grid_results_h200/N10485760_K65536_D64_B1_fp16.jsonl
{"N": 10485760, "K": 65536, "D": 64, "B": 1, "dtype": "fp16", "BLOCK_N": 32, "BLOCK_K": 32, "num_warps": 4, "num_stages": 1, "time_ms": 1079.0704345703125, "status": "ok"}
{"N": 10485760, "K": 65536, "D": 64, "B": 1, "dtype": "fp16", "BLOCK_N": 32, "BLOCK_K": 32, "num_warps": 4, "num_stages": 2, "time_ms": 949.505126953125, "status": "ok"}
{"N": 10485760, "K": 65536, "D": 64, "B": 1, "dtype": "fp16", "BLOCK_N": 32, "BLOCK_K": 32, "num_warps": 4, "num_stages": 4, "time_ms": 927.7288818359375, "status": "ok"}
{"N": 10485760, "K": 65536, "D": 64, "B": 1, "dtype": "fp16", "BLOCK_N": 32, "BLOCK_K": 32, "num_warps": 8, "num_stages": 1, "time_ms": 1730.55615234375, "status": "ok"}
{"N": 10485760, "K": 65536, "D": 64, "B": 1, "dtype": "fp16", "BLOCK_N": 32, "BLOCK_K": 32, "num_warps": 8, "num_stages": 2, "time_ms": 1624.0076904296875, "status": "ok"}
{"N": 10485760, "K": 65536, "D": 64, "B": 1, "dtype": "fp16", "BLOCK_N": 32, "BLOCK_K": 32, "num_warps": 8, "num_stages": 4, "time_ms": 1614.635009765625, "status": "ok"}
{"N": 10485760, "K": 65536, "D": 64, "B": 1, "dtype": "fp16", "BLOCK_N": 32, "BLOCK_K": 64, "num_warps": 4, "num_stages": 1, "time_ms": 911.7942504882812, "status": "ok"}
{"N": 10485760, "K": 65536, "D": 64, "B": 1, "dtype": "fp16", "BLOCK_N": 32, "BLOCK_K": 64, "num_warps": 4, "num_stages": 2, "time_ms": 792.4656982421875, "status": "ok"}
{"N": 10485760, "K": 65536, "D": 64, "B": 1, "dtype": "fp16", "BLOCK_N": 32, "BLOCK_K": 64, "num_warps": 4, "num_stages": 4, "time_ms": 769.241943359375, "status": "ok"}
{"N": 10485760, "K": 65536, "D": 64, "B": 1, "dtype": "fp16", "BLOCK_N": 32, "BLOCK_K": 64, "num_warps": 8, "num_stages": 1, "time_ms": 1181.7158203125, "status": "ok"}
{"N": 10485760, "K": 65536, "D": 64, "B": 1, "dtype": "fp16", "BLOCK_N": 32, "BLOCK_K": 64, "num_warps": 8, "num_stages": 2, "time_ms": 1006.9718627929688, "status": "ok"}
{"N": 10485760, "K": 65536, "D": 64, "B": 1, "dtype": "fp16", "BLOCK_N": 32, "BLOCK_K": 64, "num_warps": 8, "num_stages": 4, "time_ms": 987.2068481445312, "status": "ok"}
{"N": 10485760, "K": 65536, "D": 64, "B": 1, "dtype": "fp16", "BLOCK_N": 32, "BLOCK_K": 128, "num_warps": 4, "num_stages": 1, "time_ms": 708.8358154296875, "status": "ok"}
{"N": 10485760, "K": 65536, "D": 64, "B": 1, "dtype": "fp16", "BLOCK_N": 32, "BLOCK_K": 128, "num_warps": 4, "num_stages": 2, "time_ms": 603.081298828125, "status": "ok"}
{"N": 10485760, "K": 65536, "D": 64, "B": 1, "dtype": "fp16", "BLOCK_N": 32, "BLOCK_K": 128, "num_warps": 4, "num_stages": 4, "time_ms": 609.3460693359375, "status": "ok"}
{"N": 10485760, "K": 65536, "D": 64, "B": 1, "dtype": "fp16", "BLOCK_N": 32, "BLOCK_K": 128, "num_warps": 8, "num_stages": 1, "time_ms": 1171.8807373046875, "status": "ok"}
{"N": 10485760, "K": 65536, "D": 64, "B": 1, "dtype": "fp16", "BLOCK_N": 32, "BLOCK_K": 128, "num_warps": 8, "num_stages": 2, "time_ms": 957.859130859375, "status": "ok"}
{"N": 10485760, "K": 65536, "D": 64, "B": 1, "dtype": "fp16", "BLOCK_N": 32, "BLOCK_K": 128, "num_warps": 8, "num_stages": 4, "time_ms": 921.807861328125, "status": "ok"}
{"N": 10485760, "K": 65536, "D": 64, "B": 1, "dtype": "fp16", "BLOCK_N": 64, "BLOCK_K": 32, "num_warps": 4, "num_stages": 1, "time_ms": 431.8131408691406, "status": "ok"}
{"N": 10485760, "K": 65536, "D": 64, "B": 1, "dtype": "fp16", "BLOCK_N": 64, "BLOCK_K": 32, "num_warps": 4, "num_stages": 2, "time_ms": 420.87933349609375, "status": "ok"}
{"N": 10485760, "K": 65536, "D": 64, "B": 1, "dtype": "fp16", "BLOCK_N": 64, "BLOCK_K": 32, "num_warps": 4, "num_stages": 4, "time_ms": 424.1488952636719, "status": "ok"}
{"N": 10485760, "K": 65536, "D": 64, "B": 1, "dtype": "fp16", "BLOCK_N": 64, "BLOCK_K": 32, "num_warps": 8, "num_stages": 1, "time_ms": 860.0516357421875, "status": "ok"}
{"N": 10485760, "K": 65536, "D": 64, "B": 1, "dtype": "fp16", "BLOCK_N": 64, "BLOCK_K": 32, "num_warps": 8, "num_stages": 2, "time_ms": 808.7864379882812, "status": "ok"}
{"N": 10485760, "K": 65536, "D": 64, "B": 1, "dtype": "fp16", "BLOCK_N": 64, "BLOCK_K": 32, "num_warps": 8, "num_stages": 4, "time_ms": 794.7396850585938, "status": "ok"}
{"N": 10485760, "K": 65536, "D": 64, "B": 1, "dtype": "fp16", "BLOCK_N": 64, "BLOCK_K": 64, "num_warps": 4, "num_stages": 1, "time_ms": 410.15460205078125, "status": "ok"}
{"N": 10485760, "K": 65536, "D": 64, "B": 1, "dtype": "fp16", "BLOCK_N": 64, "BLOCK_K": 64, "num_warps": 4, "num_stages": 2, "time_ms": 385.5257263183594, "status": "ok"}
{"N": 10485760, "K": 65536, "D": 64, "B": 1, "dtype": "fp16", "BLOCK_N": 64, "BLOCK_K": 64, "num_warps": 4, "num_stages": 4, "time_ms": 387.8188171386719, "status": "ok"}
{"N": 10485760, "K": 65536, "D": 64, "B": 1, "dtype": "fp16", "BLOCK_N": 64, "BLOCK_K": 64, "num_warps": 8, "num_stages": 1, "time_ms": 606.6243286132812, "status": "ok"}
{"N": 10485760, "K": 65536, "D": 64, "B": 1, "dtype": "fp16", "BLOCK_N": 64, "BLOCK_K": 64, "num_warps": 8, "num_stages": 2, "time_ms": 589.44091796875, "status": "ok"}
{"N": 10485760, "K": 65536, "D": 64, "B": 1, "dtype": "fp16", "BLOCK_N": 64, "BLOCK_K": 64, "num_warps": 8, "num_stages": 4, "time_ms": 567.1436157226562, "status": "ok"}
{"N": 10485760, "K": 65536, "D": 64, "B": 1, "dtype": "fp16", "BLOCK_N": 64, "BLOCK_K": 128, "num_warps": 4, "num_stages": 1, "time_ms": 377.8802795410156, "status": "ok"}
{"N": 10485760, "K": 65536, "D": 64, "B": 1, "dtype": "fp16", "BLOCK_N": 64, "BLOCK_K": 128, "num_warps": 4, "num_stages": 2, "time_ms": 367.9125671386719, "status": "ok"}
{"N": 10485760, "K": 65536, "D": 64, "B": 1, "dtype": "fp16", "BLOCK_N": 64, "BLOCK_K": 128, "num_warps": 4, "num_stages": 4, "time_ms": 364.79730224609375, "status": "ok"}
{"N": 10485760, "K": 65536, "D": 64, "B": 1, "dtype": "fp16", "BLOCK_N": 64, "BLOCK_K": 128, "num_warps": 8, "num_stages": 1, "time_ms": 641.0245971679688, "status": "ok"}
{"N": 10485760, "K": 65536, "D": 64, "B": 1, "dtype": "fp16", "BLOCK_N": 64, "BLOCK_K": 128, "num_warps": 8, "num_stages": 2, "time_ms": 546.8905029296875, "status": "ok"}
{"N": 10485760, "K": 65536, "D": 64, "B": 1, "dtype": "fp16", "BLOCK_N": 64, "BLOCK_K": 128, "num_warps": 8, "num_stages": 4, "time_ms": 501.89068603515625, "status": "ok"}
{"N": 10485760, "K": 65536, "D": 64, "B": 1, "dtype": "fp16", "BLOCK_N": 128, "BLOCK_K": 32, "num_warps": 4, "num_stages": 1, "time_ms": 411.9143981933594, "status": "ok"}
{"N": 10485760, "K": 65536, "D": 64, "B": 1, "dtype": "fp16", "BLOCK_N": 128, "BLOCK_K": 32, "num_warps": 4, "num_stages": 2, "time_ms": 401.741455078125, "status": "ok"}
{"N": 10485760, "K": 65536, "D": 64, "B": 1, "dtype": "fp16", "BLOCK_N": 128, "BLOCK_K": 32, "num_warps": 4, "num_stages": 4, "time_ms": 408.6327209472656, "status": "ok"}
{"N": 10485760, "K": 65536, "D": 64, "B": 1, "dtype": "fp16", "BLOCK_N": 128, "BLOCK_K": 32, "num_warps": 8, "num_stages": 1, "time_ms": 432.8228759765625, "status": "ok"}
{"N": 10485760, "K": 65536, "D": 64, "B": 1, "dtype": "fp16", "BLOCK_N": 128, "BLOCK_K": 32, "num_warps": 8, "num_stages": 2, "time_ms": 452.3377990722656, "status": "ok"}
{"N": 10485760, "K": 65536, "D": 64, "B": 1, "dtype": "fp16", "BLOCK_N": 128, "BLOCK_K": 32, "num_warps": 8, "num_stages": 4, "time_ms": 439.1009826660156, "status": "ok"}
{"N": 10485760, "K": 65536, "D": 64, "B": 1, "dtype": "fp16", "BLOCK_N": 128, "BLOCK_K": 64, "num_warps": 4, "num_stages": 1, "time_ms": 397.0035705566406, "status": "ok"}
{"N": 10485760, "K": 65536, "D": 64, "B": 1, "dtype": "fp16", "BLOCK_N": 128, "BLOCK_K": 64, "num_warps": 4, "num_stages": 2, "time_ms": 361.2490234375, "status": "ok"}
{"N": 10485760, "K": 65536, "D": 64, "B": 1, "dtype": "fp16", "BLOCK_N": 128, "BLOCK_K": 64, "num_warps": 4, "num_stages": 4, "time_ms": 363.3813781738281, "status": "ok"}
{"N": 10485760, "K": 65536, "D": 64, "B": 1, "dtype": "fp16", "BLOCK_N": 128, "BLOCK_K": 64, "num_warps": 8, "num_stages": 1, "time_ms": 406.272216796875, "status": "ok"}
{"N": 10485760, "K": 65536, "D": 64, "B": 1, "dtype": "fp16", "BLOCK_N": 128, "BLOCK_K": 64, "num_warps": 8, "num_stages": 2, "time_ms": 394.2861328125, "status": "ok"}
{"N": 10485760, "K": 65536, "D": 64, "B": 1, "dtype": "fp16", "BLOCK_N": 128, "BLOCK_K": 64, "num_warps": 8, "num_stages": 4, "time_ms": 385.039306640625, "status": "ok"}
{"N": 10485760, "K": 65536, "D": 64, "B": 1, "dtype": "fp16", "BLOCK_N": 128, "BLOCK_K": 128, "num_warps": 4, "num_stages": 1, "time_ms": 423.93377685546875, "status": "ok"}
{"N": 10485760, "K": 65536, "D": 64, "B": 1, "dtype": "fp16", "BLOCK_N": 128, "BLOCK_K": 128, "num_warps": 4, "num_stages": 2, "time_ms": 389.9190368652344, "status": "ok"}
{"N": 10485760, "K": 65536, "D": 64, "B": 1, "dtype": "fp16", "BLOCK_N": 128, "BLOCK_K": 128, "num_warps": 4, "num_stages": 4, "time_ms": 349.69122314453125, "status": "ok"}
{"N": 10485760, "K": 65536, "D": 64, "B": 1, "dtype": "fp16", "BLOCK_N": 128, "BLOCK_K": 128, "num_warps": 8, "num_stages": 1, "time_ms": 566.5341186523438, "status": "ok"}
{"N": 10485760, "K": 65536, "D": 64, "B": 1, "dtype": "fp16", "BLOCK_N": 128, "BLOCK_K": 128, "num_warps": 8, "num_stages": 2, "time_ms": 374.8528747558594, "status": "ok"}
{"N": 10485760, "K": 65536, "D": 64, "B": 1, "dtype": "fp16", "BLOCK_N": 128, "BLOCK_K": 128, "num_warps": 8, "num_stages": 4, "time_ms": 365.7474365234375, "status": "ok"}
{"summary": true, "N": 10485760, "K": 65536, "D": 64, "B": 1, "dtype": "fp16", "best": {"N": 10485760, "K": 65536, "D": 64, "B": 1, "dtype": "fp16", "BLOCK_N": 128, "BLOCK_K": 128, "num_warps": 4, "num_stages": 4, "time_ms": 349.69122314453125, "status": "ok"}, "best_time_ms": 349.69122314453125, "tuning_seconds": 292.4459216594696, "skipped": 0}
