grid_results_h200/N10485760_K256_D128_B1_fp16.jsonl
{"N": 10485760, "K": 256, "D": 128, "B": 1, "dtype": "fp16", "BLOCK_N": 32, "BLOCK_K": 32, "num_warps": 4, "num_stages": 1, "time_ms": 6.538335800170898, "status": "ok"}
{"N": 10485760, "K": 256, "D": 128, "B": 1, "dtype": "fp16", "BLOCK_N": 32, "BLOCK_K": 32, "num_warps": 4, "num_stages": 2, "time_ms": 5.612415790557861, "status": "ok"}
{"N": 10485760, "K": 256, "D": 128, "B": 1, "dtype": "fp16", "BLOCK_N": 32, "BLOCK_K": 32, "num_warps": 4, "num_stages": 4, "time_ms": 5.866464138031006, "status": "ok"}
{"N": 10485760, "K": 256, "D": 128, "B": 1, "dtype": "fp16", "BLOCK_N": 32, "BLOCK_K": 32, "num_warps": 8, "num_stages": 1, "time_ms": 9.692480087280273, "status": "ok"}
{"N": 10485760, "K": 256, "D": 128, "B": 1, "dtype": "fp16", "BLOCK_N": 32, "BLOCK_K": 32, "num_warps": 8, "num_stages": 2, "time_ms": 9.09001636505127, "status": "ok"}
{"N": 10485760, "K": 256, "D": 128, "B": 1, "dtype": "fp16", "BLOCK_N": 32, "BLOCK_K": 32, "num_warps": 8, "num_stages": 4, "time_ms": 9.287391662597656, "status": "ok"}
{"N": 10485760, "K": 256, "D": 128, "B": 1, "dtype": "fp16", "BLOCK_N": 32, "BLOCK_K": 64, "num_warps": 4, "num_stages": 1, "time_ms": 5.653728008270264, "status": "ok"}
{"N": 10485760, "K": 256, "D": 128, "B": 1, "dtype": "fp16", "BLOCK_N": 32, "BLOCK_K": 64, "num_warps": 4, "num_stages": 2, "time_ms": 4.738431930541992, "status": "ok"}
{"N": 10485760, "K": 256, "D": 128, "B": 1, "dtype": "fp16", "BLOCK_N": 32, "BLOCK_K": 64, "num_warps": 4, "num_stages": 4, "time_ms": 5.772607803344727, "status": "ok"}
{"N": 10485760, "K": 256, "D": 128, "B": 1, "dtype": "fp16", "BLOCK_N": 32, "BLOCK_K": 64, "num_warps": 8, "num_stages": 1, "time_ms": 6.904032230377197, "status": "ok"}
{"N": 10485760, "K": 256, "D": 128, "B": 1, "dtype": "fp16", "BLOCK_N": 32, "BLOCK_K": 64, "num_warps": 8, "num_stages": 2, "time_ms": 6.5675201416015625, "status": "ok"}
{"N": 10485760, "K": 256, "D": 128, "B": 1, "dtype": "fp16", "BLOCK_N": 32, "BLOCK_K": 64, "num_warps": 8, "num_stages": 4, "time_ms": 6.676959991455078, "status": "ok"}
{"N": 10485760, "K": 256, "D": 128, "B": 1, "dtype": "fp16", "BLOCK_N": 32, "BLOCK_K": 128, "num_warps": 4, "num_stages": 1, "time_ms": 4.649663925170898, "status": "ok"}
{"N": 10485760, "K": 256, "D": 128, "B": 1, "dtype": "fp16", "BLOCK_N": 32, "BLOCK_K": 128, "num_warps": 4, "num_stages": 2, "time_ms": 4.132224082946777, "status": "ok"}
{"N": 10485760, "K": 256, "D": 128, "B": 1, "dtype": "fp16", "BLOCK_N": 32, "BLOCK_K": 128, "num_warps": 4, "num_stages": 4, "time_ms": 6.308800220489502, "status": "ok"}
{"N": 10485760, "K": 256, "D": 128, "B": 1, "dtype": "fp16", "BLOCK_N": 32, "BLOCK_K": 128, "num_warps": 8, "num_stages": 1, "time_ms": 6.2887678146362305, "status": "ok"}
{"N": 10485760, "K": 256, "D": 128, "B": 1, "dtype": "fp16", "BLOCK_N": 32, "BLOCK_K": 128, "num_warps": 8, "num_stages": 2, "time_ms": 5.888800144195557, "status": "ok"}
{"N": 10485760, "K": 256, "D": 128, "B": 1, "dtype": "fp16", "BLOCK_N": 32, "BLOCK_K": 128, "num_warps": 8, "num_stages": 4, "time_ms": 7.134399890899658, "status": "ok"}
{"N": 10485760, "K": 256, "D": 128, "B": 1, "dtype": "fp16", "BLOCK_N": 64, "BLOCK_K": 32, "num_warps": 4, "num_stages": 1, "time_ms": 2.771967887878418, "status": "ok"}
{"N": 10485760, "K": 256, "D": 128, "B": 1, "dtype": "fp16", "BLOCK_N": 64, "BLOCK_K": 32, "num_warps": 4, "num_stages": 2, "time_ms": 2.409071922302246, "status": "ok"}
{"N": 10485760, "K": 256, "D": 128, "B": 1, "dtype": "fp16", "BLOCK_N": 64, "BLOCK_K": 32, "num_warps": 4, "num_stages": 4, "time_ms": 2.6059839725494385, "status": "ok"}
{"N": 10485760, "K": 256, "D": 128, "B": 1, "dtype": "fp16", "BLOCK_N": 64, "BLOCK_K": 32, "num_warps": 8, "num_stages": 1, "time_ms": 4.778656005859375, "status": "ok"}
{"N": 10485760, "K": 256, "D": 128, "B": 1, "dtype": "fp16", "BLOCK_N": 64, "BLOCK_K": 32, "num_warps": 8, "num_stages": 2, "time_ms": 4.368959903717041, "status": "ok"}
{"N": 10485760, "K": 256, "D": 128, "B": 1, "dtype": "fp16", "BLOCK_N": 64, "BLOCK_K": 32, "num_warps": 8, "num_stages": 4, "time_ms": 4.569151878356934, "status": "ok"}
{"N": 10485760, "K": 256, "D": 128, "B": 1, "dtype": "fp16", "BLOCK_N": 64, "BLOCK_K": 64, "num_warps": 4, "num_stages": 1, "time_ms": 2.3840479850769043, "status": "ok"}
{"N": 10485760, "K": 256, "D": 128, "B": 1, "dtype": "fp16", "BLOCK_N": 64, "BLOCK_K": 64, "num_warps": 4, "num_stages": 2, "time_ms": 2.1950559616088867, "status": "ok"}
{"N": 10485760, "K": 256, "D": 128, "B": 1, "dtype": "fp16", "BLOCK_N": 64, "BLOCK_K": 64, "num_warps": 4, "num_stages": 4, "time_ms": 2.8797121047973633, "status": "ok"}
{"N": 10485760, "K": 256, "D": 128, "B": 1, "dtype": "fp16", "BLOCK_N": 64, "BLOCK_K": 64, "num_warps": 8, "num_stages": 1, "time_ms": 3.386176109313965, "status": "ok"}
{"N": 10485760, "K": 256, "D": 128, "B": 1, "dtype": "fp16", "BLOCK_N": 64, "BLOCK_K": 64, "num_warps": 8, "num_stages": 2, "time_ms": 3.2686400413513184, "status": "ok"}
{"N": 10485760, "K": 256, "D": 128, "B": 1, "dtype": "fp16", "BLOCK_N": 64, "BLOCK_K": 64, "num_warps": 8, "num_stages": 4, "time_ms": 3.9882559776306152, "status": "ok"}
{"N": 10485760, "K": 256, "D": 128, "B": 1, "dtype": "fp16", "BLOCK_N": 64, "BLOCK_K": 128, "num_warps": 4, "num_stages": 1, "time_ms": 2.390639901161194, "status": "ok"}
{"N": 10485760, "K": 256, "D": 128, "B": 1, "dtype": "fp16", "BLOCK_N": 64, "BLOCK_K": 128, "num_warps": 4, "num_stages": 2, "time_ms": 2.884000062942505, "status": "ok"}
{"N": 10485760, "K": 256, "D": 128, "B": 1, "dtype": "fp16", "BLOCK_N": 64, "BLOCK_K": 128, "num_warps": 4, "num_stages": 4, "time_ms": 4.4088640213012695, "status": "ok"}
{"N": 10485760, "K": 256, "D": 128, "B": 1, "dtype": "fp16", "BLOCK_N": 64, "BLOCK_K": 128, "num_warps": 8, "num_stages": 1, "time_ms": 3.2820160388946533, "status": "ok"}
{"N": 10485760, "K": 256, "D": 128, "B": 1, "dtype": "fp16", "BLOCK_N": 64, "BLOCK_K": 128, "num_warps": 8, "num_stages": 2, "time_ms": 3.276992082595825, "status": "ok"}
{"N": 10485760, "K": 256, "D": 128, "B": 1, "dtype": "fp16", "BLOCK_N": 64, "BLOCK_K": 128, "num_warps": 8, "num_stages": 4, "time_ms": 4.9352641105651855, "status": "ok"}
{"N": 10485760, "K": 256, "D": 128, "B": 1, "dtype": "fp16", "BLOCK_N": 128, "BLOCK_K": 32, "num_warps": 4, "num_stages": 1, "time_ms": 2.407263994216919, "status": "ok"}
{"N": 10485760, "K": 256, "D": 128, "B": 1, "dtype": "fp16", "BLOCK_N": 128, "BLOCK_K": 32, "num_warps": 4, "num_stages": 2, "time_ms": 2.432495951652527, "status": "ok"}
{"N": 10485760, "K": 256, "D": 128, "B": 1, "dtype": "fp16", "BLOCK_N": 128, "BLOCK_K": 32, "num_warps": 4, "num_stages": 4, "time_ms": 2.5453760623931885, "status": "ok"}
{"N": 10485760, "K": 256, "D": 128, "B": 1, "dtype": "fp16", "BLOCK_N": 128, "BLOCK_K": 32, "num_warps": 8, "num_stages": 1, "time_ms": 2.4378559589385986, "status": "ok"}
{"N": 10485760, "K": 256, "D": 128, "B": 1, "dtype": "fp16", "BLOCK_N": 128, "BLOCK_K": 32, "num_warps": 8, "num_stages": 2, "time_ms": 2.4088319540023804, "status": "ok"}
{"N": 10485760, "K": 256, "D": 128, "B": 1, "dtype": "fp16", "BLOCK_N": 128, "BLOCK_K": 32, "num_warps": 8, "num_stages": 4, "time_ms": 2.5155200958251953, "status": "ok"}
{"N": 10485760, "K": 256, "D": 128, "B": 1, "dtype": "fp16", "BLOCK_N": 128, "BLOCK_K": 64, "num_warps": 4, "num_stages": 1, "time_ms": 2.0998880863189697, "status": "ok"}
{"N": 10485760, "K": 256, "D": 128, "B": 1, "dtype": "fp16", "BLOCK_N": 128, "BLOCK_K": 64, "num_warps": 4, "num_stages": 2, "time_ms": 2.1996320486068726, "status": "ok"}
{"N": 10485760, "K": 256, "D": 128, "B": 1, "dtype": "fp16", "BLOCK_N": 128, "BLOCK_K": 64, "num_warps": 4, "num_stages": 4, "time_ms": 2.4465279579162598, "status": "ok"}
{"N": 10485760, "K": 256, "D": 128, "B": 1, "dtype": "fp16", "BLOCK_N": 128, "BLOCK_K": 64, "num_warps": 8, "num_stages": 1, "time_ms": 2.2367841005325317, "status": "ok"}
{"N": 10485760, "K": 256, "D": 128, "B": 1, "dtype": "fp16", "BLOCK_N": 128, "BLOCK_K": 64, "num_warps": 8, "num_stages": 2, "time_ms": 2.229856014251709, "status": "ok"}
{"N": 10485760, "K": 256, "D": 128, "B": 1, "dtype": "fp16", "BLOCK_N": 128, "BLOCK_K": 64, "num_warps": 8, "num_stages": 4, "time_ms": 2.3193279504776, "status": "ok"}
{"N": 10485760, "K": 256, "D": 128, "B": 1, "dtype": "fp16", "BLOCK_N": 128, "BLOCK_K": 128, "num_warps": 4, "num_stages": 1, "time_ms": 2.5129919052124023, "status": "ok"}
{"N": 10485760, "K": 256, "D": 128, "B": 1, "dtype": "fp16", "BLOCK_N": 128, "BLOCK_K": 128, "num_warps": 4, "num_stages": 2, "time_ms": 2.2290879487991333, "status": "ok"}
{"N": 10485760, "K": 256, "D": 128, "B": 1, "dtype": "fp16", "BLOCK_N": 128, "BLOCK_K": 128, "num_warps": 4, "num_stages": 4, "time_ms": 3.3762240409851074, "status": "ok"}
{"N": 10485760, "K": 256, "D": 128, "B": 1, "dtype": "fp16", "BLOCK_N": 128, "BLOCK_K": 128, "num_warps": 8, "num_stages": 1, "time_ms": 3.5512640476226807, "status": "ok"}
{"N": 10485760, "K": 256, "D": 128, "B": 1, "dtype": "fp16", "BLOCK_N": 128, "BLOCK_K": 128, "num_warps": 8, "num_stages": 2, "time_ms": 3.2128639221191406, "status": "ok"}
{"N": 10485760, "K": 256, "D": 128, "B": 1, "dtype": "fp16", "BLOCK_N": 128, "BLOCK_K": 128, "num_warps": 8, "num_stages": 4, "time_ms": 3.25433611869812, "status": "ok"}
{"summary": true, "N": 10485760, "K": 256, "D": 128, "B": 1, "dtype": "fp16", "best": {"N": 10485760, "K": 256, "D": 128, "B": 1, "dtype": "fp16", "BLOCK_N": 128, "BLOCK_K": 64, "num_warps": 4, "num_stages": 1, "time_ms": 2.0998880863189697, "status": "ok"}, "best_time_ms": 2.0998880863189697, "tuning_seconds": 12.82495403289795, "skipped": 0}
