grid_results_h200/N1048576_K256_D64_B32_fp16.jsonl
{"N": 1048576, "K": 256, "D": 64, "B": 32, "dtype": "fp16", "BLOCK_N": 32, "BLOCK_K": 32, "num_warps": 4, "num_stages": 1, "time_ms": 13.55900764465332, "status": "ok"}
{"N": 1048576, "K": 256, "D": 64, "B": 32, "dtype": "fp16", "BLOCK_N": 32, "BLOCK_K": 32, "num_warps": 4, "num_stages": 2, "time_ms": 12.591615676879883, "status": "ok"}
{"N": 1048576, "K": 256, "D": 64, "B": 32, "dtype": "fp16", "BLOCK_N": 32, "BLOCK_K": 32, "num_warps": 4, "num_stages": 4, "time_ms": 12.927519798278809, "status": "ok"}
{"N": 1048576, "K": 256, "D": 64, "B": 32, "dtype": "fp16", "BLOCK_N": 32, "BLOCK_K": 32, "num_warps": 8, "num_stages": 1, "time_ms": 21.947359085083008, "status": "ok"}
{"N": 1048576, "K": 256, "D": 64, "B": 32, "dtype": "fp16", "BLOCK_N": 32, "BLOCK_K": 32, "num_warps": 8, "num_stages": 2, "time_ms": 21.315263748168945, "status": "ok"}
{"N": 1048576, "K": 256, "D": 64, "B": 32, "dtype": "fp16", "BLOCK_N": 32, "BLOCK_K": 32, "num_warps": 8, "num_stages": 4, "time_ms": 21.726112365722656, "status": "ok"}
{"N": 1048576, "K": 256, "D": 64, "B": 32, "dtype": "fp16", "BLOCK_N": 32, "BLOCK_K": 64, "num_warps": 4, "num_stages": 1, "time_ms": 11.6495361328125, "status": "ok"}
{"N": 1048576, "K": 256, "D": 64, "B": 32, "dtype": "fp16", "BLOCK_N": 32, "BLOCK_K": 64, "num_warps": 4, "num_stages": 2, "time_ms": 11.035039901733398, "status": "ok"}
{"N": 1048576, "K": 256, "D": 64, "B": 32, "dtype": "fp16", "BLOCK_N": 32, "BLOCK_K": 64, "num_warps": 4, "num_stages": 4, "time_ms": 11.618656158447266, "status": "ok"}
{"N": 1048576, "K": 256, "D": 64, "B": 32, "dtype": "fp16", "BLOCK_N": 32, "BLOCK_K": 64, "num_warps": 8, "num_stages": 1, "time_ms": 15.253791809082031, "status": "ok"}
{"N": 1048576, "K": 256, "D": 64, "B": 32, "dtype": "fp16", "BLOCK_N": 32, "BLOCK_K": 64, "num_warps": 8, "num_stages": 2, "time_ms": 14.249728202819824, "status": "ok"}
{"N": 1048576, "K": 256, "D": 64, "B": 32, "dtype": "fp16", "BLOCK_N": 32, "BLOCK_K": 64, "num_warps": 8, "num_stages": 4, "time_ms": 15.154496192932129, "status": "ok"}
{"N": 1048576, "K": 256, "D": 64, "B": 32, "dtype": "fp16", "BLOCK_N": 32, "BLOCK_K": 128, "num_warps": 4, "num_stages": 1, "time_ms": 9.598336219787598, "status": "ok"}
{"N": 1048576, "K": 256, "D": 64, "B": 32, "dtype": "fp16", "BLOCK_N": 32, "BLOCK_K": 128, "num_warps": 4, "num_stages": 2, "time_ms": 9.709695816040039, "status": "ok"}
{"N": 1048576, "K": 256, "D": 64, "B": 32, "dtype": "fp16", "BLOCK_N": 32, "BLOCK_K": 128, "num_warps": 4, "num_stages": 4, "time_ms": 10.670559883117676, "status": "ok"}
{"N": 1048576, "K": 256, "D": 64, "B": 32, "dtype": "fp16", "BLOCK_N": 32, "BLOCK_K": 128, "num_warps": 8, "num_stages": 1, "time_ms": 14.365599632263184, "status": "ok"}
{"N": 1048576, "K": 256, "D": 64, "B": 32, "dtype": "fp16", "BLOCK_N": 32, "BLOCK_K": 128, "num_warps": 8, "num_stages": 2, "time_ms": 14.149184226989746, "status": "ok"}
{"N": 1048576, "K": 256, "D": 64, "B": 32, "dtype": "fp16", "BLOCK_N": 32, "BLOCK_K": 128, "num_warps": 8, "num_stages": 4, "time_ms": 15.31827163696289, "status": "ok"}
{"N": 1048576, "K": 256, "D": 64, "B": 32, "dtype": "fp16", "BLOCK_N": 64, "BLOCK_K": 32, "num_warps": 4, "num_stages": 1, "time_ms": 5.712031841278076, "status": "ok"}
{"N": 1048576, "K": 256, "D": 64, "B": 32, "dtype": "fp16", "BLOCK_N": 64, "BLOCK_K": 32, "num_warps": 4, "num_stages": 2, "time_ms": 5.668704032897949, "status": "ok"}
{"N": 1048576, "K": 256, "D": 64, "B": 32, "dtype": "fp16", "BLOCK_N": 64, "BLOCK_K": 32, "num_warps": 4, "num_stages": 4, "time_ms": 5.777503967285156, "status": "ok"}
{"N": 1048576, "K": 256, "D": 64, "B": 32, "dtype": "fp16", "BLOCK_N": 64, "BLOCK_K": 32, "num_warps": 8, "num_stages": 1, "time_ms": 10.950207710266113, "status": "ok"}
{"N": 1048576, "K": 256, "D": 64, "B": 32, "dtype": "fp16", "BLOCK_N": 64, "BLOCK_K": 32, "num_warps": 8, "num_stages": 2, "time_ms": 10.637408256530762, "status": "ok"}
{"N": 1048576, "K": 256, "D": 64, "B": 32, "dtype": "fp16", "BLOCK_N": 64, "BLOCK_K": 32, "num_warps": 8, "num_stages": 4, "time_ms": 10.875040054321289, "status": "ok"}
{"N": 1048576, "K": 256, "D": 64, "B": 32, "dtype": "fp16", "BLOCK_N": 64, "BLOCK_K": 64, "num_warps": 4, "num_stages": 1, "time_ms": 5.619711875915527, "status": "ok"}
{"N": 1048576, "K": 256, "D": 64, "B": 32, "dtype": "fp16", "BLOCK_N": 64, "BLOCK_K": 64, "num_warps": 4, "num_stages": 2, "time_ms": 5.320799827575684, "status": "ok"}
{"N": 1048576, "K": 256, "D": 64, "B": 32, "dtype": "fp16", "BLOCK_N": 64, "BLOCK_K": 64, "num_warps": 4, "num_stages": 4, "time_ms": 5.513696193695068, "status": "ok"}
{"N": 1048576, "K": 256, "D": 64, "B": 32, "dtype": "fp16", "BLOCK_N": 64, "BLOCK_K": 64, "num_warps": 8, "num_stages": 1, "time_ms": 8.237152099609375, "status": "ok"}
{"N": 1048576, "K": 256, "D": 64, "B": 32, "dtype": "fp16", "BLOCK_N": 64, "BLOCK_K": 64, "num_warps": 8, "num_stages": 2, "time_ms": 8.249247550964355, "status": "ok"}
{"N": 1048576, "K": 256, "D": 64, "B": 32, "dtype": "fp16", "BLOCK_N": 64, "BLOCK_K": 64, "num_warps": 8, "num_stages": 4, "time_ms": 8.33676815032959, "status": "ok"}
{"N": 1048576, "K": 256, "D": 64, "B": 32, "dtype": "fp16", "BLOCK_N": 64, "BLOCK_K": 128, "num_warps": 4, "num_stages": 1, "time_ms": 6.2566399574279785, "status": "ok"}
{"N": 1048576, "K": 256, "D": 64, "B": 32, "dtype": "fp16", "BLOCK_N": 64, "BLOCK_K": 128, "num_warps": 4, "num_stages": 2, "time_ms": 5.646944046020508, "status": "ok"}
{"N": 1048576, "K": 256, "D": 64, "B": 32, "dtype": "fp16", "BLOCK_N": 64, "BLOCK_K": 128, "num_warps": 4, "num_stages": 4, "time_ms": 6.510591983795166, "status": "ok"}
{"N": 1048576, "K": 256, "D": 64, "B": 32, "dtype": "fp16", "BLOCK_N": 64, "BLOCK_K": 128, "num_warps": 8, "num_stages": 1, "time_ms": 8.35484790802002, "status": "ok"}
{"N": 1048576, "K": 256, "D": 64, "B": 32, "dtype": "fp16", "BLOCK_N": 64, "BLOCK_K": 128, "num_warps": 8, "num_stages": 2, "time_ms": 8.814784049987793, "status": "ok"}
{"N": 1048576, "K": 256, "D": 64, "B": 32, "dtype": "fp16", "BLOCK_N": 64, "BLOCK_K": 128, "num_warps": 8, "num_stages": 4, "time_ms": 9.296031951904297, "status": "ok"}
{"N": 1048576, "K": 256, "D": 64, "B": 32, "dtype": "fp16", "BLOCK_N": 128, "BLOCK_K": 32, "num_warps": 4, "num_stages": 1, "time_ms": 5.560287952423096, "status": "ok"}
{"N": 1048576, "K": 256, "D": 64, "B": 32, "dtype": "fp16", "BLOCK_N": 128, "BLOCK_K": 32, "num_warps": 4, "num_stages": 2, "time_ms": 5.4339518547058105, "status": "ok"}
{"N": 1048576, "K": 256, "D": 64, "B": 32, "dtype": "fp16", "BLOCK_N": 128, "BLOCK_K": 32, "num_warps": 4, "num_stages": 4, "time_ms": 5.486976146697998, "status": "ok"}
{"N": 1048576, "K": 256, "D": 64, "B": 32, "dtype": "fp16", "BLOCK_N": 128, "BLOCK_K": 32, "num_warps": 8, "num_stages": 1, "time_ms": 5.852863788604736, "status": "ok"}
{"N": 1048576, "K": 256, "D": 64, "B": 32, "dtype": "fp16", "BLOCK_N": 128, "BLOCK_K": 32, "num_warps": 8, "num_stages": 2, "time_ms": 6.182015895843506, "status": "ok"}
{"N": 1048576, "K": 256, "D": 64, "B": 32, "dtype": "fp16", "BLOCK_N": 128, "BLOCK_K": 32, "num_warps": 8, "num_stages": 4, "time_ms": 6.006080150604248, "status": "ok"}
{"N": 1048576, "K": 256, "D": 64, "B": 32, "dtype": "fp16", "BLOCK_N": 128, "BLOCK_K": 64, "num_warps": 4, "num_stages": 1, "time_ms": 5.35481595993042, "status": "ok"}
{"N": 1048576, "K": 256, "D": 64, "B": 32, "dtype": "fp16", "BLOCK_N": 128, "BLOCK_K": 64, "num_warps": 4, "num_stages": 2, "time_ms": 4.931615829467773, "status": "ok"}
{"N": 1048576, "K": 256, "D": 64, "B": 32, "dtype": "fp16", "BLOCK_N": 128, "BLOCK_K": 64, "num_warps": 4, "num_stages": 4, "time_ms": 5.2008957862854, "status": "ok"}
{"N": 1048576, "K": 256, "D": 64, "B": 32, "dtype": "fp16", "BLOCK_N": 128, "BLOCK_K": 64, "num_warps": 8, "num_stages": 1, "time_ms": 5.842624187469482, "status": "ok"}
{"N": 1048576, "K": 256, "D": 64, "B": 32, "dtype": "fp16", "BLOCK_N": 128, "BLOCK_K": 64, "num_warps": 8, "num_stages": 2, "time_ms": 5.6708478927612305, "status": "ok"}
{"N": 1048576, "K": 256, "D": 64, "B": 32, "dtype": "fp16", "BLOCK_N": 128, "BLOCK_K": 64, "num_warps": 8, "num_stages": 4, "time_ms": 5.726560115814209, "status": "ok"}
{"N": 1048576, "K": 256, "D": 64, "B": 32, "dtype": "fp16", "BLOCK_N": 128, "BLOCK_K": 128, "num_warps": 4, "num_stages": 1, "time_ms": 5.843103885650635, "status": "ok"}
{"N": 1048576, "K": 256, "D": 64, "B": 32, "dtype": "fp16", "BLOCK_N": 128, "BLOCK_K": 128, "num_warps": 4, "num_stages": 2, "time_ms": 5.828800201416016, "status": "ok"}
{"N": 1048576, "K": 256, "D": 64, "B": 32, "dtype": "fp16", "BLOCK_N": 128, "BLOCK_K": 128, "num_warps": 4, "num_stages": 4, "time_ms": 5.899551868438721, "status": "ok"}
{"N": 1048576, "K": 256, "D": 64, "B": 32, "dtype": "fp16", "BLOCK_N": 128, "BLOCK_K": 128, "num_warps": 8, "num_stages": 1, "time_ms": 8.18883228302002, "status": "ok"}
{"N": 1048576, "K": 256, "D": 64, "B": 32, "dtype": "fp16", "BLOCK_N": 128, "BLOCK_K": 128, "num_warps": 8, "num_stages": 2, "time_ms": 7.840288162231445, "status": "ok"}
{"N": 1048576, "K": 256, "D": 64, "B": 32, "dtype": "fp16", "BLOCK_N": 128, "BLOCK_K": 128, "num_warps": 8, "num_stages": 4, "time_ms": 7.7414398193359375, "status": "ok"}
{"summary": true, "N": 1048576, "K": 256, "D": 64, "B": 32, "dtype": "fp16", "best": {"N": 1048576, "K": 256, "D": 64, "B": 32, "dtype": "fp16", "BLOCK_N": 128, "BLOCK_K": 64, "num_warps": 4, "num_stages": 2, "time_ms": 4.931615829467773, "status": "ok"}, "best_time_ms": 4.931615829467773, "tuning_seconds": 13.083310604095459, "skipped": 0}
