grid_results_h200/N10485760_K65536_D128_B1_fp16.jsonl
{"N": 10485760, "K": 65536, "D": 128, "B": 1, "dtype": "fp16", "BLOCK_N": 32, "BLOCK_K": 32, "num_warps": 4, "num_stages": 1, "time_ms": 1642.171630859375, "status": "ok"}
{"N": 10485760, "K": 65536, "D": 128, "B": 1, "dtype": "fp16", "BLOCK_N": 32, "BLOCK_K": 32, "num_warps": 4, "num_stages": 2, "time_ms": 1328.5106201171875, "status": "ok"}
{"N": 10485760, "K": 65536, "D": 128, "B": 1, "dtype": "fp16", "BLOCK_N": 32, "BLOCK_K": 32, "num_warps": 4, "num_stages": 4, "time_ms": 1318.7650146484375, "status": "ok"}
{"N": 10485760, "K": 65536, "D": 128, "B": 1, "dtype": "fp16", "BLOCK_N": 32, "BLOCK_K": 32, "num_warps": 8, "num_stages": 1, "time_ms": 2411.596923828125, "status": "ok"}
{"N": 10485760, "K": 65536, "D": 128, "B": 1, "dtype": "fp16", "BLOCK_N": 32, "BLOCK_K": 32, "num_warps": 8, "num_stages": 2, "time_ms": 2188.55322265625, "status": "ok"}
{"N": 10485760, "K": 65536, "D": 128, "B": 1, "dtype": "fp16", "BLOCK_N": 32, "BLOCK_K": 32, "num_warps": 8, "num_stages": 4, "time_ms": 2151.85791015625, "status": "ok"}
{"N": 10485760, "K": 65536, "D": 128, "B": 1, "dtype": "fp16", "BLOCK_N": 32, "BLOCK_K": 64, "num_warps": 4, "num_stages": 1, "time_ms": 1390.75146484375, "status": "ok"}
{"N": 10485760, "K": 65536, "D": 128, "B": 1, "dtype": "fp16", "BLOCK_N": 32, "BLOCK_K": 64, "num_warps": 4, "num_stages": 2, "time_ms": 1090.7789306640625, "status": "ok"}
{"N": 10485760, "K": 65536, "D": 128, "B": 1, "dtype": "fp16", "BLOCK_N": 32, "BLOCK_K": 64, "num_warps": 4, "num_stages": 4, "time_ms": 1187.295654296875, "status": "ok"}
{"N": 10485760, "K": 65536, "D": 128, "B": 1, "dtype": "fp16", "BLOCK_N": 32, "BLOCK_K": 64, "num_warps": 8, "num_stages": 1, "time_ms": 1658.5238037109375, "status": "ok"}
{"N": 10485760, "K": 65536, "D": 128, "B": 1, "dtype": "fp16", "BLOCK_N": 32, "BLOCK_K": 64, "num_warps": 8, "num_stages": 2, "time_ms": 1418.5130615234375, "status": "ok"}
{"N": 10485760, "K": 65536, "D": 128, "B": 1, "dtype": "fp16", "BLOCK_N": 32, "BLOCK_K": 64, "num_warps": 8, "num_stages": 4, "time_ms": 1406.1319580078125, "status": "ok"}
{"N": 10485760, "K": 65536, "D": 128, "B": 1, "dtype": "fp16", "BLOCK_N": 32, "BLOCK_K": 128, "num_warps": 4, "num_stages": 1, "time_ms": 1102.9478759765625, "status": "ok"}
{"N": 10485760, "K": 65536, "D": 128, "B": 1, "dtype": "fp16", "BLOCK_N": 32, "BLOCK_K": 128, "num_warps": 4, "num_stages": 2, "time_ms": 890.1025390625, "status": "ok"}
{"N": 10485760, "K": 65536, "D": 128, "B": 1, "dtype": "fp16", "BLOCK_N": 32, "BLOCK_K": 128, "num_warps": 4, "num_stages": 4, "time_ms": 1187.8536376953125, "status": "ok"}
{"N": 10485760, "K": 65536, "D": 128, "B": 1, "dtype": "fp16", "BLOCK_N": 32, "BLOCK_K": 128, "num_warps": 8, "num_stages": 1, "time_ms": 1517.50341796875, "status": "ok"}
{"N": 10485760, "K": 65536, "D": 128, "B": 1, "dtype": "fp16", "BLOCK_N": 32, "BLOCK_K": 128, "num_warps": 8, "num_stages": 2, "time_ms": 1297.816650390625, "status": "ok"}
{"N": 10485760, "K": 65536, "D": 128, "B": 1, "dtype": "fp16", "BLOCK_N": 32, "BLOCK_K": 128, "num_warps": 8, "num_stages": 4, "time_ms": 1329.50439453125, "status": "ok"}
{"N": 10485760, "K": 65536, "D": 128, "B": 1, "dtype": "fp16", "BLOCK_N": 64, "BLOCK_K": 32, "num_warps": 4, "num_stages": 1, "time_ms": 674.2047729492188, "status": "ok"}
{"N": 10485760, "K": 65536, "D": 128, "B": 1, "dtype": "fp16", "BLOCK_N": 64, "BLOCK_K": 32, "num_warps": 4, "num_stages": 2, "time_ms": 577.8674926757812, "status": "ok"}
{"N": 10485760, "K": 65536, "D": 128, "B": 1, "dtype": "fp16", "BLOCK_N": 64, "BLOCK_K": 32, "num_warps": 4, "num_stages": 4, "time_ms": 595.5725708007812, "status": "ok"}
{"N": 10485760, "K": 65536, "D": 128, "B": 1, "dtype": "fp16", "BLOCK_N": 64, "BLOCK_K": 32, "num_warps": 8, "num_stages": 1, "time_ms": 1181.2760009765625, "status": "ok"}
{"N": 10485760, "K": 65536, "D": 128, "B": 1, "dtype": "fp16", "BLOCK_N": 64, "BLOCK_K": 32, "num_warps": 8, "num_stages": 2, "time_ms": 1017.2697143554688, "status": "ok"}
{"N": 10485760, "K": 65536, "D": 128, "B": 1, "dtype": "fp16", "BLOCK_N": 64, "BLOCK_K": 32, "num_warps": 8, "num_stages": 4, "time_ms": 1029.0079345703125, "status": "ok"}
{"N": 10485760, "K": 65536, "D": 128, "B": 1, "dtype": "fp16", "BLOCK_N": 64, "BLOCK_K": 64, "num_warps": 4, "num_stages": 1, "time_ms": 575.1574096679688, "status": "ok"}
{"N": 10485760, "K": 65536, "D": 128, "B": 1, "dtype": "fp16", "BLOCK_N": 64, "BLOCK_K": 64, "num_warps": 4, "num_stages": 2, "time_ms": 523.615234375, "status": "ok"}
{"N": 10485760, "K": 65536, "D": 128, "B": 1, "dtype": "fp16", "BLOCK_N": 64, "BLOCK_K": 64, "num_warps": 4, "num_stages": 4, "time_ms": 537.7200317382812, "status": "ok"}
{"N": 10485760, "K": 65536, "D": 128, "B": 1, "dtype": "fp16", "BLOCK_N": 64, "BLOCK_K": 64, "num_warps": 8, "num_stages": 1, "time_ms": 836.741943359375, "status": "ok"}
{"N": 10485760, "K": 65536, "D": 128, "B": 1, "dtype": "fp16", "BLOCK_N": 64, "BLOCK_K": 64, "num_warps": 8, "num_stages": 2, "time_ms": 721.4321899414062, "status": "ok"}
{"N": 10485760, "K": 65536, "D": 128, "B": 1, "dtype": "fp16", "BLOCK_N": 64, "BLOCK_K": 64, "num_warps": 8, "num_stages": 4, "time_ms": 804.8140869140625, "status": "ok"}
{"N": 10485760, "K": 65536, "D": 128, "B": 1, "dtype": "fp16", "BLOCK_N": 64, "BLOCK_K": 128, "num_warps": 4, "num_stages": 1, "time_ms": 539.935302734375, "status": "ok"}
{"N": 10485760, "K": 65536, "D": 128, "B": 1, "dtype": "fp16", "BLOCK_N": 64, "BLOCK_K": 128, "num_warps": 4, "num_stages": 2, "time_ms": 521.1270141601562, "status": "ok"}
{"N": 10485760, "K": 65536, "D": 128, "B": 1, "dtype": "fp16", "BLOCK_N": 64, "BLOCK_K": 128, "num_warps": 4, "num_stages": 4, "time_ms": 629.6552124023438, "status": "ok"}
{"N": 10485760, "K": 65536, "D": 128, "B": 1, "dtype": "fp16", "BLOCK_N": 64, "BLOCK_K": 128, "num_warps": 8, "num_stages": 1, "time_ms": 776.383056640625, "status": "ok"}
{"N": 10485760, "K": 65536, "D": 128, "B": 1, "dtype": "fp16", "BLOCK_N": 64, "BLOCK_K": 128, "num_warps": 8, "num_stages": 2, "time_ms": 690.043701171875, "status": "ok"}
{"N": 10485760, "K": 65536, "D": 128, "B": 1, "dtype": "fp16", "BLOCK_N": 64, "BLOCK_K": 128, "num_warps": 8, "num_stages": 4, "time_ms": 757.087646484375, "status": "ok"}
{"N": 10485760, "K": 65536, "D": 128, "B": 1, "dtype": "fp16", "BLOCK_N": 128, "BLOCK_K": 32, "num_warps": 4, "num_stages": 1, "time_ms": 568.6160888671875, "status": "ok"}
{"N": 10485760, "K": 65536, "D": 128, "B": 1, "dtype": "fp16", "BLOCK_N": 128, "BLOCK_K": 32, "num_warps": 4, "num_stages": 2, "time_ms": 571.1963500976562, "status": "ok"}
{"N": 10485760, "K": 65536, "D": 128, "B": 1, "dtype": "fp16", "BLOCK_N": 128, "BLOCK_K": 32, "num_warps": 4, "num_stages": 4, "time_ms": 593.3883056640625, "status": "ok"}
{"N": 10485760, "K": 65536, "D": 128, "B": 1, "dtype": "fp16", "BLOCK_N": 128, "BLOCK_K": 32, "num_warps": 8, "num_stages": 1, "time_ms": 582.0665893554688, "status": "ok"}
{"N": 10485760, "K": 65536, "D": 128, "B": 1, "dtype": "fp16", "BLOCK_N": 128, "BLOCK_K": 32, "num_warps": 8, "num_stages": 2, "time_ms": 567.4658203125, "status": "ok"}
{"N": 10485760, "K": 65536, "D": 128, "B": 1, "dtype": "fp16", "BLOCK_N": 128, "BLOCK_K": 32, "num_warps": 8, "num_stages": 4, "time_ms": 578.6143188476562, "status": "ok"}
{"N": 10485760, "K": 65536, "D": 128, "B": 1, "dtype": "fp16", "BLOCK_N": 128, "BLOCK_K": 64, "num_warps": 4, "num_stages": 1, "time_ms": 504.1593322753906, "status": "ok"}
{"N": 10485760, "K": 65536, "D": 128, "B": 1, "dtype": "fp16", "BLOCK_N": 128, "BLOCK_K": 64, "num_warps": 4, "num_stages": 2, "time_ms": 505.13311767578125, "status": "ok"}
{"N": 10485760, "K": 65536, "D": 128, "B": 1, "dtype": "fp16", "BLOCK_N": 128, "BLOCK_K": 64, "num_warps": 4, "num_stages": 4, "time_ms": 502.1759948730469, "status": "ok"}
{"N": 10485760, "K": 65536, "D": 128, "B": 1, "dtype": "fp16", "BLOCK_N": 128, "BLOCK_K": 64, "num_warps": 8, "num_stages": 1, "time_ms": 518.2351684570312, "status": "ok"}
{"N": 10485760, "K": 65536, "D": 128, "B": 1, "dtype": "fp16", "BLOCK_N": 128, "BLOCK_K": 64, "num_warps": 8, "num_stages": 2, "time_ms": 508.2063903808594, "status": "ok"}
{"N": 10485760, "K": 65536, "D": 128, "B": 1, "dtype": "fp16", "BLOCK_N": 128, "BLOCK_K": 64, "num_warps": 8, "num_stages": 4, "time_ms": 505.9227600097656, "status": "ok"}
{"N": 10485760, "K": 65536, "D": 128, "B": 1, "dtype": "fp16", "BLOCK_N": 128, "BLOCK_K": 128, "num_warps": 4, "num_stages": 1, "time_ms": 494.7496337890625, "status": "ok"}
{"N": 10485760, "K": 65536, "D": 128, "B": 1, "dtype": "fp16", "BLOCK_N": 128, "BLOCK_K": 128, "num_warps": 4, "num_stages": 2, "time_ms": 479.6861267089844, "status": "ok"}
{"N": 10485760, "K": 65536, "D": 128, "B": 1, "dtype": "fp16", "BLOCK_N": 128, "BLOCK_K": 128, "num_warps": 4, "num_stages": 4, "time_ms": 542.8536987304688, "status": "ok"}
{"N": 10485760, "K": 65536, "D": 128, "B": 1, "dtype": "fp16", "BLOCK_N": 128, "BLOCK_K": 128, "num_warps": 8, "num_stages": 1, "time_ms": 697.2516479492188, "status": "ok"}
{"N": 10485760, "K": 65536, "D": 128, "B": 1, "dtype": "fp16", "BLOCK_N": 128, "BLOCK_K": 128, "num_warps": 8, "num_stages": 2, "time_ms": 460.6561279296875, "status": "ok"}
{"N": 10485760, "K": 65536, "D": 128, "B": 1, "dtype": "fp16", "BLOCK_N": 128, "BLOCK_K": 128, "num_warps": 8, "num_stages": 4, "time_ms": 529.8179931640625, "status": "ok"}
{"summary": true, "N": 10485760, "K": 65536, "D": 128, "B": 1, "dtype": "fp16", "best": {"N": 10485760, "K": 65536, "D": 128, "B": 1, "dtype": "fp16", "BLOCK_N": 128, "BLOCK_K": 128, "num_warps": 8, "num_stages": 2, "time_ms": 460.6561279296875, "status": "ok"}, "best_time_ms": 460.6561279296875, "tuning_seconds": 402.4808073043823, "skipped": 0}
