grid_results_h200/N1048576_K16384_D128_B1_fp16.jsonl
{"N": 1048576, "K": 16384, "D": 128, "B": 1, "dtype": "fp16", "BLOCK_N": 32, "BLOCK_K": 32, "num_warps": 4, "num_stages": 1, "time_ms": 41.21993637084961, "status": "ok"}
{"N": 1048576, "K": 16384, "D": 128, "B": 1, "dtype": "fp16", "BLOCK_N": 32, "BLOCK_K": 32, "num_warps": 4, "num_stages": 2, "time_ms": 33.60905456542969, "status": "ok"}
{"N": 1048576, "K": 16384, "D": 128, "B": 1, "dtype": "fp16", "BLOCK_N": 32, "BLOCK_K": 32, "num_warps": 4, "num_stages": 4, "time_ms": 33.60636901855469, "status": "ok"}
{"N": 1048576, "K": 16384, "D": 128, "B": 1, "dtype": "fp16", "BLOCK_N": 32, "BLOCK_K": 32, "num_warps": 8, "num_stages": 1, "time_ms": 61.2053108215332, "status": "ok"}
{"N": 1048576, "K": 16384, "D": 128, "B": 1, "dtype": "fp16", "BLOCK_N": 32, "BLOCK_K": 32, "num_warps": 8, "num_stages": 2, "time_ms": 55.43302536010742, "status": "ok"}
{"N": 1048576, "K": 16384, "D": 128, "B": 1, "dtype": "fp16", "BLOCK_N": 32, "BLOCK_K": 32, "num_warps": 8, "num_stages": 4, "time_ms": 54.58588790893555, "status": "ok"}
{"N": 1048576, "K": 16384, "D": 128, "B": 1, "dtype": "fp16", "BLOCK_N": 32, "BLOCK_K": 64, "num_warps": 4, "num_stages": 1, "time_ms": 34.978206634521484, "status": "ok"}
{"N": 1048576, "K": 16384, "D": 128, "B": 1, "dtype": "fp16", "BLOCK_N": 32, "BLOCK_K": 64, "num_warps": 4, "num_stages": 2, "time_ms": 27.28835105895996, "status": "ok"}
{"N": 1048576, "K": 16384, "D": 128, "B": 1, "dtype": "fp16", "BLOCK_N": 32, "BLOCK_K": 64, "num_warps": 4, "num_stages": 4, "time_ms": 29.180095672607422, "status": "ok"}
{"N": 1048576, "K": 16384, "D": 128, "B": 1, "dtype": "fp16", "BLOCK_N": 32, "BLOCK_K": 64, "num_warps": 8, "num_stages": 1, "time_ms": 41.96364974975586, "status": "ok"}
{"N": 1048576, "K": 16384, "D": 128, "B": 1, "dtype": "fp16", "BLOCK_N": 32, "BLOCK_K": 64, "num_warps": 8, "num_stages": 2, "time_ms": 35.689823150634766, "status": "ok"}
{"N": 1048576, "K": 16384, "D": 128, "B": 1, "dtype": "fp16", "BLOCK_N": 32, "BLOCK_K": 64, "num_warps": 8, "num_stages": 4, "time_ms": 35.6715202331543, "status": "ok"}
{"N": 1048576, "K": 16384, "D": 128, "B": 1, "dtype": "fp16", "BLOCK_N": 32, "BLOCK_K": 128, "num_warps": 4, "num_stages": 1, "time_ms": 27.93084716796875, "status": "ok"}
{"N": 1048576, "K": 16384, "D": 128, "B": 1, "dtype": "fp16", "BLOCK_N": 32, "BLOCK_K": 128, "num_warps": 4, "num_stages": 2, "time_ms": 21.45043182373047, "status": "ok"}
{"N": 1048576, "K": 16384, "D": 128, "B": 1, "dtype": "fp16", "BLOCK_N": 32, "BLOCK_K": 128, "num_warps": 4, "num_stages": 4, "time_ms": 27.882495880126953, "status": "ok"}
{"N": 1048576, "K": 16384, "D": 128, "B": 1, "dtype": "fp16", "BLOCK_N": 32, "BLOCK_K": 128, "num_warps": 8, "num_stages": 1, "time_ms": 38.39030456542969, "status": "ok"}
{"N": 1048576, "K": 16384, "D": 128, "B": 1, "dtype": "fp16", "BLOCK_N": 32, "BLOCK_K": 128, "num_warps": 8, "num_stages": 2, "time_ms": 32.57513427734375, "status": "ok"}
{"N": 1048576, "K": 16384, "D": 128, "B": 1, "dtype": "fp16", "BLOCK_N": 32, "BLOCK_K": 128, "num_warps": 8, "num_stages": 4, "time_ms": 33.887264251708984, "status": "ok"}
{"N": 1048576, "K": 16384, "D": 128, "B": 1, "dtype": "fp16", "BLOCK_N": 64, "BLOCK_K": 32, "num_warps": 4, "num_stages": 1, "time_ms": 16.478303909301758, "status": "ok"}
{"N": 1048576, "K": 16384, "D": 128, "B": 1, "dtype": "fp16", "BLOCK_N": 64, "BLOCK_K": 32, "num_warps": 4, "num_stages": 2, "time_ms": 14.253120422363281, "status": "ok"}
{"N": 1048576, "K": 16384, "D": 128, "B": 1, "dtype": "fp16", "BLOCK_N": 64, "BLOCK_K": 32, "num_warps": 4, "num_stages": 4, "time_ms": 14.420479774475098, "status": "ok"}
{"N": 1048576, "K": 16384, "D": 128, "B": 1, "dtype": "fp16", "BLOCK_N": 64, "BLOCK_K": 32, "num_warps": 8, "num_stages": 1, "time_ms": 30.36457633972168, "status": "ok"}
{"N": 1048576, "K": 16384, "D": 128, "B": 1, "dtype": "fp16", "BLOCK_N": 64, "BLOCK_K": 32, "num_warps": 8, "num_stages": 2, "time_ms": 26.04204750061035, "status": "ok"}
{"N": 1048576, "K": 16384, "D": 128, "B": 1, "dtype": "fp16", "BLOCK_N": 64, "BLOCK_K": 32, "num_warps": 8, "num_stages": 4, "time_ms": 26.185216903686523, "status": "ok"}
{"N": 1048576, "K": 16384, "D": 128, "B": 1, "dtype": "fp16", "BLOCK_N": 64, "BLOCK_K": 64, "num_warps": 4, "num_stages": 1, "time_ms": 13.945664405822754, "status": "ok"}
{"N": 1048576, "K": 16384, "D": 128, "B": 1, "dtype": "fp16", "BLOCK_N": 64, "BLOCK_K": 64, "num_warps": 4, "num_stages": 2, "time_ms": 12.695487976074219, "status": "ok"}
{"N": 1048576, "K": 16384, "D": 128, "B": 1, "dtype": "fp16", "BLOCK_N": 64, "BLOCK_K": 64, "num_warps": 4, "num_stages": 4, "time_ms": 13.184000015258789, "status": "ok"}
{"N": 1048576, "K": 16384, "D": 128, "B": 1, "dtype": "fp16", "BLOCK_N": 64, "BLOCK_K": 64, "num_warps": 8, "num_stages": 1, "time_ms": 21.225759506225586, "status": "ok"}
{"N": 1048576, "K": 16384, "D": 128, "B": 1, "dtype": "fp16", "BLOCK_N": 64, "BLOCK_K": 64, "num_warps": 8, "num_stages": 2, "time_ms": 18.18060874938965, "status": "ok"}
{"N": 1048576, "K": 16384, "D": 128, "B": 1, "dtype": "fp16", "BLOCK_N": 64, "BLOCK_K": 64, "num_warps": 8, "num_stages": 4, "time_ms": 20.899423599243164, "status": "ok"}
{"N": 1048576, "K": 16384, "D": 128, "B": 1, "dtype": "fp16", "BLOCK_N": 64, "BLOCK_K": 128, "num_warps": 4, "num_stages": 1, "time_ms": 13.0066556930542, "status": "ok"}
{"N": 1048576, "K": 16384, "D": 128, "B": 1, "dtype": "fp16", "BLOCK_N": 64, "BLOCK_K": 128, "num_warps": 4, "num_stages": 2, "time_ms": 12.668543815612793, "status": "ok"}
{"N": 1048576, "K": 16384, "D": 128, "B": 1, "dtype": "fp16", "BLOCK_N": 64, "BLOCK_K": 128, "num_warps": 4, "num_stages": 4, "time_ms": 16.058752059936523, "status": "ok"}
{"N": 1048576, "K": 16384, "D": 128, "B": 1, "dtype": "fp16", "BLOCK_N": 64, "BLOCK_K": 128, "num_warps": 8, "num_stages": 1, "time_ms": 19.81270408630371, "status": "ok"}
{"N": 1048576, "K": 16384, "D": 128, "B": 1, "dtype": "fp16", "BLOCK_N": 64, "BLOCK_K": 128, "num_warps": 8, "num_stages": 2, "time_ms": 16.871583938598633, "status": "ok"}
{"N": 1048576, "K": 16384, "D": 128, "B": 1, "dtype": "fp16", "BLOCK_N": 64, "BLOCK_K": 128, "num_warps": 8, "num_stages": 4, "time_ms": 19.34332847595215, "status": "ok"}
{"N": 1048576, "K": 16384, "D": 128, "B": 1, "dtype": "fp16", "BLOCK_N": 128, "BLOCK_K": 32, "num_warps": 4, "num_stages": 1, "time_ms": 14.025055885314941, "status": "ok"}
{"N": 1048576, "K": 16384, "D": 128, "B": 1, "dtype": "fp16", "BLOCK_N": 128, "BLOCK_K": 32, "num_warps": 4, "num_stages": 2, "time_ms": 14.3187837600708, "status": "ok"}
{"N": 1048576, "K": 16384, "D": 128, "B": 1, "dtype": "fp16", "BLOCK_N": 128, "BLOCK_K": 32, "num_warps": 4, "num_stages": 4, "time_ms": 15.116191864013672, "status": "ok"}
{"N": 1048576, "K": 16384, "D": 128, "B": 1, "dtype": "fp16", "BLOCK_N": 128, "BLOCK_K": 32, "num_warps": 8, "num_stages": 1, "time_ms": 14.596480369567871, "status": "ok"}
{"N": 1048576, "K": 16384, "D": 128, "B": 1, "dtype": "fp16", "BLOCK_N": 128, "BLOCK_K": 32, "num_warps": 8, "num_stages": 2, "time_ms": 14.09727954864502, "status": "ok"}
{"N": 1048576, "K": 16384, "D": 128, "B": 1, "dtype": "fp16", "BLOCK_N": 128, "BLOCK_K": 32, "num_warps": 8, "num_stages": 4, "time_ms": 14.599935531616211, "status": "ok"}
{"N": 1048576, "K": 16384, "D": 128, "B": 1, "dtype": "fp16", "BLOCK_N": 128, "BLOCK_K": 64, "num_warps": 4, "num_stages": 1, "time_ms": 12.207103729248047, "status": "ok"}
{"N": 1048576, "K": 16384, "D": 128, "B": 1, "dtype": "fp16", "BLOCK_N": 128, "BLOCK_K": 64, "num_warps": 4, "num_stages": 2, "time_ms": 12.41817569732666, "status": "ok"}
{"N": 1048576, "K": 16384, "D": 128, "B": 1, "dtype": "fp16", "BLOCK_N": 128, "BLOCK_K": 64, "num_warps": 4, "num_stages": 4, "time_ms": 12.241472244262695, "status": "ok"}
{"N": 1048576, "K": 16384, "D": 128, "B": 1, "dtype": "fp16", "BLOCK_N": 128, "BLOCK_K": 64, "num_warps": 8, "num_stages": 1, "time_ms": 12.707807540893555, "status": "ok"}
{"N": 1048576, "K": 16384, "D": 128, "B": 1, "dtype": "fp16", "BLOCK_N": 128, "BLOCK_K": 64, "num_warps": 8, "num_stages": 2, "time_ms": 12.530303955078125, "status": "ok"}
{"N": 1048576, "K": 16384, "D": 128, "B": 1, "dtype": "fp16", "BLOCK_N": 128, "BLOCK_K": 64, "num_warps": 8, "num_stages": 4, "time_ms": 12.414655685424805, "status": "ok"}
{"N": 1048576, "K": 16384, "D": 128, "B": 1, "dtype": "fp16", "BLOCK_N": 128, "BLOCK_K": 128, "num_warps": 4, "num_stages": 1, "time_ms": 12.161952018737793, "status": "ok"}
{"N": 1048576, "K": 16384, "D": 128, "B": 1, "dtype": "fp16", "BLOCK_N": 128, "BLOCK_K": 128, "num_warps": 4, "num_stages": 2, "time_ms": 11.764927864074707, "status": "ok"}
{"N": 1048576, "K": 16384, "D": 128, "B": 1, "dtype": "fp16", "BLOCK_N": 128, "BLOCK_K": 128, "num_warps": 4, "num_stages": 4, "time_ms": 14.185855865478516, "status": "ok"}
{"N": 1048576, "K": 16384, "D": 128, "B": 1, "dtype": "fp16", "BLOCK_N": 128, "BLOCK_K": 128, "num_warps": 8, "num_stages": 1, "time_ms": 17.988704681396484, "status": "ok"}
{"N": 1048576, "K": 16384, "D": 128, "B": 1, "dtype": "fp16", "BLOCK_N": 128, "BLOCK_K": 128, "num_warps": 8, "num_stages": 2, "time_ms": 11.546112060546875, "status": "ok"}
{"N": 1048576, "K": 16384, "D": 128, "B": 1, "dtype": "fp16", "BLOCK_N": 128, "BLOCK_K": 128, "num_warps": 8, "num_stages": 4, "time_ms": 13.304927825927734, "status": "ok"}
{"summary": true, "N": 1048576, "K": 16384, "D": 128, "B": 1, "dtype": "fp16", "best": {"N": 1048576, "K": 16384, "D": 128, "B": 1, "dtype": "fp16", "BLOCK_N": 128, "BLOCK_K": 128, "num_warps": 8, "num_stages": 2, "time_ms": 11.546112060546875, "status": "ok"}, "best_time_ms": 11.546112060546875, "tuning_seconds": 20.87892723083496, "skipped": 0}
