grid_results_h200/N10485760_K4096_D64_B1_fp16.jsonl
{"N": 10485760, "K": 4096, "D": 64, "B": 1, "dtype": "fp16", "BLOCK_N": 32, "BLOCK_K": 32, "num_warps": 4, "num_stages": 1, "time_ms": 66.87983703613281, "status": "ok"}
{"N": 10485760, "K": 4096, "D": 64, "B": 1, "dtype": "fp16", "BLOCK_N": 32, "BLOCK_K": 32, "num_warps": 4, "num_stages": 2, "time_ms": 59.263038635253906, "status": "ok"}
{"N": 10485760, "K": 4096, "D": 64, "B": 1, "dtype": "fp16", "BLOCK_N": 32, "BLOCK_K": 32, "num_warps": 4, "num_stages": 4, "time_ms": 58.704864501953125, "status": "ok"}
{"N": 10485760, "K": 4096, "D": 64, "B": 1, "dtype": "fp16", "BLOCK_N": 32, "BLOCK_K": 32, "num_warps": 8, "num_stages": 1, "time_ms": 107.43740844726562, "status": "ok"}
{"N": 10485760, "K": 4096, "D": 64, "B": 1, "dtype": "fp16", "BLOCK_N": 32, "BLOCK_K": 32, "num_warps": 8, "num_stages": 2, "time_ms": 101.4775390625, "status": "ok"}
{"N": 10485760, "K": 4096, "D": 64, "B": 1, "dtype": "fp16", "BLOCK_N": 32, "BLOCK_K": 32, "num_warps": 8, "num_stages": 4, "time_ms": 100.34496307373047, "status": "ok"}
{"N": 10485760, "K": 4096, "D": 64, "B": 1, "dtype": "fp16", "BLOCK_N": 32, "BLOCK_K": 64, "num_warps": 4, "num_stages": 1, "time_ms": 56.899070739746094, "status": "ok"}
{"N": 10485760, "K": 4096, "D": 64, "B": 1, "dtype": "fp16", "BLOCK_N": 32, "BLOCK_K": 64, "num_warps": 4, "num_stages": 2, "time_ms": 50.497825622558594, "status": "ok"}
{"N": 10485760, "K": 4096, "D": 64, "B": 1, "dtype": "fp16", "BLOCK_N": 32, "BLOCK_K": 64, "num_warps": 4, "num_stages": 4, "time_ms": 48.276126861572266, "status": "ok"}
{"N": 10485760, "K": 4096, "D": 64, "B": 1, "dtype": "fp16", "BLOCK_N": 32, "BLOCK_K": 64, "num_warps": 8, "num_stages": 1, "time_ms": 69.08745574951172, "status": "ok"}
{"N": 10485760, "K": 4096, "D": 64, "B": 1, "dtype": "fp16", "BLOCK_N": 32, "BLOCK_K": 64, "num_warps": 8, "num_stages": 2, "time_ms": 64.14848327636719, "status": "ok"}
{"N": 10485760, "K": 4096, "D": 64, "B": 1, "dtype": "fp16", "BLOCK_N": 32, "BLOCK_K": 64, "num_warps": 8, "num_stages": 4, "time_ms": 63.320960998535156, "status": "ok"}
{"N": 10485760, "K": 4096, "D": 64, "B": 1, "dtype": "fp16", "BLOCK_N": 32, "BLOCK_K": 128, "num_warps": 4, "num_stages": 1, "time_ms": 44.87830352783203, "status": "ok"}
{"N": 10485760, "K": 4096, "D": 64, "B": 1, "dtype": "fp16", "BLOCK_N": 32, "BLOCK_K": 128, "num_warps": 4, "num_stages": 2, "time_ms": 38.331905364990234, "status": "ok"}
{"N": 10485760, "K": 4096, "D": 64, "B": 1, "dtype": "fp16", "BLOCK_N": 32, "BLOCK_K": 128, "num_warps": 4, "num_stages": 4, "time_ms": 39.353729248046875, "status": "ok"}
{"N": 10485760, "K": 4096, "D": 64, "B": 1, "dtype": "fp16", "BLOCK_N": 32, "BLOCK_K": 128, "num_warps": 8, "num_stages": 1, "time_ms": 73.2132797241211, "status": "ok"}
{"N": 10485760, "K": 4096, "D": 64, "B": 1, "dtype": "fp16", "BLOCK_N": 32, "BLOCK_K": 128, "num_warps": 8, "num_stages": 2, "time_ms": 60.658687591552734, "status": "ok"}
{"N": 10485760, "K": 4096, "D": 64, "B": 1, "dtype": "fp16", "BLOCK_N": 32, "BLOCK_K": 128, "num_warps": 8, "num_stages": 4, "time_ms": 58.717472076416016, "status": "ok"}
{"N": 10485760, "K": 4096, "D": 64, "B": 1, "dtype": "fp16", "BLOCK_N": 64, "BLOCK_K": 32, "num_warps": 4, "num_stages": 1, "time_ms": 26.30588722229004, "status": "ok"}
{"N": 10485760, "K": 4096, "D": 64, "B": 1, "dtype": "fp16", "BLOCK_N": 64, "BLOCK_K": 32, "num_warps": 4, "num_stages": 2, "time_ms": 26.049407958984375, "status": "ok"}
{"N": 10485760, "K": 4096, "D": 64, "B": 1, "dtype": "fp16", "BLOCK_N": 64, "BLOCK_K": 32, "num_warps": 4, "num_stages": 4, "time_ms": 26.40185546875, "status": "ok"}
{"N": 10485760, "K": 4096, "D": 64, "B": 1, "dtype": "fp16", "BLOCK_N": 64, "BLOCK_K": 32, "num_warps": 8, "num_stages": 1, "time_ms": 53.239009857177734, "status": "ok"}
{"N": 10485760, "K": 4096, "D": 64, "B": 1, "dtype": "fp16", "BLOCK_N": 64, "BLOCK_K": 32, "num_warps": 8, "num_stages": 2, "time_ms": 49.51942443847656, "status": "ok"}
{"N": 10485760, "K": 4096, "D": 64, "B": 1, "dtype": "fp16", "BLOCK_N": 64, "BLOCK_K": 32, "num_warps": 8, "num_stages": 4, "time_ms": 48.79942321777344, "status": "ok"}
{"N": 10485760, "K": 4096, "D": 64, "B": 1, "dtype": "fp16", "BLOCK_N": 64, "BLOCK_K": 64, "num_warps": 4, "num_stages": 1, "time_ms": 25.078336715698242, "status": "ok"}
{"N": 10485760, "K": 4096, "D": 64, "B": 1, "dtype": "fp16", "BLOCK_N": 64, "BLOCK_K": 64, "num_warps": 4, "num_stages": 2, "time_ms": 23.648256301879883, "status": "ok"}
{"N": 10485760, "K": 4096, "D": 64, "B": 1, "dtype": "fp16", "BLOCK_N": 64, "BLOCK_K": 64, "num_warps": 4, "num_stages": 4, "time_ms": 24.015167236328125, "status": "ok"}
{"N": 10485760, "K": 4096, "D": 64, "B": 1, "dtype": "fp16", "BLOCK_N": 64, "BLOCK_K": 64, "num_warps": 8, "num_stages": 1, "time_ms": 38.28812789916992, "status": "ok"}
{"N": 10485760, "K": 4096, "D": 64, "B": 1, "dtype": "fp16", "BLOCK_N": 64, "BLOCK_K": 64, "num_warps": 8, "num_stages": 2, "time_ms": 36.34783935546875, "status": "ok"}
{"N": 10485760, "K": 4096, "D": 64, "B": 1, "dtype": "fp16", "BLOCK_N": 64, "BLOCK_K": 64, "num_warps": 8, "num_stages": 4, "time_ms": 35.871551513671875, "status": "ok"}
{"N": 10485760, "K": 4096, "D": 64, "B": 1, "dtype": "fp16", "BLOCK_N": 64, "BLOCK_K": 128, "num_warps": 4, "num_stages": 1, "time_ms": 23.241504669189453, "status": "ok"}
{"N": 10485760, "K": 4096, "D": 64, "B": 1, "dtype": "fp16", "BLOCK_N": 64, "BLOCK_K": 128, "num_warps": 4, "num_stages": 2, "time_ms": 22.804927825927734, "status": "ok"}
{"N": 10485760, "K": 4096, "D": 64, "B": 1, "dtype": "fp16", "BLOCK_N": 64, "BLOCK_K": 128, "num_warps": 4, "num_stages": 4, "time_ms": 22.833568572998047, "status": "ok"}
{"N": 10485760, "K": 4096, "D": 64, "B": 1, "dtype": "fp16", "BLOCK_N": 64, "BLOCK_K": 128, "num_warps": 8, "num_stages": 1, "time_ms": 39.28326416015625, "status": "ok"}
{"N": 10485760, "K": 4096, "D": 64, "B": 1, "dtype": "fp16", "BLOCK_N": 64, "BLOCK_K": 128, "num_warps": 8, "num_stages": 2, "time_ms": 33.77657699584961, "status": "ok"}
{"N": 10485760, "K": 4096, "D": 64, "B": 1, "dtype": "fp16", "BLOCK_N": 64, "BLOCK_K": 128, "num_warps": 8, "num_stages": 4, "time_ms": 32.40220642089844, "status": "ok"}
{"N": 10485760, "K": 4096, "D": 64, "B": 1, "dtype": "fp16", "BLOCK_N": 128, "BLOCK_K": 32, "num_warps": 4, "num_stages": 1, "time_ms": 26.131296157836914, "status": "ok"}
{"N": 10485760, "K": 4096, "D": 64, "B": 1, "dtype": "fp16", "BLOCK_N": 128, "BLOCK_K": 32, "num_warps": 4, "num_stages": 2, "time_ms": 25.306976318359375, "status": "ok"}
{"N": 10485760, "K": 4096, "D": 64, "B": 1, "dtype": "fp16", "BLOCK_N": 128, "BLOCK_K": 32, "num_warps": 4, "num_stages": 4, "time_ms": 25.76540756225586, "status": "ok"}
{"N": 10485760, "K": 4096, "D": 64, "B": 1, "dtype": "fp16", "BLOCK_N": 128, "BLOCK_K": 32, "num_warps": 8, "num_stages": 1, "time_ms": 27.113727569580078, "status": "ok"}
{"N": 10485760, "K": 4096, "D": 64, "B": 1, "dtype": "fp16", "BLOCK_N": 128, "BLOCK_K": 32, "num_warps": 8, "num_stages": 2, "time_ms": 28.366016387939453, "status": "ok"}
{"N": 10485760, "K": 4096, "D": 64, "B": 1, "dtype": "fp16", "BLOCK_N": 128, "BLOCK_K": 32, "num_warps": 8, "num_stages": 4, "time_ms": 27.884544372558594, "status": "ok"}
{"N": 10485760, "K": 4096, "D": 64, "B": 1, "dtype": "fp16", "BLOCK_N": 128, "BLOCK_K": 64, "num_warps": 4, "num_stages": 1, "time_ms": 24.889184951782227, "status": "ok"}
{"N": 10485760, "K": 4096, "D": 64, "B": 1, "dtype": "fp16", "BLOCK_N": 128, "BLOCK_K": 64, "num_warps": 4, "num_stages": 2, "time_ms": 22.7587833404541, "status": "ok"}
{"N": 10485760, "K": 4096, "D": 64, "B": 1, "dtype": "fp16", "BLOCK_N": 128, "BLOCK_K": 64, "num_warps": 4, "num_stages": 4, "time_ms": 23.195999145507812, "status": "ok"}
{"N": 10485760, "K": 4096, "D": 64, "B": 1, "dtype": "fp16", "BLOCK_N": 128, "BLOCK_K": 64, "num_warps": 8, "num_stages": 1, "time_ms": 25.343263626098633, "status": "ok"}
{"N": 10485760, "K": 4096, "D": 64, "B": 1, "dtype": "fp16", "BLOCK_N": 128, "BLOCK_K": 64, "num_warps": 8, "num_stages": 2, "time_ms": 24.496992111206055, "status": "ok"}
{"N": 10485760, "K": 4096, "D": 64, "B": 1, "dtype": "fp16", "BLOCK_N": 128, "BLOCK_K": 64, "num_warps": 8, "num_stages": 4, "time_ms": 24.65488052368164, "status": "ok"}
{"N": 10485760, "K": 4096, "D": 64, "B": 1, "dtype": "fp16", "BLOCK_N": 128, "BLOCK_K": 128, "num_warps": 4, "num_stages": 1, "time_ms": 26.679487228393555, "status": "ok"}
{"N": 10485760, "K": 4096, "D": 64, "B": 1, "dtype": "fp16", "BLOCK_N": 128, "BLOCK_K": 128, "num_warps": 4, "num_stages": 2, "time_ms": 24.789663314819336, "status": "ok"}
{"N": 10485760, "K": 4096, "D": 64, "B": 1, "dtype": "fp16", "BLOCK_N": 128, "BLOCK_K": 128, "num_warps": 4, "num_stages": 4, "time_ms": 22.343488693237305, "status": "ok"}
{"N": 10485760, "K": 4096, "D": 64, "B": 1, "dtype": "fp16", "BLOCK_N": 128, "BLOCK_K": 128, "num_warps": 8, "num_stages": 1, "time_ms": 34.401729583740234, "status": "ok"}
{"N": 10485760, "K": 4096, "D": 64, "B": 1, "dtype": "fp16", "BLOCK_N": 128, "BLOCK_K": 128, "num_warps": 8, "num_stages": 2, "time_ms": 23.974111557006836, "status": "ok"}
{"N": 10485760, "K": 4096, "D": 64, "B": 1, "dtype": "fp16", "BLOCK_N": 128, "BLOCK_K": 128, "num_warps": 8, "num_stages": 4, "time_ms": 23.440160751342773, "status": "ok"}
{"summary": true, "N": 10485760, "K": 4096, "D": 64, "B": 1, "dtype": "fp16", "best": {"N": 10485760, "K": 4096, "D": 64, "B": 1, "dtype": "fp16", "BLOCK_N": 128, "BLOCK_K": 128, "num_warps": 4, "num_stages": 4, "time_ms": 22.343488693237305, "status": "ok"}, "best_time_ms": 22.343488693237305, "tuning_seconds": 27.25908327102661, "skipped": 0}
