grid_results_h200/N1048576_K16384_D64_B32_fp16.jsonl
{"N": 1048576, "K": 16384, "D": 64, "B": 32, "dtype": "fp16", "BLOCK_N": 32, "BLOCK_K": 32, "num_warps": 4, "num_stages": 1, "time_ms": 859.6925659179688, "status": "ok"}
{"N": 1048576, "K": 16384, "D": 64, "B": 32, "dtype": "fp16", "BLOCK_N": 32, "BLOCK_K": 32, "num_warps": 4, "num_stages": 2, "time_ms": 755.9102783203125, "status": "ok"}
{"N": 1048576, "K": 16384, "D": 64, "B": 32, "dtype": "fp16", "BLOCK_N": 32, "BLOCK_K": 32, "num_warps": 4, "num_stages": 4, "time_ms": 741.4517211914062, "status": "ok"}
{"N": 1048576, "K": 16384, "D": 64, "B": 32, "dtype": "fp16", "BLOCK_N": 32, "BLOCK_K": 32, "num_warps": 8, "num_stages": 1, "time_ms": 1375.4210205078125, "status": "ok"}
{"N": 1048576, "K": 16384, "D": 64, "B": 32, "dtype": "fp16", "BLOCK_N": 32, "BLOCK_K": 32, "num_warps": 8, "num_stages": 2, "time_ms": 1295.199951171875, "status": "ok"}
{"N": 1048576, "K": 16384, "D": 64, "B": 32, "dtype": "fp16", "BLOCK_N": 32, "BLOCK_K": 32, "num_warps": 8, "num_stages": 4, "time_ms": 1279.15625, "status": "ok"}
{"N": 1048576, "K": 16384, "D": 64, "B": 32, "dtype": "fp16", "BLOCK_N": 32, "BLOCK_K": 64, "num_warps": 4, "num_stages": 1, "time_ms": 721.9801025390625, "status": "ok"}
{"N": 1048576, "K": 16384, "D": 64, "B": 32, "dtype": "fp16", "BLOCK_N": 32, "BLOCK_K": 64, "num_warps": 4, "num_stages": 2, "time_ms": 637.046875, "status": "ok"}
{"N": 1048576, "K": 16384, "D": 64, "B": 32, "dtype": "fp16", "BLOCK_N": 32, "BLOCK_K": 64, "num_warps": 4, "num_stages": 4, "time_ms": 604.6031494140625, "status": "ok"}
{"N": 1048576, "K": 16384, "D": 64, "B": 32, "dtype": "fp16", "BLOCK_N": 32, "BLOCK_K": 64, "num_warps": 8, "num_stages": 1, "time_ms": 893.4042358398438, "status": "ok"}
{"N": 1048576, "K": 16384, "D": 64, "B": 32, "dtype": "fp16", "BLOCK_N": 32, "BLOCK_K": 64, "num_warps": 8, "num_stages": 2, "time_ms": 815.930908203125, "status": "ok"}
{"N": 1048576, "K": 16384, "D": 64, "B": 32, "dtype": "fp16", "BLOCK_N": 32, "BLOCK_K": 64, "num_warps": 8, "num_stages": 4, "time_ms": 803.3068237304688, "status": "ok"}
{"N": 1048576, "K": 16384, "D": 64, "B": 32, "dtype": "fp16", "BLOCK_N": 32, "BLOCK_K": 128, "num_warps": 4, "num_stages": 1, "time_ms": 566.5365600585938, "status": "ok"}
{"N": 1048576, "K": 16384, "D": 64, "B": 32, "dtype": "fp16", "BLOCK_N": 32, "BLOCK_K": 128, "num_warps": 4, "num_stages": 2, "time_ms": 498.5233459472656, "status": "ok"}
{"N": 1048576, "K": 16384, "D": 64, "B": 32, "dtype": "fp16", "BLOCK_N": 32, "BLOCK_K": 128, "num_warps": 4, "num_stages": 4, "time_ms": 488.3703308105469, "status": "ok"}
{"N": 1048576, "K": 16384, "D": 64, "B": 32, "dtype": "fp16", "BLOCK_N": 32, "BLOCK_K": 128, "num_warps": 8, "num_stages": 1, "time_ms": 927.7927856445312, "status": "ok"}
{"N": 1048576, "K": 16384, "D": 64, "B": 32, "dtype": "fp16", "BLOCK_N": 32, "BLOCK_K": 128, "num_warps": 8, "num_stages": 2, "time_ms": 768.8427124023438, "status": "ok"}
{"N": 1048576, "K": 16384, "D": 64, "B": 32, "dtype": "fp16", "BLOCK_N": 32, "BLOCK_K": 128, "num_warps": 8, "num_stages": 4, "time_ms": 736.8390502929688, "status": "ok"}
{"N": 1048576, "K": 16384, "D": 64, "B": 32, "dtype": "fp16", "BLOCK_N": 64, "BLOCK_K": 32, "num_warps": 4, "num_stages": 1, "time_ms": 340.92266845703125, "status": "ok"}
{"N": 1048576, "K": 16384, "D": 64, "B": 32, "dtype": "fp16", "BLOCK_N": 64, "BLOCK_K": 32, "num_warps": 4, "num_stages": 2, "time_ms": 330.7576599121094, "status": "ok"}
{"N": 1048576, "K": 16384, "D": 64, "B": 32, "dtype": "fp16", "BLOCK_N": 64, "BLOCK_K": 32, "num_warps": 4, "num_stages": 4, "time_ms": 333.4873046875, "status": "ok"}
{"N": 1048576, "K": 16384, "D": 64, "B": 32, "dtype": "fp16", "BLOCK_N": 64, "BLOCK_K": 32, "num_warps": 8, "num_stages": 1, "time_ms": 690.5572509765625, "status": "ok"}
{"N": 1048576, "K": 16384, "D": 64, "B": 32, "dtype": "fp16", "BLOCK_N": 64, "BLOCK_K": 32, "num_warps": 8, "num_stages": 2, "time_ms": 631.8547973632812, "status": "ok"}
{"N": 1048576, "K": 16384, "D": 64, "B": 32, "dtype": "fp16", "BLOCK_N": 64, "BLOCK_K": 32, "num_warps": 8, "num_stages": 4, "time_ms": 621.323486328125, "status": "ok"}
{"N": 1048576, "K": 16384, "D": 64, "B": 32, "dtype": "fp16", "BLOCK_N": 64, "BLOCK_K": 64, "num_warps": 4, "num_stages": 1, "time_ms": 319.23553466796875, "status": "ok"}
{"N": 1048576, "K": 16384, "D": 64, "B": 32, "dtype": "fp16", "BLOCK_N": 64, "BLOCK_K": 64, "num_warps": 4, "num_stages": 2, "time_ms": 302.9065246582031, "status": "ok"}
{"N": 1048576, "K": 16384, "D": 64, "B": 32, "dtype": "fp16", "BLOCK_N": 64, "BLOCK_K": 64, "num_warps": 4, "num_stages": 4, "time_ms": 305.0429382324219, "status": "ok"}
{"N": 1048576, "K": 16384, "D": 64, "B": 32, "dtype": "fp16", "BLOCK_N": 64, "BLOCK_K": 64, "num_warps": 8, "num_stages": 1, "time_ms": 485.71099853515625, "status": "ok"}
{"N": 1048576, "K": 16384, "D": 64, "B": 32, "dtype": "fp16", "BLOCK_N": 64, "BLOCK_K": 64, "num_warps": 8, "num_stages": 2, "time_ms": 458.5343017578125, "status": "ok"}
{"N": 1048576, "K": 16384, "D": 64, "B": 32, "dtype": "fp16", "BLOCK_N": 64, "BLOCK_K": 64, "num_warps": 8, "num_stages": 4, "time_ms": 449.2610778808594, "status": "ok"}
{"N": 1048576, "K": 16384, "D": 64, "B": 32, "dtype": "fp16", "BLOCK_N": 64, "BLOCK_K": 128, "num_warps": 4, "num_stages": 1, "time_ms": 302.15533447265625, "status": "ok"}
{"N": 1048576, "K": 16384, "D": 64, "B": 32, "dtype": "fp16", "BLOCK_N": 64, "BLOCK_K": 128, "num_warps": 4, "num_stages": 2, "time_ms": 294.2551574707031, "status": "ok"}
{"N": 1048576, "K": 16384, "D": 64, "B": 32, "dtype": "fp16", "BLOCK_N": 64, "BLOCK_K": 128, "num_warps": 4, "num_stages": 4, "time_ms": 295.012451171875, "status": "ok"}
{"N": 1048576, "K": 16384, "D": 64, "B": 32, "dtype": "fp16", "BLOCK_N": 64, "BLOCK_K": 128, "num_warps": 8, "num_stages": 1, "time_ms": 491.9608459472656, "status": "ok"}
{"N": 1048576, "K": 16384, "D": 64, "B": 32, "dtype": "fp16", "BLOCK_N": 64, "BLOCK_K": 128, "num_warps": 8, "num_stages": 2, "time_ms": 422.5587158203125, "status": "ok"}
{"N": 1048576, "K": 16384, "D": 64, "B": 32, "dtype": "fp16", "BLOCK_N": 64, "BLOCK_K": 128, "num_warps": 8, "num_stages": 4, "time_ms": 406.34503173828125, "status": "ok"}
{"N": 1048576, "K": 16384, "D": 64, "B": 32, "dtype": "fp16", "BLOCK_N": 128, "BLOCK_K": 32, "num_warps": 4, "num_stages": 1, "time_ms": 329.210693359375, "status": "ok"}
{"N": 1048576, "K": 16384, "D": 64, "B": 32, "dtype": "fp16", "BLOCK_N": 128, "BLOCK_K": 32, "num_warps": 4, "num_stages": 2, "time_ms": 319.78271484375, "status": "ok"}
{"N": 1048576, "K": 16384, "D": 64, "B": 32, "dtype": "fp16", "BLOCK_N": 128, "BLOCK_K": 32, "num_warps": 4, "num_stages": 4, "time_ms": 326.9078063964844, "status": "ok"}
{"N": 1048576, "K": 16384, "D": 64, "B": 32, "dtype": "fp16", "BLOCK_N": 128, "BLOCK_K": 32, "num_warps": 8, "num_stages": 1, "time_ms": 346.1137390136719, "status": "ok"}
{"N": 1048576, "K": 16384, "D": 64, "B": 32, "dtype": "fp16", "BLOCK_N": 128, "BLOCK_K": 32, "num_warps": 8, "num_stages": 2, "time_ms": 358.4026794433594, "status": "ok"}
{"N": 1048576, "K": 16384, "D": 64, "B": 32, "dtype": "fp16", "BLOCK_N": 128, "BLOCK_K": 32, "num_warps": 8, "num_stages": 4, "time_ms": 352.2950744628906, "status": "ok"}
{"N": 1048576, "K": 16384, "D": 64, "B": 32, "dtype": "fp16", "BLOCK_N": 128, "BLOCK_K": 64, "num_warps": 4, "num_stages": 1, "time_ms": 315.9230041503906, "status": "ok"}
{"N": 1048576, "K": 16384, "D": 64, "B": 32, "dtype": "fp16", "BLOCK_N": 128, "BLOCK_K": 64, "num_warps": 4, "num_stages": 2, "time_ms": 286.71148681640625, "status": "ok"}
{"N": 1048576, "K": 16384, "D": 64, "B": 32, "dtype": "fp16", "BLOCK_N": 128, "BLOCK_K": 64, "num_warps": 4, "num_stages": 4, "time_ms": 291.293212890625, "status": "ok"}
{"N": 1048576, "K": 16384, "D": 64, "B": 32, "dtype": "fp16", "BLOCK_N": 128, "BLOCK_K": 64, "num_warps": 8, "num_stages": 1, "time_ms": 326.322021484375, "status": "ok"}
{"N": 1048576, "K": 16384, "D": 64, "B": 32, "dtype": "fp16", "BLOCK_N": 128, "BLOCK_K": 64, "num_warps": 8, "num_stages": 2, "time_ms": 308.597412109375, "status": "ok"}
{"N": 1048576, "K": 16384, "D": 64, "B": 32, "dtype": "fp16", "BLOCK_N": 128, "BLOCK_K": 64, "num_warps": 8, "num_stages": 4, "time_ms": 310.0548095703125, "status": "ok"}
{"N": 1048576, "K": 16384, "D": 64, "B": 32, "dtype": "fp16", "BLOCK_N": 128, "BLOCK_K": 128, "num_warps": 4, "num_stages": 1, "time_ms": 322.78466796875, "status": "ok"}
{"N": 1048576, "K": 16384, "D": 64, "B": 32, "dtype": "fp16", "BLOCK_N": 128, "BLOCK_K": 128, "num_warps": 4, "num_stages": 2, "time_ms": 314.8270263671875, "status": "ok"}
{"N": 1048576, "K": 16384, "D": 64, "B": 32, "dtype": "fp16", "BLOCK_N": 128, "BLOCK_K": 128, "num_warps": 4, "num_stages": 4, "time_ms": 286.6685485839844, "status": "ok"}
{"N": 1048576, "K": 16384, "D": 64, "B": 32, "dtype": "fp16", "BLOCK_N": 128, "BLOCK_K": 128, "num_warps": 8, "num_stages": 1, "time_ms": 433.64227294921875, "status": "ok"}
{"N": 1048576, "K": 16384, "D": 64, "B": 32, "dtype": "fp16", "BLOCK_N": 128, "BLOCK_K": 128, "num_warps": 8, "num_stages": 2, "time_ms": 298.8199768066406, "status": "ok"}
{"N": 1048576, "K": 16384, "D": 64, "B": 32, "dtype": "fp16", "BLOCK_N": 128, "BLOCK_K": 128, "num_warps": 8, "num_stages": 4, "time_ms": 292.94085693359375, "status": "ok"}
{"summary": true, "N": 1048576, "K": 16384, "D": 64, "B": 32, "dtype": "fp16", "best": {"N": 1048576, "K": 16384, "D": 64, "B": 32, "dtype": "fp16", "BLOCK_N": 128, "BLOCK_K": 128, "num_warps": 4, "num_stages": 4, "time_ms": 286.6685485839844, "status": "ok"}, "best_time_ms": 286.6685485839844, "tuning_seconds": 233.9882297515869, "skipped": 0}
