grid_results_h200/N1048576_K65536_D64_B32_fp16.jsonl
{"N": 1048576, "K": 65536, "D": 64, "B": 32, "dtype": "fp16", "BLOCK_N": 32, "BLOCK_K": 32, "num_warps": 4, "num_stages": 1, "time_ms": 3451.8271484375, "status": "ok"}
{"N": 1048576, "K": 65536, "D": 64, "B": 32, "dtype": "fp16", "BLOCK_N": 32, "BLOCK_K": 32, "num_warps": 4, "num_stages": 2, "time_ms": 3012.770751953125, "status": "ok"}
{"N": 1048576, "K": 65536, "D": 64, "B": 32, "dtype": "fp16", "BLOCK_N": 32, "BLOCK_K": 32, "num_warps": 4, "num_stages": 4, "time_ms": 2967.797607421875, "status": "ok"}
{"N": 1048576, "K": 65536, "D": 64, "B": 32, "dtype": "fp16", "BLOCK_N": 32, "BLOCK_K": 32, "num_warps": 8, "num_stages": 1, "time_ms": 5536.1787109375, "status": "ok"}
{"N": 1048576, "K": 65536, "D": 64, "B": 32, "dtype": "fp16", "BLOCK_N": 32, "BLOCK_K": 32, "num_warps": 8, "num_stages": 2, "time_ms": 5195.41259765625, "status": "ok"}
{"N": 1048576, "K": 65536, "D": 64, "B": 32, "dtype": "fp16", "BLOCK_N": 32, "BLOCK_K": 32, "num_warps": 8, "num_stages": 4, "time_ms": 5165.6083984375, "status": "ok"}
{"N": 1048576, "K": 65536, "D": 64, "B": 32, "dtype": "fp16", "BLOCK_N": 32, "BLOCK_K": 64, "num_warps": 4, "num_stages": 1, "time_ms": 2893.215087890625, "status": "ok"}
{"N": 1048576, "K": 65536, "D": 64, "B": 32, "dtype": "fp16", "BLOCK_N": 32, "BLOCK_K": 64, "num_warps": 4, "num_stages": 2, "time_ms": 2534.917236328125, "status": "ok"}
{"N": 1048576, "K": 65536, "D": 64, "B": 32, "dtype": "fp16", "BLOCK_N": 32, "BLOCK_K": 64, "num_warps": 4, "num_stages": 4, "time_ms": 2461.027099609375, "status": "ok"}
{"N": 1048576, "K": 65536, "D": 64, "B": 32, "dtype": "fp16", "BLOCK_N": 32, "BLOCK_K": 64, "num_warps": 8, "num_stages": 1, "time_ms": 3780.711181640625, "status": "ok"}
{"N": 1048576, "K": 65536, "D": 64, "B": 32, "dtype": "fp16", "BLOCK_N": 32, "BLOCK_K": 64, "num_warps": 8, "num_stages": 2, "time_ms": 3246.543701171875, "status": "ok"}
{"N": 1048576, "K": 65536, "D": 64, "B": 32, "dtype": "fp16", "BLOCK_N": 32, "BLOCK_K": 64, "num_warps": 8, "num_stages": 4, "time_ms": 3157.99951171875, "status": "ok"}
{"N": 1048576, "K": 65536, "D": 64, "B": 32, "dtype": "fp16", "BLOCK_N": 32, "BLOCK_K": 128, "num_warps": 4, "num_stages": 1, "time_ms": 2267.8505859375, "status": "ok"}
{"N": 1048576, "K": 65536, "D": 64, "B": 32, "dtype": "fp16", "BLOCK_N": 32, "BLOCK_K": 128, "num_warps": 4, "num_stages": 2, "time_ms": 1927.269287109375, "status": "ok"}
{"N": 1048576, "K": 65536, "D": 64, "B": 32, "dtype": "fp16", "BLOCK_N": 32, "BLOCK_K": 128, "num_warps": 4, "num_stages": 4, "time_ms": 1948.7799072265625, "status": "ok"}
{"N": 1048576, "K": 65536, "D": 64, "B": 32, "dtype": "fp16", "BLOCK_N": 32, "BLOCK_K": 128, "num_warps": 8, "num_stages": 1, "time_ms": 3720.3466796875, "status": "ok"}
{"N": 1048576, "K": 65536, "D": 64, "B": 32, "dtype": "fp16", "BLOCK_N": 32, "BLOCK_K": 128, "num_warps": 8, "num_stages": 2, "time_ms": 3040.57763671875, "status": "ok"}
{"N": 1048576, "K": 65536, "D": 64, "B": 32, "dtype": "fp16", "BLOCK_N": 32, "BLOCK_K": 128, "num_warps": 8, "num_stages": 4, "time_ms": 2925.155517578125, "status": "ok"}
{"N": 1048576, "K": 65536, "D": 64, "B": 32, "dtype": "fp16", "BLOCK_N": 64, "BLOCK_K": 32, "num_warps": 4, "num_stages": 1, "time_ms": 1376.8389892578125, "status": "ok"}
{"N": 1048576, "K": 65536, "D": 64, "B": 32, "dtype": "fp16", "BLOCK_N": 64, "BLOCK_K": 32, "num_warps": 4, "num_stages": 2, "time_ms": 1342.61279296875, "status": "ok"}
{"N": 1048576, "K": 65536, "D": 64, "B": 32, "dtype": "fp16", "BLOCK_N": 64, "BLOCK_K": 32, "num_warps": 4, "num_stages": 4, "time_ms": 1352.020751953125, "status": "ok"}
{"N": 1048576, "K": 65536, "D": 64, "B": 32, "dtype": "fp16", "BLOCK_N": 64, "BLOCK_K": 32, "num_warps": 8, "num_stages": 1, "time_ms": 2750.9091796875, "status": "ok"}
{"N": 1048576, "K": 65536, "D": 64, "B": 32, "dtype": "fp16", "BLOCK_N": 64, "BLOCK_K": 32, "num_warps": 8, "num_stages": 2, "time_ms": 2587.007080078125, "status": "ok"}
{"N": 1048576, "K": 65536, "D": 64, "B": 32, "dtype": "fp16", "BLOCK_N": 64, "BLOCK_K": 32, "num_warps": 8, "num_stages": 4, "time_ms": 2542.029541015625, "status": "ok"}
{"N": 1048576, "K": 65536, "D": 64, "B": 32, "dtype": "fp16", "BLOCK_N": 64, "BLOCK_K": 64, "num_warps": 4, "num_stages": 1, "time_ms": 1292.18994140625, "status": "ok"}
{"N": 1048576, "K": 65536, "D": 64, "B": 32, "dtype": "fp16", "BLOCK_N": 64, "BLOCK_K": 64, "num_warps": 4, "num_stages": 2, "time_ms": 1217.8563232421875, "status": "ok"}
{"N": 1048576, "K": 65536, "D": 64, "B": 32, "dtype": "fp16", "BLOCK_N": 64, "BLOCK_K": 64, "num_warps": 4, "num_stages": 4, "time_ms": 1227.362548828125, "status": "ok"}
{"N": 1048576, "K": 65536, "D": 64, "B": 32, "dtype": "fp16", "BLOCK_N": 64, "BLOCK_K": 64, "num_warps": 8, "num_stages": 1, "time_ms": 1940.1981201171875, "status": "ok"}
{"N": 1048576, "K": 65536, "D": 64, "B": 32, "dtype": "fp16", "BLOCK_N": 64, "BLOCK_K": 64, "num_warps": 8, "num_stages": 2, "time_ms": 1885.233642578125, "status": "ok"}
{"N": 1048576, "K": 65536, "D": 64, "B": 32, "dtype": "fp16", "BLOCK_N": 64, "BLOCK_K": 64, "num_warps": 8, "num_stages": 4, "time_ms": 1813.9537353515625, "status": "ok"}
{"N": 1048576, "K": 65536, "D": 64, "B": 32, "dtype": "fp16", "BLOCK_N": 64, "BLOCK_K": 128, "num_warps": 4, "num_stages": 1, "time_ms": 1202.5042724609375, "status": "ok"}
{"N": 1048576, "K": 65536, "D": 64, "B": 32, "dtype": "fp16", "BLOCK_N": 64, "BLOCK_K": 128, "num_warps": 4, "num_stages": 2, "time_ms": 1172.6036376953125, "status": "ok"}
{"N": 1048576, "K": 65536, "D": 64, "B": 32, "dtype": "fp16", "BLOCK_N": 64, "BLOCK_K": 128, "num_warps": 4, "num_stages": 4, "time_ms": 1164.5943603515625, "status": "ok"}
{"N": 1048576, "K": 65536, "D": 64, "B": 32, "dtype": "fp16", "BLOCK_N": 64, "BLOCK_K": 128, "num_warps": 8, "num_stages": 1, "time_ms": 2045.1396484375, "status": "ok"}
{"N": 1048576, "K": 65536, "D": 64, "B": 32, "dtype": "fp16", "BLOCK_N": 64, "BLOCK_K": 128, "num_warps": 8, "num_stages": 2, "time_ms": 1762.0130615234375, "status": "ok"}
{"N": 1048576, "K": 65536, "D": 64, "B": 32, "dtype": "fp16", "BLOCK_N": 64, "BLOCK_K": 128, "num_warps": 8, "num_stages": 4, "time_ms": 1604.46630859375, "status": "ok"}
{"N": 1048576, "K": 65536, "D": 64, "B": 32, "dtype": "fp16", "BLOCK_N": 128, "BLOCK_K": 32, "num_warps": 4, "num_stages": 1, "time_ms": 1315.331787109375, "status": "ok"}
{"N": 1048576, "K": 65536, "D": 64, "B": 32, "dtype": "fp16", "BLOCK_N": 128, "BLOCK_K": 32, "num_warps": 4, "num_stages": 2, "time_ms": 1284.00830078125, "status": "ok"}
{"N": 1048576, "K": 65536, "D": 64, "B": 32, "dtype": "fp16", "BLOCK_N": 128, "BLOCK_K": 32, "num_warps": 4, "num_stages": 4, "time_ms": 1309.5443115234375, "status": "ok"}
{"N": 1048576, "K": 65536, "D": 64, "B": 32, "dtype": "fp16", "BLOCK_N": 128, "BLOCK_K": 32, "num_warps": 8, "num_stages": 1, "time_ms": 1381.4959716796875, "status": "ok"}
{"N": 1048576, "K": 65536, "D": 64, "B": 32, "dtype": "fp16", "BLOCK_N": 128, "BLOCK_K": 32, "num_warps": 8, "num_stages": 2, "time_ms": 1446.405517578125, "status": "ok"}
{"N": 1048576, "K": 65536, "D": 64, "B": 32, "dtype": "fp16", "BLOCK_N": 128, "BLOCK_K": 32, "num_warps": 8, "num_stages": 4, "time_ms": 1404.874267578125, "status": "ok"}
{"N": 1048576, "K": 65536, "D": 64, "B": 32, "dtype": "fp16", "BLOCK_N": 128, "BLOCK_K": 64, "num_warps": 4, "num_stages": 1, "time_ms": 1262.08740234375, "status": "ok"}
{"N": 1048576, "K": 65536, "D": 64, "B": 32, "dtype": "fp16", "BLOCK_N": 128, "BLOCK_K": 64, "num_warps": 4, "num_stages": 2, "time_ms": 1154.6878662109375, "status": "ok"}
{"N": 1048576, "K": 65536, "D": 64, "B": 32, "dtype": "fp16", "BLOCK_N": 128, "BLOCK_K": 64, "num_warps": 4, "num_stages": 4, "time_ms": 1161.3892822265625, "status": "ok"}
{"N": 1048576, "K": 65536, "D": 64, "B": 32, "dtype": "fp16", "BLOCK_N": 128, "BLOCK_K": 64, "num_warps": 8, "num_stages": 1, "time_ms": 2069.994384765625, "status": "ok"}
{"N": 1048576, "K": 65536, "D": 64, "B": 32, "dtype": "fp16", "BLOCK_N": 128, "BLOCK_K": 64, "num_warps": 8, "num_stages": 2, "time_ms": 1964.13134765625, "status": "ok"}
{"N": 1048576, "K": 65536, "D": 64, "B": 32, "dtype": "fp16", "BLOCK_N": 128, "BLOCK_K": 64, "num_warps": 8, "num_stages": 4, "time_ms": 1231.5140380859375, "status": "ok"}
{"N": 1048576, "K": 65536, "D": 64, "B": 32, "dtype": "fp16", "BLOCK_N": 128, "BLOCK_K": 128, "num_warps": 4, "num_stages": 1, "time_ms": 1360.742919921875, "status": "ok"}
{"N": 1048576, "K": 65536, "D": 64, "B": 32, "dtype": "fp16", "BLOCK_N": 128, "BLOCK_K": 128, "num_warps": 4, "num_stages": 2, "time_ms": 1246.6827392578125, "status": "ok"}
{"N": 1048576, "K": 65536, "D": 64, "B": 32, "dtype": "fp16", "BLOCK_N": 128, "BLOCK_K": 128, "num_warps": 4, "num_stages": 4, "time_ms": 1119.4085693359375, "status": "ok"}
{"N": 1048576, "K": 65536, "D": 64, "B": 32, "dtype": "fp16", "BLOCK_N": 128, "BLOCK_K": 128, "num_warps": 8, "num_stages": 1, "time_ms": 1804.2791748046875, "status": "ok"}
{"N": 1048576, "K": 65536, "D": 64, "B": 32, "dtype": "fp16", "BLOCK_N": 128, "BLOCK_K": 128, "num_warps": 8, "num_stages": 2, "time_ms": 1198.337158203125, "status": "ok"}
{"N": 1048576, "K": 65536, "D": 64, "B": 32, "dtype": "fp16", "BLOCK_N": 128, "BLOCK_K": 128, "num_warps": 8, "num_stages": 4, "time_ms": 1922.479736328125, "status": "ok"}
{"summary": true, "N": 1048576, "K": 65536, "D": 64, "B": 32, "dtype": "fp16", "best": {"N": 1048576, "K": 65536, "D": 64, "B": 32, "dtype": "fp16", "BLOCK_N": 128, "BLOCK_K": 128, "num_warps": 4, "num_stages": 4, "time_ms": 1119.4085693359375, "status": "ok"}, "best_time_ms": 1119.4085693359375, "tuning_seconds": 928.229127407074, "skipped": 0}
