grid_results_h200/N1048576_K4096_D64_B32_fp16.jsonl
{"N": 1048576, "K": 4096, "D": 64, "B": 32, "dtype": "fp16", "BLOCK_N": 32, "BLOCK_K": 32, "num_warps": 4, "num_stages": 1, "time_ms": 213.99880981445312, "status": "ok"}
{"N": 1048576, "K": 4096, "D": 64, "B": 32, "dtype": "fp16", "BLOCK_N": 32, "BLOCK_K": 32, "num_warps": 4, "num_stages": 2, "time_ms": 189.54867553710938, "status": "ok"}
{"N": 1048576, "K": 4096, "D": 64, "B": 32, "dtype": "fp16", "BLOCK_N": 32, "BLOCK_K": 32, "num_warps": 4, "num_stages": 4, "time_ms": 186.26780700683594, "status": "ok"}
{"N": 1048576, "K": 4096, "D": 64, "B": 32, "dtype": "fp16", "BLOCK_N": 32, "BLOCK_K": 32, "num_warps": 8, "num_stages": 1, "time_ms": 343.63287353515625, "status": "ok"}
{"N": 1048576, "K": 4096, "D": 64, "B": 32, "dtype": "fp16", "BLOCK_N": 32, "BLOCK_K": 32, "num_warps": 8, "num_stages": 2, "time_ms": 324.5896911621094, "status": "ok"}
{"N": 1048576, "K": 4096, "D": 64, "B": 32, "dtype": "fp16", "BLOCK_N": 32, "BLOCK_K": 32, "num_warps": 8, "num_stages": 4, "time_ms": 321.01934814453125, "status": "ok"}
{"N": 1048576, "K": 4096, "D": 64, "B": 32, "dtype": "fp16", "BLOCK_N": 32, "BLOCK_K": 64, "num_warps": 4, "num_stages": 1, "time_ms": 181.94659423828125, "status": "ok"}
{"N": 1048576, "K": 4096, "D": 64, "B": 32, "dtype": "fp16", "BLOCK_N": 32, "BLOCK_K": 64, "num_warps": 4, "num_stages": 2, "time_ms": 160.0015411376953, "status": "ok"}
{"N": 1048576, "K": 4096, "D": 64, "B": 32, "dtype": "fp16", "BLOCK_N": 32, "BLOCK_K": 64, "num_warps": 4, "num_stages": 4, "time_ms": 153.19261169433594, "status": "ok"}
{"N": 1048576, "K": 4096, "D": 64, "B": 32, "dtype": "fp16", "BLOCK_N": 32, "BLOCK_K": 64, "num_warps": 8, "num_stages": 1, "time_ms": 219.17347717285156, "status": "ok"}
{"N": 1048576, "K": 4096, "D": 64, "B": 32, "dtype": "fp16", "BLOCK_N": 32, "BLOCK_K": 64, "num_warps": 8, "num_stages": 2, "time_ms": 203.35939025878906, "status": "ok"}
{"N": 1048576, "K": 4096, "D": 64, "B": 32, "dtype": "fp16", "BLOCK_N": 32, "BLOCK_K": 64, "num_warps": 8, "num_stages": 4, "time_ms": 200.94972229003906, "status": "ok"}
{"N": 1048576, "K": 4096, "D": 64, "B": 32, "dtype": "fp16", "BLOCK_N": 32, "BLOCK_K": 128, "num_warps": 4, "num_stages": 1, "time_ms": 142.42239379882812, "status": "ok"}
{"N": 1048576, "K": 4096, "D": 64, "B": 32, "dtype": "fp16", "BLOCK_N": 32, "BLOCK_K": 128, "num_warps": 4, "num_stages": 2, "time_ms": 121.63350677490234, "status": "ok"}
{"N": 1048576, "K": 4096, "D": 64, "B": 32, "dtype": "fp16", "BLOCK_N": 32, "BLOCK_K": 128, "num_warps": 4, "num_stages": 4, "time_ms": 124.92691040039062, "status": "ok"}
{"N": 1048576, "K": 4096, "D": 64, "B": 32, "dtype": "fp16", "BLOCK_N": 32, "BLOCK_K": 128, "num_warps": 8, "num_stages": 1, "time_ms": 234.11021423339844, "status": "ok"}
{"N": 1048576, "K": 4096, "D": 64, "B": 32, "dtype": "fp16", "BLOCK_N": 32, "BLOCK_K": 128, "num_warps": 8, "num_stages": 2, "time_ms": 192.49462890625, "status": "ok"}
{"N": 1048576, "K": 4096, "D": 64, "B": 32, "dtype": "fp16", "BLOCK_N": 32, "BLOCK_K": 128, "num_warps": 8, "num_stages": 4, "time_ms": 186.33692932128906, "status": "ok"}
{"N": 1048576, "K": 4096, "D": 64, "B": 32, "dtype": "fp16", "BLOCK_N": 64, "BLOCK_K": 32, "num_warps": 4, "num_stages": 1, "time_ms": 84.41970825195312, "status": "ok"}
{"N": 1048576, "K": 4096, "D": 64, "B": 32, "dtype": "fp16", "BLOCK_N": 64, "BLOCK_K": 32, "num_warps": 4, "num_stages": 2, "time_ms": 82.60342407226562, "status": "ok"}
{"N": 1048576, "K": 4096, "D": 64, "B": 32, "dtype": "fp16", "BLOCK_N": 64, "BLOCK_K": 32, "num_warps": 4, "num_stages": 4, "time_ms": 83.97615814208984, "status": "ok"}
{"N": 1048576, "K": 4096, "D": 64, "B": 32, "dtype": "fp16", "BLOCK_N": 64, "BLOCK_K": 32, "num_warps": 8, "num_stages": 1, "time_ms": 170.18374633789062, "status": "ok"}
{"N": 1048576, "K": 4096, "D": 64, "B": 32, "dtype": "fp16", "BLOCK_N": 64, "BLOCK_K": 32, "num_warps": 8, "num_stages": 2, "time_ms": 158.38636779785156, "status": "ok"}
{"N": 1048576, "K": 4096, "D": 64, "B": 32, "dtype": "fp16", "BLOCK_N": 64, "BLOCK_K": 32, "num_warps": 8, "num_stages": 4, "time_ms": 154.8179473876953, "status": "ok"}
{"N": 1048576, "K": 4096, "D": 64, "B": 32, "dtype": "fp16", "BLOCK_N": 64, "BLOCK_K": 64, "num_warps": 4, "num_stages": 1, "time_ms": 79.6124496459961, "status": "ok"}
{"N": 1048576, "K": 4096, "D": 64, "B": 32, "dtype": "fp16", "BLOCK_N": 64, "BLOCK_K": 64, "num_warps": 4, "num_stages": 2, "time_ms": 75.58534240722656, "status": "ok"}
{"N": 1048576, "K": 4096, "D": 64, "B": 32, "dtype": "fp16", "BLOCK_N": 64, "BLOCK_K": 64, "num_warps": 4, "num_stages": 4, "time_ms": 76.10899353027344, "status": "ok"}
{"N": 1048576, "K": 4096, "D": 64, "B": 32, "dtype": "fp16", "BLOCK_N": 64, "BLOCK_K": 64, "num_warps": 8, "num_stages": 1, "time_ms": 121.42972564697266, "status": "ok"}
{"N": 1048576, "K": 4096, "D": 64, "B": 32, "dtype": "fp16", "BLOCK_N": 64, "BLOCK_K": 64, "num_warps": 8, "num_stages": 2, "time_ms": 115.32710266113281, "status": "ok"}
{"N": 1048576, "K": 4096, "D": 64, "B": 32, "dtype": "fp16", "BLOCK_N": 64, "BLOCK_K": 64, "num_warps": 8, "num_stages": 4, "time_ms": 113.86054229736328, "status": "ok"}
{"N": 1048576, "K": 4096, "D": 64, "B": 32, "dtype": "fp16", "BLOCK_N": 64, "BLOCK_K": 128, "num_warps": 4, "num_stages": 1, "time_ms": 75.16566467285156, "status": "ok"}
{"N": 1048576, "K": 4096, "D": 64, "B": 32, "dtype": "fp16", "BLOCK_N": 64, "BLOCK_K": 128, "num_warps": 4, "num_stages": 2, "time_ms": 72.93673706054688, "status": "ok"}
{"N": 1048576, "K": 4096, "D": 64, "B": 32, "dtype": "fp16", "BLOCK_N": 64, "BLOCK_K": 128, "num_warps": 4, "num_stages": 4, "time_ms": 72.9119644165039, "status": "ok"}
{"N": 1048576, "K": 4096, "D": 64, "B": 32, "dtype": "fp16", "BLOCK_N": 64, "BLOCK_K": 128, "num_warps": 8, "num_stages": 1, "time_ms": 123.4381103515625, "status": "ok"}
{"N": 1048576, "K": 4096, "D": 64, "B": 32, "dtype": "fp16", "BLOCK_N": 64, "BLOCK_K": 128, "num_warps": 8, "num_stages": 2, "time_ms": 107.25206756591797, "status": "ok"}
{"N": 1048576, "K": 4096, "D": 64, "B": 32, "dtype": "fp16", "BLOCK_N": 64, "BLOCK_K": 128, "num_warps": 8, "num_stages": 4, "time_ms": 102.52572631835938, "status": "ok"}
{"N": 1048576, "K": 4096, "D": 64, "B": 32, "dtype": "fp16", "BLOCK_N": 128, "BLOCK_K": 32, "num_warps": 4, "num_stages": 1, "time_ms": 82.84159851074219, "status": "ok"}
{"N": 1048576, "K": 4096, "D": 64, "B": 32, "dtype": "fp16", "BLOCK_N": 128, "BLOCK_K": 32, "num_warps": 4, "num_stages": 2, "time_ms": 80.21568298339844, "status": "ok"}
{"N": 1048576, "K": 4096, "D": 64, "B": 32, "dtype": "fp16", "BLOCK_N": 128, "BLOCK_K": 32, "num_warps": 4, "num_stages": 4, "time_ms": 81.74079895019531, "status": "ok"}
{"N": 1048576, "K": 4096, "D": 64, "B": 32, "dtype": "fp16", "BLOCK_N": 128, "BLOCK_K": 32, "num_warps": 8, "num_stages": 1, "time_ms": 86.22879791259766, "status": "ok"}
{"N": 1048576, "K": 4096, "D": 64, "B": 32, "dtype": "fp16", "BLOCK_N": 128, "BLOCK_K": 32, "num_warps": 8, "num_stages": 2, "time_ms": 89.99017333984375, "status": "ok"}
{"N": 1048576, "K": 4096, "D": 64, "B": 32, "dtype": "fp16", "BLOCK_N": 128, "BLOCK_K": 32, "num_warps": 8, "num_stages": 4, "time_ms": 88.56963348388672, "status": "ok"}
{"N": 1048576, "K": 4096, "D": 64, "B": 32, "dtype": "fp16", "BLOCK_N": 128, "BLOCK_K": 64, "num_warps": 4, "num_stages": 1, "time_ms": 78.96678161621094, "status": "ok"}
{"N": 1048576, "K": 4096, "D": 64, "B": 32, "dtype": "fp16", "BLOCK_N": 128, "BLOCK_K": 64, "num_warps": 4, "num_stages": 2, "time_ms": 72.11619567871094, "status": "ok"}
{"N": 1048576, "K": 4096, "D": 64, "B": 32, "dtype": "fp16", "BLOCK_N": 128, "BLOCK_K": 64, "num_warps": 4, "num_stages": 4, "time_ms": 73.48722839355469, "status": "ok"}
{"N": 1048576, "K": 4096, "D": 64, "B": 32, "dtype": "fp16", "BLOCK_N": 128, "BLOCK_K": 64, "num_warps": 8, "num_stages": 1, "time_ms": 80.50390625, "status": "ok"}
{"N": 1048576, "K": 4096, "D": 64, "B": 32, "dtype": "fp16", "BLOCK_N": 128, "BLOCK_K": 64, "num_warps": 8, "num_stages": 2, "time_ms": 77.70716857910156, "status": "ok"}
{"N": 1048576, "K": 4096, "D": 64, "B": 32, "dtype": "fp16", "BLOCK_N": 128, "BLOCK_K": 64, "num_warps": 8, "num_stages": 4, "time_ms": 78.21196746826172, "status": "ok"}
{"N": 1048576, "K": 4096, "D": 64, "B": 32, "dtype": "fp16", "BLOCK_N": 128, "BLOCK_K": 128, "num_warps": 4, "num_stages": 1, "time_ms": 84.35020446777344, "status": "ok"}
{"N": 1048576, "K": 4096, "D": 64, "B": 32, "dtype": "fp16", "BLOCK_N": 128, "BLOCK_K": 128, "num_warps": 4, "num_stages": 2, "time_ms": 78.64214324951172, "status": "ok"}
{"N": 1048576, "K": 4096, "D": 64, "B": 32, "dtype": "fp16", "BLOCK_N": 128, "BLOCK_K": 128, "num_warps": 4, "num_stages": 4, "time_ms": 71.10594940185547, "status": "ok"}
{"N": 1048576, "K": 4096, "D": 64, "B": 32, "dtype": "fp16", "BLOCK_N": 128, "BLOCK_K": 128, "num_warps": 8, "num_stages": 1, "time_ms": 110.09977722167969, "status": "ok"}
{"N": 1048576, "K": 4096, "D": 64, "B": 32, "dtype": "fp16", "BLOCK_N": 128, "BLOCK_K": 128, "num_warps": 8, "num_stages": 2, "time_ms": 76.0508804321289, "status": "ok"}
{"N": 1048576, "K": 4096, "D": 64, "B": 32, "dtype": "fp16", "BLOCK_N": 128, "BLOCK_K": 128, "num_warps": 8, "num_stages": 4, "time_ms": 74.37606048583984, "status": "ok"}
{"summary": true, "N": 1048576, "K": 4096, "D": 64, "B": 32, "dtype": "fp16", "best": {"N": 1048576, "K": 4096, "D": 64, "B": 32, "dtype": "fp16", "BLOCK_N": 128, "BLOCK_K": 128, "num_warps": 4, "num_stages": 4, "time_ms": 71.10594940185547, "status": "ok"}, "best_time_ms": 71.10594940185547, "tuning_seconds": 65.49958610534668, "skipped": 0}
