grid_results_h200/N10485760_K256_D64_B1_fp16.jsonl
{"N": 10485760, "K": 256, "D": 64, "B": 1, "dtype": "fp16", "BLOCK_N": 32, "BLOCK_K": 32, "num_warps": 4, "num_stages": 1, "time_ms": 4.247200012207031, "status": "ok"}
{"N": 10485760, "K": 256, "D": 64, "B": 1, "dtype": "fp16", "BLOCK_N": 32, "BLOCK_K": 32, "num_warps": 4, "num_stages": 2, "time_ms": 3.9390718936920166, "status": "ok"}
{"N": 10485760, "K": 256, "D": 64, "B": 1, "dtype": "fp16", "BLOCK_N": 32, "BLOCK_K": 32, "num_warps": 4, "num_stages": 4, "time_ms": 4.04585599899292, "status": "ok"}
{"N": 10485760, "K": 256, "D": 64, "B": 1, "dtype": "fp16", "BLOCK_N": 32, "BLOCK_K": 32, "num_warps": 8, "num_stages": 1, "time_ms": 6.859936237335205, "status": "ok"}
{"N": 10485760, "K": 256, "D": 64, "B": 1, "dtype": "fp16", "BLOCK_N": 32, "BLOCK_K": 32, "num_warps": 8, "num_stages": 2, "time_ms": 6.676767826080322, "status": "ok"}
{"N": 10485760, "K": 256, "D": 64, "B": 1, "dtype": "fp16", "BLOCK_N": 32, "BLOCK_K": 32, "num_warps": 8, "num_stages": 4, "time_ms": 6.780191898345947, "status": "ok"}
{"N": 10485760, "K": 256, "D": 64, "B": 1, "dtype": "fp16", "BLOCK_N": 32, "BLOCK_K": 64, "num_warps": 4, "num_stages": 1, "time_ms": 3.641472101211548, "status": "ok"}
{"N": 10485760, "K": 256, "D": 64, "B": 1, "dtype": "fp16", "BLOCK_N": 32, "BLOCK_K": 64, "num_warps": 4, "num_stages": 2, "time_ms": 3.4578239917755127, "status": "ok"}
{"N": 10485760, "K": 256, "D": 64, "B": 1, "dtype": "fp16", "BLOCK_N": 32, "BLOCK_K": 64, "num_warps": 4, "num_stages": 4, "time_ms": 3.6194241046905518, "status": "ok"}
{"N": 10485760, "K": 256, "D": 64, "B": 1, "dtype": "fp16", "BLOCK_N": 32, "BLOCK_K": 64, "num_warps": 8, "num_stages": 1, "time_ms": 4.753280162811279, "status": "ok"}
{"N": 10485760, "K": 256, "D": 64, "B": 1, "dtype": "fp16", "BLOCK_N": 32, "BLOCK_K": 64, "num_warps": 8, "num_stages": 2, "time_ms": 4.43225622177124, "status": "ok"}
{"N": 10485760, "K": 256, "D": 64, "B": 1, "dtype": "fp16", "BLOCK_N": 32, "BLOCK_K": 64, "num_warps": 8, "num_stages": 4, "time_ms": 4.741119861602783, "status": "ok"}
{"N": 10485760, "K": 256, "D": 64, "B": 1, "dtype": "fp16", "BLOCK_N": 32, "BLOCK_K": 128, "num_warps": 4, "num_stages": 1, "time_ms": 2.9995200634002686, "status": "ok"}
{"N": 10485760, "K": 256, "D": 64, "B": 1, "dtype": "fp16", "BLOCK_N": 32, "BLOCK_K": 128, "num_warps": 4, "num_stages": 2, "time_ms": 3.044447898864746, "status": "ok"}
{"N": 10485760, "K": 256, "D": 64, "B": 1, "dtype": "fp16", "BLOCK_N": 32, "BLOCK_K": 128, "num_warps": 4, "num_stages": 4, "time_ms": 3.3382720947265625, "status": "ok"}
{"N": 10485760, "K": 256, "D": 64, "B": 1, "dtype": "fp16", "BLOCK_N": 32, "BLOCK_K": 128, "num_warps": 8, "num_stages": 1, "time_ms": 4.495999813079834, "status": "ok"}
{"N": 10485760, "K": 256, "D": 64, "B": 1, "dtype": "fp16", "BLOCK_N": 32, "BLOCK_K": 128, "num_warps": 8, "num_stages": 2, "time_ms": 4.43225622177124, "status": "ok"}
{"N": 10485760, "K": 256, "D": 64, "B": 1, "dtype": "fp16", "BLOCK_N": 32, "BLOCK_K": 128, "num_warps": 8, "num_stages": 4, "time_ms": 4.790815830230713, "status": "ok"}
{"N": 10485760, "K": 256, "D": 64, "B": 1, "dtype": "fp16", "BLOCK_N": 64, "BLOCK_K": 32, "num_warps": 4, "num_stages": 1, "time_ms": 1.7965919971466064, "status": "ok"}
{"N": 10485760, "K": 256, "D": 64, "B": 1, "dtype": "fp16", "BLOCK_N": 64, "BLOCK_K": 32, "num_warps": 4, "num_stages": 2, "time_ms": 1.7821919918060303, "status": "ok"}
{"N": 10485760, "K": 256, "D": 64, "B": 1, "dtype": "fp16", "BLOCK_N": 64, "BLOCK_K": 32, "num_warps": 4, "num_stages": 4, "time_ms": 1.8142399787902832, "status": "ok"}
{"N": 10485760, "K": 256, "D": 64, "B": 1, "dtype": "fp16", "BLOCK_N": 64, "BLOCK_K": 32, "num_warps": 8, "num_stages": 1, "time_ms": 3.429663896560669, "status": "ok"}
{"N": 10485760, "K": 256, "D": 64, "B": 1, "dtype": "fp16", "BLOCK_N": 64, "BLOCK_K": 32, "num_warps": 8, "num_stages": 2, "time_ms": 3.3282880783081055, "status": "ok"}
{"N": 10485760, "K": 256, "D": 64, "B": 1, "dtype": "fp16", "BLOCK_N": 64, "BLOCK_K": 32, "num_warps": 8, "num_stages": 4, "time_ms": 3.3939199447631836, "status": "ok"}
{"N": 10485760, "K": 256, "D": 64, "B": 1, "dtype": "fp16", "BLOCK_N": 64, "BLOCK_K": 64, "num_warps": 4, "num_stages": 1, "time_ms": 1.76009601354599, "status": "ok"}
{"N": 10485760, "K": 256, "D": 64, "B": 1, "dtype": "fp16", "BLOCK_N": 64, "BLOCK_K": 64, "num_warps": 4, "num_stages": 2, "time_ms": 1.6713599562644958, "status": "ok"}
{"N": 10485760, "K": 256, "D": 64, "B": 1, "dtype": "fp16", "BLOCK_N": 64, "BLOCK_K": 64, "num_warps": 4, "num_stages": 4, "time_ms": 1.7339199781417847, "status": "ok"}
{"N": 10485760, "K": 256, "D": 64, "B": 1, "dtype": "fp16", "BLOCK_N": 64, "BLOCK_K": 64, "num_warps": 8, "num_stages": 1, "time_ms": 2.579551935195923, "status": "ok"}
{"N": 10485760, "K": 256, "D": 64, "B": 1, "dtype": "fp16", "BLOCK_N": 64, "BLOCK_K": 64, "num_warps": 8, "num_stages": 2, "time_ms": 2.594464063644409, "status": "ok"}
{"N": 10485760, "K": 256, "D": 64, "B": 1, "dtype": "fp16", "BLOCK_N": 64, "BLOCK_K": 64, "num_warps": 8, "num_stages": 4, "time_ms": 2.609407901763916, "status": "ok"}
{"N": 10485760, "K": 256, "D": 64, "B": 1, "dtype": "fp16", "BLOCK_N": 64, "BLOCK_K": 128, "num_warps": 4, "num_stages": 1, "time_ms": 1.9629759788513184, "status": "ok"}
{"N": 10485760, "K": 256, "D": 64, "B": 1, "dtype": "fp16", "BLOCK_N": 64, "BLOCK_K": 128, "num_warps": 4, "num_stages": 2, "time_ms": 1.7740000486373901, "status": "ok"}
{"N": 10485760, "K": 256, "D": 64, "B": 1, "dtype": "fp16", "BLOCK_N": 64, "BLOCK_K": 128, "num_warps": 4, "num_stages": 4, "time_ms": 2.041216015815735, "status": "ok"}
{"N": 10485760, "K": 256, "D": 64, "B": 1, "dtype": "fp16", "BLOCK_N": 64, "BLOCK_K": 128, "num_warps": 8, "num_stages": 1, "time_ms": 2.6246719360351562, "status": "ok"}
{"N": 10485760, "K": 256, "D": 64, "B": 1, "dtype": "fp16", "BLOCK_N": 64, "BLOCK_K": 128, "num_warps": 8, "num_stages": 2, "time_ms": 2.762432098388672, "status": "ok"}
{"N": 10485760, "K": 256, "D": 64, "B": 1, "dtype": "fp16", "BLOCK_N": 64, "BLOCK_K": 128, "num_warps": 8, "num_stages": 4, "time_ms": 2.904576063156128, "status": "ok"}
{"N": 10485760, "K": 256, "D": 64, "B": 1, "dtype": "fp16", "BLOCK_N": 128, "BLOCK_K": 32, "num_warps": 4, "num_stages": 1, "time_ms": 1.7500960230827332, "status": "ok"}
{"N": 10485760, "K": 256, "D": 64, "B": 1, "dtype": "fp16", "BLOCK_N": 128, "BLOCK_K": 32, "num_warps": 4, "num_stages": 2, "time_ms": 1.7071999907493591, "status": "ok"}
{"N": 10485760, "K": 256, "D": 64, "B": 1, "dtype": "fp16", "BLOCK_N": 128, "BLOCK_K": 32, "num_warps": 4, "num_stages": 4, "time_ms": 1.725376009941101, "status": "ok"}
{"N": 10485760, "K": 256, "D": 64, "B": 1, "dtype": "fp16", "BLOCK_N": 128, "BLOCK_K": 32, "num_warps": 8, "num_stages": 1, "time_ms": 1.8384960293769836, "status": "ok"}
{"N": 10485760, "K": 256, "D": 64, "B": 1, "dtype": "fp16", "BLOCK_N": 128, "BLOCK_K": 32, "num_warps": 8, "num_stages": 2, "time_ms": 1.9417439699172974, "status": "ok"}
{"N": 10485760, "K": 256, "D": 64, "B": 1, "dtype": "fp16", "BLOCK_N": 128, "BLOCK_K": 32, "num_warps": 8, "num_stages": 4, "time_ms": 1.8822880387306213, "status": "ok"}
{"N": 10485760, "K": 256, "D": 64, "B": 1, "dtype": "fp16", "BLOCK_N": 128, "BLOCK_K": 64, "num_warps": 4, "num_stages": 1, "time_ms": 1.6840479969978333, "status": "ok"}
{"N": 10485760, "K": 256, "D": 64, "B": 1, "dtype": "fp16", "BLOCK_N": 128, "BLOCK_K": 64, "num_warps": 4, "num_stages": 2, "time_ms": 1.549888014793396, "status": "ok"}
{"N": 10485760, "K": 256, "D": 64, "B": 1, "dtype": "fp16", "BLOCK_N": 128, "BLOCK_K": 64, "num_warps": 4, "num_stages": 4, "time_ms": 1.6178239583969116, "status": "ok"}
{"N": 10485760, "K": 256, "D": 64, "B": 1, "dtype": "fp16", "BLOCK_N": 128, "BLOCK_K": 64, "num_warps": 8, "num_stages": 1, "time_ms": 1.8381279706954956, "status": "ok"}
{"N": 10485760, "K": 256, "D": 64, "B": 1, "dtype": "fp16", "BLOCK_N": 128, "BLOCK_K": 64, "num_warps": 8, "num_stages": 2, "time_ms": 1.776144027709961, "status": "ok"}
{"N": 10485760, "K": 256, "D": 64, "B": 1, "dtype": "fp16", "BLOCK_N": 128, "BLOCK_K": 64, "num_warps": 8, "num_stages": 4, "time_ms": 1.7987839579582214, "status": "ok"}
{"N": 10485760, "K": 256, "D": 64, "B": 1, "dtype": "fp16", "BLOCK_N": 128, "BLOCK_K": 128, "num_warps": 4, "num_stages": 1, "time_ms": 1.829360008239746, "status": "ok"}
{"N": 10485760, "K": 256, "D": 64, "B": 1, "dtype": "fp16", "BLOCK_N": 128, "BLOCK_K": 128, "num_warps": 4, "num_stages": 2, "time_ms": 1.8297759890556335, "status": "ok"}
{"N": 10485760, "K": 256, "D": 64, "B": 1, "dtype": "fp16", "BLOCK_N": 128, "BLOCK_K": 128, "num_warps": 4, "num_stages": 4, "time_ms": 1.8666880130767822, "status": "ok"}
{"N": 10485760, "K": 256, "D": 64, "B": 1, "dtype": "fp16", "BLOCK_N": 128, "BLOCK_K": 128, "num_warps": 8, "num_stages": 1, "time_ms": 2.5750720500946045, "status": "ok"}
{"N": 10485760, "K": 256, "D": 64, "B": 1, "dtype": "fp16", "BLOCK_N": 128, "BLOCK_K": 128, "num_warps": 8, "num_stages": 2, "time_ms": 2.4548799991607666, "status": "ok"}
{"N": 10485760, "K": 256, "D": 64, "B": 1, "dtype": "fp16", "BLOCK_N": 128, "BLOCK_K": 128, "num_warps": 8, "num_stages": 4, "time_ms": 2.4382400512695312, "status": "ok"}
{"summary": true, "N": 10485760, "K": 256, "D": 64, "B": 1, "dtype": "fp16", "best": {"N": 10485760, "K": 256, "D": 64, "B": 1, "dtype": "fp16", "BLOCK_N": 128, "BLOCK_K": 64, "num_warps": 4, "num_stages": 2, "time_ms": 1.549888014793396, "status": "ok"}, "best_time_ms": 1.549888014793396, "tuning_seconds": 10.671726703643799, "skipped": 0}
