grid_results_h200/N10485760_K1024_D128_B1_fp16.jsonl
{"N": 10485760, "K": 1024, "D": 128, "B": 1, "dtype": "fp16", "BLOCK_N": 32, "BLOCK_K": 32, "num_warps": 4, "num_stages": 1, "time_ms": 25.826976776123047, "status": "ok"}
{"N": 10485760, "K": 1024, "D": 128, "B": 1, "dtype": "fp16", "BLOCK_N": 32, "BLOCK_K": 32, "num_warps": 4, "num_stages": 2, "time_ms": 21.250431060791016, "status": "ok"}
{"N": 10485760, "K": 1024, "D": 128, "B": 1, "dtype": "fp16", "BLOCK_N": 32, "BLOCK_K": 32, "num_warps": 4, "num_stages": 4, "time_ms": 21.63475227355957, "status": "ok"}
{"N": 10485760, "K": 1024, "D": 128, "B": 1, "dtype": "fp16", "BLOCK_N": 32, "BLOCK_K": 32, "num_warps": 8, "num_stages": 1, "time_ms": 38.21094512939453, "status": "ok"}
{"N": 10485760, "K": 1024, "D": 128, "B": 1, "dtype": "fp16", "BLOCK_N": 32, "BLOCK_K": 32, "num_warps": 8, "num_stages": 2, "time_ms": 34.944766998291016, "status": "ok"}
{"N": 10485760, "K": 1024, "D": 128, "B": 1, "dtype": "fp16", "BLOCK_N": 32, "BLOCK_K": 32, "num_warps": 8, "num_stages": 4, "time_ms": 34.698177337646484, "status": "ok"}
{"N": 10485760, "K": 1024, "D": 128, "B": 1, "dtype": "fp16", "BLOCK_N": 32, "BLOCK_K": 64, "num_warps": 4, "num_stages": 1, "time_ms": 22.064992904663086, "status": "ok"}
{"N": 10485760, "K": 1024, "D": 128, "B": 1, "dtype": "fp16", "BLOCK_N": 32, "BLOCK_K": 64, "num_warps": 4, "num_stages": 2, "time_ms": 17.584928512573242, "status": "ok"}
{"N": 10485760, "K": 1024, "D": 128, "B": 1, "dtype": "fp16", "BLOCK_N": 32, "BLOCK_K": 64, "num_warps": 4, "num_stages": 4, "time_ms": 19.371583938598633, "status": "ok"}
{"N": 10485760, "K": 1024, "D": 128, "B": 1, "dtype": "fp16", "BLOCK_N": 32, "BLOCK_K": 64, "num_warps": 8, "num_stages": 1, "time_ms": 26.326719284057617, "status": "ok"}
{"N": 10485760, "K": 1024, "D": 128, "B": 1, "dtype": "fp16", "BLOCK_N": 32, "BLOCK_K": 64, "num_warps": 8, "num_stages": 2, "time_ms": 22.750303268432617, "status": "ok"}
{"N": 10485760, "K": 1024, "D": 128, "B": 1, "dtype": "fp16", "BLOCK_N": 32, "BLOCK_K": 64, "num_warps": 8, "num_stages": 4, "time_ms": 23.422719955444336, "status": "ok"}
{"N": 10485760, "K": 1024, "D": 128, "B": 1, "dtype": "fp16", "BLOCK_N": 32, "BLOCK_K": 128, "num_warps": 4, "num_stages": 1, "time_ms": 17.59177589416504, "status": "ok"}
{"N": 10485760, "K": 1024, "D": 128, "B": 1, "dtype": "fp16", "BLOCK_N": 32, "BLOCK_K": 128, "num_warps": 4, "num_stages": 2, "time_ms": 13.96729564666748, "status": "ok"}
{"N": 10485760, "K": 1024, "D": 128, "B": 1, "dtype": "fp16", "BLOCK_N": 32, "BLOCK_K": 128, "num_warps": 4, "num_stages": 4, "time_ms": 18.24687957763672, "status": "ok"}
{"N": 10485760, "K": 1024, "D": 128, "B": 1, "dtype": "fp16", "BLOCK_N": 32, "BLOCK_K": 128, "num_warps": 8, "num_stages": 1, "time_ms": 24.14463996887207, "status": "ok"}
{"N": 10485760, "K": 1024, "D": 128, "B": 1, "dtype": "fp16", "BLOCK_N": 32, "BLOCK_K": 128, "num_warps": 8, "num_stages": 2, "time_ms": 21.130016326904297, "status": "ok"}
{"N": 10485760, "K": 1024, "D": 128, "B": 1, "dtype": "fp16", "BLOCK_N": 32, "BLOCK_K": 128, "num_warps": 8, "num_stages": 4, "time_ms": 22.52579116821289, "status": "ok"}
{"N": 10485760, "K": 1024, "D": 128, "B": 1, "dtype": "fp16", "BLOCK_N": 64, "BLOCK_K": 32, "num_warps": 4, "num_stages": 1, "time_ms": 10.378463745117188, "status": "ok"}
{"N": 10485760, "K": 1024, "D": 128, "B": 1, "dtype": "fp16", "BLOCK_N": 64, "BLOCK_K": 32, "num_warps": 4, "num_stages": 2, "time_ms": 8.670975685119629, "status": "ok"}
{"N": 10485760, "K": 1024, "D": 128, "B": 1, "dtype": "fp16", "BLOCK_N": 64, "BLOCK_K": 32, "num_warps": 4, "num_stages": 4, "time_ms": 9.309663772583008, "status": "ok"}
{"N": 10485760, "K": 1024, "D": 128, "B": 1, "dtype": "fp16", "BLOCK_N": 64, "BLOCK_K": 32, "num_warps": 8, "num_stages": 1, "time_ms": 18.9751033782959, "status": "ok"}
{"N": 10485760, "K": 1024, "D": 128, "B": 1, "dtype": "fp16", "BLOCK_N": 64, "BLOCK_K": 32, "num_warps": 8, "num_stages": 2, "time_ms": 16.441984176635742, "status": "ok"}
{"N": 10485760, "K": 1024, "D": 128, "B": 1, "dtype": "fp16", "BLOCK_N": 64, "BLOCK_K": 32, "num_warps": 8, "num_stages": 4, "time_ms": 16.762239456176758, "status": "ok"}
{"N": 10485760, "K": 1024, "D": 128, "B": 1, "dtype": "fp16", "BLOCK_N": 64, "BLOCK_K": 64, "num_warps": 4, "num_stages": 1, "time_ms": 8.882399559020996, "status": "ok"}
{"N": 10485760, "K": 1024, "D": 128, "B": 1, "dtype": "fp16", "BLOCK_N": 64, "BLOCK_K": 64, "num_warps": 4, "num_stages": 2, "time_ms": 7.846496105194092, "status": "ok"}
{"N": 10485760, "K": 1024, "D": 128, "B": 1, "dtype": "fp16", "BLOCK_N": 64, "BLOCK_K": 64, "num_warps": 4, "num_stages": 4, "time_ms": 8.709152221679688, "status": "ok"}
{"N": 10485760, "K": 1024, "D": 128, "B": 1, "dtype": "fp16", "BLOCK_N": 64, "BLOCK_K": 64, "num_warps": 8, "num_stages": 1, "time_ms": 13.223008155822754, "status": "ok"}
{"N": 10485760, "K": 1024, "D": 128, "B": 1, "dtype": "fp16", "BLOCK_N": 64, "BLOCK_K": 64, "num_warps": 8, "num_stages": 2, "time_ms": 11.6015043258667, "status": "ok"}
{"N": 10485760, "K": 1024, "D": 128, "B": 1, "dtype": "fp16", "BLOCK_N": 64, "BLOCK_K": 64, "num_warps": 8, "num_stages": 4, "time_ms": 13.438112258911133, "status": "ok"}
{"N": 10485760, "K": 1024, "D": 128, "B": 1, "dtype": "fp16", "BLOCK_N": 64, "BLOCK_K": 128, "num_warps": 4, "num_stages": 1, "time_ms": 8.288703918457031, "status": "ok"}
{"N": 10485760, "K": 1024, "D": 128, "B": 1, "dtype": "fp16", "BLOCK_N": 64, "BLOCK_K": 128, "num_warps": 4, "num_stages": 2, "time_ms": 8.33296012878418, "status": "ok"}
{"N": 10485760, "K": 1024, "D": 128, "B": 1, "dtype": "fp16", "BLOCK_N": 64, "BLOCK_K": 128, "num_warps": 4, "num_stages": 4, "time_ms": 11.673088073730469, "status": "ok"}
{"N": 10485760, "K": 1024, "D": 128, "B": 1, "dtype": "fp16", "BLOCK_N": 64, "BLOCK_K": 128, "num_warps": 8, "num_stages": 1, "time_ms": 12.543168067932129, "status": "ok"}
{"N": 10485760, "K": 1024, "D": 128, "B": 1, "dtype": "fp16", "BLOCK_N": 64, "BLOCK_K": 128, "num_warps": 8, "num_stages": 2, "time_ms": 11.089599609375, "status": "ok"}
{"N": 10485760, "K": 1024, "D": 128, "B": 1, "dtype": "fp16", "BLOCK_N": 64, "BLOCK_K": 128, "num_warps": 8, "num_stages": 4, "time_ms": 13.680831909179688, "status": "ok"}
{"N": 10485760, "K": 1024, "D": 128, "B": 1, "dtype": "fp16", "BLOCK_N": 128, "BLOCK_K": 32, "num_warps": 4, "num_stages": 1, "time_ms": 8.84819221496582, "status": "ok"}
{"N": 10485760, "K": 1024, "D": 128, "B": 1, "dtype": "fp16", "BLOCK_N": 128, "BLOCK_K": 32, "num_warps": 4, "num_stages": 2, "time_ms": 8.989215850830078, "status": "ok"}
{"N": 10485760, "K": 1024, "D": 128, "B": 1, "dtype": "fp16", "BLOCK_N": 128, "BLOCK_K": 32, "num_warps": 4, "num_stages": 4, "time_ms": 9.506112098693848, "status": "ok"}
{"N": 10485760, "K": 1024, "D": 128, "B": 1, "dtype": "fp16", "BLOCK_N": 128, "BLOCK_K": 32, "num_warps": 8, "num_stages": 1, "time_ms": 9.180255889892578, "status": "ok"}
{"N": 10485760, "K": 1024, "D": 128, "B": 1, "dtype": "fp16", "BLOCK_N": 128, "BLOCK_K": 32, "num_warps": 8, "num_stages": 2, "time_ms": 8.899007797241211, "status": "ok"}
{"N": 10485760, "K": 1024, "D": 128, "B": 1, "dtype": "fp16", "BLOCK_N": 128, "BLOCK_K": 32, "num_warps": 8, "num_stages": 4, "time_ms": 9.312031745910645, "status": "ok"}
{"N": 10485760, "K": 1024, "D": 128, "B": 1, "dtype": "fp16", "BLOCK_N": 128, "BLOCK_K": 64, "num_warps": 4, "num_stages": 1, "time_ms": 7.612287998199463, "status": "ok"}
{"N": 10485760, "K": 1024, "D": 128, "B": 1, "dtype": "fp16", "BLOCK_N": 128, "BLOCK_K": 64, "num_warps": 4, "num_stages": 2, "time_ms": 7.948416233062744, "status": "ok"}
{"N": 10485760, "K": 1024, "D": 128, "B": 1, "dtype": "fp16", "BLOCK_N": 128, "BLOCK_K": 64, "num_warps": 4, "num_stages": 4, "time_ms": 7.971551895141602, "status": "ok"}
{"N": 10485760, "K": 1024, "D": 128, "B": 1, "dtype": "fp16", "BLOCK_N": 128, "BLOCK_K": 64, "num_warps": 8, "num_stages": 1, "time_ms": 8.204768180847168, "status": "ok"}
{"N": 10485760, "K": 1024, "D": 128, "B": 1, "dtype": "fp16", "BLOCK_N": 128, "BLOCK_K": 64, "num_warps": 8, "num_stages": 2, "time_ms": 8.071968078613281, "status": "ok"}
{"N": 10485760, "K": 1024, "D": 128, "B": 1, "dtype": "fp16", "BLOCK_N": 128, "BLOCK_K": 64, "num_warps": 8, "num_stages": 4, "time_ms": 8.021599769592285, "status": "ok"}
{"N": 10485760, "K": 1024, "D": 128, "B": 1, "dtype": "fp16", "BLOCK_N": 128, "BLOCK_K": 128, "num_warps": 4, "num_stages": 1, "time_ms": 8.053183555603027, "status": "ok"}
{"N": 10485760, "K": 1024, "D": 128, "B": 1, "dtype": "fp16", "BLOCK_N": 128, "BLOCK_K": 128, "num_warps": 4, "num_stages": 2, "time_ms": 7.645376205444336, "status": "ok"}
{"N": 10485760, "K": 1024, "D": 128, "B": 1, "dtype": "fp16", "BLOCK_N": 128, "BLOCK_K": 128, "num_warps": 4, "num_stages": 4, "time_ms": 9.798463821411133, "status": "ok"}
{"N": 10485760, "K": 1024, "D": 128, "B": 1, "dtype": "fp16", "BLOCK_N": 128, "BLOCK_K": 128, "num_warps": 8, "num_stages": 1, "time_ms": 11.76854419708252, "status": "ok"}
{"N": 10485760, "K": 1024, "D": 128, "B": 1, "dtype": "fp16", "BLOCK_N": 128, "BLOCK_K": 128, "num_warps": 8, "num_stages": 2, "time_ms": 7.65177583694458, "status": "ok"}
{"N": 10485760, "K": 1024, "D": 128, "B": 1, "dtype": "fp16", "BLOCK_N": 128, "BLOCK_K": 128, "num_warps": 8, "num_stages": 4, "time_ms": 9.348064422607422, "status": "ok"}
{"summary": true, "N": 10485760, "K": 1024, "D": 128, "B": 1, "dtype": "fp16", "best": {"N": 10485760, "K": 1024, "D": 128, "B": 1, "dtype": "fp16", "BLOCK_N": 128, "BLOCK_K": 64, "num_warps": 4, "num_stages": 1, "time_ms": 7.612287998199463, "status": "ok"}, "best_time_ms": 7.612287998199463, "tuning_seconds": 17.345787048339844, "skipped": 0}
