grid_results_h200/N1048576_K256_D128_B1_fp16.jsonl
{"N": 1048576, "K": 256, "D": 128, "B": 1, "dtype": "fp16", "BLOCK_N": 32, "BLOCK_K": 32, "num_warps": 4, "num_stages": 1, "time_ms": 0.6628160079320272, "status": "ok"}
{"N": 1048576, "K": 256, "D": 128, "B": 1, "dtype": "fp16", "BLOCK_N": 32, "BLOCK_K": 32, "num_warps": 4, "num_stages": 2, "time_ms": 0.5729599935667855, "status": "ok"}
{"N": 1048576, "K": 256, "D": 128, "B": 1, "dtype": "fp16", "BLOCK_N": 32, "BLOCK_K": 32, "num_warps": 4, "num_stages": 4, "time_ms": 0.5963428616523743, "status": "ok"}
{"N": 1048576, "K": 256, "D": 128, "B": 1, "dtype": "fp16", "BLOCK_N": 32, "BLOCK_K": 32, "num_warps": 8, "num_stages": 1, "time_ms": 0.9812959879636765, "status": "ok"}
{"N": 1048576, "K": 256, "D": 128, "B": 1, "dtype": "fp16", "BLOCK_N": 32, "BLOCK_K": 32, "num_warps": 8, "num_stages": 2, "time_ms": 0.9196096062660217, "status": "ok"}
{"N": 1048576, "K": 256, "D": 128, "B": 1, "dtype": "fp16", "BLOCK_N": 32, "BLOCK_K": 32, "num_warps": 8, "num_stages": 4, "time_ms": 0.9378799945116043, "status": "ok"}
{"N": 1048576, "K": 256, "D": 128, "B": 1, "dtype": "fp16", "BLOCK_N": 32, "BLOCK_K": 64, "num_warps": 4, "num_stages": 1, "time_ms": 0.5735588499477932, "status": "ok"}
{"N": 1048576, "K": 256, "D": 128, "B": 1, "dtype": "fp16", "BLOCK_N": 32, "BLOCK_K": 64, "num_warps": 4, "num_stages": 2, "time_ms": 0.483377777867847, "status": "ok"}
{"N": 1048576, "K": 256, "D": 128, "B": 1, "dtype": "fp16", "BLOCK_N": 32, "BLOCK_K": 64, "num_warps": 4, "num_stages": 4, "time_ms": 0.5858788575444903, "status": "ok"}
{"N": 1048576, "K": 256, "D": 128, "B": 1, "dtype": "fp16", "BLOCK_N": 32, "BLOCK_K": 64, "num_warps": 8, "num_stages": 1, "time_ms": 0.6972479919592539, "status": "ok"}
{"N": 1048576, "K": 256, "D": 128, "B": 1, "dtype": "fp16", "BLOCK_N": 32, "BLOCK_K": 64, "num_warps": 8, "num_stages": 2, "time_ms": 0.6648586591084799, "status": "ok"}
{"N": 1048576, "K": 256, "D": 128, "B": 1, "dtype": "fp16", "BLOCK_N": 32, "BLOCK_K": 64, "num_warps": 8, "num_stages": 4, "time_ms": 0.6754186650117239, "status": "ok"}
{"N": 1048576, "K": 256, "D": 128, "B": 1, "dtype": "fp16", "BLOCK_N": 32, "BLOCK_K": 128, "num_warps": 4, "num_stages": 1, "time_ms": 0.47207466430134243, "status": "ok"}
{"N": 1048576, "K": 256, "D": 128, "B": 1, "dtype": "fp16", "BLOCK_N": 32, "BLOCK_K": 128, "num_warps": 4, "num_stages": 2, "time_ms": 0.42260800004005433, "status": "ok"}
{"N": 1048576, "K": 256, "D": 128, "B": 1, "dtype": "fp16", "BLOCK_N": 32, "BLOCK_K": 128, "num_warps": 4, "num_stages": 4, "time_ms": 0.6484906772772471, "status": "ok"}
{"N": 1048576, "K": 256, "D": 128, "B": 1, "dtype": "fp16", "BLOCK_N": 32, "BLOCK_K": 128, "num_warps": 8, "num_stages": 1, "time_ms": 0.6377737181527274, "status": "ok"}
{"N": 1048576, "K": 256, "D": 128, "B": 1, "dtype": "fp16", "BLOCK_N": 32, "BLOCK_K": 128, "num_warps": 8, "num_stages": 2, "time_ms": 0.5986834338733128, "status": "ok"}
{"N": 1048576, "K": 256, "D": 128, "B": 1, "dtype": "fp16", "BLOCK_N": 32, "BLOCK_K": 128, "num_warps": 8, "num_stages": 4, "time_ms": 0.7233066658178965, "status": "ok"}
{"N": 1048576, "K": 256, "D": 128, "B": 1, "dtype": "fp16", "BLOCK_N": 64, "BLOCK_K": 32, "num_warps": 4, "num_stages": 1, "time_ms": 0.29143876983569217, "status": "ok"}
{"N": 1048576, "K": 256, "D": 128, "B": 1, "dtype": "fp16", "BLOCK_N": 64, "BLOCK_K": 32, "num_warps": 4, "num_stages": 2, "time_ms": 0.25797120134035745, "status": "ok"}
{"N": 1048576, "K": 256, "D": 128, "B": 1, "dtype": "fp16", "BLOCK_N": 64, "BLOCK_K": 32, "num_warps": 4, "num_stages": 4, "time_ms": 0.2731885718447821, "status": "ok"}
{"N": 1048576, "K": 256, "D": 128, "B": 1, "dtype": "fp16", "BLOCK_N": 64, "BLOCK_K": 32, "num_warps": 8, "num_stages": 1, "time_ms": 0.4898346695635054, "status": "ok"}
{"N": 1048576, "K": 256, "D": 128, "B": 1, "dtype": "fp16", "BLOCK_N": 64, "BLOCK_K": 32, "num_warps": 8, "num_stages": 2, "time_ms": 0.4492764472961426, "status": "ok"}
{"N": 1048576, "K": 256, "D": 128, "B": 1, "dtype": "fp16", "BLOCK_N": 64, "BLOCK_K": 32, "num_warps": 8, "num_stages": 4, "time_ms": 0.4693902201122708, "status": "ok"}
{"N": 1048576, "K": 256, "D": 128, "B": 1, "dtype": "fp16", "BLOCK_N": 64, "BLOCK_K": 64, "num_warps": 4, "num_stages": 1, "time_ms": 0.25333760380744935, "status": "ok"}
{"N": 1048576, "K": 256, "D": 128, "B": 1, "dtype": "fp16", "BLOCK_N": 64, "BLOCK_K": 64, "num_warps": 4, "num_stages": 2, "time_ms": 0.2352719996124506, "status": "ok"}
{"N": 1048576, "K": 256, "D": 128, "B": 1, "dtype": "fp16", "BLOCK_N": 64, "BLOCK_K": 64, "num_warps": 4, "num_stages": 4, "time_ms": 0.2985747731648959, "status": "ok"}
{"N": 1048576, "K": 256, "D": 128, "B": 1, "dtype": "fp16", "BLOCK_N": 64, "BLOCK_K": 64, "num_warps": 8, "num_stages": 1, "time_ms": 0.3481119970480601, "status": "ok"}
{"N": 1048576, "K": 256, "D": 128, "B": 1, "dtype": "fp16", "BLOCK_N": 64, "BLOCK_K": 64, "num_warps": 8, "num_stages": 2, "time_ms": 0.33739466468493146, "status": "ok"}
{"N": 1048576, "K": 256, "D": 128, "B": 1, "dtype": "fp16", "BLOCK_N": 64, "BLOCK_K": 64, "num_warps": 8, "num_stages": 4, "time_ms": 0.40796159505844115, "status": "ok"}
{"N": 1048576, "K": 256, "D": 128, "B": 1, "dtype": "fp16", "BLOCK_N": 64, "BLOCK_K": 128, "num_warps": 4, "num_stages": 1, "time_ms": 0.25280640125274656, "status": "ok"}
{"N": 1048576, "K": 256, "D": 128, "B": 1, "dtype": "fp16", "BLOCK_N": 64, "BLOCK_K": 128, "num_warps": 4, "num_stages": 2, "time_ms": 0.2975335396253146, "status": "ok"}
{"N": 1048576, "K": 256, "D": 128, "B": 1, "dtype": "fp16", "BLOCK_N": 64, "BLOCK_K": 128, "num_warps": 4, "num_stages": 4, "time_ms": 0.45279644264115226, "status": "ok"}
{"N": 1048576, "K": 256, "D": 128, "B": 1, "dtype": "fp16", "BLOCK_N": 64, "BLOCK_K": 128, "num_warps": 8, "num_stages": 1, "time_ms": 0.3363093361258507, "status": "ok"}
{"N": 1048576, "K": 256, "D": 128, "B": 1, "dtype": "fp16", "BLOCK_N": 64, "BLOCK_K": 128, "num_warps": 8, "num_stages": 2, "time_ms": 0.33576266715923947, "status": "ok"}
{"N": 1048576, "K": 256, "D": 128, "B": 1, "dtype": "fp16", "BLOCK_N": 64, "BLOCK_K": 128, "num_warps": 8, "num_stages": 4, "time_ms": 0.5077320039272308, "status": "ok"}
{"N": 1048576, "K": 256, "D": 128, "B": 1, "dtype": "fp16", "BLOCK_N": 128, "BLOCK_K": 32, "num_warps": 4, "num_stages": 1, "time_ms": 0.25786240100860597, "status": "ok"}
{"N": 1048576, "K": 256, "D": 128, "B": 1, "dtype": "fp16", "BLOCK_N": 128, "BLOCK_K": 32, "num_warps": 4, "num_stages": 2, "time_ms": 0.26012373169263203, "status": "ok"}
{"N": 1048576, "K": 256, "D": 128, "B": 1, "dtype": "fp16", "BLOCK_N": 128, "BLOCK_K": 32, "num_warps": 4, "num_stages": 4, "time_ms": 0.2687588632106781, "status": "ok"}
{"N": 1048576, "K": 256, "D": 128, "B": 1, "dtype": "fp16", "BLOCK_N": 128, "BLOCK_K": 32, "num_warps": 8, "num_stages": 1, "time_ms": 0.2595008035500844, "status": "ok"}
{"N": 1048576, "K": 256, "D": 128, "B": 1, "dtype": "fp16", "BLOCK_N": 128, "BLOCK_K": 32, "num_warps": 8, "num_stages": 2, "time_ms": 0.2569301346937815, "status": "ok"}
{"N": 1048576, "K": 256, "D": 128, "B": 1, "dtype": "fp16", "BLOCK_N": 128, "BLOCK_K": 32, "num_warps": 8, "num_stages": 4, "time_ms": 0.26559360027313234, "status": "ok"}
{"N": 1048576, "K": 256, "D": 128, "B": 1, "dtype": "fp16", "BLOCK_N": 128, "BLOCK_K": 64, "num_warps": 4, "num_stages": 1, "time_ms": 0.2256225890973035, "status": "ok"}
{"N": 1048576, "K": 256, "D": 128, "B": 1, "dtype": "fp16", "BLOCK_N": 128, "BLOCK_K": 64, "num_warps": 4, "num_stages": 2, "time_ms": 0.23375199921429157, "status": "ok"}
{"N": 1048576, "K": 256, "D": 128, "B": 1, "dtype": "fp16", "BLOCK_N": 128, "BLOCK_K": 64, "num_warps": 4, "num_stages": 4, "time_ms": 0.25827413201332095, "status": "ok"}
{"N": 1048576, "K": 256, "D": 128, "B": 1, "dtype": "fp16", "BLOCK_N": 128, "BLOCK_K": 64, "num_warps": 8, "num_stages": 1, "time_ms": 0.23892599903047085, "status": "ok"}
{"N": 1048576, "K": 256, "D": 128, "B": 1, "dtype": "fp16", "BLOCK_N": 128, "BLOCK_K": 64, "num_warps": 8, "num_stages": 2, "time_ms": 0.23659199848771095, "status": "ok"}
{"N": 1048576, "K": 256, "D": 128, "B": 1, "dtype": "fp16", "BLOCK_N": 128, "BLOCK_K": 64, "num_warps": 8, "num_stages": 4, "time_ms": 0.24515200033783913, "status": "ok"}
{"N": 1048576, "K": 256, "D": 128, "B": 1, "dtype": "fp16", "BLOCK_N": 128, "BLOCK_K": 128, "num_warps": 4, "num_stages": 1, "time_ms": 0.26766933004061383, "status": "ok"}
{"N": 1048576, "K": 256, "D": 128, "B": 1, "dtype": "fp16", "BLOCK_N": 128, "BLOCK_K": 128, "num_warps": 4, "num_stages": 2, "time_ms": 0.23645799793303013, "status": "ok"}
{"N": 1048576, "K": 256, "D": 128, "B": 1, "dtype": "fp16", "BLOCK_N": 128, "BLOCK_K": 128, "num_warps": 4, "num_stages": 4, "time_ms": 0.3582661802118475, "status": "ok"}
{"N": 1048576, "K": 256, "D": 128, "B": 1, "dtype": "fp16", "BLOCK_N": 128, "BLOCK_K": 128, "num_warps": 8, "num_stages": 1, "time_ms": 0.37570618228478864, "status": "ok"}
{"N": 1048576, "K": 256, "D": 128, "B": 1, "dtype": "fp16", "BLOCK_N": 128, "BLOCK_K": 128, "num_warps": 8, "num_stages": 2, "time_ms": 0.341050664583842, "status": "ok"}
{"N": 1048576, "K": 256, "D": 128, "B": 1, "dtype": "fp16", "BLOCK_N": 128, "BLOCK_K": 128, "num_warps": 8, "num_stages": 4, "time_ms": 0.3450080007314682, "status": "ok"}
{"summary": true, "N": 1048576, "K": 256, "D": 128, "B": 1, "dtype": "fp16", "best": {"N": 1048576, "K": 256, "D": 128, "B": 1, "dtype": "fp16", "BLOCK_N": 128, "BLOCK_K": 64, "num_warps": 4, "num_stages": 1, "time_ms": 0.2256225890973035, "status": "ok"}, "best_time_ms": 0.2256225890973035, "tuning_seconds": 11.294470310211182, "skipped": 0}
