grid_results_h200/N1048576_K200000_D128_B1_fp16.jsonl
{"N": 1048576, "K": 200000, "D": 128, "B": 1, "dtype": "fp16", "BLOCK_N": 32, "BLOCK_K": 32, "num_warps": 4, "num_stages": 1, "time_ms": 499.5224304199219, "status": "ok"}
{"N": 1048576, "K": 200000, "D": 128, "B": 1, "dtype": "fp16", "BLOCK_N": 32, "BLOCK_K": 32, "num_warps": 4, "num_stages": 2, "time_ms": 408.6291198730469, "status": "ok"}
{"N": 1048576, "K": 200000, "D": 128, "B": 1, "dtype": "fp16", "BLOCK_N": 32, "BLOCK_K": 32, "num_warps": 4, "num_stages": 4, "time_ms": 404.9011535644531, "status": "ok"}
{"N": 1048576, "K": 200000, "D": 128, "B": 1, "dtype": "fp16", "BLOCK_N": 32, "BLOCK_K": 32, "num_warps": 8, "num_stages": 1, "time_ms": 755.6964111328125, "status": "ok"}
{"N": 1048576, "K": 200000, "D": 128, "B": 1, "dtype": "fp16", "BLOCK_N": 32, "BLOCK_K": 32, "num_warps": 8, "num_stages": 2, "time_ms": 678.957275390625, "status": "ok"}
{"N": 1048576, "K": 200000, "D": 128, "B": 1, "dtype": "fp16", "BLOCK_N": 32, "BLOCK_K": 32, "num_warps": 8, "num_stages": 4, "time_ms": 659.03857421875, "status": "ok"}
{"N": 1048576, "K": 200000, "D": 128, "B": 1, "dtype": "fp16", "BLOCK_N": 32, "BLOCK_K": 64, "num_warps": 4, "num_stages": 1, "time_ms": 426.20367431640625, "status": "ok"}
{"N": 1048576, "K": 200000, "D": 128, "B": 1, "dtype": "fp16", "BLOCK_N": 32, "BLOCK_K": 64, "num_warps": 4, "num_stages": 2, "time_ms": 331.74639892578125, "status": "ok"}
{"N": 1048576, "K": 200000, "D": 128, "B": 1, "dtype": "fp16", "BLOCK_N": 32, "BLOCK_K": 64, "num_warps": 4, "num_stages": 4, "time_ms": 396.7884216308594, "status": "ok"}
{"N": 1048576, "K": 200000, "D": 128, "B": 1, "dtype": "fp16", "BLOCK_N": 32, "BLOCK_K": 64, "num_warps": 8, "num_stages": 1, "time_ms": 508.5819396972656, "status": "ok"}
{"N": 1048576, "K": 200000, "D": 128, "B": 1, "dtype": "fp16", "BLOCK_N": 32, "BLOCK_K": 64, "num_warps": 8, "num_stages": 2, "time_ms": 437.4062194824219, "status": "ok"}
{"N": 1048576, "K": 200000, "D": 128, "B": 1, "dtype": "fp16", "BLOCK_N": 32, "BLOCK_K": 64, "num_warps": 8, "num_stages": 4, "time_ms": 431.0006408691406, "status": "ok"}
{"N": 1048576, "K": 200000, "D": 128, "B": 1, "dtype": "fp16", "BLOCK_N": 32, "BLOCK_K": 128, "num_warps": 4, "num_stages": 1, "time_ms": 346.232421875, "status": "ok"}
{"N": 1048576, "K": 200000, "D": 128, "B": 1, "dtype": "fp16", "BLOCK_N": 32, "BLOCK_K": 128, "num_warps": 4, "num_stages": 2, "time_ms": 271.6347961425781, "status": "ok"}
{"N": 1048576, "K": 200000, "D": 128, "B": 1, "dtype": "fp16", "BLOCK_N": 32, "BLOCK_K": 128, "num_warps": 4, "num_stages": 4, "time_ms": 357.49993896484375, "status": "ok"}
{"N": 1048576, "K": 200000, "D": 128, "B": 1, "dtype": "fp16", "BLOCK_N": 32, "BLOCK_K": 128, "num_warps": 8, "num_stages": 1, "time_ms": 467.28729248046875, "status": "ok"}
{"N": 1048576, "K": 200000, "D": 128, "B": 1, "dtype": "fp16", "BLOCK_N": 32, "BLOCK_K": 128, "num_warps": 8, "num_stages": 2, "time_ms": 394.4198913574219, "status": "ok"}
{"N": 1048576, "K": 200000, "D": 128, "B": 1, "dtype": "fp16", "BLOCK_N": 32, "BLOCK_K": 128, "num_warps": 8, "num_stages": 4, "time_ms": 413.1914367675781, "status": "ok"}
{"N": 1048576, "K": 200000, "D": 128, "B": 1, "dtype": "fp16", "BLOCK_N": 64, "BLOCK_K": 32, "num_warps": 4, "num_stages": 1, "time_ms": 204.8482208251953, "status": "ok"}
{"N": 1048576, "K": 200000, "D": 128, "B": 1, "dtype": "fp16", "BLOCK_N": 64, "BLOCK_K": 32, "num_warps": 4, "num_stages": 2, "time_ms": 179.17788696289062, "status": "ok"}
{"N": 1048576, "K": 200000, "D": 128, "B": 1, "dtype": "fp16", "BLOCK_N": 64, "BLOCK_K": 32, "num_warps": 4, "num_stages": 4, "time_ms": 179.0167694091797, "status": "ok"}
{"N": 1048576, "K": 200000, "D": 128, "B": 1, "dtype": "fp16", "BLOCK_N": 64, "BLOCK_K": 32, "num_warps": 8, "num_stages": 1, "time_ms": 363.5290222167969, "status": "ok"}
{"N": 1048576, "K": 200000, "D": 128, "B": 1, "dtype": "fp16", "BLOCK_N": 64, "BLOCK_K": 32, "num_warps": 8, "num_stages": 2, "time_ms": 313.9474182128906, "status": "ok"}
{"N": 1048576, "K": 200000, "D": 128, "B": 1, "dtype": "fp16", "BLOCK_N": 64, "BLOCK_K": 32, "num_warps": 8, "num_stages": 4, "time_ms": 316.9955139160156, "status": "ok"}
{"N": 1048576, "K": 200000, "D": 128, "B": 1, "dtype": "fp16", "BLOCK_N": 64, "BLOCK_K": 64, "num_warps": 4, "num_stages": 1, "time_ms": 174.14498901367188, "status": "ok"}
{"N": 1048576, "K": 200000, "D": 128, "B": 1, "dtype": "fp16", "BLOCK_N": 64, "BLOCK_K": 64, "num_warps": 4, "num_stages": 2, "time_ms": 162.28924560546875, "status": "ok"}
{"N": 1048576, "K": 200000, "D": 128, "B": 1, "dtype": "fp16", "BLOCK_N": 64, "BLOCK_K": 64, "num_warps": 4, "num_stages": 4, "time_ms": 193.38844299316406, "status": "ok"}
{"N": 1048576, "K": 200000, "D": 128, "B": 1, "dtype": "fp16", "BLOCK_N": 64, "BLOCK_K": 64, "num_warps": 8, "num_stages": 1, "time_ms": 257.04620361328125, "status": "ok"}
{"N": 1048576, "K": 200000, "D": 128, "B": 1, "dtype": "fp16", "BLOCK_N": 64, "BLOCK_K": 64, "num_warps": 8, "num_stages": 2, "time_ms": 219.55532836914062, "status": "ok"}
{"N": 1048576, "K": 200000, "D": 128, "B": 1, "dtype": "fp16", "BLOCK_N": 64, "BLOCK_K": 64, "num_warps": 8, "num_stages": 4, "time_ms": 247.3095703125, "status": "ok"}
{"N": 1048576, "K": 200000, "D": 128, "B": 1, "dtype": "fp16", "BLOCK_N": 64, "BLOCK_K": 128, "num_warps": 4, "num_stages": 1, "time_ms": 174.8401336669922, "status": "ok"}
{"N": 1048576, "K": 200000, "D": 128, "B": 1, "dtype": "fp16", "BLOCK_N": 64, "BLOCK_K": 128, "num_warps": 4, "num_stages": 2, "time_ms": 181.95986938476562, "status": "ok"}
{"N": 1048576, "K": 200000, "D": 128, "B": 1, "dtype": "fp16", "BLOCK_N": 64, "BLOCK_K": 128, "num_warps": 4, "num_stages": 4, "time_ms": 250.8685760498047, "status": "ok"}
{"N": 1048576, "K": 200000, "D": 128, "B": 1, "dtype": "fp16", "BLOCK_N": 64, "BLOCK_K": 128, "num_warps": 8, "num_stages": 1, "time_ms": 258.3001403808594, "status": "ok"}
{"N": 1048576, "K": 200000, "D": 128, "B": 1, "dtype": "fp16", "BLOCK_N": 64, "BLOCK_K": 128, "num_warps": 8, "num_stages": 2, "time_ms": 234.5020751953125, "status": "ok"}
{"N": 1048576, "K": 200000, "D": 128, "B": 1, "dtype": "fp16", "BLOCK_N": 64, "BLOCK_K": 128, "num_warps": 8, "num_stages": 4, "time_ms": 294.33477783203125, "status": "ok"}
{"N": 1048576, "K": 200000, "D": 128, "B": 1, "dtype": "fp16", "BLOCK_N": 128, "BLOCK_K": 32, "num_warps": 4, "num_stages": 1, "time_ms": 175.1017608642578, "status": "ok"}
{"N": 1048576, "K": 200000, "D": 128, "B": 1, "dtype": "fp16", "BLOCK_N": 128, "BLOCK_K": 32, "num_warps": 4, "num_stages": 2, "time_ms": 177.61929321289062, "status": "ok"}
{"N": 1048576, "K": 200000, "D": 128, "B": 1, "dtype": "fp16", "BLOCK_N": 128, "BLOCK_K": 32, "num_warps": 4, "num_stages": 4, "time_ms": 180.72947692871094, "status": "ok"}
{"N": 1048576, "K": 200000, "D": 128, "B": 1, "dtype": "fp16", "BLOCK_N": 128, "BLOCK_K": 32, "num_warps": 8, "num_stages": 1, "time_ms": 179.6835174560547, "status": "ok"}
{"N": 1048576, "K": 200000, "D": 128, "B": 1, "dtype": "fp16", "BLOCK_N": 128, "BLOCK_K": 32, "num_warps": 8, "num_stages": 2, "time_ms": 175.783203125, "status": "ok"}
{"N": 1048576, "K": 200000, "D": 128, "B": 1, "dtype": "fp16", "BLOCK_N": 128, "BLOCK_K": 32, "num_warps": 8, "num_stages": 4, "time_ms": 177.45443725585938, "status": "ok"}
{"N": 1048576, "K": 200000, "D": 128, "B": 1, "dtype": "fp16", "BLOCK_N": 128, "BLOCK_K": 64, "num_warps": 4, "num_stages": 1, "time_ms": 155.32981872558594, "status": "ok"}
{"N": 1048576, "K": 200000, "D": 128, "B": 1, "dtype": "fp16", "BLOCK_N": 128, "BLOCK_K": 64, "num_warps": 4, "num_stages": 2, "time_ms": 155.50448608398438, "status": "ok"}
{"N": 1048576, "K": 200000, "D": 128, "B": 1, "dtype": "fp16", "BLOCK_N": 128, "BLOCK_K": 64, "num_warps": 4, "num_stages": 4, "time_ms": 154.71487426757812, "status": "ok"}
{"N": 1048576, "K": 200000, "D": 128, "B": 1, "dtype": "fp16", "BLOCK_N": 128, "BLOCK_K": 64, "num_warps": 8, "num_stages": 1, "time_ms": 161.52992248535156, "status": "ok"}
{"N": 1048576, "K": 200000, "D": 128, "B": 1, "dtype": "fp16", "BLOCK_N": 128, "BLOCK_K": 64, "num_warps": 8, "num_stages": 2, "time_ms": 155.08079528808594, "status": "ok"}
{"N": 1048576, "K": 200000, "D": 128, "B": 1, "dtype": "fp16", "BLOCK_N": 128, "BLOCK_K": 64, "num_warps": 8, "num_stages": 4, "time_ms": 154.38485717773438, "status": "ok"}
{"N": 1048576, "K": 200000, "D": 128, "B": 1, "dtype": "fp16", "BLOCK_N": 128, "BLOCK_K": 128, "num_warps": 4, "num_stages": 1, "time_ms": 177.57366943359375, "status": "ok"}
{"N": 1048576, "K": 200000, "D": 128, "B": 1, "dtype": "fp16", "BLOCK_N": 128, "BLOCK_K": 128, "num_warps": 4, "num_stages": 2, "time_ms": 159.931640625, "status": "ok"}
{"N": 1048576, "K": 200000, "D": 128, "B": 1, "dtype": "fp16", "BLOCK_N": 128, "BLOCK_K": 128, "num_warps": 4, "num_stages": 4, "time_ms": 189.43516540527344, "status": "ok"}
{"N": 1048576, "K": 200000, "D": 128, "B": 1, "dtype": "fp16", "BLOCK_N": 128, "BLOCK_K": 128, "num_warps": 8, "num_stages": 1, "time_ms": 285.15850830078125, "status": "ok"}
{"N": 1048576, "K": 200000, "D": 128, "B": 1, "dtype": "fp16", "BLOCK_N": 128, "BLOCK_K": 128, "num_warps": 8, "num_stages": 2, "time_ms": 242.29592895507812, "status": "ok"}
{"N": 1048576, "K": 200000, "D": 128, "B": 1, "dtype": "fp16", "BLOCK_N": 128, "BLOCK_K": 128, "num_warps": 8, "num_stages": 4, "time_ms": 198.4976348876953, "status": "ok"}
{"summary": true, "N": 1048576, "K": 200000, "D": 128, "B": 1, "dtype": "fp16", "best": {"N": 1048576, "K": 200000, "D": 128, "B": 1, "dtype": "fp16", "BLOCK_N": 128, "BLOCK_K": 64, "num_warps": 8, "num_stages": 4, "time_ms": 154.38485717773438, "status": "ok"}, "best_time_ms": 154.38485717773438, "tuning_seconds": 136.74468350410461, "skipped": 0}
