grid_results_h200/N1048576_K4096_D128_B32_fp16.jsonl
{"N": 1048576, "K": 4096, "D": 128, "B": 32, "dtype": "fp16", "BLOCK_N": 32, "BLOCK_K": 32, "num_warps": 4, "num_stages": 1, "time_ms": 326.3556823730469, "status": "ok"}
{"N": 1048576, "K": 4096, "D": 128, "B": 32, "dtype": "fp16", "BLOCK_N": 32, "BLOCK_K": 32, "num_warps": 4, "num_stages": 2, "time_ms": 265.8721923828125, "status": "ok"}
{"N": 1048576, "K": 4096, "D": 128, "B": 32, "dtype": "fp16", "BLOCK_N": 32, "BLOCK_K": 32, "num_warps": 4, "num_stages": 4, "time_ms": 266.7866516113281, "status": "ok"}
{"N": 1048576, "K": 4096, "D": 128, "B": 32, "dtype": "fp16", "BLOCK_N": 32, "BLOCK_K": 32, "num_warps": 8, "num_stages": 1, "time_ms": 482.3183898925781, "status": "ok"}
{"N": 1048576, "K": 4096, "D": 128, "B": 32, "dtype": "fp16", "BLOCK_N": 32, "BLOCK_K": 32, "num_warps": 8, "num_stages": 2, "time_ms": 439.2098388671875, "status": "ok"}
{"N": 1048576, "K": 4096, "D": 128, "B": 32, "dtype": "fp16", "BLOCK_N": 32, "BLOCK_K": 32, "num_warps": 8, "num_stages": 4, "time_ms": 433.11370849609375, "status": "ok"}
{"N": 1048576, "K": 4096, "D": 128, "B": 32, "dtype": "fp16", "BLOCK_N": 32, "BLOCK_K": 64, "num_warps": 4, "num_stages": 1, "time_ms": 277.42156982421875, "status": "ok"}
{"N": 1048576, "K": 4096, "D": 128, "B": 32, "dtype": "fp16", "BLOCK_N": 32, "BLOCK_K": 64, "num_warps": 4, "num_stages": 2, "time_ms": 216.59071350097656, "status": "ok"}
{"N": 1048576, "K": 4096, "D": 128, "B": 32, "dtype": "fp16", "BLOCK_N": 32, "BLOCK_K": 64, "num_warps": 4, "num_stages": 4, "time_ms": 233.30044555664062, "status": "ok"}
{"N": 1048576, "K": 4096, "D": 128, "B": 32, "dtype": "fp16", "BLOCK_N": 32, "BLOCK_K": 64, "num_warps": 8, "num_stages": 1, "time_ms": 330.8812255859375, "status": "ok"}
{"N": 1048576, "K": 4096, "D": 128, "B": 32, "dtype": "fp16", "BLOCK_N": 32, "BLOCK_K": 64, "num_warps": 8, "num_stages": 2, "time_ms": 283.4468078613281, "status": "ok"}
{"N": 1048576, "K": 4096, "D": 128, "B": 32, "dtype": "fp16", "BLOCK_N": 32, "BLOCK_K": 64, "num_warps": 8, "num_stages": 4, "time_ms": 284.2275390625, "status": "ok"}
{"N": 1048576, "K": 4096, "D": 128, "B": 32, "dtype": "fp16", "BLOCK_N": 32, "BLOCK_K": 128, "num_warps": 4, "num_stages": 1, "time_ms": 221.26039123535156, "status": "ok"}
{"N": 1048576, "K": 4096, "D": 128, "B": 32, "dtype": "fp16", "BLOCK_N": 32, "BLOCK_K": 128, "num_warps": 4, "num_stages": 2, "time_ms": 173.64710998535156, "status": "ok"}
{"N": 1048576, "K": 4096, "D": 128, "B": 32, "dtype": "fp16", "BLOCK_N": 32, "BLOCK_K": 128, "num_warps": 4, "num_stages": 4, "time_ms": 218.4199676513672, "status": "ok"}
{"N": 1048576, "K": 4096, "D": 128, "B": 32, "dtype": "fp16", "BLOCK_N": 32, "BLOCK_K": 128, "num_warps": 8, "num_stages": 1, "time_ms": 303.4659729003906, "status": "ok"}
{"N": 1048576, "K": 4096, "D": 128, "B": 32, "dtype": "fp16", "BLOCK_N": 32, "BLOCK_K": 128, "num_warps": 8, "num_stages": 2, "time_ms": 259.8205261230469, "status": "ok"}
{"N": 1048576, "K": 4096, "D": 128, "B": 32, "dtype": "fp16", "BLOCK_N": 32, "BLOCK_K": 128, "num_warps": 8, "num_stages": 4, "time_ms": 270.1044921875, "status": "ok"}
{"N": 1048576, "K": 4096, "D": 128, "B": 32, "dtype": "fp16", "BLOCK_N": 64, "BLOCK_K": 32, "num_warps": 4, "num_stages": 1, "time_ms": 138.5877685546875, "status": "ok"}
{"N": 1048576, "K": 4096, "D": 128, "B": 32, "dtype": "fp16", "BLOCK_N": 64, "BLOCK_K": 32, "num_warps": 4, "num_stages": 2, "time_ms": 117.74249267578125, "status": "ok"}
{"N": 1048576, "K": 4096, "D": 128, "B": 32, "dtype": "fp16", "BLOCK_N": 64, "BLOCK_K": 32, "num_warps": 4, "num_stages": 4, "time_ms": 124.47542572021484, "status": "ok"}
{"N": 1048576, "K": 4096, "D": 128, "B": 32, "dtype": "fp16", "BLOCK_N": 64, "BLOCK_K": 32, "num_warps": 8, "num_stages": 1, "time_ms": 236.71055603027344, "status": "ok"}
{"N": 1048576, "K": 4096, "D": 128, "B": 32, "dtype": "fp16", "BLOCK_N": 64, "BLOCK_K": 32, "num_warps": 8, "num_stages": 2, "time_ms": 205.2802276611328, "status": "ok"}
{"N": 1048576, "K": 4096, "D": 128, "B": 32, "dtype": "fp16", "BLOCK_N": 64, "BLOCK_K": 32, "num_warps": 8, "num_stages": 4, "time_ms": 207.43324279785156, "status": "ok"}
{"N": 1048576, "K": 4096, "D": 128, "B": 32, "dtype": "fp16", "BLOCK_N": 64, "BLOCK_K": 64, "num_warps": 4, "num_stages": 1, "time_ms": 114.62601470947266, "status": "ok"}
{"N": 1048576, "K": 4096, "D": 128, "B": 32, "dtype": "fp16", "BLOCK_N": 64, "BLOCK_K": 64, "num_warps": 4, "num_stages": 2, "time_ms": 100.70825958251953, "status": "ok"}
{"N": 1048576, "K": 4096, "D": 128, "B": 32, "dtype": "fp16", "BLOCK_N": 64, "BLOCK_K": 64, "num_warps": 4, "num_stages": 4, "time_ms": 106.35737609863281, "status": "ok"}
{"N": 1048576, "K": 4096, "D": 128, "B": 32, "dtype": "fp16", "BLOCK_N": 64, "BLOCK_K": 64, "num_warps": 8, "num_stages": 1, "time_ms": 164.43923950195312, "status": "ok"}
{"N": 1048576, "K": 4096, "D": 128, "B": 32, "dtype": "fp16", "BLOCK_N": 64, "BLOCK_K": 64, "num_warps": 8, "num_stages": 2, "time_ms": 143.6710968017578, "status": "ok"}
{"N": 1048576, "K": 4096, "D": 128, "B": 32, "dtype": "fp16", "BLOCK_N": 64, "BLOCK_K": 64, "num_warps": 8, "num_stages": 4, "time_ms": 164.65660095214844, "status": "ok"}
{"N": 1048576, "K": 4096, "D": 128, "B": 32, "dtype": "fp16", "BLOCK_N": 64, "BLOCK_K": 128, "num_warps": 4, "num_stages": 1, "time_ms": 103.49398040771484, "status": "ok"}
{"N": 1048576, "K": 4096, "D": 128, "B": 32, "dtype": "fp16", "BLOCK_N": 64, "BLOCK_K": 128, "num_warps": 4, "num_stages": 2, "time_ms": 101.70038604736328, "status": "ok"}
{"N": 1048576, "K": 4096, "D": 128, "B": 32, "dtype": "fp16", "BLOCK_N": 64, "BLOCK_K": 128, "num_warps": 4, "num_stages": 4, "time_ms": 130.55267333984375, "status": "ok"}
{"N": 1048576, "K": 4096, "D": 128, "B": 32, "dtype": "fp16", "BLOCK_N": 64, "BLOCK_K": 128, "num_warps": 8, "num_stages": 1, "time_ms": 156.06092834472656, "status": "ok"}
{"N": 1048576, "K": 4096, "D": 128, "B": 32, "dtype": "fp16", "BLOCK_N": 64, "BLOCK_K": 128, "num_warps": 8, "num_stages": 2, "time_ms": 134.45187377929688, "status": "ok"}
{"N": 1048576, "K": 4096, "D": 128, "B": 32, "dtype": "fp16", "BLOCK_N": 64, "BLOCK_K": 128, "num_warps": 8, "num_stages": 4, "time_ms": 156.73715209960938, "status": "ok"}
{"N": 1048576, "K": 4096, "D": 128, "B": 32, "dtype": "fp16", "BLOCK_N": 128, "BLOCK_K": 32, "num_warps": 4, "num_stages": 1, "time_ms": 111.28300476074219, "status": "ok"}
{"N": 1048576, "K": 4096, "D": 128, "B": 32, "dtype": "fp16", "BLOCK_N": 128, "BLOCK_K": 32, "num_warps": 4, "num_stages": 2, "time_ms": 111.45308685302734, "status": "ok"}
{"N": 1048576, "K": 4096, "D": 128, "B": 32, "dtype": "fp16", "BLOCK_N": 128, "BLOCK_K": 32, "num_warps": 4, "num_stages": 4, "time_ms": 118.35775756835938, "status": "ok"}
{"N": 1048576, "K": 4096, "D": 128, "B": 32, "dtype": "fp16", "BLOCK_N": 128, "BLOCK_K": 32, "num_warps": 8, "num_stages": 1, "time_ms": 117.33110046386719, "status": "ok"}
{"N": 1048576, "K": 4096, "D": 128, "B": 32, "dtype": "fp16", "BLOCK_N": 128, "BLOCK_K": 32, "num_warps": 8, "num_stages": 2, "time_ms": 110.96969604492188, "status": "ok"}
{"N": 1048576, "K": 4096, "D": 128, "B": 32, "dtype": "fp16", "BLOCK_N": 128, "BLOCK_K": 32, "num_warps": 8, "num_stages": 4, "time_ms": 115.61097717285156, "status": "ok"}
{"N": 1048576, "K": 4096, "D": 128, "B": 32, "dtype": "fp16", "BLOCK_N": 128, "BLOCK_K": 64, "num_warps": 4, "num_stages": 1, "time_ms": 98.62844848632812, "status": "ok"}
{"N": 1048576, "K": 4096, "D": 128, "B": 32, "dtype": "fp16", "BLOCK_N": 128, "BLOCK_K": 64, "num_warps": 4, "num_stages": 2, "time_ms": 98.92841339111328, "status": "ok"}
{"N": 1048576, "K": 4096, "D": 128, "B": 32, "dtype": "fp16", "BLOCK_N": 128, "BLOCK_K": 64, "num_warps": 4, "num_stages": 4, "time_ms": 99.21379089355469, "status": "ok"}
{"N": 1048576, "K": 4096, "D": 128, "B": 32, "dtype": "fp16", "BLOCK_N": 128, "BLOCK_K": 64, "num_warps": 8, "num_stages": 1, "time_ms": 102.22525024414062, "status": "ok"}
{"N": 1048576, "K": 4096, "D": 128, "B": 32, "dtype": "fp16", "BLOCK_N": 128, "BLOCK_K": 64, "num_warps": 8, "num_stages": 2, "time_ms": 100.00672149658203, "status": "ok"}
{"N": 1048576, "K": 4096, "D": 128, "B": 32, "dtype": "fp16", "BLOCK_N": 128, "BLOCK_K": 64, "num_warps": 8, "num_stages": 4, "time_ms": 99.61587524414062, "status": "ok"}
{"N": 1048576, "K": 4096, "D": 128, "B": 32, "dtype": "fp16", "BLOCK_N": 128, "BLOCK_K": 128, "num_warps": 4, "num_stages": 1, "time_ms": 98.52178955078125, "status": "ok"}
{"N": 1048576, "K": 4096, "D": 128, "B": 32, "dtype": "fp16", "BLOCK_N": 128, "BLOCK_K": 128, "num_warps": 4, "num_stages": 2, "time_ms": 94.7580795288086, "status": "ok"}
{"N": 1048576, "K": 4096, "D": 128, "B": 32, "dtype": "fp16", "BLOCK_N": 128, "BLOCK_K": 128, "num_warps": 4, "num_stages": 4, "time_ms": 112.83363342285156, "status": "ok"}
{"N": 1048576, "K": 4096, "D": 128, "B": 32, "dtype": "fp16", "BLOCK_N": 128, "BLOCK_K": 128, "num_warps": 8, "num_stages": 1, "time_ms": 141.58883666992188, "status": "ok"}
{"N": 1048576, "K": 4096, "D": 128, "B": 32, "dtype": "fp16", "BLOCK_N": 128, "BLOCK_K": 128, "num_warps": 8, "num_stages": 2, "time_ms": 93.37926483154297, "status": "ok"}
{"N": 1048576, "K": 4096, "D": 128, "B": 32, "dtype": "fp16", "BLOCK_N": 128, "BLOCK_K": 128, "num_warps": 8, "num_stages": 4, "time_ms": 106.77308654785156, "status": "ok"}
{"summary": true, "N": 1048576, "K": 4096, "D": 128, "B": 32, "dtype": "fp16", "best": {"N": 1048576, "K": 4096, "D": 128, "B": 32, "dtype": "fp16", "BLOCK_N": 128, "BLOCK_K": 128, "num_warps": 8, "num_stages": 2, "time_ms": 93.37926483154297, "status": "ok"}, "best_time_ms": 93.37926483154297, "tuning_seconds": 89.13489484786987, "skipped": 0}
