grid_results_h200/N262144_K4096_D128_B1_fp16.jsonl
{"N": 262144, "K": 4096, "D": 128, "B": 1, "dtype": "fp16", "BLOCK_N": 32, "BLOCK_K": 32, "num_warps": 4, "num_stages": 1, "time_ms": 2.631455898284912, "status": "ok"}
{"N": 262144, "K": 4096, "D": 128, "B": 1, "dtype": "fp16", "BLOCK_N": 32, "BLOCK_K": 32, "num_warps": 4, "num_stages": 2, "time_ms": 2.152608036994934, "status": "ok"}
{"N": 262144, "K": 4096, "D": 128, "B": 1, "dtype": "fp16", "BLOCK_N": 32, "BLOCK_K": 32, "num_warps": 4, "num_stages": 4, "time_ms": 2.150847911834717, "status": "ok"}
{"N": 262144, "K": 4096, "D": 128, "B": 1, "dtype": "fp16", "BLOCK_N": 32, "BLOCK_K": 32, "num_warps": 8, "num_stages": 1, "time_ms": 3.9153919219970703, "status": "ok"}
{"N": 262144, "K": 4096, "D": 128, "B": 1, "dtype": "fp16", "BLOCK_N": 32, "BLOCK_K": 32, "num_warps": 8, "num_stages": 2, "time_ms": 3.538111925125122, "status": "ok"}
{"N": 262144, "K": 4096, "D": 128, "B": 1, "dtype": "fp16", "BLOCK_N": 32, "BLOCK_K": 32, "num_warps": 8, "num_stages": 4, "time_ms": 3.4800000190734863, "status": "ok"}
{"N": 262144, "K": 4096, "D": 128, "B": 1, "dtype": "fp16", "BLOCK_N": 32, "BLOCK_K": 64, "num_warps": 4, "num_stages": 1, "time_ms": 2.2350239753723145, "status": "ok"}
{"N": 262144, "K": 4096, "D": 128, "B": 1, "dtype": "fp16", "BLOCK_N": 32, "BLOCK_K": 64, "num_warps": 4, "num_stages": 2, "time_ms": 1.7517279982566833, "status": "ok"}
{"N": 262144, "K": 4096, "D": 128, "B": 1, "dtype": "fp16", "BLOCK_N": 32, "BLOCK_K": 64, "num_warps": 4, "num_stages": 4, "time_ms": 1.871071994304657, "status": "ok"}
{"N": 262144, "K": 4096, "D": 128, "B": 1, "dtype": "fp16", "BLOCK_N": 32, "BLOCK_K": 64, "num_warps": 8, "num_stages": 1, "time_ms": 2.6657280921936035, "status": "ok"}
{"N": 262144, "K": 4096, "D": 128, "B": 1, "dtype": "fp16", "BLOCK_N": 32, "BLOCK_K": 64, "num_warps": 8, "num_stages": 2, "time_ms": 2.283936023712158, "status": "ok"}
{"N": 262144, "K": 4096, "D": 128, "B": 1, "dtype": "fp16", "BLOCK_N": 32, "BLOCK_K": 64, "num_warps": 8, "num_stages": 4, "time_ms": 2.281440019607544, "status": "ok"}
{"N": 262144, "K": 4096, "D": 128, "B": 1, "dtype": "fp16", "BLOCK_N": 32, "BLOCK_K": 128, "num_warps": 4, "num_stages": 1, "time_ms": 1.781599998474121, "status": "ok"}
{"N": 262144, "K": 4096, "D": 128, "B": 1, "dtype": "fp16", "BLOCK_N": 32, "BLOCK_K": 128, "num_warps": 4, "num_stages": 2, "time_ms": 1.3594666719436646, "status": "ok"}
{"N": 262144, "K": 4096, "D": 128, "B": 1, "dtype": "fp16", "BLOCK_N": 32, "BLOCK_K": 128, "num_warps": 4, "num_stages": 4, "time_ms": 1.77947199344635, "status": "ok"}
{"N": 262144, "K": 4096, "D": 128, "B": 1, "dtype": "fp16", "BLOCK_N": 32, "BLOCK_K": 128, "num_warps": 8, "num_stages": 1, "time_ms": 2.4388160705566406, "status": "ok"}
{"N": 262144, "K": 4096, "D": 128, "B": 1, "dtype": "fp16", "BLOCK_N": 32, "BLOCK_K": 128, "num_warps": 8, "num_stages": 2, "time_ms": 2.0879039764404297, "status": "ok"}
{"N": 262144, "K": 4096, "D": 128, "B": 1, "dtype": "fp16", "BLOCK_N": 32, "BLOCK_K": 128, "num_warps": 8, "num_stages": 4, "time_ms": 2.1700159311294556, "status": "ok"}
{"N": 262144, "K": 4096, "D": 128, "B": 1, "dtype": "fp16", "BLOCK_N": 64, "BLOCK_K": 32, "num_warps": 4, "num_stages": 1, "time_ms": 1.063655972480774, "status": "ok"}
{"N": 262144, "K": 4096, "D": 128, "B": 1, "dtype": "fp16", "BLOCK_N": 64, "BLOCK_K": 32, "num_warps": 4, "num_stages": 2, "time_ms": 0.9111488103866577, "status": "ok"}
{"N": 262144, "K": 4096, "D": 128, "B": 1, "dtype": "fp16", "BLOCK_N": 64, "BLOCK_K": 32, "num_warps": 4, "num_stages": 4, "time_ms": 0.9304383993148804, "status": "ok"}
{"N": 262144, "K": 4096, "D": 128, "B": 1, "dtype": "fp16", "BLOCK_N": 64, "BLOCK_K": 32, "num_warps": 8, "num_stages": 1, "time_ms": 1.9433120489120483, "status": "ok"}
{"N": 262144, "K": 4096, "D": 128, "B": 1, "dtype": "fp16", "BLOCK_N": 64, "BLOCK_K": 32, "num_warps": 8, "num_stages": 2, "time_ms": 1.6990240216255188, "status": "ok"}
{"N": 262144, "K": 4096, "D": 128, "B": 1, "dtype": "fp16", "BLOCK_N": 64, "BLOCK_K": 32, "num_warps": 8, "num_stages": 4, "time_ms": 1.7053119540214539, "status": "ok"}
{"N": 262144, "K": 4096, "D": 128, "B": 1, "dtype": "fp16", "BLOCK_N": 64, "BLOCK_K": 64, "num_warps": 4, "num_stages": 1, "time_ms": 0.8776960015296936, "status": "ok"}
{"N": 262144, "K": 4096, "D": 128, "B": 1, "dtype": "fp16", "BLOCK_N": 64, "BLOCK_K": 64, "num_warps": 4, "num_stages": 2, "time_ms": 0.7855936050415039, "status": "ok"}
{"N": 262144, "K": 4096, "D": 128, "B": 1, "dtype": "fp16", "BLOCK_N": 64, "BLOCK_K": 64, "num_warps": 4, "num_stages": 4, "time_ms": 0.8215296030044555, "status": "ok"}
{"N": 262144, "K": 4096, "D": 128, "B": 1, "dtype": "fp16", "BLOCK_N": 64, "BLOCK_K": 64, "num_warps": 8, "num_stages": 1, "time_ms": 1.3589653571446736, "status": "ok"}
{"N": 262144, "K": 4096, "D": 128, "B": 1, "dtype": "fp16", "BLOCK_N": 64, "BLOCK_K": 64, "num_warps": 8, "num_stages": 2, "time_ms": 1.1925119558970134, "status": "ok"}
{"N": 262144, "K": 4096, "D": 128, "B": 1, "dtype": "fp16", "BLOCK_N": 64, "BLOCK_K": 64, "num_warps": 8, "num_stages": 4, "time_ms": 1.3446826934814453, "status": "ok"}
{"N": 262144, "K": 4096, "D": 128, "B": 1, "dtype": "fp16", "BLOCK_N": 64, "BLOCK_K": 128, "num_warps": 4, "num_stages": 1, "time_ms": 0.7846848011016846, "status": "ok"}
{"N": 262144, "K": 4096, "D": 128, "B": 1, "dtype": "fp16", "BLOCK_N": 64, "BLOCK_K": 128, "num_warps": 4, "num_stages": 2, "time_ms": 0.7895295858383179, "status": "ok"}
{"N": 262144, "K": 4096, "D": 128, "B": 1, "dtype": "fp16", "BLOCK_N": 64, "BLOCK_K": 128, "num_warps": 4, "num_stages": 4, "time_ms": 1.080191969871521, "status": "ok"}
{"N": 262144, "K": 4096, "D": 128, "B": 1, "dtype": "fp16", "BLOCK_N": 64, "BLOCK_K": 128, "num_warps": 8, "num_stages": 1, "time_ms": 1.2792747020721436, "status": "ok"}
{"N": 262144, "K": 4096, "D": 128, "B": 1, "dtype": "fp16", "BLOCK_N": 64, "BLOCK_K": 128, "num_warps": 8, "num_stages": 2, "time_ms": 1.1002160012722015, "status": "ok"}
{"N": 262144, "K": 4096, "D": 128, "B": 1, "dtype": "fp16", "BLOCK_N": 64, "BLOCK_K": 128, "num_warps": 8, "num_stages": 4, "time_ms": 1.2877119779586792, "status": "ok"}
{"N": 262144, "K": 4096, "D": 128, "B": 1, "dtype": "fp16", "BLOCK_N": 128, "BLOCK_K": 32, "num_warps": 4, "num_stages": 1, "time_ms": 0.9268288016319275, "status": "ok"}
{"N": 262144, "K": 4096, "D": 128, "B": 1, "dtype": "fp16", "BLOCK_N": 128, "BLOCK_K": 32, "num_warps": 4, "num_stages": 2, "time_ms": 0.9450159966945648, "status": "ok"}
{"N": 262144, "K": 4096, "D": 128, "B": 1, "dtype": "fp16", "BLOCK_N": 128, "BLOCK_K": 32, "num_warps": 4, "num_stages": 4, "time_ms": 0.9832160025835037, "status": "ok"}
{"N": 262144, "K": 4096, "D": 128, "B": 1, "dtype": "fp16", "BLOCK_N": 128, "BLOCK_K": 32, "num_warps": 8, "num_stages": 1, "time_ms": 0.9603440016508102, "status": "ok"}
{"N": 262144, "K": 4096, "D": 128, "B": 1, "dtype": "fp16", "BLOCK_N": 128, "BLOCK_K": 32, "num_warps": 8, "num_stages": 2, "time_ms": 0.9372560083866119, "status": "ok"}
{"N": 262144, "K": 4096, "D": 128, "B": 1, "dtype": "fp16", "BLOCK_N": 128, "BLOCK_K": 32, "num_warps": 8, "num_stages": 4, "time_ms": 0.9596239924430847, "status": "ok"}
{"N": 262144, "K": 4096, "D": 128, "B": 1, "dtype": "fp16", "BLOCK_N": 128, "BLOCK_K": 64, "num_warps": 4, "num_stages": 1, "time_ms": 0.8056447982788086, "status": "ok"}
{"N": 262144, "K": 4096, "D": 128, "B": 1, "dtype": "fp16", "BLOCK_N": 128, "BLOCK_K": 64, "num_warps": 4, "num_stages": 2, "time_ms": 0.8138944029808044, "status": "ok"}
{"N": 262144, "K": 4096, "D": 128, "B": 1, "dtype": "fp16", "BLOCK_N": 128, "BLOCK_K": 64, "num_warps": 4, "num_stages": 4, "time_ms": 0.8011839985847473, "status": "ok"}
{"N": 262144, "K": 4096, "D": 128, "B": 1, "dtype": "fp16", "BLOCK_N": 128, "BLOCK_K": 64, "num_warps": 8, "num_stages": 1, "time_ms": 0.8428992033004761, "status": "ok"}
{"N": 262144, "K": 4096, "D": 128, "B": 1, "dtype": "fp16", "BLOCK_N": 128, "BLOCK_K": 64, "num_warps": 8, "num_stages": 2, "time_ms": 0.8187327980995178, "status": "ok"}
{"N": 262144, "K": 4096, "D": 128, "B": 1, "dtype": "fp16", "BLOCK_N": 128, "BLOCK_K": 64, "num_warps": 8, "num_stages": 4, "time_ms": 0.8074368119239808, "status": "ok"}
{"N": 262144, "K": 4096, "D": 128, "B": 1, "dtype": "fp16", "BLOCK_N": 128, "BLOCK_K": 128, "num_warps": 4, "num_stages": 1, "time_ms": 0.8082687973976135, "status": "ok"}
{"N": 262144, "K": 4096, "D": 128, "B": 1, "dtype": "fp16", "BLOCK_N": 128, "BLOCK_K": 128, "num_warps": 4, "num_stages": 2, "time_ms": 0.7757759928703308, "status": "ok"}
{"N": 262144, "K": 4096, "D": 128, "B": 1, "dtype": "fp16", "BLOCK_N": 128, "BLOCK_K": 128, "num_warps": 4, "num_stages": 4, "time_ms": 0.9371920078992844, "status": "ok"}
{"N": 262144, "K": 4096, "D": 128, "B": 1, "dtype": "fp16", "BLOCK_N": 128, "BLOCK_K": 128, "num_warps": 8, "num_stages": 1, "time_ms": 1.1901439825693767, "status": "ok"}
{"N": 262144, "K": 4096, "D": 128, "B": 1, "dtype": "fp16", "BLOCK_N": 128, "BLOCK_K": 128, "num_warps": 8, "num_stages": 2, "time_ms": 0.7541439930597941, "status": "ok"}
{"N": 262144, "K": 4096, "D": 128, "B": 1, "dtype": "fp16", "BLOCK_N": 128, "BLOCK_K": 128, "num_warps": 8, "num_stages": 4, "time_ms": 0.8911615967750549, "status": "ok"}
{"summary": true, "N": 262144, "K": 4096, "D": 128, "B": 1, "dtype": "fp16", "best": {"N": 262144, "K": 4096, "D": 128, "B": 1, "dtype": "fp16", "BLOCK_N": 128, "BLOCK_K": 128, "num_warps": 8, "num_stages": 2, "time_ms": 0.7541439930597941, "status": "ok"}, "best_time_ms": 0.7541439930597941, "tuning_seconds": 11.754681825637817, "skipped": 0}
