grid_results_h200/N262144_K200000_D64_B32_fp16.jsonl
{"N": 262144, "K": 200000, "D": 64, "B": 32, "dtype": "fp16", "BLOCK_N": 32, "BLOCK_K": 32, "num_warps": 4, "num_stages": 1, "time_ms": 2614.2548828125, "status": "ok"}
{"N": 262144, "K": 200000, "D": 64, "B": 32, "dtype": "fp16", "BLOCK_N": 32, "BLOCK_K": 32, "num_warps": 4, "num_stages": 2, "time_ms": 2300.4111328125, "status": "ok"}
{"N": 262144, "K": 200000, "D": 64, "B": 32, "dtype": "fp16", "BLOCK_N": 32, "BLOCK_K": 32, "num_warps": 4, "num_stages": 4, "time_ms": 2264.920654296875, "status": "ok"}
{"N": 262144, "K": 200000, "D": 64, "B": 32, "dtype": "fp16", "BLOCK_N": 32, "BLOCK_K": 32, "num_warps": 8, "num_stages": 1, "time_ms": 4193.28173828125, "status": "ok"}
{"N": 262144, "K": 200000, "D": 64, "B": 32, "dtype": "fp16", "BLOCK_N": 32, "BLOCK_K": 32, "num_warps": 8, "num_stages": 2, "time_ms": 3966.251953125, "status": "ok"}
{"N": 262144, "K": 200000, "D": 64, "B": 32, "dtype": "fp16", "BLOCK_N": 32, "BLOCK_K": 32, "num_warps": 8, "num_stages": 4, "time_ms": 3941.68115234375, "status": "ok"}
{"N": 262144, "K": 200000, "D": 64, "B": 32, "dtype": "fp16", "BLOCK_N": 32, "BLOCK_K": 64, "num_warps": 4, "num_stages": 1, "time_ms": 2208.512939453125, "status": "ok"}
{"N": 262144, "K": 200000, "D": 64, "B": 32, "dtype": "fp16", "BLOCK_N": 32, "BLOCK_K": 64, "num_warps": 4, "num_stages": 2, "time_ms": 1935.089111328125, "status": "ok"}
{"N": 262144, "K": 200000, "D": 64, "B": 32, "dtype": "fp16", "BLOCK_N": 32, "BLOCK_K": 64, "num_warps": 4, "num_stages": 4, "time_ms": 1877.8223876953125, "status": "ok"}
{"N": 262144, "K": 200000, "D": 64, "B": 32, "dtype": "fp16", "BLOCK_N": 32, "BLOCK_K": 64, "num_warps": 8, "num_stages": 1, "time_ms": 2884.7021484375, "status": "ok"}
{"N": 262144, "K": 200000, "D": 64, "B": 32, "dtype": "fp16", "BLOCK_N": 32, "BLOCK_K": 64, "num_warps": 8, "num_stages": 2, "time_ms": 2459.608154296875, "status": "ok"}
{"N": 262144, "K": 200000, "D": 64, "B": 32, "dtype": "fp16", "BLOCK_N": 32, "BLOCK_K": 64, "num_warps": 8, "num_stages": 4, "time_ms": 2390.667236328125, "status": "ok"}
{"N": 262144, "K": 200000, "D": 64, "B": 32, "dtype": "fp16", "BLOCK_N": 32, "BLOCK_K": 128, "num_warps": 4, "num_stages": 1, "time_ms": 1880.415283203125, "status": "ok"}
{"N": 262144, "K": 200000, "D": 64, "B": 32, "dtype": "fp16", "BLOCK_N": 32, "BLOCK_K": 128, "num_warps": 4, "num_stages": 2, "time_ms": 1604.9439697265625, "status": "ok"}
{"N": 262144, "K": 200000, "D": 64, "B": 32, "dtype": "fp16", "BLOCK_N": 32, "BLOCK_K": 128, "num_warps": 4, "num_stages": 4, "time_ms": 1562.08935546875, "status": "ok"}
{"N": 262144, "K": 200000, "D": 64, "B": 32, "dtype": "fp16", "BLOCK_N": 32, "BLOCK_K": 128, "num_warps": 8, "num_stages": 1, "time_ms": 2653.1904296875, "status": "ok"}
{"N": 262144, "K": 200000, "D": 64, "B": 32, "dtype": "fp16", "BLOCK_N": 32, "BLOCK_K": 128, "num_warps": 8, "num_stages": 2, "time_ms": 2432.710205078125, "status": "ok"}
{"N": 262144, "K": 200000, "D": 64, "B": 32, "dtype": "fp16", "BLOCK_N": 32, "BLOCK_K": 128, "num_warps": 8, "num_stages": 4, "time_ms": 2267.47119140625, "status": "ok"}
{"N": 262144, "K": 200000, "D": 64, "B": 32, "dtype": "fp16", "BLOCK_N": 64, "BLOCK_K": 32, "num_warps": 4, "num_stages": 1, "time_ms": 1041.0084228515625, "status": "ok"}
{"N": 262144, "K": 200000, "D": 64, "B": 32, "dtype": "fp16", "BLOCK_N": 64, "BLOCK_K": 32, "num_warps": 4, "num_stages": 2, "time_ms": 1017.4122924804688, "status": "ok"}
{"N": 262144, "K": 200000, "D": 64, "B": 32, "dtype": "fp16", "BLOCK_N": 64, "BLOCK_K": 32, "num_warps": 4, "num_stages": 4, "time_ms": 1025.6563720703125, "status": "ok"}
{"N": 262144, "K": 200000, "D": 64, "B": 32, "dtype": "fp16", "BLOCK_N": 64, "BLOCK_K": 32, "num_warps": 8, "num_stages": 1, "time_ms": 2099.89453125, "status": "ok"}
{"N": 262144, "K": 200000, "D": 64, "B": 32, "dtype": "fp16", "BLOCK_N": 64, "BLOCK_K": 32, "num_warps": 8, "num_stages": 2, "time_ms": 1976.6900634765625, "status": "ok"}
{"N": 262144, "K": 200000, "D": 64, "B": 32, "dtype": "fp16", "BLOCK_N": 64, "BLOCK_K": 32, "num_warps": 8, "num_stages": 4, "time_ms": 1943.3074951171875, "status": "ok"}
{"N": 262144, "K": 200000, "D": 64, "B": 32, "dtype": "fp16", "BLOCK_N": 64, "BLOCK_K": 64, "num_warps": 4, "num_stages": 1, "time_ms": 980.1402587890625, "status": "ok"}
{"N": 262144, "K": 200000, "D": 64, "B": 32, "dtype": "fp16", "BLOCK_N": 64, "BLOCK_K": 64, "num_warps": 4, "num_stages": 2, "time_ms": 923.5340576171875, "status": "ok"}
{"N": 262144, "K": 200000, "D": 64, "B": 32, "dtype": "fp16", "BLOCK_N": 64, "BLOCK_K": 64, "num_warps": 4, "num_stages": 4, "time_ms": 930.42919921875, "status": "ok"}
{"N": 262144, "K": 200000, "D": 64, "B": 32, "dtype": "fp16", "BLOCK_N": 64, "BLOCK_K": 64, "num_warps": 8, "num_stages": 1, "time_ms": 1481.3179931640625, "status": "ok"}
{"N": 262144, "K": 200000, "D": 64, "B": 32, "dtype": "fp16", "BLOCK_N": 64, "BLOCK_K": 64, "num_warps": 8, "num_stages": 2, "time_ms": 1439.69287109375, "status": "ok"}
{"N": 262144, "K": 200000, "D": 64, "B": 32, "dtype": "fp16", "BLOCK_N": 64, "BLOCK_K": 64, "num_warps": 8, "num_stages": 4, "time_ms": 1387.7962646484375, "status": "ok"}
{"N": 262144, "K": 200000, "D": 64, "B": 32, "dtype": "fp16", "BLOCK_N": 64, "BLOCK_K": 128, "num_warps": 4, "num_stages": 1, "time_ms": 1042.169189453125, "status": "ok"}
{"N": 262144, "K": 200000, "D": 64, "B": 32, "dtype": "fp16", "BLOCK_N": 64, "BLOCK_K": 128, "num_warps": 4, "num_stages": 2, "time_ms": 965.0256958007812, "status": "ok"}
{"N": 262144, "K": 200000, "D": 64, "B": 32, "dtype": "fp16", "BLOCK_N": 64, "BLOCK_K": 128, "num_warps": 4, "num_stages": 4, "time_ms": 955.9564819335938, "status": "ok"}
{"N": 262144, "K": 200000, "D": 64, "B": 32, "dtype": "fp16", "BLOCK_N": 64, "BLOCK_K": 128, "num_warps": 8, "num_stages": 1, "time_ms": 1636.365966796875, "status": "ok"}
{"N": 262144, "K": 200000, "D": 64, "B": 32, "dtype": "fp16", "BLOCK_N": 64, "BLOCK_K": 128, "num_warps": 8, "num_stages": 2, "time_ms": 1509.387939453125, "status": "ok"}
{"N": 262144, "K": 200000, "D": 64, "B": 32, "dtype": "fp16", "BLOCK_N": 64, "BLOCK_K": 128, "num_warps": 8, "num_stages": 4, "time_ms": 1450.0208740234375, "status": "ok"}
{"N": 262144, "K": 200000, "D": 64, "B": 32, "dtype": "fp16", "BLOCK_N": 128, "BLOCK_K": 32, "num_warps": 4, "num_stages": 1, "time_ms": 1005.6502075195312, "status": "ok"}
{"N": 262144, "K": 200000, "D": 64, "B": 32, "dtype": "fp16", "BLOCK_N": 128, "BLOCK_K": 32, "num_warps": 4, "num_stages": 2, "time_ms": 982.9775390625, "status": "ok"}
{"N": 262144, "K": 200000, "D": 64, "B": 32, "dtype": "fp16", "BLOCK_N": 128, "BLOCK_K": 32, "num_warps": 4, "num_stages": 4, "time_ms": 999.7781372070312, "status": "ok"}
{"N": 262144, "K": 200000, "D": 64, "B": 32, "dtype": "fp16", "BLOCK_N": 128, "BLOCK_K": 32, "num_warps": 8, "num_stages": 1, "time_ms": 1056.0318603515625, "status": "ok"}
{"N": 262144, "K": 200000, "D": 64, "B": 32, "dtype": "fp16", "BLOCK_N": 128, "BLOCK_K": 32, "num_warps": 8, "num_stages": 2, "time_ms": 1107.1973876953125, "status": "ok"}
{"N": 262144, "K": 200000, "D": 64, "B": 32, "dtype": "fp16", "BLOCK_N": 128, "BLOCK_K": 32, "num_warps": 8, "num_stages": 4, "time_ms": 1089.5550537109375, "status": "ok"}
{"N": 262144, "K": 200000, "D": 64, "B": 32, "dtype": "fp16", "BLOCK_N": 128, "BLOCK_K": 64, "num_warps": 4, "num_stages": 1, "time_ms": 962.8562622070312, "status": "ok"}
{"N": 262144, "K": 200000, "D": 64, "B": 32, "dtype": "fp16", "BLOCK_N": 128, "BLOCK_K": 64, "num_warps": 4, "num_stages": 2, "time_ms": 883.5862426757812, "status": "ok"}
{"N": 262144, "K": 200000, "D": 64, "B": 32, "dtype": "fp16", "BLOCK_N": 128, "BLOCK_K": 64, "num_warps": 4, "num_stages": 4, "time_ms": 892.860595703125, "status": "ok"}
{"N": 262144, "K": 200000, "D": 64, "B": 32, "dtype": "fp16", "BLOCK_N": 128, "BLOCK_K": 64, "num_warps": 8, "num_stages": 1, "time_ms": 1011.345458984375, "status": "ok"}
{"N": 262144, "K": 200000, "D": 64, "B": 32, "dtype": "fp16", "BLOCK_N": 128, "BLOCK_K": 64, "num_warps": 8, "num_stages": 2, "time_ms": 964.0270385742188, "status": "ok"}
{"N": 262144, "K": 200000, "D": 64, "B": 32, "dtype": "fp16", "BLOCK_N": 128, "BLOCK_K": 64, "num_warps": 8, "num_stages": 4, "time_ms": 940.3504638671875, "status": "ok"}
{"N": 262144, "K": 200000, "D": 64, "B": 32, "dtype": "fp16", "BLOCK_N": 128, "BLOCK_K": 128, "num_warps": 4, "num_stages": 1, "time_ms": 1008.7393798828125, "status": "ok"}
{"N": 262144, "K": 200000, "D": 64, "B": 32, "dtype": "fp16", "BLOCK_N": 128, "BLOCK_K": 128, "num_warps": 4, "num_stages": 2, "time_ms": 998.9276733398438, "status": "ok"}
{"N": 262144, "K": 200000, "D": 64, "B": 32, "dtype": "fp16", "BLOCK_N": 128, "BLOCK_K": 128, "num_warps": 4, "num_stages": 4, "time_ms": 960.2922973632812, "status": "ok"}
{"N": 262144, "K": 200000, "D": 64, "B": 32, "dtype": "fp16", "BLOCK_N": 128, "BLOCK_K": 128, "num_warps": 8, "num_stages": 1, "time_ms": 1560.0552978515625, "status": "ok"}
{"N": 262144, "K": 200000, "D": 64, "B": 32, "dtype": "fp16", "BLOCK_N": 128, "BLOCK_K": 128, "num_warps": 8, "num_stages": 2, "time_ms": 1459.090576171875, "status": "ok"}
{"N": 262144, "K": 200000, "D": 64, "B": 32, "dtype": "fp16", "BLOCK_N": 128, "BLOCK_K": 128, "num_warps": 8, "num_stages": 4, "time_ms": 1274.44921875, "status": "ok"}
{"summary": true, "N": 262144, "K": 200000, "D": 64, "B": 32, "dtype": "fp16", "best": {"N": 262144, "K": 200000, "D": 64, "B": 32, "dtype": "fp16", "BLOCK_N": 128, "BLOCK_K": 64, "num_warps": 4, "num_stages": 2, "time_ms": 883.5862426757812, "status": "ok"}, "best_time_ms": 883.5862426757812, "tuning_seconds": 716.7673389911652, "skipped": 0}
