grid_results_h200/N262144_K200000_D128_B1_fp16.jsonl
{"N": 262144, "K": 200000, "D": 128, "B": 1, "dtype": "fp16", "BLOCK_N": 32, "BLOCK_K": 32, "num_warps": 4, "num_stages": 1, "time_ms": 128.19769287109375, "status": "ok"}
{"N": 262144, "K": 200000, "D": 128, "B": 1, "dtype": "fp16", "BLOCK_N": 32, "BLOCK_K": 32, "num_warps": 4, "num_stages": 2, "time_ms": 105.04073333740234, "status": "ok"}
{"N": 262144, "K": 200000, "D": 128, "B": 1, "dtype": "fp16", "BLOCK_N": 32, "BLOCK_K": 32, "num_warps": 4, "num_stages": 4, "time_ms": 104.13737487792969, "status": "ok"}
{"N": 262144, "K": 200000, "D": 128, "B": 1, "dtype": "fp16", "BLOCK_N": 32, "BLOCK_K": 32, "num_warps": 8, "num_stages": 1, "time_ms": 192.0603485107422, "status": "ok"}
{"N": 262144, "K": 200000, "D": 128, "B": 1, "dtype": "fp16", "BLOCK_N": 32, "BLOCK_K": 32, "num_warps": 8, "num_stages": 2, "time_ms": 173.54669189453125, "status": "ok"}
{"N": 262144, "K": 200000, "D": 128, "B": 1, "dtype": "fp16", "BLOCK_N": 32, "BLOCK_K": 32, "num_warps": 8, "num_stages": 4, "time_ms": 168.80950927734375, "status": "ok"}
{"N": 262144, "K": 200000, "D": 128, "B": 1, "dtype": "fp16", "BLOCK_N": 32, "BLOCK_K": 64, "num_warps": 4, "num_stages": 1, "time_ms": 109.25676727294922, "status": "ok"}
{"N": 262144, "K": 200000, "D": 128, "B": 1, "dtype": "fp16", "BLOCK_N": 32, "BLOCK_K": 64, "num_warps": 4, "num_stages": 2, "time_ms": 84.57599639892578, "status": "ok"}
{"N": 262144, "K": 200000, "D": 128, "B": 1, "dtype": "fp16", "BLOCK_N": 32, "BLOCK_K": 64, "num_warps": 4, "num_stages": 4, "time_ms": 100.91200256347656, "status": "ok"}
{"N": 262144, "K": 200000, "D": 128, "B": 1, "dtype": "fp16", "BLOCK_N": 32, "BLOCK_K": 64, "num_warps": 8, "num_stages": 1, "time_ms": 130.3553009033203, "status": "ok"}
{"N": 262144, "K": 200000, "D": 128, "B": 1, "dtype": "fp16", "BLOCK_N": 32, "BLOCK_K": 64, "num_warps": 8, "num_stages": 2, "time_ms": 112.39622497558594, "status": "ok"}
{"N": 262144, "K": 200000, "D": 128, "B": 1, "dtype": "fp16", "BLOCK_N": 32, "BLOCK_K": 64, "num_warps": 8, "num_stages": 4, "time_ms": 110.37174224853516, "status": "ok"}
{"N": 262144, "K": 200000, "D": 128, "B": 1, "dtype": "fp16", "BLOCK_N": 32, "BLOCK_K": 128, "num_warps": 4, "num_stages": 1, "time_ms": 88.13609313964844, "status": "ok"}
{"N": 262144, "K": 200000, "D": 128, "B": 1, "dtype": "fp16", "BLOCK_N": 32, "BLOCK_K": 128, "num_warps": 4, "num_stages": 2, "time_ms": 68.71324920654297, "status": "ok"}
{"N": 262144, "K": 200000, "D": 128, "B": 1, "dtype": "fp16", "BLOCK_N": 32, "BLOCK_K": 128, "num_warps": 4, "num_stages": 4, "time_ms": 90.93753814697266, "status": "ok"}
{"N": 262144, "K": 200000, "D": 128, "B": 1, "dtype": "fp16", "BLOCK_N": 32, "BLOCK_K": 128, "num_warps": 8, "num_stages": 1, "time_ms": 119.6977310180664, "status": "ok"}
{"N": 262144, "K": 200000, "D": 128, "B": 1, "dtype": "fp16", "BLOCK_N": 32, "BLOCK_K": 128, "num_warps": 8, "num_stages": 2, "time_ms": 100.28256225585938, "status": "ok"}
{"N": 262144, "K": 200000, "D": 128, "B": 1, "dtype": "fp16", "BLOCK_N": 32, "BLOCK_K": 128, "num_warps": 8, "num_stages": 4, "time_ms": 105.8116455078125, "status": "ok"}
{"N": 262144, "K": 200000, "D": 128, "B": 1, "dtype": "fp16", "BLOCK_N": 64, "BLOCK_K": 32, "num_warps": 4, "num_stages": 1, "time_ms": 51.9931526184082, "status": "ok"}
{"N": 262144, "K": 200000, "D": 128, "B": 1, "dtype": "fp16", "BLOCK_N": 64, "BLOCK_K": 32, "num_warps": 4, "num_stages": 2, "time_ms": 46.29008102416992, "status": "ok"}
{"N": 262144, "K": 200000, "D": 128, "B": 1, "dtype": "fp16", "BLOCK_N": 64, "BLOCK_K": 32, "num_warps": 4, "num_stages": 4, "time_ms": 46.15852737426758, "status": "ok"}
{"N": 262144, "K": 200000, "D": 128, "B": 1, "dtype": "fp16", "BLOCK_N": 64, "BLOCK_K": 32, "num_warps": 8, "num_stages": 1, "time_ms": 94.03839874267578, "status": "ok"}
{"N": 262144, "K": 200000, "D": 128, "B": 1, "dtype": "fp16", "BLOCK_N": 64, "BLOCK_K": 32, "num_warps": 8, "num_stages": 2, "time_ms": 82.38162994384766, "status": "ok"}
{"N": 262144, "K": 200000, "D": 128, "B": 1, "dtype": "fp16", "BLOCK_N": 64, "BLOCK_K": 32, "num_warps": 8, "num_stages": 4, "time_ms": 81.92435455322266, "status": "ok"}
{"N": 262144, "K": 200000, "D": 128, "B": 1, "dtype": "fp16", "BLOCK_N": 64, "BLOCK_K": 64, "num_warps": 4, "num_stages": 1, "time_ms": 45.08998489379883, "status": "ok"}
{"N": 262144, "K": 200000, "D": 128, "B": 1, "dtype": "fp16", "BLOCK_N": 64, "BLOCK_K": 64, "num_warps": 4, "num_stages": 2, "time_ms": 43.478240966796875, "status": "ok"}
{"N": 262144, "K": 200000, "D": 128, "B": 1, "dtype": "fp16", "BLOCK_N": 64, "BLOCK_K": 64, "num_warps": 4, "num_stages": 4, "time_ms": 49.116127014160156, "status": "ok"}
{"N": 262144, "K": 200000, "D": 128, "B": 1, "dtype": "fp16", "BLOCK_N": 64, "BLOCK_K": 64, "num_warps": 8, "num_stages": 1, "time_ms": 66.5964126586914, "status": "ok"}
{"N": 262144, "K": 200000, "D": 128, "B": 1, "dtype": "fp16", "BLOCK_N": 64, "BLOCK_K": 64, "num_warps": 8, "num_stages": 2, "time_ms": 57.36598587036133, "status": "ok"}
{"N": 262144, "K": 200000, "D": 128, "B": 1, "dtype": "fp16", "BLOCK_N": 64, "BLOCK_K": 64, "num_warps": 8, "num_stages": 4, "time_ms": 63.80246353149414, "status": "ok"}
{"N": 262144, "K": 200000, "D": 128, "B": 1, "dtype": "fp16", "BLOCK_N": 64, "BLOCK_K": 128, "num_warps": 4, "num_stages": 1, "time_ms": 44.606910705566406, "status": "ok"}
{"N": 262144, "K": 200000, "D": 128, "B": 1, "dtype": "fp16", "BLOCK_N": 64, "BLOCK_K": 128, "num_warps": 4, "num_stages": 2, "time_ms": 46.14339065551758, "status": "ok"}
{"N": 262144, "K": 200000, "D": 128, "B": 1, "dtype": "fp16", "BLOCK_N": 64, "BLOCK_K": 128, "num_warps": 4, "num_stages": 4, "time_ms": 64.1626205444336, "status": "ok"}
{"N": 262144, "K": 200000, "D": 128, "B": 1, "dtype": "fp16", "BLOCK_N": 64, "BLOCK_K": 128, "num_warps": 8, "num_stages": 1, "time_ms": 67.10765075683594, "status": "ok"}
{"N": 262144, "K": 200000, "D": 128, "B": 1, "dtype": "fp16", "BLOCK_N": 64, "BLOCK_K": 128, "num_warps": 8, "num_stages": 2, "time_ms": 60.63539123535156, "status": "ok"}
{"N": 262144, "K": 200000, "D": 128, "B": 1, "dtype": "fp16", "BLOCK_N": 64, "BLOCK_K": 128, "num_warps": 8, "num_stages": 4, "time_ms": 75.49932861328125, "status": "ok"}
{"N": 262144, "K": 200000, "D": 128, "B": 1, "dtype": "fp16", "BLOCK_N": 128, "BLOCK_K": 32, "num_warps": 4, "num_stages": 1, "time_ms": 44.3853759765625, "status": "ok"}
{"N": 262144, "K": 200000, "D": 128, "B": 1, "dtype": "fp16", "BLOCK_N": 128, "BLOCK_K": 32, "num_warps": 4, "num_stages": 2, "time_ms": 46.28313446044922, "status": "ok"}
{"N": 262144, "K": 200000, "D": 128, "B": 1, "dtype": "fp16", "BLOCK_N": 128, "BLOCK_K": 32, "num_warps": 4, "num_stages": 4, "time_ms": 46.67318344116211, "status": "ok"}
{"N": 262144, "K": 200000, "D": 128, "B": 1, "dtype": "fp16", "BLOCK_N": 128, "BLOCK_K": 32, "num_warps": 8, "num_stages": 1, "time_ms": 46.481407165527344, "status": "ok"}
{"N": 262144, "K": 200000, "D": 128, "B": 1, "dtype": "fp16", "BLOCK_N": 128, "BLOCK_K": 32, "num_warps": 8, "num_stages": 2, "time_ms": 45.33244705200195, "status": "ok"}
{"N": 262144, "K": 200000, "D": 128, "B": 1, "dtype": "fp16", "BLOCK_N": 128, "BLOCK_K": 32, "num_warps": 8, "num_stages": 4, "time_ms": 45.45916748046875, "status": "ok"}
{"N": 262144, "K": 200000, "D": 128, "B": 1, "dtype": "fp16", "BLOCK_N": 128, "BLOCK_K": 64, "num_warps": 4, "num_stages": 1, "time_ms": 39.913726806640625, "status": "ok"}
{"N": 262144, "K": 200000, "D": 128, "B": 1, "dtype": "fp16", "BLOCK_N": 128, "BLOCK_K": 64, "num_warps": 4, "num_stages": 2, "time_ms": 39.448097229003906, "status": "ok"}
{"N": 262144, "K": 200000, "D": 128, "B": 1, "dtype": "fp16", "BLOCK_N": 128, "BLOCK_K": 64, "num_warps": 4, "num_stages": 4, "time_ms": 39.1993293762207, "status": "ok"}
{"N": 262144, "K": 200000, "D": 128, "B": 1, "dtype": "fp16", "BLOCK_N": 128, "BLOCK_K": 64, "num_warps": 8, "num_stages": 1, "time_ms": 40.90028762817383, "status": "ok"}
{"N": 262144, "K": 200000, "D": 128, "B": 1, "dtype": "fp16", "BLOCK_N": 128, "BLOCK_K": 64, "num_warps": 8, "num_stages": 2, "time_ms": 39.88643264770508, "status": "ok"}
{"N": 262144, "K": 200000, "D": 128, "B": 1, "dtype": "fp16", "BLOCK_N": 128, "BLOCK_K": 64, "num_warps": 8, "num_stages": 4, "time_ms": 38.85232162475586, "status": "ok"}
{"N": 262144, "K": 200000, "D": 128, "B": 1, "dtype": "fp16", "BLOCK_N": 128, "BLOCK_K": 128, "num_warps": 4, "num_stages": 1, "time_ms": 45.9192008972168, "status": "ok"}
{"N": 262144, "K": 200000, "D": 128, "B": 1, "dtype": "fp16", "BLOCK_N": 128, "BLOCK_K": 128, "num_warps": 4, "num_stages": 2, "time_ms": 41.17148971557617, "status": "ok"}
{"N": 262144, "K": 200000, "D": 128, "B": 1, "dtype": "fp16", "BLOCK_N": 128, "BLOCK_K": 128, "num_warps": 4, "num_stages": 4, "time_ms": 48.32400131225586, "status": "ok"}
{"N": 262144, "K": 200000, "D": 128, "B": 1, "dtype": "fp16", "BLOCK_N": 128, "BLOCK_K": 128, "num_warps": 8, "num_stages": 1, "time_ms": 72.45926666259766, "status": "ok"}
{"N": 262144, "K": 200000, "D": 128, "B": 1, "dtype": "fp16", "BLOCK_N": 128, "BLOCK_K": 128, "num_warps": 8, "num_stages": 2, "time_ms": 61.6596794128418, "status": "ok"}
{"N": 262144, "K": 200000, "D": 128, "B": 1, "dtype": "fp16", "BLOCK_N": 128, "BLOCK_K": 128, "num_warps": 8, "num_stages": 4, "time_ms": 50.31411361694336, "status": "ok"}
{"summary": true, "N": 262144, "K": 200000, "D": 128, "B": 1, "dtype": "fp16", "best": {"N": 262144, "K": 200000, "D": 128, "B": 1, "dtype": "fp16", "BLOCK_N": 128, "BLOCK_K": 64, "num_warps": 8, "num_stages": 4, "time_ms": 38.85232162475586, "status": "ok"}, "best_time_ms": 38.85232162475586, "tuning_seconds": 43.490023612976074, "skipped": 0}
