grid_results_h200/N262144_K16384_D128_B32_fp16.jsonl
{"N": 262144, "K": 16384, "D": 128, "B": 32, "dtype": "fp16", "BLOCK_N": 32, "BLOCK_K": 32, "num_warps": 4, "num_stages": 1, "time_ms": 325.9187316894531, "status": "ok"}
{"N": 262144, "K": 16384, "D": 128, "B": 32, "dtype": "fp16", "BLOCK_N": 32, "BLOCK_K": 32, "num_warps": 4, "num_stages": 2, "time_ms": 265.12255859375, "status": "ok"}
{"N": 262144, "K": 16384, "D": 128, "B": 32, "dtype": "fp16", "BLOCK_N": 32, "BLOCK_K": 32, "num_warps": 4, "num_stages": 4, "time_ms": 265.64227294921875, "status": "ok"}
{"N": 262144, "K": 16384, "D": 128, "B": 32, "dtype": "fp16", "BLOCK_N": 32, "BLOCK_K": 32, "num_warps": 8, "num_stages": 1, "time_ms": 486.5690002441406, "status": "ok"}
{"N": 262144, "K": 16384, "D": 128, "B": 32, "dtype": "fp16", "BLOCK_N": 32, "BLOCK_K": 32, "num_warps": 8, "num_stages": 2, "time_ms": 438.5028381347656, "status": "ok"}
{"N": 262144, "K": 16384, "D": 128, "B": 32, "dtype": "fp16", "BLOCK_N": 32, "BLOCK_K": 32, "num_warps": 8, "num_stages": 4, "time_ms": 431.8052978515625, "status": "ok"}
{"N": 262144, "K": 16384, "D": 128, "B": 32, "dtype": "fp16", "BLOCK_N": 32, "BLOCK_K": 64, "num_warps": 4, "num_stages": 1, "time_ms": 276.9755554199219, "status": "ok"}
{"N": 262144, "K": 16384, "D": 128, "B": 32, "dtype": "fp16", "BLOCK_N": 32, "BLOCK_K": 64, "num_warps": 4, "num_stages": 2, "time_ms": 215.37635803222656, "status": "ok"}
{"N": 262144, "K": 16384, "D": 128, "B": 32, "dtype": "fp16", "BLOCK_N": 32, "BLOCK_K": 64, "num_warps": 4, "num_stages": 4, "time_ms": 231.31666564941406, "status": "ok"}
{"N": 262144, "K": 16384, "D": 128, "B": 32, "dtype": "fp16", "BLOCK_N": 32, "BLOCK_K": 64, "num_warps": 8, "num_stages": 1, "time_ms": 331.9950866699219, "status": "ok"}
{"N": 262144, "K": 16384, "D": 128, "B": 32, "dtype": "fp16", "BLOCK_N": 32, "BLOCK_K": 64, "num_warps": 8, "num_stages": 2, "time_ms": 282.2333068847656, "status": "ok"}
{"N": 262144, "K": 16384, "D": 128, "B": 32, "dtype": "fp16", "BLOCK_N": 32, "BLOCK_K": 64, "num_warps": 8, "num_stages": 4, "time_ms": 281.98590087890625, "status": "ok"}
{"N": 262144, "K": 16384, "D": 128, "B": 32, "dtype": "fp16", "BLOCK_N": 32, "BLOCK_K": 128, "num_warps": 4, "num_stages": 1, "time_ms": 220.93942260742188, "status": "ok"}
{"N": 262144, "K": 16384, "D": 128, "B": 32, "dtype": "fp16", "BLOCK_N": 32, "BLOCK_K": 128, "num_warps": 4, "num_stages": 2, "time_ms": 173.6419219970703, "status": "ok"}
{"N": 262144, "K": 16384, "D": 128, "B": 32, "dtype": "fp16", "BLOCK_N": 32, "BLOCK_K": 128, "num_warps": 4, "num_stages": 4, "time_ms": 229.32818603515625, "status": "ok"}
{"N": 262144, "K": 16384, "D": 128, "B": 32, "dtype": "fp16", "BLOCK_N": 32, "BLOCK_K": 128, "num_warps": 8, "num_stages": 1, "time_ms": 303.55914306640625, "status": "ok"}
{"N": 262144, "K": 16384, "D": 128, "B": 32, "dtype": "fp16", "BLOCK_N": 32, "BLOCK_K": 128, "num_warps": 8, "num_stages": 2, "time_ms": 257.71923828125, "status": "ok"}
{"N": 262144, "K": 16384, "D": 128, "B": 32, "dtype": "fp16", "BLOCK_N": 32, "BLOCK_K": 128, "num_warps": 8, "num_stages": 4, "time_ms": 267.7060241699219, "status": "ok"}
{"N": 262144, "K": 16384, "D": 128, "B": 32, "dtype": "fp16", "BLOCK_N": 64, "BLOCK_K": 32, "num_warps": 4, "num_stages": 1, "time_ms": 142.56886291503906, "status": "ok"}
{"N": 262144, "K": 16384, "D": 128, "B": 32, "dtype": "fp16", "BLOCK_N": 64, "BLOCK_K": 32, "num_warps": 4, "num_stages": 2, "time_ms": 121.58889770507812, "status": "ok"}
{"N": 262144, "K": 16384, "D": 128, "B": 32, "dtype": "fp16", "BLOCK_N": 64, "BLOCK_K": 32, "num_warps": 4, "num_stages": 4, "time_ms": 127.089599609375, "status": "ok"}
{"N": 262144, "K": 16384, "D": 128, "B": 32, "dtype": "fp16", "BLOCK_N": 64, "BLOCK_K": 32, "num_warps": 8, "num_stages": 1, "time_ms": 237.02330017089844, "status": "ok"}
{"N": 262144, "K": 16384, "D": 128, "B": 32, "dtype": "fp16", "BLOCK_N": 64, "BLOCK_K": 32, "num_warps": 8, "num_stages": 2, "time_ms": 204.5806121826172, "status": "ok"}
{"N": 262144, "K": 16384, "D": 128, "B": 32, "dtype": "fp16", "BLOCK_N": 64, "BLOCK_K": 32, "num_warps": 8, "num_stages": 4, "time_ms": 206.15475463867188, "status": "ok"}
{"N": 262144, "K": 16384, "D": 128, "B": 32, "dtype": "fp16", "BLOCK_N": 64, "BLOCK_K": 64, "num_warps": 4, "num_stages": 1, "time_ms": 115.1204833984375, "status": "ok"}
{"N": 262144, "K": 16384, "D": 128, "B": 32, "dtype": "fp16", "BLOCK_N": 64, "BLOCK_K": 64, "num_warps": 4, "num_stages": 2, "time_ms": 100.78809356689453, "status": "ok"}
{"N": 262144, "K": 16384, "D": 128, "B": 32, "dtype": "fp16", "BLOCK_N": 64, "BLOCK_K": 64, "num_warps": 4, "num_stages": 4, "time_ms": 106.5097885131836, "status": "ok"}
{"N": 262144, "K": 16384, "D": 128, "B": 32, "dtype": "fp16", "BLOCK_N": 64, "BLOCK_K": 64, "num_warps": 8, "num_stages": 1, "time_ms": 165.7511749267578, "status": "ok"}
{"N": 262144, "K": 16384, "D": 128, "B": 32, "dtype": "fp16", "BLOCK_N": 64, "BLOCK_K": 64, "num_warps": 8, "num_stages": 2, "time_ms": 146.88905334472656, "status": "ok"}
{"N": 262144, "K": 16384, "D": 128, "B": 32, "dtype": "fp16", "BLOCK_N": 64, "BLOCK_K": 64, "num_warps": 8, "num_stages": 4, "time_ms": 164.13235473632812, "status": "ok"}
{"N": 262144, "K": 16384, "D": 128, "B": 32, "dtype": "fp16", "BLOCK_N": 64, "BLOCK_K": 128, "num_warps": 4, "num_stages": 1, "time_ms": 103.92233276367188, "status": "ok"}
{"N": 262144, "K": 16384, "D": 128, "B": 32, "dtype": "fp16", "BLOCK_N": 64, "BLOCK_K": 128, "num_warps": 4, "num_stages": 2, "time_ms": 101.60626983642578, "status": "ok"}
{"N": 262144, "K": 16384, "D": 128, "B": 32, "dtype": "fp16", "BLOCK_N": 64, "BLOCK_K": 128, "num_warps": 4, "num_stages": 4, "time_ms": 127.06342315673828, "status": "ok"}
{"N": 262144, "K": 16384, "D": 128, "B": 32, "dtype": "fp16", "BLOCK_N": 64, "BLOCK_K": 128, "num_warps": 8, "num_stages": 1, "time_ms": 156.6973114013672, "status": "ok"}
{"N": 262144, "K": 16384, "D": 128, "B": 32, "dtype": "fp16", "BLOCK_N": 64, "BLOCK_K": 128, "num_warps": 8, "num_stages": 2, "time_ms": 134.35504150390625, "status": "ok"}
{"N": 262144, "K": 16384, "D": 128, "B": 32, "dtype": "fp16", "BLOCK_N": 64, "BLOCK_K": 128, "num_warps": 8, "num_stages": 4, "time_ms": 152.79910278320312, "status": "ok"}
{"N": 262144, "K": 16384, "D": 128, "B": 32, "dtype": "fp16", "BLOCK_N": 128, "BLOCK_K": 32, "num_warps": 4, "num_stages": 1, "time_ms": 112.79119873046875, "status": "ok"}
{"N": 262144, "K": 16384, "D": 128, "B": 32, "dtype": "fp16", "BLOCK_N": 128, "BLOCK_K": 32, "num_warps": 4, "num_stages": 2, "time_ms": 112.65103912353516, "status": "ok"}
{"N": 262144, "K": 16384, "D": 128, "B": 32, "dtype": "fp16", "BLOCK_N": 128, "BLOCK_K": 32, "num_warps": 4, "num_stages": 4, "time_ms": 118.25321960449219, "status": "ok"}
{"N": 262144, "K": 16384, "D": 128, "B": 32, "dtype": "fp16", "BLOCK_N": 128, "BLOCK_K": 32, "num_warps": 8, "num_stages": 1, "time_ms": 121.52365112304688, "status": "ok"}
{"N": 262144, "K": 16384, "D": 128, "B": 32, "dtype": "fp16", "BLOCK_N": 128, "BLOCK_K": 32, "num_warps": 8, "num_stages": 2, "time_ms": 112.70992279052734, "status": "ok"}
{"N": 262144, "K": 16384, "D": 128, "B": 32, "dtype": "fp16", "BLOCK_N": 128, "BLOCK_K": 32, "num_warps": 8, "num_stages": 4, "time_ms": 118.1674575805664, "status": "ok"}
{"N": 262144, "K": 16384, "D": 128, "B": 32, "dtype": "fp16", "BLOCK_N": 128, "BLOCK_K": 64, "num_warps": 4, "num_stages": 1, "time_ms": 99.11872100830078, "status": "ok"}
{"N": 262144, "K": 16384, "D": 128, "B": 32, "dtype": "fp16", "BLOCK_N": 128, "BLOCK_K": 64, "num_warps": 4, "num_stages": 2, "time_ms": 99.18051147460938, "status": "ok"}
{"N": 262144, "K": 16384, "D": 128, "B": 32, "dtype": "fp16", "BLOCK_N": 128, "BLOCK_K": 64, "num_warps": 4, "num_stages": 4, "time_ms": 98.48873901367188, "status": "ok"}
{"N": 262144, "K": 16384, "D": 128, "B": 32, "dtype": "fp16", "BLOCK_N": 128, "BLOCK_K": 64, "num_warps": 8, "num_stages": 1, "time_ms": 101.82758331298828, "status": "ok"}
{"N": 262144, "K": 16384, "D": 128, "B": 32, "dtype": "fp16", "BLOCK_N": 128, "BLOCK_K": 64, "num_warps": 8, "num_stages": 2, "time_ms": 99.70825958251953, "status": "ok"}
{"N": 262144, "K": 16384, "D": 128, "B": 32, "dtype": "fp16", "BLOCK_N": 128, "BLOCK_K": 64, "num_warps": 8, "num_stages": 4, "time_ms": 100.30553436279297, "status": "ok"}
{"N": 262144, "K": 16384, "D": 128, "B": 32, "dtype": "fp16", "BLOCK_N": 128, "BLOCK_K": 128, "num_warps": 4, "num_stages": 1, "time_ms": 97.57324981689453, "status": "ok"}
{"N": 262144, "K": 16384, "D": 128, "B": 32, "dtype": "fp16", "BLOCK_N": 128, "BLOCK_K": 128, "num_warps": 4, "num_stages": 2, "time_ms": 93.812255859375, "status": "ok"}
{"N": 262144, "K": 16384, "D": 128, "B": 32, "dtype": "fp16", "BLOCK_N": 128, "BLOCK_K": 128, "num_warps": 4, "num_stages": 4, "time_ms": 110.24765014648438, "status": "ok"}
{"N": 262144, "K": 16384, "D": 128, "B": 32, "dtype": "fp16", "BLOCK_N": 128, "BLOCK_K": 128, "num_warps": 8, "num_stages": 1, "time_ms": 140.25164794921875, "status": "ok"}
{"N": 262144, "K": 16384, "D": 128, "B": 32, "dtype": "fp16", "BLOCK_N": 128, "BLOCK_K": 128, "num_warps": 8, "num_stages": 2, "time_ms": 92.42352294921875, "status": "ok"}
{"N": 262144, "K": 16384, "D": 128, "B": 32, "dtype": "fp16", "BLOCK_N": 128, "BLOCK_K": 128, "num_warps": 8, "num_stages": 4, "time_ms": 104.27385711669922, "status": "ok"}
{"summary": true, "N": 262144, "K": 16384, "D": 128, "B": 32, "dtype": "fp16", "best": {"N": 262144, "K": 16384, "D": 128, "B": 32, "dtype": "fp16", "BLOCK_N": 128, "BLOCK_K": 128, "num_warps": 8, "num_stages": 2, "time_ms": 92.42352294921875, "status": "ok"}, "best_time_ms": 92.42352294921875, "tuning_seconds": 88.98647999763489, "skipped": 0}
