grid_results_h200/N262144_K1024_D128_B32_fp16.jsonl
{"N": 262144, "K": 1024, "D": 128, "B": 32, "dtype": "fp16", "BLOCK_N": 32, "BLOCK_K": 32, "num_warps": 4, "num_stages": 1, "time_ms": 20.66655921936035, "status": "ok"}
{"N": 262144, "K": 1024, "D": 128, "B": 32, "dtype": "fp16", "BLOCK_N": 32, "BLOCK_K": 32, "num_warps": 4, "num_stages": 2, "time_ms": 17.00432014465332, "status": "ok"}
{"N": 262144, "K": 1024, "D": 128, "B": 32, "dtype": "fp16", "BLOCK_N": 32, "BLOCK_K": 32, "num_warps": 4, "num_stages": 4, "time_ms": 17.2043514251709, "status": "ok"}
{"N": 262144, "K": 1024, "D": 128, "B": 32, "dtype": "fp16", "BLOCK_N": 32, "BLOCK_K": 32, "num_warps": 8, "num_stages": 1, "time_ms": 30.62259292602539, "status": "ok"}
{"N": 262144, "K": 1024, "D": 128, "B": 32, "dtype": "fp16", "BLOCK_N": 32, "BLOCK_K": 32, "num_warps": 8, "num_stages": 2, "time_ms": 27.963584899902344, "status": "ok"}
{"N": 262144, "K": 1024, "D": 128, "B": 32, "dtype": "fp16", "BLOCK_N": 32, "BLOCK_K": 32, "num_warps": 8, "num_stages": 4, "time_ms": 27.764991760253906, "status": "ok"}
{"N": 262144, "K": 1024, "D": 128, "B": 32, "dtype": "fp16", "BLOCK_N": 32, "BLOCK_K": 64, "num_warps": 4, "num_stages": 1, "time_ms": 17.66681671142578, "status": "ok"}
{"N": 262144, "K": 1024, "D": 128, "B": 32, "dtype": "fp16", "BLOCK_N": 32, "BLOCK_K": 64, "num_warps": 4, "num_stages": 2, "time_ms": 13.955391883850098, "status": "ok"}
{"N": 262144, "K": 1024, "D": 128, "B": 32, "dtype": "fp16", "BLOCK_N": 32, "BLOCK_K": 64, "num_warps": 4, "num_stages": 4, "time_ms": 15.382816314697266, "status": "ok"}
{"N": 262144, "K": 1024, "D": 128, "B": 32, "dtype": "fp16", "BLOCK_N": 32, "BLOCK_K": 64, "num_warps": 8, "num_stages": 1, "time_ms": 21.073375701904297, "status": "ok"}
{"N": 262144, "K": 1024, "D": 128, "B": 32, "dtype": "fp16", "BLOCK_N": 32, "BLOCK_K": 64, "num_warps": 8, "num_stages": 2, "time_ms": 18.207744598388672, "status": "ok"}
{"N": 262144, "K": 1024, "D": 128, "B": 32, "dtype": "fp16", "BLOCK_N": 32, "BLOCK_K": 64, "num_warps": 8, "num_stages": 4, "time_ms": 18.597152709960938, "status": "ok"}
{"N": 262144, "K": 1024, "D": 128, "B": 32, "dtype": "fp16", "BLOCK_N": 32, "BLOCK_K": 128, "num_warps": 4, "num_stages": 1, "time_ms": 14.074527740478516, "status": "ok"}
{"N": 262144, "K": 1024, "D": 128, "B": 32, "dtype": "fp16", "BLOCK_N": 32, "BLOCK_K": 128, "num_warps": 4, "num_stages": 2, "time_ms": 11.152064323425293, "status": "ok"}
{"N": 262144, "K": 1024, "D": 128, "B": 32, "dtype": "fp16", "BLOCK_N": 32, "BLOCK_K": 128, "num_warps": 4, "num_stages": 4, "time_ms": 14.665568351745605, "status": "ok"}
{"N": 262144, "K": 1024, "D": 128, "B": 32, "dtype": "fp16", "BLOCK_N": 32, "BLOCK_K": 128, "num_warps": 8, "num_stages": 1, "time_ms": 19.333471298217773, "status": "ok"}
{"N": 262144, "K": 1024, "D": 128, "B": 32, "dtype": "fp16", "BLOCK_N": 32, "BLOCK_K": 128, "num_warps": 8, "num_stages": 2, "time_ms": 16.941856384277344, "status": "ok"}
{"N": 262144, "K": 1024, "D": 128, "B": 32, "dtype": "fp16", "BLOCK_N": 32, "BLOCK_K": 128, "num_warps": 8, "num_stages": 4, "time_ms": 17.966527938842773, "status": "ok"}
{"N": 262144, "K": 1024, "D": 128, "B": 32, "dtype": "fp16", "BLOCK_N": 64, "BLOCK_K": 32, "num_warps": 4, "num_stages": 1, "time_ms": 8.256863594055176, "status": "ok"}
{"N": 262144, "K": 1024, "D": 128, "B": 32, "dtype": "fp16", "BLOCK_N": 64, "BLOCK_K": 32, "num_warps": 4, "num_stages": 2, "time_ms": 7.291744232177734, "status": "ok"}
{"N": 262144, "K": 1024, "D": 128, "B": 32, "dtype": "fp16", "BLOCK_N": 64, "BLOCK_K": 32, "num_warps": 4, "num_stages": 4, "time_ms": 7.5775041580200195, "status": "ok"}
{"N": 262144, "K": 1024, "D": 128, "B": 32, "dtype": "fp16", "BLOCK_N": 64, "BLOCK_K": 32, "num_warps": 8, "num_stages": 1, "time_ms": 15.13856029510498, "status": "ok"}
{"N": 262144, "K": 1024, "D": 128, "B": 32, "dtype": "fp16", "BLOCK_N": 64, "BLOCK_K": 32, "num_warps": 8, "num_stages": 2, "time_ms": 13.176704406738281, "status": "ok"}
{"N": 262144, "K": 1024, "D": 128, "B": 32, "dtype": "fp16", "BLOCK_N": 64, "BLOCK_K": 32, "num_warps": 8, "num_stages": 4, "time_ms": 13.390496253967285, "status": "ok"}
{"N": 262144, "K": 1024, "D": 128, "B": 32, "dtype": "fp16", "BLOCK_N": 64, "BLOCK_K": 64, "num_warps": 4, "num_stages": 1, "time_ms": 6.804543972015381, "status": "ok"}
{"N": 262144, "K": 1024, "D": 128, "B": 32, "dtype": "fp16", "BLOCK_N": 64, "BLOCK_K": 64, "num_warps": 4, "num_stages": 2, "time_ms": 6.295584201812744, "status": "ok"}
{"N": 262144, "K": 1024, "D": 128, "B": 32, "dtype": "fp16", "BLOCK_N": 64, "BLOCK_K": 64, "num_warps": 4, "num_stages": 4, "time_ms": 6.805215835571289, "status": "ok"}
{"N": 262144, "K": 1024, "D": 128, "B": 32, "dtype": "fp16", "BLOCK_N": 64, "BLOCK_K": 64, "num_warps": 8, "num_stages": 1, "time_ms": 10.58892822265625, "status": "ok"}
{"N": 262144, "K": 1024, "D": 128, "B": 32, "dtype": "fp16", "BLOCK_N": 64, "BLOCK_K": 64, "num_warps": 8, "num_stages": 2, "time_ms": 9.278976440429688, "status": "ok"}
{"N": 262144, "K": 1024, "D": 128, "B": 32, "dtype": "fp16", "BLOCK_N": 64, "BLOCK_K": 64, "num_warps": 8, "num_stages": 4, "time_ms": 10.75699234008789, "status": "ok"}
{"N": 262144, "K": 1024, "D": 128, "B": 32, "dtype": "fp16", "BLOCK_N": 64, "BLOCK_K": 128, "num_warps": 4, "num_stages": 1, "time_ms": 6.729248046875, "status": "ok"}
{"N": 262144, "K": 1024, "D": 128, "B": 32, "dtype": "fp16", "BLOCK_N": 64, "BLOCK_K": 128, "num_warps": 4, "num_stages": 2, "time_ms": 6.531775951385498, "status": "ok"}
{"N": 262144, "K": 1024, "D": 128, "B": 32, "dtype": "fp16", "BLOCK_N": 64, "BLOCK_K": 128, "num_warps": 4, "num_stages": 4, "time_ms": 9.2806396484375, "status": "ok"}
{"N": 262144, "K": 1024, "D": 128, "B": 32, "dtype": "fp16", "BLOCK_N": 64, "BLOCK_K": 128, "num_warps": 8, "num_stages": 1, "time_ms": 9.992575645446777, "status": "ok"}
{"N": 262144, "K": 1024, "D": 128, "B": 32, "dtype": "fp16", "BLOCK_N": 64, "BLOCK_K": 128, "num_warps": 8, "num_stages": 2, "time_ms": 8.850815773010254, "status": "ok"}
{"N": 262144, "K": 1024, "D": 128, "B": 32, "dtype": "fp16", "BLOCK_N": 64, "BLOCK_K": 128, "num_warps": 8, "num_stages": 4, "time_ms": 10.960160255432129, "status": "ok"}
{"N": 262144, "K": 1024, "D": 128, "B": 32, "dtype": "fp16", "BLOCK_N": 128, "BLOCK_K": 32, "num_warps": 4, "num_stages": 1, "time_ms": 7.021312236785889, "status": "ok"}
{"N": 262144, "K": 1024, "D": 128, "B": 32, "dtype": "fp16", "BLOCK_N": 128, "BLOCK_K": 32, "num_warps": 4, "num_stages": 2, "time_ms": 7.127711772918701, "status": "ok"}
{"N": 262144, "K": 1024, "D": 128, "B": 32, "dtype": "fp16", "BLOCK_N": 128, "BLOCK_K": 32, "num_warps": 4, "num_stages": 4, "time_ms": 7.616032123565674, "status": "ok"}
{"N": 262144, "K": 1024, "D": 128, "B": 32, "dtype": "fp16", "BLOCK_N": 128, "BLOCK_K": 32, "num_warps": 8, "num_stages": 1, "time_ms": 7.306848049163818, "status": "ok"}
{"N": 262144, "K": 1024, "D": 128, "B": 32, "dtype": "fp16", "BLOCK_N": 128, "BLOCK_K": 32, "num_warps": 8, "num_stages": 2, "time_ms": 7.134880065917969, "status": "ok"}
{"N": 262144, "K": 1024, "D": 128, "B": 32, "dtype": "fp16", "BLOCK_N": 128, "BLOCK_K": 32, "num_warps": 8, "num_stages": 4, "time_ms": 7.458432197570801, "status": "ok"}
{"N": 262144, "K": 1024, "D": 128, "B": 32, "dtype": "fp16", "BLOCK_N": 128, "BLOCK_K": 64, "num_warps": 4, "num_stages": 1, "time_ms": 6.076511859893799, "status": "ok"}
{"N": 262144, "K": 1024, "D": 128, "B": 32, "dtype": "fp16", "BLOCK_N": 128, "BLOCK_K": 64, "num_warps": 4, "num_stages": 2, "time_ms": 6.370463848114014, "status": "ok"}
{"N": 262144, "K": 1024, "D": 128, "B": 32, "dtype": "fp16", "BLOCK_N": 128, "BLOCK_K": 64, "num_warps": 4, "num_stages": 4, "time_ms": 6.396448135375977, "status": "ok"}
{"N": 262144, "K": 1024, "D": 128, "B": 32, "dtype": "fp16", "BLOCK_N": 128, "BLOCK_K": 64, "num_warps": 8, "num_stages": 1, "time_ms": 6.6869120597839355, "status": "ok"}
{"N": 262144, "K": 1024, "D": 128, "B": 32, "dtype": "fp16", "BLOCK_N": 128, "BLOCK_K": 64, "num_warps": 8, "num_stages": 2, "time_ms": 6.413407802581787, "status": "ok"}
{"N": 262144, "K": 1024, "D": 128, "B": 32, "dtype": "fp16", "BLOCK_N": 128, "BLOCK_K": 64, "num_warps": 8, "num_stages": 4, "time_ms": 6.426239967346191, "status": "ok"}
{"N": 262144, "K": 1024, "D": 128, "B": 32, "dtype": "fp16", "BLOCK_N": 128, "BLOCK_K": 128, "num_warps": 4, "num_stages": 1, "time_ms": 6.440896034240723, "status": "ok"}
{"N": 262144, "K": 1024, "D": 128, "B": 32, "dtype": "fp16", "BLOCK_N": 128, "BLOCK_K": 128, "num_warps": 4, "num_stages": 2, "time_ms": 6.107327938079834, "status": "ok"}
{"N": 262144, "K": 1024, "D": 128, "B": 32, "dtype": "fp16", "BLOCK_N": 128, "BLOCK_K": 128, "num_warps": 4, "num_stages": 4, "time_ms": 7.850016117095947, "status": "ok"}
{"N": 262144, "K": 1024, "D": 128, "B": 32, "dtype": "fp16", "BLOCK_N": 128, "BLOCK_K": 128, "num_warps": 8, "num_stages": 1, "time_ms": 9.437439918518066, "status": "ok"}
{"N": 262144, "K": 1024, "D": 128, "B": 32, "dtype": "fp16", "BLOCK_N": 128, "BLOCK_K": 128, "num_warps": 8, "num_stages": 2, "time_ms": 6.119743824005127, "status": "ok"}
{"N": 262144, "K": 1024, "D": 128, "B": 32, "dtype": "fp16", "BLOCK_N": 128, "BLOCK_K": 128, "num_warps": 8, "num_stages": 4, "time_ms": 7.444543838500977, "status": "ok"}
{"summary": true, "N": 262144, "K": 1024, "D": 128, "B": 32, "dtype": "fp16", "best": {"N": 262144, "K": 1024, "D": 128, "B": 32, "dtype": "fp16", "BLOCK_N": 128, "BLOCK_K": 64, "num_warps": 4, "num_stages": 1, "time_ms": 6.076511859893799, "status": "ok"}, "best_time_ms": 6.076511859893799, "tuning_seconds": 15.68991208076477, "skipped": 0}
