grid_results_h200/N262144_K16384_D64_B32_fp16.jsonl
{"N": 262144, "K": 16384, "D": 64, "B": 32, "dtype": "fp16", "BLOCK_N": 32, "BLOCK_K": 32, "num_warps": 4, "num_stages": 1, "time_ms": 215.029541015625, "status": "ok"}
{"N": 262144, "K": 16384, "D": 64, "B": 32, "dtype": "fp16", "BLOCK_N": 32, "BLOCK_K": 32, "num_warps": 4, "num_stages": 2, "time_ms": 189.23004150390625, "status": "ok"}
{"N": 262144, "K": 16384, "D": 64, "B": 32, "dtype": "fp16", "BLOCK_N": 32, "BLOCK_K": 32, "num_warps": 4, "num_stages": 4, "time_ms": 186.94834899902344, "status": "ok"}
{"N": 262144, "K": 16384, "D": 64, "B": 32, "dtype": "fp16", "BLOCK_N": 32, "BLOCK_K": 32, "num_warps": 8, "num_stages": 1, "time_ms": 344.2736511230469, "status": "ok"}
{"N": 262144, "K": 16384, "D": 64, "B": 32, "dtype": "fp16", "BLOCK_N": 32, "BLOCK_K": 32, "num_warps": 8, "num_stages": 2, "time_ms": 323.970947265625, "status": "ok"}
{"N": 262144, "K": 16384, "D": 64, "B": 32, "dtype": "fp16", "BLOCK_N": 32, "BLOCK_K": 32, "num_warps": 8, "num_stages": 4, "time_ms": 319.89630126953125, "status": "ok"}
{"N": 262144, "K": 16384, "D": 64, "B": 32, "dtype": "fp16", "BLOCK_N": 32, "BLOCK_K": 64, "num_warps": 4, "num_stages": 1, "time_ms": 180.57887268066406, "status": "ok"}
{"N": 262144, "K": 16384, "D": 64, "B": 32, "dtype": "fp16", "BLOCK_N": 32, "BLOCK_K": 64, "num_warps": 4, "num_stages": 2, "time_ms": 159.38284301757812, "status": "ok"}
{"N": 262144, "K": 16384, "D": 64, "B": 32, "dtype": "fp16", "BLOCK_N": 32, "BLOCK_K": 64, "num_warps": 4, "num_stages": 4, "time_ms": 151.30125427246094, "status": "ok"}
{"N": 262144, "K": 16384, "D": 64, "B": 32, "dtype": "fp16", "BLOCK_N": 32, "BLOCK_K": 64, "num_warps": 8, "num_stages": 1, "time_ms": 221.64306640625, "status": "ok"}
{"N": 262144, "K": 16384, "D": 64, "B": 32, "dtype": "fp16", "BLOCK_N": 32, "BLOCK_K": 64, "num_warps": 8, "num_stages": 2, "time_ms": 204.12745666503906, "status": "ok"}
{"N": 262144, "K": 16384, "D": 64, "B": 32, "dtype": "fp16", "BLOCK_N": 32, "BLOCK_K": 64, "num_warps": 8, "num_stages": 4, "time_ms": 200.8921661376953, "status": "ok"}
{"N": 262144, "K": 16384, "D": 64, "B": 32, "dtype": "fp16", "BLOCK_N": 32, "BLOCK_K": 128, "num_warps": 4, "num_stages": 1, "time_ms": 141.94569396972656, "status": "ok"}
{"N": 262144, "K": 16384, "D": 64, "B": 32, "dtype": "fp16", "BLOCK_N": 32, "BLOCK_K": 128, "num_warps": 4, "num_stages": 2, "time_ms": 120.40595245361328, "status": "ok"}
{"N": 262144, "K": 16384, "D": 64, "B": 32, "dtype": "fp16", "BLOCK_N": 32, "BLOCK_K": 128, "num_warps": 4, "num_stages": 4, "time_ms": 122.81324768066406, "status": "ok"}
{"N": 262144, "K": 16384, "D": 64, "B": 32, "dtype": "fp16", "BLOCK_N": 32, "BLOCK_K": 128, "num_warps": 8, "num_stages": 1, "time_ms": 233.111328125, "status": "ok"}
{"N": 262144, "K": 16384, "D": 64, "B": 32, "dtype": "fp16", "BLOCK_N": 32, "BLOCK_K": 128, "num_warps": 8, "num_stages": 2, "time_ms": 190.87957763671875, "status": "ok"}
{"N": 262144, "K": 16384, "D": 64, "B": 32, "dtype": "fp16", "BLOCK_N": 32, "BLOCK_K": 128, "num_warps": 8, "num_stages": 4, "time_ms": 185.03836059570312, "status": "ok"}
{"N": 262144, "K": 16384, "D": 64, "B": 32, "dtype": "fp16", "BLOCK_N": 64, "BLOCK_K": 32, "num_warps": 4, "num_stages": 1, "time_ms": 83.92134094238281, "status": "ok"}
{"N": 262144, "K": 16384, "D": 64, "B": 32, "dtype": "fp16", "BLOCK_N": 64, "BLOCK_K": 32, "num_warps": 4, "num_stages": 2, "time_ms": 82.31257629394531, "status": "ok"}
{"N": 262144, "K": 16384, "D": 64, "B": 32, "dtype": "fp16", "BLOCK_N": 64, "BLOCK_K": 32, "num_warps": 4, "num_stages": 4, "time_ms": 83.1259536743164, "status": "ok"}
{"N": 262144, "K": 16384, "D": 64, "B": 32, "dtype": "fp16", "BLOCK_N": 64, "BLOCK_K": 32, "num_warps": 8, "num_stages": 1, "time_ms": 171.54537963867188, "status": "ok"}
{"N": 262144, "K": 16384, "D": 64, "B": 32, "dtype": "fp16", "BLOCK_N": 64, "BLOCK_K": 32, "num_warps": 8, "num_stages": 2, "time_ms": 157.04188537597656, "status": "ok"}
{"N": 262144, "K": 16384, "D": 64, "B": 32, "dtype": "fp16", "BLOCK_N": 64, "BLOCK_K": 32, "num_warps": 8, "num_stages": 4, "time_ms": 154.31484985351562, "status": "ok"}
{"N": 262144, "K": 16384, "D": 64, "B": 32, "dtype": "fp16", "BLOCK_N": 64, "BLOCK_K": 64, "num_warps": 4, "num_stages": 1, "time_ms": 79.35433959960938, "status": "ok"}
{"N": 262144, "K": 16384, "D": 64, "B": 32, "dtype": "fp16", "BLOCK_N": 64, "BLOCK_K": 64, "num_warps": 4, "num_stages": 2, "time_ms": 74.46806335449219, "status": "ok"}
{"N": 262144, "K": 16384, "D": 64, "B": 32, "dtype": "fp16", "BLOCK_N": 64, "BLOCK_K": 64, "num_warps": 4, "num_stages": 4, "time_ms": 75.24543762207031, "status": "ok"}
{"N": 262144, "K": 16384, "D": 64, "B": 32, "dtype": "fp16", "BLOCK_N": 64, "BLOCK_K": 64, "num_warps": 8, "num_stages": 1, "time_ms": 121.4425277709961, "status": "ok"}
{"N": 262144, "K": 16384, "D": 64, "B": 32, "dtype": "fp16", "BLOCK_N": 64, "BLOCK_K": 64, "num_warps": 8, "num_stages": 2, "time_ms": 114.80003356933594, "status": "ok"}
{"N": 262144, "K": 16384, "D": 64, "B": 32, "dtype": "fp16", "BLOCK_N": 64, "BLOCK_K": 64, "num_warps": 8, "num_stages": 4, "time_ms": 112.43449401855469, "status": "ok"}
{"N": 262144, "K": 16384, "D": 64, "B": 32, "dtype": "fp16", "BLOCK_N": 64, "BLOCK_K": 128, "num_warps": 4, "num_stages": 1, "time_ms": 74.1563491821289, "status": "ok"}
{"N": 262144, "K": 16384, "D": 64, "B": 32, "dtype": "fp16", "BLOCK_N": 64, "BLOCK_K": 128, "num_warps": 4, "num_stages": 2, "time_ms": 72.12799835205078, "status": "ok"}
{"N": 262144, "K": 16384, "D": 64, "B": 32, "dtype": "fp16", "BLOCK_N": 64, "BLOCK_K": 128, "num_warps": 4, "num_stages": 4, "time_ms": 71.34217834472656, "status": "ok"}
{"N": 262144, "K": 16384, "D": 64, "B": 32, "dtype": "fp16", "BLOCK_N": 64, "BLOCK_K": 128, "num_warps": 8, "num_stages": 1, "time_ms": 123.35881805419922, "status": "ok"}
{"N": 262144, "K": 16384, "D": 64, "B": 32, "dtype": "fp16", "BLOCK_N": 64, "BLOCK_K": 128, "num_warps": 8, "num_stages": 2, "time_ms": 106.59033966064453, "status": "ok"}
{"N": 262144, "K": 16384, "D": 64, "B": 32, "dtype": "fp16", "BLOCK_N": 64, "BLOCK_K": 128, "num_warps": 8, "num_stages": 4, "time_ms": 100.95257568359375, "status": "ok"}
{"N": 262144, "K": 16384, "D": 64, "B": 32, "dtype": "fp16", "BLOCK_N": 128, "BLOCK_K": 32, "num_warps": 4, "num_stages": 1, "time_ms": 82.51663970947266, "status": "ok"}
{"N": 262144, "K": 16384, "D": 64, "B": 32, "dtype": "fp16", "BLOCK_N": 128, "BLOCK_K": 32, "num_warps": 4, "num_stages": 2, "time_ms": 80.14844512939453, "status": "ok"}
{"N": 262144, "K": 16384, "D": 64, "B": 32, "dtype": "fp16", "BLOCK_N": 128, "BLOCK_K": 32, "num_warps": 4, "num_stages": 4, "time_ms": 82.02665710449219, "status": "ok"}
{"N": 262144, "K": 16384, "D": 64, "B": 32, "dtype": "fp16", "BLOCK_N": 128, "BLOCK_K": 32, "num_warps": 8, "num_stages": 1, "time_ms": 86.83503723144531, "status": "ok"}
{"N": 262144, "K": 16384, "D": 64, "B": 32, "dtype": "fp16", "BLOCK_N": 128, "BLOCK_K": 32, "num_warps": 8, "num_stages": 2, "time_ms": 89.94441223144531, "status": "ok"}
{"N": 262144, "K": 16384, "D": 64, "B": 32, "dtype": "fp16", "BLOCK_N": 128, "BLOCK_K": 32, "num_warps": 8, "num_stages": 4, "time_ms": 88.31558227539062, "status": "ok"}
{"N": 262144, "K": 16384, "D": 64, "B": 32, "dtype": "fp16", "BLOCK_N": 128, "BLOCK_K": 64, "num_warps": 4, "num_stages": 1, "time_ms": 78.9208984375, "status": "ok"}
{"N": 262144, "K": 16384, "D": 64, "B": 32, "dtype": "fp16", "BLOCK_N": 128, "BLOCK_K": 64, "num_warps": 4, "num_stages": 2, "time_ms": 72.03465270996094, "status": "ok"}
{"N": 262144, "K": 16384, "D": 64, "B": 32, "dtype": "fp16", "BLOCK_N": 128, "BLOCK_K": 64, "num_warps": 4, "num_stages": 4, "time_ms": 72.9059829711914, "status": "ok"}
{"N": 262144, "K": 16384, "D": 64, "B": 32, "dtype": "fp16", "BLOCK_N": 128, "BLOCK_K": 64, "num_warps": 8, "num_stages": 1, "time_ms": 81.86329650878906, "status": "ok"}
{"N": 262144, "K": 16384, "D": 64, "B": 32, "dtype": "fp16", "BLOCK_N": 128, "BLOCK_K": 64, "num_warps": 8, "num_stages": 2, "time_ms": 77.46562957763672, "status": "ok"}
{"N": 262144, "K": 16384, "D": 64, "B": 32, "dtype": "fp16", "BLOCK_N": 128, "BLOCK_K": 64, "num_warps": 8, "num_stages": 4, "time_ms": 77.49366760253906, "status": "ok"}
{"N": 262144, "K": 16384, "D": 64, "B": 32, "dtype": "fp16", "BLOCK_N": 128, "BLOCK_K": 128, "num_warps": 4, "num_stages": 1, "time_ms": 84.51468658447266, "status": "ok"}
{"N": 262144, "K": 16384, "D": 64, "B": 32, "dtype": "fp16", "BLOCK_N": 128, "BLOCK_K": 128, "num_warps": 4, "num_stages": 2, "time_ms": 78.90220642089844, "status": "ok"}
{"N": 262144, "K": 16384, "D": 64, "B": 32, "dtype": "fp16", "BLOCK_N": 128, "BLOCK_K": 128, "num_warps": 4, "num_stages": 4, "time_ms": 70.42208099365234, "status": "ok"}
{"N": 262144, "K": 16384, "D": 64, "B": 32, "dtype": "fp16", "BLOCK_N": 128, "BLOCK_K": 128, "num_warps": 8, "num_stages": 1, "time_ms": 109.5549087524414, "status": "ok"}
{"N": 262144, "K": 16384, "D": 64, "B": 32, "dtype": "fp16", "BLOCK_N": 128, "BLOCK_K": 128, "num_warps": 8, "num_stages": 2, "time_ms": 76.10502624511719, "status": "ok"}
{"N": 262144, "K": 16384, "D": 64, "B": 32, "dtype": "fp16", "BLOCK_N": 128, "BLOCK_K": 128, "num_warps": 8, "num_stages": 4, "time_ms": 73.48143768310547, "status": "ok"}
{"summary": true, "N": 262144, "K": 16384, "D": 64, "B": 32, "dtype": "fp16", "best": {"N": 262144, "K": 16384, "D": 64, "B": 32, "dtype": "fp16", "BLOCK_N": 128, "BLOCK_K": 128, "num_warps": 4, "num_stages": 4, "time_ms": 70.42208099365234, "status": "ok"}, "best_time_ms": 70.42208099365234, "tuning_seconds": 65.28416180610657, "skipped": 0}
