grid_results_h200/N262144_K1024_D64_B1_fp16.jsonl
{"N": 262144, "K": 1024, "D": 64, "B": 1, "dtype": "fp16", "BLOCK_N": 32, "BLOCK_K": 32, "num_warps": 4, "num_stages": 1, "time_ms": 0.431768000125885, "status": "ok"}
{"N": 262144, "K": 1024, "D": 64, "B": 1, "dtype": "fp16", "BLOCK_N": 32, "BLOCK_K": 32, "num_warps": 4, "num_stages": 2, "time_ms": 0.3932000041007996, "status": "ok"}
{"N": 262144, "K": 1024, "D": 64, "B": 1, "dtype": "fp16", "BLOCK_N": 32, "BLOCK_K": 32, "num_warps": 4, "num_stages": 4, "time_ms": 0.3899810964410955, "status": "ok"}
{"N": 262144, "K": 1024, "D": 64, "B": 1, "dtype": "fp16", "BLOCK_N": 32, "BLOCK_K": 32, "num_warps": 8, "num_stages": 1, "time_ms": 0.6913813352584839, "status": "ok"}
{"N": 262144, "K": 1024, "D": 64, "B": 1, "dtype": "fp16", "BLOCK_N": 32, "BLOCK_K": 32, "num_warps": 8, "num_stages": 2, "time_ms": 0.663482666015625, "status": "ok"}
{"N": 262144, "K": 1024, "D": 64, "B": 1, "dtype": "fp16", "BLOCK_N": 32, "BLOCK_K": 32, "num_warps": 8, "num_stages": 4, "time_ms": 0.6549920042355856, "status": "ok"}
{"N": 262144, "K": 1024, "D": 64, "B": 1, "dtype": "fp16", "BLOCK_N": 32, "BLOCK_K": 64, "num_warps": 4, "num_stages": 1, "time_ms": 0.36784290996464813, "status": "ok"}
{"N": 262144, "K": 1024, "D": 64, "B": 1, "dtype": "fp16", "BLOCK_N": 32, "BLOCK_K": 64, "num_warps": 4, "num_stages": 2, "time_ms": 0.33589333295822144, "status": "ok"}
{"N": 262144, "K": 1024, "D": 64, "B": 1, "dtype": "fp16", "BLOCK_N": 32, "BLOCK_K": 64, "num_warps": 4, "num_stages": 4, "time_ms": 0.32607999940713245, "status": "ok"}
{"N": 262144, "K": 1024, "D": 64, "B": 1, "dtype": "fp16", "BLOCK_N": 32, "BLOCK_K": 64, "num_warps": 8, "num_stages": 1, "time_ms": 0.4453440010547638, "status": "ok"}
{"N": 262144, "K": 1024, "D": 64, "B": 1, "dtype": "fp16", "BLOCK_N": 32, "BLOCK_K": 64, "num_warps": 8, "num_stages": 2, "time_ms": 0.4269184023141861, "status": "ok"}
{"N": 262144, "K": 1024, "D": 64, "B": 1, "dtype": "fp16", "BLOCK_N": 32, "BLOCK_K": 64, "num_warps": 8, "num_stages": 4, "time_ms": 0.42319999933242797, "status": "ok"}
{"N": 262144, "K": 1024, "D": 64, "B": 1, "dtype": "fp16", "BLOCK_N": 32, "BLOCK_K": 128, "num_warps": 4, "num_stages": 1, "time_ms": 0.2929033843370584, "status": "ok"}
{"N": 262144, "K": 1024, "D": 64, "B": 1, "dtype": "fp16", "BLOCK_N": 32, "BLOCK_K": 128, "num_warps": 4, "num_stages": 2, "time_ms": 0.2641365349292755, "status": "ok"}
{"N": 262144, "K": 1024, "D": 64, "B": 1, "dtype": "fp16", "BLOCK_N": 32, "BLOCK_K": 128, "num_warps": 4, "num_stages": 4, "time_ms": 0.2750422826835087, "status": "ok"}
{"N": 262144, "K": 1024, "D": 64, "B": 1, "dtype": "fp16", "BLOCK_N": 32, "BLOCK_K": 128, "num_warps": 8, "num_stages": 1, "time_ms": 0.4632675548394521, "status": "ok"}
{"N": 262144, "K": 1024, "D": 64, "B": 1, "dtype": "fp16", "BLOCK_N": 32, "BLOCK_K": 128, "num_warps": 8, "num_stages": 2, "time_ms": 0.40772799849510194, "status": "ok"}
{"N": 262144, "K": 1024, "D": 64, "B": 1, "dtype": "fp16", "BLOCK_N": 32, "BLOCK_K": 128, "num_warps": 8, "num_stages": 4, "time_ms": 0.40088640749454496, "status": "ok"}
{"N": 262144, "K": 1024, "D": 64, "B": 1, "dtype": "fp16", "BLOCK_N": 64, "BLOCK_K": 32, "num_warps": 4, "num_stages": 1, "time_ms": 0.1881364207518728, "status": "ok"}
{"N": 262144, "K": 1024, "D": 64, "B": 1, "dtype": "fp16", "BLOCK_N": 64, "BLOCK_K": 32, "num_warps": 4, "num_stages": 2, "time_ms": 0.18659519851207734, "status": "ok"}
{"N": 262144, "K": 1024, "D": 64, "B": 1, "dtype": "fp16", "BLOCK_N": 64, "BLOCK_K": 32, "num_warps": 4, "num_stages": 4, "time_ms": 0.18568319901823999, "status": "ok"}
{"N": 262144, "K": 1024, "D": 64, "B": 1, "dtype": "fp16", "BLOCK_N": 64, "BLOCK_K": 32, "num_warps": 8, "num_stages": 1, "time_ms": 0.3520853395263354, "status": "ok"}
{"N": 262144, "K": 1024, "D": 64, "B": 1, "dtype": "fp16", "BLOCK_N": 64, "BLOCK_K": 32, "num_warps": 8, "num_stages": 2, "time_ms": 0.33832533409198123, "status": "ok"}
{"N": 262144, "K": 1024, "D": 64, "B": 1, "dtype": "fp16", "BLOCK_N": 64, "BLOCK_K": 32, "num_warps": 8, "num_stages": 4, "time_ms": 0.33214399963617325, "status": "ok"}
{"N": 262144, "K": 1024, "D": 64, "B": 1, "dtype": "fp16", "BLOCK_N": 64, "BLOCK_K": 64, "num_warps": 4, "num_stages": 1, "time_ms": 0.17857759892940522, "status": "ok"}
{"N": 262144, "K": 1024, "D": 64, "B": 1, "dtype": "fp16", "BLOCK_N": 64, "BLOCK_K": 64, "num_warps": 4, "num_stages": 2, "time_ms": 0.1683375984430313, "status": "ok"}
{"N": 262144, "K": 1024, "D": 64, "B": 1, "dtype": "fp16", "BLOCK_N": 64, "BLOCK_K": 64, "num_warps": 4, "num_stages": 4, "time_ms": 0.16884419180098034, "status": "ok"}
{"N": 262144, "K": 1024, "D": 64, "B": 1, "dtype": "fp16", "BLOCK_N": 64, "BLOCK_K": 64, "num_warps": 8, "num_stages": 1, "time_ms": 0.2577087978521983, "status": "ok"}
{"N": 262144, "K": 1024, "D": 64, "B": 1, "dtype": "fp16", "BLOCK_N": 64, "BLOCK_K": 64, "num_warps": 8, "num_stages": 2, "time_ms": 0.2520085334777832, "status": "ok"}
{"N": 262144, "K": 1024, "D": 64, "B": 1, "dtype": "fp16", "BLOCK_N": 64, "BLOCK_K": 64, "num_warps": 8, "num_stages": 4, "time_ms": 0.24840999953448772, "status": "ok"}
{"N": 262144, "K": 1024, "D": 64, "B": 1, "dtype": "fp16", "BLOCK_N": 64, "BLOCK_K": 128, "num_warps": 4, "num_stages": 1, "time_ms": 0.16220654479481958, "status": "ok"}
{"N": 262144, "K": 1024, "D": 64, "B": 1, "dtype": "fp16", "BLOCK_N": 64, "BLOCK_K": 128, "num_warps": 4, "num_stages": 2, "time_ms": 0.16498285957745143, "status": "ok"}
{"N": 262144, "K": 1024, "D": 64, "B": 1, "dtype": "fp16", "BLOCK_N": 64, "BLOCK_K": 128, "num_warps": 4, "num_stages": 4, "time_ms": 0.16264872862534088, "status": "ok"}
{"N": 262144, "K": 1024, "D": 64, "B": 1, "dtype": "fp16", "BLOCK_N": 64, "BLOCK_K": 128, "num_warps": 8, "num_stages": 1, "time_ms": 0.2436039987951517, "status": "ok"}
{"N": 262144, "K": 1024, "D": 64, "B": 1, "dtype": "fp16", "BLOCK_N": 64, "BLOCK_K": 128, "num_warps": 8, "num_stages": 2, "time_ms": 0.2380579998716712, "status": "ok"}
{"N": 262144, "K": 1024, "D": 64, "B": 1, "dtype": "fp16", "BLOCK_N": 64, "BLOCK_K": 128, "num_warps": 8, "num_stages": 4, "time_ms": 0.2297091773327659, "status": "ok"}
{"N": 262144, "K": 1024, "D": 64, "B": 1, "dtype": "fp16", "BLOCK_N": 128, "BLOCK_K": 32, "num_warps": 4, "num_stages": 1, "time_ms": 0.18679747220716977, "status": "ok"}
{"N": 262144, "K": 1024, "D": 64, "B": 1, "dtype": "fp16", "BLOCK_N": 128, "BLOCK_K": 32, "num_warps": 4, "num_stages": 2, "time_ms": 0.1836530527001933, "status": "ok"}
{"N": 262144, "K": 1024, "D": 64, "B": 1, "dtype": "fp16", "BLOCK_N": 128, "BLOCK_K": 32, "num_warps": 4, "num_stages": 4, "time_ms": 0.1816690532784713, "status": "ok"}
{"N": 262144, "K": 1024, "D": 64, "B": 1, "dtype": "fp16", "BLOCK_N": 128, "BLOCK_K": 32, "num_warps": 8, "num_stages": 1, "time_ms": 0.1935444215410634, "status": "ok"}
{"N": 262144, "K": 1024, "D": 64, "B": 1, "dtype": "fp16", "BLOCK_N": 128, "BLOCK_K": 32, "num_warps": 8, "num_stages": 2, "time_ms": 0.2040088896950086, "status": "ok"}
{"N": 262144, "K": 1024, "D": 64, "B": 1, "dtype": "fp16", "BLOCK_N": 128, "BLOCK_K": 32, "num_warps": 8, "num_stages": 4, "time_ms": 0.19514844566583633, "status": "ok"}
{"N": 262144, "K": 1024, "D": 64, "B": 1, "dtype": "fp16", "BLOCK_N": 128, "BLOCK_K": 64, "num_warps": 4, "num_stages": 1, "time_ms": 0.1769584000110626, "status": "ok"}
{"N": 262144, "K": 1024, "D": 64, "B": 1, "dtype": "fp16", "BLOCK_N": 128, "BLOCK_K": 64, "num_warps": 4, "num_stages": 2, "time_ms": 0.16441295118558974, "status": "ok"}
{"N": 262144, "K": 1024, "D": 64, "B": 1, "dtype": "fp16", "BLOCK_N": 128, "BLOCK_K": 64, "num_warps": 4, "num_stages": 4, "time_ms": 0.16500723858674368, "status": "ok"}
{"N": 262144, "K": 1024, "D": 64, "B": 1, "dtype": "fp16", "BLOCK_N": 128, "BLOCK_K": 64, "num_warps": 8, "num_stages": 1, "time_ms": 0.18136084001315267, "status": "ok"}
{"N": 262144, "K": 1024, "D": 64, "B": 1, "dtype": "fp16", "BLOCK_N": 128, "BLOCK_K": 64, "num_warps": 8, "num_stages": 2, "time_ms": 0.17714399918913842, "status": "ok"}
{"N": 262144, "K": 1024, "D": 64, "B": 1, "dtype": "fp16", "BLOCK_N": 128, "BLOCK_K": 64, "num_warps": 8, "num_stages": 4, "time_ms": 0.174588952036131, "status": "ok"}
{"N": 262144, "K": 1024, "D": 64, "B": 1, "dtype": "fp16", "BLOCK_N": 128, "BLOCK_K": 128, "num_warps": 4, "num_stages": 1, "time_ms": 0.18007039949297904, "status": "ok"}
{"N": 262144, "K": 1024, "D": 64, "B": 1, "dtype": "fp16", "BLOCK_N": 128, "BLOCK_K": 128, "num_warps": 4, "num_stages": 2, "time_ms": 0.17833920046687127, "status": "ok"}
{"N": 262144, "K": 1024, "D": 64, "B": 1, "dtype": "fp16", "BLOCK_N": 128, "BLOCK_K": 128, "num_warps": 4, "num_stages": 4, "time_ms": 0.16381866733233133, "status": "ok"}
{"N": 262144, "K": 1024, "D": 64, "B": 1, "dtype": "fp16", "BLOCK_N": 128, "BLOCK_K": 128, "num_warps": 8, "num_stages": 1, "time_ms": 0.23967600148171186, "status": "ok"}
{"N": 262144, "K": 1024, "D": 64, "B": 1, "dtype": "fp16", "BLOCK_N": 128, "BLOCK_K": 128, "num_warps": 8, "num_stages": 2, "time_ms": 0.1745828567516236, "status": "ok"}
{"N": 262144, "K": 1024, "D": 64, "B": 1, "dtype": "fp16", "BLOCK_N": 128, "BLOCK_K": 128, "num_warps": 8, "num_stages": 4, "time_ms": 0.16877257043407076, "status": "ok"}
{"summary": true, "N": 262144, "K": 1024, "D": 64, "B": 1, "dtype": "fp16", "best": {"N": 262144, "K": 1024, "D": 64, "B": 1, "dtype": "fp16", "BLOCK_N": 64, "BLOCK_K": 128, "num_warps": 4, "num_stages": 1, "time_ms": 0.16220654479481958, "status": "ok"}, "best_time_ms": 0.16220654479481958, "tuning_seconds": 9.767031192779541, "skipped": 0}
