grid_results_h200/N262144_K65536_D64_B1_fp16.jsonl
{"N": 262144, "K": 65536, "D": 64, "B": 1, "dtype": "fp16", "BLOCK_N": 32, "BLOCK_K": 32, "num_warps": 4, "num_stages": 1, "time_ms": 27.724576950073242, "status": "ok"}
{"N": 262144, "K": 65536, "D": 64, "B": 1, "dtype": "fp16", "BLOCK_N": 32, "BLOCK_K": 32, "num_warps": 4, "num_stages": 2, "time_ms": 24.432575225830078, "status": "ok"}
{"N": 262144, "K": 65536, "D": 64, "B": 1, "dtype": "fp16", "BLOCK_N": 32, "BLOCK_K": 32, "num_warps": 4, "num_stages": 4, "time_ms": 23.927488327026367, "status": "ok"}
{"N": 262144, "K": 65536, "D": 64, "B": 1, "dtype": "fp16", "BLOCK_N": 32, "BLOCK_K": 32, "num_warps": 8, "num_stages": 1, "time_ms": 44.36463928222656, "status": "ok"}
{"N": 262144, "K": 65536, "D": 64, "B": 1, "dtype": "fp16", "BLOCK_N": 32, "BLOCK_K": 32, "num_warps": 8, "num_stages": 2, "time_ms": 41.490047454833984, "status": "ok"}
{"N": 262144, "K": 65536, "D": 64, "B": 1, "dtype": "fp16", "BLOCK_N": 32, "BLOCK_K": 32, "num_warps": 8, "num_stages": 4, "time_ms": 41.155296325683594, "status": "ok"}
{"N": 262144, "K": 65536, "D": 64, "B": 1, "dtype": "fp16", "BLOCK_N": 32, "BLOCK_K": 64, "num_warps": 4, "num_stages": 1, "time_ms": 23.366880416870117, "status": "ok"}
{"N": 262144, "K": 65536, "D": 64, "B": 1, "dtype": "fp16", "BLOCK_N": 32, "BLOCK_K": 64, "num_warps": 4, "num_stages": 2, "time_ms": 20.51545524597168, "status": "ok"}
{"N": 262144, "K": 65536, "D": 64, "B": 1, "dtype": "fp16", "BLOCK_N": 32, "BLOCK_K": 64, "num_warps": 4, "num_stages": 4, "time_ms": 19.847103118896484, "status": "ok"}
{"N": 262144, "K": 65536, "D": 64, "B": 1, "dtype": "fp16", "BLOCK_N": 32, "BLOCK_K": 64, "num_warps": 8, "num_stages": 1, "time_ms": 30.3953914642334, "status": "ok"}
{"N": 262144, "K": 65536, "D": 64, "B": 1, "dtype": "fp16", "BLOCK_N": 32, "BLOCK_K": 64, "num_warps": 8, "num_stages": 2, "time_ms": 26.000255584716797, "status": "ok"}
{"N": 262144, "K": 65536, "D": 64, "B": 1, "dtype": "fp16", "BLOCK_N": 32, "BLOCK_K": 64, "num_warps": 8, "num_stages": 4, "time_ms": 25.160160064697266, "status": "ok"}
{"N": 262144, "K": 65536, "D": 64, "B": 1, "dtype": "fp16", "BLOCK_N": 32, "BLOCK_K": 128, "num_warps": 4, "num_stages": 1, "time_ms": 18.385215759277344, "status": "ok"}
{"N": 262144, "K": 65536, "D": 64, "B": 1, "dtype": "fp16", "BLOCK_N": 32, "BLOCK_K": 128, "num_warps": 4, "num_stages": 2, "time_ms": 15.517472267150879, "status": "ok"}
{"N": 262144, "K": 65536, "D": 64, "B": 1, "dtype": "fp16", "BLOCK_N": 32, "BLOCK_K": 128, "num_warps": 4, "num_stages": 4, "time_ms": 15.807711601257324, "status": "ok"}
{"N": 262144, "K": 65536, "D": 64, "B": 1, "dtype": "fp16", "BLOCK_N": 32, "BLOCK_K": 128, "num_warps": 8, "num_stages": 1, "time_ms": 29.91219139099121, "status": "ok"}
{"N": 262144, "K": 65536, "D": 64, "B": 1, "dtype": "fp16", "BLOCK_N": 32, "BLOCK_K": 128, "num_warps": 8, "num_stages": 2, "time_ms": 24.472576141357422, "status": "ok"}
{"N": 262144, "K": 65536, "D": 64, "B": 1, "dtype": "fp16", "BLOCK_N": 32, "BLOCK_K": 128, "num_warps": 8, "num_stages": 4, "time_ms": 23.501792907714844, "status": "ok"}
{"N": 262144, "K": 65536, "D": 64, "B": 1, "dtype": "fp16", "BLOCK_N": 64, "BLOCK_K": 32, "num_warps": 4, "num_stages": 1, "time_ms": 11.17024040222168, "status": "ok"}
{"N": 262144, "K": 65536, "D": 64, "B": 1, "dtype": "fp16", "BLOCK_N": 64, "BLOCK_K": 32, "num_warps": 4, "num_stages": 2, "time_ms": 11.156000137329102, "status": "ok"}
{"N": 262144, "K": 65536, "D": 64, "B": 1, "dtype": "fp16", "BLOCK_N": 64, "BLOCK_K": 32, "num_warps": 4, "num_stages": 4, "time_ms": 10.984288215637207, "status": "ok"}
{"N": 262144, "K": 65536, "D": 64, "B": 1, "dtype": "fp16", "BLOCK_N": 64, "BLOCK_K": 32, "num_warps": 8, "num_stages": 1, "time_ms": 22.585439682006836, "status": "ok"}
{"N": 262144, "K": 65536, "D": 64, "B": 1, "dtype": "fp16", "BLOCK_N": 64, "BLOCK_K": 32, "num_warps": 8, "num_stages": 2, "time_ms": 21.368928909301758, "status": "ok"}
{"N": 262144, "K": 65536, "D": 64, "B": 1, "dtype": "fp16", "BLOCK_N": 64, "BLOCK_K": 32, "num_warps": 8, "num_stages": 4, "time_ms": 20.900672912597656, "status": "ok"}
{"N": 262144, "K": 65536, "D": 64, "B": 1, "dtype": "fp16", "BLOCK_N": 64, "BLOCK_K": 64, "num_warps": 4, "num_stages": 1, "time_ms": 10.583776473999023, "status": "ok"}
{"N": 262144, "K": 65536, "D": 64, "B": 1, "dtype": "fp16", "BLOCK_N": 64, "BLOCK_K": 64, "num_warps": 4, "num_stages": 2, "time_ms": 9.921216011047363, "status": "ok"}
{"N": 262144, "K": 65536, "D": 64, "B": 1, "dtype": "fp16", "BLOCK_N": 64, "BLOCK_K": 64, "num_warps": 4, "num_stages": 4, "time_ms": 9.846752166748047, "status": "ok"}
{"N": 262144, "K": 65536, "D": 64, "B": 1, "dtype": "fp16", "BLOCK_N": 64, "BLOCK_K": 64, "num_warps": 8, "num_stages": 1, "time_ms": 16.147327423095703, "status": "ok"}
{"N": 262144, "K": 65536, "D": 64, "B": 1, "dtype": "fp16", "BLOCK_N": 64, "BLOCK_K": 64, "num_warps": 8, "num_stages": 2, "time_ms": 15.625344276428223, "status": "ok"}
{"N": 262144, "K": 65536, "D": 64, "B": 1, "dtype": "fp16", "BLOCK_N": 64, "BLOCK_K": 64, "num_warps": 8, "num_stages": 4, "time_ms": 14.936575889587402, "status": "ok"}
{"N": 262144, "K": 65536, "D": 64, "B": 1, "dtype": "fp16", "BLOCK_N": 64, "BLOCK_K": 128, "num_warps": 4, "num_stages": 1, "time_ms": 9.535967826843262, "status": "ok"}
{"N": 262144, "K": 65536, "D": 64, "B": 1, "dtype": "fp16", "BLOCK_N": 64, "BLOCK_K": 128, "num_warps": 4, "num_stages": 2, "time_ms": 9.446080207824707, "status": "ok"}
{"N": 262144, "K": 65536, "D": 64, "B": 1, "dtype": "fp16", "BLOCK_N": 64, "BLOCK_K": 128, "num_warps": 4, "num_stages": 4, "time_ms": 9.29593563079834, "status": "ok"}
{"N": 262144, "K": 65536, "D": 64, "B": 1, "dtype": "fp16", "BLOCK_N": 64, "BLOCK_K": 128, "num_warps": 8, "num_stages": 1, "time_ms": 16.607776641845703, "status": "ok"}
{"N": 262144, "K": 65536, "D": 64, "B": 1, "dtype": "fp16", "BLOCK_N": 64, "BLOCK_K": 128, "num_warps": 8, "num_stages": 2, "time_ms": 14.400383949279785, "status": "ok"}
{"N": 262144, "K": 65536, "D": 64, "B": 1, "dtype": "fp16", "BLOCK_N": 64, "BLOCK_K": 128, "num_warps": 8, "num_stages": 4, "time_ms": 13.12019157409668, "status": "ok"}
{"N": 262144, "K": 65536, "D": 64, "B": 1, "dtype": "fp16", "BLOCK_N": 128, "BLOCK_K": 32, "num_warps": 4, "num_stages": 1, "time_ms": 11.193535804748535, "status": "ok"}
{"N": 262144, "K": 65536, "D": 64, "B": 1, "dtype": "fp16", "BLOCK_N": 128, "BLOCK_K": 32, "num_warps": 4, "num_stages": 2, "time_ms": 11.088768005371094, "status": "ok"}
{"N": 262144, "K": 65536, "D": 64, "B": 1, "dtype": "fp16", "BLOCK_N": 128, "BLOCK_K": 32, "num_warps": 4, "num_stages": 4, "time_ms": 10.989184379577637, "status": "ok"}
{"N": 262144, "K": 65536, "D": 64, "B": 1, "dtype": "fp16", "BLOCK_N": 128, "BLOCK_K": 32, "num_warps": 8, "num_stages": 1, "time_ms": 11.674304008483887, "status": "ok"}
{"N": 262144, "K": 65536, "D": 64, "B": 1, "dtype": "fp16", "BLOCK_N": 128, "BLOCK_K": 32, "num_warps": 8, "num_stages": 2, "time_ms": 12.336447715759277, "status": "ok"}
{"N": 262144, "K": 65536, "D": 64, "B": 1, "dtype": "fp16", "BLOCK_N": 128, "BLOCK_K": 32, "num_warps": 8, "num_stages": 4, "time_ms": 11.701248168945312, "status": "ok"}
{"N": 262144, "K": 65536, "D": 64, "B": 1, "dtype": "fp16", "BLOCK_N": 128, "BLOCK_K": 64, "num_warps": 4, "num_stages": 1, "time_ms": 10.525343894958496, "status": "ok"}
{"N": 262144, "K": 65536, "D": 64, "B": 1, "dtype": "fp16", "BLOCK_N": 128, "BLOCK_K": 64, "num_warps": 4, "num_stages": 2, "time_ms": 9.752096176147461, "status": "ok"}
{"N": 262144, "K": 65536, "D": 64, "B": 1, "dtype": "fp16", "BLOCK_N": 128, "BLOCK_K": 64, "num_warps": 4, "num_stages": 4, "time_ms": 9.640095710754395, "status": "ok"}
{"N": 262144, "K": 65536, "D": 64, "B": 1, "dtype": "fp16", "BLOCK_N": 128, "BLOCK_K": 64, "num_warps": 8, "num_stages": 1, "time_ms": 10.882559776306152, "status": "ok"}
{"N": 262144, "K": 65536, "D": 64, "B": 1, "dtype": "fp16", "BLOCK_N": 128, "BLOCK_K": 64, "num_warps": 8, "num_stages": 2, "time_ms": 10.603808403015137, "status": "ok"}
{"N": 262144, "K": 65536, "D": 64, "B": 1, "dtype": "fp16", "BLOCK_N": 128, "BLOCK_K": 64, "num_warps": 8, "num_stages": 4, "time_ms": 10.205344200134277, "status": "ok"}
{"N": 262144, "K": 65536, "D": 64, "B": 1, "dtype": "fp16", "BLOCK_N": 128, "BLOCK_K": 128, "num_warps": 4, "num_stages": 1, "time_ms": 11.16163158416748, "status": "ok"}
{"N": 262144, "K": 65536, "D": 64, "B": 1, "dtype": "fp16", "BLOCK_N": 128, "BLOCK_K": 128, "num_warps": 4, "num_stages": 2, "time_ms": 10.384320259094238, "status": "ok"}
{"N": 262144, "K": 65536, "D": 64, "B": 1, "dtype": "fp16", "BLOCK_N": 128, "BLOCK_K": 128, "num_warps": 4, "num_stages": 4, "time_ms": 9.303711891174316, "status": "ok"}
{"N": 262144, "K": 65536, "D": 64, "B": 1, "dtype": "fp16", "BLOCK_N": 128, "BLOCK_K": 128, "num_warps": 8, "num_stages": 1, "time_ms": 15.285375595092773, "status": "ok"}
{"N": 262144, "K": 65536, "D": 64, "B": 1, "dtype": "fp16", "BLOCK_N": 128, "BLOCK_K": 128, "num_warps": 8, "num_stages": 2, "time_ms": 9.987039566040039, "status": "ok"}
{"N": 262144, "K": 65536, "D": 64, "B": 1, "dtype": "fp16", "BLOCK_N": 128, "BLOCK_K": 128, "num_warps": 8, "num_stages": 4, "time_ms": 9.684000015258789, "status": "ok"}
{"summary": true, "N": 262144, "K": 65536, "D": 64, "B": 1, "dtype": "fp16", "best": {"N": 262144, "K": 65536, "D": 64, "B": 1, "dtype": "fp16", "BLOCK_N": 64, "BLOCK_K": 128, "num_warps": 4, "num_stages": 4, "time_ms": 9.29593563079834, "status": "ok"}, "best_time_ms": 9.29593563079834, "tuning_seconds": 16.84892225265503, "skipped": 0}
