grid_results_h200/N262144_K1024_D128_B1_fp16.jsonl
{"N": 262144, "K": 1024, "D": 128, "B": 1, "dtype": "fp16", "BLOCK_N": 32, "BLOCK_K": 32, "num_warps": 4, "num_stages": 1, "time_ms": 0.6655786832173666, "status": "ok"}
{"N": 262144, "K": 1024, "D": 128, "B": 1, "dtype": "fp16", "BLOCK_N": 32, "BLOCK_K": 32, "num_warps": 4, "num_stages": 2, "time_ms": 0.5523559972643852, "status": "ok"}
{"N": 262144, "K": 1024, "D": 128, "B": 1, "dtype": "fp16", "BLOCK_N": 32, "BLOCK_K": 32, "num_warps": 4, "num_stages": 4, "time_ms": 0.5552880018949509, "status": "ok"}
{"N": 262144, "K": 1024, "D": 128, "B": 1, "dtype": "fp16", "BLOCK_N": 32, "BLOCK_K": 32, "num_warps": 8, "num_stages": 1, "time_ms": 0.989671990275383, "status": "ok"}
{"N": 262144, "K": 1024, "D": 128, "B": 1, "dtype": "fp16", "BLOCK_N": 32, "BLOCK_K": 32, "num_warps": 8, "num_stages": 2, "time_ms": 0.8985088109970093, "status": "ok"}
{"N": 262144, "K": 1024, "D": 128, "B": 1, "dtype": "fp16", "BLOCK_N": 32, "BLOCK_K": 32, "num_warps": 8, "num_stages": 4, "time_ms": 0.8900543928146363, "status": "ok"}
{"N": 262144, "K": 1024, "D": 128, "B": 1, "dtype": "fp16", "BLOCK_N": 32, "BLOCK_K": 64, "num_warps": 4, "num_stages": 1, "time_ms": 0.5685165694781712, "status": "ok"}
{"N": 262144, "K": 1024, "D": 128, "B": 1, "dtype": "fp16", "BLOCK_N": 32, "BLOCK_K": 64, "num_warps": 4, "num_stages": 2, "time_ms": 0.45332977506849503, "status": "ok"}
{"N": 262144, "K": 1024, "D": 128, "B": 1, "dtype": "fp16", "BLOCK_N": 32, "BLOCK_K": 64, "num_warps": 4, "num_stages": 4, "time_ms": 0.4983839988708496, "status": "ok"}
{"N": 262144, "K": 1024, "D": 128, "B": 1, "dtype": "fp16", "BLOCK_N": 32, "BLOCK_K": 64, "num_warps": 8, "num_stages": 1, "time_ms": 0.6767359972000122, "status": "ok"}
{"N": 262144, "K": 1024, "D": 128, "B": 1, "dtype": "fp16", "BLOCK_N": 32, "BLOCK_K": 64, "num_warps": 8, "num_stages": 2, "time_ms": 0.587593138217926, "status": "ok"}
{"N": 262144, "K": 1024, "D": 128, "B": 1, "dtype": "fp16", "BLOCK_N": 32, "BLOCK_K": 64, "num_warps": 8, "num_stages": 4, "time_ms": 0.5972479922430856, "status": "ok"}
{"N": 262144, "K": 1024, "D": 128, "B": 1, "dtype": "fp16", "BLOCK_N": 32, "BLOCK_K": 128, "num_warps": 4, "num_stages": 1, "time_ms": 0.4541546669271257, "status": "ok"}
{"N": 262144, "K": 1024, "D": 128, "B": 1, "dtype": "fp16", "BLOCK_N": 32, "BLOCK_K": 128, "num_warps": 4, "num_stages": 2, "time_ms": 0.36229817975651135, "status": "ok"}
{"N": 262144, "K": 1024, "D": 128, "B": 1, "dtype": "fp16", "BLOCK_N": 32, "BLOCK_K": 128, "num_warps": 4, "num_stages": 4, "time_ms": 0.4749866657786899, "status": "ok"}
{"N": 262144, "K": 1024, "D": 128, "B": 1, "dtype": "fp16", "BLOCK_N": 32, "BLOCK_K": 128, "num_warps": 8, "num_stages": 1, "time_ms": 0.619488000869751, "status": "ok"}
{"N": 262144, "K": 1024, "D": 128, "B": 1, "dtype": "fp16", "BLOCK_N": 32, "BLOCK_K": 128, "num_warps": 8, "num_stages": 2, "time_ms": 0.5440879985690117, "status": "ok"}
{"N": 262144, "K": 1024, "D": 128, "B": 1, "dtype": "fp16", "BLOCK_N": 32, "BLOCK_K": 128, "num_warps": 8, "num_stages": 4, "time_ms": 0.5761051603725978, "status": "ok"}
{"N": 262144, "K": 1024, "D": 128, "B": 1, "dtype": "fp16", "BLOCK_N": 64, "BLOCK_K": 32, "num_warps": 4, "num_stages": 1, "time_ms": 0.27861256897449493, "status": "ok"}
{"N": 262144, "K": 1024, "D": 128, "B": 1, "dtype": "fp16", "BLOCK_N": 64, "BLOCK_K": 32, "num_warps": 4, "num_stages": 2, "time_ms": 0.24307199753820896, "status": "ok"}
{"N": 262144, "K": 1024, "D": 128, "B": 1, "dtype": "fp16", "BLOCK_N": 64, "BLOCK_K": 32, "num_warps": 4, "num_stages": 4, "time_ms": 0.24721920092900593, "status": "ok"}
{"N": 262144, "K": 1024, "D": 128, "B": 1, "dtype": "fp16", "BLOCK_N": 64, "BLOCK_K": 32, "num_warps": 8, "num_stages": 1, "time_ms": 0.49428800120949745, "status": "ok"}
{"N": 262144, "K": 1024, "D": 128, "B": 1, "dtype": "fp16", "BLOCK_N": 64, "BLOCK_K": 32, "num_warps": 8, "num_stages": 2, "time_ms": 0.4376853307088216, "status": "ok"}
{"N": 262144, "K": 1024, "D": 128, "B": 1, "dtype": "fp16", "BLOCK_N": 64, "BLOCK_K": 32, "num_warps": 8, "num_stages": 4, "time_ms": 0.44237156046761406, "status": "ok"}
{"N": 262144, "K": 1024, "D": 128, "B": 1, "dtype": "fp16", "BLOCK_N": 64, "BLOCK_K": 64, "num_warps": 4, "num_stages": 1, "time_ms": 0.23372199852019548, "status": "ok"}
{"N": 262144, "K": 1024, "D": 128, "B": 1, "dtype": "fp16", "BLOCK_N": 64, "BLOCK_K": 64, "num_warps": 4, "num_stages": 2, "time_ms": 0.21217244366804758, "status": "ok"}
{"N": 262144, "K": 1024, "D": 128, "B": 1, "dtype": "fp16", "BLOCK_N": 64, "BLOCK_K": 64, "num_warps": 4, "num_stages": 4, "time_ms": 0.22896800097078085, "status": "ok"}
{"N": 262144, "K": 1024, "D": 128, "B": 1, "dtype": "fp16", "BLOCK_N": 64, "BLOCK_K": 64, "num_warps": 8, "num_stages": 1, "time_ms": 0.3484773288170497, "status": "ok"}
{"N": 262144, "K": 1024, "D": 128, "B": 1, "dtype": "fp16", "BLOCK_N": 64, "BLOCK_K": 64, "num_warps": 8, "num_stages": 2, "time_ms": 0.31104000027363116, "status": "ok"}
{"N": 262144, "K": 1024, "D": 128, "B": 1, "dtype": "fp16", "BLOCK_N": 64, "BLOCK_K": 64, "num_warps": 8, "num_stages": 4, "time_ms": 0.3537626713514328, "status": "ok"}
{"N": 262144, "K": 1024, "D": 128, "B": 1, "dtype": "fp16", "BLOCK_N": 64, "BLOCK_K": 128, "num_warps": 4, "num_stages": 1, "time_ms": 0.21436234958031597, "status": "ok"}
{"N": 262144, "K": 1024, "D": 128, "B": 1, "dtype": "fp16", "BLOCK_N": 64, "BLOCK_K": 128, "num_warps": 4, "num_stages": 2, "time_ms": 0.22088658809661865, "status": "ok"}
{"N": 262144, "K": 1024, "D": 128, "B": 1, "dtype": "fp16", "BLOCK_N": 64, "BLOCK_K": 128, "num_warps": 4, "num_stages": 4, "time_ms": 0.30720492280446565, "status": "ok"}
{"N": 262144, "K": 1024, "D": 128, "B": 1, "dtype": "fp16", "BLOCK_N": 64, "BLOCK_K": 128, "num_warps": 8, "num_stages": 1, "time_ms": 0.32765067120393115, "status": "ok"}
{"N": 262144, "K": 1024, "D": 128, "B": 1, "dtype": "fp16", "BLOCK_N": 64, "BLOCK_K": 128, "num_warps": 8, "num_stages": 2, "time_ms": 0.29280983943205613, "status": "ok"}
{"N": 262144, "K": 1024, "D": 128, "B": 1, "dtype": "fp16", "BLOCK_N": 64, "BLOCK_K": 128, "num_warps": 8, "num_stages": 4, "time_ms": 0.3606283664703369, "status": "ok"}
{"N": 262144, "K": 1024, "D": 128, "B": 1, "dtype": "fp16", "BLOCK_N": 128, "BLOCK_K": 32, "num_warps": 4, "num_stages": 1, "time_ms": 0.24615599680691957, "status": "ok"}
{"N": 262144, "K": 1024, "D": 128, "B": 1, "dtype": "fp16", "BLOCK_N": 128, "BLOCK_K": 32, "num_warps": 4, "num_stages": 2, "time_ms": 0.2508074680964152, "status": "ok"}
{"N": 262144, "K": 1024, "D": 128, "B": 1, "dtype": "fp16", "BLOCK_N": 128, "BLOCK_K": 32, "num_warps": 4, "num_stages": 4, "time_ms": 0.25885013341903684, "status": "ok"}
{"N": 262144, "K": 1024, "D": 128, "B": 1, "dtype": "fp16", "BLOCK_N": 128, "BLOCK_K": 32, "num_warps": 8, "num_stages": 1, "time_ms": 0.2524714688460032, "status": "ok"}
{"N": 262144, "K": 1024, "D": 128, "B": 1, "dtype": "fp16", "BLOCK_N": 128, "BLOCK_K": 32, "num_warps": 8, "num_stages": 2, "time_ms": 0.2477500019595027, "status": "ok"}
{"N": 262144, "K": 1024, "D": 128, "B": 1, "dtype": "fp16", "BLOCK_N": 128, "BLOCK_K": 32, "num_warps": 8, "num_stages": 4, "time_ms": 0.2530901292959849, "status": "ok"}
{"N": 262144, "K": 1024, "D": 128, "B": 1, "dtype": "fp16", "BLOCK_N": 128, "BLOCK_K": 64, "num_warps": 4, "num_stages": 1, "time_ms": 0.21476141231901505, "status": "ok"}
{"N": 262144, "K": 1024, "D": 128, "B": 1, "dtype": "fp16", "BLOCK_N": 128, "BLOCK_K": 64, "num_warps": 4, "num_stages": 2, "time_ms": 0.218164704301778, "status": "ok"}
{"N": 262144, "K": 1024, "D": 128, "B": 1, "dtype": "fp16", "BLOCK_N": 128, "BLOCK_K": 64, "num_warps": 4, "num_stages": 4, "time_ms": 0.21839059012777665, "status": "ok"}
{"N": 262144, "K": 1024, "D": 128, "B": 1, "dtype": "fp16", "BLOCK_N": 128, "BLOCK_K": 64, "num_warps": 8, "num_stages": 1, "time_ms": 0.2260630595333436, "status": "ok"}
{"N": 262144, "K": 1024, "D": 128, "B": 1, "dtype": "fp16", "BLOCK_N": 128, "BLOCK_K": 64, "num_warps": 8, "num_stages": 2, "time_ms": 0.21844706026946797, "status": "ok"}
{"N": 262144, "K": 1024, "D": 128, "B": 1, "dtype": "fp16", "BLOCK_N": 128, "BLOCK_K": 64, "num_warps": 8, "num_stages": 4, "time_ms": 0.21962729447028217, "status": "ok"}
{"N": 262144, "K": 1024, "D": 128, "B": 1, "dtype": "fp16", "BLOCK_N": 128, "BLOCK_K": 128, "num_warps": 4, "num_stages": 1, "time_ms": 0.22364235274931965, "status": "ok"}
{"N": 262144, "K": 1024, "D": 128, "B": 1, "dtype": "fp16", "BLOCK_N": 128, "BLOCK_K": 128, "num_warps": 4, "num_stages": 2, "time_ms": 0.21326870778027704, "status": "ok"}
{"N": 262144, "K": 1024, "D": 128, "B": 1, "dtype": "fp16", "BLOCK_N": 128, "BLOCK_K": 128, "num_warps": 4, "num_stages": 4, "time_ms": 0.2681851472173418, "status": "ok"}
{"N": 262144, "K": 1024, "D": 128, "B": 1, "dtype": "fp16", "BLOCK_N": 128, "BLOCK_K": 128, "num_warps": 8, "num_stages": 1, "time_ms": 0.32704266905784607, "status": "ok"}
{"N": 262144, "K": 1024, "D": 128, "B": 1, "dtype": "fp16", "BLOCK_N": 128, "BLOCK_K": 128, "num_warps": 8, "num_stages": 2, "time_ms": 0.21105317508473115, "status": "ok"}
{"N": 262144, "K": 1024, "D": 128, "B": 1, "dtype": "fp16", "BLOCK_N": 128, "BLOCK_K": 128, "num_warps": 8, "num_stages": 4, "time_ms": 0.25798826416333515, "status": "ok"}
{"summary": true, "N": 262144, "K": 1024, "D": 128, "B": 1, "dtype": "fp16", "best": {"N": 262144, "K": 1024, "D": 128, "B": 1, "dtype": "fp16", "BLOCK_N": 128, "BLOCK_K": 128, "num_warps": 8, "num_stages": 2, "time_ms": 0.21105317508473115, "status": "ok"}, "best_time_ms": 0.21105317508473115, "tuning_seconds": 11.380300760269165, "skipped": 0}
