grid_results_h200/N262144_K1024_D64_B32_fp16.jsonl
{"N": 262144, "K": 1024, "D": 64, "B": 32, "dtype": "fp16", "BLOCK_N": 32, "BLOCK_K": 32, "num_warps": 4, "num_stages": 1, "time_ms": 13.370623588562012, "status": "ok"}
{"N": 262144, "K": 1024, "D": 64, "B": 32, "dtype": "fp16", "BLOCK_N": 32, "BLOCK_K": 32, "num_warps": 4, "num_stages": 2, "time_ms": 12.111647605895996, "status": "ok"}
{"N": 262144, "K": 1024, "D": 64, "B": 32, "dtype": "fp16", "BLOCK_N": 32, "BLOCK_K": 32, "num_warps": 4, "num_stages": 4, "time_ms": 12.082464218139648, "status": "ok"}
{"N": 262144, "K": 1024, "D": 64, "B": 32, "dtype": "fp16", "BLOCK_N": 32, "BLOCK_K": 32, "num_warps": 8, "num_stages": 1, "time_ms": 21.498655319213867, "status": "ok"}
{"N": 262144, "K": 1024, "D": 64, "B": 32, "dtype": "fp16", "BLOCK_N": 32, "BLOCK_K": 32, "num_warps": 8, "num_stages": 2, "time_ms": 20.682912826538086, "status": "ok"}
{"N": 262144, "K": 1024, "D": 64, "B": 32, "dtype": "fp16", "BLOCK_N": 32, "BLOCK_K": 32, "num_warps": 8, "num_stages": 4, "time_ms": 20.554847717285156, "status": "ok"}
{"N": 262144, "K": 1024, "D": 64, "B": 32, "dtype": "fp16", "BLOCK_N": 32, "BLOCK_K": 64, "num_warps": 4, "num_stages": 1, "time_ms": 11.457119941711426, "status": "ok"}
{"N": 262144, "K": 1024, "D": 64, "B": 32, "dtype": "fp16", "BLOCK_N": 32, "BLOCK_K": 64, "num_warps": 4, "num_stages": 2, "time_ms": 10.363807678222656, "status": "ok"}
{"N": 262144, "K": 1024, "D": 64, "B": 32, "dtype": "fp16", "BLOCK_N": 32, "BLOCK_K": 64, "num_warps": 4, "num_stages": 4, "time_ms": 10.070752143859863, "status": "ok"}
{"N": 262144, "K": 1024, "D": 64, "B": 32, "dtype": "fp16", "BLOCK_N": 32, "BLOCK_K": 64, "num_warps": 8, "num_stages": 1, "time_ms": 13.967679977416992, "status": "ok"}
{"N": 262144, "K": 1024, "D": 64, "B": 32, "dtype": "fp16", "BLOCK_N": 32, "BLOCK_K": 64, "num_warps": 8, "num_stages": 2, "time_ms": 13.20803165435791, "status": "ok"}
{"N": 262144, "K": 1024, "D": 64, "B": 32, "dtype": "fp16", "BLOCK_N": 32, "BLOCK_K": 64, "num_warps": 8, "num_stages": 4, "time_ms": 13.216704368591309, "status": "ok"}
{"N": 262144, "K": 1024, "D": 64, "B": 32, "dtype": "fp16", "BLOCK_N": 32, "BLOCK_K": 128, "num_warps": 4, "num_stages": 1, "time_ms": 9.110879898071289, "status": "ok"}
{"N": 262144, "K": 1024, "D": 64, "B": 32, "dtype": "fp16", "BLOCK_N": 32, "BLOCK_K": 128, "num_warps": 4, "num_stages": 2, "time_ms": 8.100319862365723, "status": "ok"}
{"N": 262144, "K": 1024, "D": 64, "B": 32, "dtype": "fp16", "BLOCK_N": 32, "BLOCK_K": 128, "num_warps": 4, "num_stages": 4, "time_ms": 8.497695922851562, "status": "ok"}
{"N": 262144, "K": 1024, "D": 64, "B": 32, "dtype": "fp16", "BLOCK_N": 32, "BLOCK_K": 128, "num_warps": 8, "num_stages": 1, "time_ms": 14.504096031188965, "status": "ok"}
{"N": 262144, "K": 1024, "D": 64, "B": 32, "dtype": "fp16", "BLOCK_N": 32, "BLOCK_K": 128, "num_warps": 8, "num_stages": 2, "time_ms": 12.72003173828125, "status": "ok"}
{"N": 262144, "K": 1024, "D": 64, "B": 32, "dtype": "fp16", "BLOCK_N": 32, "BLOCK_K": 128, "num_warps": 8, "num_stages": 4, "time_ms": 12.52182388305664, "status": "ok"}
{"N": 262144, "K": 1024, "D": 64, "B": 32, "dtype": "fp16", "BLOCK_N": 64, "BLOCK_K": 32, "num_warps": 4, "num_stages": 1, "time_ms": 5.416927814483643, "status": "ok"}
{"N": 262144, "K": 1024, "D": 64, "B": 32, "dtype": "fp16", "BLOCK_N": 64, "BLOCK_K": 32, "num_warps": 4, "num_stages": 2, "time_ms": 5.352863788604736, "status": "ok"}
{"N": 262144, "K": 1024, "D": 64, "B": 32, "dtype": "fp16", "BLOCK_N": 64, "BLOCK_K": 32, "num_warps": 4, "num_stages": 4, "time_ms": 5.435967922210693, "status": "ok"}
{"N": 262144, "K": 1024, "D": 64, "B": 32, "dtype": "fp16", "BLOCK_N": 64, "BLOCK_K": 32, "num_warps": 8, "num_stages": 1, "time_ms": 10.731424331665039, "status": "ok"}
{"N": 262144, "K": 1024, "D": 64, "B": 32, "dtype": "fp16", "BLOCK_N": 64, "BLOCK_K": 32, "num_warps": 8, "num_stages": 2, "time_ms": 10.152192115783691, "status": "ok"}
{"N": 262144, "K": 1024, "D": 64, "B": 32, "dtype": "fp16", "BLOCK_N": 64, "BLOCK_K": 32, "num_warps": 8, "num_stages": 4, "time_ms": 10.064000129699707, "status": "ok"}
{"N": 262144, "K": 1024, "D": 64, "B": 32, "dtype": "fp16", "BLOCK_N": 64, "BLOCK_K": 64, "num_warps": 4, "num_stages": 1, "time_ms": 5.226399898529053, "status": "ok"}
{"N": 262144, "K": 1024, "D": 64, "B": 32, "dtype": "fp16", "BLOCK_N": 64, "BLOCK_K": 64, "num_warps": 4, "num_stages": 2, "time_ms": 4.9119038581848145, "status": "ok"}
{"N": 262144, "K": 1024, "D": 64, "B": 32, "dtype": "fp16", "BLOCK_N": 64, "BLOCK_K": 64, "num_warps": 4, "num_stages": 4, "time_ms": 4.996543884277344, "status": "ok"}
{"N": 262144, "K": 1024, "D": 64, "B": 32, "dtype": "fp16", "BLOCK_N": 64, "BLOCK_K": 64, "num_warps": 8, "num_stages": 1, "time_ms": 7.781504154205322, "status": "ok"}
{"N": 262144, "K": 1024, "D": 64, "B": 32, "dtype": "fp16", "BLOCK_N": 64, "BLOCK_K": 64, "num_warps": 8, "num_stages": 2, "time_ms": 7.52672004699707, "status": "ok"}
{"N": 262144, "K": 1024, "D": 64, "B": 32, "dtype": "fp16", "BLOCK_N": 64, "BLOCK_K": 64, "num_warps": 8, "num_stages": 4, "time_ms": 7.486623764038086, "status": "ok"}
{"N": 262144, "K": 1024, "D": 64, "B": 32, "dtype": "fp16", "BLOCK_N": 64, "BLOCK_K": 128, "num_warps": 4, "num_stages": 1, "time_ms": 4.762847900390625, "status": "ok"}
{"N": 262144, "K": 1024, "D": 64, "B": 32, "dtype": "fp16", "BLOCK_N": 64, "BLOCK_K": 128, "num_warps": 4, "num_stages": 2, "time_ms": 4.854720115661621, "status": "ok"}
{"N": 262144, "K": 1024, "D": 64, "B": 32, "dtype": "fp16", "BLOCK_N": 64, "BLOCK_K": 128, "num_warps": 4, "num_stages": 4, "time_ms": 4.836544036865234, "status": "ok"}
{"N": 262144, "K": 1024, "D": 64, "B": 32, "dtype": "fp16", "BLOCK_N": 64, "BLOCK_K": 128, "num_warps": 8, "num_stages": 1, "time_ms": 7.583871841430664, "status": "ok"}
{"N": 262144, "K": 1024, "D": 64, "B": 32, "dtype": "fp16", "BLOCK_N": 64, "BLOCK_K": 128, "num_warps": 8, "num_stages": 2, "time_ms": 7.127903938293457, "status": "ok"}
{"N": 262144, "K": 1024, "D": 64, "B": 32, "dtype": "fp16", "BLOCK_N": 64, "BLOCK_K": 128, "num_warps": 8, "num_stages": 4, "time_ms": 6.958367824554443, "status": "ok"}
{"N": 262144, "K": 1024, "D": 64, "B": 32, "dtype": "fp16", "BLOCK_N": 128, "BLOCK_K": 32, "num_warps": 4, "num_stages": 1, "time_ms": 5.329343795776367, "status": "ok"}
{"N": 262144, "K": 1024, "D": 64, "B": 32, "dtype": "fp16", "BLOCK_N": 128, "BLOCK_K": 32, "num_warps": 4, "num_stages": 2, "time_ms": 5.193056106567383, "status": "ok"}
{"N": 262144, "K": 1024, "D": 64, "B": 32, "dtype": "fp16", "BLOCK_N": 128, "BLOCK_K": 32, "num_warps": 4, "num_stages": 4, "time_ms": 5.244800090789795, "status": "ok"}
{"N": 262144, "K": 1024, "D": 64, "B": 32, "dtype": "fp16", "BLOCK_N": 128, "BLOCK_K": 32, "num_warps": 8, "num_stages": 1, "time_ms": 5.594655990600586, "status": "ok"}
{"N": 262144, "K": 1024, "D": 64, "B": 32, "dtype": "fp16", "BLOCK_N": 128, "BLOCK_K": 32, "num_warps": 8, "num_stages": 2, "time_ms": 5.845088005065918, "status": "ok"}
{"N": 262144, "K": 1024, "D": 64, "B": 32, "dtype": "fp16", "BLOCK_N": 128, "BLOCK_K": 32, "num_warps": 8, "num_stages": 4, "time_ms": 5.729568004608154, "status": "ok"}
{"N": 262144, "K": 1024, "D": 64, "B": 32, "dtype": "fp16", "BLOCK_N": 128, "BLOCK_K": 64, "num_warps": 4, "num_stages": 1, "time_ms": 5.11078405380249, "status": "ok"}
{"N": 262144, "K": 1024, "D": 64, "B": 32, "dtype": "fp16", "BLOCK_N": 128, "BLOCK_K": 64, "num_warps": 4, "num_stages": 2, "time_ms": 4.6769280433654785, "status": "ok"}
{"N": 262144, "K": 1024, "D": 64, "B": 32, "dtype": "fp16", "BLOCK_N": 128, "BLOCK_K": 64, "num_warps": 4, "num_stages": 4, "time_ms": 4.795487880706787, "status": "ok"}
{"N": 262144, "K": 1024, "D": 64, "B": 32, "dtype": "fp16", "BLOCK_N": 128, "BLOCK_K": 64, "num_warps": 8, "num_stages": 1, "time_ms": 5.3048319816589355, "status": "ok"}
{"N": 262144, "K": 1024, "D": 64, "B": 32, "dtype": "fp16", "BLOCK_N": 128, "BLOCK_K": 64, "num_warps": 8, "num_stages": 2, "time_ms": 5.12281608581543, "status": "ok"}
{"N": 262144, "K": 1024, "D": 64, "B": 32, "dtype": "fp16", "BLOCK_N": 128, "BLOCK_K": 64, "num_warps": 8, "num_stages": 4, "time_ms": 5.141215801239014, "status": "ok"}
{"N": 262144, "K": 1024, "D": 64, "B": 32, "dtype": "fp16", "BLOCK_N": 128, "BLOCK_K": 128, "num_warps": 4, "num_stages": 1, "time_ms": 5.419968128204346, "status": "ok"}
{"N": 262144, "K": 1024, "D": 64, "B": 32, "dtype": "fp16", "BLOCK_N": 128, "BLOCK_K": 128, "num_warps": 4, "num_stages": 2, "time_ms": 5.130688190460205, "status": "ok"}
{"N": 262144, "K": 1024, "D": 64, "B": 32, "dtype": "fp16", "BLOCK_N": 128, "BLOCK_K": 128, "num_warps": 4, "num_stages": 4, "time_ms": 4.722400188446045, "status": "ok"}
{"N": 262144, "K": 1024, "D": 64, "B": 32, "dtype": "fp16", "BLOCK_N": 128, "BLOCK_K": 128, "num_warps": 8, "num_stages": 1, "time_ms": 7.253087997436523, "status": "ok"}
{"N": 262144, "K": 1024, "D": 64, "B": 32, "dtype": "fp16", "BLOCK_N": 128, "BLOCK_K": 128, "num_warps": 8, "num_stages": 2, "time_ms": 5.033472061157227, "status": "ok"}
{"N": 262144, "K": 1024, "D": 64, "B": 32, "dtype": "fp16", "BLOCK_N": 128, "BLOCK_K": 128, "num_warps": 8, "num_stages": 4, "time_ms": 4.933279991149902, "status": "ok"}
{"summary": true, "N": 262144, "K": 1024, "D": 64, "B": 32, "dtype": "fp16", "best": {"N": 262144, "K": 1024, "D": 64, "B": 32, "dtype": "fp16", "BLOCK_N": 128, "BLOCK_K": 64, "num_warps": 4, "num_stages": 2, "time_ms": 4.6769280433654785, "status": "ok"}, "best_time_ms": 4.6769280433654785, "tuning_seconds": 12.722152948379517, "skipped": 0}
