grid_results_h200/N65536_K1024_D64_B1_fp16.jsonl
{"N": 65536, "K": 1024, "D": 64, "B": 1, "dtype": "fp16", "BLOCK_N": 32, "BLOCK_K": 32, "num_warps": 4, "num_stages": 1, "time_ms": 0.11784960031509399, "status": "ok"}
{"N": 65536, "K": 1024, "D": 64, "B": 1, "dtype": "fp16", "BLOCK_N": 32, "BLOCK_K": 32, "num_warps": 4, "num_stages": 2, "time_ms": 0.10986041431796961, "status": "ok"}
{"N": 65536, "K": 1024, "D": 64, "B": 1, "dtype": "fp16", "BLOCK_N": 32, "BLOCK_K": 32, "num_warps": 4, "num_stages": 4, "time_ms": 0.10749241375717623, "status": "ok"}
{"N": 65536, "K": 1024, "D": 64, "B": 1, "dtype": "fp16", "BLOCK_N": 32, "BLOCK_K": 32, "num_warps": 8, "num_stages": 1, "time_ms": 0.1903444207028339, "status": "ok"}
{"N": 65536, "K": 1024, "D": 64, "B": 1, "dtype": "fp16", "BLOCK_N": 32, "BLOCK_K": 32, "num_warps": 8, "num_stages": 2, "time_ms": 0.18020319938659668, "status": "ok"}
{"N": 65536, "K": 1024, "D": 64, "B": 1, "dtype": "fp16", "BLOCK_N": 32, "BLOCK_K": 32, "num_warps": 8, "num_stages": 4, "time_ms": 0.17319923852171218, "status": "ok"}
{"N": 65536, "K": 1024, "D": 64, "B": 1, "dtype": "fp16", "BLOCK_N": 32, "BLOCK_K": 64, "num_warps": 4, "num_stages": 1, "time_ms": 0.10126080041130384, "status": "ok"}
{"N": 65536, "K": 1024, "D": 64, "B": 1, "dtype": "fp16", "BLOCK_N": 32, "BLOCK_K": 64, "num_warps": 4, "num_stages": 2, "time_ms": 0.0943480001296848, "status": "ok"}
{"N": 65536, "K": 1024, "D": 64, "B": 1, "dtype": "fp16", "BLOCK_N": 32, "BLOCK_K": 64, "num_warps": 4, "num_stages": 4, "time_ms": 0.09087299928069115, "status": "ok"}
{"N": 65536, "K": 1024, "D": 64, "B": 1, "dtype": "fp16", "BLOCK_N": 32, "BLOCK_K": 64, "num_warps": 8, "num_stages": 1, "time_ms": 0.12103466634397153, "status": "ok"}
{"N": 65536, "K": 1024, "D": 64, "B": 1, "dtype": "fp16", "BLOCK_N": 32, "BLOCK_K": 64, "num_warps": 8, "num_stages": 2, "time_ms": 0.11767314241400786, "status": "ok"}
{"N": 65536, "K": 1024, "D": 64, "B": 1, "dtype": "fp16", "BLOCK_N": 32, "BLOCK_K": 64, "num_warps": 8, "num_stages": 4, "time_ms": 0.11450857163539954, "status": "ok"}
{"N": 65536, "K": 1024, "D": 64, "B": 1, "dtype": "fp16", "BLOCK_N": 32, "BLOCK_K": 128, "num_warps": 4, "num_stages": 1, "time_ms": 0.08294787935235283, "status": "ok"}
{"N": 65536, "K": 1024, "D": 64, "B": 1, "dtype": "fp16", "BLOCK_N": 32, "BLOCK_K": 128, "num_warps": 4, "num_stages": 2, "time_ms": 0.07789622800690787, "status": "ok"}
{"N": 65536, "K": 1024, "D": 64, "B": 1, "dtype": "fp16", "BLOCK_N": 32, "BLOCK_K": 128, "num_warps": 4, "num_stages": 4, "time_ms": 0.07651840001344681, "status": "ok"}
{"N": 65536, "K": 1024, "D": 64, "B": 1, "dtype": "fp16", "BLOCK_N": 32, "BLOCK_K": 128, "num_warps": 8, "num_stages": 1, "time_ms": 0.12501661479473114, "status": "ok"}
{"N": 65536, "K": 1024, "D": 64, "B": 1, "dtype": "fp16", "BLOCK_N": 32, "BLOCK_K": 128, "num_warps": 8, "num_stages": 2, "time_ms": 0.11046628520957061, "status": "ok"}
{"N": 65536, "K": 1024, "D": 64, "B": 1, "dtype": "fp16", "BLOCK_N": 32, "BLOCK_K": 128, "num_warps": 8, "num_stages": 4, "time_ms": 0.10796027604875894, "status": "ok"}
{"N": 65536, "K": 1024, "D": 64, "B": 1, "dtype": "fp16", "BLOCK_N": 64, "BLOCK_K": 32, "num_warps": 4, "num_stages": 1, "time_ms": 0.057660190211165516, "status": "ok"}
{"N": 65536, "K": 1024, "D": 64, "B": 1, "dtype": "fp16", "BLOCK_N": 64, "BLOCK_K": 32, "num_warps": 4, "num_stages": 2, "time_ms": 0.058666926876800814, "status": "ok"}
{"N": 65536, "K": 1024, "D": 64, "B": 1, "dtype": "fp16", "BLOCK_N": 64, "BLOCK_K": 32, "num_warps": 4, "num_stages": 4, "time_ms": 0.05611999984830618, "status": "ok"}
{"N": 65536, "K": 1024, "D": 64, "B": 1, "dtype": "fp16", "BLOCK_N": 64, "BLOCK_K": 32, "num_warps": 8, "num_stages": 1, "time_ms": 0.09702841320942188, "status": "ok"}
{"N": 65536, "K": 1024, "D": 64, "B": 1, "dtype": "fp16", "BLOCK_N": 64, "BLOCK_K": 32, "num_warps": 8, "num_stages": 2, "time_ms": 0.09647359997034073, "status": "ok"}
{"N": 65536, "K": 1024, "D": 64, "B": 1, "dtype": "fp16", "BLOCK_N": 64, "BLOCK_K": 32, "num_warps": 8, "num_stages": 4, "time_ms": 0.09287741828349329, "status": "ok"}
{"N": 65536, "K": 1024, "D": 64, "B": 1, "dtype": "fp16", "BLOCK_N": 64, "BLOCK_K": 64, "num_warps": 4, "num_stages": 1, "time_ms": 0.05411047630366825, "status": "ok"}
{"N": 65536, "K": 1024, "D": 64, "B": 1, "dtype": "fp16", "BLOCK_N": 64, "BLOCK_K": 64, "num_warps": 4, "num_stages": 2, "time_ms": 0.052801454439759254, "status": "ok"}
{"N": 65536, "K": 1024, "D": 64, "B": 1, "dtype": "fp16", "BLOCK_N": 64, "BLOCK_K": 64, "num_warps": 4, "num_stages": 4, "time_ms": 0.04976223261896954, "status": "ok"}
{"N": 65536, "K": 1024, "D": 64, "B": 1, "dtype": "fp16", "BLOCK_N": 64, "BLOCK_K": 64, "num_warps": 8, "num_stages": 1, "time_ms": 0.07337173372507096, "status": "ok"}
{"N": 65536, "K": 1024, "D": 64, "B": 1, "dtype": "fp16", "BLOCK_N": 64, "BLOCK_K": 64, "num_warps": 8, "num_stages": 2, "time_ms": 0.07256502913577216, "status": "ok"}
{"N": 65536, "K": 1024, "D": 64, "B": 1, "dtype": "fp16", "BLOCK_N": 64, "BLOCK_K": 64, "num_warps": 8, "num_stages": 4, "time_ms": 0.07003111102514797, "status": "ok"}
{"N": 65536, "K": 1024, "D": 64, "B": 1, "dtype": "fp16", "BLOCK_N": 64, "BLOCK_K": 128, "num_warps": 4, "num_stages": 1, "time_ms": 0.050697904967126395, "status": "ok"}
{"N": 65536, "K": 1024, "D": 64, "B": 1, "dtype": "fp16", "BLOCK_N": 64, "BLOCK_K": 128, "num_warps": 4, "num_stages": 2, "time_ms": 0.049785904675012545, "status": "ok"}
{"N": 65536, "K": 1024, "D": 64, "B": 1, "dtype": "fp16", "BLOCK_N": 64, "BLOCK_K": 128, "num_warps": 4, "num_stages": 4, "time_ms": 0.04813456411163012, "status": "ok"}
{"N": 65536, "K": 1024, "D": 64, "B": 1, "dtype": "fp16", "BLOCK_N": 64, "BLOCK_K": 128, "num_warps": 8, "num_stages": 1, "time_ms": 0.0686754598408132, "status": "ok"}
{"N": 65536, "K": 1024, "D": 64, "B": 1, "dtype": "fp16", "BLOCK_N": 64, "BLOCK_K": 128, "num_warps": 8, "num_stages": 2, "time_ms": 0.06861232442630304, "status": "ok"}
{"N": 65536, "K": 1024, "D": 64, "B": 1, "dtype": "fp16", "BLOCK_N": 64, "BLOCK_K": 128, "num_warps": 8, "num_stages": 4, "time_ms": 0.06485087157059939, "status": "ok"}
{"N": 65536, "K": 1024, "D": 64, "B": 1, "dtype": "fp16", "BLOCK_N": 128, "BLOCK_K": 32, "num_warps": 4, "num_stages": 1, "time_ms": 0.059360000236732206, "status": "ok"}
{"N": 65536, "K": 1024, "D": 64, "B": 1, "dtype": "fp16", "BLOCK_N": 128, "BLOCK_K": 32, "num_warps": 4, "num_stages": 2, "time_ms": 0.05981999998912215, "status": "ok"}
{"N": 65536, "K": 1024, "D": 64, "B": 1, "dtype": "fp16", "BLOCK_N": 128, "BLOCK_K": 32, "num_warps": 4, "num_stages": 4, "time_ms": 0.0558620954730681, "status": "ok"}
{"N": 65536, "K": 1024, "D": 64, "B": 1, "dtype": "fp16", "BLOCK_N": 128, "BLOCK_K": 32, "num_warps": 8, "num_stages": 1, "time_ms": 0.058165853888523286, "status": "ok"}
{"N": 65536, "K": 1024, "D": 64, "B": 1, "dtype": "fp16", "BLOCK_N": 128, "BLOCK_K": 32, "num_warps": 8, "num_stages": 2, "time_ms": 0.06274789781906666, "status": "ok"}
{"N": 65536, "K": 1024, "D": 64, "B": 1, "dtype": "fp16", "BLOCK_N": 128, "BLOCK_K": 32, "num_warps": 8, "num_stages": 4, "time_ms": 0.058147121675130795, "status": "ok"}
{"N": 65536, "K": 1024, "D": 64, "B": 1, "dtype": "fp16", "BLOCK_N": 128, "BLOCK_K": 64, "num_warps": 4, "num_stages": 1, "time_ms": 0.053247219451316975, "status": "ok"}
{"N": 65536, "K": 1024, "D": 64, "B": 1, "dtype": "fp16", "BLOCK_N": 128, "BLOCK_K": 64, "num_warps": 4, "num_stages": 2, "time_ms": 0.05249326830593551, "status": "ok"}
{"N": 65536, "K": 1024, "D": 64, "B": 1, "dtype": "fp16", "BLOCK_N": 128, "BLOCK_K": 64, "num_warps": 4, "num_stages": 4, "time_ms": 0.04933257143767107, "status": "ok"}
{"N": 65536, "K": 1024, "D": 64, "B": 1, "dtype": "fp16", "BLOCK_N": 128, "BLOCK_K": 64, "num_warps": 8, "num_stages": 1, "time_ms": 0.05566126844141542, "status": "ok"}
{"N": 65536, "K": 1024, "D": 64, "B": 1, "dtype": "fp16", "BLOCK_N": 128, "BLOCK_K": 64, "num_warps": 8, "num_stages": 2, "time_ms": 0.05564097551310935, "status": "ok"}
{"N": 65536, "K": 1024, "D": 64, "B": 1, "dtype": "fp16", "BLOCK_N": 128, "BLOCK_K": 64, "num_warps": 8, "num_stages": 4, "time_ms": 0.051317599788308146, "status": "ok"}
{"N": 65536, "K": 1024, "D": 64, "B": 1, "dtype": "fp16", "BLOCK_N": 128, "BLOCK_K": 128, "num_warps": 4, "num_stages": 1, "time_ms": 0.05202107313202649, "status": "ok"}
{"N": 65536, "K": 1024, "D": 64, "B": 1, "dtype": "fp16", "BLOCK_N": 128, "BLOCK_K": 128, "num_warps": 4, "num_stages": 2, "time_ms": 0.05306926814884674, "status": "ok"}
{"N": 65536, "K": 1024, "D": 64, "B": 1, "dtype": "fp16", "BLOCK_N": 128, "BLOCK_K": 128, "num_warps": 4, "num_stages": 4, "time_ms": 0.050922666454599017, "status": "ok"}
{"N": 65536, "K": 1024, "D": 64, "B": 1, "dtype": "fp16", "BLOCK_N": 128, "BLOCK_K": 128, "num_warps": 8, "num_stages": 1, "time_ms": 0.06999956776161452, "status": "ok"}
{"N": 65536, "K": 1024, "D": 64, "B": 1, "dtype": "fp16", "BLOCK_N": 128, "BLOCK_K": 128, "num_warps": 8, "num_stages": 2, "time_ms": 0.05307123810052872, "status": "ok"}
{"N": 65536, "K": 1024, "D": 64, "B": 1, "dtype": "fp16", "BLOCK_N": 128, "BLOCK_K": 128, "num_warps": 8, "num_stages": 4, "time_ms": 0.050326857272358166, "status": "ok"}
{"summary": true, "N": 65536, "K": 1024, "D": 64, "B": 1, "dtype": "fp16", "best": {"N": 65536, "K": 1024, "D": 64, "B": 1, "dtype": "fp16", "BLOCK_N": 64, "BLOCK_K": 128, "num_warps": 4, "num_stages": 4, "time_ms": 0.04813456411163012, "status": "ok"}, "best_time_ms": 0.04813456411163012, "tuning_seconds": 9.673338890075684, "skipped": 0}
