grid_results_h200/N65536_K1024_D64_B32_fp16.jsonl
{"N": 65536, "K": 1024, "D": 64, "B": 32, "dtype": "fp16", "BLOCK_N": 32, "BLOCK_K": 32, "num_warps": 4, "num_stages": 1, "time_ms": 3.3569600582122803, "status": "ok"}
{"N": 65536, "K": 1024, "D": 64, "B": 32, "dtype": "fp16", "BLOCK_N": 32, "BLOCK_K": 32, "num_warps": 4, "num_stages": 2, "time_ms": 3.0183041095733643, "status": "ok"}
{"N": 65536, "K": 1024, "D": 64, "B": 32, "dtype": "fp16", "BLOCK_N": 32, "BLOCK_K": 32, "num_warps": 4, "num_stages": 4, "time_ms": 3.009023904800415, "status": "ok"}
{"N": 65536, "K": 1024, "D": 64, "B": 32, "dtype": "fp16", "BLOCK_N": 32, "BLOCK_K": 32, "num_warps": 8, "num_stages": 1, "time_ms": 5.370431900024414, "status": "ok"}
{"N": 65536, "K": 1024, "D": 64, "B": 32, "dtype": "fp16", "BLOCK_N": 32, "BLOCK_K": 32, "num_warps": 8, "num_stages": 2, "time_ms": 5.147295951843262, "status": "ok"}
{"N": 65536, "K": 1024, "D": 64, "B": 32, "dtype": "fp16", "BLOCK_N": 32, "BLOCK_K": 32, "num_warps": 8, "num_stages": 4, "time_ms": 5.1071038246154785, "status": "ok"}
{"N": 65536, "K": 1024, "D": 64, "B": 32, "dtype": "fp16", "BLOCK_N": 32, "BLOCK_K": 64, "num_warps": 4, "num_stages": 1, "time_ms": 2.864255905151367, "status": "ok"}
{"N": 65536, "K": 1024, "D": 64, "B": 32, "dtype": "fp16", "BLOCK_N": 32, "BLOCK_K": 64, "num_warps": 4, "num_stages": 2, "time_ms": 2.5797441005706787, "status": "ok"}
{"N": 65536, "K": 1024, "D": 64, "B": 32, "dtype": "fp16", "BLOCK_N": 32, "BLOCK_K": 64, "num_warps": 4, "num_stages": 4, "time_ms": 2.506592035293579, "status": "ok"}
{"N": 65536, "K": 1024, "D": 64, "B": 32, "dtype": "fp16", "BLOCK_N": 32, "BLOCK_K": 64, "num_warps": 8, "num_stages": 1, "time_ms": 3.492095947265625, "status": "ok"}
{"N": 65536, "K": 1024, "D": 64, "B": 32, "dtype": "fp16", "BLOCK_N": 32, "BLOCK_K": 64, "num_warps": 8, "num_stages": 2, "time_ms": 3.2919039726257324, "status": "ok"}
{"N": 65536, "K": 1024, "D": 64, "B": 32, "dtype": "fp16", "BLOCK_N": 32, "BLOCK_K": 64, "num_warps": 8, "num_stages": 4, "time_ms": 3.289792060852051, "status": "ok"}
{"N": 65536, "K": 1024, "D": 64, "B": 32, "dtype": "fp16", "BLOCK_N": 32, "BLOCK_K": 128, "num_warps": 4, "num_stages": 1, "time_ms": 2.2766079902648926, "status": "ok"}
{"N": 65536, "K": 1024, "D": 64, "B": 32, "dtype": "fp16", "BLOCK_N": 32, "BLOCK_K": 128, "num_warps": 4, "num_stages": 2, "time_ms": 2.088927984237671, "status": "ok"}
{"N": 65536, "K": 1024, "D": 64, "B": 32, "dtype": "fp16", "BLOCK_N": 32, "BLOCK_K": 128, "num_warps": 4, "num_stages": 4, "time_ms": 2.0991519689559937, "status": "ok"}
{"N": 65536, "K": 1024, "D": 64, "B": 32, "dtype": "fp16", "BLOCK_N": 32, "BLOCK_K": 128, "num_warps": 8, "num_stages": 1, "time_ms": 3.6346559524536133, "status": "ok"}
{"N": 65536, "K": 1024, "D": 64, "B": 32, "dtype": "fp16", "BLOCK_N": 32, "BLOCK_K": 128, "num_warps": 8, "num_stages": 2, "time_ms": 3.1486079692840576, "status": "ok"}
{"N": 65536, "K": 1024, "D": 64, "B": 32, "dtype": "fp16", "BLOCK_N": 32, "BLOCK_K": 128, "num_warps": 8, "num_stages": 4, "time_ms": 3.091104030609131, "status": "ok"}
{"N": 65536, "K": 1024, "D": 64, "B": 32, "dtype": "fp16", "BLOCK_N": 64, "BLOCK_K": 32, "num_warps": 4, "num_stages": 1, "time_ms": 1.3581760327021282, "status": "ok"}
{"N": 65536, "K": 1024, "D": 64, "B": 32, "dtype": "fp16", "BLOCK_N": 64, "BLOCK_K": 32, "num_warps": 4, "num_stages": 2, "time_ms": 1.345589319864909, "status": "ok"}
{"N": 65536, "K": 1024, "D": 64, "B": 32, "dtype": "fp16", "BLOCK_N": 64, "BLOCK_K": 32, "num_warps": 4, "num_stages": 4, "time_ms": 1.3630400101343791, "status": "ok"}
{"N": 65536, "K": 1024, "D": 64, "B": 32, "dtype": "fp16", "BLOCK_N": 64, "BLOCK_K": 32, "num_warps": 8, "num_stages": 1, "time_ms": 2.692768096923828, "status": "ok"}
{"N": 65536, "K": 1024, "D": 64, "B": 32, "dtype": "fp16", "BLOCK_N": 64, "BLOCK_K": 32, "num_warps": 8, "num_stages": 2, "time_ms": 2.544800043106079, "status": "ok"}
{"N": 65536, "K": 1024, "D": 64, "B": 32, "dtype": "fp16", "BLOCK_N": 64, "BLOCK_K": 32, "num_warps": 8, "num_stages": 4, "time_ms": 2.516767978668213, "status": "ok"}
{"N": 65536, "K": 1024, "D": 64, "B": 32, "dtype": "fp16", "BLOCK_N": 64, "BLOCK_K": 64, "num_warps": 4, "num_stages": 1, "time_ms": 1.3064640363057454, "status": "ok"}
{"N": 65536, "K": 1024, "D": 64, "B": 32, "dtype": "fp16", "BLOCK_N": 64, "BLOCK_K": 64, "num_warps": 4, "num_stages": 2, "time_ms": 1.2334293127059937, "status": "ok"}
{"N": 65536, "K": 1024, "D": 64, "B": 32, "dtype": "fp16", "BLOCK_N": 64, "BLOCK_K": 64, "num_warps": 4, "num_stages": 4, "time_ms": 1.2507839997609456, "status": "ok"}
{"N": 65536, "K": 1024, "D": 64, "B": 32, "dtype": "fp16", "BLOCK_N": 64, "BLOCK_K": 64, "num_warps": 8, "num_stages": 1, "time_ms": 1.9511359930038452, "status": "ok"}
{"N": 65536, "K": 1024, "D": 64, "B": 32, "dtype": "fp16", "BLOCK_N": 64, "BLOCK_K": 64, "num_warps": 8, "num_stages": 2, "time_ms": 1.8842880129814148, "status": "ok"}
{"N": 65536, "K": 1024, "D": 64, "B": 32, "dtype": "fp16", "BLOCK_N": 64, "BLOCK_K": 64, "num_warps": 8, "num_stages": 4, "time_ms": 1.870736002922058, "status": "ok"}
{"N": 65536, "K": 1024, "D": 64, "B": 32, "dtype": "fp16", "BLOCK_N": 64, "BLOCK_K": 128, "num_warps": 4, "num_stages": 1, "time_ms": 1.2162879705429077, "status": "ok"}
{"N": 65536, "K": 1024, "D": 64, "B": 32, "dtype": "fp16", "BLOCK_N": 64, "BLOCK_K": 128, "num_warps": 4, "num_stages": 2, "time_ms": 1.205077330271403, "status": "ok"}
{"N": 65536, "K": 1024, "D": 64, "B": 32, "dtype": "fp16", "BLOCK_N": 64, "BLOCK_K": 128, "num_warps": 4, "num_stages": 4, "time_ms": 1.209663987159729, "status": "ok"}
{"N": 65536, "K": 1024, "D": 64, "B": 32, "dtype": "fp16", "BLOCK_N": 64, "BLOCK_K": 128, "num_warps": 8, "num_stages": 1, "time_ms": 1.9432960152626038, "status": "ok"}
{"N": 65536, "K": 1024, "D": 64, "B": 32, "dtype": "fp16", "BLOCK_N": 64, "BLOCK_K": 128, "num_warps": 8, "num_stages": 2, "time_ms": 1.797760009765625, "status": "ok"}
{"N": 65536, "K": 1024, "D": 64, "B": 32, "dtype": "fp16", "BLOCK_N": 64, "BLOCK_K": 128, "num_warps": 8, "num_stages": 4, "time_ms": 1.7403839826583862, "status": "ok"}
{"N": 65536, "K": 1024, "D": 64, "B": 32, "dtype": "fp16", "BLOCK_N": 128, "BLOCK_K": 32, "num_warps": 4, "num_stages": 1, "time_ms": 1.3413866360982258, "status": "ok"}
{"N": 65536, "K": 1024, "D": 64, "B": 32, "dtype": "fp16", "BLOCK_N": 128, "BLOCK_K": 32, "num_warps": 4, "num_stages": 2, "time_ms": 1.3092906475067139, "status": "ok"}
{"N": 65536, "K": 1024, "D": 64, "B": 32, "dtype": "fp16", "BLOCK_N": 128, "BLOCK_K": 32, "num_warps": 4, "num_stages": 4, "time_ms": 1.3188373645146687, "status": "ok"}
{"N": 65536, "K": 1024, "D": 64, "B": 32, "dtype": "fp16", "BLOCK_N": 128, "BLOCK_K": 32, "num_warps": 8, "num_stages": 1, "time_ms": 1.4028586546579997, "status": "ok"}
{"N": 65536, "K": 1024, "D": 64, "B": 32, "dtype": "fp16", "BLOCK_N": 128, "BLOCK_K": 32, "num_warps": 8, "num_stages": 2, "time_ms": 1.472981333732605, "status": "ok"}
{"N": 65536, "K": 1024, "D": 64, "B": 32, "dtype": "fp16", "BLOCK_N": 128, "BLOCK_K": 32, "num_warps": 8, "num_stages": 4, "time_ms": 1.4423679908116658, "status": "ok"}
{"N": 65536, "K": 1024, "D": 64, "B": 32, "dtype": "fp16", "BLOCK_N": 128, "BLOCK_K": 64, "num_warps": 4, "num_stages": 1, "time_ms": 1.278047998746236, "status": "ok"}
{"N": 65536, "K": 1024, "D": 64, "B": 32, "dtype": "fp16", "BLOCK_N": 128, "BLOCK_K": 64, "num_warps": 4, "num_stages": 2, "time_ms": 1.1804160177707672, "status": "ok"}
{"N": 65536, "K": 1024, "D": 64, "B": 32, "dtype": "fp16", "BLOCK_N": 128, "BLOCK_K": 64, "num_warps": 4, "num_stages": 4, "time_ms": 1.2055786450703938, "status": "ok"}
{"N": 65536, "K": 1024, "D": 64, "B": 32, "dtype": "fp16", "BLOCK_N": 128, "BLOCK_K": 64, "num_warps": 8, "num_stages": 1, "time_ms": 1.3409813245137532, "status": "ok"}
{"N": 65536, "K": 1024, "D": 64, "B": 32, "dtype": "fp16", "BLOCK_N": 128, "BLOCK_K": 64, "num_warps": 8, "num_stages": 2, "time_ms": 1.2935467163721721, "status": "ok"}
{"N": 65536, "K": 1024, "D": 64, "B": 32, "dtype": "fp16", "BLOCK_N": 128, "BLOCK_K": 64, "num_warps": 8, "num_stages": 4, "time_ms": 1.2897920211156209, "status": "ok"}
{"N": 65536, "K": 1024, "D": 64, "B": 32, "dtype": "fp16", "BLOCK_N": 128, "BLOCK_K": 128, "num_warps": 4, "num_stages": 1, "time_ms": 1.3450026512145996, "status": "ok"}
{"N": 65536, "K": 1024, "D": 64, "B": 32, "dtype": "fp16", "BLOCK_N": 128, "BLOCK_K": 128, "num_warps": 4, "num_stages": 2, "time_ms": 1.3032640218734741, "status": "ok"}
{"N": 65536, "K": 1024, "D": 64, "B": 32, "dtype": "fp16", "BLOCK_N": 128, "BLOCK_K": 128, "num_warps": 4, "num_stages": 4, "time_ms": 1.1989333629608154, "status": "ok"}
{"N": 65536, "K": 1024, "D": 64, "B": 32, "dtype": "fp16", "BLOCK_N": 128, "BLOCK_K": 128, "num_warps": 8, "num_stages": 1, "time_ms": 1.8413439989089966, "status": "ok"}
{"N": 65536, "K": 1024, "D": 64, "B": 32, "dtype": "fp16", "BLOCK_N": 128, "BLOCK_K": 128, "num_warps": 8, "num_stages": 2, "time_ms": 1.263370672861735, "status": "ok"}
{"N": 65536, "K": 1024, "D": 64, "B": 32, "dtype": "fp16", "BLOCK_N": 128, "BLOCK_K": 128, "num_warps": 8, "num_stages": 4, "time_ms": 1.2326080004374187, "status": "ok"}
{"summary": true, "N": 65536, "K": 1024, "D": 64, "B": 32, "dtype": "fp16", "best": {"N": 65536, "K": 1024, "D": 64, "B": 32, "dtype": "fp16", "BLOCK_N": 128, "BLOCK_K": 64, "num_warps": 4, "num_stages": 2, "time_ms": 1.1804160177707672, "status": "ok"}, "best_time_ms": 1.1804160177707672, "tuning_seconds": 10.04804277420044, "skipped": 0}
