grid_results_h200/N65536_K1024_D256_B1_fp16.jsonl
{"N": 65536, "K": 1024, "D": 256, "B": 1, "dtype": "fp16", "BLOCK_N": 32, "BLOCK_K": 32, "num_warps": 4, "num_stages": 1, "time_ms": 0.30822400003671646, "status": "ok"}
{"N": 65536, "K": 1024, "D": 256, "B": 1, "dtype": "fp16", "BLOCK_N": 32, "BLOCK_K": 32, "num_warps": 4, "num_stages": 2, "time_ms": 0.24742399994283915, "status": "ok"}
{"N": 65536, "K": 1024, "D": 256, "B": 1, "dtype": "fp16", "BLOCK_N": 32, "BLOCK_K": 32, "num_warps": 4, "num_stages": 4, "time_ms": 0.2978461545247298, "status": "ok"}
{"N": 65536, "K": 1024, "D": 256, "B": 1, "dtype": "fp16", "BLOCK_N": 32, "BLOCK_K": 32, "num_warps": 8, "num_stages": 1, "time_ms": 0.4168992042541504, "status": "ok"}
{"N": 65536, "K": 1024, "D": 256, "B": 1, "dtype": "fp16", "BLOCK_N": 32, "BLOCK_K": 32, "num_warps": 8, "num_stages": 2, "time_ms": 0.3613469113003124, "status": "ok"}
{"N": 65536, "K": 1024, "D": 256, "B": 1, "dtype": "fp16", "BLOCK_N": 32, "BLOCK_K": 32, "num_warps": 8, "num_stages": 4, "time_ms": 0.38168727538802405, "status": "ok"}
{"N": 65536, "K": 1024, "D": 256, "B": 1, "dtype": "fp16", "BLOCK_N": 32, "BLOCK_K": 64, "num_warps": 4, "num_stages": 1, "time_ms": 0.26266666650772097, "status": "ok"}
{"N": 65536, "K": 1024, "D": 256, "B": 1, "dtype": "fp16", "BLOCK_N": 32, "BLOCK_K": 64, "num_warps": 4, "num_stages": 2, "time_ms": 0.20711288849512735, "status": "ok"}
{"N": 65536, "K": 1024, "D": 256, "B": 1, "dtype": "fp16", "BLOCK_N": 32, "BLOCK_K": 64, "num_warps": 4, "num_stages": 4, "time_ms": 0.2486379984766245, "status": "ok"}
{"N": 65536, "K": 1024, "D": 256, "B": 1, "dtype": "fp16", "BLOCK_N": 32, "BLOCK_K": 64, "num_warps": 8, "num_stages": 1, "time_ms": 0.3104467667066134, "status": "ok"}
{"N": 65536, "K": 1024, "D": 256, "B": 1, "dtype": "fp16", "BLOCK_N": 32, "BLOCK_K": 64, "num_warps": 8, "num_stages": 2, "time_ms": 0.2453880002722144, "status": "ok"}
{"N": 65536, "K": 1024, "D": 256, "B": 1, "dtype": "fp16", "BLOCK_N": 32, "BLOCK_K": 64, "num_warps": 8, "num_stages": 4, "time_ms": 0.25756159822146096, "status": "ok"}
{"N": 65536, "K": 1024, "D": 256, "B": 1, "dtype": "fp16", "BLOCK_N": 32, "BLOCK_K": 128, "num_warps": 4, "num_stages": 1, "time_ms": 0.2412600014358759, "status": "ok"}
{"N": 65536, "K": 1024, "D": 256, "B": 1, "dtype": "fp16", "BLOCK_N": 32, "BLOCK_K": 128, "num_warps": 4, "num_stages": 2, "time_ms": 0.19336252620345667, "status": "ok"}
{"N": 65536, "K": 1024, "D": 256, "B": 1, "dtype": "fp16", "BLOCK_N": 32, "BLOCK_K": 128, "num_warps": 4, "num_stages": 4, "time_ms": 0.26615771438394276, "status": "ok"}
{"N": 65536, "K": 1024, "D": 256, "B": 1, "dtype": "fp16", "BLOCK_N": 32, "BLOCK_K": 128, "num_warps": 8, "num_stages": 1, "time_ms": 0.29117256828716825, "status": "ok"}
{"N": 65536, "K": 1024, "D": 256, "B": 1, "dtype": "fp16", "BLOCK_N": 32, "BLOCK_K": 128, "num_warps": 8, "num_stages": 2, "time_ms": 0.2270776471670936, "status": "ok"}
{"N": 65536, "K": 1024, "D": 256, "B": 1, "dtype": "fp16", "BLOCK_N": 32, "BLOCK_K": 128, "num_warps": 8, "num_stages": 4, "time_ms": 0.294210284948349, "status": "ok"}
{"N": 65536, "K": 1024, "D": 256, "B": 1, "dtype": "fp16", "BLOCK_N": 64, "BLOCK_K": 32, "num_warps": 4, "num_stages": 1, "time_ms": 0.13952533217767873, "status": "ok"}
{"N": 65536, "K": 1024, "D": 256, "B": 1, "dtype": "fp16", "BLOCK_N": 64, "BLOCK_K": 32, "num_warps": 4, "num_stages": 2, "time_ms": 0.13625215947628022, "status": "ok"}
{"N": 65536, "K": 1024, "D": 256, "B": 1, "dtype": "fp16", "BLOCK_N": 64, "BLOCK_K": 32, "num_warps": 4, "num_stages": 4, "time_ms": 0.12494400028999035, "status": "ok"}
{"N": 65536, "K": 1024, "D": 256, "B": 1, "dtype": "fp16", "BLOCK_N": 64, "BLOCK_K": 32, "num_warps": 8, "num_stages": 1, "time_ms": 0.21256177706850898, "status": "ok"}
{"N": 65536, "K": 1024, "D": 256, "B": 1, "dtype": "fp16", "BLOCK_N": 64, "BLOCK_K": 32, "num_warps": 8, "num_stages": 2, "time_ms": 0.18788160011172295, "status": "ok"}
{"N": 65536, "K": 1024, "D": 256, "B": 1, "dtype": "fp16", "BLOCK_N": 64, "BLOCK_K": 32, "num_warps": 8, "num_stages": 4, "time_ms": 0.1900639995932579, "status": "ok"}
{"N": 65536, "K": 1024, "D": 256, "B": 1, "dtype": "fp16", "BLOCK_N": 64, "BLOCK_K": 64, "num_warps": 4, "num_stages": 1, "time_ms": 0.1181451854882417, "status": "ok"}
{"N": 65536, "K": 1024, "D": 256, "B": 1, "dtype": "fp16", "BLOCK_N": 64, "BLOCK_K": 64, "num_warps": 4, "num_stages": 2, "time_ms": 0.11860799975693226, "status": "ok"}
{"N": 65536, "K": 1024, "D": 256, "B": 1, "dtype": "fp16", "BLOCK_N": 64, "BLOCK_K": 64, "num_warps": 4, "num_stages": 4, "time_ms": 0.1451839999012325, "status": "ok"}
{"N": 65536, "K": 1024, "D": 256, "B": 1, "dtype": "fp16", "BLOCK_N": 64, "BLOCK_K": 64, "num_warps": 8, "num_stages": 1, "time_ms": 0.16441745514219458, "status": "ok"}
{"N": 65536, "K": 1024, "D": 256, "B": 1, "dtype": "fp16", "BLOCK_N": 64, "BLOCK_K": 64, "num_warps": 8, "num_stages": 2, "time_ms": 0.15052104255427484, "status": "ok"}
{"N": 65536, "K": 1024, "D": 256, "B": 1, "dtype": "fp16", "BLOCK_N": 64, "BLOCK_K": 64, "num_warps": 8, "num_stages": 4, "time_ms": 0.17327695233481272, "status": "ok"}
{"N": 65536, "K": 1024, "D": 256, "B": 1, "dtype": "fp16", "BLOCK_N": 64, "BLOCK_K": 128, "num_warps": 4, "num_stages": 1, "time_ms": 0.10976882715677393, "status": "ok"}
{"N": 65536, "K": 1024, "D": 256, "B": 1, "dtype": "fp16", "BLOCK_N": 64, "BLOCK_K": 128, "num_warps": 4, "num_stages": 2, "time_ms": 0.13982800083855787, "status": "ok"}
{"N": 65536, "K": 1024, "D": 256, "B": 1, "dtype": "fp16", "BLOCK_N": 64, "BLOCK_K": 128, "num_warps": 4, "num_stages": 4, "status": "oor"}
{"N": 65536, "K": 1024, "D": 256, "B": 1, "dtype": "fp16", "BLOCK_N": 64, "BLOCK_K": 128, "num_warps": 8, "num_stages": 1, "time_ms": 0.1426799992720286, "status": "ok"}
{"N": 65536, "K": 1024, "D": 256, "B": 1, "dtype": "fp16", "BLOCK_N": 64, "BLOCK_K": 128, "num_warps": 8, "num_stages": 2, "time_ms": 0.15616834811542346, "status": "ok"}
{"N": 65536, "K": 1024, "D": 256, "B": 1, "dtype": "fp16", "BLOCK_N": 64, "BLOCK_K": 128, "num_warps": 8, "num_stages": 4, "status": "oor"}
{"N": 65536, "K": 1024, "D": 256, "B": 1, "dtype": "fp16", "BLOCK_N": 128, "BLOCK_K": 32, "num_warps": 4, "num_stages": 1, "time_ms": 0.13099263966083527, "status": "ok"}
{"N": 65536, "K": 1024, "D": 256, "B": 1, "dtype": "fp16", "BLOCK_N": 128, "BLOCK_K": 32, "num_warps": 4, "num_stages": 2, "time_ms": 0.12539076948395142, "status": "ok"}
{"N": 65536, "K": 1024, "D": 256, "B": 1, "dtype": "fp16", "BLOCK_N": 128, "BLOCK_K": 32, "num_warps": 4, "num_stages": 4, "time_ms": 0.13713279962539673, "status": "ok"}
{"N": 65536, "K": 1024, "D": 256, "B": 1, "dtype": "fp16", "BLOCK_N": 128, "BLOCK_K": 32, "num_warps": 8, "num_stages": 1, "time_ms": 0.12159876955243257, "status": "ok"}
{"N": 65536, "K": 1024, "D": 256, "B": 1, "dtype": "fp16", "BLOCK_N": 128, "BLOCK_K": 32, "num_warps": 8, "num_stages": 2, "time_ms": 0.12065777817258129, "status": "ok"}
{"N": 65536, "K": 1024, "D": 256, "B": 1, "dtype": "fp16", "BLOCK_N": 128, "BLOCK_K": 32, "num_warps": 8, "num_stages": 4, "time_ms": 0.12497353954957081, "status": "ok"}
{"N": 65536, "K": 1024, "D": 256, "B": 1, "dtype": "fp16", "BLOCK_N": 128, "BLOCK_K": 64, "num_warps": 4, "num_stages": 1, "time_ms": 0.10687668981223271, "status": "ok"}
{"N": 65536, "K": 1024, "D": 256, "B": 1, "dtype": "fp16", "BLOCK_N": 128, "BLOCK_K": 64, "num_warps": 4, "num_stages": 2, "time_ms": 0.13316735982894898, "status": "ok"}
{"N": 65536, "K": 1024, "D": 256, "B": 1, "dtype": "fp16", "BLOCK_N": 128, "BLOCK_K": 64, "num_warps": 4, "num_stages": 4, "time_ms": 0.11505257152020931, "status": "ok"}
{"N": 65536, "K": 1024, "D": 256, "B": 1, "dtype": "fp16", "BLOCK_N": 128, "BLOCK_K": 64, "num_warps": 8, "num_stages": 1, "time_ms": 0.10859696489983592, "status": "ok"}
{"N": 65536, "K": 1024, "D": 256, "B": 1, "dtype": "fp16", "BLOCK_N": 128, "BLOCK_K": 64, "num_warps": 8, "num_stages": 2, "time_ms": 0.12746584644684425, "status": "ok"}
{"N": 65536, "K": 1024, "D": 256, "B": 1, "dtype": "fp16", "BLOCK_N": 128, "BLOCK_K": 64, "num_warps": 8, "num_stages": 4, "time_ms": 0.10839944846671203, "status": "ok"}
{"N": 65536, "K": 1024, "D": 256, "B": 1, "dtype": "fp16", "BLOCK_N": 128, "BLOCK_K": 128, "num_warps": 4, "num_stages": 1, "time_ms": 0.1312934398651123, "status": "ok"}
{"N": 65536, "K": 1024, "D": 256, "B": 1, "dtype": "fp16", "BLOCK_N": 128, "BLOCK_K": 128, "num_warps": 4, "num_stages": 2, "time_ms": 0.12040296307316532, "status": "ok"}
{"N": 65536, "K": 1024, "D": 256, "B": 1, "dtype": "fp16", "BLOCK_N": 128, "BLOCK_K": 128, "num_warps": 4, "num_stages": 4, "status": "oor"}
{"N": 65536, "K": 1024, "D": 256, "B": 1, "dtype": "fp16", "BLOCK_N": 128, "BLOCK_K": 128, "num_warps": 8, "num_stages": 1, "time_ms": 0.12947071969509125, "status": "ok"}
{"N": 65536, "K": 1024, "D": 256, "B": 1, "dtype": "fp16", "BLOCK_N": 128, "BLOCK_K": 128, "num_warps": 8, "num_stages": 2, "time_ms": 0.1129445927562537, "status": "ok"}
{"N": 65536, "K": 1024, "D": 256, "B": 1, "dtype": "fp16", "BLOCK_N": 128, "BLOCK_K": 128, "num_warps": 8, "num_stages": 4, "status": "oor"}
{"summary": true, "N": 65536, "K": 1024, "D": 256, "B": 1, "dtype": "fp16", "best": {"N": 65536, "K": 1024, "D": 256, "B": 1, "dtype": "fp16", "BLOCK_N": 128, "BLOCK_K": 64, "num_warps": 4, "num_stages": 1, "time_ms": 0.10687668981223271, "status": "ok"}, "best_time_ms": 0.10687668981223271, "tuning_seconds": 14.351764440536499, "skipped": 4}
