grid_results_h200/N65536_K16384_D128_B32_fp16.jsonl
{"N": 65536, "K": 16384, "D": 128, "B": 32, "dtype": "fp16", "BLOCK_N": 32, "BLOCK_K": 32, "num_warps": 4, "num_stages": 1, "time_ms": 81.58930969238281, "status": "ok"}
{"N": 65536, "K": 16384, "D": 128, "B": 32, "dtype": "fp16", "BLOCK_N": 32, "BLOCK_K": 32, "num_warps": 4, "num_stages": 2, "time_ms": 66.40563201904297, "status": "ok"}
{"N": 65536, "K": 16384, "D": 128, "B": 32, "dtype": "fp16", "BLOCK_N": 32, "BLOCK_K": 32, "num_warps": 4, "num_stages": 4, "time_ms": 66.49849700927734, "status": "ok"}
{"N": 65536, "K": 16384, "D": 128, "B": 32, "dtype": "fp16", "BLOCK_N": 32, "BLOCK_K": 32, "num_warps": 8, "num_stages": 1, "time_ms": 120.9453125, "status": "ok"}
{"N": 65536, "K": 16384, "D": 128, "B": 32, "dtype": "fp16", "BLOCK_N": 32, "BLOCK_K": 32, "num_warps": 8, "num_stages": 2, "time_ms": 110.69862365722656, "status": "ok"}
{"N": 65536, "K": 16384, "D": 128, "B": 32, "dtype": "fp16", "BLOCK_N": 32, "BLOCK_K": 32, "num_warps": 8, "num_stages": 4, "time_ms": 108.99263763427734, "status": "ok"}
{"N": 65536, "K": 16384, "D": 128, "B": 32, "dtype": "fp16", "BLOCK_N": 32, "BLOCK_K": 64, "num_warps": 4, "num_stages": 1, "time_ms": 69.27731323242188, "status": "ok"}
{"N": 65536, "K": 16384, "D": 128, "B": 32, "dtype": "fp16", "BLOCK_N": 32, "BLOCK_K": 64, "num_warps": 4, "num_stages": 2, "time_ms": 53.928062438964844, "status": "ok"}
{"N": 65536, "K": 16384, "D": 128, "B": 32, "dtype": "fp16", "BLOCK_N": 32, "BLOCK_K": 64, "num_warps": 4, "num_stages": 4, "time_ms": 57.93318557739258, "status": "ok"}
{"N": 65536, "K": 16384, "D": 128, "B": 32, "dtype": "fp16", "BLOCK_N": 32, "BLOCK_K": 64, "num_warps": 8, "num_stages": 1, "time_ms": 83.05830383300781, "status": "ok"}
{"N": 65536, "K": 16384, "D": 128, "B": 32, "dtype": "fp16", "BLOCK_N": 32, "BLOCK_K": 64, "num_warps": 8, "num_stages": 2, "time_ms": 70.68169403076172, "status": "ok"}
{"N": 65536, "K": 16384, "D": 128, "B": 32, "dtype": "fp16", "BLOCK_N": 32, "BLOCK_K": 64, "num_warps": 8, "num_stages": 4, "time_ms": 70.69602966308594, "status": "ok"}
{"N": 65536, "K": 16384, "D": 128, "B": 32, "dtype": "fp16", "BLOCK_N": 32, "BLOCK_K": 128, "num_warps": 4, "num_stages": 1, "time_ms": 55.26780700683594, "status": "ok"}
{"N": 65536, "K": 16384, "D": 128, "B": 32, "dtype": "fp16", "BLOCK_N": 32, "BLOCK_K": 128, "num_warps": 4, "num_stages": 2, "time_ms": 43.182430267333984, "status": "ok"}
{"N": 65536, "K": 16384, "D": 128, "B": 32, "dtype": "fp16", "BLOCK_N": 32, "BLOCK_K": 128, "num_warps": 4, "num_stages": 4, "time_ms": 55.53696060180664, "status": "ok"}
{"N": 65536, "K": 16384, "D": 128, "B": 32, "dtype": "fp16", "BLOCK_N": 32, "BLOCK_K": 128, "num_warps": 8, "num_stages": 1, "time_ms": 75.9755859375, "status": "ok"}
{"N": 65536, "K": 16384, "D": 128, "B": 32, "dtype": "fp16", "BLOCK_N": 32, "BLOCK_K": 128, "num_warps": 8, "num_stages": 2, "time_ms": 64.61449432373047, "status": "ok"}
{"N": 65536, "K": 16384, "D": 128, "B": 32, "dtype": "fp16", "BLOCK_N": 32, "BLOCK_K": 128, "num_warps": 8, "num_stages": 4, "time_ms": 67.0713882446289, "status": "ok"}
{"N": 65536, "K": 16384, "D": 128, "B": 32, "dtype": "fp16", "BLOCK_N": 64, "BLOCK_K": 32, "num_warps": 4, "num_stages": 1, "time_ms": 32.81843185424805, "status": "ok"}
{"N": 65536, "K": 16384, "D": 128, "B": 32, "dtype": "fp16", "BLOCK_N": 64, "BLOCK_K": 32, "num_warps": 4, "num_stages": 2, "time_ms": 28.608352661132812, "status": "ok"}
{"N": 65536, "K": 16384, "D": 128, "B": 32, "dtype": "fp16", "BLOCK_N": 64, "BLOCK_K": 32, "num_warps": 4, "num_stages": 4, "time_ms": 29.468032836914062, "status": "ok"}
{"N": 65536, "K": 16384, "D": 128, "B": 32, "dtype": "fp16", "BLOCK_N": 64, "BLOCK_K": 32, "num_warps": 8, "num_stages": 1, "time_ms": 59.42144012451172, "status": "ok"}
{"N": 65536, "K": 16384, "D": 128, "B": 32, "dtype": "fp16", "BLOCK_N": 64, "BLOCK_K": 32, "num_warps": 8, "num_stages": 2, "time_ms": 51.35276794433594, "status": "ok"}
{"N": 65536, "K": 16384, "D": 128, "B": 32, "dtype": "fp16", "BLOCK_N": 64, "BLOCK_K": 32, "num_warps": 8, "num_stages": 4, "time_ms": 51.69676971435547, "status": "ok"}
{"N": 65536, "K": 16384, "D": 128, "B": 32, "dtype": "fp16", "BLOCK_N": 64, "BLOCK_K": 64, "num_warps": 4, "num_stages": 1, "time_ms": 28.072288513183594, "status": "ok"}
{"N": 65536, "K": 16384, "D": 128, "B": 32, "dtype": "fp16", "BLOCK_N": 64, "BLOCK_K": 64, "num_warps": 4, "num_stages": 2, "time_ms": 25.36288070678711, "status": "ok"}
{"N": 65536, "K": 16384, "D": 128, "B": 32, "dtype": "fp16", "BLOCK_N": 64, "BLOCK_K": 64, "num_warps": 4, "num_stages": 4, "time_ms": 26.476255416870117, "status": "ok"}
{"N": 65536, "K": 16384, "D": 128, "B": 32, "dtype": "fp16", "BLOCK_N": 64, "BLOCK_K": 64, "num_warps": 8, "num_stages": 1, "time_ms": 41.53532791137695, "status": "ok"}
{"N": 65536, "K": 16384, "D": 128, "B": 32, "dtype": "fp16", "BLOCK_N": 64, "BLOCK_K": 64, "num_warps": 8, "num_stages": 2, "time_ms": 35.86579132080078, "status": "ok"}
{"N": 65536, "K": 16384, "D": 128, "B": 32, "dtype": "fp16", "BLOCK_N": 64, "BLOCK_K": 64, "num_warps": 8, "num_stages": 4, "time_ms": 41.15516662597656, "status": "ok"}
{"N": 65536, "K": 16384, "D": 128, "B": 32, "dtype": "fp16", "BLOCK_N": 64, "BLOCK_K": 128, "num_warps": 4, "num_stages": 1, "time_ms": 26.12019157409668, "status": "ok"}
{"N": 65536, "K": 16384, "D": 128, "B": 32, "dtype": "fp16", "BLOCK_N": 64, "BLOCK_K": 128, "num_warps": 4, "num_stages": 2, "time_ms": 25.42083168029785, "status": "ok"}
{"N": 65536, "K": 16384, "D": 128, "B": 32, "dtype": "fp16", "BLOCK_N": 64, "BLOCK_K": 128, "num_warps": 4, "num_stages": 4, "time_ms": 31.835264205932617, "status": "ok"}
{"N": 65536, "K": 16384, "D": 128, "B": 32, "dtype": "fp16", "BLOCK_N": 64, "BLOCK_K": 128, "num_warps": 8, "num_stages": 1, "time_ms": 39.3770866394043, "status": "ok"}
{"N": 65536, "K": 16384, "D": 128, "B": 32, "dtype": "fp16", "BLOCK_N": 64, "BLOCK_K": 128, "num_warps": 8, "num_stages": 2, "time_ms": 33.16476821899414, "status": "ok"}
{"N": 65536, "K": 16384, "D": 128, "B": 32, "dtype": "fp16", "BLOCK_N": 64, "BLOCK_K": 128, "num_warps": 8, "num_stages": 4, "time_ms": 38.33417510986328, "status": "ok"}
{"N": 65536, "K": 16384, "D": 128, "B": 32, "dtype": "fp16", "BLOCK_N": 128, "BLOCK_K": 32, "num_warps": 4, "num_stages": 1, "time_ms": 27.711423873901367, "status": "ok"}
{"N": 65536, "K": 16384, "D": 128, "B": 32, "dtype": "fp16", "BLOCK_N": 128, "BLOCK_K": 32, "num_warps": 4, "num_stages": 2, "time_ms": 27.786176681518555, "status": "ok"}
{"N": 65536, "K": 16384, "D": 128, "B": 32, "dtype": "fp16", "BLOCK_N": 128, "BLOCK_K": 32, "num_warps": 4, "num_stages": 4, "time_ms": 29.689376831054688, "status": "ok"}
{"N": 65536, "K": 16384, "D": 128, "B": 32, "dtype": "fp16", "BLOCK_N": 128, "BLOCK_K": 32, "num_warps": 8, "num_stages": 1, "time_ms": 28.99456024169922, "status": "ok"}
{"N": 65536, "K": 16384, "D": 128, "B": 32, "dtype": "fp16", "BLOCK_N": 128, "BLOCK_K": 32, "num_warps": 8, "num_stages": 2, "time_ms": 28.027551651000977, "status": "ok"}
{"N": 65536, "K": 16384, "D": 128, "B": 32, "dtype": "fp16", "BLOCK_N": 128, "BLOCK_K": 32, "num_warps": 8, "num_stages": 4, "time_ms": 28.713760375976562, "status": "ok"}
{"N": 65536, "K": 16384, "D": 128, "B": 32, "dtype": "fp16", "BLOCK_N": 128, "BLOCK_K": 64, "num_warps": 4, "num_stages": 1, "time_ms": 24.916608810424805, "status": "ok"}
{"N": 65536, "K": 16384, "D": 128, "B": 32, "dtype": "fp16", "BLOCK_N": 128, "BLOCK_K": 64, "num_warps": 4, "num_stages": 2, "time_ms": 24.963520050048828, "status": "ok"}
{"N": 65536, "K": 16384, "D": 128, "B": 32, "dtype": "fp16", "BLOCK_N": 128, "BLOCK_K": 64, "num_warps": 4, "num_stages": 4, "time_ms": 24.724000930786133, "status": "ok"}
{"N": 65536, "K": 16384, "D": 128, "B": 32, "dtype": "fp16", "BLOCK_N": 128, "BLOCK_K": 64, "num_warps": 8, "num_stages": 1, "time_ms": 25.632736206054688, "status": "ok"}
{"N": 65536, "K": 16384, "D": 128, "B": 32, "dtype": "fp16", "BLOCK_N": 128, "BLOCK_K": 64, "num_warps": 8, "num_stages": 2, "time_ms": 25.231199264526367, "status": "ok"}
{"N": 65536, "K": 16384, "D": 128, "B": 32, "dtype": "fp16", "BLOCK_N": 128, "BLOCK_K": 64, "num_warps": 8, "num_stages": 4, "time_ms": 25.016639709472656, "status": "ok"}
{"N": 65536, "K": 16384, "D": 128, "B": 32, "dtype": "fp16", "BLOCK_N": 128, "BLOCK_K": 128, "num_warps": 4, "num_stages": 1, "time_ms": 24.71001625061035, "status": "ok"}
{"N": 65536, "K": 16384, "D": 128, "B": 32, "dtype": "fp16", "BLOCK_N": 128, "BLOCK_K": 128, "num_warps": 4, "num_stages": 2, "time_ms": 23.451936721801758, "status": "ok"}
{"N": 65536, "K": 16384, "D": 128, "B": 32, "dtype": "fp16", "BLOCK_N": 128, "BLOCK_K": 128, "num_warps": 4, "num_stages": 4, "time_ms": 27.670495986938477, "status": "ok"}
{"N": 65536, "K": 16384, "D": 128, "B": 32, "dtype": "fp16", "BLOCK_N": 128, "BLOCK_K": 128, "num_warps": 8, "num_stages": 1, "time_ms": 35.39430236816406, "status": "ok"}
{"N": 65536, "K": 16384, "D": 128, "B": 32, "dtype": "fp16", "BLOCK_N": 128, "BLOCK_K": 128, "num_warps": 8, "num_stages": 2, "time_ms": 23.217567443847656, "status": "ok"}
{"N": 65536, "K": 16384, "D": 128, "B": 32, "dtype": "fp16", "BLOCK_N": 128, "BLOCK_K": 128, "num_warps": 8, "num_stages": 4, "time_ms": 26.20694351196289, "status": "ok"}
{"summary": true, "N": 65536, "K": 16384, "D": 128, "B": 32, "dtype": "fp16", "best": {"N": 65536, "K": 16384, "D": 128, "B": 32, "dtype": "fp16", "BLOCK_N": 128, "BLOCK_K": 128, "num_warps": 8, "num_stages": 2, "time_ms": 23.217567443847656, "status": "ok"}, "best_time_ms": 23.217567443847656, "tuning_seconds": 30.227925777435303, "skipped": 0}
