grid_results_gb10/N1048576_K1024_D64_B32_fp16.jsonl
{"N": 1048576, "K": 1024, "D": 64, "B": 32, "dtype": "fp16", "BLOCK_N": 32, "BLOCK_K": 32, "num_warps": 4, "num_stages": 1, "time_ms": 140.793701171875, "status": "ok"}
{"N": 1048576, "K": 1024, "D": 64, "B": 32, "dtype": "fp16", "BLOCK_N": 32, "BLOCK_K": 32, "num_warps": 4, "num_stages": 2, "time_ms": 136.87501525878906, "status": "ok"}
{"N": 1048576, "K": 1024, "D": 64, "B": 32, "dtype": "fp16", "BLOCK_N": 32, "BLOCK_K": 32, "num_warps": 4, "num_stages": 4, "time_ms": 137.81698608398438, "status": "ok"}
{"N": 1048576, "K": 1024, "D": 64, "B": 32, "dtype": "fp16", "BLOCK_N": 32, "BLOCK_K": 32, "num_warps": 8, "num_stages": 1, "time_ms": 233.57113647460938, "status": "ok"}
{"N": 1048576, "K": 1024, "D": 64, "B": 32, "dtype": "fp16", "BLOCK_N": 32, "BLOCK_K": 32, "num_warps": 8, "num_stages": 2, "time_ms": 237.34678649902344, "status": "ok"}
{"N": 1048576, "K": 1024, "D": 64, "B": 32, "dtype": "fp16", "BLOCK_N": 32, "BLOCK_K": 32, "num_warps": 8, "num_stages": 4, "time_ms": 240.07168579101562, "status": "ok"}
{"N": 1048576, "K": 1024, "D": 64, "B": 32, "dtype": "fp16", "BLOCK_N": 32, "BLOCK_K": 64, "num_warps": 4, "num_stages": 1, "time_ms": 130.49542236328125, "status": "ok"}
{"N": 1048576, "K": 1024, "D": 64, "B": 32, "dtype": "fp16", "BLOCK_N": 32, "BLOCK_K": 64, "num_warps": 4, "num_stages": 2, "time_ms": 122.37741088867188, "status": "ok"}
{"N": 1048576, "K": 1024, "D": 64, "B": 32, "dtype": "fp16", "BLOCK_N": 32, "BLOCK_K": 64, "num_warps": 4, "num_stages": 4, "time_ms": 127.90278625488281, "status": "ok"}
{"N": 1048576, "K": 1024, "D": 64, "B": 32, "dtype": "fp16", "BLOCK_N": 32, "BLOCK_K": 64, "num_warps": 8, "num_stages": 1, "time_ms": 154.63014221191406, "status": "ok"}
{"N": 1048576, "K": 1024, "D": 64, "B": 32, "dtype": "fp16", "BLOCK_N": 32, "BLOCK_K": 64, "num_warps": 8, "num_stages": 2, "time_ms": 145.84115600585938, "status": "ok"}
{"N": 1048576, "K": 1024, "D": 64, "B": 32, "dtype": "fp16", "BLOCK_N": 32, "BLOCK_K": 64, "num_warps": 8, "num_stages": 4, "time_ms": 149.9658203125, "status": "ok"}
{"N": 1048576, "K": 1024, "D": 64, "B": 32, "dtype": "fp16", "BLOCK_N": 32, "BLOCK_K": 128, "num_warps": 4, "num_stages": 1, "time_ms": 109.68169403076172, "status": "ok"}
{"N": 1048576, "K": 1024, "D": 64, "B": 32, "dtype": "fp16", "BLOCK_N": 32, "BLOCK_K": 128, "num_warps": 4, "num_stages": 2, "time_ms": 105.4249267578125, "status": "ok"}
{"N": 1048576, "K": 1024, "D": 64, "B": 32, "dtype": "fp16", "BLOCK_N": 32, "BLOCK_K": 128, "num_warps": 4, "num_stages": 4, "time_ms": 179.27474975585938, "status": "ok"}
{"N": 1048576, "K": 1024, "D": 64, "B": 32, "dtype": "fp16", "BLOCK_N": 32, "BLOCK_K": 128, "num_warps": 8, "num_stages": 1, "time_ms": 141.98886108398438, "status": "ok"}
{"N": 1048576, "K": 1024, "D": 64, "B": 32, "dtype": "fp16", "BLOCK_N": 32, "BLOCK_K": 128, "num_warps": 8, "num_stages": 2, "time_ms": 134.53004455566406, "status": "ok"}
{"N": 1048576, "K": 1024, "D": 64, "B": 32, "dtype": "fp16", "BLOCK_N": 32, "BLOCK_K": 128, "num_warps": 8, "num_stages": 4, "time_ms": 185.2241973876953, "status": "ok"}
{"N": 1048576, "K": 1024, "D": 64, "B": 32, "dtype": "fp16", "BLOCK_N": 64, "BLOCK_K": 32, "num_warps": 4, "num_stages": 1, "time_ms": 112.60521697998047, "status": "ok"}
{"N": 1048576, "K": 1024, "D": 64, "B": 32, "dtype": "fp16", "BLOCK_N": 64, "BLOCK_K": 32, "num_warps": 4, "num_stages": 2, "time_ms": 106.98857879638672, "status": "ok"}
{"N": 1048576, "K": 1024, "D": 64, "B": 32, "dtype": "fp16", "BLOCK_N": 64, "BLOCK_K": 32, "num_warps": 4, "num_stages": 4, "time_ms": 110.28787231445312, "status": "ok"}
{"N": 1048576, "K": 1024, "D": 64, "B": 32, "dtype": "fp16", "BLOCK_N": 64, "BLOCK_K": 32, "num_warps": 8, "num_stages": 1, "time_ms": 127.98889923095703, "status": "ok"}
{"N": 1048576, "K": 1024, "D": 64, "B": 32, "dtype": "fp16", "BLOCK_N": 64, "BLOCK_K": 32, "num_warps": 8, "num_stages": 2, "time_ms": 131.73861694335938, "status": "ok"}
{"N": 1048576, "K": 1024, "D": 64, "B": 32, "dtype": "fp16", "BLOCK_N": 64, "BLOCK_K": 32, "num_warps": 8, "num_stages": 4, "time_ms": 131.8082275390625, "status": "ok"}
{"N": 1048576, "K": 1024, "D": 64, "B": 32, "dtype": "fp16", "BLOCK_N": 64, "BLOCK_K": 64, "num_warps": 4, "num_stages": 1, "time_ms": 83.09913635253906, "status": "ok"}
{"N": 1048576, "K": 1024, "D": 64, "B": 32, "dtype": "fp16", "BLOCK_N": 64, "BLOCK_K": 64, "num_warps": 4, "num_stages": 2, "time_ms": 80.74137878417969, "status": "ok"}
{"N": 1048576, "K": 1024, "D": 64, "B": 32, "dtype": "fp16", "BLOCK_N": 64, "BLOCK_K": 64, "num_warps": 4, "num_stages": 4, "time_ms": 94.05439758300781, "status": "ok"}
{"N": 1048576, "K": 1024, "D": 64, "B": 32, "dtype": "fp16", "BLOCK_N": 64, "BLOCK_K": 64, "num_warps": 8, "num_stages": 1, "time_ms": 122.05773162841797, "status": "ok"}
{"N": 1048576, "K": 1024, "D": 64, "B": 32, "dtype": "fp16", "BLOCK_N": 64, "BLOCK_K": 64, "num_warps": 8, "num_stages": 2, "time_ms": 116.10419464111328, "status": "ok"}
{"N": 1048576, "K": 1024, "D": 64, "B": 32, "dtype": "fp16", "BLOCK_N": 64, "BLOCK_K": 64, "num_warps": 8, "num_stages": 4, "time_ms": 122.3353271484375, "status": "ok"}
{"N": 1048576, "K": 1024, "D": 64, "B": 32, "dtype": "fp16", "BLOCK_N": 64, "BLOCK_K": 128, "num_warps": 4, "num_stages": 1, "time_ms": 89.87548828125, "status": "ok"}
{"N": 1048576, "K": 1024, "D": 64, "B": 32, "dtype": "fp16", "BLOCK_N": 64, "BLOCK_K": 128, "num_warps": 4, "num_stages": 2, "time_ms": 89.39830780029297, "status": "ok"}
{"N": 1048576, "K": 1024, "D": 64, "B": 32, "dtype": "fp16", "BLOCK_N": 64, "BLOCK_K": 128, "num_warps": 4, "num_stages": 4, "time_ms": 144.9451446533203, "status": "ok"}
{"N": 1048576, "K": 1024, "D": 64, "B": 32, "dtype": "fp16", "BLOCK_N": 64, "BLOCK_K": 128, "num_warps": 8, "num_stages": 1, "time_ms": 95.37741088867188, "status": "ok"}
{"N": 1048576, "K": 1024, "D": 64, "B": 32, "dtype": "fp16", "BLOCK_N": 64, "BLOCK_K": 128, "num_warps": 8, "num_stages": 2, "time_ms": 90.62809753417969, "status": "ok"}
{"N": 1048576, "K": 1024, "D": 64, "B": 32, "dtype": "fp16", "BLOCK_N": 64, "BLOCK_K": 128, "num_warps": 8, "num_stages": 4, "time_ms": 115.2174072265625, "status": "ok"}
{"N": 1048576, "K": 1024, "D": 64, "B": 32, "dtype": "fp16", "BLOCK_N": 128, "BLOCK_K": 32, "num_warps": 4, "num_stages": 1, "time_ms": 65.3037109375, "status": "ok"}
{"N": 1048576, "K": 1024, "D": 64, "B": 32, "dtype": "fp16", "BLOCK_N": 128, "BLOCK_K": 32, "num_warps": 4, "num_stages": 2, "time_ms": 65.15817260742188, "status": "ok"}
{"N": 1048576, "K": 1024, "D": 64, "B": 32, "dtype": "fp16", "BLOCK_N": 128, "BLOCK_K": 32, "num_warps": 4, "num_stages": 4, "time_ms": 67.99871826171875, "status": "ok"}
{"N": 1048576, "K": 1024, "D": 64, "B": 32, "dtype": "fp16", "BLOCK_N": 128, "BLOCK_K": 32, "num_warps": 8, "num_stages": 1, "time_ms": 108.10470581054688, "status": "ok"}
{"N": 1048576, "K": 1024, "D": 64, "B": 32, "dtype": "fp16", "BLOCK_N": 128, "BLOCK_K": 32, "num_warps": 8, "num_stages": 2, "time_ms": 108.96896362304688, "status": "ok"}
{"N": 1048576, "K": 1024, "D": 64, "B": 32, "dtype": "fp16", "BLOCK_N": 128, "BLOCK_K": 32, "num_warps": 8, "num_stages": 4, "time_ms": 108.89024353027344, "status": "ok"}
{"N": 1048576, "K": 1024, "D": 64, "B": 32, "dtype": "fp16", "BLOCK_N": 128, "BLOCK_K": 64, "num_warps": 4, "num_stages": 1, "time_ms": 80.55014038085938, "status": "ok"}
{"N": 1048576, "K": 1024, "D": 64, "B": 32, "dtype": "fp16", "BLOCK_N": 128, "BLOCK_K": 64, "num_warps": 4, "num_stages": 2, "time_ms": 74.21647644042969, "status": "ok"}
{"N": 1048576, "K": 1024, "D": 64, "B": 32, "dtype": "fp16", "BLOCK_N": 128, "BLOCK_K": 64, "num_warps": 4, "num_stages": 4, "time_ms": 78.2581787109375, "status": "ok"}
{"N": 1048576, "K": 1024, "D": 64, "B": 32, "dtype": "fp16", "BLOCK_N": 128, "BLOCK_K": 64, "num_warps": 8, "num_stages": 1, "time_ms": 86.59852600097656, "status": "ok"}
{"N": 1048576, "K": 1024, "D": 64, "B": 32, "dtype": "fp16", "BLOCK_N": 128, "BLOCK_K": 64, "num_warps": 8, "num_stages": 2, "time_ms": 83.9444808959961, "status": "ok"}
{"N": 1048576, "K": 1024, "D": 64, "B": 32, "dtype": "fp16", "BLOCK_N": 128, "BLOCK_K": 64, "num_warps": 8, "num_stages": 4, "time_ms": 82.31116485595703, "status": "ok"}
{"N": 1048576, "K": 1024, "D": 64, "B": 32, "dtype": "fp16", "BLOCK_N": 128, "BLOCK_K": 128, "num_warps": 4, "num_stages": 1, "time_ms": 77.74105834960938, "status": "ok"}
{"N": 1048576, "K": 1024, "D": 64, "B": 32, "dtype": "fp16", "BLOCK_N": 128, "BLOCK_K": 128, "num_warps": 4, "num_stages": 2, "time_ms": 75.07762908935547, "status": "ok"}
{"N": 1048576, "K": 1024, "D": 64, "B": 32, "dtype": "fp16", "BLOCK_N": 128, "BLOCK_K": 128, "num_warps": 4, "num_stages": 4, "time_ms": 100.19737243652344, "status": "ok"}
{"N": 1048576, "K": 1024, "D": 64, "B": 32, "dtype": "fp16", "BLOCK_N": 128, "BLOCK_K": 128, "num_warps": 8, "num_stages": 1, "time_ms": 108.4405746459961, "status": "ok"}
{"N": 1048576, "K": 1024, "D": 64, "B": 32, "dtype": "fp16", "BLOCK_N": 128, "BLOCK_K": 128, "num_warps": 8, "num_stages": 2, "time_ms": 112.06143951416016, "status": "ok"}
{"N": 1048576, "K": 1024, "D": 64, "B": 32, "dtype": "fp16", "BLOCK_N": 128, "BLOCK_K": 128, "num_warps": 8, "num_stages": 4, "time_ms": 105.28761291503906, "status": "ok"}
{"summary": true, "N": 1048576, "K": 1024, "D": 64, "B": 32, "dtype": "fp16", "best": {"N": 1048576, "K": 1024, "D": 64, "B": 32, "dtype": "fp16", "BLOCK_N": 128, "BLOCK_K": 32, "num_warps": 4, "num_stages": 2, "time_ms": 65.15817260742188, "status": "ok"}, "best_time_ms": 65.15817260742188, "tuning_seconds": 58.75759196281433, "skipped": 0}
