grid_results_gb10/N1048576_K16384_D64_B1_fp16.jsonl
{"N": 1048576, "K": 16384, "D": 64, "B": 1, "dtype": "fp16", "BLOCK_N": 32, "BLOCK_K": 32, "num_warps": 4, "num_stages": 1, "time_ms": 68.59164428710938, "status": "ok"}
{"N": 1048576, "K": 16384, "D": 64, "B": 1, "dtype": "fp16", "BLOCK_N": 32, "BLOCK_K": 32, "num_warps": 4, "num_stages": 2, "time_ms": 65.95481872558594, "status": "ok"}
{"N": 1048576, "K": 16384, "D": 64, "B": 1, "dtype": "fp16", "BLOCK_N": 32, "BLOCK_K": 32, "num_warps": 4, "num_stages": 4, "time_ms": 66.88460540771484, "status": "ok"}
{"N": 1048576, "K": 16384, "D": 64, "B": 1, "dtype": "fp16", "BLOCK_N": 32, "BLOCK_K": 32, "num_warps": 8, "num_stages": 1, "time_ms": 113.69462585449219, "status": "ok"}
{"N": 1048576, "K": 16384, "D": 64, "B": 1, "dtype": "fp16", "BLOCK_N": 32, "BLOCK_K": 32, "num_warps": 8, "num_stages": 2, "time_ms": 115.40160369873047, "status": "ok"}
{"N": 1048576, "K": 16384, "D": 64, "B": 1, "dtype": "fp16", "BLOCK_N": 32, "BLOCK_K": 32, "num_warps": 8, "num_stages": 4, "time_ms": 115.89740753173828, "status": "ok"}
{"N": 1048576, "K": 16384, "D": 64, "B": 1, "dtype": "fp16", "BLOCK_N": 32, "BLOCK_K": 64, "num_warps": 4, "num_stages": 1, "time_ms": 61.94073486328125, "status": "ok"}
{"N": 1048576, "K": 16384, "D": 64, "B": 1, "dtype": "fp16", "BLOCK_N": 32, "BLOCK_K": 64, "num_warps": 4, "num_stages": 2, "time_ms": 57.31020736694336, "status": "ok"}
{"N": 1048576, "K": 16384, "D": 64, "B": 1, "dtype": "fp16", "BLOCK_N": 32, "BLOCK_K": 64, "num_warps": 4, "num_stages": 4, "time_ms": 61.28947067260742, "status": "ok"}
{"N": 1048576, "K": 16384, "D": 64, "B": 1, "dtype": "fp16", "BLOCK_N": 32, "BLOCK_K": 64, "num_warps": 8, "num_stages": 1, "time_ms": 75.87648010253906, "status": "ok"}
{"N": 1048576, "K": 16384, "D": 64, "B": 1, "dtype": "fp16", "BLOCK_N": 32, "BLOCK_K": 64, "num_warps": 8, "num_stages": 2, "time_ms": 70.23206329345703, "status": "ok"}
{"N": 1048576, "K": 16384, "D": 64, "B": 1, "dtype": "fp16", "BLOCK_N": 32, "BLOCK_K": 64, "num_warps": 8, "num_stages": 4, "time_ms": 70.9754867553711, "status": "ok"}
{"N": 1048576, "K": 16384, "D": 64, "B": 1, "dtype": "fp16", "BLOCK_N": 32, "BLOCK_K": 128, "num_warps": 4, "num_stages": 1, "time_ms": 51.975135803222656, "status": "ok"}
{"N": 1048576, "K": 16384, "D": 64, "B": 1, "dtype": "fp16", "BLOCK_N": 32, "BLOCK_K": 128, "num_warps": 4, "num_stages": 2, "time_ms": 52.89164733886719, "status": "ok"}
{"N": 1048576, "K": 16384, "D": 64, "B": 1, "dtype": "fp16", "BLOCK_N": 32, "BLOCK_K": 128, "num_warps": 4, "num_stages": 4, "time_ms": 85.12614440917969, "status": "ok"}
{"N": 1048576, "K": 16384, "D": 64, "B": 1, "dtype": "fp16", "BLOCK_N": 32, "BLOCK_K": 128, "num_warps": 8, "num_stages": 1, "time_ms": 68.17391967773438, "status": "ok"}
{"N": 1048576, "K": 16384, "D": 64, "B": 1, "dtype": "fp16", "BLOCK_N": 32, "BLOCK_K": 128, "num_warps": 8, "num_stages": 2, "time_ms": 64.48844909667969, "status": "ok"}
{"N": 1048576, "K": 16384, "D": 64, "B": 1, "dtype": "fp16", "BLOCK_N": 32, "BLOCK_K": 128, "num_warps": 8, "num_stages": 4, "time_ms": 88.66508483886719, "status": "ok"}
{"N": 1048576, "K": 16384, "D": 64, "B": 1, "dtype": "fp16", "BLOCK_N": 64, "BLOCK_K": 32, "num_warps": 4, "num_stages": 1, "time_ms": 53.566368103027344, "status": "ok"}
{"N": 1048576, "K": 16384, "D": 64, "B": 1, "dtype": "fp16", "BLOCK_N": 64, "BLOCK_K": 32, "num_warps": 4, "num_stages": 2, "time_ms": 51.60140609741211, "status": "ok"}
{"N": 1048576, "K": 16384, "D": 64, "B": 1, "dtype": "fp16", "BLOCK_N": 64, "BLOCK_K": 32, "num_warps": 4, "num_stages": 4, "time_ms": 54.12044906616211, "status": "ok"}
{"N": 1048576, "K": 16384, "D": 64, "B": 1, "dtype": "fp16", "BLOCK_N": 64, "BLOCK_K": 32, "num_warps": 8, "num_stages": 1, "time_ms": 62.19673538208008, "status": "ok"}
{"N": 1048576, "K": 16384, "D": 64, "B": 1, "dtype": "fp16", "BLOCK_N": 64, "BLOCK_K": 32, "num_warps": 8, "num_stages": 2, "time_ms": 63.92931365966797, "status": "ok"}
{"N": 1048576, "K": 16384, "D": 64, "B": 1, "dtype": "fp16", "BLOCK_N": 64, "BLOCK_K": 32, "num_warps": 8, "num_stages": 4, "time_ms": 64.03072357177734, "status": "ok"}
{"N": 1048576, "K": 16384, "D": 64, "B": 1, "dtype": "fp16", "BLOCK_N": 64, "BLOCK_K": 64, "num_warps": 4, "num_stages": 1, "time_ms": 40.050689697265625, "status": "ok"}
{"N": 1048576, "K": 16384, "D": 64, "B": 1, "dtype": "fp16", "BLOCK_N": 64, "BLOCK_K": 64, "num_warps": 4, "num_stages": 2, "time_ms": 40.77734375, "status": "ok"}
{"N": 1048576, "K": 16384, "D": 64, "B": 1, "dtype": "fp16", "BLOCK_N": 64, "BLOCK_K": 64, "num_warps": 4, "num_stages": 4, "time_ms": 41.5015983581543, "status": "ok"}
{"N": 1048576, "K": 16384, "D": 64, "B": 1, "dtype": "fp16", "BLOCK_N": 64, "BLOCK_K": 64, "num_warps": 8, "num_stages": 1, "time_ms": 59.40739059448242, "status": "ok"}
{"N": 1048576, "K": 16384, "D": 64, "B": 1, "dtype": "fp16", "BLOCK_N": 64, "BLOCK_K": 64, "num_warps": 8, "num_stages": 2, "time_ms": 56.01484680175781, "status": "ok"}
{"N": 1048576, "K": 16384, "D": 64, "B": 1, "dtype": "fp16", "BLOCK_N": 64, "BLOCK_K": 64, "num_warps": 8, "num_stages": 4, "time_ms": 58.37833786010742, "status": "ok"}
{"N": 1048576, "K": 16384, "D": 64, "B": 1, "dtype": "fp16", "BLOCK_N": 64, "BLOCK_K": 128, "num_warps": 4, "num_stages": 1, "time_ms": 42.222591400146484, "status": "ok"}
{"N": 1048576, "K": 16384, "D": 64, "B": 1, "dtype": "fp16", "BLOCK_N": 64, "BLOCK_K": 128, "num_warps": 4, "num_stages": 2, "time_ms": 40.48793411254883, "status": "ok"}
{"N": 1048576, "K": 16384, "D": 64, "B": 1, "dtype": "fp16", "BLOCK_N": 64, "BLOCK_K": 128, "num_warps": 4, "num_stages": 4, "time_ms": 65.65363311767578, "status": "ok"}
{"N": 1048576, "K": 16384, "D": 64, "B": 1, "dtype": "fp16", "BLOCK_N": 64, "BLOCK_K": 128, "num_warps": 8, "num_stages": 1, "time_ms": 45.30278396606445, "status": "ok"}
{"N": 1048576, "K": 16384, "D": 64, "B": 1, "dtype": "fp16", "BLOCK_N": 64, "BLOCK_K": 128, "num_warps": 8, "num_stages": 2, "time_ms": 42.895294189453125, "status": "ok"}
{"N": 1048576, "K": 16384, "D": 64, "B": 1, "dtype": "fp16", "BLOCK_N": 64, "BLOCK_K": 128, "num_warps": 8, "num_stages": 4, "time_ms": 51.66691207885742, "status": "ok"}
{"N": 1048576, "K": 16384, "D": 64, "B": 1, "dtype": "fp16", "BLOCK_N": 128, "BLOCK_K": 32, "num_warps": 4, "num_stages": 1, "time_ms": 31.912832260131836, "status": "ok"}
{"N": 1048576, "K": 16384, "D": 64, "B": 1, "dtype": "fp16", "BLOCK_N": 128, "BLOCK_K": 32, "num_warps": 4, "num_stages": 2, "time_ms": 31.753215789794922, "status": "ok"}
{"N": 1048576, "K": 16384, "D": 64, "B": 1, "dtype": "fp16", "BLOCK_N": 128, "BLOCK_K": 32, "num_warps": 4, "num_stages": 4, "time_ms": 33.001502990722656, "status": "ok"}
{"N": 1048576, "K": 16384, "D": 64, "B": 1, "dtype": "fp16", "BLOCK_N": 128, "BLOCK_K": 32, "num_warps": 8, "num_stages": 1, "time_ms": 53.41798400878906, "status": "ok"}
{"N": 1048576, "K": 16384, "D": 64, "B": 1, "dtype": "fp16", "BLOCK_N": 128, "BLOCK_K": 32, "num_warps": 8, "num_stages": 2, "time_ms": 53.919742584228516, "status": "ok"}
{"N": 1048576, "K": 16384, "D": 64, "B": 1, "dtype": "fp16", "BLOCK_N": 128, "BLOCK_K": 32, "num_warps": 8, "num_stages": 4, "time_ms": 53.40671920776367, "status": "ok"}
{"N": 1048576, "K": 16384, "D": 64, "B": 1, "dtype": "fp16", "BLOCK_N": 128, "BLOCK_K": 64, "num_warps": 4, "num_stages": 1, "time_ms": 37.459999084472656, "status": "ok"}
{"N": 1048576, "K": 16384, "D": 64, "B": 1, "dtype": "fp16", "BLOCK_N": 128, "BLOCK_K": 64, "num_warps": 4, "num_stages": 2, "time_ms": 35.62393569946289, "status": "ok"}
{"N": 1048576, "K": 16384, "D": 64, "B": 1, "dtype": "fp16", "BLOCK_N": 128, "BLOCK_K": 64, "num_warps": 4, "num_stages": 4, "time_ms": 36.27318572998047, "status": "ok"}
{"N": 1048576, "K": 16384, "D": 64, "B": 1, "dtype": "fp16", "BLOCK_N": 128, "BLOCK_K": 64, "num_warps": 8, "num_stages": 1, "time_ms": 41.68092727661133, "status": "ok"}
{"N": 1048576, "K": 16384, "D": 64, "B": 1, "dtype": "fp16", "BLOCK_N": 128, "BLOCK_K": 64, "num_warps": 8, "num_stages": 2, "time_ms": 40.70403289794922, "status": "ok"}
{"N": 1048576, "K": 16384, "D": 64, "B": 1, "dtype": "fp16", "BLOCK_N": 128, "BLOCK_K": 64, "num_warps": 8, "num_stages": 4, "time_ms": 39.206912994384766, "status": "ok"}
{"N": 1048576, "K": 16384, "D": 64, "B": 1, "dtype": "fp16", "BLOCK_N": 128, "BLOCK_K": 128, "num_warps": 4, "num_stages": 1, "time_ms": 35.4334716796875, "status": "ok"}
{"N": 1048576, "K": 16384, "D": 64, "B": 1, "dtype": "fp16", "BLOCK_N": 128, "BLOCK_K": 128, "num_warps": 4, "num_stages": 2, "time_ms": 36.47792053222656, "status": "ok"}
{"N": 1048576, "K": 16384, "D": 64, "B": 1, "dtype": "fp16", "BLOCK_N": 128, "BLOCK_K": 128, "num_warps": 4, "num_stages": 4, "time_ms": 46.867454528808594, "status": "ok"}
{"N": 1048576, "K": 16384, "D": 64, "B": 1, "dtype": "fp16", "BLOCK_N": 128, "BLOCK_K": 128, "num_warps": 8, "num_stages": 1, "time_ms": 52.764671325683594, "status": "ok"}
{"N": 1048576, "K": 16384, "D": 64, "B": 1, "dtype": "fp16", "BLOCK_N": 128, "BLOCK_K": 128, "num_warps": 8, "num_stages": 2, "time_ms": 53.35027313232422, "status": "ok"}
{"N": 1048576, "K": 16384, "D": 64, "B": 1, "dtype": "fp16", "BLOCK_N": 128, "BLOCK_K": 128, "num_warps": 8, "num_stages": 4, "time_ms": 49.08137512207031, "status": "ok"}
{"summary": true, "N": 1048576, "K": 16384, "D": 64, "B": 1, "dtype": "fp16", "best": {"N": 1048576, "K": 16384, "D": 64, "B": 1, "dtype": "fp16", "BLOCK_N": 128, "BLOCK_K": 32, "num_warps": 4, "num_stages": 2, "time_ms": 31.753215789794922, "status": "ok"}, "best_time_ms": 31.753215789794922, "tuning_seconds": 31.872321605682373, "skipped": 0}
