grid_results_gb10/N1048576_K200000_D64_B1_fp16.jsonl
{"N": 1048576, "K": 200000, "D": 64, "B": 1, "dtype": "fp16", "BLOCK_N": 32, "BLOCK_K": 32, "num_warps": 4, "num_stages": 1, "time_ms": 861.2720336914062, "status": "ok"}
{"N": 1048576, "K": 200000, "D": 64, "B": 1, "dtype": "fp16", "BLOCK_N": 32, "BLOCK_K": 32, "num_warps": 4, "num_stages": 2, "time_ms": 822.42041015625, "status": "ok"}
{"N": 1048576, "K": 200000, "D": 64, "B": 1, "dtype": "fp16", "BLOCK_N": 32, "BLOCK_K": 32, "num_warps": 4, "num_stages": 4, "time_ms": 842.8533325195312, "status": "ok"}
{"N": 1048576, "K": 200000, "D": 64, "B": 1, "dtype": "fp16", "BLOCK_N": 32, "BLOCK_K": 32, "num_warps": 8, "num_stages": 1, "time_ms": 1443.4805908203125, "status": "ok"}
{"N": 1048576, "K": 200000, "D": 64, "B": 1, "dtype": "fp16", "BLOCK_N": 32, "BLOCK_K": 32, "num_warps": 8, "num_stages": 2, "time_ms": 1452.4774169921875, "status": "ok"}
{"N": 1048576, "K": 200000, "D": 64, "B": 1, "dtype": "fp16", "BLOCK_N": 32, "BLOCK_K": 32, "num_warps": 8, "num_stages": 4, "time_ms": 1444.983642578125, "status": "ok"}
{"N": 1048576, "K": 200000, "D": 64, "B": 1, "dtype": "fp16", "BLOCK_N": 32, "BLOCK_K": 64, "num_warps": 4, "num_stages": 1, "time_ms": 789.2471313476562, "status": "ok"}
{"N": 1048576, "K": 200000, "D": 64, "B": 1, "dtype": "fp16", "BLOCK_N": 32, "BLOCK_K": 64, "num_warps": 4, "num_stages": 2, "time_ms": 736.5848388671875, "status": "ok"}
{"N": 1048576, "K": 200000, "D": 64, "B": 1, "dtype": "fp16", "BLOCK_N": 32, "BLOCK_K": 64, "num_warps": 4, "num_stages": 4, "time_ms": 806.5404663085938, "status": "ok"}
{"N": 1048576, "K": 200000, "D": 64, "B": 1, "dtype": "fp16", "BLOCK_N": 32, "BLOCK_K": 64, "num_warps": 8, "num_stages": 1, "time_ms": 952.0262451171875, "status": "ok"}
{"N": 1048576, "K": 200000, "D": 64, "B": 1, "dtype": "fp16", "BLOCK_N": 32, "BLOCK_K": 64, "num_warps": 8, "num_stages": 2, "time_ms": 907.9746704101562, "status": "ok"}
{"N": 1048576, "K": 200000, "D": 64, "B": 1, "dtype": "fp16", "BLOCK_N": 32, "BLOCK_K": 64, "num_warps": 8, "num_stages": 4, "time_ms": 907.947998046875, "status": "ok"}
{"N": 1048576, "K": 200000, "D": 64, "B": 1, "dtype": "fp16", "BLOCK_N": 32, "BLOCK_K": 128, "num_warps": 4, "num_stages": 1, "time_ms": 674.1934204101562, "status": "ok"}
{"N": 1048576, "K": 200000, "D": 64, "B": 1, "dtype": "fp16", "BLOCK_N": 32, "BLOCK_K": 128, "num_warps": 4, "num_stages": 2, "time_ms": 668.02685546875, "status": "ok"}
{"N": 1048576, "K": 200000, "D": 64, "B": 1, "dtype": "fp16", "BLOCK_N": 32, "BLOCK_K": 128, "num_warps": 4, "num_stages": 4, "time_ms": 1279.4952392578125, "status": "ok"}
{"N": 1048576, "K": 200000, "D": 64, "B": 1, "dtype": "fp16", "BLOCK_N": 32, "BLOCK_K": 128, "num_warps": 8, "num_stages": 1, "time_ms": 862.6043090820312, "status": "ok"}
{"N": 1048576, "K": 200000, "D": 64, "B": 1, "dtype": "fp16", "BLOCK_N": 32, "BLOCK_K": 128, "num_warps": 8, "num_stages": 2, "time_ms": 842.0301513671875, "status": "ok"}
{"N": 1048576, "K": 200000, "D": 64, "B": 1, "dtype": "fp16", "BLOCK_N": 32, "BLOCK_K": 128, "num_warps": 8, "num_stages": 4, "time_ms": 1282.714599609375, "status": "ok"}
{"N": 1048576, "K": 200000, "D": 64, "B": 1, "dtype": "fp16", "BLOCK_N": 64, "BLOCK_K": 32, "num_warps": 4, "num_stages": 1, "time_ms": 663.5663452148438, "status": "ok"}
{"N": 1048576, "K": 200000, "D": 64, "B": 1, "dtype": "fp16", "BLOCK_N": 64, "BLOCK_K": 32, "num_warps": 4, "num_stages": 2, "time_ms": 648.2800903320312, "status": "ok"}
{"N": 1048576, "K": 200000, "D": 64, "B": 1, "dtype": "fp16", "BLOCK_N": 64, "BLOCK_K": 32, "num_warps": 4, "num_stages": 4, "time_ms": 672.111572265625, "status": "ok"}
{"N": 1048576, "K": 200000, "D": 64, "B": 1, "dtype": "fp16", "BLOCK_N": 64, "BLOCK_K": 32, "num_warps": 8, "num_stages": 1, "time_ms": 783.6569213867188, "status": "ok"}
{"N": 1048576, "K": 200000, "D": 64, "B": 1, "dtype": "fp16", "BLOCK_N": 64, "BLOCK_K": 32, "num_warps": 8, "num_stages": 2, "time_ms": 812.9290161132812, "status": "ok"}
{"N": 1048576, "K": 200000, "D": 64, "B": 1, "dtype": "fp16", "BLOCK_N": 64, "BLOCK_K": 32, "num_warps": 8, "num_stages": 4, "time_ms": 788.5906372070312, "status": "ok"}
{"N": 1048576, "K": 200000, "D": 64, "B": 1, "dtype": "fp16", "BLOCK_N": 64, "BLOCK_K": 64, "num_warps": 4, "num_stages": 1, "time_ms": 506.94549560546875, "status": "ok"}
{"N": 1048576, "K": 200000, "D": 64, "B": 1, "dtype": "fp16", "BLOCK_N": 64, "BLOCK_K": 64, "num_warps": 4, "num_stages": 2, "time_ms": 617.05419921875, "status": "ok"}
{"N": 1048576, "K": 200000, "D": 64, "B": 1, "dtype": "fp16", "BLOCK_N": 64, "BLOCK_K": 64, "num_warps": 4, "num_stages": 4, "time_ms": 604.2716064453125, "status": "ok"}
{"N": 1048576, "K": 200000, "D": 64, "B": 1, "dtype": "fp16", "BLOCK_N": 64, "BLOCK_K": 64, "num_warps": 8, "num_stages": 1, "time_ms": 727.9381103515625, "status": "ok"}
{"N": 1048576, "K": 200000, "D": 64, "B": 1, "dtype": "fp16", "BLOCK_N": 64, "BLOCK_K": 64, "num_warps": 8, "num_stages": 2, "time_ms": 710.793212890625, "status": "ok"}
{"N": 1048576, "K": 200000, "D": 64, "B": 1, "dtype": "fp16", "BLOCK_N": 64, "BLOCK_K": 64, "num_warps": 8, "num_stages": 4, "time_ms": 751.34765625, "status": "ok"}
{"N": 1048576, "K": 200000, "D": 64, "B": 1, "dtype": "fp16", "BLOCK_N": 64, "BLOCK_K": 128, "num_warps": 4, "num_stages": 1, "time_ms": 545.6373901367188, "status": "ok"}
{"N": 1048576, "K": 200000, "D": 64, "B": 1, "dtype": "fp16", "BLOCK_N": 64, "BLOCK_K": 128, "num_warps": 4, "num_stages": 2, "time_ms": 527.211669921875, "status": "ok"}
{"N": 1048576, "K": 200000, "D": 64, "B": 1, "dtype": "fp16", "BLOCK_N": 64, "BLOCK_K": 128, "num_warps": 4, "num_stages": 4, "time_ms": 970.3956298828125, "status": "ok"}
{"N": 1048576, "K": 200000, "D": 64, "B": 1, "dtype": "fp16", "BLOCK_N": 64, "BLOCK_K": 128, "num_warps": 8, "num_stages": 1, "time_ms": 567.6503295898438, "status": "ok"}
{"N": 1048576, "K": 200000, "D": 64, "B": 1, "dtype": "fp16", "BLOCK_N": 64, "BLOCK_K": 128, "num_warps": 8, "num_stages": 2, "time_ms": 566.451171875, "status": "ok"}
{"N": 1048576, "K": 200000, "D": 64, "B": 1, "dtype": "fp16", "BLOCK_N": 64, "BLOCK_K": 128, "num_warps": 8, "num_stages": 4, "time_ms": 709.7446899414062, "status": "ok"}
{"N": 1048576, "K": 200000, "D": 64, "B": 1, "dtype": "fp16", "BLOCK_N": 128, "BLOCK_K": 32, "num_warps": 4, "num_stages": 1, "time_ms": 394.6455078125, "status": "ok"}
{"N": 1048576, "K": 200000, "D": 64, "B": 1, "dtype": "fp16", "BLOCK_N": 128, "BLOCK_K": 32, "num_warps": 4, "num_stages": 2, "time_ms": 433.0076599121094, "status": "ok"}
{"N": 1048576, "K": 200000, "D": 64, "B": 1, "dtype": "fp16", "BLOCK_N": 128, "BLOCK_K": 32, "num_warps": 4, "num_stages": 4, "time_ms": 440.13775634765625, "status": "ok"}
{"N": 1048576, "K": 200000, "D": 64, "B": 1, "dtype": "fp16", "BLOCK_N": 128, "BLOCK_K": 32, "num_warps": 8, "num_stages": 1, "time_ms": 665.3358154296875, "status": "ok"}
{"N": 1048576, "K": 200000, "D": 64, "B": 1, "dtype": "fp16", "BLOCK_N": 128, "BLOCK_K": 32, "num_warps": 8, "num_stages": 2, "time_ms": 680.1028442382812, "status": "ok"}
{"N": 1048576, "K": 200000, "D": 64, "B": 1, "dtype": "fp16", "BLOCK_N": 128, "BLOCK_K": 32, "num_warps": 8, "num_stages": 4, "time_ms": 653.4276733398438, "status": "ok"}
{"N": 1048576, "K": 200000, "D": 64, "B": 1, "dtype": "fp16", "BLOCK_N": 128, "BLOCK_K": 64, "num_warps": 4, "num_stages": 1, "time_ms": 492.5654296875, "status": "ok"}
{"N": 1048576, "K": 200000, "D": 64, "B": 1, "dtype": "fp16", "BLOCK_N": 128, "BLOCK_K": 64, "num_warps": 4, "num_stages": 2, "time_ms": 438.68572998046875, "status": "ok"}
{"N": 1048576, "K": 200000, "D": 64, "B": 1, "dtype": "fp16", "BLOCK_N": 128, "BLOCK_K": 64, "num_warps": 4, "num_stages": 4, "time_ms": 495.0353698730469, "status": "ok"}
{"N": 1048576, "K": 200000, "D": 64, "B": 1, "dtype": "fp16", "BLOCK_N": 128, "BLOCK_K": 64, "num_warps": 8, "num_stages": 1, "time_ms": 521.2897338867188, "status": "ok"}
{"N": 1048576, "K": 200000, "D": 64, "B": 1, "dtype": "fp16", "BLOCK_N": 128, "BLOCK_K": 64, "num_warps": 8, "num_stages": 2, "time_ms": 573.2208251953125, "status": "ok"}
{"N": 1048576, "K": 200000, "D": 64, "B": 1, "dtype": "fp16", "BLOCK_N": 128, "BLOCK_K": 64, "num_warps": 8, "num_stages": 4, "time_ms": 479.9374084472656, "status": "ok"}
{"N": 1048576, "K": 200000, "D": 64, "B": 1, "dtype": "fp16", "BLOCK_N": 128, "BLOCK_K": 128, "num_warps": 4, "num_stages": 1, "time_ms": 476.6095275878906, "status": "ok"}
{"N": 1048576, "K": 200000, "D": 64, "B": 1, "dtype": "fp16", "BLOCK_N": 128, "BLOCK_K": 128, "num_warps": 4, "num_stages": 2, "time_ms": 438.1819152832031, "status": "ok"}
{"N": 1048576, "K": 200000, "D": 64, "B": 1, "dtype": "fp16", "BLOCK_N": 128, "BLOCK_K": 128, "num_warps": 4, "num_stages": 4, "time_ms": 652.623779296875, "status": "ok"}
{"N": 1048576, "K": 200000, "D": 64, "B": 1, "dtype": "fp16", "BLOCK_N": 128, "BLOCK_K": 128, "num_warps": 8, "num_stages": 1, "time_ms": 724.6674194335938, "status": "ok"}
{"N": 1048576, "K": 200000, "D": 64, "B": 1, "dtype": "fp16", "BLOCK_N": 128, "BLOCK_K": 128, "num_warps": 8, "num_stages": 2, "time_ms": 780.2235107421875, "status": "ok"}
{"N": 1048576, "K": 200000, "D": 64, "B": 1, "dtype": "fp16", "BLOCK_N": 128, "BLOCK_K": 128, "num_warps": 8, "num_stages": 4, "time_ms": 620.6699829101562, "status": "ok"}
{"summary": true, "N": 1048576, "K": 200000, "D": 64, "B": 1, "dtype": "fp16", "best": {"N": 1048576, "K": 200000, "D": 64, "B": 1, "dtype": "fp16", "BLOCK_N": 128, "BLOCK_K": 32, "num_warps": 4, "num_stages": 1, "time_ms": 394.6455078125, "status": "ok"}, "best_time_ms": 394.6455078125, "tuning_seconds": 325.49303436279297, "skipped": 0}
