grid_results_gb10/N1048576_K200000_D128_B1_fp16.jsonl
{"N": 1048576, "K": 200000, "D": 128, "B": 1, "dtype": "fp16", "BLOCK_N": 32, "BLOCK_K": 32, "num_warps": 4, "num_stages": 1, "time_ms": 1357.959228515625, "status": "ok"}
{"N": 1048576, "K": 200000, "D": 128, "B": 1, "dtype": "fp16", "BLOCK_N": 32, "BLOCK_K": 32, "num_warps": 4, "num_stages": 2, "time_ms": 1393.04345703125, "status": "ok"}
{"N": 1048576, "K": 200000, "D": 128, "B": 1, "dtype": "fp16", "BLOCK_N": 32, "BLOCK_K": 32, "num_warps": 4, "num_stages": 4, "time_ms": 1913.7493896484375, "status": "ok"}
{"N": 1048576, "K": 200000, "D": 128, "B": 1, "dtype": "fp16", "BLOCK_N": 32, "BLOCK_K": 32, "num_warps": 8, "num_stages": 1, "time_ms": 1951.289306640625, "status": "ok"}
{"N": 1048576, "K": 200000, "D": 128, "B": 1, "dtype": "fp16", "BLOCK_N": 32, "BLOCK_K": 32, "num_warps": 8, "num_stages": 2, "time_ms": 1901.5106201171875, "status": "ok"}
{"N": 1048576, "K": 200000, "D": 128, "B": 1, "dtype": "fp16", "BLOCK_N": 32, "BLOCK_K": 32, "num_warps": 8, "num_stages": 4, "time_ms": 2285.086669921875, "status": "ok"}
{"N": 1048576, "K": 200000, "D": 128, "B": 1, "dtype": "fp16", "BLOCK_N": 32, "BLOCK_K": 64, "num_warps": 4, "num_stages": 1, "time_ms": 1298.367431640625, "status": "ok"}
{"N": 1048576, "K": 200000, "D": 128, "B": 1, "dtype": "fp16", "BLOCK_N": 32, "BLOCK_K": 64, "num_warps": 4, "num_stages": 2, "time_ms": 1458.6275634765625, "status": "ok"}
{"N": 1048576, "K": 200000, "D": 128, "B": 1, "dtype": "fp16", "BLOCK_N": 32, "BLOCK_K": 64, "num_warps": 4, "num_stages": 4, "time_ms": 2491.947998046875, "status": "ok"}
{"N": 1048576, "K": 200000, "D": 128, "B": 1, "dtype": "fp16", "BLOCK_N": 32, "BLOCK_K": 64, "num_warps": 8, "num_stages": 1, "time_ms": 1390.2950439453125, "status": "ok"}
{"N": 1048576, "K": 200000, "D": 128, "B": 1, "dtype": "fp16", "BLOCK_N": 32, "BLOCK_K": 64, "num_warps": 8, "num_stages": 2, "time_ms": 1392.9041748046875, "status": "ok"}
{"N": 1048576, "K": 200000, "D": 128, "B": 1, "dtype": "fp16", "BLOCK_N": 32, "BLOCK_K": 64, "num_warps": 8, "num_stages": 4, "time_ms": 2356.956298828125, "status": "ok"}
{"N": 1048576, "K": 200000, "D": 128, "B": 1, "dtype": "fp16", "BLOCK_N": 32, "BLOCK_K": 128, "num_warps": 4, "num_stages": 1, "time_ms": 1502.2274169921875, "status": "ok"}
{"N": 1048576, "K": 200000, "D": 128, "B": 1, "dtype": "fp16", "BLOCK_N": 32, "BLOCK_K": 128, "num_warps": 4, "num_stages": 2, "time_ms": 1806.0533447265625, "status": "ok"}
{"N": 1048576, "K": 200000, "D": 128, "B": 1, "dtype": "fp16", "BLOCK_N": 32, "BLOCK_K": 128, "num_warps": 4, "num_stages": 4, "status": "oor"}
{"N": 1048576, "K": 200000, "D": 128, "B": 1, "dtype": "fp16", "BLOCK_N": 32, "BLOCK_K": 128, "num_warps": 8, "num_stages": 1, "time_ms": 1633.142822265625, "status": "ok"}
{"N": 1048576, "K": 200000, "D": 128, "B": 1, "dtype": "fp16", "BLOCK_N": 32, "BLOCK_K": 128, "num_warps": 8, "num_stages": 2, "time_ms": 1577.058349609375, "status": "ok"}
{"N": 1048576, "K": 200000, "D": 128, "B": 1, "dtype": "fp16", "BLOCK_N": 32, "BLOCK_K": 128, "num_warps": 8, "num_stages": 4, "status": "oor"}
{"N": 1048576, "K": 200000, "D": 128, "B": 1, "dtype": "fp16", "BLOCK_N": 64, "BLOCK_K": 32, "num_warps": 4, "num_stages": 1, "time_ms": 1028.6365966796875, "status": "ok"}
{"N": 1048576, "K": 200000, "D": 128, "B": 1, "dtype": "fp16", "BLOCK_N": 64, "BLOCK_K": 32, "num_warps": 4, "num_stages": 2, "time_ms": 1189.674072265625, "status": "ok"}
{"N": 1048576, "K": 200000, "D": 128, "B": 1, "dtype": "fp16", "BLOCK_N": 64, "BLOCK_K": 32, "num_warps": 4, "num_stages": 4, "time_ms": 1292.8154296875, "status": "ok"}
{"N": 1048576, "K": 200000, "D": 128, "B": 1, "dtype": "fp16", "BLOCK_N": 64, "BLOCK_K": 32, "num_warps": 8, "num_stages": 1, "time_ms": 1129.576416015625, "status": "ok"}
{"N": 1048576, "K": 200000, "D": 128, "B": 1, "dtype": "fp16", "BLOCK_N": 64, "BLOCK_K": 32, "num_warps": 8, "num_stages": 2, "time_ms": 1211.7808837890625, "status": "ok"}
{"N": 1048576, "K": 200000, "D": 128, "B": 1, "dtype": "fp16", "BLOCK_N": 64, "BLOCK_K": 32, "num_warps": 8, "num_stages": 4, "time_ms": 1234.8150634765625, "status": "ok"}
{"N": 1048576, "K": 200000, "D": 128, "B": 1, "dtype": "fp16", "BLOCK_N": 64, "BLOCK_K": 64, "num_warps": 4, "num_stages": 1, "time_ms": 846.6135864257812, "status": "ok"}
{"N": 1048576, "K": 200000, "D": 128, "B": 1, "dtype": "fp16", "BLOCK_N": 64, "BLOCK_K": 64, "num_warps": 4, "num_stages": 2, "time_ms": 1058.3070068359375, "status": "ok"}
{"N": 1048576, "K": 200000, "D": 128, "B": 1, "dtype": "fp16", "BLOCK_N": 64, "BLOCK_K": 64, "num_warps": 4, "num_stages": 4, "time_ms": 1680.583740234375, "status": "ok"}
{"N": 1048576, "K": 200000, "D": 128, "B": 1, "dtype": "fp16", "BLOCK_N": 64, "BLOCK_K": 64, "num_warps": 8, "num_stages": 1, "time_ms": 1025.311767578125, "status": "ok"}
{"N": 1048576, "K": 200000, "D": 128, "B": 1, "dtype": "fp16", "BLOCK_N": 64, "BLOCK_K": 64, "num_warps": 8, "num_stages": 2, "time_ms": 1401.47802734375, "status": "ok"}
{"N": 1048576, "K": 200000, "D": 128, "B": 1, "dtype": "fp16", "BLOCK_N": 64, "BLOCK_K": 64, "num_warps": 8, "num_stages": 4, "time_ms": 1823.2197265625, "status": "ok"}
{"N": 1048576, "K": 200000, "D": 128, "B": 1, "dtype": "fp16", "BLOCK_N": 64, "BLOCK_K": 128, "num_warps": 4, "num_stages": 1, "time_ms": 1004.0493774414062, "status": "ok"}
{"N": 1048576, "K": 200000, "D": 128, "B": 1, "dtype": "fp16", "BLOCK_N": 64, "BLOCK_K": 128, "num_warps": 4, "num_stages": 2, "time_ms": 1492.538330078125, "status": "ok"}
{"N": 1048576, "K": 200000, "D": 128, "B": 1, "dtype": "fp16", "BLOCK_N": 64, "BLOCK_K": 128, "num_warps": 4, "num_stages": 4, "status": "oor"}
{"N": 1048576, "K": 200000, "D": 128, "B": 1, "dtype": "fp16", "BLOCK_N": 64, "BLOCK_K": 128, "num_warps": 8, "num_stages": 1, "time_ms": 991.7286376953125, "status": "ok"}
{"N": 1048576, "K": 200000, "D": 128, "B": 1, "dtype": "fp16", "BLOCK_N": 64, "BLOCK_K": 128, "num_warps": 8, "num_stages": 2, "time_ms": 1645.2474365234375, "status": "ok"}
{"N": 1048576, "K": 200000, "D": 128, "B": 1, "dtype": "fp16", "BLOCK_N": 64, "BLOCK_K": 128, "num_warps": 8, "num_stages": 4, "status": "oor"}
{"N": 1048576, "K": 200000, "D": 128, "B": 1, "dtype": "fp16", "BLOCK_N": 128, "BLOCK_K": 32, "num_warps": 4, "num_stages": 1, "time_ms": 796.3115234375, "status": "ok"}
{"N": 1048576, "K": 200000, "D": 128, "B": 1, "dtype": "fp16", "BLOCK_N": 128, "BLOCK_K": 32, "num_warps": 4, "num_stages": 2, "time_ms": 1097.1322021484375, "status": "ok"}
{"N": 1048576, "K": 200000, "D": 128, "B": 1, "dtype": "fp16", "BLOCK_N": 128, "BLOCK_K": 32, "num_warps": 4, "num_stages": 4, "time_ms": 1501.2730712890625, "status": "ok"}
{"N": 1048576, "K": 200000, "D": 128, "B": 1, "dtype": "fp16", "BLOCK_N": 128, "BLOCK_K": 32, "num_warps": 8, "num_stages": 1, "time_ms": 973.8886108398438, "status": "ok"}
{"N": 1048576, "K": 200000, "D": 128, "B": 1, "dtype": "fp16", "BLOCK_N": 128, "BLOCK_K": 32, "num_warps": 8, "num_stages": 2, "time_ms": 1068.96484375, "status": "ok"}
{"N": 1048576, "K": 200000, "D": 128, "B": 1, "dtype": "fp16", "BLOCK_N": 128, "BLOCK_K": 32, "num_warps": 8, "num_stages": 4, "time_ms": 1413.8603515625, "status": "ok"}
{"N": 1048576, "K": 200000, "D": 128, "B": 1, "dtype": "fp16", "BLOCK_N": 128, "BLOCK_K": 64, "num_warps": 4, "num_stages": 1, "time_ms": 723.9812622070312, "status": "ok"}
{"N": 1048576, "K": 200000, "D": 128, "B": 1, "dtype": "fp16", "BLOCK_N": 128, "BLOCK_K": 64, "num_warps": 4, "num_stages": 2, "time_ms": 1308.478515625, "status": "ok"}
{"N": 1048576, "K": 200000, "D": 128, "B": 1, "dtype": "fp16", "BLOCK_N": 128, "BLOCK_K": 64, "num_warps": 4, "num_stages": 4, "time_ms": 910.28173828125, "status": "ok"}
{"N": 1048576, "K": 200000, "D": 128, "B": 1, "dtype": "fp16", "BLOCK_N": 128, "BLOCK_K": 64, "num_warps": 8, "num_stages": 1, "time_ms": 778.5420532226562, "status": "ok"}
{"N": 1048576, "K": 200000, "D": 128, "B": 1, "dtype": "fp16", "BLOCK_N": 128, "BLOCK_K": 64, "num_warps": 8, "num_stages": 2, "time_ms": 1438.730224609375, "status": "ok"}
{"N": 1048576, "K": 200000, "D": 128, "B": 1, "dtype": "fp16", "BLOCK_N": 128, "BLOCK_K": 64, "num_warps": 8, "num_stages": 4, "time_ms": 1120.6993408203125, "status": "ok"}
{"N": 1048576, "K": 200000, "D": 128, "B": 1, "dtype": "fp16", "BLOCK_N": 128, "BLOCK_K": 128, "num_warps": 4, "num_stages": 1, "time_ms": 1300.0908203125, "status": "ok"}
{"N": 1048576, "K": 200000, "D": 128, "B": 1, "dtype": "fp16", "BLOCK_N": 128, "BLOCK_K": 128, "num_warps": 4, "num_stages": 2, "time_ms": 1033.787353515625, "status": "ok"}
{"N": 1048576, "K": 200000, "D": 128, "B": 1, "dtype": "fp16", "BLOCK_N": 128, "BLOCK_K": 128, "num_warps": 4, "num_stages": 4, "status": "oor"}
{"N": 1048576, "K": 200000, "D": 128, "B": 1, "dtype": "fp16", "BLOCK_N": 128, "BLOCK_K": 128, "num_warps": 8, "num_stages": 1, "time_ms": 1134.6146240234375, "status": "ok"}
{"N": 1048576, "K": 200000, "D": 128, "B": 1, "dtype": "fp16", "BLOCK_N": 128, "BLOCK_K": 128, "num_warps": 8, "num_stages": 2, "time_ms": 1023.7910766601562, "status": "ok"}
{"N": 1048576, "K": 200000, "D": 128, "B": 1, "dtype": "fp16", "BLOCK_N": 128, "BLOCK_K": 128, "num_warps": 8, "num_stages": 4, "status": "oor"}
{"summary": true, "N": 1048576, "K": 200000, "D": 128, "B": 1, "dtype": "fp16", "best": {"N": 1048576, "K": 200000, "D": 128, "B": 1, "dtype": "fp16", "BLOCK_N": 128, "BLOCK_K": 64, "num_warps": 4, "num_stages": 1, "time_ms": 723.9812622070312, "status": "ok"}, "best_time_ms": 723.9812622070312, "tuning_seconds": 531.9612236022949, "skipped": 6}
