grid_results_gb10/N1048576_K65536_D64_B1_fp16.jsonl
{"N": 1048576, "K": 65536, "D": 64, "B": 1, "dtype": "fp16", "BLOCK_N": 32, "BLOCK_K": 32, "num_warps": 4, "num_stages": 1, "time_ms": 279.15570068359375, "status": "ok"}
{"N": 1048576, "K": 65536, "D": 64, "B": 1, "dtype": "fp16", "BLOCK_N": 32, "BLOCK_K": 32, "num_warps": 4, "num_stages": 2, "time_ms": 266.61785888671875, "status": "ok"}
{"N": 1048576, "K": 65536, "D": 64, "B": 1, "dtype": "fp16", "BLOCK_N": 32, "BLOCK_K": 32, "num_warps": 4, "num_stages": 4, "time_ms": 272.6604919433594, "status": "ok"}
{"N": 1048576, "K": 65536, "D": 64, "B": 1, "dtype": "fp16", "BLOCK_N": 32, "BLOCK_K": 32, "num_warps": 8, "num_stages": 1, "time_ms": 458.9609069824219, "status": "ok"}
{"N": 1048576, "K": 65536, "D": 64, "B": 1, "dtype": "fp16", "BLOCK_N": 32, "BLOCK_K": 32, "num_warps": 8, "num_stages": 2, "time_ms": 465.301513671875, "status": "ok"}
{"N": 1048576, "K": 65536, "D": 64, "B": 1, "dtype": "fp16", "BLOCK_N": 32, "BLOCK_K": 32, "num_warps": 8, "num_stages": 4, "time_ms": 468.9931640625, "status": "ok"}
{"N": 1048576, "K": 65536, "D": 64, "B": 1, "dtype": "fp16", "BLOCK_N": 32, "BLOCK_K": 64, "num_warps": 4, "num_stages": 1, "time_ms": 250.44374084472656, "status": "ok"}
{"N": 1048576, "K": 65536, "D": 64, "B": 1, "dtype": "fp16", "BLOCK_N": 32, "BLOCK_K": 64, "num_warps": 4, "num_stages": 2, "time_ms": 235.26707458496094, "status": "ok"}
{"N": 1048576, "K": 65536, "D": 64, "B": 1, "dtype": "fp16", "BLOCK_N": 32, "BLOCK_K": 64, "num_warps": 4, "num_stages": 4, "time_ms": 250.04441833496094, "status": "ok"}
{"N": 1048576, "K": 65536, "D": 64, "B": 1, "dtype": "fp16", "BLOCK_N": 32, "BLOCK_K": 64, "num_warps": 8, "num_stages": 1, "time_ms": 300.9372253417969, "status": "ok"}
{"N": 1048576, "K": 65536, "D": 64, "B": 1, "dtype": "fp16", "BLOCK_N": 32, "BLOCK_K": 64, "num_warps": 8, "num_stages": 2, "time_ms": 287.1664733886719, "status": "ok"}
{"N": 1048576, "K": 65536, "D": 64, "B": 1, "dtype": "fp16", "BLOCK_N": 32, "BLOCK_K": 64, "num_warps": 8, "num_stages": 4, "time_ms": 289.0096740722656, "status": "ok"}
{"N": 1048576, "K": 65536, "D": 64, "B": 1, "dtype": "fp16", "BLOCK_N": 32, "BLOCK_K": 128, "num_warps": 4, "num_stages": 1, "time_ms": 210.0102996826172, "status": "ok"}
{"N": 1048576, "K": 65536, "D": 64, "B": 1, "dtype": "fp16", "BLOCK_N": 32, "BLOCK_K": 128, "num_warps": 4, "num_stages": 2, "time_ms": 213.702880859375, "status": "ok"}
{"N": 1048576, "K": 65536, "D": 64, "B": 1, "dtype": "fp16", "BLOCK_N": 32, "BLOCK_K": 128, "num_warps": 4, "num_stages": 4, "time_ms": 338.81207275390625, "status": "ok"}
{"N": 1048576, "K": 65536, "D": 64, "B": 1, "dtype": "fp16", "BLOCK_N": 32, "BLOCK_K": 128, "num_warps": 8, "num_stages": 1, "time_ms": 276.7605895996094, "status": "ok"}
{"N": 1048576, "K": 65536, "D": 64, "B": 1, "dtype": "fp16", "BLOCK_N": 32, "BLOCK_K": 128, "num_warps": 8, "num_stages": 2, "time_ms": 263.08709716796875, "status": "ok"}
{"N": 1048576, "K": 65536, "D": 64, "B": 1, "dtype": "fp16", "BLOCK_N": 32, "BLOCK_K": 128, "num_warps": 8, "num_stages": 4, "time_ms": 354.66546630859375, "status": "ok"}
{"N": 1048576, "K": 65536, "D": 64, "B": 1, "dtype": "fp16", "BLOCK_N": 64, "BLOCK_K": 32, "num_warps": 4, "num_stages": 1, "time_ms": 217.97702026367188, "status": "ok"}
{"N": 1048576, "K": 65536, "D": 64, "B": 1, "dtype": "fp16", "BLOCK_N": 64, "BLOCK_K": 32, "num_warps": 4, "num_stages": 2, "time_ms": 210.68698120117188, "status": "ok"}
{"N": 1048576, "K": 65536, "D": 64, "B": 1, "dtype": "fp16", "BLOCK_N": 64, "BLOCK_K": 32, "num_warps": 4, "num_stages": 4, "time_ms": 216.99072265625, "status": "ok"}
{"N": 1048576, "K": 65536, "D": 64, "B": 1, "dtype": "fp16", "BLOCK_N": 64, "BLOCK_K": 32, "num_warps": 8, "num_stages": 1, "time_ms": 253.86598205566406, "status": "ok"}
{"N": 1048576, "K": 65536, "D": 64, "B": 1, "dtype": "fp16", "BLOCK_N": 64, "BLOCK_K": 32, "num_warps": 8, "num_stages": 2, "time_ms": 258.2109375, "status": "ok"}
{"N": 1048576, "K": 65536, "D": 64, "B": 1, "dtype": "fp16", "BLOCK_N": 64, "BLOCK_K": 32, "num_warps": 8, "num_stages": 4, "time_ms": 258.9512023925781, "status": "ok"}
{"N": 1048576, "K": 65536, "D": 64, "B": 1, "dtype": "fp16", "BLOCK_N": 64, "BLOCK_K": 64, "num_warps": 4, "num_stages": 1, "time_ms": 162.48204040527344, "status": "ok"}
{"N": 1048576, "K": 65536, "D": 64, "B": 1, "dtype": "fp16", "BLOCK_N": 64, "BLOCK_K": 64, "num_warps": 4, "num_stages": 2, "time_ms": 161.0771484375, "status": "ok"}
{"N": 1048576, "K": 65536, "D": 64, "B": 1, "dtype": "fp16", "BLOCK_N": 64, "BLOCK_K": 64, "num_warps": 4, "num_stages": 4, "time_ms": 168.01087951660156, "status": "ok"}
{"N": 1048576, "K": 65536, "D": 64, "B": 1, "dtype": "fp16", "BLOCK_N": 64, "BLOCK_K": 64, "num_warps": 8, "num_stages": 1, "time_ms": 236.70477294921875, "status": "ok"}
{"N": 1048576, "K": 65536, "D": 64, "B": 1, "dtype": "fp16", "BLOCK_N": 64, "BLOCK_K": 64, "num_warps": 8, "num_stages": 2, "time_ms": 227.27980041503906, "status": "ok"}
{"N": 1048576, "K": 65536, "D": 64, "B": 1, "dtype": "fp16", "BLOCK_N": 64, "BLOCK_K": 64, "num_warps": 8, "num_stages": 4, "time_ms": 235.44216918945312, "status": "ok"}
{"N": 1048576, "K": 65536, "D": 64, "B": 1, "dtype": "fp16", "BLOCK_N": 64, "BLOCK_K": 128, "num_warps": 4, "num_stages": 1, "time_ms": 174.45376586914062, "status": "ok"}
{"N": 1048576, "K": 65536, "D": 64, "B": 1, "dtype": "fp16", "BLOCK_N": 64, "BLOCK_K": 128, "num_warps": 4, "num_stages": 2, "time_ms": 165.8665008544922, "status": "ok"}
{"N": 1048576, "K": 65536, "D": 64, "B": 1, "dtype": "fp16", "BLOCK_N": 64, "BLOCK_K": 128, "num_warps": 4, "num_stages": 4, "time_ms": 263.09326171875, "status": "ok"}
{"N": 1048576, "K": 65536, "D": 64, "B": 1, "dtype": "fp16", "BLOCK_N": 64, "BLOCK_K": 128, "num_warps": 8, "num_stages": 1, "time_ms": 181.6985626220703, "status": "ok"}
{"N": 1048576, "K": 65536, "D": 64, "B": 1, "dtype": "fp16", "BLOCK_N": 64, "BLOCK_K": 128, "num_warps": 8, "num_stages": 2, "time_ms": 173.33145141601562, "status": "ok"}
{"N": 1048576, "K": 65536, "D": 64, "B": 1, "dtype": "fp16", "BLOCK_N": 64, "BLOCK_K": 128, "num_warps": 8, "num_stages": 4, "time_ms": 206.34713745117188, "status": "ok"}
{"N": 1048576, "K": 65536, "D": 64, "B": 1, "dtype": "fp16", "BLOCK_N": 128, "BLOCK_K": 32, "num_warps": 4, "num_stages": 1, "time_ms": 127.74195098876953, "status": "ok"}
{"N": 1048576, "K": 65536, "D": 64, "B": 1, "dtype": "fp16", "BLOCK_N": 128, "BLOCK_K": 32, "num_warps": 4, "num_stages": 2, "time_ms": 127.73478698730469, "status": "ok"}
{"N": 1048576, "K": 65536, "D": 64, "B": 1, "dtype": "fp16", "BLOCK_N": 128, "BLOCK_K": 32, "num_warps": 4, "num_stages": 4, "time_ms": 133.5037384033203, "status": "ok"}
{"N": 1048576, "K": 65536, "D": 64, "B": 1, "dtype": "fp16", "BLOCK_N": 128, "BLOCK_K": 32, "num_warps": 8, "num_stages": 1, "time_ms": 214.74928283691406, "status": "ok"}
{"N": 1048576, "K": 65536, "D": 64, "B": 1, "dtype": "fp16", "BLOCK_N": 128, "BLOCK_K": 32, "num_warps": 8, "num_stages": 2, "time_ms": 217.64915466308594, "status": "ok"}
{"N": 1048576, "K": 65536, "D": 64, "B": 1, "dtype": "fp16", "BLOCK_N": 128, "BLOCK_K": 32, "num_warps": 8, "num_stages": 4, "time_ms": 216.92930603027344, "status": "ok"}
{"N": 1048576, "K": 65536, "D": 64, "B": 1, "dtype": "fp16", "BLOCK_N": 128, "BLOCK_K": 64, "num_warps": 4, "num_stages": 1, "time_ms": 151.43724060058594, "status": "ok"}
{"N": 1048576, "K": 65536, "D": 64, "B": 1, "dtype": "fp16", "BLOCK_N": 128, "BLOCK_K": 64, "num_warps": 4, "num_stages": 2, "time_ms": 144.3901824951172, "status": "ok"}
{"N": 1048576, "K": 65536, "D": 64, "B": 1, "dtype": "fp16", "BLOCK_N": 128, "BLOCK_K": 64, "num_warps": 4, "num_stages": 4, "time_ms": 146.54156494140625, "status": "ok"}
{"N": 1048576, "K": 65536, "D": 64, "B": 1, "dtype": "fp16", "BLOCK_N": 128, "BLOCK_K": 64, "num_warps": 8, "num_stages": 1, "time_ms": 168.15411376953125, "status": "ok"}
{"N": 1048576, "K": 65536, "D": 64, "B": 1, "dtype": "fp16", "BLOCK_N": 128, "BLOCK_K": 64, "num_warps": 8, "num_stages": 2, "time_ms": 166.62220764160156, "status": "ok"}
{"N": 1048576, "K": 65536, "D": 64, "B": 1, "dtype": "fp16", "BLOCK_N": 128, "BLOCK_K": 64, "num_warps": 8, "num_stages": 4, "time_ms": 158.0185546875, "status": "ok"}
{"N": 1048576, "K": 65536, "D": 64, "B": 1, "dtype": "fp16", "BLOCK_N": 128, "BLOCK_K": 128, "num_warps": 4, "num_stages": 1, "time_ms": 141.5362548828125, "status": "ok"}
{"N": 1048576, "K": 65536, "D": 64, "B": 1, "dtype": "fp16", "BLOCK_N": 128, "BLOCK_K": 128, "num_warps": 4, "num_stages": 2, "time_ms": 142.2664031982422, "status": "ok"}
{"N": 1048576, "K": 65536, "D": 64, "B": 1, "dtype": "fp16", "BLOCK_N": 128, "BLOCK_K": 128, "num_warps": 4, "num_stages": 4, "time_ms": 190.15577697753906, "status": "ok"}
{"N": 1048576, "K": 65536, "D": 64, "B": 1, "dtype": "fp16", "BLOCK_N": 128, "BLOCK_K": 128, "num_warps": 8, "num_stages": 1, "time_ms": 211.87481689453125, "status": "ok"}
{"N": 1048576, "K": 65536, "D": 64, "B": 1, "dtype": "fp16", "BLOCK_N": 128, "BLOCK_K": 128, "num_warps": 8, "num_stages": 2, "time_ms": 215.63702392578125, "status": "ok"}
{"N": 1048576, "K": 65536, "D": 64, "B": 1, "dtype": "fp16", "BLOCK_N": 128, "BLOCK_K": 128, "num_warps": 8, "num_stages": 4, "time_ms": 197.9217987060547, "status": "ok"}
{"summary": true, "N": 1048576, "K": 65536, "D": 64, "B": 1, "dtype": "fp16", "best": {"N": 1048576, "K": 65536, "D": 64, "B": 1, "dtype": "fp16", "BLOCK_N": 128, "BLOCK_K": 32, "num_warps": 4, "num_stages": 2, "time_ms": 127.73478698730469, "status": "ok"}, "best_time_ms": 127.73478698730469, "tuning_seconds": 106.16122388839722, "skipped": 0}
