grid_results_gb10/N1048576_K1024_D128_B1_fp16.jsonl
{"N": 1048576, "K": 1024, "D": 128, "B": 1, "dtype": "fp16", "BLOCK_N": 32, "BLOCK_K": 32, "num_warps": 4, "num_stages": 1, "time_ms": 6.236192226409912, "status": "ok"}
{"N": 1048576, "K": 1024, "D": 128, "B": 1, "dtype": "fp16", "BLOCK_N": 32, "BLOCK_K": 32, "num_warps": 4, "num_stages": 2, "time_ms": 5.660639762878418, "status": "ok"}
{"N": 1048576, "K": 1024, "D": 128, "B": 1, "dtype": "fp16", "BLOCK_N": 32, "BLOCK_K": 32, "num_warps": 4, "num_stages": 4, "time_ms": 6.93452787399292, "status": "ok"}
{"N": 1048576, "K": 1024, "D": 128, "B": 1, "dtype": "fp16", "BLOCK_N": 32, "BLOCK_K": 32, "num_warps": 8, "num_stages": 1, "time_ms": 9.237728118896484, "status": "ok"}
{"N": 1048576, "K": 1024, "D": 128, "B": 1, "dtype": "fp16", "BLOCK_N": 32, "BLOCK_K": 32, "num_warps": 8, "num_stages": 2, "time_ms": 9.211935997009277, "status": "ok"}
{"N": 1048576, "K": 1024, "D": 128, "B": 1, "dtype": "fp16", "BLOCK_N": 32, "BLOCK_K": 32, "num_warps": 8, "num_stages": 4, "time_ms": 9.638815879821777, "status": "ok"}
{"N": 1048576, "K": 1024, "D": 128, "B": 1, "dtype": "fp16", "BLOCK_N": 32, "BLOCK_K": 64, "num_warps": 4, "num_stages": 1, "time_ms": 6.023168087005615, "status": "ok"}
{"N": 1048576, "K": 1024, "D": 128, "B": 1, "dtype": "fp16", "BLOCK_N": 32, "BLOCK_K": 64, "num_warps": 4, "num_stages": 2, "time_ms": 6.100992202758789, "status": "ok"}
{"N": 1048576, "K": 1024, "D": 128, "B": 1, "dtype": "fp16", "BLOCK_N": 32, "BLOCK_K": 64, "num_warps": 4, "num_stages": 4, "time_ms": 9.131839752197266, "status": "ok"}
{"N": 1048576, "K": 1024, "D": 128, "B": 1, "dtype": "fp16", "BLOCK_N": 32, "BLOCK_K": 64, "num_warps": 8, "num_stages": 1, "time_ms": 6.96233606338501, "status": "ok"}
{"N": 1048576, "K": 1024, "D": 128, "B": 1, "dtype": "fp16", "BLOCK_N": 32, "BLOCK_K": 64, "num_warps": 8, "num_stages": 2, "time_ms": 6.333343982696533, "status": "ok"}
{"N": 1048576, "K": 1024, "D": 128, "B": 1, "dtype": "fp16", "BLOCK_N": 32, "BLOCK_K": 64, "num_warps": 8, "num_stages": 4, "time_ms": 8.577887535095215, "status": "ok"}
{"N": 1048576, "K": 1024, "D": 128, "B": 1, "dtype": "fp16", "BLOCK_N": 32, "BLOCK_K": 128, "num_warps": 4, "num_stages": 1, "time_ms": 7.703551769256592, "status": "ok"}
{"N": 1048576, "K": 1024, "D": 128, "B": 1, "dtype": "fp16", "BLOCK_N": 32, "BLOCK_K": 128, "num_warps": 4, "num_stages": 2, "time_ms": 7.163904190063477, "status": "ok"}
{"N": 1048576, "K": 1024, "D": 128, "B": 1, "dtype": "fp16", "BLOCK_N": 32, "BLOCK_K": 128, "num_warps": 4, "num_stages": 4, "status": "oor"}
{"N": 1048576, "K": 1024, "D": 128, "B": 1, "dtype": "fp16", "BLOCK_N": 32, "BLOCK_K": 128, "num_warps": 8, "num_stages": 1, "time_ms": 7.525440216064453, "status": "ok"}
{"N": 1048576, "K": 1024, "D": 128, "B": 1, "dtype": "fp16", "BLOCK_N": 32, "BLOCK_K": 128, "num_warps": 8, "num_stages": 2, "time_ms": 6.980639934539795, "status": "ok"}
{"N": 1048576, "K": 1024, "D": 128, "B": 1, "dtype": "fp16", "BLOCK_N": 32, "BLOCK_K": 128, "num_warps": 8, "num_stages": 4, "status": "oor"}
{"N": 1048576, "K": 1024, "D": 128, "B": 1, "dtype": "fp16", "BLOCK_N": 64, "BLOCK_K": 32, "num_warps": 4, "num_stages": 1, "time_ms": 4.722720146179199, "status": "ok"}
{"N": 1048576, "K": 1024, "D": 128, "B": 1, "dtype": "fp16", "BLOCK_N": 64, "BLOCK_K": 32, "num_warps": 4, "num_stages": 2, "time_ms": 4.8476481437683105, "status": "ok"}
{"N": 1048576, "K": 1024, "D": 128, "B": 1, "dtype": "fp16", "BLOCK_N": 64, "BLOCK_K": 32, "num_warps": 4, "num_stages": 4, "time_ms": 5.242879867553711, "status": "ok"}
{"N": 1048576, "K": 1024, "D": 128, "B": 1, "dtype": "fp16", "BLOCK_N": 64, "BLOCK_K": 32, "num_warps": 8, "num_stages": 1, "time_ms": 5.375904083251953, "status": "ok"}
{"N": 1048576, "K": 1024, "D": 128, "B": 1, "dtype": "fp16", "BLOCK_N": 64, "BLOCK_K": 32, "num_warps": 8, "num_stages": 2, "time_ms": 5.446559906005859, "status": "ok"}
{"N": 1048576, "K": 1024, "D": 128, "B": 1, "dtype": "fp16", "BLOCK_N": 64, "BLOCK_K": 32, "num_warps": 8, "num_stages": 4, "time_ms": 5.6708478927612305, "status": "ok"}
{"N": 1048576, "K": 1024, "D": 128, "B": 1, "dtype": "fp16", "BLOCK_N": 64, "BLOCK_K": 64, "num_warps": 4, "num_stages": 1, "time_ms": 4.510784149169922, "status": "ok"}
{"N": 1048576, "K": 1024, "D": 128, "B": 1, "dtype": "fp16", "BLOCK_N": 64, "BLOCK_K": 64, "num_warps": 4, "num_stages": 2, "time_ms": 4.484064102172852, "status": "ok"}
{"N": 1048576, "K": 1024, "D": 128, "B": 1, "dtype": "fp16", "BLOCK_N": 64, "BLOCK_K": 64, "num_warps": 4, "num_stages": 4, "time_ms": 5.720096111297607, "status": "ok"}
{"N": 1048576, "K": 1024, "D": 128, "B": 1, "dtype": "fp16", "BLOCK_N": 64, "BLOCK_K": 64, "num_warps": 8, "num_stages": 1, "time_ms": 4.907968044281006, "status": "ok"}
{"N": 1048576, "K": 1024, "D": 128, "B": 1, "dtype": "fp16", "BLOCK_N": 64, "BLOCK_K": 64, "num_warps": 8, "num_stages": 2, "time_ms": 5.065631866455078, "status": "ok"}
{"N": 1048576, "K": 1024, "D": 128, "B": 1, "dtype": "fp16", "BLOCK_N": 64, "BLOCK_K": 64, "num_warps": 8, "num_stages": 4, "time_ms": 6.461440086364746, "status": "ok"}
{"N": 1048576, "K": 1024, "D": 128, "B": 1, "dtype": "fp16", "BLOCK_N": 64, "BLOCK_K": 128, "num_warps": 4, "num_stages": 1, "time_ms": 4.827136039733887, "status": "ok"}
{"N": 1048576, "K": 1024, "D": 128, "B": 1, "dtype": "fp16", "BLOCK_N": 64, "BLOCK_K": 128, "num_warps": 4, "num_stages": 2, "time_ms": 7.219232082366943, "status": "ok"}
{"N": 1048576, "K": 1024, "D": 128, "B": 1, "dtype": "fp16", "BLOCK_N": 64, "BLOCK_K": 128, "num_warps": 4, "num_stages": 4, "status": "oor"}
{"N": 1048576, "K": 1024, "D": 128, "B": 1, "dtype": "fp16", "BLOCK_N": 64, "BLOCK_K": 128, "num_warps": 8, "num_stages": 1, "time_ms": 4.859936237335205, "status": "ok"}
{"N": 1048576, "K": 1024, "D": 128, "B": 1, "dtype": "fp16", "BLOCK_N": 64, "BLOCK_K": 128, "num_warps": 8, "num_stages": 2, "time_ms": 6.855679988861084, "status": "ok"}
{"N": 1048576, "K": 1024, "D": 128, "B": 1, "dtype": "fp16", "BLOCK_N": 64, "BLOCK_K": 128, "num_warps": 8, "num_stages": 4, "status": "oor"}
{"N": 1048576, "K": 1024, "D": 128, "B": 1, "dtype": "fp16", "BLOCK_N": 128, "BLOCK_K": 32, "num_warps": 4, "num_stages": 1, "time_ms": 3.382848024368286, "status": "ok"}
{"N": 1048576, "K": 1024, "D": 128, "B": 1, "dtype": "fp16", "BLOCK_N": 128, "BLOCK_K": 32, "num_warps": 4, "num_stages": 2, "time_ms": 3.5471999645233154, "status": "ok"}
{"N": 1048576, "K": 1024, "D": 128, "B": 1, "dtype": "fp16", "BLOCK_N": 128, "BLOCK_K": 32, "num_warps": 4, "num_stages": 4, "time_ms": 4.732960224151611, "status": "ok"}
{"N": 1048576, "K": 1024, "D": 128, "B": 1, "dtype": "fp16", "BLOCK_N": 128, "BLOCK_K": 32, "num_warps": 8, "num_stages": 1, "time_ms": 4.819647789001465, "status": "ok"}
{"N": 1048576, "K": 1024, "D": 128, "B": 1, "dtype": "fp16", "BLOCK_N": 128, "BLOCK_K": 32, "num_warps": 8, "num_stages": 2, "time_ms": 4.678592205047607, "status": "ok"}
{"N": 1048576, "K": 1024, "D": 128, "B": 1, "dtype": "fp16", "BLOCK_N": 128, "BLOCK_K": 32, "num_warps": 8, "num_stages": 4, "time_ms": 6.122335910797119, "status": "ok"}
{"N": 1048576, "K": 1024, "D": 128, "B": 1, "dtype": "fp16", "BLOCK_N": 128, "BLOCK_K": 64, "num_warps": 4, "num_stages": 1, "time_ms": 4.099071979522705, "status": "ok"}
{"N": 1048576, "K": 1024, "D": 128, "B": 1, "dtype": "fp16", "BLOCK_N": 128, "BLOCK_K": 64, "num_warps": 4, "num_stages": 2, "time_ms": 5.3779520988464355, "status": "ok"}
{"N": 1048576, "K": 1024, "D": 128, "B": 1, "dtype": "fp16", "BLOCK_N": 128, "BLOCK_K": 64, "num_warps": 4, "num_stages": 4, "time_ms": 4.661248207092285, "status": "ok"}
{"N": 1048576, "K": 1024, "D": 128, "B": 1, "dtype": "fp16", "BLOCK_N": 128, "BLOCK_K": 64, "num_warps": 8, "num_stages": 1, "time_ms": 3.867647886276245, "status": "ok"}
{"N": 1048576, "K": 1024, "D": 128, "B": 1, "dtype": "fp16", "BLOCK_N": 128, "BLOCK_K": 64, "num_warps": 8, "num_stages": 2, "time_ms": 5.505760192871094, "status": "ok"}
{"N": 1048576, "K": 1024, "D": 128, "B": 1, "dtype": "fp16", "BLOCK_N": 128, "BLOCK_K": 64, "num_warps": 8, "num_stages": 4, "time_ms": 4.852863788604736, "status": "ok"}
{"N": 1048576, "K": 1024, "D": 128, "B": 1, "dtype": "fp16", "BLOCK_N": 128, "BLOCK_K": 128, "num_warps": 4, "num_stages": 1, "time_ms": 6.214623928070068, "status": "ok"}
{"N": 1048576, "K": 1024, "D": 128, "B": 1, "dtype": "fp16", "BLOCK_N": 128, "BLOCK_K": 128, "num_warps": 4, "num_stages": 2, "time_ms": 5.493760108947754, "status": "ok"}
{"N": 1048576, "K": 1024, "D": 128, "B": 1, "dtype": "fp16", "BLOCK_N": 128, "BLOCK_K": 128, "num_warps": 4, "num_stages": 4, "status": "oor"}
{"N": 1048576, "K": 1024, "D": 128, "B": 1, "dtype": "fp16", "BLOCK_N": 128, "BLOCK_K": 128, "num_warps": 8, "num_stages": 1, "time_ms": 5.112832069396973, "status": "ok"}
{"N": 1048576, "K": 1024, "D": 128, "B": 1, "dtype": "fp16", "BLOCK_N": 128, "BLOCK_K": 128, "num_warps": 8, "num_stages": 2, "time_ms": 5.107744216918945, "status": "ok"}
{"N": 1048576, "K": 1024, "D": 128, "B": 1, "dtype": "fp16", "BLOCK_N": 128, "BLOCK_K": 128, "num_warps": 8, "num_stages": 4, "status": "oor"}
{"summary": true, "N": 1048576, "K": 1024, "D": 128, "B": 1, "dtype": "fp16", "best": {"N": 1048576, "K": 1024, "D": 128, "B": 1, "dtype": "fp16", "BLOCK_N": 128, "BLOCK_K": 32, "num_warps": 4, "num_stages": 1, "time_ms": 3.382848024368286, "status": "ok"}, "best_time_ms": 3.382848024368286, "tuning_seconds": 11.137665271759033, "skipped": 6}
