grid_results_gb10/N262144_K16384_D256_B1_fp16.jsonl
{"N": 262144, "K": 16384, "D": 256, "B": 1, "dtype": "fp16", "BLOCK_N": 32, "BLOCK_K": 32, "num_warps": 4, "num_stages": 1, "time_ms": 48.01228713989258, "status": "ok"}
{"N": 262144, "K": 16384, "D": 256, "B": 1, "dtype": "fp16", "BLOCK_N": 32, "BLOCK_K": 32, "num_warps": 4, "num_stages": 2, "time_ms": 67.11398315429688, "status": "ok"}
{"N": 262144, "K": 16384, "D": 256, "B": 1, "dtype": "fp16", "BLOCK_N": 32, "BLOCK_K": 32, "num_warps": 4, "num_stages": 4, "time_ms": 69.74249267578125, "status": "ok"}
{"N": 262144, "K": 16384, "D": 256, "B": 1, "dtype": "fp16", "BLOCK_N": 32, "BLOCK_K": 32, "num_warps": 8, "num_stages": 1, "time_ms": 61.43379211425781, "status": "ok"}
{"N": 262144, "K": 16384, "D": 256, "B": 1, "dtype": "fp16", "BLOCK_N": 32, "BLOCK_K": 32, "num_warps": 8, "num_stages": 2, "time_ms": 68.76258850097656, "status": "ok"}
{"N": 262144, "K": 16384, "D": 256, "B": 1, "dtype": "fp16", "BLOCK_N": 32, "BLOCK_K": 32, "num_warps": 8, "num_stages": 4, "time_ms": 77.24748992919922, "status": "ok"}
{"N": 262144, "K": 16384, "D": 256, "B": 1, "dtype": "fp16", "BLOCK_N": 32, "BLOCK_K": 64, "num_warps": 4, "num_stages": 1, "time_ms": 57.785343170166016, "status": "ok"}
{"N": 262144, "K": 16384, "D": 256, "B": 1, "dtype": "fp16", "BLOCK_N": 32, "BLOCK_K": 64, "num_warps": 4, "num_stages": 2, "time_ms": 64.19145965576172, "status": "ok"}
{"N": 262144, "K": 16384, "D": 256, "B": 1, "dtype": "fp16", "BLOCK_N": 32, "BLOCK_K": 64, "num_warps": 4, "num_stages": 4, "status": "oor"}
{"N": 262144, "K": 16384, "D": 256, "B": 1, "dtype": "fp16", "BLOCK_N": 32, "BLOCK_K": 64, "num_warps": 8, "num_stages": 1, "time_ms": 58.5975341796875, "status": "ok"}
{"N": 262144, "K": 16384, "D": 256, "B": 1, "dtype": "fp16", "BLOCK_N": 32, "BLOCK_K": 64, "num_warps": 8, "num_stages": 2, "time_ms": 60.70988845825195, "status": "ok"}
{"N": 262144, "K": 16384, "D": 256, "B": 1, "dtype": "fp16", "BLOCK_N": 32, "BLOCK_K": 64, "num_warps": 8, "num_stages": 4, "status": "oor"}
{"N": 262144, "K": 16384, "D": 256, "B": 1, "dtype": "fp16", "BLOCK_N": 32, "BLOCK_K": 128, "num_warps": 4, "num_stages": 1, "time_ms": 66.81804656982422, "status": "ok"}
{"N": 262144, "K": 16384, "D": 256, "B": 1, "dtype": "fp16", "BLOCK_N": 32, "BLOCK_K": 128, "num_warps": 4, "num_stages": 2, "time_ms": 100.8691177368164, "status": "ok"}
{"N": 262144, "K": 16384, "D": 256, "B": 1, "dtype": "fp16", "BLOCK_N": 32, "BLOCK_K": 128, "num_warps": 4, "num_stages": 4, "status": "oor"}
{"N": 262144, "K": 16384, "D": 256, "B": 1, "dtype": "fp16", "BLOCK_N": 32, "BLOCK_K": 128, "num_warps": 8, "num_stages": 1, "time_ms": 62.141441345214844, "status": "ok"}
{"N": 262144, "K": 16384, "D": 256, "B": 1, "dtype": "fp16", "BLOCK_N": 32, "BLOCK_K": 128, "num_warps": 8, "num_stages": 2, "time_ms": 74.05158233642578, "status": "ok"}
{"N": 262144, "K": 16384, "D": 256, "B": 1, "dtype": "fp16", "BLOCK_N": 32, "BLOCK_K": 128, "num_warps": 8, "num_stages": 4, "status": "oor"}
{"N": 262144, "K": 16384, "D": 256, "B": 1, "dtype": "fp16", "BLOCK_N": 64, "BLOCK_K": 32, "num_warps": 4, "num_stages": 1, "time_ms": 35.73244857788086, "status": "ok"}
{"N": 262144, "K": 16384, "D": 256, "B": 1, "dtype": "fp16", "BLOCK_N": 64, "BLOCK_K": 32, "num_warps": 4, "num_stages": 2, "time_ms": 42.06166458129883, "status": "ok"}
{"N": 262144, "K": 16384, "D": 256, "B": 1, "dtype": "fp16", "BLOCK_N": 64, "BLOCK_K": 32, "num_warps": 4, "num_stages": 4, "time_ms": 51.7468147277832, "status": "ok"}
{"N": 262144, "K": 16384, "D": 256, "B": 1, "dtype": "fp16", "BLOCK_N": 64, "BLOCK_K": 32, "num_warps": 8, "num_stages": 1, "time_ms": 37.96486282348633, "status": "ok"}
{"N": 262144, "K": 16384, "D": 256, "B": 1, "dtype": "fp16", "BLOCK_N": 64, "BLOCK_K": 32, "num_warps": 8, "num_stages": 2, "time_ms": 35.48979187011719, "status": "ok"}
{"N": 262144, "K": 16384, "D": 256, "B": 1, "dtype": "fp16", "BLOCK_N": 64, "BLOCK_K": 32, "num_warps": 8, "num_stages": 4, "time_ms": 43.1901741027832, "status": "ok"}
{"N": 262144, "K": 16384, "D": 256, "B": 1, "dtype": "fp16", "BLOCK_N": 64, "BLOCK_K": 64, "num_warps": 4, "num_stages": 1, "time_ms": 44.22041702270508, "status": "ok"}
{"N": 262144, "K": 16384, "D": 256, "B": 1, "dtype": "fp16", "BLOCK_N": 64, "BLOCK_K": 64, "num_warps": 4, "num_stages": 2, "time_ms": 48.39628982543945, "status": "ok"}
{"N": 262144, "K": 16384, "D": 256, "B": 1, "dtype": "fp16", "BLOCK_N": 64, "BLOCK_K": 64, "num_warps": 4, "num_stages": 4, "status": "oor"}
{"N": 262144, "K": 16384, "D": 256, "B": 1, "dtype": "fp16", "BLOCK_N": 64, "BLOCK_K": 64, "num_warps": 8, "num_stages": 1, "time_ms": 46.09126281738281, "status": "ok"}
{"N": 262144, "K": 16384, "D": 256, "B": 1, "dtype": "fp16", "BLOCK_N": 64, "BLOCK_K": 64, "num_warps": 8, "num_stages": 2, "time_ms": 50.286590576171875, "status": "ok"}
{"N": 262144, "K": 16384, "D": 256, "B": 1, "dtype": "fp16", "BLOCK_N": 64, "BLOCK_K": 64, "num_warps": 8, "num_stages": 4, "status": "oor"}
{"N": 262144, "K": 16384, "D": 256, "B": 1, "dtype": "fp16", "BLOCK_N": 64, "BLOCK_K": 128, "num_warps": 4, "num_stages": 1, "time_ms": 47.38243103027344, "status": "ok"}
{"N": 262144, "K": 16384, "D": 256, "B": 1, "dtype": "fp16", "BLOCK_N": 64, "BLOCK_K": 128, "num_warps": 4, "num_stages": 2, "time_ms": 64.40550231933594, "status": "ok"}
{"N": 262144, "K": 16384, "D": 256, "B": 1, "dtype": "fp16", "BLOCK_N": 64, "BLOCK_K": 128, "num_warps": 4, "num_stages": 4, "status": "oor"}
{"N": 262144, "K": 16384, "D": 256, "B": 1, "dtype": "fp16", "BLOCK_N": 64, "BLOCK_K": 128, "num_warps": 8, "num_stages": 1, "time_ms": 41.220096588134766, "status": "ok"}
{"N": 262144, "K": 16384, "D": 256, "B": 1, "dtype": "fp16", "BLOCK_N": 64, "BLOCK_K": 128, "num_warps": 8, "num_stages": 2, "time_ms": 45.783935546875, "status": "ok"}
{"N": 262144, "K": 16384, "D": 256, "B": 1, "dtype": "fp16", "BLOCK_N": 64, "BLOCK_K": 128, "num_warps": 8, "num_stages": 4, "status": "oor"}
{"N": 262144, "K": 16384, "D": 256, "B": 1, "dtype": "fp16", "BLOCK_N": 128, "BLOCK_K": 32, "num_warps": 4, "num_stages": 1, "time_ms": 36.890625, "status": "ok"}
{"N": 262144, "K": 16384, "D": 256, "B": 1, "dtype": "fp16", "BLOCK_N": 128, "BLOCK_K": 32, "num_warps": 4, "num_stages": 2, "time_ms": 36.66534423828125, "status": "ok"}
{"N": 262144, "K": 16384, "D": 256, "B": 1, "dtype": "fp16", "BLOCK_N": 128, "BLOCK_K": 32, "num_warps": 4, "num_stages": 4, "status": "oor"}
{"N": 262144, "K": 16384, "D": 256, "B": 1, "dtype": "fp16", "BLOCK_N": 128, "BLOCK_K": 32, "num_warps": 8, "num_stages": 1, "time_ms": 39.07276916503906, "status": "ok"}
{"N": 262144, "K": 16384, "D": 256, "B": 1, "dtype": "fp16", "BLOCK_N": 128, "BLOCK_K": 32, "num_warps": 8, "num_stages": 2, "time_ms": 40.767486572265625, "status": "ok"}
{"N": 262144, "K": 16384, "D": 256, "B": 1, "dtype": "fp16", "BLOCK_N": 128, "BLOCK_K": 32, "num_warps": 8, "num_stages": 4, "status": "oor"}
{"N": 262144, "K": 16384, "D": 256, "B": 1, "dtype": "fp16", "BLOCK_N": 128, "BLOCK_K": 64, "num_warps": 4, "num_stages": 1, "time_ms": 49.19196701049805, "status": "ok"}
{"N": 262144, "K": 16384, "D": 256, "B": 1, "dtype": "fp16", "BLOCK_N": 128, "BLOCK_K": 64, "num_warps": 4, "num_stages": 2, "time_ms": 32.79564666748047, "status": "ok"}
{"N": 262144, "K": 16384, "D": 256, "B": 1, "dtype": "fp16", "BLOCK_N": 128, "BLOCK_K": 64, "num_warps": 4, "num_stages": 4, "status": "oor"}
{"N": 262144, "K": 16384, "D": 256, "B": 1, "dtype": "fp16", "BLOCK_N": 128, "BLOCK_K": 64, "num_warps": 8, "num_stages": 1, "time_ms": 33.86982345581055, "status": "ok"}
{"N": 262144, "K": 16384, "D": 256, "B": 1, "dtype": "fp16", "BLOCK_N": 128, "BLOCK_K": 64, "num_warps": 8, "num_stages": 2, "time_ms": 35.206302642822266, "status": "ok"}
{"N": 262144, "K": 16384, "D": 256, "B": 1, "dtype": "fp16", "BLOCK_N": 128, "BLOCK_K": 64, "num_warps": 8, "num_stages": 4, "status": "oor"}
{"N": 262144, "K": 16384, "D": 256, "B": 1, "dtype": "fp16", "BLOCK_N": 128, "BLOCK_K": 128, "num_warps": 4, "num_stages": 1, "status": "oor"}
{"N": 262144, "K": 16384, "D": 256, "B": 1, "dtype": "fp16", "BLOCK_N": 128, "BLOCK_K": 128, "num_warps": 4, "num_stages": 2, "status": "oor"}
{"N": 262144, "K": 16384, "D": 256, "B": 1, "dtype": "fp16", "BLOCK_N": 128, "BLOCK_K": 128, "num_warps": 4, "num_stages": 4, "status": "oor"}
{"N": 262144, "K": 16384, "D": 256, "B": 1, "dtype": "fp16", "BLOCK_N": 128, "BLOCK_K": 128, "num_warps": 8, "num_stages": 1, "status": "oor"}
{"N": 262144, "K": 16384, "D": 256, "B": 1, "dtype": "fp16", "BLOCK_N": 128, "BLOCK_K": 128, "num_warps": 8, "num_stages": 2, "status": "oor"}
{"N": 262144, "K": 16384, "D": 256, "B": 1, "dtype": "fp16", "BLOCK_N": 128, "BLOCK_K": 128, "num_warps": 8, "num_stages": 4, "status": "oor"}
{"summary": true, "N": 262144, "K": 16384, "D": 256, "B": 1, "dtype": "fp16", "best": {"N": 262144, "K": 16384, "D": 256, "B": 1, "dtype": "fp16", "BLOCK_N": 128, "BLOCK_K": 64, "num_warps": 4, "num_stages": 2, "time_ms": 32.79564666748047, "status": "ok"}, "best_time_ms": 32.79564666748047, "tuning_seconds": 26.647602558135986, "skipped": 18}
