grid_results_gb10/N262144_K4096_D512_B1_fp16.jsonl
{"N": 262144, "K": 4096, "D": 512, "B": 1, "dtype": "fp16", "BLOCK_N": 32, "BLOCK_K": 32, "num_warps": 4, "num_stages": 1, "time_ms": 35.66182327270508, "status": "ok"}
{"N": 262144, "K": 4096, "D": 512, "B": 1, "dtype": "fp16", "BLOCK_N": 32, "BLOCK_K": 32, "num_warps": 4, "num_stages": 2, "time_ms": 39.95036697387695, "status": "ok"}
{"N": 262144, "K": 4096, "D": 512, "B": 1, "dtype": "fp16", "BLOCK_N": 32, "BLOCK_K": 32, "num_warps": 4, "num_stages": 4, "status": "oor"}
{"N": 262144, "K": 4096, "D": 512, "B": 1, "dtype": "fp16", "BLOCK_N": 32, "BLOCK_K": 32, "num_warps": 8, "num_stages": 1, "time_ms": 38.66012954711914, "status": "ok"}
{"N": 262144, "K": 4096, "D": 512, "B": 1, "dtype": "fp16", "BLOCK_N": 32, "BLOCK_K": 32, "num_warps": 8, "num_stages": 2, "time_ms": 35.5241584777832, "status": "ok"}
{"N": 262144, "K": 4096, "D": 512, "B": 1, "dtype": "fp16", "BLOCK_N": 32, "BLOCK_K": 32, "num_warps": 8, "num_stages": 4, "status": "oor"}
{"N": 262144, "K": 4096, "D": 512, "B": 1, "dtype": "fp16", "BLOCK_N": 32, "BLOCK_K": 64, "num_warps": 4, "num_stages": 1, "time_ms": 32.28790283203125, "status": "ok"}
{"N": 262144, "K": 4096, "D": 512, "B": 1, "dtype": "fp16", "BLOCK_N": 32, "BLOCK_K": 64, "num_warps": 4, "num_stages": 2, "time_ms": 37.03807830810547, "status": "ok"}
{"N": 262144, "K": 4096, "D": 512, "B": 1, "dtype": "fp16", "BLOCK_N": 32, "BLOCK_K": 64, "num_warps": 4, "num_stages": 4, "status": "oor"}
{"N": 262144, "K": 4096, "D": 512, "B": 1, "dtype": "fp16", "BLOCK_N": 32, "BLOCK_K": 64, "num_warps": 8, "num_stages": 1, "time_ms": 29.920703887939453, "status": "ok"}
{"N": 262144, "K": 4096, "D": 512, "B": 1, "dtype": "fp16", "BLOCK_N": 32, "BLOCK_K": 64, "num_warps": 8, "num_stages": 2, "time_ms": 34.00505447387695, "status": "ok"}
{"N": 262144, "K": 4096, "D": 512, "B": 1, "dtype": "fp16", "BLOCK_N": 32, "BLOCK_K": 64, "num_warps": 8, "num_stages": 4, "status": "oor"}
{"N": 262144, "K": 4096, "D": 512, "B": 1, "dtype": "fp16", "BLOCK_N": 32, "BLOCK_K": 128, "num_warps": 4, "num_stages": 1, "status": "oor"}
{"N": 262144, "K": 4096, "D": 512, "B": 1, "dtype": "fp16", "BLOCK_N": 32, "BLOCK_K": 128, "num_warps": 4, "num_stages": 2, "status": "oor"}
{"N": 262144, "K": 4096, "D": 512, "B": 1, "dtype": "fp16", "BLOCK_N": 32, "BLOCK_K": 128, "num_warps": 4, "num_stages": 4, "status": "oor"}
{"N": 262144, "K": 4096, "D": 512, "B": 1, "dtype": "fp16", "BLOCK_N": 32, "BLOCK_K": 128, "num_warps": 8, "num_stages": 1, "status": "oor"}
{"N": 262144, "K": 4096, "D": 512, "B": 1, "dtype": "fp16", "BLOCK_N": 32, "BLOCK_K": 128, "num_warps": 8, "num_stages": 2, "status": "oor"}
{"N": 262144, "K": 4096, "D": 512, "B": 1, "dtype": "fp16", "BLOCK_N": 32, "BLOCK_K": 128, "num_warps": 8, "num_stages": 4, "status": "oor"}
{"N": 262144, "K": 4096, "D": 512, "B": 1, "dtype": "fp16", "BLOCK_N": 64, "BLOCK_K": 32, "num_warps": 4, "num_stages": 1, "time_ms": 23.37164878845215, "status": "ok"}
{"N": 262144, "K": 4096, "D": 512, "B": 1, "dtype": "fp16", "BLOCK_N": 64, "BLOCK_K": 32, "num_warps": 4, "num_stages": 2, "time_ms": 25.1146240234375, "status": "ok"}
{"N": 262144, "K": 4096, "D": 512, "B": 1, "dtype": "fp16", "BLOCK_N": 64, "BLOCK_K": 32, "num_warps": 4, "num_stages": 4, "status": "oor"}
{"N": 262144, "K": 4096, "D": 512, "B": 1, "dtype": "fp16", "BLOCK_N": 64, "BLOCK_K": 32, "num_warps": 8, "num_stages": 1, "time_ms": 21.106687545776367, "status": "ok"}
{"N": 262144, "K": 4096, "D": 512, "B": 1, "dtype": "fp16", "BLOCK_N": 64, "BLOCK_K": 32, "num_warps": 8, "num_stages": 2, "time_ms": 24.363296508789062, "status": "ok"}
{"N": 262144, "K": 4096, "D": 512, "B": 1, "dtype": "fp16", "BLOCK_N": 64, "BLOCK_K": 32, "num_warps": 8, "num_stages": 4, "status": "oor"}
{"N": 262144, "K": 4096, "D": 512, "B": 1, "dtype": "fp16", "BLOCK_N": 64, "BLOCK_K": 64, "num_warps": 4, "num_stages": 1, "status": "oor"}
{"N": 262144, "K": 4096, "D": 512, "B": 1, "dtype": "fp16", "BLOCK_N": 64, "BLOCK_K": 64, "num_warps": 4, "num_stages": 2, "status": "oor"}
{"N": 262144, "K": 4096, "D": 512, "B": 1, "dtype": "fp16", "BLOCK_N": 64, "BLOCK_K": 64, "num_warps": 4, "num_stages": 4, "status": "oor"}
{"N": 262144, "K": 4096, "D": 512, "B": 1, "dtype": "fp16", "BLOCK_N": 64, "BLOCK_K": 64, "num_warps": 8, "num_stages": 1, "status": "oor"}
{"N": 262144, "K": 4096, "D": 512, "B": 1, "dtype": "fp16", "BLOCK_N": 64, "BLOCK_K": 64, "num_warps": 8, "num_stages": 2, "status": "oor"}
{"N": 262144, "K": 4096, "D": 512, "B": 1, "dtype": "fp16", "BLOCK_N": 64, "BLOCK_K": 64, "num_warps": 8, "num_stages": 4, "status": "oor"}
{"N": 262144, "K": 4096, "D": 512, "B": 1, "dtype": "fp16", "BLOCK_N": 64, "BLOCK_K": 128, "num_warps": 4, "num_stages": 1, "status": "oor"}
{"N": 262144, "K": 4096, "D": 512, "B": 1, "dtype": "fp16", "BLOCK_N": 64, "BLOCK_K": 128, "num_warps": 4, "num_stages": 2, "status": "oor"}
{"N": 262144, "K": 4096, "D": 512, "B": 1, "dtype": "fp16", "BLOCK_N": 64, "BLOCK_K": 128, "num_warps": 4, "num_stages": 4, "status": "oor"}
{"N": 262144, "K": 4096, "D": 512, "B": 1, "dtype": "fp16", "BLOCK_N": 64, "BLOCK_K": 128, "num_warps": 8, "num_stages": 1, "status": "oor"}
{"N": 262144, "K": 4096, "D": 512, "B": 1, "dtype": "fp16", "BLOCK_N": 64, "BLOCK_K": 128, "num_warps": 8, "num_stages": 2, "status": "oor"}
{"N": 262144, "K": 4096, "D": 512, "B": 1, "dtype": "fp16", "BLOCK_N": 64, "BLOCK_K": 128, "num_warps": 8, "num_stages": 4, "status": "oor"}
{"N": 262144, "K": 4096, "D": 512, "B": 1, "dtype": "fp16", "BLOCK_N": 128, "BLOCK_K": 32, "num_warps": 4, "num_stages": 1, "status": "oor"}
{"N": 262144, "K": 4096, "D": 512, "B": 1, "dtype": "fp16", "BLOCK_N": 128, "BLOCK_K": 32, "num_warps": 4, "num_stages": 2, "status": "oor"}
{"N": 262144, "K": 4096, "D": 512, "B": 1, "dtype": "fp16", "BLOCK_N": 128, "BLOCK_K": 32, "num_warps": 4, "num_stages": 4, "status": "oor"}
{"N": 262144, "K": 4096, "D": 512, "B": 1, "dtype": "fp16", "BLOCK_N": 128, "BLOCK_K": 32, "num_warps": 8, "num_stages": 1, "status": "oor"}
{"N": 262144, "K": 4096, "D": 512, "B": 1, "dtype": "fp16", "BLOCK_N": 128, "BLOCK_K": 32, "num_warps": 8, "num_stages": 2, "status": "oor"}
{"N": 262144, "K": 4096, "D": 512, "B": 1, "dtype": "fp16", "BLOCK_N": 128, "BLOCK_K": 32, "num_warps": 8, "num_stages": 4, "status": "oor"}
{"N": 262144, "K": 4096, "D": 512, "B": 1, "dtype": "fp16", "BLOCK_N": 128, "BLOCK_K": 64, "num_warps": 4, "num_stages": 1, "status": "oor"}
{"N": 262144, "K": 4096, "D": 512, "B": 1, "dtype": "fp16", "BLOCK_N": 128, "BLOCK_K": 64, "num_warps": 4, "num_stages": 2, "status": "oor"}
{"N": 262144, "K": 4096, "D": 512, "B": 1, "dtype": "fp16", "BLOCK_N": 128, "BLOCK_K": 64, "num_warps": 4, "num_stages": 4, "status": "oor"}
{"N": 262144, "K": 4096, "D": 512, "B": 1, "dtype": "fp16", "BLOCK_N": 128, "BLOCK_K": 64, "num_warps": 8, "num_stages": 1, "status": "oor"}
{"N": 262144, "K": 4096, "D": 512, "B": 1, "dtype": "fp16", "BLOCK_N": 128, "BLOCK_K": 64, "num_warps": 8, "num_stages": 2, "status": "oor"}
{"N": 262144, "K": 4096, "D": 512, "B": 1, "dtype": "fp16", "BLOCK_N": 128, "BLOCK_K": 64, "num_warps": 8, "num_stages": 4, "status": "oor"}
{"N": 262144, "K": 4096, "D": 512, "B": 1, "dtype": "fp16", "BLOCK_N": 128, "BLOCK_K": 128, "num_warps": 4, "num_stages": 1, "status": "oor"}
{"N": 262144, "K": 4096, "D": 512, "B": 1, "dtype": "fp16", "BLOCK_N": 128, "BLOCK_K": 128, "num_warps": 4, "num_stages": 2, "status": "oor"}
{"N": 262144, "K": 4096, "D": 512, "B": 1, "dtype": "fp16", "BLOCK_N": 128, "BLOCK_K": 128, "num_warps": 4, "num_stages": 4, "status": "oor"}
{"N": 262144, "K": 4096, "D": 512, "B": 1, "dtype": "fp16", "BLOCK_N": 128, "BLOCK_K": 128, "num_warps": 8, "num_stages": 1, "status": "oor"}
{"N": 262144, "K": 4096, "D": 512, "B": 1, "dtype": "fp16", "BLOCK_N": 128, "BLOCK_K": 128, "num_warps": 8, "num_stages": 2, "status": "oor"}
{"N": 262144, "K": 4096, "D": 512, "B": 1, "dtype": "fp16", "BLOCK_N": 128, "BLOCK_K": 128, "num_warps": 8, "num_stages": 4, "status": "oor"}
{"summary": true, "N": 262144, "K": 4096, "D": 512, "B": 1, "dtype": "fp16", "best": {"N": 262144, "K": 4096, "D": 512, "B": 1, "dtype": "fp16", "BLOCK_N": 64, "BLOCK_K": 32, "num_warps": 8, "num_stages": 1, "time_ms": 21.106687545776367, "status": "ok"}, "best_time_ms": 21.106687545776367, "tuning_seconds": 21.4108407497406, "skipped": 42}
