grid_results_gb10/N262144_K4096_D64_B32_fp16.jsonl
{"N": 262144, "K": 4096, "D": 64, "B": 32, "dtype": "fp16", "BLOCK_N": 32, "BLOCK_K": 32, "num_warps": 4, "num_stages": 1, "time_ms": 139.23426818847656, "status": "ok"}
{"N": 262144, "K": 4096, "D": 64, "B": 32, "dtype": "fp16", "BLOCK_N": 32, "BLOCK_K": 32, "num_warps": 4, "num_stages": 2, "time_ms": 133.50399780273438, "status": "ok"}
{"N": 262144, "K": 4096, "D": 64, "B": 32, "dtype": "fp16", "BLOCK_N": 32, "BLOCK_K": 32, "num_warps": 4, "num_stages": 4, "time_ms": 136.5820770263672, "status": "ok"}
{"N": 262144, "K": 4096, "D": 64, "B": 32, "dtype": "fp16", "BLOCK_N": 32, "BLOCK_K": 32, "num_warps": 8, "num_stages": 1, "time_ms": 231.7045440673828, "status": "ok"}
{"N": 262144, "K": 4096, "D": 64, "B": 32, "dtype": "fp16", "BLOCK_N": 32, "BLOCK_K": 32, "num_warps": 8, "num_stages": 2, "time_ms": 235.22918701171875, "status": "ok"}
{"N": 262144, "K": 4096, "D": 64, "B": 32, "dtype": "fp16", "BLOCK_N": 32, "BLOCK_K": 32, "num_warps": 8, "num_stages": 4, "time_ms": 235.9920654296875, "status": "ok"}
{"N": 262144, "K": 4096, "D": 64, "B": 32, "dtype": "fp16", "BLOCK_N": 32, "BLOCK_K": 64, "num_warps": 4, "num_stages": 1, "time_ms": 128.1966094970703, "status": "ok"}
{"N": 262144, "K": 4096, "D": 64, "B": 32, "dtype": "fp16", "BLOCK_N": 32, "BLOCK_K": 64, "num_warps": 4, "num_stages": 2, "time_ms": 118.63346862792969, "status": "ok"}
{"N": 262144, "K": 4096, "D": 64, "B": 32, "dtype": "fp16", "BLOCK_N": 32, "BLOCK_K": 64, "num_warps": 4, "num_stages": 4, "time_ms": 123.50752258300781, "status": "ok"}
{"N": 262144, "K": 4096, "D": 64, "B": 32, "dtype": "fp16", "BLOCK_N": 32, "BLOCK_K": 64, "num_warps": 8, "num_stages": 1, "time_ms": 152.19068908691406, "status": "ok"}
{"N": 262144, "K": 4096, "D": 64, "B": 32, "dtype": "fp16", "BLOCK_N": 32, "BLOCK_K": 64, "num_warps": 8, "num_stages": 2, "time_ms": 142.89418029785156, "status": "ok"}
{"N": 262144, "K": 4096, "D": 64, "B": 32, "dtype": "fp16", "BLOCK_N": 32, "BLOCK_K": 64, "num_warps": 8, "num_stages": 4, "time_ms": 146.044921875, "status": "ok"}
{"N": 262144, "K": 4096, "D": 64, "B": 32, "dtype": "fp16", "BLOCK_N": 32, "BLOCK_K": 128, "num_warps": 4, "num_stages": 1, "time_ms": 106.00230407714844, "status": "ok"}
{"N": 262144, "K": 4096, "D": 64, "B": 32, "dtype": "fp16", "BLOCK_N": 32, "BLOCK_K": 128, "num_warps": 4, "num_stages": 2, "time_ms": 103.863037109375, "status": "ok"}
{"N": 262144, "K": 4096, "D": 64, "B": 32, "dtype": "fp16", "BLOCK_N": 32, "BLOCK_K": 128, "num_warps": 4, "num_stages": 4, "time_ms": 161.4940185546875, "status": "ok"}
{"N": 262144, "K": 4096, "D": 64, "B": 32, "dtype": "fp16", "BLOCK_N": 32, "BLOCK_K": 128, "num_warps": 8, "num_stages": 1, "time_ms": 139.6848602294922, "status": "ok"}
{"N": 262144, "K": 4096, "D": 64, "B": 32, "dtype": "fp16", "BLOCK_N": 32, "BLOCK_K": 128, "num_warps": 8, "num_stages": 2, "time_ms": 130.03482055664062, "status": "ok"}
{"N": 262144, "K": 4096, "D": 64, "B": 32, "dtype": "fp16", "BLOCK_N": 32, "BLOCK_K": 128, "num_warps": 8, "num_stages": 4, "time_ms": 170.7519989013672, "status": "ok"}
{"N": 262144, "K": 4096, "D": 64, "B": 32, "dtype": "fp16", "BLOCK_N": 64, "BLOCK_K": 32, "num_warps": 4, "num_stages": 1, "time_ms": 109.93561553955078, "status": "ok"}
{"N": 262144, "K": 4096, "D": 64, "B": 32, "dtype": "fp16", "BLOCK_N": 64, "BLOCK_K": 32, "num_warps": 4, "num_stages": 2, "time_ms": 105.9758071899414, "status": "ok"}
{"N": 262144, "K": 4096, "D": 64, "B": 32, "dtype": "fp16", "BLOCK_N": 64, "BLOCK_K": 32, "num_warps": 4, "num_stages": 4, "time_ms": 109.13996887207031, "status": "ok"}
{"N": 262144, "K": 4096, "D": 64, "B": 32, "dtype": "fp16", "BLOCK_N": 64, "BLOCK_K": 32, "num_warps": 8, "num_stages": 1, "time_ms": 126.8592300415039, "status": "ok"}
{"N": 262144, "K": 4096, "D": 64, "B": 32, "dtype": "fp16", "BLOCK_N": 64, "BLOCK_K": 32, "num_warps": 8, "num_stages": 2, "time_ms": 130.05413818359375, "status": "ok"}
{"N": 262144, "K": 4096, "D": 64, "B": 32, "dtype": "fp16", "BLOCK_N": 64, "BLOCK_K": 32, "num_warps": 8, "num_stages": 4, "time_ms": 129.38035583496094, "status": "ok"}
{"N": 262144, "K": 4096, "D": 64, "B": 32, "dtype": "fp16", "BLOCK_N": 64, "BLOCK_K": 64, "num_warps": 4, "num_stages": 1, "time_ms": 81.88819122314453, "status": "ok"}
{"N": 262144, "K": 4096, "D": 64, "B": 32, "dtype": "fp16", "BLOCK_N": 64, "BLOCK_K": 64, "num_warps": 4, "num_stages": 2, "time_ms": 80.8980484008789, "status": "ok"}
{"N": 262144, "K": 4096, "D": 64, "B": 32, "dtype": "fp16", "BLOCK_N": 64, "BLOCK_K": 64, "num_warps": 4, "num_stages": 4, "time_ms": 86.75302124023438, "status": "ok"}
{"N": 262144, "K": 4096, "D": 64, "B": 32, "dtype": "fp16", "BLOCK_N": 64, "BLOCK_K": 64, "num_warps": 8, "num_stages": 1, "time_ms": 119.20076751708984, "status": "ok"}
{"N": 262144, "K": 4096, "D": 64, "B": 32, "dtype": "fp16", "BLOCK_N": 64, "BLOCK_K": 64, "num_warps": 8, "num_stages": 2, "time_ms": 114.67097473144531, "status": "ok"}
{"N": 262144, "K": 4096, "D": 64, "B": 32, "dtype": "fp16", "BLOCK_N": 64, "BLOCK_K": 64, "num_warps": 8, "num_stages": 4, "time_ms": 121.19961547851562, "status": "ok"}
{"N": 262144, "K": 4096, "D": 64, "B": 32, "dtype": "fp16", "BLOCK_N": 64, "BLOCK_K": 128, "num_warps": 4, "num_stages": 1, "time_ms": 87.72303771972656, "status": "ok"}
{"N": 262144, "K": 4096, "D": 64, "B": 32, "dtype": "fp16", "BLOCK_N": 64, "BLOCK_K": 128, "num_warps": 4, "num_stages": 2, "time_ms": 84.56483459472656, "status": "ok"}
{"N": 262144, "K": 4096, "D": 64, "B": 32, "dtype": "fp16", "BLOCK_N": 64, "BLOCK_K": 128, "num_warps": 4, "num_stages": 4, "time_ms": 135.1321563720703, "status": "ok"}
{"N": 262144, "K": 4096, "D": 64, "B": 32, "dtype": "fp16", "BLOCK_N": 64, "BLOCK_K": 128, "num_warps": 8, "num_stages": 1, "time_ms": 92.48169708251953, "status": "ok"}
{"N": 262144, "K": 4096, "D": 64, "B": 32, "dtype": "fp16", "BLOCK_N": 64, "BLOCK_K": 128, "num_warps": 8, "num_stages": 2, "time_ms": 89.39008331298828, "status": "ok"}
{"N": 262144, "K": 4096, "D": 64, "B": 32, "dtype": "fp16", "BLOCK_N": 64, "BLOCK_K": 128, "num_warps": 8, "num_stages": 4, "time_ms": 107.12560272216797, "status": "ok"}
{"N": 262144, "K": 4096, "D": 64, "B": 32, "dtype": "fp16", "BLOCK_N": 128, "BLOCK_K": 32, "num_warps": 4, "num_stages": 1, "time_ms": 64.05133056640625, "status": "ok"}
{"N": 262144, "K": 4096, "D": 64, "B": 32, "dtype": "fp16", "BLOCK_N": 128, "BLOCK_K": 32, "num_warps": 4, "num_stages": 2, "time_ms": 64.64502716064453, "status": "ok"}
{"N": 262144, "K": 4096, "D": 64, "B": 32, "dtype": "fp16", "BLOCK_N": 128, "BLOCK_K": 32, "num_warps": 4, "num_stages": 4, "time_ms": 68.44207763671875, "status": "ok"}
{"N": 262144, "K": 4096, "D": 64, "B": 32, "dtype": "fp16", "BLOCK_N": 128, "BLOCK_K": 32, "num_warps": 8, "num_stages": 1, "time_ms": 107.2015380859375, "status": "ok"}
{"N": 262144, "K": 4096, "D": 64, "B": 32, "dtype": "fp16", "BLOCK_N": 128, "BLOCK_K": 32, "num_warps": 8, "num_stages": 2, "time_ms": 109.47891235351562, "status": "ok"}
{"N": 262144, "K": 4096, "D": 64, "B": 32, "dtype": "fp16", "BLOCK_N": 128, "BLOCK_K": 32, "num_warps": 8, "num_stages": 4, "time_ms": 108.47452545166016, "status": "ok"}
{"N": 262144, "K": 4096, "D": 64, "B": 32, "dtype": "fp16", "BLOCK_N": 128, "BLOCK_K": 64, "num_warps": 4, "num_stages": 1, "time_ms": 76.07721710205078, "status": "ok"}
{"N": 262144, "K": 4096, "D": 64, "B": 32, "dtype": "fp16", "BLOCK_N": 128, "BLOCK_K": 64, "num_warps": 4, "num_stages": 2, "time_ms": 72.11417388916016, "status": "ok"}
{"N": 262144, "K": 4096, "D": 64, "B": 32, "dtype": "fp16", "BLOCK_N": 128, "BLOCK_K": 64, "num_warps": 4, "num_stages": 4, "time_ms": 75.0745620727539, "status": "ok"}
{"N": 262144, "K": 4096, "D": 64, "B": 32, "dtype": "fp16", "BLOCK_N": 128, "BLOCK_K": 64, "num_warps": 8, "num_stages": 1, "time_ms": 85.08198547363281, "status": "ok"}
{"N": 262144, "K": 4096, "D": 64, "B": 32, "dtype": "fp16", "BLOCK_N": 128, "BLOCK_K": 64, "num_warps": 8, "num_stages": 2, "time_ms": 82.1217269897461, "status": "ok"}
{"N": 262144, "K": 4096, "D": 64, "B": 32, "dtype": "fp16", "BLOCK_N": 128, "BLOCK_K": 64, "num_warps": 8, "num_stages": 4, "time_ms": 79.52460479736328, "status": "ok"}
{"N": 262144, "K": 4096, "D": 64, "B": 32, "dtype": "fp16", "BLOCK_N": 128, "BLOCK_K": 128, "num_warps": 4, "num_stages": 1, "time_ms": 72.80230712890625, "status": "ok"}
{"N": 262144, "K": 4096, "D": 64, "B": 32, "dtype": "fp16", "BLOCK_N": 128, "BLOCK_K": 128, "num_warps": 4, "num_stages": 2, "time_ms": 72.69478607177734, "status": "ok"}
{"N": 262144, "K": 4096, "D": 64, "B": 32, "dtype": "fp16", "BLOCK_N": 128, "BLOCK_K": 128, "num_warps": 4, "num_stages": 4, "time_ms": 96.38607788085938, "status": "ok"}
{"N": 262144, "K": 4096, "D": 64, "B": 32, "dtype": "fp16", "BLOCK_N": 128, "BLOCK_K": 128, "num_warps": 8, "num_stages": 1, "time_ms": 105.81708526611328, "status": "ok"}
{"N": 262144, "K": 4096, "D": 64, "B": 32, "dtype": "fp16", "BLOCK_N": 128, "BLOCK_K": 128, "num_warps": 8, "num_stages": 2, "time_ms": 106.4458236694336, "status": "ok"}
{"N": 262144, "K": 4096, "D": 64, "B": 32, "dtype": "fp16", "BLOCK_N": 128, "BLOCK_K": 128, "num_warps": 8, "num_stages": 4, "time_ms": 99.19795227050781, "status": "ok"}
{"summary": true, "N": 262144, "K": 4096, "D": 64, "B": 32, "dtype": "fp16", "best": {"N": 262144, "K": 4096, "D": 64, "B": 32, "dtype": "fp16", "BLOCK_N": 128, "BLOCK_K": 32, "num_warps": 4, "num_stages": 1, "time_ms": 64.05133056640625, "status": "ok"}, "best_time_ms": 64.05133056640625, "tuning_seconds": 57.21071815490723, "skipped": 0}
