grid_results_gb10/N262144_K256_D64_B1_fp16.jsonl
{"N": 262144, "K": 256, "D": 64, "B": 1, "dtype": "fp16", "BLOCK_N": 32, "BLOCK_K": 32, "num_warps": 4, "num_stages": 1, "time_ms": 0.2842399924993515, "status": "ok"}
{"N": 262144, "K": 256, "D": 64, "B": 1, "dtype": "fp16", "BLOCK_N": 32, "BLOCK_K": 32, "num_warps": 4, "num_stages": 2, "time_ms": 0.31031466523806256, "status": "ok"}
{"N": 262144, "K": 256, "D": 64, "B": 1, "dtype": "fp16", "BLOCK_N": 32, "BLOCK_K": 32, "num_warps": 4, "num_stages": 4, "time_ms": 0.2921706636746724, "status": "ok"}
{"N": 262144, "K": 256, "D": 64, "B": 1, "dtype": "fp16", "BLOCK_N": 32, "BLOCK_K": 32, "num_warps": 8, "num_stages": 1, "time_ms": 0.464383989572525, "status": "ok"}
{"N": 262144, "K": 256, "D": 64, "B": 1, "dtype": "fp16", "BLOCK_N": 32, "BLOCK_K": 32, "num_warps": 8, "num_stages": 2, "time_ms": 0.4782080054283142, "status": "ok"}
{"N": 262144, "K": 256, "D": 64, "B": 1, "dtype": "fp16", "BLOCK_N": 32, "BLOCK_K": 32, "num_warps": 8, "num_stages": 4, "time_ms": 0.5222079753875732, "status": "ok"}
{"N": 262144, "K": 256, "D": 64, "B": 1, "dtype": "fp16", "BLOCK_N": 32, "BLOCK_K": 64, "num_warps": 4, "num_stages": 1, "time_ms": 0.26072532931963605, "status": "ok"}
{"N": 262144, "K": 256, "D": 64, "B": 1, "dtype": "fp16", "BLOCK_N": 32, "BLOCK_K": 64, "num_warps": 4, "num_stages": 2, "time_ms": 0.2607680062452952, "status": "ok"}
{"N": 262144, "K": 256, "D": 64, "B": 1, "dtype": "fp16", "BLOCK_N": 32, "BLOCK_K": 64, "num_warps": 4, "num_stages": 4, "time_ms": 0.3017386694749196, "status": "ok"}
{"N": 262144, "K": 256, "D": 64, "B": 1, "dtype": "fp16", "BLOCK_N": 32, "BLOCK_K": 64, "num_warps": 8, "num_stages": 1, "time_ms": 0.2969599962234497, "status": "ok"}
{"N": 262144, "K": 256, "D": 64, "B": 1, "dtype": "fp16", "BLOCK_N": 32, "BLOCK_K": 64, "num_warps": 8, "num_stages": 2, "time_ms": 0.3007146616776784, "status": "ok"}
{"N": 262144, "K": 256, "D": 64, "B": 1, "dtype": "fp16", "BLOCK_N": 32, "BLOCK_K": 64, "num_warps": 8, "num_stages": 4, "time_ms": 0.32122666637102765, "status": "ok"}
{"N": 262144, "K": 256, "D": 64, "B": 1, "dtype": "fp16", "BLOCK_N": 32, "BLOCK_K": 128, "num_warps": 4, "num_stages": 1, "time_ms": 0.23790933191776276, "status": "ok"}
{"N": 262144, "K": 256, "D": 64, "B": 1, "dtype": "fp16", "BLOCK_N": 32, "BLOCK_K": 128, "num_warps": 4, "num_stages": 2, "time_ms": 0.24916266401608786, "status": "ok"}
{"N": 262144, "K": 256, "D": 64, "B": 1, "dtype": "fp16", "BLOCK_N": 32, "BLOCK_K": 128, "num_warps": 4, "num_stages": 4, "time_ms": 0.5828799903392792, "status": "ok"}
{"N": 262144, "K": 256, "D": 64, "B": 1, "dtype": "fp16", "BLOCK_N": 32, "BLOCK_K": 128, "num_warps": 8, "num_stages": 1, "time_ms": 0.32708799839019775, "status": "ok"}
{"N": 262144, "K": 256, "D": 64, "B": 1, "dtype": "fp16", "BLOCK_N": 32, "BLOCK_K": 128, "num_warps": 8, "num_stages": 2, "time_ms": 0.289792001247406, "status": "ok"}
{"N": 262144, "K": 256, "D": 64, "B": 1, "dtype": "fp16", "BLOCK_N": 32, "BLOCK_K": 128, "num_warps": 8, "num_stages": 4, "time_ms": 0.4833280146121979, "status": "ok"}
{"N": 262144, "K": 256, "D": 64, "B": 1, "dtype": "fp16", "BLOCK_N": 64, "BLOCK_K": 32, "num_warps": 4, "num_stages": 1, "time_ms": 0.2532373269399007, "status": "ok"}
{"N": 262144, "K": 256, "D": 64, "B": 1, "dtype": "fp16", "BLOCK_N": 64, "BLOCK_K": 32, "num_warps": 4, "num_stages": 2, "time_ms": 0.2595626711845398, "status": "ok"}
{"N": 262144, "K": 256, "D": 64, "B": 1, "dtype": "fp16", "BLOCK_N": 64, "BLOCK_K": 32, "num_warps": 4, "num_stages": 4, "time_ms": 0.2553173303604126, "status": "ok"}
{"N": 262144, "K": 256, "D": 64, "B": 1, "dtype": "fp16", "BLOCK_N": 64, "BLOCK_K": 32, "num_warps": 8, "num_stages": 1, "time_ms": 0.2734079957008362, "status": "ok"}
{"N": 262144, "K": 256, "D": 64, "B": 1, "dtype": "fp16", "BLOCK_N": 64, "BLOCK_K": 32, "num_warps": 8, "num_stages": 2, "time_ms": 0.28125866254170734, "status": "ok"}
{"N": 262144, "K": 256, "D": 64, "B": 1, "dtype": "fp16", "BLOCK_N": 64, "BLOCK_K": 32, "num_warps": 8, "num_stages": 4, "time_ms": 0.2802880009015401, "status": "ok"}
{"N": 262144, "K": 256, "D": 64, "B": 1, "dtype": "fp16", "BLOCK_N": 64, "BLOCK_K": 64, "num_warps": 4, "num_stages": 1, "time_ms": 0.2212053338686625, "status": "ok"}
{"N": 262144, "K": 256, "D": 64, "B": 1, "dtype": "fp16", "BLOCK_N": 64, "BLOCK_K": 64, "num_warps": 4, "num_stages": 2, "time_ms": 0.22698666652043661, "status": "ok"}
{"N": 262144, "K": 256, "D": 64, "B": 1, "dtype": "fp16", "BLOCK_N": 64, "BLOCK_K": 64, "num_warps": 4, "num_stages": 4, "time_ms": 0.29147733251253766, "status": "ok"}
{"N": 262144, "K": 256, "D": 64, "B": 1, "dtype": "fp16", "BLOCK_N": 64, "BLOCK_K": 64, "num_warps": 8, "num_stages": 1, "time_ms": 0.258762667576472, "status": "ok"}
{"N": 262144, "K": 256, "D": 64, "B": 1, "dtype": "fp16", "BLOCK_N": 64, "BLOCK_K": 64, "num_warps": 8, "num_stages": 2, "time_ms": 0.2577066620190938, "status": "ok"}
{"N": 262144, "K": 256, "D": 64, "B": 1, "dtype": "fp16", "BLOCK_N": 64, "BLOCK_K": 64, "num_warps": 8, "num_stages": 4, "time_ms": 0.2744320034980774, "status": "ok"}
{"N": 262144, "K": 256, "D": 64, "B": 1, "dtype": "fp16", "BLOCK_N": 64, "BLOCK_K": 128, "num_warps": 4, "num_stages": 1, "time_ms": 0.23449600239594778, "status": "ok"}
{"N": 262144, "K": 256, "D": 64, "B": 1, "dtype": "fp16", "BLOCK_N": 64, "BLOCK_K": 128, "num_warps": 4, "num_stages": 2, "time_ms": 0.24195200204849243, "status": "ok"}
{"N": 262144, "K": 256, "D": 64, "B": 1, "dtype": "fp16", "BLOCK_N": 64, "BLOCK_K": 128, "num_warps": 4, "num_stages": 4, "time_ms": 0.4055679887533188, "status": "ok"}
{"N": 262144, "K": 256, "D": 64, "B": 1, "dtype": "fp16", "BLOCK_N": 64, "BLOCK_K": 128, "num_warps": 8, "num_stages": 1, "time_ms": 0.23587200045585632, "status": "ok"}
{"N": 262144, "K": 256, "D": 64, "B": 1, "dtype": "fp16", "BLOCK_N": 64, "BLOCK_K": 128, "num_warps": 8, "num_stages": 2, "time_ms": 0.24434132874011993, "status": "ok"}
{"N": 262144, "K": 256, "D": 64, "B": 1, "dtype": "fp16", "BLOCK_N": 64, "BLOCK_K": 128, "num_warps": 8, "num_stages": 4, "time_ms": 0.3123199939727783, "status": "ok"}
{"N": 262144, "K": 256, "D": 64, "B": 1, "dtype": "fp16", "BLOCK_N": 128, "BLOCK_K": 32, "num_warps": 4, "num_stages": 1, "time_ms": 0.22510932882626852, "status": "ok"}
{"N": 262144, "K": 256, "D": 64, "B": 1, "dtype": "fp16", "BLOCK_N": 128, "BLOCK_K": 32, "num_warps": 4, "num_stages": 2, "time_ms": 0.23087999721368155, "status": "ok"}
{"N": 262144, "K": 256, "D": 64, "B": 1, "dtype": "fp16", "BLOCK_N": 128, "BLOCK_K": 32, "num_warps": 4, "num_stages": 4, "time_ms": 0.2449386715888977, "status": "ok"}
{"N": 262144, "K": 256, "D": 64, "B": 1, "dtype": "fp16", "BLOCK_N": 128, "BLOCK_K": 32, "num_warps": 8, "num_stages": 1, "time_ms": 0.25736533602078754, "status": "ok"}
{"N": 262144, "K": 256, "D": 64, "B": 1, "dtype": "fp16", "BLOCK_N": 128, "BLOCK_K": 32, "num_warps": 8, "num_stages": 2, "time_ms": 0.26609066128730774, "status": "ok"}
{"N": 262144, "K": 256, "D": 64, "B": 1, "dtype": "fp16", "BLOCK_N": 128, "BLOCK_K": 32, "num_warps": 8, "num_stages": 4, "time_ms": 0.2593493362267812, "status": "ok"}
{"N": 262144, "K": 256, "D": 64, "B": 1, "dtype": "fp16", "BLOCK_N": 128, "BLOCK_K": 64, "num_warps": 4, "num_stages": 1, "time_ms": 0.23244800170262656, "status": "ok"}
{"N": 262144, "K": 256, "D": 64, "B": 1, "dtype": "fp16", "BLOCK_N": 128, "BLOCK_K": 64, "num_warps": 4, "num_stages": 2, "time_ms": 0.22630399465560913, "status": "ok"}
{"N": 262144, "K": 256, "D": 64, "B": 1, "dtype": "fp16", "BLOCK_N": 128, "BLOCK_K": 64, "num_warps": 4, "num_stages": 4, "time_ms": 0.22971733411153158, "status": "ok"}
{"N": 262144, "K": 256, "D": 64, "B": 1, "dtype": "fp16", "BLOCK_N": 128, "BLOCK_K": 64, "num_warps": 8, "num_stages": 1, "time_ms": 0.23589333395163217, "status": "ok"}
{"N": 262144, "K": 256, "D": 64, "B": 1, "dtype": "fp16", "BLOCK_N": 128, "BLOCK_K": 64, "num_warps": 8, "num_stages": 2, "time_ms": 0.24298666417598724, "status": "ok"}
{"N": 262144, "K": 256, "D": 64, "B": 1, "dtype": "fp16", "BLOCK_N": 128, "BLOCK_K": 64, "num_warps": 8, "num_stages": 4, "time_ms": 0.23108266790707907, "status": "ok"}
{"N": 262144, "K": 256, "D": 64, "B": 1, "dtype": "fp16", "BLOCK_N": 128, "BLOCK_K": 128, "num_warps": 4, "num_stages": 1, "time_ms": 0.22905599574247995, "status": "ok"}
{"N": 262144, "K": 256, "D": 64, "B": 1, "dtype": "fp16", "BLOCK_N": 128, "BLOCK_K": 128, "num_warps": 4, "num_stages": 2, "time_ms": 0.2659306675195694, "status": "ok"}
{"N": 262144, "K": 256, "D": 64, "B": 1, "dtype": "fp16", "BLOCK_N": 128, "BLOCK_K": 128, "num_warps": 4, "num_stages": 4, "time_ms": 0.27648000915845233, "status": "ok"}
{"N": 262144, "K": 256, "D": 64, "B": 1, "dtype": "fp16", "BLOCK_N": 128, "BLOCK_K": 128, "num_warps": 8, "num_stages": 1, "time_ms": 0.2706880072752635, "status": "ok"}
{"N": 262144, "K": 256, "D": 64, "B": 1, "dtype": "fp16", "BLOCK_N": 128, "BLOCK_K": 128, "num_warps": 8, "num_stages": 2, "time_ms": 0.28359466791152954, "status": "ok"}
{"N": 262144, "K": 256, "D": 64, "B": 1, "dtype": "fp16", "BLOCK_N": 128, "BLOCK_K": 128, "num_warps": 8, "num_stages": 4, "time_ms": 0.27509333690007526, "status": "ok"}
{"summary": true, "N": 262144, "K": 256, "D": 64, "B": 1, "dtype": "fp16", "best": {"N": 262144, "K": 256, "D": 64, "B": 1, "dtype": "fp16", "BLOCK_N": 64, "BLOCK_K": 64, "num_warps": 4, "num_stages": 1, "time_ms": 0.2212053338686625, "status": "ok"}, "best_time_ms": 0.2212053338686625, "tuning_seconds": 7.935547828674316, "skipped": 0}
