grid_results_gb10/N262144_K256_D64_B32_fp16.jsonl
{"N": 262144, "K": 256, "D": 64, "B": 32, "dtype": "fp16", "BLOCK_N": 32, "BLOCK_K": 32, "num_warps": 4, "num_stages": 1, "time_ms": 8.773504257202148, "status": "ok"}
{"N": 262144, "K": 256, "D": 64, "B": 32, "dtype": "fp16", "BLOCK_N": 32, "BLOCK_K": 32, "num_warps": 4, "num_stages": 2, "time_ms": 8.797247886657715, "status": "ok"}
{"N": 262144, "K": 256, "D": 64, "B": 32, "dtype": "fp16", "BLOCK_N": 32, "BLOCK_K": 32, "num_warps": 4, "num_stages": 4, "time_ms": 9.173664093017578, "status": "ok"}
{"N": 262144, "K": 256, "D": 64, "B": 32, "dtype": "fp16", "BLOCK_N": 32, "BLOCK_K": 32, "num_warps": 8, "num_stages": 1, "time_ms": 14.632960319519043, "status": "ok"}
{"N": 262144, "K": 256, "D": 64, "B": 32, "dtype": "fp16", "BLOCK_N": 32, "BLOCK_K": 32, "num_warps": 8, "num_stages": 2, "time_ms": 15.312895774841309, "status": "ok"}
{"N": 262144, "K": 256, "D": 64, "B": 32, "dtype": "fp16", "BLOCK_N": 32, "BLOCK_K": 32, "num_warps": 8, "num_stages": 4, "time_ms": 15.672320365905762, "status": "ok"}
{"N": 262144, "K": 256, "D": 64, "B": 32, "dtype": "fp16", "BLOCK_N": 32, "BLOCK_K": 64, "num_warps": 4, "num_stages": 1, "time_ms": 8.155967712402344, "status": "ok"}
{"N": 262144, "K": 256, "D": 64, "B": 32, "dtype": "fp16", "BLOCK_N": 32, "BLOCK_K": 64, "num_warps": 4, "num_stages": 2, "time_ms": 7.445536136627197, "status": "ok"}
{"N": 262144, "K": 256, "D": 64, "B": 32, "dtype": "fp16", "BLOCK_N": 32, "BLOCK_K": 64, "num_warps": 4, "num_stages": 4, "time_ms": 8.881152153015137, "status": "ok"}
{"N": 262144, "K": 256, "D": 64, "B": 32, "dtype": "fp16", "BLOCK_N": 32, "BLOCK_K": 64, "num_warps": 8, "num_stages": 1, "time_ms": 9.583711624145508, "status": "ok"}
{"N": 262144, "K": 256, "D": 64, "B": 32, "dtype": "fp16", "BLOCK_N": 32, "BLOCK_K": 64, "num_warps": 8, "num_stages": 2, "time_ms": 9.521151542663574, "status": "ok"}
{"N": 262144, "K": 256, "D": 64, "B": 32, "dtype": "fp16", "BLOCK_N": 32, "BLOCK_K": 64, "num_warps": 8, "num_stages": 4, "time_ms": 9.980928421020508, "status": "ok"}
{"N": 262144, "K": 256, "D": 64, "B": 32, "dtype": "fp16", "BLOCK_N": 32, "BLOCK_K": 128, "num_warps": 4, "num_stages": 1, "time_ms": 7.3471999168396, "status": "ok"}
{"N": 262144, "K": 256, "D": 64, "B": 32, "dtype": "fp16", "BLOCK_N": 32, "BLOCK_K": 128, "num_warps": 4, "num_stages": 2, "time_ms": 7.719840049743652, "status": "ok"}
{"N": 262144, "K": 256, "D": 64, "B": 32, "dtype": "fp16", "BLOCK_N": 32, "BLOCK_K": 128, "num_warps": 4, "num_stages": 4, "time_ms": 15.14793586730957, "status": "ok"}
{"N": 262144, "K": 256, "D": 64, "B": 32, "dtype": "fp16", "BLOCK_N": 32, "BLOCK_K": 128, "num_warps": 8, "num_stages": 1, "time_ms": 8.683520317077637, "status": "ok"}
{"N": 262144, "K": 256, "D": 64, "B": 32, "dtype": "fp16", "BLOCK_N": 32, "BLOCK_K": 128, "num_warps": 8, "num_stages": 2, "time_ms": 8.872960090637207, "status": "ok"}
{"N": 262144, "K": 256, "D": 64, "B": 32, "dtype": "fp16", "BLOCK_N": 32, "BLOCK_K": 128, "num_warps": 8, "num_stages": 4, "time_ms": 16.178144454956055, "status": "ok"}
{"N": 262144, "K": 256, "D": 64, "B": 32, "dtype": "fp16", "BLOCK_N": 64, "BLOCK_K": 32, "num_warps": 4, "num_stages": 1, "time_ms": 7.315487861633301, "status": "ok"}
{"N": 262144, "K": 256, "D": 64, "B": 32, "dtype": "fp16", "BLOCK_N": 64, "BLOCK_K": 32, "num_warps": 4, "num_stages": 2, "time_ms": 7.115776062011719, "status": "ok"}
{"N": 262144, "K": 256, "D": 64, "B": 32, "dtype": "fp16", "BLOCK_N": 64, "BLOCK_K": 32, "num_warps": 4, "num_stages": 4, "time_ms": 6.94268798828125, "status": "ok"}
{"N": 262144, "K": 256, "D": 64, "B": 32, "dtype": "fp16", "BLOCK_N": 64, "BLOCK_K": 32, "num_warps": 8, "num_stages": 1, "time_ms": 8.376319885253906, "status": "ok"}
{"N": 262144, "K": 256, "D": 64, "B": 32, "dtype": "fp16", "BLOCK_N": 64, "BLOCK_K": 32, "num_warps": 8, "num_stages": 2, "time_ms": 8.481823921203613, "status": "ok"}
{"N": 262144, "K": 256, "D": 64, "B": 32, "dtype": "fp16", "BLOCK_N": 64, "BLOCK_K": 32, "num_warps": 8, "num_stages": 4, "time_ms": 8.633343696594238, "status": "ok"}
{"N": 262144, "K": 256, "D": 64, "B": 32, "dtype": "fp16", "BLOCK_N": 64, "BLOCK_K": 64, "num_warps": 4, "num_stages": 1, "time_ms": 6.042623996734619, "status": "ok"}
{"N": 262144, "K": 256, "D": 64, "B": 32, "dtype": "fp16", "BLOCK_N": 64, "BLOCK_K": 64, "num_warps": 4, "num_stages": 2, "time_ms": 5.708799839019775, "status": "ok"}
{"N": 262144, "K": 256, "D": 64, "B": 32, "dtype": "fp16", "BLOCK_N": 64, "BLOCK_K": 64, "num_warps": 4, "num_stages": 4, "time_ms": 8.13161563873291, "status": "ok"}
{"N": 262144, "K": 256, "D": 64, "B": 32, "dtype": "fp16", "BLOCK_N": 64, "BLOCK_K": 64, "num_warps": 8, "num_stages": 1, "time_ms": 7.448575973510742, "status": "ok"}
{"N": 262144, "K": 256, "D": 64, "B": 32, "dtype": "fp16", "BLOCK_N": 64, "BLOCK_K": 64, "num_warps": 8, "num_stages": 2, "time_ms": 8.028160095214844, "status": "ok"}
{"N": 262144, "K": 256, "D": 64, "B": 32, "dtype": "fp16", "BLOCK_N": 64, "BLOCK_K": 64, "num_warps": 8, "num_stages": 4, "time_ms": 8.19001579284668, "status": "ok"}
{"N": 262144, "K": 256, "D": 64, "B": 32, "dtype": "fp16", "BLOCK_N": 64, "BLOCK_K": 128, "num_warps": 4, "num_stages": 1, "time_ms": 5.803008079528809, "status": "ok"}
{"N": 262144, "K": 256, "D": 64, "B": 32, "dtype": "fp16", "BLOCK_N": 64, "BLOCK_K": 128, "num_warps": 4, "num_stages": 2, "time_ms": 6.389887809753418, "status": "ok"}
{"N": 262144, "K": 256, "D": 64, "B": 32, "dtype": "fp16", "BLOCK_N": 64, "BLOCK_K": 128, "num_warps": 4, "num_stages": 4, "time_ms": 12.626943588256836, "status": "ok"}
{"N": 262144, "K": 256, "D": 64, "B": 32, "dtype": "fp16", "BLOCK_N": 64, "BLOCK_K": 128, "num_warps": 8, "num_stages": 1, "time_ms": 7.0830078125, "status": "ok"}
{"N": 262144, "K": 256, "D": 64, "B": 32, "dtype": "fp16", "BLOCK_N": 64, "BLOCK_K": 128, "num_warps": 8, "num_stages": 2, "time_ms": 6.53004789352417, "status": "ok"}
{"N": 262144, "K": 256, "D": 64, "B": 32, "dtype": "fp16", "BLOCK_N": 64, "BLOCK_K": 128, "num_warps": 8, "num_stages": 4, "time_ms": 9.650303840637207, "status": "ok"}
{"N": 262144, "K": 256, "D": 64, "B": 32, "dtype": "fp16", "BLOCK_N": 128, "BLOCK_K": 32, "num_warps": 4, "num_stages": 1, "time_ms": 5.642111778259277, "status": "ok"}
{"N": 262144, "K": 256, "D": 64, "B": 32, "dtype": "fp16", "BLOCK_N": 128, "BLOCK_K": 32, "num_warps": 4, "num_stages": 2, "time_ms": 5.521471977233887, "status": "ok"}
{"N": 262144, "K": 256, "D": 64, "B": 32, "dtype": "fp16", "BLOCK_N": 128, "BLOCK_K": 32, "num_warps": 4, "num_stages": 4, "time_ms": 5.01145601272583, "status": "ok"}
{"N": 262144, "K": 256, "D": 64, "B": 32, "dtype": "fp16", "BLOCK_N": 128, "BLOCK_K": 32, "num_warps": 8, "num_stages": 1, "time_ms": 7.237728118896484, "status": "ok"}
{"N": 262144, "K": 256, "D": 64, "B": 32, "dtype": "fp16", "BLOCK_N": 128, "BLOCK_K": 32, "num_warps": 8, "num_stages": 2, "time_ms": 6.858880043029785, "status": "ok"}
{"N": 262144, "K": 256, "D": 64, "B": 32, "dtype": "fp16", "BLOCK_N": 128, "BLOCK_K": 32, "num_warps": 8, "num_stages": 4, "time_ms": 6.847487926483154, "status": "ok"}
{"N": 262144, "K": 256, "D": 64, "B": 32, "dtype": "fp16", "BLOCK_N": 128, "BLOCK_K": 64, "num_warps": 4, "num_stages": 1, "time_ms": 5.495808124542236, "status": "ok"}
{"N": 262144, "K": 256, "D": 64, "B": 32, "dtype": "fp16", "BLOCK_N": 128, "BLOCK_K": 64, "num_warps": 4, "num_stages": 2, "time_ms": 4.968448162078857, "status": "ok"}
{"N": 262144, "K": 256, "D": 64, "B": 32, "dtype": "fp16", "BLOCK_N": 128, "BLOCK_K": 64, "num_warps": 4, "num_stages": 4, "time_ms": 6.249375820159912, "status": "ok"}
{"N": 262144, "K": 256, "D": 64, "B": 32, "dtype": "fp16", "BLOCK_N": 128, "BLOCK_K": 64, "num_warps": 8, "num_stages": 1, "time_ms": 5.835391998291016, "status": "ok"}
{"N": 262144, "K": 256, "D": 64, "B": 32, "dtype": "fp16", "BLOCK_N": 128, "BLOCK_K": 64, "num_warps": 8, "num_stages": 2, "time_ms": 6.918911933898926, "status": "ok"}
{"N": 262144, "K": 256, "D": 64, "B": 32, "dtype": "fp16", "BLOCK_N": 128, "BLOCK_K": 64, "num_warps": 8, "num_stages": 4, "time_ms": 5.464064121246338, "status": "ok"}
{"N": 262144, "K": 256, "D": 64, "B": 32, "dtype": "fp16", "BLOCK_N": 128, "BLOCK_K": 128, "num_warps": 4, "num_stages": 1, "time_ms": 6.3179521560668945, "status": "ok"}
{"N": 262144, "K": 256, "D": 64, "B": 32, "dtype": "fp16", "BLOCK_N": 128, "BLOCK_K": 128, "num_warps": 4, "num_stages": 2, "time_ms": 5.342207908630371, "status": "ok"}
{"N": 262144, "K": 256, "D": 64, "B": 32, "dtype": "fp16", "BLOCK_N": 128, "BLOCK_K": 128, "num_warps": 4, "num_stages": 4, "time_ms": 7.861055850982666, "status": "ok"}
{"N": 262144, "K": 256, "D": 64, "B": 32, "dtype": "fp16", "BLOCK_N": 128, "BLOCK_K": 128, "num_warps": 8, "num_stages": 1, "time_ms": 8.576000213623047, "status": "ok"}
{"N": 262144, "K": 256, "D": 64, "B": 32, "dtype": "fp16", "BLOCK_N": 128, "BLOCK_K": 128, "num_warps": 8, "num_stages": 2, "time_ms": 8.71241569519043, "status": "ok"}
{"N": 262144, "K": 256, "D": 64, "B": 32, "dtype": "fp16", "BLOCK_N": 128, "BLOCK_K": 128, "num_warps": 8, "num_stages": 4, "time_ms": 8.186079978942871, "status": "ok"}
{"summary": true, "N": 262144, "K": 256, "D": 64, "B": 32, "dtype": "fp16", "best": {"N": 262144, "K": 256, "D": 64, "B": 32, "dtype": "fp16", "BLOCK_N": 128, "BLOCK_K": 64, "num_warps": 4, "num_stages": 2, "time_ms": 4.968448162078857, "status": "ok"}, "best_time_ms": 4.968448162078857, "tuning_seconds": 11.434167623519897, "skipped": 0}
