grid_results_gb10/N262144_K200000_D64_B1_fp16.jsonl
{"N": 262144, "K": 200000, "D": 64, "B": 1, "dtype": "fp16", "BLOCK_N": 32, "BLOCK_K": 32, "num_warps": 4, "num_stages": 1, "time_ms": 217.2569580078125, "status": "ok"}
{"N": 262144, "K": 200000, "D": 64, "B": 1, "dtype": "fp16", "BLOCK_N": 32, "BLOCK_K": 32, "num_warps": 4, "num_stages": 2, "time_ms": 206.81411743164062, "status": "ok"}
{"N": 262144, "K": 200000, "D": 64, "B": 1, "dtype": "fp16", "BLOCK_N": 32, "BLOCK_K": 32, "num_warps": 4, "num_stages": 4, "time_ms": 214.77273559570312, "status": "ok"}
{"N": 262144, "K": 200000, "D": 64, "B": 1, "dtype": "fp16", "BLOCK_N": 32, "BLOCK_K": 32, "num_warps": 8, "num_stages": 1, "time_ms": 362.315673828125, "status": "ok"}
{"N": 262144, "K": 200000, "D": 64, "B": 1, "dtype": "fp16", "BLOCK_N": 32, "BLOCK_K": 32, "num_warps": 8, "num_stages": 2, "time_ms": 362.0997009277344, "status": "ok"}
{"N": 262144, "K": 200000, "D": 64, "B": 1, "dtype": "fp16", "BLOCK_N": 32, "BLOCK_K": 32, "num_warps": 8, "num_stages": 4, "time_ms": 359.40045166015625, "status": "ok"}
{"N": 262144, "K": 200000, "D": 64, "B": 1, "dtype": "fp16", "BLOCK_N": 32, "BLOCK_K": 64, "num_warps": 4, "num_stages": 1, "time_ms": 194.94195556640625, "status": "ok"}
{"N": 262144, "K": 200000, "D": 64, "B": 1, "dtype": "fp16", "BLOCK_N": 32, "BLOCK_K": 64, "num_warps": 4, "num_stages": 2, "time_ms": 181.45074462890625, "status": "ok"}
{"N": 262144, "K": 200000, "D": 64, "B": 1, "dtype": "fp16", "BLOCK_N": 32, "BLOCK_K": 64, "num_warps": 4, "num_stages": 4, "time_ms": 213.25311279296875, "status": "ok"}
{"N": 262144, "K": 200000, "D": 64, "B": 1, "dtype": "fp16", "BLOCK_N": 32, "BLOCK_K": 64, "num_warps": 8, "num_stages": 1, "time_ms": 240.32972717285156, "status": "ok"}
{"N": 262144, "K": 200000, "D": 64, "B": 1, "dtype": "fp16", "BLOCK_N": 32, "BLOCK_K": 64, "num_warps": 8, "num_stages": 2, "time_ms": 230.2750701904297, "status": "ok"}
{"N": 262144, "K": 200000, "D": 64, "B": 1, "dtype": "fp16", "BLOCK_N": 32, "BLOCK_K": 64, "num_warps": 8, "num_stages": 4, "time_ms": 229.7434539794922, "status": "ok"}
{"N": 262144, "K": 200000, "D": 64, "B": 1, "dtype": "fp16", "BLOCK_N": 32, "BLOCK_K": 128, "num_warps": 4, "num_stages": 1, "time_ms": 167.7987823486328, "status": "ok"}
{"N": 262144, "K": 200000, "D": 64, "B": 1, "dtype": "fp16", "BLOCK_N": 32, "BLOCK_K": 128, "num_warps": 4, "num_stages": 2, "time_ms": 167.39768981933594, "status": "ok"}
{"N": 262144, "K": 200000, "D": 64, "B": 1, "dtype": "fp16", "BLOCK_N": 32, "BLOCK_K": 128, "num_warps": 4, "num_stages": 4, "time_ms": 329.0726318359375, "status": "ok"}
{"N": 262144, "K": 200000, "D": 64, "B": 1, "dtype": "fp16", "BLOCK_N": 32, "BLOCK_K": 128, "num_warps": 8, "num_stages": 1, "time_ms": 216.7183380126953, "status": "ok"}
{"N": 262144, "K": 200000, "D": 64, "B": 1, "dtype": "fp16", "BLOCK_N": 32, "BLOCK_K": 128, "num_warps": 8, "num_stages": 2, "time_ms": 211.42527770996094, "status": "ok"}
{"N": 262144, "K": 200000, "D": 64, "B": 1, "dtype": "fp16", "BLOCK_N": 32, "BLOCK_K": 128, "num_warps": 8, "num_stages": 4, "time_ms": 344.2347717285156, "status": "ok"}
{"N": 262144, "K": 200000, "D": 64, "B": 1, "dtype": "fp16", "BLOCK_N": 64, "BLOCK_K": 32, "num_warps": 4, "num_stages": 1, "time_ms": 168.79718017578125, "status": "ok"}
{"N": 262144, "K": 200000, "D": 64, "B": 1, "dtype": "fp16", "BLOCK_N": 64, "BLOCK_K": 32, "num_warps": 4, "num_stages": 2, "time_ms": 164.95718383789062, "status": "ok"}
{"N": 262144, "K": 200000, "D": 64, "B": 1, "dtype": "fp16", "BLOCK_N": 64, "BLOCK_K": 32, "num_warps": 4, "num_stages": 4, "time_ms": 171.68179321289062, "status": "ok"}
{"N": 262144, "K": 200000, "D": 64, "B": 1, "dtype": "fp16", "BLOCK_N": 64, "BLOCK_K": 32, "num_warps": 8, "num_stages": 1, "time_ms": 196.40016174316406, "status": "ok"}
{"N": 262144, "K": 200000, "D": 64, "B": 1, "dtype": "fp16", "BLOCK_N": 64, "BLOCK_K": 32, "num_warps": 8, "num_stages": 2, "time_ms": 208.69223022460938, "status": "ok"}
{"N": 262144, "K": 200000, "D": 64, "B": 1, "dtype": "fp16", "BLOCK_N": 64, "BLOCK_K": 32, "num_warps": 8, "num_stages": 4, "time_ms": 197.94534301757812, "status": "ok"}
{"N": 262144, "K": 200000, "D": 64, "B": 1, "dtype": "fp16", "BLOCK_N": 64, "BLOCK_K": 64, "num_warps": 4, "num_stages": 1, "time_ms": 124.91264343261719, "status": "ok"}
{"N": 262144, "K": 200000, "D": 64, "B": 1, "dtype": "fp16", "BLOCK_N": 64, "BLOCK_K": 64, "num_warps": 4, "num_stages": 2, "time_ms": 165.73849487304688, "status": "ok"}
{"N": 262144, "K": 200000, "D": 64, "B": 1, "dtype": "fp16", "BLOCK_N": 64, "BLOCK_K": 64, "num_warps": 4, "num_stages": 4, "time_ms": 154.1315155029297, "status": "ok"}
{"N": 262144, "K": 200000, "D": 64, "B": 1, "dtype": "fp16", "BLOCK_N": 64, "BLOCK_K": 64, "num_warps": 8, "num_stages": 1, "time_ms": 182.19334411621094, "status": "ok"}
{"N": 262144, "K": 200000, "D": 64, "B": 1, "dtype": "fp16", "BLOCK_N": 64, "BLOCK_K": 64, "num_warps": 8, "num_stages": 2, "time_ms": 181.08522033691406, "status": "ok"}
{"N": 262144, "K": 200000, "D": 64, "B": 1, "dtype": "fp16", "BLOCK_N": 64, "BLOCK_K": 64, "num_warps": 8, "num_stages": 4, "time_ms": 191.63034057617188, "status": "ok"}
{"N": 262144, "K": 200000, "D": 64, "B": 1, "dtype": "fp16", "BLOCK_N": 64, "BLOCK_K": 128, "num_warps": 4, "num_stages": 1, "time_ms": 137.18121337890625, "status": "ok"}
{"N": 262144, "K": 200000, "D": 64, "B": 1, "dtype": "fp16", "BLOCK_N": 64, "BLOCK_K": 128, "num_warps": 4, "num_stages": 2, "time_ms": 131.11276245117188, "status": "ok"}
{"N": 262144, "K": 200000, "D": 64, "B": 1, "dtype": "fp16", "BLOCK_N": 64, "BLOCK_K": 128, "num_warps": 4, "num_stages": 4, "time_ms": 246.91795349121094, "status": "ok"}
{"N": 262144, "K": 200000, "D": 64, "B": 1, "dtype": "fp16", "BLOCK_N": 64, "BLOCK_K": 128, "num_warps": 8, "num_stages": 1, "time_ms": 146.34597778320312, "status": "ok"}
{"N": 262144, "K": 200000, "D": 64, "B": 1, "dtype": "fp16", "BLOCK_N": 64, "BLOCK_K": 128, "num_warps": 8, "num_stages": 2, "time_ms": 143.11846923828125, "status": "ok"}
{"N": 262144, "K": 200000, "D": 64, "B": 1, "dtype": "fp16", "BLOCK_N": 64, "BLOCK_K": 128, "num_warps": 8, "num_stages": 4, "time_ms": 182.27708435058594, "status": "ok"}
{"N": 262144, "K": 200000, "D": 64, "B": 1, "dtype": "fp16", "BLOCK_N": 128, "BLOCK_K": 32, "num_warps": 4, "num_stages": 1, "time_ms": 100.29049682617188, "status": "ok"}
{"N": 262144, "K": 200000, "D": 64, "B": 1, "dtype": "fp16", "BLOCK_N": 128, "BLOCK_K": 32, "num_warps": 4, "num_stages": 2, "time_ms": 118.39794921875, "status": "ok"}
{"N": 262144, "K": 200000, "D": 64, "B": 1, "dtype": "fp16", "BLOCK_N": 128, "BLOCK_K": 32, "num_warps": 4, "num_stages": 4, "time_ms": 121.47305297851562, "status": "ok"}
{"N": 262144, "K": 200000, "D": 64, "B": 1, "dtype": "fp16", "BLOCK_N": 128, "BLOCK_K": 32, "num_warps": 8, "num_stages": 1, "time_ms": 167.70460510253906, "status": "ok"}
{"N": 262144, "K": 200000, "D": 64, "B": 1, "dtype": "fp16", "BLOCK_N": 128, "BLOCK_K": 32, "num_warps": 8, "num_stages": 2, "time_ms": 172.61465454101562, "status": "ok"}
{"N": 262144, "K": 200000, "D": 64, "B": 1, "dtype": "fp16", "BLOCK_N": 128, "BLOCK_K": 32, "num_warps": 8, "num_stages": 4, "time_ms": 165.7354278564453, "status": "ok"}
{"N": 262144, "K": 200000, "D": 64, "B": 1, "dtype": "fp16", "BLOCK_N": 128, "BLOCK_K": 64, "num_warps": 4, "num_stages": 1, "time_ms": 125.71446228027344, "status": "ok"}
{"N": 262144, "K": 200000, "D": 64, "B": 1, "dtype": "fp16", "BLOCK_N": 128, "BLOCK_K": 64, "num_warps": 4, "num_stages": 2, "time_ms": 113.20111846923828, "status": "ok"}
{"N": 262144, "K": 200000, "D": 64, "B": 1, "dtype": "fp16", "BLOCK_N": 128, "BLOCK_K": 64, "num_warps": 4, "num_stages": 4, "time_ms": 127.0179214477539, "status": "ok"}
{"N": 262144, "K": 200000, "D": 64, "B": 1, "dtype": "fp16", "BLOCK_N": 128, "BLOCK_K": 64, "num_warps": 8, "num_stages": 1, "time_ms": 130.56410217285156, "status": "ok"}
{"N": 262144, "K": 200000, "D": 64, "B": 1, "dtype": "fp16", "BLOCK_N": 128, "BLOCK_K": 64, "num_warps": 8, "num_stages": 2, "time_ms": 158.10330200195312, "status": "ok"}
{"N": 262144, "K": 200000, "D": 64, "B": 1, "dtype": "fp16", "BLOCK_N": 128, "BLOCK_K": 64, "num_warps": 8, "num_stages": 4, "time_ms": 121.61945343017578, "status": "ok"}
{"N": 262144, "K": 200000, "D": 64, "B": 1, "dtype": "fp16", "BLOCK_N": 128, "BLOCK_K": 128, "num_warps": 4, "num_stages": 1, "time_ms": 130.2578887939453, "status": "ok"}
{"N": 262144, "K": 200000, "D": 64, "B": 1, "dtype": "fp16", "BLOCK_N": 128, "BLOCK_K": 128, "num_warps": 4, "num_stages": 2, "time_ms": 113.05577850341797, "status": "ok"}
{"N": 262144, "K": 200000, "D": 64, "B": 1, "dtype": "fp16", "BLOCK_N": 128, "BLOCK_K": 128, "num_warps": 4, "num_stages": 4, "time_ms": 163.31890869140625, "status": "ok"}
{"N": 262144, "K": 200000, "D": 64, "B": 1, "dtype": "fp16", "BLOCK_N": 128, "BLOCK_K": 128, "num_warps": 8, "num_stages": 1, "time_ms": 191.01490783691406, "status": "ok"}
{"N": 262144, "K": 200000, "D": 64, "B": 1, "dtype": "fp16", "BLOCK_N": 128, "BLOCK_K": 128, "num_warps": 8, "num_stages": 2, "time_ms": 199.66053771972656, "status": "ok"}
{"N": 262144, "K": 200000, "D": 64, "B": 1, "dtype": "fp16", "BLOCK_N": 128, "BLOCK_K": 128, "num_warps": 8, "num_stages": 4, "time_ms": 159.70407104492188, "status": "ok"}
{"summary": true, "N": 262144, "K": 200000, "D": 64, "B": 1, "dtype": "fp16", "best": {"N": 262144, "K": 200000, "D": 64, "B": 1, "dtype": "fp16", "BLOCK_N": 128, "BLOCK_K": 32, "num_warps": 4, "num_stages": 1, "time_ms": 100.29049682617188, "status": "ok"}, "best_time_ms": 100.29049682617188, "tuning_seconds": 88.81625437736511, "skipped": 0}
