grid_results_gb10/N262144_K65536_D64_B1_fp16.jsonl
{"N": 262144, "K": 65536, "D": 64, "B": 1, "dtype": "fp16", "BLOCK_N": 32, "BLOCK_K": 32, "num_warps": 4, "num_stages": 1, "time_ms": 69.20806121826172, "status": "ok"}
{"N": 262144, "K": 65536, "D": 64, "B": 1, "dtype": "fp16", "BLOCK_N": 32, "BLOCK_K": 32, "num_warps": 4, "num_stages": 2, "time_ms": 66.91840362548828, "status": "ok"}
{"N": 262144, "K": 65536, "D": 64, "B": 1, "dtype": "fp16", "BLOCK_N": 32, "BLOCK_K": 32, "num_warps": 4, "num_stages": 4, "time_ms": 67.94038391113281, "status": "ok"}
{"N": 262144, "K": 65536, "D": 64, "B": 1, "dtype": "fp16", "BLOCK_N": 32, "BLOCK_K": 32, "num_warps": 8, "num_stages": 1, "time_ms": 114.77913665771484, "status": "ok"}
{"N": 262144, "K": 65536, "D": 64, "B": 1, "dtype": "fp16", "BLOCK_N": 32, "BLOCK_K": 32, "num_warps": 8, "num_stages": 2, "time_ms": 116.30694580078125, "status": "ok"}
{"N": 262144, "K": 65536, "D": 64, "B": 1, "dtype": "fp16", "BLOCK_N": 32, "BLOCK_K": 32, "num_warps": 8, "num_stages": 4, "time_ms": 117.39952087402344, "status": "ok"}
{"N": 262144, "K": 65536, "D": 64, "B": 1, "dtype": "fp16", "BLOCK_N": 32, "BLOCK_K": 64, "num_warps": 4, "num_stages": 1, "time_ms": 62.23155212402344, "status": "ok"}
{"N": 262144, "K": 65536, "D": 64, "B": 1, "dtype": "fp16", "BLOCK_N": 32, "BLOCK_K": 64, "num_warps": 4, "num_stages": 2, "time_ms": 59.33961486816406, "status": "ok"}
{"N": 262144, "K": 65536, "D": 64, "B": 1, "dtype": "fp16", "BLOCK_N": 32, "BLOCK_K": 64, "num_warps": 4, "num_stages": 4, "time_ms": 61.58134460449219, "status": "ok"}
{"N": 262144, "K": 65536, "D": 64, "B": 1, "dtype": "fp16", "BLOCK_N": 32, "BLOCK_K": 64, "num_warps": 8, "num_stages": 1, "time_ms": 75.01312255859375, "status": "ok"}
{"N": 262144, "K": 65536, "D": 64, "B": 1, "dtype": "fp16", "BLOCK_N": 32, "BLOCK_K": 64, "num_warps": 8, "num_stages": 2, "time_ms": 71.55302429199219, "status": "ok"}
{"N": 262144, "K": 65536, "D": 64, "B": 1, "dtype": "fp16", "BLOCK_N": 32, "BLOCK_K": 64, "num_warps": 8, "num_stages": 4, "time_ms": 72.82780456542969, "status": "ok"}
{"N": 262144, "K": 65536, "D": 64, "B": 1, "dtype": "fp16", "BLOCK_N": 32, "BLOCK_K": 128, "num_warps": 4, "num_stages": 1, "time_ms": 51.84819030761719, "status": "ok"}
{"N": 262144, "K": 65536, "D": 64, "B": 1, "dtype": "fp16", "BLOCK_N": 32, "BLOCK_K": 128, "num_warps": 4, "num_stages": 2, "time_ms": 53.25312042236328, "status": "ok"}
{"N": 262144, "K": 65536, "D": 64, "B": 1, "dtype": "fp16", "BLOCK_N": 32, "BLOCK_K": 128, "num_warps": 4, "num_stages": 4, "time_ms": 84.48307037353516, "status": "ok"}
{"N": 262144, "K": 65536, "D": 64, "B": 1, "dtype": "fp16", "BLOCK_N": 32, "BLOCK_K": 128, "num_warps": 8, "num_stages": 1, "time_ms": 69.07392120361328, "status": "ok"}
{"N": 262144, "K": 65536, "D": 64, "B": 1, "dtype": "fp16", "BLOCK_N": 32, "BLOCK_K": 128, "num_warps": 8, "num_stages": 2, "time_ms": 64.98303985595703, "status": "ok"}
{"N": 262144, "K": 65536, "D": 64, "B": 1, "dtype": "fp16", "BLOCK_N": 32, "BLOCK_K": 128, "num_warps": 8, "num_stages": 4, "time_ms": 89.25615692138672, "status": "ok"}
{"N": 262144, "K": 65536, "D": 64, "B": 1, "dtype": "fp16", "BLOCK_N": 64, "BLOCK_K": 32, "num_warps": 4, "num_stages": 1, "time_ms": 54.71334457397461, "status": "ok"}
{"N": 262144, "K": 65536, "D": 64, "B": 1, "dtype": "fp16", "BLOCK_N": 64, "BLOCK_K": 32, "num_warps": 4, "num_stages": 2, "time_ms": 52.594688415527344, "status": "ok"}
{"N": 262144, "K": 65536, "D": 64, "B": 1, "dtype": "fp16", "BLOCK_N": 64, "BLOCK_K": 32, "num_warps": 4, "num_stages": 4, "time_ms": 54.43379211425781, "status": "ok"}
{"N": 262144, "K": 65536, "D": 64, "B": 1, "dtype": "fp16", "BLOCK_N": 64, "BLOCK_K": 32, "num_warps": 8, "num_stages": 1, "time_ms": 64.13619232177734, "status": "ok"}
{"N": 262144, "K": 65536, "D": 64, "B": 1, "dtype": "fp16", "BLOCK_N": 64, "BLOCK_K": 32, "num_warps": 8, "num_stages": 2, "time_ms": 65.02297973632812, "status": "ok"}
{"N": 262144, "K": 65536, "D": 64, "B": 1, "dtype": "fp16", "BLOCK_N": 64, "BLOCK_K": 32, "num_warps": 8, "num_stages": 4, "time_ms": 64.16793823242188, "status": "ok"}
{"N": 262144, "K": 65536, "D": 64, "B": 1, "dtype": "fp16", "BLOCK_N": 64, "BLOCK_K": 64, "num_warps": 4, "num_stages": 1, "time_ms": 40.7940788269043, "status": "ok"}
{"N": 262144, "K": 65536, "D": 64, "B": 1, "dtype": "fp16", "BLOCK_N": 64, "BLOCK_K": 64, "num_warps": 4, "num_stages": 2, "time_ms": 40.546302795410156, "status": "ok"}
{"N": 262144, "K": 65536, "D": 64, "B": 1, "dtype": "fp16", "BLOCK_N": 64, "BLOCK_K": 64, "num_warps": 4, "num_stages": 4, "time_ms": 41.84694290161133, "status": "ok"}
{"N": 262144, "K": 65536, "D": 64, "B": 1, "dtype": "fp16", "BLOCK_N": 64, "BLOCK_K": 64, "num_warps": 8, "num_stages": 1, "time_ms": 59.74835205078125, "status": "ok"}
{"N": 262144, "K": 65536, "D": 64, "B": 1, "dtype": "fp16", "BLOCK_N": 64, "BLOCK_K": 64, "num_warps": 8, "num_stages": 2, "time_ms": 56.5247688293457, "status": "ok"}
{"N": 262144, "K": 65536, "D": 64, "B": 1, "dtype": "fp16", "BLOCK_N": 64, "BLOCK_K": 64, "num_warps": 8, "num_stages": 4, "time_ms": 59.6899528503418, "status": "ok"}
{"N": 262144, "K": 65536, "D": 64, "B": 1, "dtype": "fp16", "BLOCK_N": 64, "BLOCK_K": 128, "num_warps": 4, "num_stages": 1, "time_ms": 42.9567985534668, "status": "ok"}
{"N": 262144, "K": 65536, "D": 64, "B": 1, "dtype": "fp16", "BLOCK_N": 64, "BLOCK_K": 128, "num_warps": 4, "num_stages": 2, "time_ms": 40.84124755859375, "status": "ok"}
{"N": 262144, "K": 65536, "D": 64, "B": 1, "dtype": "fp16", "BLOCK_N": 64, "BLOCK_K": 128, "num_warps": 4, "num_stages": 4, "time_ms": 66.30502319335938, "status": "ok"}
{"N": 262144, "K": 65536, "D": 64, "B": 1, "dtype": "fp16", "BLOCK_N": 64, "BLOCK_K": 128, "num_warps": 8, "num_stages": 1, "time_ms": 45.84233474731445, "status": "ok"}
{"N": 262144, "K": 65536, "D": 64, "B": 1, "dtype": "fp16", "BLOCK_N": 64, "BLOCK_K": 128, "num_warps": 8, "num_stages": 2, "time_ms": 44.06777572631836, "status": "ok"}
{"N": 262144, "K": 65536, "D": 64, "B": 1, "dtype": "fp16", "BLOCK_N": 64, "BLOCK_K": 128, "num_warps": 8, "num_stages": 4, "time_ms": 51.013633728027344, "status": "ok"}
{"N": 262144, "K": 65536, "D": 64, "B": 1, "dtype": "fp16", "BLOCK_N": 128, "BLOCK_K": 32, "num_warps": 4, "num_stages": 1, "time_ms": 32.700382232666016, "status": "ok"}
{"N": 262144, "K": 65536, "D": 64, "B": 1, "dtype": "fp16", "BLOCK_N": 128, "BLOCK_K": 32, "num_warps": 4, "num_stages": 2, "time_ms": 32.44630432128906, "status": "ok"}
{"N": 262144, "K": 65536, "D": 64, "B": 1, "dtype": "fp16", "BLOCK_N": 128, "BLOCK_K": 32, "num_warps": 4, "num_stages": 4, "time_ms": 34.43107223510742, "status": "ok"}
{"N": 262144, "K": 65536, "D": 64, "B": 1, "dtype": "fp16", "BLOCK_N": 128, "BLOCK_K": 32, "num_warps": 8, "num_stages": 1, "time_ms": 53.729183197021484, "status": "ok"}
{"N": 262144, "K": 65536, "D": 64, "B": 1, "dtype": "fp16", "BLOCK_N": 128, "BLOCK_K": 32, "num_warps": 8, "num_stages": 2, "time_ms": 54.05593490600586, "status": "ok"}
{"N": 262144, "K": 65536, "D": 64, "B": 1, "dtype": "fp16", "BLOCK_N": 128, "BLOCK_K": 32, "num_warps": 8, "num_stages": 4, "time_ms": 53.82963180541992, "status": "ok"}
{"N": 262144, "K": 65536, "D": 64, "B": 1, "dtype": "fp16", "BLOCK_N": 128, "BLOCK_K": 64, "num_warps": 4, "num_stages": 1, "time_ms": 37.24697494506836, "status": "ok"}
{"N": 262144, "K": 65536, "D": 64, "B": 1, "dtype": "fp16", "BLOCK_N": 128, "BLOCK_K": 64, "num_warps": 4, "num_stages": 2, "time_ms": 35.99465560913086, "status": "ok"}
{"N": 262144, "K": 65536, "D": 64, "B": 1, "dtype": "fp16", "BLOCK_N": 128, "BLOCK_K": 64, "num_warps": 4, "num_stages": 4, "time_ms": 37.00019073486328, "status": "ok"}
{"N": 262144, "K": 65536, "D": 64, "B": 1, "dtype": "fp16", "BLOCK_N": 128, "BLOCK_K": 64, "num_warps": 8, "num_stages": 1, "time_ms": 42.1662712097168, "status": "ok"}
{"N": 262144, "K": 65536, "D": 64, "B": 1, "dtype": "fp16", "BLOCK_N": 128, "BLOCK_K": 64, "num_warps": 8, "num_stages": 2, "time_ms": 42.684417724609375, "status": "ok"}
{"N": 262144, "K": 65536, "D": 64, "B": 1, "dtype": "fp16", "BLOCK_N": 128, "BLOCK_K": 64, "num_warps": 8, "num_stages": 4, "time_ms": 39.35036849975586, "status": "ok"}
{"N": 262144, "K": 65536, "D": 64, "B": 1, "dtype": "fp16", "BLOCK_N": 128, "BLOCK_K": 128, "num_warps": 4, "num_stages": 1, "time_ms": 37.158782958984375, "status": "ok"}
{"N": 262144, "K": 65536, "D": 64, "B": 1, "dtype": "fp16", "BLOCK_N": 128, "BLOCK_K": 128, "num_warps": 4, "num_stages": 2, "time_ms": 36.120574951171875, "status": "ok"}
{"N": 262144, "K": 65536, "D": 64, "B": 1, "dtype": "fp16", "BLOCK_N": 128, "BLOCK_K": 128, "num_warps": 4, "num_stages": 4, "time_ms": 47.388671875, "status": "ok"}
{"N": 262144, "K": 65536, "D": 64, "B": 1, "dtype": "fp16", "BLOCK_N": 128, "BLOCK_K": 128, "num_warps": 8, "num_stages": 1, "time_ms": 53.1486701965332, "status": "ok"}
{"N": 262144, "K": 65536, "D": 64, "B": 1, "dtype": "fp16", "BLOCK_N": 128, "BLOCK_K": 128, "num_warps": 8, "num_stages": 2, "time_ms": 55.15574264526367, "status": "ok"}
{"N": 262144, "K": 65536, "D": 64, "B": 1, "dtype": "fp16", "BLOCK_N": 128, "BLOCK_K": 128, "num_warps": 8, "num_stages": 4, "time_ms": 49.924095153808594, "status": "ok"}
{"summary": true, "N": 262144, "K": 65536, "D": 64, "B": 1, "dtype": "fp16", "best": {"N": 262144, "K": 65536, "D": 64, "B": 1, "dtype": "fp16", "BLOCK_N": 128, "BLOCK_K": 32, "num_warps": 4, "num_stages": 2, "time_ms": 32.44630432128906, "status": "ok"}, "best_time_ms": 32.44630432128906, "tuning_seconds": 32.170164585113525, "skipped": 0}
