grid_results_gb10/N262144_K4096_D64_B1_fp16.jsonl
{"N": 262144, "K": 4096, "D": 64, "B": 1, "dtype": "fp16", "BLOCK_N": 32, "BLOCK_K": 32, "num_warps": 4, "num_stages": 1, "time_ms": 4.093952178955078, "status": "ok"}
{"N": 262144, "K": 4096, "D": 64, "B": 1, "dtype": "fp16", "BLOCK_N": 32, "BLOCK_K": 32, "num_warps": 4, "num_stages": 2, "time_ms": 4.059167861938477, "status": "ok"}
{"N": 262144, "K": 4096, "D": 64, "B": 1, "dtype": "fp16", "BLOCK_N": 32, "BLOCK_K": 32, "num_warps": 4, "num_stages": 4, "time_ms": 3.9823360443115234, "status": "ok"}
{"N": 262144, "K": 4096, "D": 64, "B": 1, "dtype": "fp16", "BLOCK_N": 32, "BLOCK_K": 32, "num_warps": 8, "num_stages": 1, "time_ms": 7.208479881286621, "status": "ok"}
{"N": 262144, "K": 4096, "D": 64, "B": 1, "dtype": "fp16", "BLOCK_N": 32, "BLOCK_K": 32, "num_warps": 8, "num_stages": 2, "time_ms": 7.358496189117432, "status": "ok"}
{"N": 262144, "K": 4096, "D": 64, "B": 1, "dtype": "fp16", "BLOCK_N": 32, "BLOCK_K": 32, "num_warps": 8, "num_stages": 4, "time_ms": 7.187456130981445, "status": "ok"}
{"N": 262144, "K": 4096, "D": 64, "B": 1, "dtype": "fp16", "BLOCK_N": 32, "BLOCK_K": 64, "num_warps": 4, "num_stages": 1, "time_ms": 3.6362240314483643, "status": "ok"}
{"N": 262144, "K": 4096, "D": 64, "B": 1, "dtype": "fp16", "BLOCK_N": 32, "BLOCK_K": 64, "num_warps": 4, "num_stages": 2, "time_ms": 3.5288000106811523, "status": "ok"}
{"N": 262144, "K": 4096, "D": 64, "B": 1, "dtype": "fp16", "BLOCK_N": 32, "BLOCK_K": 64, "num_warps": 4, "num_stages": 4, "time_ms": 4.194975852966309, "status": "ok"}
{"N": 262144, "K": 4096, "D": 64, "B": 1, "dtype": "fp16", "BLOCK_N": 32, "BLOCK_K": 64, "num_warps": 8, "num_stages": 1, "time_ms": 4.744095802307129, "status": "ok"}
{"N": 262144, "K": 4096, "D": 64, "B": 1, "dtype": "fp16", "BLOCK_N": 32, "BLOCK_K": 64, "num_warps": 8, "num_stages": 2, "time_ms": 4.204512119293213, "status": "ok"}
{"N": 262144, "K": 4096, "D": 64, "B": 1, "dtype": "fp16", "BLOCK_N": 32, "BLOCK_K": 64, "num_warps": 8, "num_stages": 4, "time_ms": 4.254720211029053, "status": "ok"}
{"N": 262144, "K": 4096, "D": 64, "B": 1, "dtype": "fp16", "BLOCK_N": 32, "BLOCK_K": 128, "num_warps": 4, "num_stages": 1, "time_ms": 3.0166399478912354, "status": "ok"}
{"N": 262144, "K": 4096, "D": 64, "B": 1, "dtype": "fp16", "BLOCK_N": 32, "BLOCK_K": 128, "num_warps": 4, "num_stages": 2, "time_ms": 3.2811200618743896, "status": "ok"}
{"N": 262144, "K": 4096, "D": 64, "B": 1, "dtype": "fp16", "BLOCK_N": 32, "BLOCK_K": 128, "num_warps": 4, "num_stages": 4, "time_ms": 5.121119976043701, "status": "ok"}
{"N": 262144, "K": 4096, "D": 64, "B": 1, "dtype": "fp16", "BLOCK_N": 32, "BLOCK_K": 128, "num_warps": 8, "num_stages": 1, "time_ms": 4.0562238693237305, "status": "ok"}
{"N": 262144, "K": 4096, "D": 64, "B": 1, "dtype": "fp16", "BLOCK_N": 32, "BLOCK_K": 128, "num_warps": 8, "num_stages": 2, "time_ms": 3.7806079387664795, "status": "ok"}
{"N": 262144, "K": 4096, "D": 64, "B": 1, "dtype": "fp16", "BLOCK_N": 32, "BLOCK_K": 128, "num_warps": 8, "num_stages": 4, "time_ms": 5.470208168029785, "status": "ok"}
{"N": 262144, "K": 4096, "D": 64, "B": 1, "dtype": "fp16", "BLOCK_N": 64, "BLOCK_K": 32, "num_warps": 4, "num_stages": 1, "time_ms": 3.2081921100616455, "status": "ok"}
{"N": 262144, "K": 4096, "D": 64, "B": 1, "dtype": "fp16", "BLOCK_N": 64, "BLOCK_K": 32, "num_warps": 4, "num_stages": 2, "time_ms": 3.3979198932647705, "status": "ok"}
{"N": 262144, "K": 4096, "D": 64, "B": 1, "dtype": "fp16", "BLOCK_N": 64, "BLOCK_K": 32, "num_warps": 4, "num_stages": 4, "time_ms": 3.1784958839416504, "status": "ok"}
{"N": 262144, "K": 4096, "D": 64, "B": 1, "dtype": "fp16", "BLOCK_N": 64, "BLOCK_K": 32, "num_warps": 8, "num_stages": 1, "time_ms": 3.8861119747161865, "status": "ok"}
{"N": 262144, "K": 4096, "D": 64, "B": 1, "dtype": "fp16", "BLOCK_N": 64, "BLOCK_K": 32, "num_warps": 8, "num_stages": 2, "time_ms": 3.9657280445098877, "status": "ok"}
{"N": 262144, "K": 4096, "D": 64, "B": 1, "dtype": "fp16", "BLOCK_N": 64, "BLOCK_K": 32, "num_warps": 8, "num_stages": 4, "time_ms": 3.857408046722412, "status": "ok"}
{"N": 262144, "K": 4096, "D": 64, "B": 1, "dtype": "fp16", "BLOCK_N": 64, "BLOCK_K": 64, "num_warps": 4, "num_stages": 1, "time_ms": 2.440959930419922, "status": "ok"}
{"N": 262144, "K": 4096, "D": 64, "B": 1, "dtype": "fp16", "BLOCK_N": 64, "BLOCK_K": 64, "num_warps": 4, "num_stages": 2, "time_ms": 2.3347198963165283, "status": "ok"}
{"N": 262144, "K": 4096, "D": 64, "B": 1, "dtype": "fp16", "BLOCK_N": 64, "BLOCK_K": 64, "num_warps": 4, "num_stages": 4, "time_ms": 2.572160005569458, "status": "ok"}
{"N": 262144, "K": 4096, "D": 64, "B": 1, "dtype": "fp16", "BLOCK_N": 64, "BLOCK_K": 64, "num_warps": 8, "num_stages": 1, "time_ms": 3.496959924697876, "status": "ok"}
{"N": 262144, "K": 4096, "D": 64, "B": 1, "dtype": "fp16", "BLOCK_N": 64, "BLOCK_K": 64, "num_warps": 8, "num_stages": 2, "time_ms": 3.8417279720306396, "status": "ok"}
{"N": 262144, "K": 4096, "D": 64, "B": 1, "dtype": "fp16", "BLOCK_N": 64, "BLOCK_K": 64, "num_warps": 8, "num_stages": 4, "time_ms": 3.5194880962371826, "status": "ok"}
{"N": 262144, "K": 4096, "D": 64, "B": 1, "dtype": "fp16", "BLOCK_N": 64, "BLOCK_K": 128, "num_warps": 4, "num_stages": 1, "time_ms": 2.495487928390503, "status": "ok"}
{"N": 262144, "K": 4096, "D": 64, "B": 1, "dtype": "fp16", "BLOCK_N": 64, "BLOCK_K": 128, "num_warps": 4, "num_stages": 2, "time_ms": 2.446176052093506, "status": "ok"}
{"N": 262144, "K": 4096, "D": 64, "B": 1, "dtype": "fp16", "BLOCK_N": 64, "BLOCK_K": 128, "num_warps": 4, "num_stages": 4, "time_ms": 4.100096225738525, "status": "ok"}
{"N": 262144, "K": 4096, "D": 64, "B": 1, "dtype": "fp16", "BLOCK_N": 64, "BLOCK_K": 128, "num_warps": 8, "num_stages": 1, "time_ms": 2.6961920261383057, "status": "ok"}
{"N": 262144, "K": 4096, "D": 64, "B": 1, "dtype": "fp16", "BLOCK_N": 64, "BLOCK_K": 128, "num_warps": 8, "num_stages": 2, "time_ms": 2.605504035949707, "status": "ok"}
{"N": 262144, "K": 4096, "D": 64, "B": 1, "dtype": "fp16", "BLOCK_N": 64, "BLOCK_K": 128, "num_warps": 8, "num_stages": 4, "time_ms": 3.580575942993164, "status": "ok"}
{"N": 262144, "K": 4096, "D": 64, "B": 1, "dtype": "fp16", "BLOCK_N": 128, "BLOCK_K": 32, "num_warps": 4, "num_stages": 1, "time_ms": 1.8775360584259033, "status": "ok"}
{"N": 262144, "K": 4096, "D": 64, "B": 1, "dtype": "fp16", "BLOCK_N": 128, "BLOCK_K": 32, "num_warps": 4, "num_stages": 2, "time_ms": 1.9145599603652954, "status": "ok"}
{"N": 262144, "K": 4096, "D": 64, "B": 1, "dtype": "fp16", "BLOCK_N": 128, "BLOCK_K": 32, "num_warps": 4, "num_stages": 4, "time_ms": 1.9640640020370483, "status": "ok"}
{"N": 262144, "K": 4096, "D": 64, "B": 1, "dtype": "fp16", "BLOCK_N": 128, "BLOCK_K": 32, "num_warps": 8, "num_stages": 1, "time_ms": 3.1784958839416504, "status": "ok"}
{"N": 262144, "K": 4096, "D": 64, "B": 1, "dtype": "fp16", "BLOCK_N": 128, "BLOCK_K": 32, "num_warps": 8, "num_stages": 2, "time_ms": 3.34335994720459, "status": "ok"}
{"N": 262144, "K": 4096, "D": 64, "B": 1, "dtype": "fp16", "BLOCK_N": 128, "BLOCK_K": 32, "num_warps": 8, "num_stages": 4, "time_ms": 3.1825599670410156, "status": "ok"}
{"N": 262144, "K": 4096, "D": 64, "B": 1, "dtype": "fp16", "BLOCK_N": 128, "BLOCK_K": 64, "num_warps": 4, "num_stages": 1, "time_ms": 2.261023998260498, "status": "ok"}
{"N": 262144, "K": 4096, "D": 64, "B": 1, "dtype": "fp16", "BLOCK_N": 128, "BLOCK_K": 64, "num_warps": 4, "num_stages": 2, "time_ms": 2.155872106552124, "status": "ok"}
{"N": 262144, "K": 4096, "D": 64, "B": 1, "dtype": "fp16", "BLOCK_N": 128, "BLOCK_K": 64, "num_warps": 4, "num_stages": 4, "time_ms": 2.1883199214935303, "status": "ok"}
{"N": 262144, "K": 4096, "D": 64, "B": 1, "dtype": "fp16", "BLOCK_N": 128, "BLOCK_K": 64, "num_warps": 8, "num_stages": 1, "time_ms": 2.529088020324707, "status": "ok"}
{"N": 262144, "K": 4096, "D": 64, "B": 1, "dtype": "fp16", "BLOCK_N": 128, "BLOCK_K": 64, "num_warps": 8, "num_stages": 2, "time_ms": 2.7631680965423584, "status": "ok"}
{"N": 262144, "K": 4096, "D": 64, "B": 1, "dtype": "fp16", "BLOCK_N": 128, "BLOCK_K": 64, "num_warps": 8, "num_stages": 4, "time_ms": 2.302112102508545, "status": "ok"}
{"N": 262144, "K": 4096, "D": 64, "B": 1, "dtype": "fp16", "BLOCK_N": 128, "BLOCK_K": 128, "num_warps": 4, "num_stages": 1, "time_ms": 2.384160041809082, "status": "ok"}
{"N": 262144, "K": 4096, "D": 64, "B": 1, "dtype": "fp16", "BLOCK_N": 128, "BLOCK_K": 128, "num_warps": 4, "num_stages": 2, "time_ms": 2.4402239322662354, "status": "ok"}
{"N": 262144, "K": 4096, "D": 64, "B": 1, "dtype": "fp16", "BLOCK_N": 128, "BLOCK_K": 128, "num_warps": 4, "num_stages": 4, "time_ms": 3.123647928237915, "status": "ok"}
{"N": 262144, "K": 4096, "D": 64, "B": 1, "dtype": "fp16", "BLOCK_N": 128, "BLOCK_K": 128, "num_warps": 8, "num_stages": 1, "time_ms": 3.270656108856201, "status": "ok"}
{"N": 262144, "K": 4096, "D": 64, "B": 1, "dtype": "fp16", "BLOCK_N": 128, "BLOCK_K": 128, "num_warps": 8, "num_stages": 2, "time_ms": 3.4119999408721924, "status": "ok"}
{"N": 262144, "K": 4096, "D": 64, "B": 1, "dtype": "fp16", "BLOCK_N": 128, "BLOCK_K": 128, "num_warps": 8, "num_stages": 4, "time_ms": 3.028991937637329, "status": "ok"}
{"summary": true, "N": 262144, "K": 4096, "D": 64, "B": 1, "dtype": "fp16", "best": {"N": 262144, "K": 4096, "D": 64, "B": 1, "dtype": "fp16", "BLOCK_N": 128, "BLOCK_K": 32, "num_warps": 4, "num_stages": 1, "time_ms": 1.8775360584259033, "status": "ok"}, "best_time_ms": 1.8775360584259033, "tuning_seconds": 9.122329473495483, "skipped": 0}
