grid_results_gb10/N262144_K1024_D64_B1_fp16.jsonl
{"N": 262144, "K": 1024, "D": 64, "B": 1, "dtype": "fp16", "BLOCK_N": 32, "BLOCK_K": 32, "num_warps": 4, "num_stages": 1, "time_ms": 1.0444799661636353, "status": "ok"}
{"N": 262144, "K": 1024, "D": 64, "B": 1, "dtype": "fp16", "BLOCK_N": 32, "BLOCK_K": 32, "num_warps": 4, "num_stages": 2, "time_ms": 1.0117119550704956, "status": "ok"}
{"N": 262144, "K": 1024, "D": 64, "B": 1, "dtype": "fp16", "BLOCK_N": 32, "BLOCK_K": 32, "num_warps": 4, "num_stages": 4, "time_ms": 1.0209280252456665, "status": "ok"}
{"N": 262144, "K": 1024, "D": 64, "B": 1, "dtype": "fp16", "BLOCK_N": 32, "BLOCK_K": 32, "num_warps": 8, "num_stages": 1, "time_ms": 1.7685439586639404, "status": "ok"}
{"N": 262144, "K": 1024, "D": 64, "B": 1, "dtype": "fp16", "BLOCK_N": 32, "BLOCK_K": 32, "num_warps": 8, "num_stages": 2, "time_ms": 1.8083839416503906, "status": "ok"}
{"N": 262144, "K": 1024, "D": 64, "B": 1, "dtype": "fp16", "BLOCK_N": 32, "BLOCK_K": 32, "num_warps": 8, "num_stages": 4, "time_ms": 1.8186240196228027, "status": "ok"}
{"N": 262144, "K": 1024, "D": 64, "B": 1, "dtype": "fp16", "BLOCK_N": 32, "BLOCK_K": 64, "num_warps": 4, "num_stages": 1, "time_ms": 0.9323520064353943, "status": "ok"}
{"N": 262144, "K": 1024, "D": 64, "B": 1, "dtype": "fp16", "BLOCK_N": 32, "BLOCK_K": 64, "num_warps": 4, "num_stages": 2, "time_ms": 0.8760319948196411, "status": "ok"}
{"N": 262144, "K": 1024, "D": 64, "B": 1, "dtype": "fp16", "BLOCK_N": 32, "BLOCK_K": 64, "num_warps": 4, "num_stages": 4, "time_ms": 1.0007039904594421, "status": "ok"}
{"N": 262144, "K": 1024, "D": 64, "B": 1, "dtype": "fp16", "BLOCK_N": 32, "BLOCK_K": 64, "num_warps": 8, "num_stages": 1, "time_ms": 1.210319995880127, "status": "ok"}
{"N": 262144, "K": 1024, "D": 64, "B": 1, "dtype": "fp16", "BLOCK_N": 32, "BLOCK_K": 64, "num_warps": 8, "num_stages": 2, "time_ms": 1.075215995311737, "status": "ok"}
{"N": 262144, "K": 1024, "D": 64, "B": 1, "dtype": "fp16", "BLOCK_N": 32, "BLOCK_K": 64, "num_warps": 8, "num_stages": 4, "time_ms": 1.1002880334854126, "status": "ok"}
{"N": 262144, "K": 1024, "D": 64, "B": 1, "dtype": "fp16", "BLOCK_N": 32, "BLOCK_K": 128, "num_warps": 4, "num_stages": 1, "time_ms": 0.78438401222229, "status": "ok"}
{"N": 262144, "K": 1024, "D": 64, "B": 1, "dtype": "fp16", "BLOCK_N": 32, "BLOCK_K": 128, "num_warps": 4, "num_stages": 2, "time_ms": 0.7648800015449524, "status": "ok"}
{"N": 262144, "K": 1024, "D": 64, "B": 1, "dtype": "fp16", "BLOCK_N": 32, "BLOCK_K": 128, "num_warps": 4, "num_stages": 4, "time_ms": 1.3803520202636719, "status": "ok"}
{"N": 262144, "K": 1024, "D": 64, "B": 1, "dtype": "fp16", "BLOCK_N": 32, "BLOCK_K": 128, "num_warps": 8, "num_stages": 1, "time_ms": 1.2092959880828857, "status": "ok"}
{"N": 262144, "K": 1024, "D": 64, "B": 1, "dtype": "fp16", "BLOCK_N": 32, "BLOCK_K": 128, "num_warps": 8, "num_stages": 2, "time_ms": 0.9793919920921326, "status": "ok"}
{"N": 262144, "K": 1024, "D": 64, "B": 1, "dtype": "fp16", "BLOCK_N": 32, "BLOCK_K": 128, "num_warps": 8, "num_stages": 4, "time_ms": 1.4111679792404175, "status": "ok"}
{"N": 262144, "K": 1024, "D": 64, "B": 1, "dtype": "fp16", "BLOCK_N": 64, "BLOCK_K": 32, "num_warps": 4, "num_stages": 1, "time_ms": 0.9296480417251587, "status": "ok"}
{"N": 262144, "K": 1024, "D": 64, "B": 1, "dtype": "fp16", "BLOCK_N": 64, "BLOCK_K": 32, "num_warps": 4, "num_stages": 2, "time_ms": 0.8077600002288818, "status": "ok"}
{"N": 262144, "K": 1024, "D": 64, "B": 1, "dtype": "fp16", "BLOCK_N": 64, "BLOCK_K": 32, "num_warps": 4, "num_stages": 4, "time_ms": 0.8253600001335144, "status": "ok"}
{"N": 262144, "K": 1024, "D": 64, "B": 1, "dtype": "fp16", "BLOCK_N": 64, "BLOCK_K": 32, "num_warps": 8, "num_stages": 1, "time_ms": 0.9584960043430328, "status": "ok"}
{"N": 262144, "K": 1024, "D": 64, "B": 1, "dtype": "fp16", "BLOCK_N": 64, "BLOCK_K": 32, "num_warps": 8, "num_stages": 2, "time_ms": 0.9912799894809723, "status": "ok"}
{"N": 262144, "K": 1024, "D": 64, "B": 1, "dtype": "fp16", "BLOCK_N": 64, "BLOCK_K": 32, "num_warps": 8, "num_stages": 4, "time_ms": 0.9876480102539062, "status": "ok"}
{"N": 262144, "K": 1024, "D": 64, "B": 1, "dtype": "fp16", "BLOCK_N": 64, "BLOCK_K": 64, "num_warps": 4, "num_stages": 1, "time_ms": 0.6113280057907104, "status": "ok"}
{"N": 262144, "K": 1024, "D": 64, "B": 1, "dtype": "fp16", "BLOCK_N": 64, "BLOCK_K": 64, "num_warps": 4, "num_stages": 2, "time_ms": 0.6779039800167084, "status": "ok"}
{"N": 262144, "K": 1024, "D": 64, "B": 1, "dtype": "fp16", "BLOCK_N": 64, "BLOCK_K": 64, "num_warps": 4, "num_stages": 4, "time_ms": 0.6947839856147766, "status": "ok"}
{"N": 262144, "K": 1024, "D": 64, "B": 1, "dtype": "fp16", "BLOCK_N": 64, "BLOCK_K": 64, "num_warps": 8, "num_stages": 1, "time_ms": 0.9022240042686462, "status": "ok"}
{"N": 262144, "K": 1024, "D": 64, "B": 1, "dtype": "fp16", "BLOCK_N": 64, "BLOCK_K": 64, "num_warps": 8, "num_stages": 2, "time_ms": 0.8627200126647949, "status": "ok"}
{"N": 262144, "K": 1024, "D": 64, "B": 1, "dtype": "fp16", "BLOCK_N": 64, "BLOCK_K": 64, "num_warps": 8, "num_stages": 4, "time_ms": 0.9851039946079254, "status": "ok"}
{"N": 262144, "K": 1024, "D": 64, "B": 1, "dtype": "fp16", "BLOCK_N": 64, "BLOCK_K": 128, "num_warps": 4, "num_stages": 1, "time_ms": 0.6599679887294769, "status": "ok"}
{"N": 262144, "K": 1024, "D": 64, "B": 1, "dtype": "fp16", "BLOCK_N": 64, "BLOCK_K": 128, "num_warps": 4, "num_stages": 2, "time_ms": 0.6440480053424835, "status": "ok"}
{"N": 262144, "K": 1024, "D": 64, "B": 1, "dtype": "fp16", "BLOCK_N": 64, "BLOCK_K": 128, "num_warps": 4, "num_stages": 4, "time_ms": 1.104383945465088, "status": "ok"}
{"N": 262144, "K": 1024, "D": 64, "B": 1, "dtype": "fp16", "BLOCK_N": 64, "BLOCK_K": 128, "num_warps": 8, "num_stages": 1, "time_ms": 0.7080959975719452, "status": "ok"}
{"N": 262144, "K": 1024, "D": 64, "B": 1, "dtype": "fp16", "BLOCK_N": 64, "BLOCK_K": 128, "num_warps": 8, "num_stages": 2, "time_ms": 0.7866399884223938, "status": "ok"}
{"N": 262144, "K": 1024, "D": 64, "B": 1, "dtype": "fp16", "BLOCK_N": 64, "BLOCK_K": 128, "num_warps": 8, "num_stages": 4, "time_ms": 0.8764640092849731, "status": "ok"}
{"N": 262144, "K": 1024, "D": 64, "B": 1, "dtype": "fp16", "BLOCK_N": 128, "BLOCK_K": 32, "num_warps": 4, "num_stages": 1, "time_ms": 0.5138079822063446, "status": "ok"}
{"N": 262144, "K": 1024, "D": 64, "B": 1, "dtype": "fp16", "BLOCK_N": 128, "BLOCK_K": 32, "num_warps": 4, "num_stages": 2, "time_ms": 0.5301759839057922, "status": "ok"}
{"N": 262144, "K": 1024, "D": 64, "B": 1, "dtype": "fp16", "BLOCK_N": 128, "BLOCK_K": 32, "num_warps": 4, "num_stages": 4, "time_ms": 0.5401600003242493, "status": "ok"}
{"N": 262144, "K": 1024, "D": 64, "B": 1, "dtype": "fp16", "BLOCK_N": 128, "BLOCK_K": 32, "num_warps": 8, "num_stages": 1, "time_ms": 0.8278239965438843, "status": "ok"}
{"N": 262144, "K": 1024, "D": 64, "B": 1, "dtype": "fp16", "BLOCK_N": 128, "BLOCK_K": 32, "num_warps": 8, "num_stages": 2, "time_ms": 0.8453119993209839, "status": "ok"}
{"N": 262144, "K": 1024, "D": 64, "B": 1, "dtype": "fp16", "BLOCK_N": 128, "BLOCK_K": 32, "num_warps": 8, "num_stages": 4, "time_ms": 0.8751040101051331, "status": "ok"}
{"N": 262144, "K": 1024, "D": 64, "B": 1, "dtype": "fp16", "BLOCK_N": 128, "BLOCK_K": 64, "num_warps": 4, "num_stages": 1, "time_ms": 0.6082559823989868, "status": "ok"}
{"N": 262144, "K": 1024, "D": 64, "B": 1, "dtype": "fp16", "BLOCK_N": 128, "BLOCK_K": 64, "num_warps": 4, "num_stages": 2, "time_ms": 0.565856009721756, "status": "ok"}
{"N": 262144, "K": 1024, "D": 64, "B": 1, "dtype": "fp16", "BLOCK_N": 128, "BLOCK_K": 64, "num_warps": 4, "num_stages": 4, "time_ms": 0.5934399962425232, "status": "ok"}
{"N": 262144, "K": 1024, "D": 64, "B": 1, "dtype": "fp16", "BLOCK_N": 128, "BLOCK_K": 64, "num_warps": 8, "num_stages": 1, "time_ms": 0.7489759922027588, "status": "ok"}
{"N": 262144, "K": 1024, "D": 64, "B": 1, "dtype": "fp16", "BLOCK_N": 128, "BLOCK_K": 64, "num_warps": 8, "num_stages": 2, "time_ms": 0.6558879911899567, "status": "ok"}
{"N": 262144, "K": 1024, "D": 64, "B": 1, "dtype": "fp16", "BLOCK_N": 128, "BLOCK_K": 64, "num_warps": 8, "num_stages": 4, "time_ms": 0.612496018409729, "status": "ok"}
{"N": 262144, "K": 1024, "D": 64, "B": 1, "dtype": "fp16", "BLOCK_N": 128, "BLOCK_K": 128, "num_warps": 4, "num_stages": 1, "time_ms": 0.6026239991188049, "status": "ok"}
{"N": 262144, "K": 1024, "D": 64, "B": 1, "dtype": "fp16", "BLOCK_N": 128, "BLOCK_K": 128, "num_warps": 4, "num_stages": 2, "time_ms": 0.5842080116271973, "status": "ok"}
{"N": 262144, "K": 1024, "D": 64, "B": 1, "dtype": "fp16", "BLOCK_N": 128, "BLOCK_K": 128, "num_warps": 4, "num_stages": 4, "time_ms": 0.796095997095108, "status": "ok"}
{"N": 262144, "K": 1024, "D": 64, "B": 1, "dtype": "fp16", "BLOCK_N": 128, "BLOCK_K": 128, "num_warps": 8, "num_stages": 1, "time_ms": 0.9486719965934753, "status": "ok"}
{"N": 262144, "K": 1024, "D": 64, "B": 1, "dtype": "fp16", "BLOCK_N": 128, "BLOCK_K": 128, "num_warps": 8, "num_stages": 2, "time_ms": 0.8842720091342926, "status": "ok"}
{"N": 262144, "K": 1024, "D": 64, "B": 1, "dtype": "fp16", "BLOCK_N": 128, "BLOCK_K": 128, "num_warps": 8, "num_stages": 4, "time_ms": 0.8171520233154297, "status": "ok"}
{"summary": true, "N": 262144, "K": 1024, "D": 64, "B": 1, "dtype": "fp16", "best": {"N": 262144, "K": 1024, "D": 64, "B": 1, "dtype": "fp16", "BLOCK_N": 128, "BLOCK_K": 32, "num_warps": 4, "num_stages": 1, "time_ms": 0.5138079822063446, "status": "ok"}, "best_time_ms": 0.5138079822063446, "tuning_seconds": 8.122350215911865, "skipped": 0}
