grid_results_gb10/N65536_K16384_D64_B1_fp16.jsonl
{"N": 65536, "K": 16384, "D": 64, "B": 1, "dtype": "fp16", "BLOCK_N": 32, "BLOCK_K": 32, "num_warps": 4, "num_stages": 1, "time_ms": 4.472832202911377, "status": "ok"}
{"N": 65536, "K": 16384, "D": 64, "B": 1, "dtype": "fp16", "BLOCK_N": 32, "BLOCK_K": 32, "num_warps": 4, "num_stages": 2, "time_ms": 4.109504222869873, "status": "ok"}
{"N": 65536, "K": 16384, "D": 64, "B": 1, "dtype": "fp16", "BLOCK_N": 32, "BLOCK_K": 32, "num_warps": 4, "num_stages": 4, "time_ms": 4.483744144439697, "status": "ok"}
{"N": 65536, "K": 16384, "D": 64, "B": 1, "dtype": "fp16", "BLOCK_N": 32, "BLOCK_K": 32, "num_warps": 8, "num_stages": 1, "time_ms": 7.485439777374268, "status": "ok"}
{"N": 65536, "K": 16384, "D": 64, "B": 1, "dtype": "fp16", "BLOCK_N": 32, "BLOCK_K": 32, "num_warps": 8, "num_stages": 2, "time_ms": 7.311359882354736, "status": "ok"}
{"N": 65536, "K": 16384, "D": 64, "B": 1, "dtype": "fp16", "BLOCK_N": 32, "BLOCK_K": 32, "num_warps": 8, "num_stages": 4, "time_ms": 7.297855854034424, "status": "ok"}
{"N": 65536, "K": 16384, "D": 64, "B": 1, "dtype": "fp16", "BLOCK_N": 32, "BLOCK_K": 64, "num_warps": 4, "num_stages": 1, "time_ms": 3.6874239444732666, "status": "ok"}
{"N": 65536, "K": 16384, "D": 64, "B": 1, "dtype": "fp16", "BLOCK_N": 32, "BLOCK_K": 64, "num_warps": 4, "num_stages": 2, "time_ms": 3.8765759468078613, "status": "ok"}
{"N": 65536, "K": 16384, "D": 64, "B": 1, "dtype": "fp16", "BLOCK_N": 32, "BLOCK_K": 64, "num_warps": 4, "num_stages": 4, "time_ms": 3.7222399711608887, "status": "ok"}
{"N": 65536, "K": 16384, "D": 64, "B": 1, "dtype": "fp16", "BLOCK_N": 32, "BLOCK_K": 64, "num_warps": 8, "num_stages": 1, "time_ms": 4.649951934814453, "status": "ok"}
{"N": 65536, "K": 16384, "D": 64, "B": 1, "dtype": "fp16", "BLOCK_N": 32, "BLOCK_K": 64, "num_warps": 8, "num_stages": 2, "time_ms": 4.800479888916016, "status": "ok"}
{"N": 65536, "K": 16384, "D": 64, "B": 1, "dtype": "fp16", "BLOCK_N": 32, "BLOCK_K": 64, "num_warps": 8, "num_stages": 4, "time_ms": 4.421343803405762, "status": "ok"}
{"N": 65536, "K": 16384, "D": 64, "B": 1, "dtype": "fp16", "BLOCK_N": 32, "BLOCK_K": 128, "num_warps": 4, "num_stages": 1, "time_ms": 3.1052160263061523, "status": "ok"}
{"N": 65536, "K": 16384, "D": 64, "B": 1, "dtype": "fp16", "BLOCK_N": 32, "BLOCK_K": 128, "num_warps": 4, "num_stages": 2, "time_ms": 3.173504114151001, "status": "ok"}
{"N": 65536, "K": 16384, "D": 64, "B": 1, "dtype": "fp16", "BLOCK_N": 32, "BLOCK_K": 128, "num_warps": 4, "num_stages": 4, "time_ms": 5.553311824798584, "status": "ok"}
{"N": 65536, "K": 16384, "D": 64, "B": 1, "dtype": "fp16", "BLOCK_N": 32, "BLOCK_K": 128, "num_warps": 8, "num_stages": 1, "time_ms": 4.118527889251709, "status": "ok"}
{"N": 65536, "K": 16384, "D": 64, "B": 1, "dtype": "fp16", "BLOCK_N": 32, "BLOCK_K": 128, "num_warps": 8, "num_stages": 2, "time_ms": 3.88703989982605, "status": "ok"}
{"N": 65536, "K": 16384, "D": 64, "B": 1, "dtype": "fp16", "BLOCK_N": 32, "BLOCK_K": 128, "num_warps": 8, "num_stages": 4, "time_ms": 5.56444787979126, "status": "ok"}
{"N": 65536, "K": 16384, "D": 64, "B": 1, "dtype": "fp16", "BLOCK_N": 64, "BLOCK_K": 32, "num_warps": 4, "num_stages": 1, "time_ms": 3.358720064163208, "status": "ok"}
{"N": 65536, "K": 16384, "D": 64, "B": 1, "dtype": "fp16", "BLOCK_N": 64, "BLOCK_K": 32, "num_warps": 4, "num_stages": 2, "time_ms": 3.719712018966675, "status": "ok"}
{"N": 65536, "K": 16384, "D": 64, "B": 1, "dtype": "fp16", "BLOCK_N": 64, "BLOCK_K": 32, "num_warps": 4, "num_stages": 4, "time_ms": 3.3508479595184326, "status": "ok"}
{"N": 65536, "K": 16384, "D": 64, "B": 1, "dtype": "fp16", "BLOCK_N": 64, "BLOCK_K": 32, "num_warps": 8, "num_stages": 1, "time_ms": 3.8900160789489746, "status": "ok"}
{"N": 65536, "K": 16384, "D": 64, "B": 1, "dtype": "fp16", "BLOCK_N": 64, "BLOCK_K": 32, "num_warps": 8, "num_stages": 2, "time_ms": 4.10316801071167, "status": "ok"}
{"N": 65536, "K": 16384, "D": 64, "B": 1, "dtype": "fp16", "BLOCK_N": 64, "BLOCK_K": 32, "num_warps": 8, "num_stages": 4, "time_ms": 4.009984016418457, "status": "ok"}
{"N": 65536, "K": 16384, "D": 64, "B": 1, "dtype": "fp16", "BLOCK_N": 64, "BLOCK_K": 64, "num_warps": 4, "num_stages": 1, "time_ms": 2.412544012069702, "status": "ok"}
{"N": 65536, "K": 16384, "D": 64, "B": 1, "dtype": "fp16", "BLOCK_N": 64, "BLOCK_K": 64, "num_warps": 4, "num_stages": 2, "time_ms": 2.955264091491699, "status": "ok"}
{"N": 65536, "K": 16384, "D": 64, "B": 1, "dtype": "fp16", "BLOCK_N": 64, "BLOCK_K": 64, "num_warps": 4, "num_stages": 4, "time_ms": 2.699199914932251, "status": "ok"}
{"N": 65536, "K": 16384, "D": 64, "B": 1, "dtype": "fp16", "BLOCK_N": 64, "BLOCK_K": 64, "num_warps": 8, "num_stages": 1, "time_ms": 3.780639886856079, "status": "ok"}
{"N": 65536, "K": 16384, "D": 64, "B": 1, "dtype": "fp16", "BLOCK_N": 64, "BLOCK_K": 64, "num_warps": 8, "num_stages": 2, "time_ms": 3.4938879013061523, "status": "ok"}
{"N": 65536, "K": 16384, "D": 64, "B": 1, "dtype": "fp16", "BLOCK_N": 64, "BLOCK_K": 64, "num_warps": 8, "num_stages": 4, "time_ms": 4.069375991821289, "status": "ok"}
{"N": 65536, "K": 16384, "D": 64, "B": 1, "dtype": "fp16", "BLOCK_N": 64, "BLOCK_K": 128, "num_warps": 4, "num_stages": 1, "time_ms": 2.5815041065216064, "status": "ok"}
{"N": 65536, "K": 16384, "D": 64, "B": 1, "dtype": "fp16", "BLOCK_N": 64, "BLOCK_K": 128, "num_warps": 4, "num_stages": 2, "time_ms": 2.510848045349121, "status": "ok"}
{"N": 65536, "K": 16384, "D": 64, "B": 1, "dtype": "fp16", "BLOCK_N": 64, "BLOCK_K": 128, "num_warps": 4, "num_stages": 4, "time_ms": 4.195328235626221, "status": "ok"}
{"N": 65536, "K": 16384, "D": 64, "B": 1, "dtype": "fp16", "BLOCK_N": 64, "BLOCK_K": 128, "num_warps": 8, "num_stages": 1, "time_ms": 2.78220796585083, "status": "ok"}
{"N": 65536, "K": 16384, "D": 64, "B": 1, "dtype": "fp16", "BLOCK_N": 64, "BLOCK_K": 128, "num_warps": 8, "num_stages": 2, "time_ms": 2.662400007247925, "status": "ok"}
{"N": 65536, "K": 16384, "D": 64, "B": 1, "dtype": "fp16", "BLOCK_N": 64, "BLOCK_K": 128, "num_warps": 8, "num_stages": 4, "time_ms": 3.201024055480957, "status": "ok"}
{"N": 65536, "K": 16384, "D": 64, "B": 1, "dtype": "fp16", "BLOCK_N": 128, "BLOCK_K": 32, "num_warps": 4, "num_stages": 1, "time_ms": 2.1942079067230225, "status": "ok"}
{"N": 65536, "K": 16384, "D": 64, "B": 1, "dtype": "fp16", "BLOCK_N": 128, "BLOCK_K": 32, "num_warps": 4, "num_stages": 2, "time_ms": 2.6777920722961426, "status": "ok"}
{"N": 65536, "K": 16384, "D": 64, "B": 1, "dtype": "fp16", "BLOCK_N": 128, "BLOCK_K": 32, "num_warps": 4, "num_stages": 4, "time_ms": 2.621119976043701, "status": "ok"}
{"N": 65536, "K": 16384, "D": 64, "B": 1, "dtype": "fp16", "BLOCK_N": 128, "BLOCK_K": 32, "num_warps": 8, "num_stages": 1, "time_ms": 3.3155839443206787, "status": "ok"}
{"N": 65536, "K": 16384, "D": 64, "B": 1, "dtype": "fp16", "BLOCK_N": 128, "BLOCK_K": 32, "num_warps": 8, "num_stages": 2, "time_ms": 3.455967903137207, "status": "ok"}
{"N": 65536, "K": 16384, "D": 64, "B": 1, "dtype": "fp16", "BLOCK_N": 128, "BLOCK_K": 32, "num_warps": 8, "num_stages": 4, "time_ms": 3.3228800296783447, "status": "ok"}
{"N": 65536, "K": 16384, "D": 64, "B": 1, "dtype": "fp16", "BLOCK_N": 128, "BLOCK_K": 64, "num_warps": 4, "num_stages": 1, "time_ms": 2.4704320430755615, "status": "ok"}
{"N": 65536, "K": 16384, "D": 64, "B": 1, "dtype": "fp16", "BLOCK_N": 128, "BLOCK_K": 64, "num_warps": 4, "num_stages": 2, "time_ms": 2.2583041191101074, "status": "ok"}
{"N": 65536, "K": 16384, "D": 64, "B": 1, "dtype": "fp16", "BLOCK_N": 128, "BLOCK_K": 64, "num_warps": 4, "num_stages": 4, "time_ms": 2.386944055557251, "status": "ok"}
{"N": 65536, "K": 16384, "D": 64, "B": 1, "dtype": "fp16", "BLOCK_N": 128, "BLOCK_K": 64, "num_warps": 8, "num_stages": 1, "time_ms": 2.5907199382781982, "status": "ok"}
{"N": 65536, "K": 16384, "D": 64, "B": 1, "dtype": "fp16", "BLOCK_N": 128, "BLOCK_K": 64, "num_warps": 8, "num_stages": 2, "time_ms": 2.6613759994506836, "status": "ok"}
{"N": 65536, "K": 16384, "D": 64, "B": 1, "dtype": "fp16", "BLOCK_N": 128, "BLOCK_K": 64, "num_warps": 8, "num_stages": 4, "time_ms": 2.3838720321655273, "status": "ok"}
{"N": 65536, "K": 16384, "D": 64, "B": 1, "dtype": "fp16", "BLOCK_N": 128, "BLOCK_K": 128, "num_warps": 4, "num_stages": 1, "time_ms": 2.2915520668029785, "status": "ok"}
{"N": 65536, "K": 16384, "D": 64, "B": 1, "dtype": "fp16", "BLOCK_N": 128, "BLOCK_K": 128, "num_warps": 4, "num_stages": 2, "time_ms": 2.524319887161255, "status": "ok"}
{"N": 65536, "K": 16384, "D": 64, "B": 1, "dtype": "fp16", "BLOCK_N": 128, "BLOCK_K": 128, "num_warps": 4, "num_stages": 4, "time_ms": 3.210239887237549, "status": "ok"}
{"N": 65536, "K": 16384, "D": 64, "B": 1, "dtype": "fp16", "BLOCK_N": 128, "BLOCK_K": 128, "num_warps": 8, "num_stages": 1, "time_ms": 3.3532800674438477, "status": "ok"}
{"N": 65536, "K": 16384, "D": 64, "B": 1, "dtype": "fp16", "BLOCK_N": 128, "BLOCK_K": 128, "num_warps": 8, "num_stages": 2, "time_ms": 3.4725759029388428, "status": "ok"}
{"N": 65536, "K": 16384, "D": 64, "B": 1, "dtype": "fp16", "BLOCK_N": 128, "BLOCK_K": 128, "num_warps": 8, "num_stages": 4, "time_ms": 3.401855945587158, "status": "ok"}
{"summary": true, "N": 65536, "K": 16384, "D": 64, "B": 1, "dtype": "fp16", "best": {"N": 65536, "K": 16384, "D": 64, "B": 1, "dtype": "fp16", "BLOCK_N": 128, "BLOCK_K": 32, "num_warps": 4, "num_stages": 1, "time_ms": 2.1942079067230225, "status": "ok"}, "best_time_ms": 2.1942079067230225, "tuning_seconds": 9.357835054397583, "skipped": 0}
