grid_results_gb10/N65536_K1024_D128_B1_fp16.jsonl
{"N": 65536, "K": 1024, "D": 128, "B": 1, "dtype": "fp16", "BLOCK_N": 32, "BLOCK_K": 32, "num_warps": 4, "num_stages": 1, "time_ms": 0.42958399653434753, "status": "ok"}
{"N": 65536, "K": 1024, "D": 128, "B": 1, "dtype": "fp16", "BLOCK_N": 32, "BLOCK_K": 32, "num_warps": 4, "num_stages": 2, "time_ms": 0.40401600301265717, "status": "ok"}
{"N": 65536, "K": 1024, "D": 128, "B": 1, "dtype": "fp16", "BLOCK_N": 32, "BLOCK_K": 32, "num_warps": 4, "num_stages": 4, "time_ms": 0.4679679870605469, "status": "ok"}
{"N": 65536, "K": 1024, "D": 128, "B": 1, "dtype": "fp16", "BLOCK_N": 32, "BLOCK_K": 32, "num_warps": 8, "num_stages": 1, "time_ms": 0.6077439785003662, "status": "ok"}
{"N": 65536, "K": 1024, "D": 128, "B": 1, "dtype": "fp16", "BLOCK_N": 32, "BLOCK_K": 32, "num_warps": 8, "num_stages": 2, "time_ms": 0.5904320180416107, "status": "ok"}
{"N": 65536, "K": 1024, "D": 128, "B": 1, "dtype": "fp16", "BLOCK_N": 32, "BLOCK_K": 32, "num_warps": 8, "num_stages": 4, "time_ms": 0.6286719739437103, "status": "ok"}
{"N": 65536, "K": 1024, "D": 128, "B": 1, "dtype": "fp16", "BLOCK_N": 32, "BLOCK_K": 64, "num_warps": 4, "num_stages": 1, "time_ms": 0.4065600037574768, "status": "ok"}
{"N": 65536, "K": 1024, "D": 128, "B": 1, "dtype": "fp16", "BLOCK_N": 32, "BLOCK_K": 64, "num_warps": 4, "num_stages": 2, "time_ms": 0.4343999922275543, "status": "ok"}
{"N": 65536, "K": 1024, "D": 128, "B": 1, "dtype": "fp16", "BLOCK_N": 32, "BLOCK_K": 64, "num_warps": 4, "num_stages": 4, "time_ms": 0.6768800020217896, "status": "ok"}
{"N": 65536, "K": 1024, "D": 128, "B": 1, "dtype": "fp16", "BLOCK_N": 32, "BLOCK_K": 64, "num_warps": 8, "num_stages": 1, "time_ms": 0.4398240000009537, "status": "ok"}
{"N": 65536, "K": 1024, "D": 128, "B": 1, "dtype": "fp16", "BLOCK_N": 32, "BLOCK_K": 64, "num_warps": 8, "num_stages": 2, "time_ms": 0.4198399931192398, "status": "ok"}
{"N": 65536, "K": 1024, "D": 128, "B": 1, "dtype": "fp16", "BLOCK_N": 32, "BLOCK_K": 64, "num_warps": 8, "num_stages": 4, "time_ms": 0.5518560111522675, "status": "ok"}
{"N": 65536, "K": 1024, "D": 128, "B": 1, "dtype": "fp16", "BLOCK_N": 32, "BLOCK_K": 128, "num_warps": 4, "num_stages": 1, "time_ms": 0.4551680088043213, "status": "ok"}
{"N": 65536, "K": 1024, "D": 128, "B": 1, "dtype": "fp16", "BLOCK_N": 32, "BLOCK_K": 128, "num_warps": 4, "num_stages": 2, "time_ms": 0.4750719964504242, "status": "ok"}
{"N": 65536, "K": 1024, "D": 128, "B": 1, "dtype": "fp16", "BLOCK_N": 32, "BLOCK_K": 128, "num_warps": 4, "num_stages": 4, "status": "oor"}
{"N": 65536, "K": 1024, "D": 128, "B": 1, "dtype": "fp16", "BLOCK_N": 32, "BLOCK_K": 128, "num_warps": 8, "num_stages": 1, "time_ms": 0.48179200291633606, "status": "ok"}
{"N": 65536, "K": 1024, "D": 128, "B": 1, "dtype": "fp16", "BLOCK_N": 32, "BLOCK_K": 128, "num_warps": 8, "num_stages": 2, "time_ms": 0.5380479991436005, "status": "ok"}
{"N": 65536, "K": 1024, "D": 128, "B": 1, "dtype": "fp16", "BLOCK_N": 32, "BLOCK_K": 128, "num_warps": 8, "num_stages": 4, "status": "oor"}
{"N": 65536, "K": 1024, "D": 128, "B": 1, "dtype": "fp16", "BLOCK_N": 64, "BLOCK_K": 32, "num_warps": 4, "num_stages": 1, "time_ms": 0.3697280138731003, "status": "ok"}
{"N": 65536, "K": 1024, "D": 128, "B": 1, "dtype": "fp16", "BLOCK_N": 64, "BLOCK_K": 32, "num_warps": 4, "num_stages": 2, "time_ms": 0.3768319934606552, "status": "ok"}
{"N": 65536, "K": 1024, "D": 128, "B": 1, "dtype": "fp16", "BLOCK_N": 64, "BLOCK_K": 32, "num_warps": 4, "num_stages": 4, "time_ms": 0.38811199367046356, "status": "ok"}
{"N": 65536, "K": 1024, "D": 128, "B": 1, "dtype": "fp16", "BLOCK_N": 64, "BLOCK_K": 32, "num_warps": 8, "num_stages": 1, "time_ms": 0.38785600662231445, "status": "ok"}
{"N": 65536, "K": 1024, "D": 128, "B": 1, "dtype": "fp16", "BLOCK_N": 64, "BLOCK_K": 32, "num_warps": 8, "num_stages": 2, "time_ms": 0.38967999815940857, "status": "ok"}
{"N": 65536, "K": 1024, "D": 128, "B": 1, "dtype": "fp16", "BLOCK_N": 64, "BLOCK_K": 32, "num_warps": 8, "num_stages": 4, "time_ms": 0.38499200344085693, "status": "ok"}
{"N": 65536, "K": 1024, "D": 128, "B": 1, "dtype": "fp16", "BLOCK_N": 64, "BLOCK_K": 64, "num_warps": 4, "num_stages": 1, "time_ms": 0.30005332827568054, "status": "ok"}
{"N": 65536, "K": 1024, "D": 128, "B": 1, "dtype": "fp16", "BLOCK_N": 64, "BLOCK_K": 64, "num_warps": 4, "num_stages": 2, "time_ms": 0.31913599371910095, "status": "ok"}
{"N": 65536, "K": 1024, "D": 128, "B": 1, "dtype": "fp16", "BLOCK_N": 64, "BLOCK_K": 64, "num_warps": 4, "num_stages": 4, "time_ms": 0.3891200125217438, "status": "ok"}
{"N": 65536, "K": 1024, "D": 128, "B": 1, "dtype": "fp16", "BLOCK_N": 64, "BLOCK_K": 64, "num_warps": 8, "num_stages": 1, "time_ms": 0.34886400898297626, "status": "ok"}
{"N": 65536, "K": 1024, "D": 128, "B": 1, "dtype": "fp16", "BLOCK_N": 64, "BLOCK_K": 64, "num_warps": 8, "num_stages": 2, "time_ms": 0.37171199917793274, "status": "ok"}
{"N": 65536, "K": 1024, "D": 128, "B": 1, "dtype": "fp16", "BLOCK_N": 64, "BLOCK_K": 64, "num_warps": 8, "num_stages": 4, "time_ms": 0.4403199851512909, "status": "ok"}
{"N": 65536, "K": 1024, "D": 128, "B": 1, "dtype": "fp16", "BLOCK_N": 64, "BLOCK_K": 128, "num_warps": 4, "num_stages": 1, "time_ms": 0.3327466646830241, "status": "ok"}
{"N": 65536, "K": 1024, "D": 128, "B": 1, "dtype": "fp16", "BLOCK_N": 64, "BLOCK_K": 128, "num_warps": 4, "num_stages": 2, "time_ms": 0.4842720031738281, "status": "ok"}
{"N": 65536, "K": 1024, "D": 128, "B": 1, "dtype": "fp16", "BLOCK_N": 64, "BLOCK_K": 128, "num_warps": 4, "num_stages": 4, "status": "oor"}
{"N": 65536, "K": 1024, "D": 128, "B": 1, "dtype": "fp16", "BLOCK_N": 64, "BLOCK_K": 128, "num_warps": 8, "num_stages": 1, "time_ms": 0.3266346752643585, "status": "ok"}
{"N": 65536, "K": 1024, "D": 128, "B": 1, "dtype": "fp16", "BLOCK_N": 64, "BLOCK_K": 128, "num_warps": 8, "num_stages": 2, "time_ms": 0.42905598878860474, "status": "ok"}
{"N": 65536, "K": 1024, "D": 128, "B": 1, "dtype": "fp16", "BLOCK_N": 64, "BLOCK_K": 128, "num_warps": 8, "num_stages": 4, "status": "oor"}
{"N": 65536, "K": 1024, "D": 128, "B": 1, "dtype": "fp16", "BLOCK_N": 128, "BLOCK_K": 32, "num_warps": 4, "num_stages": 1, "time_ms": 0.3203519980112712, "status": "ok"}
{"N": 65536, "K": 1024, "D": 128, "B": 1, "dtype": "fp16", "BLOCK_N": 128, "BLOCK_K": 32, "num_warps": 4, "num_stages": 2, "time_ms": 0.34485334157943726, "status": "ok"}
{"N": 65536, "K": 1024, "D": 128, "B": 1, "dtype": "fp16", "BLOCK_N": 128, "BLOCK_K": 32, "num_warps": 4, "num_stages": 4, "time_ms": 0.3681280016899109, "status": "ok"}
{"N": 65536, "K": 1024, "D": 128, "B": 1, "dtype": "fp16", "BLOCK_N": 128, "BLOCK_K": 32, "num_warps": 8, "num_stages": 1, "time_ms": 0.38576000928878784, "status": "ok"}
{"N": 65536, "K": 1024, "D": 128, "B": 1, "dtype": "fp16", "BLOCK_N": 128, "BLOCK_K": 32, "num_warps": 8, "num_stages": 2, "time_ms": 0.3837760090827942, "status": "ok"}
{"N": 65536, "K": 1024, "D": 128, "B": 1, "dtype": "fp16", "BLOCK_N": 128, "BLOCK_K": 32, "num_warps": 8, "num_stages": 4, "time_ms": 0.46694399416446686, "status": "ok"}
{"N": 65536, "K": 1024, "D": 128, "B": 1, "dtype": "fp16", "BLOCK_N": 128, "BLOCK_K": 64, "num_warps": 4, "num_stages": 1, "time_ms": 0.3255893389383952, "status": "ok"}
{"N": 65536, "K": 1024, "D": 128, "B": 1, "dtype": "fp16", "BLOCK_N": 128, "BLOCK_K": 64, "num_warps": 4, "num_stages": 2, "time_ms": 0.41471999883651733, "status": "ok"}
{"N": 65536, "K": 1024, "D": 128, "B": 1, "dtype": "fp16", "BLOCK_N": 128, "BLOCK_K": 64, "num_warps": 4, "num_stages": 4, "time_ms": 0.35357865691185, "status": "ok"}
{"N": 65536, "K": 1024, "D": 128, "B": 1, "dtype": "fp16", "BLOCK_N": 128, "BLOCK_K": 64, "num_warps": 8, "num_stages": 1, "time_ms": 0.3157973388830821, "status": "ok"}
{"N": 65536, "K": 1024, "D": 128, "B": 1, "dtype": "fp16", "BLOCK_N": 128, "BLOCK_K": 64, "num_warps": 8, "num_stages": 2, "time_ms": 0.4233600050210953, "status": "ok"}
{"N": 65536, "K": 1024, "D": 128, "B": 1, "dtype": "fp16", "BLOCK_N": 128, "BLOCK_K": 64, "num_warps": 8, "num_stages": 4, "time_ms": 0.37887999415397644, "status": "ok"}
{"N": 65536, "K": 1024, "D": 128, "B": 1, "dtype": "fp16", "BLOCK_N": 128, "BLOCK_K": 128, "num_warps": 4, "num_stages": 1, "time_ms": 0.44339199364185333, "status": "ok"}
{"N": 65536, "K": 1024, "D": 128, "B": 1, "dtype": "fp16", "BLOCK_N": 128, "BLOCK_K": 128, "num_warps": 4, "num_stages": 2, "time_ms": 0.4050400108098984, "status": "ok"}
{"N": 65536, "K": 1024, "D": 128, "B": 1, "dtype": "fp16", "BLOCK_N": 128, "BLOCK_K": 128, "num_warps": 4, "num_stages": 4, "status": "oor"}
{"N": 65536, "K": 1024, "D": 128, "B": 1, "dtype": "fp16", "BLOCK_N": 128, "BLOCK_K": 128, "num_warps": 8, "num_stages": 1, "time_ms": 0.3850559890270233, "status": "ok"}
{"N": 65536, "K": 1024, "D": 128, "B": 1, "dtype": "fp16", "BLOCK_N": 128, "BLOCK_K": 128, "num_warps": 8, "num_stages": 2, "time_ms": 0.38748799264431, "status": "ok"}
{"N": 65536, "K": 1024, "D": 128, "B": 1, "dtype": "fp16", "BLOCK_N": 128, "BLOCK_K": 128, "num_warps": 8, "num_stages": 4, "status": "oor"}
{"summary": true, "N": 65536, "K": 1024, "D": 128, "B": 1, "dtype": "fp16", "best": {"N": 65536, "K": 1024, "D": 128, "B": 1, "dtype": "fp16", "BLOCK_N": 64, "BLOCK_K": 64, "num_warps": 4, "num_stages": 1, "time_ms": 0.30005332827568054, "status": "ok"}, "best_time_ms": 0.30005332827568054, "tuning_seconds": 9.289407730102539, "skipped": 6}
