grid_results_gb10/N65536_K65536_D256_B1_fp16.jsonl
{"N": 65536, "K": 65536, "D": 256, "B": 1, "dtype": "fp16", "BLOCK_N": 32, "BLOCK_K": 32, "num_warps": 4, "num_stages": 1, "time_ms": 50.398719787597656, "status": "ok"}
{"N": 65536, "K": 65536, "D": 256, "B": 1, "dtype": "fp16", "BLOCK_N": 32, "BLOCK_K": 32, "num_warps": 4, "num_stages": 2, "time_ms": 76.82969665527344, "status": "ok"}
{"N": 65536, "K": 65536, "D": 256, "B": 1, "dtype": "fp16", "BLOCK_N": 32, "BLOCK_K": 32, "num_warps": 4, "num_stages": 4, "time_ms": 95.42144012451172, "status": "ok"}
{"N": 65536, "K": 65536, "D": 256, "B": 1, "dtype": "fp16", "BLOCK_N": 32, "BLOCK_K": 32, "num_warps": 8, "num_stages": 1, "time_ms": 64.02457427978516, "status": "ok"}
{"N": 65536, "K": 65536, "D": 256, "B": 1, "dtype": "fp16", "BLOCK_N": 32, "BLOCK_K": 32, "num_warps": 8, "num_stages": 2, "time_ms": 87.78329467773438, "status": "ok"}
{"N": 65536, "K": 65536, "D": 256, "B": 1, "dtype": "fp16", "BLOCK_N": 32, "BLOCK_K": 32, "num_warps": 8, "num_stages": 4, "time_ms": 107.9889907836914, "status": "ok"}
{"N": 65536, "K": 65536, "D": 256, "B": 1, "dtype": "fp16", "BLOCK_N": 32, "BLOCK_K": 64, "num_warps": 4, "num_stages": 1, "time_ms": 58.31782531738281, "status": "ok"}
{"N": 65536, "K": 65536, "D": 256, "B": 1, "dtype": "fp16", "BLOCK_N": 32, "BLOCK_K": 64, "num_warps": 4, "num_stages": 2, "time_ms": 69.26950073242188, "status": "ok"}
{"N": 65536, "K": 65536, "D": 256, "B": 1, "dtype": "fp16", "BLOCK_N": 32, "BLOCK_K": 64, "num_warps": 4, "num_stages": 4, "status": "oor"}
{"N": 65536, "K": 65536, "D": 256, "B": 1, "dtype": "fp16", "BLOCK_N": 32, "BLOCK_K": 64, "num_warps": 8, "num_stages": 1, "time_ms": 60.36582565307617, "status": "ok"}
{"N": 65536, "K": 65536, "D": 256, "B": 1, "dtype": "fp16", "BLOCK_N": 32, "BLOCK_K": 64, "num_warps": 8, "num_stages": 2, "time_ms": 62.820350646972656, "status": "ok"}
{"N": 65536, "K": 65536, "D": 256, "B": 1, "dtype": "fp16", "BLOCK_N": 32, "BLOCK_K": 64, "num_warps": 8, "num_stages": 4, "status": "oor"}
{"N": 65536, "K": 65536, "D": 256, "B": 1, "dtype": "fp16", "BLOCK_N": 32, "BLOCK_K": 128, "num_warps": 4, "num_stages": 1, "time_ms": 74.07923126220703, "status": "ok"}
{"N": 65536, "K": 65536, "D": 256, "B": 1, "dtype": "fp16", "BLOCK_N": 32, "BLOCK_K": 128, "num_warps": 4, "num_stages": 2, "time_ms": 97.10797119140625, "status": "ok"}
{"N": 65536, "K": 65536, "D": 256, "B": 1, "dtype": "fp16", "BLOCK_N": 32, "BLOCK_K": 128, "num_warps": 4, "num_stages": 4, "status": "oor"}
{"N": 65536, "K": 65536, "D": 256, "B": 1, "dtype": "fp16", "BLOCK_N": 32, "BLOCK_K": 128, "num_warps": 8, "num_stages": 1, "time_ms": 68.66841888427734, "status": "ok"}
{"N": 65536, "K": 65536, "D": 256, "B": 1, "dtype": "fp16", "BLOCK_N": 32, "BLOCK_K": 128, "num_warps": 8, "num_stages": 2, "time_ms": 75.82310485839844, "status": "ok"}
{"N": 65536, "K": 65536, "D": 256, "B": 1, "dtype": "fp16", "BLOCK_N": 32, "BLOCK_K": 128, "num_warps": 8, "num_stages": 4, "status": "oor"}
{"N": 65536, "K": 65536, "D": 256, "B": 1, "dtype": "fp16", "BLOCK_N": 64, "BLOCK_K": 32, "num_warps": 4, "num_stages": 1, "time_ms": 42.00243377685547, "status": "ok"}
{"N": 65536, "K": 65536, "D": 256, "B": 1, "dtype": "fp16", "BLOCK_N": 64, "BLOCK_K": 32, "num_warps": 4, "num_stages": 2, "time_ms": 47.53203201293945, "status": "ok"}
{"N": 65536, "K": 65536, "D": 256, "B": 1, "dtype": "fp16", "BLOCK_N": 64, "BLOCK_K": 32, "num_warps": 4, "num_stages": 4, "time_ms": 71.71379089355469, "status": "ok"}
{"N": 65536, "K": 65536, "D": 256, "B": 1, "dtype": "fp16", "BLOCK_N": 64, "BLOCK_K": 32, "num_warps": 8, "num_stages": 1, "time_ms": 39.2017936706543, "status": "ok"}
{"N": 65536, "K": 65536, "D": 256, "B": 1, "dtype": "fp16", "BLOCK_N": 64, "BLOCK_K": 32, "num_warps": 8, "num_stages": 2, "time_ms": 44.83686447143555, "status": "ok"}
{"N": 65536, "K": 65536, "D": 256, "B": 1, "dtype": "fp16", "BLOCK_N": 64, "BLOCK_K": 32, "num_warps": 8, "num_stages": 4, "time_ms": 63.63343811035156, "status": "ok"}
{"N": 65536, "K": 65536, "D": 256, "B": 1, "dtype": "fp16", "BLOCK_N": 64, "BLOCK_K": 64, "num_warps": 4, "num_stages": 1, "time_ms": 58.209312438964844, "status": "ok"}
{"N": 65536, "K": 65536, "D": 256, "B": 1, "dtype": "fp16", "BLOCK_N": 64, "BLOCK_K": 64, "num_warps": 4, "num_stages": 2, "time_ms": 71.41085052490234, "status": "ok"}
{"N": 65536, "K": 65536, "D": 256, "B": 1, "dtype": "fp16", "BLOCK_N": 64, "BLOCK_K": 64, "num_warps": 4, "num_stages": 4, "status": "oor"}
{"N": 65536, "K": 65536, "D": 256, "B": 1, "dtype": "fp16", "BLOCK_N": 64, "BLOCK_K": 64, "num_warps": 8, "num_stages": 1, "time_ms": 58.756961822509766, "status": "ok"}
{"N": 65536, "K": 65536, "D": 256, "B": 1, "dtype": "fp16", "BLOCK_N": 64, "BLOCK_K": 64, "num_warps": 8, "num_stages": 2, "time_ms": 71.4434585571289, "status": "ok"}
{"N": 65536, "K": 65536, "D": 256, "B": 1, "dtype": "fp16", "BLOCK_N": 64, "BLOCK_K": 64, "num_warps": 8, "num_stages": 4, "status": "oor"}
{"N": 65536, "K": 65536, "D": 256, "B": 1, "dtype": "fp16", "BLOCK_N": 64, "BLOCK_K": 128, "num_warps": 4, "num_stages": 1, "time_ms": 55.48953628540039, "status": "ok"}
{"N": 65536, "K": 65536, "D": 256, "B": 1, "dtype": "fp16", "BLOCK_N": 64, "BLOCK_K": 128, "num_warps": 4, "num_stages": 2, "time_ms": 63.51776123046875, "status": "ok"}
{"N": 65536, "K": 65536, "D": 256, "B": 1, "dtype": "fp16", "BLOCK_N": 64, "BLOCK_K": 128, "num_warps": 4, "num_stages": 4, "status": "oor"}
{"N": 65536, "K": 65536, "D": 256, "B": 1, "dtype": "fp16", "BLOCK_N": 64, "BLOCK_K": 128, "num_warps": 8, "num_stages": 1, "time_ms": 50.82931137084961, "status": "ok"}
{"N": 65536, "K": 65536, "D": 256, "B": 1, "dtype": "fp16", "BLOCK_N": 64, "BLOCK_K": 128, "num_warps": 8, "num_stages": 2, "time_ms": 47.00569534301758, "status": "ok"}
{"N": 65536, "K": 65536, "D": 256, "B": 1, "dtype": "fp16", "BLOCK_N": 64, "BLOCK_K": 128, "num_warps": 8, "num_stages": 4, "status": "oor"}
{"N": 65536, "K": 65536, "D": 256, "B": 1, "dtype": "fp16", "BLOCK_N": 128, "BLOCK_K": 32, "num_warps": 4, "num_stages": 1, "time_ms": 44.069889068603516, "status": "ok"}
{"N": 65536, "K": 65536, "D": 256, "B": 1, "dtype": "fp16", "BLOCK_N": 128, "BLOCK_K": 32, "num_warps": 4, "num_stages": 2, "time_ms": 59.65420913696289, "status": "ok"}
{"N": 65536, "K": 65536, "D": 256, "B": 1, "dtype": "fp16", "BLOCK_N": 128, "BLOCK_K": 32, "num_warps": 4, "num_stages": 4, "status": "oor"}
{"N": 65536, "K": 65536, "D": 256, "B": 1, "dtype": "fp16", "BLOCK_N": 128, "BLOCK_K": 32, "num_warps": 8, "num_stages": 1, "time_ms": 48.330753326416016, "status": "ok"}
{"N": 65536, "K": 65536, "D": 256, "B": 1, "dtype": "fp16", "BLOCK_N": 128, "BLOCK_K": 32, "num_warps": 8, "num_stages": 2, "time_ms": 60.433406829833984, "status": "ok"}
{"N": 65536, "K": 65536, "D": 256, "B": 1, "dtype": "fp16", "BLOCK_N": 128, "BLOCK_K": 32, "num_warps": 8, "num_stages": 4, "status": "oor"}
{"N": 65536, "K": 65536, "D": 256, "B": 1, "dtype": "fp16", "BLOCK_N": 128, "BLOCK_K": 64, "num_warps": 4, "num_stages": 1, "time_ms": 63.523841857910156, "status": "ok"}
{"N": 65536, "K": 65536, "D": 256, "B": 1, "dtype": "fp16", "BLOCK_N": 128, "BLOCK_K": 64, "num_warps": 4, "num_stages": 2, "time_ms": 38.92428970336914, "status": "ok"}
{"N": 65536, "K": 65536, "D": 256, "B": 1, "dtype": "fp16", "BLOCK_N": 128, "BLOCK_K": 64, "num_warps": 4, "num_stages": 4, "status": "oor"}
{"N": 65536, "K": 65536, "D": 256, "B": 1, "dtype": "fp16", "BLOCK_N": 128, "BLOCK_K": 64, "num_warps": 8, "num_stages": 1, "time_ms": 41.45487976074219, "status": "ok"}
{"N": 65536, "K": 65536, "D": 256, "B": 1, "dtype": "fp16", "BLOCK_N": 128, "BLOCK_K": 64, "num_warps": 8, "num_stages": 2, "time_ms": 46.57164764404297, "status": "ok"}
{"N": 65536, "K": 65536, "D": 256, "B": 1, "dtype": "fp16", "BLOCK_N": 128, "BLOCK_K": 64, "num_warps": 8, "num_stages": 4, "status": "oor"}
{"N": 65536, "K": 65536, "D": 256, "B": 1, "dtype": "fp16", "BLOCK_N": 128, "BLOCK_K": 128, "num_warps": 4, "num_stages": 1, "status": "oor"}
{"N": 65536, "K": 65536, "D": 256, "B": 1, "dtype": "fp16", "BLOCK_N": 128, "BLOCK_K": 128, "num_warps": 4, "num_stages": 2, "status": "oor"}
{"N": 65536, "K": 65536, "D": 256, "B": 1, "dtype": "fp16", "BLOCK_N": 128, "BLOCK_K": 128, "num_warps": 4, "num_stages": 4, "status": "oor"}
{"N": 65536, "K": 65536, "D": 256, "B": 1, "dtype": "fp16", "BLOCK_N": 128, "BLOCK_K": 128, "num_warps": 8, "num_stages": 1, "status": "oor"}
{"N": 65536, "K": 65536, "D": 256, "B": 1, "dtype": "fp16", "BLOCK_N": 128, "BLOCK_K": 128, "num_warps": 8, "num_stages": 2, "status": "oor"}
{"N": 65536, "K": 65536, "D": 256, "B": 1, "dtype": "fp16", "BLOCK_N": 128, "BLOCK_K": 128, "num_warps": 8, "num_stages": 4, "status": "oor"}
{"summary": true, "N": 65536, "K": 65536, "D": 256, "B": 1, "dtype": "fp16", "best": {"N": 65536, "K": 65536, "D": 256, "B": 1, "dtype": "fp16", "BLOCK_N": 128, "BLOCK_K": 64, "num_warps": 4, "num_stages": 2, "time_ms": 38.92428970336914, "status": "ok"}, "best_time_ms": 38.92428970336914, "tuning_seconds": 29.610209226608276, "skipped": 18}
