grid_results_h100/N1048576_K200000_D64_B1_fp16.jsonl
{"N": 1048576, "K": 200000, "D": 64, "B": 1, "dtype": "fp16", "BLOCK_N": 32, "BLOCK_K": 32, "num_warps": 4, "num_stages": 1, "time_ms": 319.53387451171875, "status": "ok"}
{"N": 1048576, "K": 200000, "D": 64, "B": 1, "dtype": "fp16", "BLOCK_N": 32, "BLOCK_K": 32, "num_warps": 4, "num_stages": 2, "time_ms": 283.5217590332031, "status": "ok"}
{"N": 1048576, "K": 200000, "D": 64, "B": 1, "dtype": "fp16", "BLOCK_N": 32, "BLOCK_K": 32, "num_warps": 4, "num_stages": 4, "time_ms": 277.9986877441406, "status": "ok"}
{"N": 1048576, "K": 200000, "D": 64, "B": 1, "dtype": "fp16", "BLOCK_N": 32, "BLOCK_K": 32, "num_warps": 8, "num_stages": 1, "time_ms": 519.36181640625, "status": "ok"}
{"N": 1048576, "K": 200000, "D": 64, "B": 1, "dtype": "fp16", "BLOCK_N": 32, "BLOCK_K": 32, "num_warps": 8, "num_stages": 2, "time_ms": 489.3982849121094, "status": "ok"}
{"N": 1048576, "K": 200000, "D": 64, "B": 1, "dtype": "fp16", "BLOCK_N": 32, "BLOCK_K": 32, "num_warps": 8, "num_stages": 4, "time_ms": 475.9660339355469, "status": "ok"}
{"N": 1048576, "K": 200000, "D": 64, "B": 1, "dtype": "fp16", "BLOCK_N": 32, "BLOCK_K": 64, "num_warps": 4, "num_stages": 1, "time_ms": 271.2852478027344, "status": "ok"}
{"N": 1048576, "K": 200000, "D": 64, "B": 1, "dtype": "fp16", "BLOCK_N": 32, "BLOCK_K": 64, "num_warps": 4, "num_stages": 2, "time_ms": 240.74758911132812, "status": "ok"}
{"N": 1048576, "K": 200000, "D": 64, "B": 1, "dtype": "fp16", "BLOCK_N": 32, "BLOCK_K": 64, "num_warps": 4, "num_stages": 4, "time_ms": 232.25112915039062, "status": "ok"}
{"N": 1048576, "K": 200000, "D": 64, "B": 1, "dtype": "fp16", "BLOCK_N": 32, "BLOCK_K": 64, "num_warps": 8, "num_stages": 1, "time_ms": 332.119140625, "status": "ok"}
{"N": 1048576, "K": 200000, "D": 64, "B": 1, "dtype": "fp16", "BLOCK_N": 32, "BLOCK_K": 64, "num_warps": 8, "num_stages": 2, "time_ms": 309.3974914550781, "status": "ok"}
{"N": 1048576, "K": 200000, "D": 64, "B": 1, "dtype": "fp16", "BLOCK_N": 32, "BLOCK_K": 64, "num_warps": 8, "num_stages": 4, "time_ms": 298.88323974609375, "status": "ok"}
{"N": 1048576, "K": 200000, "D": 64, "B": 1, "dtype": "fp16", "BLOCK_N": 32, "BLOCK_K": 128, "num_warps": 4, "num_stages": 1, "time_ms": 220.52220153808594, "status": "ok"}
{"N": 1048576, "K": 200000, "D": 64, "B": 1, "dtype": "fp16", "BLOCK_N": 32, "BLOCK_K": 128, "num_warps": 4, "num_stages": 2, "time_ms": 198.71299743652344, "status": "ok"}
{"N": 1048576, "K": 200000, "D": 64, "B": 1, "dtype": "fp16", "BLOCK_N": 32, "BLOCK_K": 128, "num_warps": 4, "num_stages": 4, "time_ms": 196.71340942382812, "status": "ok"}
{"N": 1048576, "K": 200000, "D": 64, "B": 1, "dtype": "fp16", "BLOCK_N": 32, "BLOCK_K": 128, "num_warps": 8, "num_stages": 1, "time_ms": 361.22491455078125, "status": "ok"}
{"N": 1048576, "K": 200000, "D": 64, "B": 1, "dtype": "fp16", "BLOCK_N": 32, "BLOCK_K": 128, "num_warps": 8, "num_stages": 2, "time_ms": 288.26629638671875, "status": "ok"}
{"N": 1048576, "K": 200000, "D": 64, "B": 1, "dtype": "fp16", "BLOCK_N": 32, "BLOCK_K": 128, "num_warps": 8, "num_stages": 4, "time_ms": 280.5191650390625, "status": "ok"}
{"N": 1048576, "K": 200000, "D": 64, "B": 1, "dtype": "fp16", "BLOCK_N": 64, "BLOCK_K": 32, "num_warps": 4, "num_stages": 1, "time_ms": 149.3377227783203, "status": "ok"}
{"N": 1048576, "K": 200000, "D": 64, "B": 1, "dtype": "fp16", "BLOCK_N": 64, "BLOCK_K": 32, "num_warps": 4, "num_stages": 2, "time_ms": 146.36732482910156, "status": "ok"}
{"N": 1048576, "K": 200000, "D": 64, "B": 1, "dtype": "fp16", "BLOCK_N": 64, "BLOCK_K": 32, "num_warps": 4, "num_stages": 4, "time_ms": 145.83856201171875, "status": "ok"}
{"N": 1048576, "K": 200000, "D": 64, "B": 1, "dtype": "fp16", "BLOCK_N": 64, "BLOCK_K": 32, "num_warps": 8, "num_stages": 1, "time_ms": 258.5805358886719, "status": "ok"}
{"N": 1048576, "K": 200000, "D": 64, "B": 1, "dtype": "fp16", "BLOCK_N": 64, "BLOCK_K": 32, "num_warps": 8, "num_stages": 2, "time_ms": 245.12835693359375, "status": "ok"}
{"N": 1048576, "K": 200000, "D": 64, "B": 1, "dtype": "fp16", "BLOCK_N": 64, "BLOCK_K": 32, "num_warps": 8, "num_stages": 4, "time_ms": 237.0777587890625, "status": "ok"}
{"N": 1048576, "K": 200000, "D": 64, "B": 1, "dtype": "fp16", "BLOCK_N": 64, "BLOCK_K": 64, "num_warps": 4, "num_stages": 1, "time_ms": 140.73651123046875, "status": "ok"}
{"N": 1048576, "K": 200000, "D": 64, "B": 1, "dtype": "fp16", "BLOCK_N": 64, "BLOCK_K": 64, "num_warps": 4, "num_stages": 2, "time_ms": 131.2593536376953, "status": "ok"}
{"N": 1048576, "K": 200000, "D": 64, "B": 1, "dtype": "fp16", "BLOCK_N": 64, "BLOCK_K": 64, "num_warps": 4, "num_stages": 4, "time_ms": 130.5950469970703, "status": "ok"}
{"N": 1048576, "K": 200000, "D": 64, "B": 1, "dtype": "fp16", "BLOCK_N": 64, "BLOCK_K": 64, "num_warps": 8, "num_stages": 1, "time_ms": 183.76048278808594, "status": "ok"}
{"N": 1048576, "K": 200000, "D": 64, "B": 1, "dtype": "fp16", "BLOCK_N": 64, "BLOCK_K": 64, "num_warps": 8, "num_stages": 2, "time_ms": 175.87225341796875, "status": "ok"}
{"N": 1048576, "K": 200000, "D": 64, "B": 1, "dtype": "fp16", "BLOCK_N": 64, "BLOCK_K": 64, "num_warps": 8, "num_stages": 4, "time_ms": 173.2888641357422, "status": "ok"}
{"N": 1048576, "K": 200000, "D": 64, "B": 1, "dtype": "fp16", "BLOCK_N": 64, "BLOCK_K": 128, "num_warps": 4, "num_stages": 1, "time_ms": 140.4066619873047, "status": "ok"}
{"N": 1048576, "K": 200000, "D": 64, "B": 1, "dtype": "fp16", "BLOCK_N": 64, "BLOCK_K": 128, "num_warps": 4, "num_stages": 2, "time_ms": 138.1980438232422, "status": "ok"}
{"N": 1048576, "K": 200000, "D": 64, "B": 1, "dtype": "fp16", "BLOCK_N": 64, "BLOCK_K": 128, "num_warps": 4, "num_stages": 4, "time_ms": 134.64505004882812, "status": "ok"}
{"N": 1048576, "K": 200000, "D": 64, "B": 1, "dtype": "fp16", "BLOCK_N": 64, "BLOCK_K": 128, "num_warps": 8, "num_stages": 1, "time_ms": 204.291015625, "status": "ok"}
{"N": 1048576, "K": 200000, "D": 64, "B": 1, "dtype": "fp16", "BLOCK_N": 64, "BLOCK_K": 128, "num_warps": 8, "num_stages": 2, "time_ms": 184.67068481445312, "status": "ok"}
{"N": 1048576, "K": 200000, "D": 64, "B": 1, "dtype": "fp16", "BLOCK_N": 64, "BLOCK_K": 128, "num_warps": 8, "num_stages": 4, "time_ms": 176.5537872314453, "status": "ok"}
{"N": 1048576, "K": 200000, "D": 64, "B": 1, "dtype": "fp16", "BLOCK_N": 128, "BLOCK_K": 32, "num_warps": 4, "num_stages": 1, "time_ms": 140.60105895996094, "status": "ok"}
{"N": 1048576, "K": 200000, "D": 64, "B": 1, "dtype": "fp16", "BLOCK_N": 128, "BLOCK_K": 32, "num_warps": 4, "num_stages": 2, "time_ms": 136.1346893310547, "status": "ok"}
{"N": 1048576, "K": 200000, "D": 64, "B": 1, "dtype": "fp16", "BLOCK_N": 128, "BLOCK_K": 32, "num_warps": 4, "num_stages": 4, "time_ms": 137.40956115722656, "status": "ok"}
{"N": 1048576, "K": 200000, "D": 64, "B": 1, "dtype": "fp16", "BLOCK_N": 128, "BLOCK_K": 32, "num_warps": 8, "num_stages": 1, "time_ms": 138.62156677246094, "status": "ok"}
{"N": 1048576, "K": 200000, "D": 64, "B": 1, "dtype": "fp16", "BLOCK_N": 128, "BLOCK_K": 32, "num_warps": 8, "num_stages": 2, "time_ms": 142.440185546875, "status": "ok"}
{"N": 1048576, "K": 200000, "D": 64, "B": 1, "dtype": "fp16", "BLOCK_N": 128, "BLOCK_K": 32, "num_warps": 8, "num_stages": 4, "time_ms": 140.2321014404297, "status": "ok"}
{"N": 1048576, "K": 200000, "D": 64, "B": 1, "dtype": "fp16", "BLOCK_N": 128, "BLOCK_K": 64, "num_warps": 4, "num_stages": 1, "time_ms": 134.68882751464844, "status": "ok"}
{"N": 1048576, "K": 200000, "D": 64, "B": 1, "dtype": "fp16", "BLOCK_N": 128, "BLOCK_K": 64, "num_warps": 4, "num_stages": 2, "time_ms": 119.00886535644531, "status": "ok"}
{"N": 1048576, "K": 200000, "D": 64, "B": 1, "dtype": "fp16", "BLOCK_N": 128, "BLOCK_K": 64, "num_warps": 4, "num_stages": 4, "time_ms": 119.4975357055664, "status": "ok"}
{"N": 1048576, "K": 200000, "D": 64, "B": 1, "dtype": "fp16", "BLOCK_N": 128, "BLOCK_K": 64, "num_warps": 8, "num_stages": 1, "time_ms": 131.91421508789062, "status": "ok"}
{"N": 1048576, "K": 200000, "D": 64, "B": 1, "dtype": "fp16", "BLOCK_N": 128, "BLOCK_K": 64, "num_warps": 8, "num_stages": 2, "time_ms": 126.66242980957031, "status": "ok"}
{"N": 1048576, "K": 200000, "D": 64, "B": 1, "dtype": "fp16", "BLOCK_N": 128, "BLOCK_K": 64, "num_warps": 8, "num_stages": 4, "time_ms": 129.04470825195312, "status": "ok"}
{"N": 1048576, "K": 200000, "D": 64, "B": 1, "dtype": "fp16", "BLOCK_N": 128, "BLOCK_K": 128, "num_warps": 4, "num_stages": 1, "time_ms": 130.3704376220703, "status": "ok"}
{"N": 1048576, "K": 200000, "D": 64, "B": 1, "dtype": "fp16", "BLOCK_N": 128, "BLOCK_K": 128, "num_warps": 4, "num_stages": 2, "time_ms": 127.30265808105469, "status": "ok"}
{"N": 1048576, "K": 200000, "D": 64, "B": 1, "dtype": "fp16", "BLOCK_N": 128, "BLOCK_K": 128, "num_warps": 4, "num_stages": 4, "time_ms": 124.74703979492188, "status": "ok"}
{"N": 1048576, "K": 200000, "D": 64, "B": 1, "dtype": "fp16", "BLOCK_N": 128, "BLOCK_K": 128, "num_warps": 8, "num_stages": 1, "time_ms": 204.6821746826172, "status": "ok"}
{"N": 1048576, "K": 200000, "D": 64, "B": 1, "dtype": "fp16", "BLOCK_N": 128, "BLOCK_K": 128, "num_warps": 8, "num_stages": 2, "time_ms": 201.3001251220703, "status": "ok"}
{"N": 1048576, "K": 200000, "D": 64, "B": 1, "dtype": "fp16", "BLOCK_N": 128, "BLOCK_K": 128, "num_warps": 8, "num_stages": 4, "time_ms": 163.63267517089844, "status": "ok"}
{"summary": true, "N": 1048576, "K": 200000, "D": 64, "B": 1, "dtype": "fp16", "best": {"N": 1048576, "K": 200000, "D": 64, "B": 1, "dtype": "fp16", "BLOCK_N": 128, "BLOCK_K": 64, "num_warps": 4, "num_stages": 2, "time_ms": 119.00886535644531, "status": "ok"}, "best_time_ms": 119.00886535644531, "tuning_seconds": 100.63806915283203, "skipped": 0}
