grid_results_h100/N1048576_K256_D256_B1_fp16.jsonl
{"N": 1048576, "K": 256, "D": 256, "B": 1, "dtype": "fp16", "BLOCK_N": 32, "BLOCK_K": 32, "num_warps": 4, "num_stages": 1, "time_ms": 1.192799985408783, "status": "ok"}
{"N": 1048576, "K": 256, "D": 256, "B": 1, "dtype": "fp16", "BLOCK_N": 32, "BLOCK_K": 32, "num_warps": 4, "num_stages": 2, "time_ms": 0.9427840113639832, "status": "ok"}
{"N": 1048576, "K": 256, "D": 256, "B": 1, "dtype": "fp16", "BLOCK_N": 32, "BLOCK_K": 32, "num_warps": 4, "num_stages": 4, "time_ms": 1.0978080034255981, "status": "ok"}
{"N": 1048576, "K": 256, "D": 256, "B": 1, "dtype": "fp16", "BLOCK_N": 32, "BLOCK_K": 32, "num_warps": 8, "num_stages": 1, "time_ms": 1.5970239639282227, "status": "ok"}
{"N": 1048576, "K": 256, "D": 256, "B": 1, "dtype": "fp16", "BLOCK_N": 32, "BLOCK_K": 32, "num_warps": 8, "num_stages": 2, "time_ms": 1.3868053356806438, "status": "ok"}
{"N": 1048576, "K": 256, "D": 256, "B": 1, "dtype": "fp16", "BLOCK_N": 32, "BLOCK_K": 32, "num_warps": 8, "num_stages": 4, "time_ms": 1.448426644007365, "status": "ok"}
{"N": 1048576, "K": 256, "D": 256, "B": 1, "dtype": "fp16", "BLOCK_N": 32, "BLOCK_K": 64, "num_warps": 4, "num_stages": 1, "time_ms": 1.0201520323753357, "status": "ok"}
{"N": 1048576, "K": 256, "D": 256, "B": 1, "dtype": "fp16", "BLOCK_N": 32, "BLOCK_K": 64, "num_warps": 4, "num_stages": 2, "time_ms": 0.8304640054702759, "status": "ok"}
{"N": 1048576, "K": 256, "D": 256, "B": 1, "dtype": "fp16", "BLOCK_N": 32, "BLOCK_K": 64, "num_warps": 4, "num_stages": 4, "time_ms": 1.0818800032138824, "status": "ok"}
{"N": 1048576, "K": 256, "D": 256, "B": 1, "dtype": "fp16", "BLOCK_N": 32, "BLOCK_K": 64, "num_warps": 8, "num_stages": 1, "time_ms": 1.2039786577224731, "status": "ok"}
{"N": 1048576, "K": 256, "D": 256, "B": 1, "dtype": "fp16", "BLOCK_N": 32, "BLOCK_K": 64, "num_warps": 8, "num_stages": 2, "time_ms": 0.9788879901170731, "status": "ok"}
{"N": 1048576, "K": 256, "D": 256, "B": 1, "dtype": "fp16", "BLOCK_N": 32, "BLOCK_K": 64, "num_warps": 8, "num_stages": 4, "time_ms": 1.1156160235404968, "status": "ok"}
{"N": 1048576, "K": 256, "D": 256, "B": 1, "dtype": "fp16", "BLOCK_N": 32, "BLOCK_K": 128, "num_warps": 4, "num_stages": 1, "time_ms": 0.9869919866323471, "status": "ok"}
{"N": 1048576, "K": 256, "D": 256, "B": 1, "dtype": "fp16", "BLOCK_N": 32, "BLOCK_K": 128, "num_warps": 4, "num_stages": 2, "time_ms": 0.8362432003021241, "status": "ok"}
{"N": 1048576, "K": 256, "D": 256, "B": 1, "dtype": "fp16", "BLOCK_N": 32, "BLOCK_K": 128, "num_warps": 4, "num_stages": 4, "time_ms": 1.3604800303777058, "status": "ok"}
{"N": 1048576, "K": 256, "D": 256, "B": 1, "dtype": "fp16", "BLOCK_N": 32, "BLOCK_K": 128, "num_warps": 8, "num_stages": 1, "time_ms": 1.162933309872945, "status": "ok"}
{"N": 1048576, "K": 256, "D": 256, "B": 1, "dtype": "fp16", "BLOCK_N": 32, "BLOCK_K": 128, "num_warps": 8, "num_stages": 2, "time_ms": 0.9536399990320206, "status": "ok"}
{"N": 1048576, "K": 256, "D": 256, "B": 1, "dtype": "fp16", "BLOCK_N": 32, "BLOCK_K": 128, "num_warps": 8, "num_stages": 4, "time_ms": 1.4229653278986614, "status": "ok"}
{"N": 1048576, "K": 256, "D": 256, "B": 1, "dtype": "fp16", "BLOCK_N": 64, "BLOCK_K": 32, "num_warps": 4, "num_stages": 1, "time_ms": 0.5313639938831329, "status": "ok"}
{"N": 1048576, "K": 256, "D": 256, "B": 1, "dtype": "fp16", "BLOCK_N": 64, "BLOCK_K": 32, "num_warps": 4, "num_stages": 2, "time_ms": 0.5045680031180382, "status": "ok"}
{"N": 1048576, "K": 256, "D": 256, "B": 1, "dtype": "fp16", "BLOCK_N": 64, "BLOCK_K": 32, "num_warps": 4, "num_stages": 4, "time_ms": 0.5240680128335953, "status": "ok"}
{"N": 1048576, "K": 256, "D": 256, "B": 1, "dtype": "fp16", "BLOCK_N": 64, "BLOCK_K": 32, "num_warps": 8, "num_stages": 1, "time_ms": 0.8080576062202454, "status": "ok"}
{"N": 1048576, "K": 256, "D": 256, "B": 1, "dtype": "fp16", "BLOCK_N": 64, "BLOCK_K": 32, "num_warps": 8, "num_stages": 2, "time_ms": 0.7279679973920187, "status": "ok"}
{"N": 1048576, "K": 256, "D": 256, "B": 1, "dtype": "fp16", "BLOCK_N": 64, "BLOCK_K": 32, "num_warps": 8, "num_stages": 4, "time_ms": 0.7719104051589966, "status": "ok"}
{"N": 1048576, "K": 256, "D": 256, "B": 1, "dtype": "fp16", "BLOCK_N": 64, "BLOCK_K": 64, "num_warps": 4, "num_stages": 1, "time_ms": 0.48203200101852417, "status": "ok"}
{"N": 1048576, "K": 256, "D": 256, "B": 1, "dtype": "fp16", "BLOCK_N": 64, "BLOCK_K": 64, "num_warps": 4, "num_stages": 2, "time_ms": 0.48322799801826477, "status": "ok"}
{"N": 1048576, "K": 256, "D": 256, "B": 1, "dtype": "fp16", "BLOCK_N": 64, "BLOCK_K": 64, "num_warps": 4, "num_stages": 4, "time_ms": 0.6742666661739349, "status": "ok"}
{"N": 1048576, "K": 256, "D": 256, "B": 1, "dtype": "fp16", "BLOCK_N": 64, "BLOCK_K": 64, "num_warps": 8, "num_stages": 1, "time_ms": 0.6346453527609507, "status": "ok"}
{"N": 1048576, "K": 256, "D": 256, "B": 1, "dtype": "fp16", "BLOCK_N": 64, "BLOCK_K": 64, "num_warps": 8, "num_stages": 2, "time_ms": 0.5994605677468436, "status": "ok"}
{"N": 1048576, "K": 256, "D": 256, "B": 1, "dtype": "fp16", "BLOCK_N": 64, "BLOCK_K": 64, "num_warps": 8, "num_stages": 4, "time_ms": 0.8261120200157166, "status": "ok"}
{"N": 1048576, "K": 256, "D": 256, "B": 1, "dtype": "fp16", "BLOCK_N": 64, "BLOCK_K": 128, "num_warps": 4, "num_stages": 1, "time_ms": 0.49917199835181236, "status": "ok"}
{"N": 1048576, "K": 256, "D": 256, "B": 1, "dtype": "fp16", "BLOCK_N": 64, "BLOCK_K": 128, "num_warps": 4, "num_stages": 2, "time_ms": 0.6324746608734131, "status": "ok"}
{"N": 1048576, "K": 256, "D": 256, "B": 1, "dtype": "fp16", "BLOCK_N": 64, "BLOCK_K": 128, "num_warps": 4, "num_stages": 4, "status": "oor"}
{"N": 1048576, "K": 256, "D": 256, "B": 1, "dtype": "fp16", "BLOCK_N": 64, "BLOCK_K": 128, "num_warps": 8, "num_stages": 1, "time_ms": 0.5754422715732029, "status": "ok"}
{"N": 1048576, "K": 256, "D": 256, "B": 1, "dtype": "fp16", "BLOCK_N": 64, "BLOCK_K": 128, "num_warps": 8, "num_stages": 2, "time_ms": 0.7178613344828287, "status": "ok"}
{"N": 1048576, "K": 256, "D": 256, "B": 1, "dtype": "fp16", "BLOCK_N": 64, "BLOCK_K": 128, "num_warps": 8, "num_stages": 4, "status": "oor"}
{"N": 1048576, "K": 256, "D": 256, "B": 1, "dtype": "fp16", "BLOCK_N": 128, "BLOCK_K": 32, "num_warps": 4, "num_stages": 1, "time_ms": 0.5325480028986931, "status": "ok"}
{"N": 1048576, "K": 256, "D": 256, "B": 1, "dtype": "fp16", "BLOCK_N": 128, "BLOCK_K": 32, "num_warps": 4, "num_stages": 2, "time_ms": 0.49191200360655785, "status": "ok"}
{"N": 1048576, "K": 256, "D": 256, "B": 1, "dtype": "fp16", "BLOCK_N": 128, "BLOCK_K": 32, "num_warps": 4, "num_stages": 4, "time_ms": 0.6549973289171854, "status": "ok"}
{"N": 1048576, "K": 256, "D": 256, "B": 1, "dtype": "fp16", "BLOCK_N": 128, "BLOCK_K": 32, "num_warps": 8, "num_stages": 1, "time_ms": 0.505343995988369, "status": "ok"}
{"N": 1048576, "K": 256, "D": 256, "B": 1, "dtype": "fp16", "BLOCK_N": 128, "BLOCK_K": 32, "num_warps": 8, "num_stages": 2, "time_ms": 0.4663786656326718, "status": "ok"}
{"N": 1048576, "K": 256, "D": 256, "B": 1, "dtype": "fp16", "BLOCK_N": 128, "BLOCK_K": 32, "num_warps": 8, "num_stages": 4, "time_ms": 0.6010239975793021, "status": "ok"}
{"N": 1048576, "K": 256, "D": 256, "B": 1, "dtype": "fp16", "BLOCK_N": 128, "BLOCK_K": 64, "num_warps": 4, "num_stages": 1, "time_ms": 0.4422577718893687, "status": "ok"}
{"N": 1048576, "K": 256, "D": 256, "B": 1, "dtype": "fp16", "BLOCK_N": 128, "BLOCK_K": 64, "num_warps": 4, "num_stages": 2, "time_ms": 0.571140570299966, "status": "ok"}
{"N": 1048576, "K": 256, "D": 256, "B": 1, "dtype": "fp16", "BLOCK_N": 128, "BLOCK_K": 64, "num_warps": 4, "num_stages": 4, "time_ms": 0.5257760062813759, "status": "ok"}
{"N": 1048576, "K": 256, "D": 256, "B": 1, "dtype": "fp16", "BLOCK_N": 128, "BLOCK_K": 64, "num_warps": 8, "num_stages": 1, "time_ms": 0.43439644906255936, "status": "ok"}
{"N": 1048576, "K": 256, "D": 256, "B": 1, "dtype": "fp16", "BLOCK_N": 128, "BLOCK_K": 64, "num_warps": 8, "num_stages": 2, "time_ms": 0.5297559946775436, "status": "ok"}
{"N": 1048576, "K": 256, "D": 256, "B": 1, "dtype": "fp16", "BLOCK_N": 128, "BLOCK_K": 64, "num_warps": 8, "num_stages": 4, "time_ms": 0.48917199671268463, "status": "ok"}
{"N": 1048576, "K": 256, "D": 256, "B": 1, "dtype": "fp16", "BLOCK_N": 128, "BLOCK_K": 128, "num_warps": 4, "num_stages": 1, "time_ms": 0.5609371406691415, "status": "ok"}
{"N": 1048576, "K": 256, "D": 256, "B": 1, "dtype": "fp16", "BLOCK_N": 128, "BLOCK_K": 128, "num_warps": 4, "num_stages": 2, "time_ms": 0.5141879990696907, "status": "ok"}
{"N": 1048576, "K": 256, "D": 256, "B": 1, "dtype": "fp16", "BLOCK_N": 128, "BLOCK_K": 128, "num_warps": 4, "num_stages": 4, "status": "oor"}
{"N": 1048576, "K": 256, "D": 256, "B": 1, "dtype": "fp16", "BLOCK_N": 128, "BLOCK_K": 128, "num_warps": 8, "num_stages": 1, "time_ms": 0.5307159870862961, "status": "ok"}
{"N": 1048576, "K": 256, "D": 256, "B": 1, "dtype": "fp16", "BLOCK_N": 128, "BLOCK_K": 128, "num_warps": 8, "num_stages": 2, "time_ms": 0.48627200350165367, "status": "ok"}
{"N": 1048576, "K": 256, "D": 256, "B": 1, "dtype": "fp16", "BLOCK_N": 128, "BLOCK_K": 128, "num_warps": 8, "num_stages": 4, "status": "oor"}
{"summary": true, "N": 1048576, "K": 256, "D": 256, "B": 1, "dtype": "fp16", "best": {"N": 1048576, "K": 256, "D": 256, "B": 1, "dtype": "fp16", "BLOCK_N": 128, "BLOCK_K": 64, "num_warps": 8, "num_stages": 1, "time_ms": 0.43439644906255936, "status": "ok"}, "best_time_ms": 0.43439644906255936, "tuning_seconds": 18.62468981742859, "skipped": 4}
