grid_results_h100/N1048576_K1024_D64_B32_fp16.jsonl
{"N": 1048576, "K": 1024, "D": 64, "B": 32, "dtype": "fp16", "BLOCK_N": 32, "BLOCK_K": 32, "num_warps": 4, "num_stages": 1, "time_ms": 51.39683151245117, "status": "ok"}
{"N": 1048576, "K": 1024, "D": 64, "B": 32, "dtype": "fp16", "BLOCK_N": 32, "BLOCK_K": 32, "num_warps": 4, "num_stages": 2, "time_ms": 46.19385528564453, "status": "ok"}
{"N": 1048576, "K": 1024, "D": 64, "B": 32, "dtype": "fp16", "BLOCK_N": 32, "BLOCK_K": 32, "num_warps": 4, "num_stages": 4, "time_ms": 46.092735290527344, "status": "ok"}
{"N": 1048576, "K": 1024, "D": 64, "B": 32, "dtype": "fp16", "BLOCK_N": 32, "BLOCK_K": 32, "num_warps": 8, "num_stages": 1, "time_ms": 82.03250885009766, "status": "ok"}
{"N": 1048576, "K": 1024, "D": 64, "B": 32, "dtype": "fp16", "BLOCK_N": 32, "BLOCK_K": 32, "num_warps": 8, "num_stages": 2, "time_ms": 78.88521575927734, "status": "ok"}
{"N": 1048576, "K": 1024, "D": 64, "B": 32, "dtype": "fp16", "BLOCK_N": 32, "BLOCK_K": 32, "num_warps": 8, "num_stages": 4, "time_ms": 78.41107177734375, "status": "ok"}
{"N": 1048576, "K": 1024, "D": 64, "B": 32, "dtype": "fp16", "BLOCK_N": 32, "BLOCK_K": 64, "num_warps": 4, "num_stages": 1, "time_ms": 43.95027160644531, "status": "ok"}
{"N": 1048576, "K": 1024, "D": 64, "B": 32, "dtype": "fp16", "BLOCK_N": 32, "BLOCK_K": 64, "num_warps": 4, "num_stages": 2, "time_ms": 39.799198150634766, "status": "ok"}
{"N": 1048576, "K": 1024, "D": 64, "B": 32, "dtype": "fp16", "BLOCK_N": 32, "BLOCK_K": 64, "num_warps": 4, "num_stages": 4, "time_ms": 38.80710220336914, "status": "ok"}
{"N": 1048576, "K": 1024, "D": 64, "B": 32, "dtype": "fp16", "BLOCK_N": 32, "BLOCK_K": 64, "num_warps": 8, "num_stages": 1, "time_ms": 53.214111328125, "status": "ok"}
{"N": 1048576, "K": 1024, "D": 64, "B": 32, "dtype": "fp16", "BLOCK_N": 32, "BLOCK_K": 64, "num_warps": 8, "num_stages": 2, "time_ms": 50.395870208740234, "status": "ok"}
{"N": 1048576, "K": 1024, "D": 64, "B": 32, "dtype": "fp16", "BLOCK_N": 32, "BLOCK_K": 64, "num_warps": 8, "num_stages": 4, "time_ms": 50.38256072998047, "status": "ok"}
{"N": 1048576, "K": 1024, "D": 64, "B": 32, "dtype": "fp16", "BLOCK_N": 32, "BLOCK_K": 128, "num_warps": 4, "num_stages": 1, "time_ms": 34.69935989379883, "status": "ok"}
{"N": 1048576, "K": 1024, "D": 64, "B": 32, "dtype": "fp16", "BLOCK_N": 32, "BLOCK_K": 128, "num_warps": 4, "num_stages": 2, "time_ms": 32.19513702392578, "status": "ok"}
{"N": 1048576, "K": 1024, "D": 64, "B": 32, "dtype": "fp16", "BLOCK_N": 32, "BLOCK_K": 128, "num_warps": 4, "num_stages": 4, "time_ms": 32.69171142578125, "status": "ok"}
{"N": 1048576, "K": 1024, "D": 64, "B": 32, "dtype": "fp16", "BLOCK_N": 32, "BLOCK_K": 128, "num_warps": 8, "num_stages": 1, "time_ms": 55.18073654174805, "status": "ok"}
{"N": 1048576, "K": 1024, "D": 64, "B": 32, "dtype": "fp16", "BLOCK_N": 32, "BLOCK_K": 128, "num_warps": 8, "num_stages": 2, "time_ms": 48.48963165283203, "status": "ok"}
{"N": 1048576, "K": 1024, "D": 64, "B": 32, "dtype": "fp16", "BLOCK_N": 32, "BLOCK_K": 128, "num_warps": 8, "num_stages": 4, "time_ms": 47.211456298828125, "status": "ok"}
{"N": 1048576, "K": 1024, "D": 64, "B": 32, "dtype": "fp16", "BLOCK_N": 64, "BLOCK_K": 32, "num_warps": 4, "num_stages": 1, "time_ms": 21.12928009033203, "status": "ok"}
{"N": 1048576, "K": 1024, "D": 64, "B": 32, "dtype": "fp16", "BLOCK_N": 64, "BLOCK_K": 32, "num_warps": 4, "num_stages": 2, "time_ms": 21.085376739501953, "status": "ok"}
{"N": 1048576, "K": 1024, "D": 64, "B": 32, "dtype": "fp16", "BLOCK_N": 64, "BLOCK_K": 32, "num_warps": 4, "num_stages": 4, "time_ms": 21.192256927490234, "status": "ok"}
{"N": 1048576, "K": 1024, "D": 64, "B": 32, "dtype": "fp16", "BLOCK_N": 64, "BLOCK_K": 32, "num_warps": 8, "num_stages": 1, "time_ms": 40.96556854248047, "status": "ok"}
{"N": 1048576, "K": 1024, "D": 64, "B": 32, "dtype": "fp16", "BLOCK_N": 64, "BLOCK_K": 32, "num_warps": 8, "num_stages": 2, "time_ms": 38.898048400878906, "status": "ok"}
{"N": 1048576, "K": 1024, "D": 64, "B": 32, "dtype": "fp16", "BLOCK_N": 64, "BLOCK_K": 32, "num_warps": 8, "num_stages": 4, "time_ms": 38.54851150512695, "status": "ok"}
{"N": 1048576, "K": 1024, "D": 64, "B": 32, "dtype": "fp16", "BLOCK_N": 64, "BLOCK_K": 64, "num_warps": 4, "num_stages": 1, "time_ms": 20.120960235595703, "status": "ok"}
{"N": 1048576, "K": 1024, "D": 64, "B": 32, "dtype": "fp16", "BLOCK_N": 64, "BLOCK_K": 64, "num_warps": 4, "num_stages": 2, "time_ms": 19.120256423950195, "status": "ok"}
{"N": 1048576, "K": 1024, "D": 64, "B": 32, "dtype": "fp16", "BLOCK_N": 64, "BLOCK_K": 64, "num_warps": 4, "num_stages": 4, "time_ms": 19.701919555664062, "status": "ok"}
{"N": 1048576, "K": 1024, "D": 64, "B": 32, "dtype": "fp16", "BLOCK_N": 64, "BLOCK_K": 64, "num_warps": 8, "num_stages": 1, "time_ms": 29.66044807434082, "status": "ok"}
{"N": 1048576, "K": 1024, "D": 64, "B": 32, "dtype": "fp16", "BLOCK_N": 64, "BLOCK_K": 64, "num_warps": 8, "num_stages": 2, "time_ms": 28.904064178466797, "status": "ok"}
{"N": 1048576, "K": 1024, "D": 64, "B": 32, "dtype": "fp16", "BLOCK_N": 64, "BLOCK_K": 64, "num_warps": 8, "num_stages": 4, "time_ms": 28.780864715576172, "status": "ok"}
{"N": 1048576, "K": 1024, "D": 64, "B": 32, "dtype": "fp16", "BLOCK_N": 64, "BLOCK_K": 128, "num_warps": 4, "num_stages": 1, "time_ms": 18.82249641418457, "status": "ok"}
{"N": 1048576, "K": 1024, "D": 64, "B": 32, "dtype": "fp16", "BLOCK_N": 64, "BLOCK_K": 128, "num_warps": 4, "num_stages": 2, "time_ms": 18.91209602355957, "status": "ok"}
{"N": 1048576, "K": 1024, "D": 64, "B": 32, "dtype": "fp16", "BLOCK_N": 64, "BLOCK_K": 128, "num_warps": 4, "num_stages": 4, "time_ms": 19.09644889831543, "status": "ok"}
{"N": 1048576, "K": 1024, "D": 64, "B": 32, "dtype": "fp16", "BLOCK_N": 64, "BLOCK_K": 128, "num_warps": 8, "num_stages": 1, "time_ms": 28.646080017089844, "status": "ok"}
{"N": 1048576, "K": 1024, "D": 64, "B": 32, "dtype": "fp16", "BLOCK_N": 64, "BLOCK_K": 128, "num_warps": 8, "num_stages": 2, "time_ms": 27.542335510253906, "status": "ok"}
{"N": 1048576, "K": 1024, "D": 64, "B": 32, "dtype": "fp16", "BLOCK_N": 64, "BLOCK_K": 128, "num_warps": 8, "num_stages": 4, "time_ms": 26.837087631225586, "status": "ok"}
{"N": 1048576, "K": 1024, "D": 64, "B": 32, "dtype": "fp16", "BLOCK_N": 128, "BLOCK_K": 32, "num_warps": 4, "num_stages": 1, "time_ms": 20.491296768188477, "status": "ok"}
{"N": 1048576, "K": 1024, "D": 64, "B": 32, "dtype": "fp16", "BLOCK_N": 128, "BLOCK_K": 32, "num_warps": 4, "num_stages": 2, "time_ms": 20.265920639038086, "status": "ok"}
{"N": 1048576, "K": 1024, "D": 64, "B": 32, "dtype": "fp16", "BLOCK_N": 128, "BLOCK_K": 32, "num_warps": 4, "num_stages": 4, "time_ms": 20.456832885742188, "status": "ok"}
{"N": 1048576, "K": 1024, "D": 64, "B": 32, "dtype": "fp16", "BLOCK_N": 128, "BLOCK_K": 32, "num_warps": 8, "num_stages": 1, "time_ms": 21.520992279052734, "status": "ok"}
{"N": 1048576, "K": 1024, "D": 64, "B": 32, "dtype": "fp16", "BLOCK_N": 128, "BLOCK_K": 32, "num_warps": 8, "num_stages": 2, "time_ms": 22.43052864074707, "status": "ok"}
{"N": 1048576, "K": 1024, "D": 64, "B": 32, "dtype": "fp16", "BLOCK_N": 128, "BLOCK_K": 32, "num_warps": 8, "num_stages": 4, "time_ms": 22.155391693115234, "status": "ok"}
{"N": 1048576, "K": 1024, "D": 64, "B": 32, "dtype": "fp16", "BLOCK_N": 128, "BLOCK_K": 64, "num_warps": 4, "num_stages": 1, "time_ms": 19.90937614440918, "status": "ok"}
{"N": 1048576, "K": 1024, "D": 64, "B": 32, "dtype": "fp16", "BLOCK_N": 128, "BLOCK_K": 64, "num_warps": 4, "num_stages": 2, "time_ms": 18.242015838623047, "status": "ok"}
{"N": 1048576, "K": 1024, "D": 64, "B": 32, "dtype": "fp16", "BLOCK_N": 128, "BLOCK_K": 64, "num_warps": 4, "num_stages": 4, "time_ms": 18.429567337036133, "status": "ok"}
{"N": 1048576, "K": 1024, "D": 64, "B": 32, "dtype": "fp16", "BLOCK_N": 128, "BLOCK_K": 64, "num_warps": 8, "num_stages": 1, "time_ms": 20.40595245361328, "status": "ok"}
{"N": 1048576, "K": 1024, "D": 64, "B": 32, "dtype": "fp16", "BLOCK_N": 128, "BLOCK_K": 64, "num_warps": 8, "num_stages": 2, "time_ms": 19.683488845825195, "status": "ok"}
{"N": 1048576, "K": 1024, "D": 64, "B": 32, "dtype": "fp16", "BLOCK_N": 128, "BLOCK_K": 64, "num_warps": 8, "num_stages": 4, "time_ms": 20.029375076293945, "status": "ok"}
{"N": 1048576, "K": 1024, "D": 64, "B": 32, "dtype": "fp16", "BLOCK_N": 128, "BLOCK_K": 128, "num_warps": 4, "num_stages": 1, "time_ms": 20.687904357910156, "status": "ok"}
{"N": 1048576, "K": 1024, "D": 64, "B": 32, "dtype": "fp16", "BLOCK_N": 128, "BLOCK_K": 128, "num_warps": 4, "num_stages": 2, "time_ms": 19.709407806396484, "status": "ok"}
{"N": 1048576, "K": 1024, "D": 64, "B": 32, "dtype": "fp16", "BLOCK_N": 128, "BLOCK_K": 128, "num_warps": 4, "num_stages": 4, "time_ms": 18.51100730895996, "status": "ok"}
{"N": 1048576, "K": 1024, "D": 64, "B": 32, "dtype": "fp16", "BLOCK_N": 128, "BLOCK_K": 128, "num_warps": 8, "num_stages": 1, "time_ms": 27.249055862426758, "status": "ok"}
{"N": 1048576, "K": 1024, "D": 64, "B": 32, "dtype": "fp16", "BLOCK_N": 128, "BLOCK_K": 128, "num_warps": 8, "num_stages": 2, "time_ms": 19.478368759155273, "status": "ok"}
{"N": 1048576, "K": 1024, "D": 64, "B": 32, "dtype": "fp16", "BLOCK_N": 128, "BLOCK_K": 128, "num_warps": 8, "num_stages": 4, "time_ms": 18.748544692993164, "status": "ok"}
{"summary": true, "N": 1048576, "K": 1024, "D": 64, "B": 32, "dtype": "fp16", "best": {"N": 1048576, "K": 1024, "D": 64, "B": 32, "dtype": "fp16", "BLOCK_N": 128, "BLOCK_K": 64, "num_warps": 4, "num_stages": 2, "time_ms": 18.242015838623047, "status": "ok"}, "best_time_ms": 18.242015838623047, "tuning_seconds": 25.75848412513733, "skipped": 0}
