grid_results_h100/N1048576_K200000_D64_B32_fp16.jsonl
{"N": 1048576, "K": 200000, "D": 64, "B": 32, "dtype": "fp16", "BLOCK_N": 32, "BLOCK_K": 32, "num_warps": 4, "num_stages": 1, "time_ms": 10183.9775390625, "status": "ok"}
{"N": 1048576, "K": 200000, "D": 64, "B": 32, "dtype": "fp16", "BLOCK_N": 32, "BLOCK_K": 32, "num_warps": 4, "num_stages": 2, "time_ms": 8995.94921875, "status": "ok"}
{"N": 1048576, "K": 200000, "D": 64, "B": 32, "dtype": "fp16", "BLOCK_N": 32, "BLOCK_K": 32, "num_warps": 4, "num_stages": 4, "time_ms": 8922.0107421875, "status": "ok"}
{"N": 1048576, "K": 200000, "D": 64, "B": 32, "dtype": "fp16", "BLOCK_N": 32, "BLOCK_K": 32, "num_warps": 8, "num_stages": 1, "time_ms": 16450.33984375, "status": "ok"}
{"N": 1048576, "K": 200000, "D": 64, "B": 32, "dtype": "fp16", "BLOCK_N": 32, "BLOCK_K": 32, "num_warps": 8, "num_stages": 2, "time_ms": 15527.3662109375, "status": "ok"}
{"N": 1048576, "K": 200000, "D": 64, "B": 32, "dtype": "fp16", "BLOCK_N": 32, "BLOCK_K": 32, "num_warps": 8, "num_stages": 4, "time_ms": 15174.4072265625, "status": "ok"}
{"N": 1048576, "K": 200000, "D": 64, "B": 32, "dtype": "fp16", "BLOCK_N": 32, "BLOCK_K": 64, "num_warps": 4, "num_stages": 1, "time_ms": 8715.8916015625, "status": "ok"}
{"N": 1048576, "K": 200000, "D": 64, "B": 32, "dtype": "fp16", "BLOCK_N": 32, "BLOCK_K": 64, "num_warps": 4, "num_stages": 2, "time_ms": 7693.94677734375, "status": "ok"}
{"N": 1048576, "K": 200000, "D": 64, "B": 32, "dtype": "fp16", "BLOCK_N": 32, "BLOCK_K": 64, "num_warps": 4, "num_stages": 4, "time_ms": 7353.7119140625, "status": "ok"}
{"N": 1048576, "K": 200000, "D": 64, "B": 32, "dtype": "fp16", "BLOCK_N": 32, "BLOCK_K": 64, "num_warps": 8, "num_stages": 1, "time_ms": 10658.69140625, "status": "ok"}
{"N": 1048576, "K": 200000, "D": 64, "B": 32, "dtype": "fp16", "BLOCK_N": 32, "BLOCK_K": 64, "num_warps": 8, "num_stages": 2, "time_ms": 9833.6943359375, "status": "ok"}
{"N": 1048576, "K": 200000, "D": 64, "B": 32, "dtype": "fp16", "BLOCK_N": 32, "BLOCK_K": 64, "num_warps": 8, "num_stages": 4, "time_ms": 9534.7998046875, "status": "ok"}
{"N": 1048576, "K": 200000, "D": 64, "B": 32, "dtype": "fp16", "BLOCK_N": 32, "BLOCK_K": 128, "num_warps": 4, "num_stages": 1, "time_ms": 7057.0810546875, "status": "ok"}
{"N": 1048576, "K": 200000, "D": 64, "B": 32, "dtype": "fp16", "BLOCK_N": 32, "BLOCK_K": 128, "num_warps": 4, "num_stages": 2, "time_ms": 6368.59228515625, "status": "ok"}
{"N": 1048576, "K": 200000, "D": 64, "B": 32, "dtype": "fp16", "BLOCK_N": 32, "BLOCK_K": 128, "num_warps": 4, "num_stages": 4, "time_ms": 6373.37646484375, "status": "ok"}
{"N": 1048576, "K": 200000, "D": 64, "B": 32, "dtype": "fp16", "BLOCK_N": 32, "BLOCK_K": 128, "num_warps": 8, "num_stages": 1, "time_ms": 11513.41015625, "status": "ok"}
{"N": 1048576, "K": 200000, "D": 64, "B": 32, "dtype": "fp16", "BLOCK_N": 32, "BLOCK_K": 128, "num_warps": 8, "num_stages": 2, "time_ms": 9212.630859375, "status": "ok"}
{"N": 1048576, "K": 200000, "D": 64, "B": 32, "dtype": "fp16", "BLOCK_N": 32, "BLOCK_K": 128, "num_warps": 8, "num_stages": 4, "time_ms": 9007.5234375, "status": "ok"}
{"N": 1048576, "K": 200000, "D": 64, "B": 32, "dtype": "fp16", "BLOCK_N": 64, "BLOCK_K": 32, "num_warps": 4, "num_stages": 1, "time_ms": 4251.39013671875, "status": "ok"}
{"N": 1048576, "K": 200000, "D": 64, "B": 32, "dtype": "fp16", "BLOCK_N": 64, "BLOCK_K": 32, "num_warps": 4, "num_stages": 2, "time_ms": 4143.150390625, "status": "ok"}
{"N": 1048576, "K": 200000, "D": 64, "B": 32, "dtype": "fp16", "BLOCK_N": 64, "BLOCK_K": 32, "num_warps": 4, "num_stages": 4, "time_ms": 4187.9443359375, "status": "ok"}
{"N": 1048576, "K": 200000, "D": 64, "B": 32, "dtype": "fp16", "BLOCK_N": 64, "BLOCK_K": 32, "num_warps": 8, "num_stages": 1, "time_ms": 8257.6337890625, "status": "ok"}
{"N": 1048576, "K": 200000, "D": 64, "B": 32, "dtype": "fp16", "BLOCK_N": 64, "BLOCK_K": 32, "num_warps": 8, "num_stages": 2, "time_ms": 7741.0048828125, "status": "ok"}
{"N": 1048576, "K": 200000, "D": 64, "B": 32, "dtype": "fp16", "BLOCK_N": 64, "BLOCK_K": 32, "num_warps": 8, "num_stages": 4, "time_ms": 7500.451171875, "status": "ok"}
{"N": 1048576, "K": 200000, "D": 64, "B": 32, "dtype": "fp16", "BLOCK_N": 64, "BLOCK_K": 64, "num_warps": 4, "num_stages": 1, "time_ms": 3993.591064453125, "status": "ok"}
{"N": 1048576, "K": 200000, "D": 64, "B": 32, "dtype": "fp16", "BLOCK_N": 64, "BLOCK_K": 64, "num_warps": 4, "num_stages": 2, "time_ms": 3782.273193359375, "status": "ok"}
{"N": 1048576, "K": 200000, "D": 64, "B": 32, "dtype": "fp16", "BLOCK_N": 64, "BLOCK_K": 64, "num_warps": 4, "num_stages": 4, "time_ms": 3780.486572265625, "status": "ok"}
{"N": 1048576, "K": 200000, "D": 64, "B": 32, "dtype": "fp16", "BLOCK_N": 64, "BLOCK_K": 64, "num_warps": 8, "num_stages": 1, "time_ms": 5833.10400390625, "status": "ok"}
{"N": 1048576, "K": 200000, "D": 64, "B": 32, "dtype": "fp16", "BLOCK_N": 64, "BLOCK_K": 64, "num_warps": 8, "num_stages": 2, "time_ms": 5576.81494140625, "status": "ok"}
{"N": 1048576, "K": 200000, "D": 64, "B": 32, "dtype": "fp16", "BLOCK_N": 64, "BLOCK_K": 64, "num_warps": 8, "num_stages": 4, "time_ms": 5507.83984375, "status": "ok"}
{"N": 1048576, "K": 200000, "D": 64, "B": 32, "dtype": "fp16", "BLOCK_N": 64, "BLOCK_K": 128, "num_warps": 4, "num_stages": 1, "time_ms": 4232.2138671875, "status": "ok"}
{"N": 1048576, "K": 200000, "D": 64, "B": 32, "dtype": "fp16", "BLOCK_N": 64, "BLOCK_K": 128, "num_warps": 4, "num_stages": 2, "time_ms": 3929.67626953125, "status": "ok"}
{"N": 1048576, "K": 200000, "D": 64, "B": 32, "dtype": "fp16", "BLOCK_N": 64, "BLOCK_K": 128, "num_warps": 4, "num_stages": 4, "time_ms": 3884.306640625, "status": "ok"}
{"N": 1048576, "K": 200000, "D": 64, "B": 32, "dtype": "fp16", "BLOCK_N": 64, "BLOCK_K": 128, "num_warps": 8, "num_stages": 1, "time_ms": 6488.31787109375, "status": "ok"}
{"N": 1048576, "K": 200000, "D": 64, "B": 32, "dtype": "fp16", "BLOCK_N": 64, "BLOCK_K": 128, "num_warps": 8, "num_stages": 2, "time_ms": 5837.4052734375, "status": "ok"}
{"N": 1048576, "K": 200000, "D": 64, "B": 32, "dtype": "fp16", "BLOCK_N": 64, "BLOCK_K": 128, "num_warps": 8, "num_stages": 4, "time_ms": 5621.193359375, "status": "ok"}
{"N": 1048576, "K": 200000, "D": 64, "B": 32, "dtype": "fp16", "BLOCK_N": 128, "BLOCK_K": 32, "num_warps": 4, "num_stages": 1, "time_ms": 3989.811767578125, "status": "ok"}
{"N": 1048576, "K": 200000, "D": 64, "B": 32, "dtype": "fp16", "BLOCK_N": 128, "BLOCK_K": 32, "num_warps": 4, "num_stages": 2, "time_ms": 3935.298095703125, "status": "ok"}
{"N": 1048576, "K": 200000, "D": 64, "B": 32, "dtype": "fp16", "BLOCK_N": 128, "BLOCK_K": 32, "num_warps": 4, "num_stages": 4, "time_ms": 3939.361083984375, "status": "ok"}
{"N": 1048576, "K": 200000, "D": 64, "B": 32, "dtype": "fp16", "BLOCK_N": 128, "BLOCK_K": 32, "num_warps": 8, "num_stages": 1, "time_ms": 4217.53076171875, "status": "ok"}
{"N": 1048576, "K": 200000, "D": 64, "B": 32, "dtype": "fp16", "BLOCK_N": 128, "BLOCK_K": 32, "num_warps": 8, "num_stages": 2, "time_ms": 4466.279296875, "status": "ok"}
{"N": 1048576, "K": 200000, "D": 64, "B": 32, "dtype": "fp16", "BLOCK_N": 128, "BLOCK_K": 32, "num_warps": 8, "num_stages": 4, "time_ms": 4330.13623046875, "status": "ok"}
{"N": 1048576, "K": 200000, "D": 64, "B": 32, "dtype": "fp16", "BLOCK_N": 128, "BLOCK_K": 64, "num_warps": 4, "num_stages": 1, "time_ms": 3824.8525390625, "status": "ok"}
{"N": 1048576, "K": 200000, "D": 64, "B": 32, "dtype": "fp16", "BLOCK_N": 128, "BLOCK_K": 64, "num_warps": 4, "num_stages": 2, "time_ms": 3565.411865234375, "status": "ok"}
{"N": 1048576, "K": 200000, "D": 64, "B": 32, "dtype": "fp16", "BLOCK_N": 128, "BLOCK_K": 64, "num_warps": 4, "num_stages": 4, "time_ms": 3527.3974609375, "status": "ok"}
{"N": 1048576, "K": 200000, "D": 64, "B": 32, "dtype": "fp16", "BLOCK_N": 128, "BLOCK_K": 64, "num_warps": 8, "num_stages": 1, "time_ms": 4033.30419921875, "status": "ok"}
{"N": 1048576, "K": 200000, "D": 64, "B": 32, "dtype": "fp16", "BLOCK_N": 128, "BLOCK_K": 64, "num_warps": 8, "num_stages": 2, "time_ms": 3854.038330078125, "status": "ok"}
{"N": 1048576, "K": 200000, "D": 64, "B": 32, "dtype": "fp16", "BLOCK_N": 128, "BLOCK_K": 64, "num_warps": 8, "num_stages": 4, "time_ms": 3738.961181640625, "status": "ok"}
{"N": 1048576, "K": 200000, "D": 64, "B": 32, "dtype": "fp16", "BLOCK_N": 128, "BLOCK_K": 128, "num_warps": 4, "num_stages": 1, "time_ms": 4134.798828125, "status": "ok"}
{"N": 1048576, "K": 200000, "D": 64, "B": 32, "dtype": "fp16", "BLOCK_N": 128, "BLOCK_K": 128, "num_warps": 4, "num_stages": 2, "time_ms": 4048.45654296875, "status": "ok"}
{"N": 1048576, "K": 200000, "D": 64, "B": 32, "dtype": "fp16", "BLOCK_N": 128, "BLOCK_K": 128, "num_warps": 4, "num_stages": 4, "time_ms": 3774.789794921875, "status": "ok"}
{"N": 1048576, "K": 200000, "D": 64, "B": 32, "dtype": "fp16", "BLOCK_N": 128, "BLOCK_K": 128, "num_warps": 8, "num_stages": 1, "time_ms": 6468.9013671875, "status": "ok"}
{"N": 1048576, "K": 200000, "D": 64, "B": 32, "dtype": "fp16", "BLOCK_N": 128, "BLOCK_K": 128, "num_warps": 8, "num_stages": 2, "time_ms": 6381.0712890625, "status": "ok"}
{"N": 1048576, "K": 200000, "D": 64, "B": 32, "dtype": "fp16", "BLOCK_N": 128, "BLOCK_K": 128, "num_warps": 8, "num_stages": 4, "time_ms": 5170.205078125, "status": "ok"}
{"summary": true, "N": 1048576, "K": 200000, "D": 64, "B": 32, "dtype": "fp16", "best": {"N": 1048576, "K": 200000, "D": 64, "B": 32, "dtype": "fp16", "BLOCK_N": 128, "BLOCK_K": 64, "num_warps": 4, "num_stages": 4, "time_ms": 3527.3974609375, "status": "ok"}, "best_time_ms": 3527.3974609375, "tuning_seconds": 2816.670855998993, "skipped": 0}
