grid_results_h100/N1048576_K65536_D128_B32_fp16.jsonl
{"N": 1048576, "K": 65536, "D": 128, "B": 32, "dtype": "fp16", "BLOCK_N": 32, "BLOCK_K": 32, "num_warps": 4, "num_stages": 1, "time_ms": 5095.26513671875, "status": "ok"}
{"N": 1048576, "K": 65536, "D": 128, "B": 32, "dtype": "fp16", "BLOCK_N": 32, "BLOCK_K": 32, "num_warps": 4, "num_stages": 2, "time_ms": 4203.1376953125, "status": "ok"}
{"N": 1048576, "K": 65536, "D": 128, "B": 32, "dtype": "fp16", "BLOCK_N": 32, "BLOCK_K": 32, "num_warps": 4, "num_stages": 4, "time_ms": 4207.98193359375, "status": "ok"}
{"N": 1048576, "K": 65536, "D": 128, "B": 32, "dtype": "fp16", "BLOCK_N": 32, "BLOCK_K": 32, "num_warps": 8, "num_stages": 1, "time_ms": 7546.7451171875, "status": "ok"}
{"N": 1048576, "K": 65536, "D": 128, "B": 32, "dtype": "fp16", "BLOCK_N": 32, "BLOCK_K": 32, "num_warps": 8, "num_stages": 2, "time_ms": 6876.9599609375, "status": "ok"}
{"N": 1048576, "K": 65536, "D": 128, "B": 32, "dtype": "fp16", "BLOCK_N": 32, "BLOCK_K": 32, "num_warps": 8, "num_stages": 4, "time_ms": 6748.978515625, "status": "ok"}
{"N": 1048576, "K": 65536, "D": 128, "B": 32, "dtype": "fp16", "BLOCK_N": 32, "BLOCK_K": 64, "num_warps": 4, "num_stages": 1, "time_ms": 4385.146484375, "status": "ok"}
{"N": 1048576, "K": 65536, "D": 128, "B": 32, "dtype": "fp16", "BLOCK_N": 32, "BLOCK_K": 64, "num_warps": 4, "num_stages": 2, "time_ms": 3572.885009765625, "status": "ok"}
{"N": 1048576, "K": 65536, "D": 128, "B": 32, "dtype": "fp16", "BLOCK_N": 32, "BLOCK_K": 64, "num_warps": 4, "num_stages": 4, "time_ms": 3721.094482421875, "status": "ok"}
{"N": 1048576, "K": 65536, "D": 128, "B": 32, "dtype": "fp16", "BLOCK_N": 32, "BLOCK_K": 64, "num_warps": 8, "num_stages": 1, "time_ms": 5316.52294921875, "status": "ok"}
{"N": 1048576, "K": 65536, "D": 128, "B": 32, "dtype": "fp16", "BLOCK_N": 32, "BLOCK_K": 64, "num_warps": 8, "num_stages": 2, "time_ms": 4505.201171875, "status": "ok"}
{"N": 1048576, "K": 65536, "D": 128, "B": 32, "dtype": "fp16", "BLOCK_N": 32, "BLOCK_K": 64, "num_warps": 8, "num_stages": 4, "time_ms": 4455.1005859375, "status": "ok"}
{"N": 1048576, "K": 65536, "D": 128, "B": 32, "dtype": "fp16", "BLOCK_N": 32, "BLOCK_K": 128, "num_warps": 4, "num_stages": 1, "time_ms": 3564.441162109375, "status": "ok"}
{"N": 1048576, "K": 65536, "D": 128, "B": 32, "dtype": "fp16", "BLOCK_N": 32, "BLOCK_K": 128, "num_warps": 4, "num_stages": 2, "time_ms": 2918.843017578125, "status": "ok"}
{"N": 1048576, "K": 65536, "D": 128, "B": 32, "dtype": "fp16", "BLOCK_N": 32, "BLOCK_K": 128, "num_warps": 4, "num_stages": 4, "time_ms": 3964.59619140625, "status": "ok"}
{"N": 1048576, "K": 65536, "D": 128, "B": 32, "dtype": "fp16", "BLOCK_N": 32, "BLOCK_K": 128, "num_warps": 8, "num_stages": 1, "time_ms": 4785.45166015625, "status": "ok"}
{"N": 1048576, "K": 65536, "D": 128, "B": 32, "dtype": "fp16", "BLOCK_N": 32, "BLOCK_K": 128, "num_warps": 8, "num_stages": 2, "time_ms": 4107.0703125, "status": "ok"}
{"N": 1048576, "K": 65536, "D": 128, "B": 32, "dtype": "fp16", "BLOCK_N": 32, "BLOCK_K": 128, "num_warps": 8, "num_stages": 4, "time_ms": 4089.810546875, "status": "ok"}
{"N": 1048576, "K": 65536, "D": 128, "B": 32, "dtype": "fp16", "BLOCK_N": 64, "BLOCK_K": 32, "num_warps": 4, "num_stages": 1, "time_ms": 2180.082275390625, "status": "ok"}
{"N": 1048576, "K": 65536, "D": 128, "B": 32, "dtype": "fp16", "BLOCK_N": 64, "BLOCK_K": 32, "num_warps": 4, "num_stages": 2, "time_ms": 1862.7904052734375, "status": "ok"}
{"N": 1048576, "K": 65536, "D": 128, "B": 32, "dtype": "fp16", "BLOCK_N": 64, "BLOCK_K": 32, "num_warps": 4, "num_stages": 4, "time_ms": 1952.11083984375, "status": "ok"}
{"N": 1048576, "K": 65536, "D": 128, "B": 32, "dtype": "fp16", "BLOCK_N": 64, "BLOCK_K": 32, "num_warps": 8, "num_stages": 1, "time_ms": 3702.12744140625, "status": "ok"}
{"N": 1048576, "K": 65536, "D": 128, "B": 32, "dtype": "fp16", "BLOCK_N": 64, "BLOCK_K": 32, "num_warps": 8, "num_stages": 2, "time_ms": 3225.31298828125, "status": "ok"}
{"N": 1048576, "K": 65536, "D": 128, "B": 32, "dtype": "fp16", "BLOCK_N": 64, "BLOCK_K": 32, "num_warps": 8, "num_stages": 4, "time_ms": 3254.28564453125, "status": "ok"}
{"N": 1048576, "K": 65536, "D": 128, "B": 32, "dtype": "fp16", "BLOCK_N": 64, "BLOCK_K": 64, "num_warps": 4, "num_stages": 1, "time_ms": 1858.5509033203125, "status": "ok"}
{"N": 1048576, "K": 65536, "D": 128, "B": 32, "dtype": "fp16", "BLOCK_N": 64, "BLOCK_K": 64, "num_warps": 4, "num_stages": 2, "time_ms": 1672.3082275390625, "status": "ok"}
{"N": 1048576, "K": 65536, "D": 128, "B": 32, "dtype": "fp16", "BLOCK_N": 64, "BLOCK_K": 64, "num_warps": 4, "num_stages": 4, "time_ms": 1739.527587890625, "status": "ok"}
{"N": 1048576, "K": 65536, "D": 128, "B": 32, "dtype": "fp16", "BLOCK_N": 64, "BLOCK_K": 64, "num_warps": 8, "num_stages": 1, "time_ms": 2656.123779296875, "status": "ok"}
{"N": 1048576, "K": 65536, "D": 128, "B": 32, "dtype": "fp16", "BLOCK_N": 64, "BLOCK_K": 64, "num_warps": 8, "num_stages": 2, "time_ms": 2358.690673828125, "status": "ok"}
{"N": 1048576, "K": 65536, "D": 128, "B": 32, "dtype": "fp16", "BLOCK_N": 64, "BLOCK_K": 64, "num_warps": 8, "num_stages": 4, "time_ms": 2594.96875, "status": "ok"}
{"N": 1048576, "K": 65536, "D": 128, "B": 32, "dtype": "fp16", "BLOCK_N": 64, "BLOCK_K": 128, "num_warps": 4, "num_stages": 1, "time_ms": 1712.1556396484375, "status": "ok"}
{"N": 1048576, "K": 65536, "D": 128, "B": 32, "dtype": "fp16", "BLOCK_N": 64, "BLOCK_K": 128, "num_warps": 4, "num_stages": 2, "time_ms": 1682.4522705078125, "status": "ok"}
{"N": 1048576, "K": 65536, "D": 128, "B": 32, "dtype": "fp16", "BLOCK_N": 64, "BLOCK_K": 128, "num_warps": 4, "num_stages": 4, "time_ms": 2039.9656982421875, "status": "ok"}
{"N": 1048576, "K": 65536, "D": 128, "B": 32, "dtype": "fp16", "BLOCK_N": 64, "BLOCK_K": 128, "num_warps": 8, "num_stages": 1, "time_ms": 2500.06103515625, "status": "ok"}
{"N": 1048576, "K": 65536, "D": 128, "B": 32, "dtype": "fp16", "BLOCK_N": 64, "BLOCK_K": 128, "num_warps": 8, "num_stages": 2, "time_ms": 2164.546142578125, "status": "ok"}
{"N": 1048576, "K": 65536, "D": 128, "B": 32, "dtype": "fp16", "BLOCK_N": 64, "BLOCK_K": 128, "num_warps": 8, "num_stages": 4, "time_ms": 2395.441162109375, "status": "ok"}
{"N": 1048576, "K": 65536, "D": 128, "B": 32, "dtype": "fp16", "BLOCK_N": 128, "BLOCK_K": 32, "num_warps": 4, "num_stages": 1, "time_ms": 1846.843994140625, "status": "ok"}
{"N": 1048576, "K": 65536, "D": 128, "B": 32, "dtype": "fp16", "BLOCK_N": 128, "BLOCK_K": 32, "num_warps": 4, "num_stages": 2, "time_ms": 1840.434326171875, "status": "ok"}
{"N": 1048576, "K": 65536, "D": 128, "B": 32, "dtype": "fp16", "BLOCK_N": 128, "BLOCK_K": 32, "num_warps": 4, "num_stages": 4, "time_ms": 1906.5074462890625, "status": "ok"}
{"N": 1048576, "K": 65536, "D": 128, "B": 32, "dtype": "fp16", "BLOCK_N": 128, "BLOCK_K": 32, "num_warps": 8, "num_stages": 1, "time_ms": 1893.9100341796875, "status": "ok"}
{"N": 1048576, "K": 65536, "D": 128, "B": 32, "dtype": "fp16", "BLOCK_N": 128, "BLOCK_K": 32, "num_warps": 8, "num_stages": 2, "time_ms": 1840.494140625, "status": "ok"}
{"N": 1048576, "K": 65536, "D": 128, "B": 32, "dtype": "fp16", "BLOCK_N": 128, "BLOCK_K": 32, "num_warps": 8, "num_stages": 4, "time_ms": 1886.7308349609375, "status": "ok"}
{"N": 1048576, "K": 65536, "D": 128, "B": 32, "dtype": "fp16", "BLOCK_N": 128, "BLOCK_K": 64, "num_warps": 4, "num_stages": 1, "time_ms": 1627.464599609375, "status": "ok"}
{"N": 1048576, "K": 65536, "D": 128, "B": 32, "dtype": "fp16", "BLOCK_N": 128, "BLOCK_K": 64, "num_warps": 4, "num_stages": 2, "time_ms": 1617.2122802734375, "status": "ok"}
{"N": 1048576, "K": 65536, "D": 128, "B": 32, "dtype": "fp16", "BLOCK_N": 128, "BLOCK_K": 64, "num_warps": 4, "num_stages": 4, "time_ms": 1627.1890869140625, "status": "ok"}
{"N": 1048576, "K": 65536, "D": 128, "B": 32, "dtype": "fp16", "BLOCK_N": 128, "BLOCK_K": 64, "num_warps": 8, "num_stages": 1, "time_ms": 1684.2862548828125, "status": "ok"}
{"N": 1048576, "K": 65536, "D": 128, "B": 32, "dtype": "fp16", "BLOCK_N": 128, "BLOCK_K": 64, "num_warps": 8, "num_stages": 2, "time_ms": 1650.0712890625, "status": "ok"}
{"N": 1048576, "K": 65536, "D": 128, "B": 32, "dtype": "fp16", "BLOCK_N": 128, "BLOCK_K": 64, "num_warps": 8, "num_stages": 4, "time_ms": 1642.19775390625, "status": "ok"}
{"N": 1048576, "K": 65536, "D": 128, "B": 32, "dtype": "fp16", "BLOCK_N": 128, "BLOCK_K": 128, "num_warps": 4, "num_stages": 1, "time_ms": 1610.361572265625, "status": "ok"}
{"N": 1048576, "K": 65536, "D": 128, "B": 32, "dtype": "fp16", "BLOCK_N": 128, "BLOCK_K": 128, "num_warps": 4, "num_stages": 2, "time_ms": 1548.3380126953125, "status": "ok"}
{"N": 1048576, "K": 65536, "D": 128, "B": 32, "dtype": "fp16", "BLOCK_N": 128, "BLOCK_K": 128, "num_warps": 4, "num_stages": 4, "time_ms": 1764.5889892578125, "status": "ok"}
{"N": 1048576, "K": 65536, "D": 128, "B": 32, "dtype": "fp16", "BLOCK_N": 128, "BLOCK_K": 128, "num_warps": 8, "num_stages": 1, "time_ms": 2190.821044921875, "status": "ok"}
{"N": 1048576, "K": 65536, "D": 128, "B": 32, "dtype": "fp16", "BLOCK_N": 128, "BLOCK_K": 128, "num_warps": 8, "num_stages": 2, "time_ms": 1503.263427734375, "status": "ok"}
{"N": 1048576, "K": 65536, "D": 128, "B": 32, "dtype": "fp16", "BLOCK_N": 128, "BLOCK_K": 128, "num_warps": 8, "num_stages": 4, "time_ms": 1692.752685546875, "status": "ok"}
{"summary": true, "N": 1048576, "K": 65536, "D": 128, "B": 32, "dtype": "fp16", "best": {"N": 1048576, "K": 65536, "D": 128, "B": 32, "dtype": "fp16", "BLOCK_N": 128, "BLOCK_K": 128, "num_warps": 8, "num_stages": 2, "time_ms": 1503.263427734375, "status": "ok"}, "best_time_ms": 1503.263427734375, "tuning_seconds": 1269.887314081192, "skipped": 0}
