grid_results_h100/N1048576_K1024_D128_B32_fp16.jsonl
{"N": 1048576, "K": 1024, "D": 128, "B": 32, "dtype": "fp16", "BLOCK_N": 32, "BLOCK_K": 32, "num_warps": 4, "num_stages": 1, "time_ms": 79.53731536865234, "status": "ok"}
{"N": 1048576, "K": 1024, "D": 128, "B": 32, "dtype": "fp16", "BLOCK_N": 32, "BLOCK_K": 32, "num_warps": 4, "num_stages": 2, "time_ms": 65.39881896972656, "status": "ok"}
{"N": 1048576, "K": 1024, "D": 128, "B": 32, "dtype": "fp16", "BLOCK_N": 32, "BLOCK_K": 32, "num_warps": 4, "num_stages": 4, "time_ms": 66.68291473388672, "status": "ok"}
{"N": 1048576, "K": 1024, "D": 128, "B": 32, "dtype": "fp16", "BLOCK_N": 32, "BLOCK_K": 32, "num_warps": 8, "num_stages": 1, "time_ms": 117.69574737548828, "status": "ok"}
{"N": 1048576, "K": 1024, "D": 128, "B": 32, "dtype": "fp16", "BLOCK_N": 32, "BLOCK_K": 32, "num_warps": 8, "num_stages": 2, "time_ms": 108.24918365478516, "status": "ok"}
{"N": 1048576, "K": 1024, "D": 128, "B": 32, "dtype": "fp16", "BLOCK_N": 32, "BLOCK_K": 32, "num_warps": 8, "num_stages": 4, "time_ms": 107.5313949584961, "status": "ok"}
{"N": 1048576, "K": 1024, "D": 128, "B": 32, "dtype": "fp16", "BLOCK_N": 32, "BLOCK_K": 64, "num_warps": 4, "num_stages": 1, "time_ms": 68.36956787109375, "status": "ok"}
{"N": 1048576, "K": 1024, "D": 128, "B": 32, "dtype": "fp16", "BLOCK_N": 32, "BLOCK_K": 64, "num_warps": 4, "num_stages": 2, "time_ms": 54.823646545410156, "status": "ok"}
{"N": 1048576, "K": 1024, "D": 128, "B": 32, "dtype": "fp16", "BLOCK_N": 32, "BLOCK_K": 64, "num_warps": 4, "num_stages": 4, "time_ms": 59.824031829833984, "status": "ok"}
{"N": 1048576, "K": 1024, "D": 128, "B": 32, "dtype": "fp16", "BLOCK_N": 32, "BLOCK_K": 64, "num_warps": 8, "num_stages": 1, "time_ms": 83.8635482788086, "status": "ok"}
{"N": 1048576, "K": 1024, "D": 128, "B": 32, "dtype": "fp16", "BLOCK_N": 32, "BLOCK_K": 64, "num_warps": 8, "num_stages": 2, "time_ms": 70.86637115478516, "status": "ok"}
{"N": 1048576, "K": 1024, "D": 128, "B": 32, "dtype": "fp16", "BLOCK_N": 32, "BLOCK_K": 64, "num_warps": 8, "num_stages": 4, "time_ms": 72.12969970703125, "status": "ok"}
{"N": 1048576, "K": 1024, "D": 128, "B": 32, "dtype": "fp16", "BLOCK_N": 32, "BLOCK_K": 128, "num_warps": 4, "num_stages": 1, "time_ms": 55.40947341918945, "status": "ok"}
{"N": 1048576, "K": 1024, "D": 128, "B": 32, "dtype": "fp16", "BLOCK_N": 32, "BLOCK_K": 128, "num_warps": 4, "num_stages": 2, "time_ms": 45.168094635009766, "status": "ok"}
{"N": 1048576, "K": 1024, "D": 128, "B": 32, "dtype": "fp16", "BLOCK_N": 32, "BLOCK_K": 128, "num_warps": 4, "num_stages": 4, "time_ms": 56.48614501953125, "status": "ok"}
{"N": 1048576, "K": 1024, "D": 128, "B": 32, "dtype": "fp16", "BLOCK_N": 32, "BLOCK_K": 128, "num_warps": 8, "num_stages": 1, "time_ms": 75.1048355102539, "status": "ok"}
{"N": 1048576, "K": 1024, "D": 128, "B": 32, "dtype": "fp16", "BLOCK_N": 32, "BLOCK_K": 128, "num_warps": 8, "num_stages": 2, "time_ms": 65.49929809570312, "status": "ok"}
{"N": 1048576, "K": 1024, "D": 128, "B": 32, "dtype": "fp16", "BLOCK_N": 32, "BLOCK_K": 128, "num_warps": 8, "num_stages": 4, "time_ms": 68.80687713623047, "status": "ok"}
{"N": 1048576, "K": 1024, "D": 128, "B": 32, "dtype": "fp16", "BLOCK_N": 64, "BLOCK_K": 32, "num_warps": 4, "num_stages": 1, "time_ms": 33.13071823120117, "status": "ok"}
{"N": 1048576, "K": 1024, "D": 128, "B": 32, "dtype": "fp16", "BLOCK_N": 64, "BLOCK_K": 32, "num_warps": 4, "num_stages": 2, "time_ms": 29.317760467529297, "status": "ok"}
{"N": 1048576, "K": 1024, "D": 128, "B": 32, "dtype": "fp16", "BLOCK_N": 64, "BLOCK_K": 32, "num_warps": 4, "num_stages": 4, "time_ms": 30.926271438598633, "status": "ok"}
{"N": 1048576, "K": 1024, "D": 128, "B": 32, "dtype": "fp16", "BLOCK_N": 64, "BLOCK_K": 32, "num_warps": 8, "num_stages": 1, "time_ms": 57.96675109863281, "status": "ok"}
{"N": 1048576, "K": 1024, "D": 128, "B": 32, "dtype": "fp16", "BLOCK_N": 64, "BLOCK_K": 32, "num_warps": 8, "num_stages": 2, "time_ms": 50.970367431640625, "status": "ok"}
{"N": 1048576, "K": 1024, "D": 128, "B": 32, "dtype": "fp16", "BLOCK_N": 64, "BLOCK_K": 32, "num_warps": 8, "num_stages": 4, "time_ms": 51.921791076660156, "status": "ok"}
{"N": 1048576, "K": 1024, "D": 128, "B": 32, "dtype": "fp16", "BLOCK_N": 64, "BLOCK_K": 64, "num_warps": 4, "num_stages": 1, "time_ms": 28.893600463867188, "status": "ok"}
{"N": 1048576, "K": 1024, "D": 128, "B": 32, "dtype": "fp16", "BLOCK_N": 64, "BLOCK_K": 64, "num_warps": 4, "num_stages": 2, "time_ms": 26.47248077392578, "status": "ok"}
{"N": 1048576, "K": 1024, "D": 128, "B": 32, "dtype": "fp16", "BLOCK_N": 64, "BLOCK_K": 64, "num_warps": 4, "num_stages": 4, "time_ms": 28.571487426757812, "status": "ok"}
{"N": 1048576, "K": 1024, "D": 128, "B": 32, "dtype": "fp16", "BLOCK_N": 64, "BLOCK_K": 64, "num_warps": 8, "num_stages": 1, "time_ms": 41.21209716796875, "status": "ok"}
{"N": 1048576, "K": 1024, "D": 128, "B": 32, "dtype": "fp16", "BLOCK_N": 64, "BLOCK_K": 64, "num_warps": 8, "num_stages": 2, "time_ms": 36.5081901550293, "status": "ok"}
{"N": 1048576, "K": 1024, "D": 128, "B": 32, "dtype": "fp16", "BLOCK_N": 64, "BLOCK_K": 64, "num_warps": 8, "num_stages": 4, "time_ms": 41.932926177978516, "status": "ok"}
{"N": 1048576, "K": 1024, "D": 128, "B": 32, "dtype": "fp16", "BLOCK_N": 64, "BLOCK_K": 128, "num_warps": 4, "num_stages": 1, "time_ms": 27.243167877197266, "status": "ok"}
{"N": 1048576, "K": 1024, "D": 128, "B": 32, "dtype": "fp16", "BLOCK_N": 64, "BLOCK_K": 128, "num_warps": 4, "num_stages": 2, "time_ms": 27.542112350463867, "status": "ok"}
{"N": 1048576, "K": 1024, "D": 128, "B": 32, "dtype": "fp16", "BLOCK_N": 64, "BLOCK_K": 128, "num_warps": 4, "num_stages": 4, "time_ms": 35.94572830200195, "status": "ok"}
{"N": 1048576, "K": 1024, "D": 128, "B": 32, "dtype": "fp16", "BLOCK_N": 64, "BLOCK_K": 128, "num_warps": 8, "num_stages": 1, "time_ms": 39.002784729003906, "status": "ok"}
{"N": 1048576, "K": 1024, "D": 128, "B": 32, "dtype": "fp16", "BLOCK_N": 64, "BLOCK_K": 128, "num_warps": 8, "num_stages": 2, "time_ms": 34.799903869628906, "status": "ok"}
{"N": 1048576, "K": 1024, "D": 128, "B": 32, "dtype": "fp16", "BLOCK_N": 64, "BLOCK_K": 128, "num_warps": 8, "num_stages": 4, "time_ms": 42.52649688720703, "status": "ok"}
{"N": 1048576, "K": 1024, "D": 128, "B": 32, "dtype": "fp16", "BLOCK_N": 128, "BLOCK_K": 32, "num_warps": 4, "num_stages": 1, "time_ms": 28.93235206604004, "status": "ok"}
{"N": 1048576, "K": 1024, "D": 128, "B": 32, "dtype": "fp16", "BLOCK_N": 128, "BLOCK_K": 32, "num_warps": 4, "num_stages": 2, "time_ms": 28.39948844909668, "status": "ok"}
{"N": 1048576, "K": 1024, "D": 128, "B": 32, "dtype": "fp16", "BLOCK_N": 128, "BLOCK_K": 32, "num_warps": 4, "num_stages": 4, "time_ms": 29.6759033203125, "status": "ok"}
{"N": 1048576, "K": 1024, "D": 128, "B": 32, "dtype": "fp16", "BLOCK_N": 128, "BLOCK_K": 32, "num_warps": 8, "num_stages": 1, "time_ms": 29.27222442626953, "status": "ok"}
{"N": 1048576, "K": 1024, "D": 128, "B": 32, "dtype": "fp16", "BLOCK_N": 128, "BLOCK_K": 32, "num_warps": 8, "num_stages": 2, "time_ms": 28.272415161132812, "status": "ok"}
{"N": 1048576, "K": 1024, "D": 128, "B": 32, "dtype": "fp16", "BLOCK_N": 128, "BLOCK_K": 32, "num_warps": 8, "num_stages": 4, "time_ms": 29.398399353027344, "status": "ok"}
{"N": 1048576, "K": 1024, "D": 128, "B": 32, "dtype": "fp16", "BLOCK_N": 128, "BLOCK_K": 64, "num_warps": 4, "num_stages": 1, "time_ms": 25.12735939025879, "status": "ok"}
{"N": 1048576, "K": 1024, "D": 128, "B": 32, "dtype": "fp16", "BLOCK_N": 128, "BLOCK_K": 64, "num_warps": 4, "num_stages": 2, "time_ms": 25.593215942382812, "status": "ok"}
{"N": 1048576, "K": 1024, "D": 128, "B": 32, "dtype": "fp16", "BLOCK_N": 128, "BLOCK_K": 64, "num_warps": 4, "num_stages": 4, "time_ms": 26.16979217529297, "status": "ok"}
{"N": 1048576, "K": 1024, "D": 128, "B": 32, "dtype": "fp16", "BLOCK_N": 128, "BLOCK_K": 64, "num_warps": 8, "num_stages": 1, "time_ms": 26.309215545654297, "status": "ok"}
{"N": 1048576, "K": 1024, "D": 128, "B": 32, "dtype": "fp16", "BLOCK_N": 128, "BLOCK_K": 64, "num_warps": 8, "num_stages": 2, "time_ms": 25.969663619995117, "status": "ok"}
{"N": 1048576, "K": 1024, "D": 128, "B": 32, "dtype": "fp16", "BLOCK_N": 128, "BLOCK_K": 64, "num_warps": 8, "num_stages": 4, "time_ms": 26.289920806884766, "status": "ok"}
{"N": 1048576, "K": 1024, "D": 128, "B": 32, "dtype": "fp16", "BLOCK_N": 128, "BLOCK_K": 128, "num_warps": 4, "num_stages": 1, "time_ms": 25.782880783081055, "status": "ok"}
{"N": 1048576, "K": 1024, "D": 128, "B": 32, "dtype": "fp16", "BLOCK_N": 128, "BLOCK_K": 128, "num_warps": 4, "num_stages": 2, "time_ms": 24.37775993347168, "status": "ok"}
{"N": 1048576, "K": 1024, "D": 128, "B": 32, "dtype": "fp16", "BLOCK_N": 128, "BLOCK_K": 128, "num_warps": 4, "num_stages": 4, "time_ms": 30.58393669128418, "status": "ok"}
{"N": 1048576, "K": 1024, "D": 128, "B": 32, "dtype": "fp16", "BLOCK_N": 128, "BLOCK_K": 128, "num_warps": 8, "num_stages": 1, "time_ms": 36.626014709472656, "status": "ok"}
{"N": 1048576, "K": 1024, "D": 128, "B": 32, "dtype": "fp16", "BLOCK_N": 128, "BLOCK_K": 128, "num_warps": 8, "num_stages": 2, "time_ms": 24.351999282836914, "status": "ok"}
{"N": 1048576, "K": 1024, "D": 128, "B": 32, "dtype": "fp16", "BLOCK_N": 128, "BLOCK_K": 128, "num_warps": 8, "num_stages": 4, "time_ms": 29.053855895996094, "status": "ok"}
{"summary": true, "N": 1048576, "K": 1024, "D": 128, "B": 32, "dtype": "fp16", "best": {"N": 1048576, "K": 1024, "D": 128, "B": 32, "dtype": "fp16", "BLOCK_N": 128, "BLOCK_K": 128, "num_warps": 8, "num_stages": 2, "time_ms": 24.351999282836914, "status": "ok"}, "best_time_ms": 24.351999282836914, "tuning_seconds": 33.848100900650024, "skipped": 0}
