grid_results_h100/N1048576_K65536_D64_B32_fp16.jsonl
{"N": 1048576, "K": 65536, "D": 64, "B": 32, "dtype": "fp16", "BLOCK_N": 32, "BLOCK_K": 32, "num_warps": 4, "num_stages": 1, "time_ms": 3336.509521484375, "status": "ok"}
{"N": 1048576, "K": 65536, "D": 64, "B": 32, "dtype": "fp16", "BLOCK_N": 32, "BLOCK_K": 32, "num_warps": 4, "num_stages": 2, "time_ms": 2965.84619140625, "status": "ok"}
{"N": 1048576, "K": 65536, "D": 64, "B": 32, "dtype": "fp16", "BLOCK_N": 32, "BLOCK_K": 32, "num_warps": 4, "num_stages": 4, "time_ms": 2931.380615234375, "status": "ok"}
{"N": 1048576, "K": 65536, "D": 64, "B": 32, "dtype": "fp16", "BLOCK_N": 32, "BLOCK_K": 32, "num_warps": 8, "num_stages": 1, "time_ms": 5369.1103515625, "status": "ok"}
{"N": 1048576, "K": 65536, "D": 64, "B": 32, "dtype": "fp16", "BLOCK_N": 32, "BLOCK_K": 32, "num_warps": 8, "num_stages": 2, "time_ms": 5077.08837890625, "status": "ok"}
{"N": 1048576, "K": 65536, "D": 64, "B": 32, "dtype": "fp16", "BLOCK_N": 32, "BLOCK_K": 32, "num_warps": 8, "num_stages": 4, "time_ms": 4971.0576171875, "status": "ok"}
{"N": 1048576, "K": 65536, "D": 64, "B": 32, "dtype": "fp16", "BLOCK_N": 32, "BLOCK_K": 64, "num_warps": 4, "num_stages": 1, "time_ms": 2859.7451171875, "status": "ok"}
{"N": 1048576, "K": 65536, "D": 64, "B": 32, "dtype": "fp16", "BLOCK_N": 32, "BLOCK_K": 64, "num_warps": 4, "num_stages": 2, "time_ms": 2518.966552734375, "status": "ok"}
{"N": 1048576, "K": 65536, "D": 64, "B": 32, "dtype": "fp16", "BLOCK_N": 32, "BLOCK_K": 64, "num_warps": 4, "num_stages": 4, "time_ms": 2419.78173828125, "status": "ok"}
{"N": 1048576, "K": 65536, "D": 64, "B": 32, "dtype": "fp16", "BLOCK_N": 32, "BLOCK_K": 64, "num_warps": 8, "num_stages": 1, "time_ms": 3470.891845703125, "status": "ok"}
{"N": 1048576, "K": 65536, "D": 64, "B": 32, "dtype": "fp16", "BLOCK_N": 32, "BLOCK_K": 64, "num_warps": 8, "num_stages": 2, "time_ms": 3212.883056640625, "status": "ok"}
{"N": 1048576, "K": 65536, "D": 64, "B": 32, "dtype": "fp16", "BLOCK_N": 32, "BLOCK_K": 64, "num_warps": 8, "num_stages": 4, "time_ms": 3125.72119140625, "status": "ok"}
{"N": 1048576, "K": 65536, "D": 64, "B": 32, "dtype": "fp16", "BLOCK_N": 32, "BLOCK_K": 128, "num_warps": 4, "num_stages": 1, "time_ms": 2245.580810546875, "status": "ok"}
{"N": 1048576, "K": 65536, "D": 64, "B": 32, "dtype": "fp16", "BLOCK_N": 32, "BLOCK_K": 128, "num_warps": 4, "num_stages": 2, "time_ms": 2024.810546875, "status": "ok"}
{"N": 1048576, "K": 65536, "D": 64, "B": 32, "dtype": "fp16", "BLOCK_N": 32, "BLOCK_K": 128, "num_warps": 4, "num_stages": 4, "time_ms": 2002.9544677734375, "status": "ok"}
{"N": 1048576, "K": 65536, "D": 64, "B": 32, "dtype": "fp16", "BLOCK_N": 32, "BLOCK_K": 128, "num_warps": 8, "num_stages": 1, "time_ms": 3621.50048828125, "status": "ok"}
{"N": 1048576, "K": 65536, "D": 64, "B": 32, "dtype": "fp16", "BLOCK_N": 32, "BLOCK_K": 128, "num_warps": 8, "num_stages": 2, "time_ms": 2969.970947265625, "status": "ok"}
{"N": 1048576, "K": 65536, "D": 64, "B": 32, "dtype": "fp16", "BLOCK_N": 32, "BLOCK_K": 128, "num_warps": 8, "num_stages": 4, "time_ms": 2845.86083984375, "status": "ok"}
{"N": 1048576, "K": 65536, "D": 64, "B": 32, "dtype": "fp16", "BLOCK_N": 64, "BLOCK_K": 32, "num_warps": 4, "num_stages": 1, "time_ms": 1394.961669921875, "status": "ok"}
{"N": 1048576, "K": 65536, "D": 64, "B": 32, "dtype": "fp16", "BLOCK_N": 64, "BLOCK_K": 32, "num_warps": 4, "num_stages": 2, "time_ms": 1363.1533203125, "status": "ok"}
{"N": 1048576, "K": 65536, "D": 64, "B": 32, "dtype": "fp16", "BLOCK_N": 64, "BLOCK_K": 32, "num_warps": 4, "num_stages": 4, "time_ms": 1370.3045654296875, "status": "ok"}
{"N": 1048576, "K": 65536, "D": 64, "B": 32, "dtype": "fp16", "BLOCK_N": 64, "BLOCK_K": 32, "num_warps": 8, "num_stages": 1, "time_ms": 2690.658203125, "status": "ok"}
{"N": 1048576, "K": 65536, "D": 64, "B": 32, "dtype": "fp16", "BLOCK_N": 64, "BLOCK_K": 32, "num_warps": 8, "num_stages": 2, "time_ms": 2517.583740234375, "status": "ok"}
{"N": 1048576, "K": 65536, "D": 64, "B": 32, "dtype": "fp16", "BLOCK_N": 64, "BLOCK_K": 32, "num_warps": 8, "num_stages": 4, "time_ms": 2462.71142578125, "status": "ok"}
{"N": 1048576, "K": 65536, "D": 64, "B": 32, "dtype": "fp16", "BLOCK_N": 64, "BLOCK_K": 64, "num_warps": 4, "num_stages": 1, "time_ms": 1305.471435546875, "status": "ok"}
{"N": 1048576, "K": 65536, "D": 64, "B": 32, "dtype": "fp16", "BLOCK_N": 64, "BLOCK_K": 64, "num_warps": 4, "num_stages": 2, "time_ms": 1231.51708984375, "status": "ok"}
{"N": 1048576, "K": 65536, "D": 64, "B": 32, "dtype": "fp16", "BLOCK_N": 64, "BLOCK_K": 64, "num_warps": 4, "num_stages": 4, "time_ms": 1242.7408447265625, "status": "ok"}
{"N": 1048576, "K": 65536, "D": 64, "B": 32, "dtype": "fp16", "BLOCK_N": 64, "BLOCK_K": 64, "num_warps": 8, "num_stages": 1, "time_ms": 1915.564697265625, "status": "ok"}
{"N": 1048576, "K": 65536, "D": 64, "B": 32, "dtype": "fp16", "BLOCK_N": 64, "BLOCK_K": 64, "num_warps": 8, "num_stages": 2, "time_ms": 1829.134765625, "status": "ok"}
{"N": 1048576, "K": 65536, "D": 64, "B": 32, "dtype": "fp16", "BLOCK_N": 64, "BLOCK_K": 64, "num_warps": 8, "num_stages": 4, "time_ms": 1771.3724365234375, "status": "ok"}
{"N": 1048576, "K": 65536, "D": 64, "B": 32, "dtype": "fp16", "BLOCK_N": 64, "BLOCK_K": 128, "num_warps": 4, "num_stages": 1, "time_ms": 1241.5443115234375, "status": "ok"}
{"N": 1048576, "K": 65536, "D": 64, "B": 32, "dtype": "fp16", "BLOCK_N": 64, "BLOCK_K": 128, "num_warps": 4, "num_stages": 2, "time_ms": 1204.0164794921875, "status": "ok"}
{"N": 1048576, "K": 65536, "D": 64, "B": 32, "dtype": "fp16", "BLOCK_N": 64, "BLOCK_K": 128, "num_warps": 4, "num_stages": 4, "time_ms": 1193.3433837890625, "status": "ok"}
{"N": 1048576, "K": 65536, "D": 64, "B": 32, "dtype": "fp16", "BLOCK_N": 64, "BLOCK_K": 128, "num_warps": 8, "num_stages": 1, "time_ms": 1976.2215576171875, "status": "ok"}
{"N": 1048576, "K": 65536, "D": 64, "B": 32, "dtype": "fp16", "BLOCK_N": 64, "BLOCK_K": 128, "num_warps": 8, "num_stages": 2, "time_ms": 1701.253662109375, "status": "ok"}
{"N": 1048576, "K": 65536, "D": 64, "B": 32, "dtype": "fp16", "BLOCK_N": 64, "BLOCK_K": 128, "num_warps": 8, "num_stages": 4, "time_ms": 1587.889892578125, "status": "ok"}
{"N": 1048576, "K": 65536, "D": 64, "B": 32, "dtype": "fp16", "BLOCK_N": 128, "BLOCK_K": 32, "num_warps": 4, "num_stages": 1, "time_ms": 1311.3006591796875, "status": "ok"}
{"N": 1048576, "K": 65536, "D": 64, "B": 32, "dtype": "fp16", "BLOCK_N": 128, "BLOCK_K": 32, "num_warps": 4, "num_stages": 2, "time_ms": 1285.7852783203125, "status": "ok"}
{"N": 1048576, "K": 65536, "D": 64, "B": 32, "dtype": "fp16", "BLOCK_N": 128, "BLOCK_K": 32, "num_warps": 4, "num_stages": 4, "time_ms": 1299.2926025390625, "status": "ok"}
{"N": 1048576, "K": 65536, "D": 64, "B": 32, "dtype": "fp16", "BLOCK_N": 128, "BLOCK_K": 32, "num_warps": 8, "num_stages": 1, "time_ms": 1370.5091552734375, "status": "ok"}
{"N": 1048576, "K": 65536, "D": 64, "B": 32, "dtype": "fp16", "BLOCK_N": 128, "BLOCK_K": 32, "num_warps": 8, "num_stages": 2, "time_ms": 1427.203857421875, "status": "ok"}
{"N": 1048576, "K": 65536, "D": 64, "B": 32, "dtype": "fp16", "BLOCK_N": 128, "BLOCK_K": 32, "num_warps": 8, "num_stages": 4, "time_ms": 1392.2454833984375, "status": "ok"}
{"N": 1048576, "K": 65536, "D": 64, "B": 32, "dtype": "fp16", "BLOCK_N": 128, "BLOCK_K": 64, "num_warps": 4, "num_stages": 1, "time_ms": 1258.685302734375, "status": "ok"}
{"N": 1048576, "K": 65536, "D": 64, "B": 32, "dtype": "fp16", "BLOCK_N": 128, "BLOCK_K": 64, "num_warps": 4, "num_stages": 2, "time_ms": 1160.9005126953125, "status": "ok"}
{"N": 1048576, "K": 65536, "D": 64, "B": 32, "dtype": "fp16", "BLOCK_N": 128, "BLOCK_K": 64, "num_warps": 4, "num_stages": 4, "time_ms": 1162.8231201171875, "status": "ok"}
{"N": 1048576, "K": 65536, "D": 64, "B": 32, "dtype": "fp16", "BLOCK_N": 128, "BLOCK_K": 64, "num_warps": 8, "num_stages": 1, "time_ms": 1292.4031982421875, "status": "ok"}
{"N": 1048576, "K": 65536, "D": 64, "B": 32, "dtype": "fp16", "BLOCK_N": 128, "BLOCK_K": 64, "num_warps": 8, "num_stages": 2, "time_ms": 1250.603515625, "status": "ok"}
{"N": 1048576, "K": 65536, "D": 64, "B": 32, "dtype": "fp16", "BLOCK_N": 128, "BLOCK_K": 64, "num_warps": 8, "num_stages": 4, "time_ms": 1225.7427978515625, "status": "ok"}
{"N": 1048576, "K": 65536, "D": 64, "B": 32, "dtype": "fp16", "BLOCK_N": 128, "BLOCK_K": 128, "num_warps": 4, "num_stages": 1, "time_ms": 1327.241455078125, "status": "ok"}
{"N": 1048576, "K": 65536, "D": 64, "B": 32, "dtype": "fp16", "BLOCK_N": 128, "BLOCK_K": 128, "num_warps": 4, "num_stages": 2, "time_ms": 1236.739013671875, "status": "ok"}
{"N": 1048576, "K": 65536, "D": 64, "B": 32, "dtype": "fp16", "BLOCK_N": 128, "BLOCK_K": 128, "num_warps": 4, "num_stages": 4, "time_ms": 1148.34765625, "status": "ok"}
{"N": 1048576, "K": 65536, "D": 64, "B": 32, "dtype": "fp16", "BLOCK_N": 128, "BLOCK_K": 128, "num_warps": 8, "num_stages": 1, "time_ms": 1765.31689453125, "status": "ok"}
{"N": 1048576, "K": 65536, "D": 64, "B": 32, "dtype": "fp16", "BLOCK_N": 128, "BLOCK_K": 128, "num_warps": 8, "num_stages": 2, "time_ms": 1191.33837890625, "status": "ok"}
{"N": 1048576, "K": 65536, "D": 64, "B": 32, "dtype": "fp16", "BLOCK_N": 128, "BLOCK_K": 128, "num_warps": 8, "num_stages": 4, "time_ms": 1159.8153076171875, "status": "ok"}
{"summary": true, "N": 1048576, "K": 65536, "D": 64, "B": 32, "dtype": "fp16", "best": {"N": 1048576, "K": 65536, "D": 64, "B": 32, "dtype": "fp16", "BLOCK_N": 128, "BLOCK_K": 128, "num_warps": 4, "num_stages": 4, "time_ms": 1148.34765625, "status": "ok"}, "best_time_ms": 1148.34765625, "tuning_seconds": 902.5707404613495, "skipped": 0}
