grid_results_h100/N1048576_K4096_D128_B1_fp16.jsonl
{"N": 1048576, "K": 4096, "D": 128, "B": 1, "dtype": "fp16", "BLOCK_N": 32, "BLOCK_K": 32, "num_warps": 4, "num_stages": 1, "time_ms": 10.246111869812012, "status": "ok"}
{"N": 1048576, "K": 4096, "D": 128, "B": 1, "dtype": "fp16", "BLOCK_N": 32, "BLOCK_K": 32, "num_warps": 4, "num_stages": 2, "time_ms": 8.288607597351074, "status": "ok"}
{"N": 1048576, "K": 4096, "D": 128, "B": 1, "dtype": "fp16", "BLOCK_N": 32, "BLOCK_K": 32, "num_warps": 4, "num_stages": 4, "time_ms": 8.379584312438965, "status": "ok"}
{"N": 1048576, "K": 4096, "D": 128, "B": 1, "dtype": "fp16", "BLOCK_N": 32, "BLOCK_K": 32, "num_warps": 8, "num_stages": 1, "time_ms": 14.801504135131836, "status": "ok"}
{"N": 1048576, "K": 4096, "D": 128, "B": 1, "dtype": "fp16", "BLOCK_N": 32, "BLOCK_K": 32, "num_warps": 8, "num_stages": 2, "time_ms": 13.666367530822754, "status": "ok"}
{"N": 1048576, "K": 4096, "D": 128, "B": 1, "dtype": "fp16", "BLOCK_N": 32, "BLOCK_K": 32, "num_warps": 8, "num_stages": 4, "time_ms": 13.47424030303955, "status": "ok"}
{"N": 1048576, "K": 4096, "D": 128, "B": 1, "dtype": "fp16", "BLOCK_N": 32, "BLOCK_K": 64, "num_warps": 4, "num_stages": 1, "time_ms": 8.629152297973633, "status": "ok"}
{"N": 1048576, "K": 4096, "D": 128, "B": 1, "dtype": "fp16", "BLOCK_N": 32, "BLOCK_K": 64, "num_warps": 4, "num_stages": 2, "time_ms": 6.750847816467285, "status": "ok"}
{"N": 1048576, "K": 4096, "D": 128, "B": 1, "dtype": "fp16", "BLOCK_N": 32, "BLOCK_K": 64, "num_warps": 4, "num_stages": 4, "time_ms": 7.260960102081299, "status": "ok"}
{"N": 1048576, "K": 4096, "D": 128, "B": 1, "dtype": "fp16", "BLOCK_N": 32, "BLOCK_K": 64, "num_warps": 8, "num_stages": 1, "time_ms": 10.542240142822266, "status": "ok"}
{"N": 1048576, "K": 4096, "D": 128, "B": 1, "dtype": "fp16", "BLOCK_N": 32, "BLOCK_K": 64, "num_warps": 8, "num_stages": 2, "time_ms": 8.710047721862793, "status": "ok"}
{"N": 1048576, "K": 4096, "D": 128, "B": 1, "dtype": "fp16", "BLOCK_N": 32, "BLOCK_K": 64, "num_warps": 8, "num_stages": 4, "time_ms": 8.845184326171875, "status": "ok"}
{"N": 1048576, "K": 4096, "D": 128, "B": 1, "dtype": "fp16", "BLOCK_N": 32, "BLOCK_K": 128, "num_warps": 4, "num_stages": 1, "time_ms": 6.951231956481934, "status": "ok"}
{"N": 1048576, "K": 4096, "D": 128, "B": 1, "dtype": "fp16", "BLOCK_N": 32, "BLOCK_K": 128, "num_warps": 4, "num_stages": 2, "time_ms": 5.287903785705566, "status": "ok"}
{"N": 1048576, "K": 4096, "D": 128, "B": 1, "dtype": "fp16", "BLOCK_N": 32, "BLOCK_K": 128, "num_warps": 4, "num_stages": 4, "time_ms": 7.024864196777344, "status": "ok"}
{"N": 1048576, "K": 4096, "D": 128, "B": 1, "dtype": "fp16", "BLOCK_N": 32, "BLOCK_K": 128, "num_warps": 8, "num_stages": 1, "time_ms": 9.459039688110352, "status": "ok"}
{"N": 1048576, "K": 4096, "D": 128, "B": 1, "dtype": "fp16", "BLOCK_N": 32, "BLOCK_K": 128, "num_warps": 8, "num_stages": 2, "time_ms": 8.07919979095459, "status": "ok"}
{"N": 1048576, "K": 4096, "D": 128, "B": 1, "dtype": "fp16", "BLOCK_N": 32, "BLOCK_K": 128, "num_warps": 8, "num_stages": 4, "time_ms": 8.240703582763672, "status": "ok"}
{"N": 1048576, "K": 4096, "D": 128, "B": 1, "dtype": "fp16", "BLOCK_N": 64, "BLOCK_K": 32, "num_warps": 4, "num_stages": 1, "time_ms": 4.025536060333252, "status": "ok"}
{"N": 1048576, "K": 4096, "D": 128, "B": 1, "dtype": "fp16", "BLOCK_N": 64, "BLOCK_K": 32, "num_warps": 4, "num_stages": 2, "time_ms": 3.398848056793213, "status": "ok"}
{"N": 1048576, "K": 4096, "D": 128, "B": 1, "dtype": "fp16", "BLOCK_N": 64, "BLOCK_K": 32, "num_warps": 4, "num_stages": 4, "time_ms": 3.5540480613708496, "status": "ok"}
{"N": 1048576, "K": 4096, "D": 128, "B": 1, "dtype": "fp16", "BLOCK_N": 64, "BLOCK_K": 32, "num_warps": 8, "num_stages": 1, "time_ms": 7.398143768310547, "status": "ok"}
{"N": 1048576, "K": 4096, "D": 128, "B": 1, "dtype": "fp16", "BLOCK_N": 64, "BLOCK_K": 32, "num_warps": 8, "num_stages": 2, "time_ms": 6.433055877685547, "status": "ok"}
{"N": 1048576, "K": 4096, "D": 128, "B": 1, "dtype": "fp16", "BLOCK_N": 64, "BLOCK_K": 32, "num_warps": 8, "num_stages": 4, "time_ms": 6.495808124542236, "status": "ok"}
{"N": 1048576, "K": 4096, "D": 128, "B": 1, "dtype": "fp16", "BLOCK_N": 64, "BLOCK_K": 64, "num_warps": 4, "num_stages": 1, "time_ms": 3.336735963821411, "status": "ok"}
{"N": 1048576, "K": 4096, "D": 128, "B": 1, "dtype": "fp16", "BLOCK_N": 64, "BLOCK_K": 64, "num_warps": 4, "num_stages": 2, "time_ms": 2.9418880939483643, "status": "ok"}
{"N": 1048576, "K": 4096, "D": 128, "B": 1, "dtype": "fp16", "BLOCK_N": 64, "BLOCK_K": 64, "num_warps": 4, "num_stages": 4, "time_ms": 3.1555519104003906, "status": "ok"}
{"N": 1048576, "K": 4096, "D": 128, "B": 1, "dtype": "fp16", "BLOCK_N": 64, "BLOCK_K": 64, "num_warps": 8, "num_stages": 1, "time_ms": 5.232607841491699, "status": "ok"}
{"N": 1048576, "K": 4096, "D": 128, "B": 1, "dtype": "fp16", "BLOCK_N": 64, "BLOCK_K": 64, "num_warps": 8, "num_stages": 2, "time_ms": 4.504703998565674, "status": "ok"}
{"N": 1048576, "K": 4096, "D": 128, "B": 1, "dtype": "fp16", "BLOCK_N": 64, "BLOCK_K": 64, "num_warps": 8, "num_stages": 4, "time_ms": 5.189568042755127, "status": "ok"}
{"N": 1048576, "K": 4096, "D": 128, "B": 1, "dtype": "fp16", "BLOCK_N": 64, "BLOCK_K": 128, "num_warps": 4, "num_stages": 1, "time_ms": 3.021343946456909, "status": "ok"}
{"N": 1048576, "K": 4096, "D": 128, "B": 1, "dtype": "fp16", "BLOCK_N": 64, "BLOCK_K": 128, "num_warps": 4, "num_stages": 2, "time_ms": 3.0808959007263184, "status": "ok"}
{"N": 1048576, "K": 4096, "D": 128, "B": 1, "dtype": "fp16", "BLOCK_N": 64, "BLOCK_K": 128, "num_warps": 4, "num_stages": 4, "time_ms": 4.1462721824646, "status": "ok"}
{"N": 1048576, "K": 4096, "D": 128, "B": 1, "dtype": "fp16", "BLOCK_N": 64, "BLOCK_K": 128, "num_warps": 8, "num_stages": 1, "time_ms": 4.915840148925781, "status": "ok"}
{"N": 1048576, "K": 4096, "D": 128, "B": 1, "dtype": "fp16", "BLOCK_N": 64, "BLOCK_K": 128, "num_warps": 8, "num_stages": 2, "time_ms": 4.176479816436768, "status": "ok"}
{"N": 1048576, "K": 4096, "D": 128, "B": 1, "dtype": "fp16", "BLOCK_N": 64, "BLOCK_K": 128, "num_warps": 8, "num_stages": 4, "time_ms": 4.8969597816467285, "status": "ok"}
{"N": 1048576, "K": 4096, "D": 128, "B": 1, "dtype": "fp16", "BLOCK_N": 128, "BLOCK_K": 32, "num_warps": 4, "num_stages": 1, "time_ms": 3.485311985015869, "status": "ok"}
{"N": 1048576, "K": 4096, "D": 128, "B": 1, "dtype": "fp16", "BLOCK_N": 128, "BLOCK_K": 32, "num_warps": 4, "num_stages": 2, "time_ms": 3.5676159858703613, "status": "ok"}
{"N": 1048576, "K": 4096, "D": 128, "B": 1, "dtype": "fp16", "BLOCK_N": 128, "BLOCK_K": 32, "num_warps": 4, "num_stages": 4, "time_ms": 3.711616039276123, "status": "ok"}
{"N": 1048576, "K": 4096, "D": 128, "B": 1, "dtype": "fp16", "BLOCK_N": 128, "BLOCK_K": 32, "num_warps": 8, "num_stages": 1, "time_ms": 3.63372802734375, "status": "ok"}
{"N": 1048576, "K": 4096, "D": 128, "B": 1, "dtype": "fp16", "BLOCK_N": 128, "BLOCK_K": 32, "num_warps": 8, "num_stages": 2, "time_ms": 3.511136054992676, "status": "ok"}
{"N": 1048576, "K": 4096, "D": 128, "B": 1, "dtype": "fp16", "BLOCK_N": 128, "BLOCK_K": 32, "num_warps": 8, "num_stages": 4, "time_ms": 3.6521921157836914, "status": "ok"}
{"N": 1048576, "K": 4096, "D": 128, "B": 1, "dtype": "fp16", "BLOCK_N": 128, "BLOCK_K": 64, "num_warps": 4, "num_stages": 1, "time_ms": 3.052448034286499, "status": "ok"}
{"N": 1048576, "K": 4096, "D": 128, "B": 1, "dtype": "fp16", "BLOCK_N": 128, "BLOCK_K": 64, "num_warps": 4, "num_stages": 2, "time_ms": 3.068063974380493, "status": "ok"}
{"N": 1048576, "K": 4096, "D": 128, "B": 1, "dtype": "fp16", "BLOCK_N": 128, "BLOCK_K": 64, "num_warps": 4, "num_stages": 4, "time_ms": 3.0643839836120605, "status": "ok"}
{"N": 1048576, "K": 4096, "D": 128, "B": 1, "dtype": "fp16", "BLOCK_N": 128, "BLOCK_K": 64, "num_warps": 8, "num_stages": 1, "time_ms": 3.187488079071045, "status": "ok"}
{"N": 1048576, "K": 4096, "D": 128, "B": 1, "dtype": "fp16", "BLOCK_N": 128, "BLOCK_K": 64, "num_warps": 8, "num_stages": 2, "time_ms": 3.1323840618133545, "status": "ok"}
{"N": 1048576, "K": 4096, "D": 128, "B": 1, "dtype": "fp16", "BLOCK_N": 128, "BLOCK_K": 64, "num_warps": 8, "num_stages": 4, "time_ms": 3.1291520595550537, "status": "ok"}
{"N": 1048576, "K": 4096, "D": 128, "B": 1, "dtype": "fp16", "BLOCK_N": 128, "BLOCK_K": 128, "num_warps": 4, "num_stages": 1, "time_ms": 3.078847885131836, "status": "ok"}
{"N": 1048576, "K": 4096, "D": 128, "B": 1, "dtype": "fp16", "BLOCK_N": 128, "BLOCK_K": 128, "num_warps": 4, "num_stages": 2, "time_ms": 2.9185280799865723, "status": "ok"}
{"N": 1048576, "K": 4096, "D": 128, "B": 1, "dtype": "fp16", "BLOCK_N": 128, "BLOCK_K": 128, "num_warps": 4, "num_stages": 4, "time_ms": 3.6182401180267334, "status": "ok"}
{"N": 1048576, "K": 4096, "D": 128, "B": 1, "dtype": "fp16", "BLOCK_N": 128, "BLOCK_K": 128, "num_warps": 8, "num_stages": 1, "time_ms": 4.536736011505127, "status": "ok"}
{"N": 1048576, "K": 4096, "D": 128, "B": 1, "dtype": "fp16", "BLOCK_N": 128, "BLOCK_K": 128, "num_warps": 8, "num_stages": 2, "time_ms": 2.8399999141693115, "status": "ok"}
{"N": 1048576, "K": 4096, "D": 128, "B": 1, "dtype": "fp16", "BLOCK_N": 128, "BLOCK_K": 128, "num_warps": 8, "num_stages": 4, "time_ms": 3.41593599319458, "status": "ok"}
{"summary": true, "N": 1048576, "K": 4096, "D": 128, "B": 1, "dtype": "fp16", "best": {"N": 1048576, "K": 4096, "D": 128, "B": 1, "dtype": "fp16", "BLOCK_N": 128, "BLOCK_K": 128, "num_warps": 8, "num_stages": 2, "time_ms": 2.8399999141693115, "status": "ok"}, "best_time_ms": 2.8399999141693115, "tuning_seconds": 16.328730583190918, "skipped": 0}
