grid_results_h100/N1048576_K4096_D128_B32_fp16.jsonl
{"N": 1048576, "K": 4096, "D": 128, "B": 32, "dtype": "fp16", "BLOCK_N": 32, "BLOCK_K": 32, "num_warps": 4, "num_stages": 1, "time_ms": 318.6545104980469, "status": "ok"}
{"N": 1048576, "K": 4096, "D": 128, "B": 32, "dtype": "fp16", "BLOCK_N": 32, "BLOCK_K": 32, "num_warps": 4, "num_stages": 2, "time_ms": 268.7749328613281, "status": "ok"}
{"N": 1048576, "K": 4096, "D": 128, "B": 32, "dtype": "fp16", "BLOCK_N": 32, "BLOCK_K": 32, "num_warps": 4, "num_stages": 4, "time_ms": 271.7087097167969, "status": "ok"}
{"N": 1048576, "K": 4096, "D": 128, "B": 32, "dtype": "fp16", "BLOCK_N": 32, "BLOCK_K": 32, "num_warps": 8, "num_stages": 1, "time_ms": 471.4153137207031, "status": "ok"}
{"N": 1048576, "K": 4096, "D": 128, "B": 32, "dtype": "fp16", "BLOCK_N": 32, "BLOCK_K": 32, "num_warps": 8, "num_stages": 2, "time_ms": 429.1888732910156, "status": "ok"}
{"N": 1048576, "K": 4096, "D": 128, "B": 32, "dtype": "fp16", "BLOCK_N": 32, "BLOCK_K": 32, "num_warps": 8, "num_stages": 4, "time_ms": 422.78253173828125, "status": "ok"}
{"N": 1048576, "K": 4096, "D": 128, "B": 32, "dtype": "fp16", "BLOCK_N": 32, "BLOCK_K": 64, "num_warps": 4, "num_stages": 1, "time_ms": 277.0047607421875, "status": "ok"}
{"N": 1048576, "K": 4096, "D": 128, "B": 32, "dtype": "fp16", "BLOCK_N": 32, "BLOCK_K": 64, "num_warps": 4, "num_stages": 2, "time_ms": 216.5734405517578, "status": "ok"}
{"N": 1048576, "K": 4096, "D": 128, "B": 32, "dtype": "fp16", "BLOCK_N": 32, "BLOCK_K": 64, "num_warps": 4, "num_stages": 4, "time_ms": 237.70672607421875, "status": "ok"}
{"N": 1048576, "K": 4096, "D": 128, "B": 32, "dtype": "fp16", "BLOCK_N": 32, "BLOCK_K": 64, "num_warps": 8, "num_stages": 1, "time_ms": 330.7783508300781, "status": "ok"}
{"N": 1048576, "K": 4096, "D": 128, "B": 32, "dtype": "fp16", "BLOCK_N": 32, "BLOCK_K": 64, "num_warps": 8, "num_stages": 2, "time_ms": 281.8916015625, "status": "ok"}
{"N": 1048576, "K": 4096, "D": 128, "B": 32, "dtype": "fp16", "BLOCK_N": 32, "BLOCK_K": 64, "num_warps": 8, "num_stages": 4, "time_ms": 283.22906494140625, "status": "ok"}
{"N": 1048576, "K": 4096, "D": 128, "B": 32, "dtype": "fp16", "BLOCK_N": 32, "BLOCK_K": 128, "num_warps": 4, "num_stages": 1, "time_ms": 220.9156494140625, "status": "ok"}
{"N": 1048576, "K": 4096, "D": 128, "B": 32, "dtype": "fp16", "BLOCK_N": 32, "BLOCK_K": 128, "num_warps": 4, "num_stages": 2, "time_ms": 174.37008666992188, "status": "ok"}
{"N": 1048576, "K": 4096, "D": 128, "B": 32, "dtype": "fp16", "BLOCK_N": 32, "BLOCK_K": 128, "num_warps": 4, "num_stages": 4, "time_ms": 224.13279724121094, "status": "ok"}
{"N": 1048576, "K": 4096, "D": 128, "B": 32, "dtype": "fp16", "BLOCK_N": 32, "BLOCK_K": 128, "num_warps": 8, "num_stages": 1, "time_ms": 298.1416320800781, "status": "ok"}
{"N": 1048576, "K": 4096, "D": 128, "B": 32, "dtype": "fp16", "BLOCK_N": 32, "BLOCK_K": 128, "num_warps": 8, "num_stages": 2, "time_ms": 266.2367248535156, "status": "ok"}
{"N": 1048576, "K": 4096, "D": 128, "B": 32, "dtype": "fp16", "BLOCK_N": 32, "BLOCK_K": 128, "num_warps": 8, "num_stages": 4, "time_ms": 267.4793701171875, "status": "ok"}
{"N": 1048576, "K": 4096, "D": 128, "B": 32, "dtype": "fp16", "BLOCK_N": 64, "BLOCK_K": 32, "num_warps": 4, "num_stages": 1, "time_ms": 147.7027587890625, "status": "ok"}
{"N": 1048576, "K": 4096, "D": 128, "B": 32, "dtype": "fp16", "BLOCK_N": 64, "BLOCK_K": 32, "num_warps": 4, "num_stages": 2, "time_ms": 131.74429321289062, "status": "ok"}
{"N": 1048576, "K": 4096, "D": 128, "B": 32, "dtype": "fp16", "BLOCK_N": 64, "BLOCK_K": 32, "num_warps": 4, "num_stages": 4, "time_ms": 139.25479125976562, "status": "ok"}
{"N": 1048576, "K": 4096, "D": 128, "B": 32, "dtype": "fp16", "BLOCK_N": 64, "BLOCK_K": 32, "num_warps": 8, "num_stages": 1, "time_ms": 232.56646728515625, "status": "ok"}
{"N": 1048576, "K": 4096, "D": 128, "B": 32, "dtype": "fp16", "BLOCK_N": 64, "BLOCK_K": 32, "num_warps": 8, "num_stages": 2, "time_ms": 202.0715789794922, "status": "ok"}
{"N": 1048576, "K": 4096, "D": 128, "B": 32, "dtype": "fp16", "BLOCK_N": 64, "BLOCK_K": 32, "num_warps": 8, "num_stages": 4, "time_ms": 204.40684509277344, "status": "ok"}
{"N": 1048576, "K": 4096, "D": 128, "B": 32, "dtype": "fp16", "BLOCK_N": 64, "BLOCK_K": 64, "num_warps": 4, "num_stages": 1, "time_ms": 130.9633331298828, "status": "ok"}
{"N": 1048576, "K": 4096, "D": 128, "B": 32, "dtype": "fp16", "BLOCK_N": 64, "BLOCK_K": 64, "num_warps": 4, "num_stages": 2, "time_ms": 101.73747253417969, "status": "ok"}
{"N": 1048576, "K": 4096, "D": 128, "B": 32, "dtype": "fp16", "BLOCK_N": 64, "BLOCK_K": 64, "num_warps": 4, "num_stages": 4, "time_ms": 117.82051086425781, "status": "ok"}
{"N": 1048576, "K": 4096, "D": 128, "B": 32, "dtype": "fp16", "BLOCK_N": 64, "BLOCK_K": 64, "num_warps": 8, "num_stages": 1, "time_ms": 162.94972229003906, "status": "ok"}
{"N": 1048576, "K": 4096, "D": 128, "B": 32, "dtype": "fp16", "BLOCK_N": 64, "BLOCK_K": 64, "num_warps": 8, "num_stages": 2, "time_ms": 149.18899536132812, "status": "ok"}
{"N": 1048576, "K": 4096, "D": 128, "B": 32, "dtype": "fp16", "BLOCK_N": 64, "BLOCK_K": 64, "num_warps": 8, "num_stages": 4, "time_ms": 162.99270629882812, "status": "ok"}
{"N": 1048576, "K": 4096, "D": 128, "B": 32, "dtype": "fp16", "BLOCK_N": 64, "BLOCK_K": 128, "num_warps": 4, "num_stages": 1, "time_ms": 110.05593872070312, "status": "ok"}
{"N": 1048576, "K": 4096, "D": 128, "B": 32, "dtype": "fp16", "BLOCK_N": 64, "BLOCK_K": 128, "num_warps": 4, "num_stages": 2, "time_ms": 106.78665924072266, "status": "ok"}
{"N": 1048576, "K": 4096, "D": 128, "B": 32, "dtype": "fp16", "BLOCK_N": 64, "BLOCK_K": 128, "num_warps": 4, "num_stages": 4, "time_ms": 147.76832580566406, "status": "ok"}
{"N": 1048576, "K": 4096, "D": 128, "B": 32, "dtype": "fp16", "BLOCK_N": 64, "BLOCK_K": 128, "num_warps": 8, "num_stages": 1, "time_ms": 155.19955444335938, "status": "ok"}
{"N": 1048576, "K": 4096, "D": 128, "B": 32, "dtype": "fp16", "BLOCK_N": 64, "BLOCK_K": 128, "num_warps": 8, "num_stages": 2, "time_ms": 152.2954864501953, "status": "ok"}
{"N": 1048576, "K": 4096, "D": 128, "B": 32, "dtype": "fp16", "BLOCK_N": 64, "BLOCK_K": 128, "num_warps": 8, "num_stages": 4, "time_ms": 155.41891479492188, "status": "ok"}
{"N": 1048576, "K": 4096, "D": 128, "B": 32, "dtype": "fp16", "BLOCK_N": 128, "BLOCK_K": 32, "num_warps": 4, "num_stages": 1, "time_ms": 126.7765121459961, "status": "ok"}
{"N": 1048576, "K": 4096, "D": 128, "B": 32, "dtype": "fp16", "BLOCK_N": 128, "BLOCK_K": 32, "num_warps": 4, "num_stages": 2, "time_ms": 122.12751770019531, "status": "ok"}
{"N": 1048576, "K": 4096, "D": 128, "B": 32, "dtype": "fp16", "BLOCK_N": 128, "BLOCK_K": 32, "num_warps": 4, "num_stages": 4, "time_ms": 135.0013427734375, "status": "ok"}
{"N": 1048576, "K": 4096, "D": 128, "B": 32, "dtype": "fp16", "BLOCK_N": 128, "BLOCK_K": 32, "num_warps": 8, "num_stages": 1, "time_ms": 131.84518432617188, "status": "ok"}
{"N": 1048576, "K": 4096, "D": 128, "B": 32, "dtype": "fp16", "BLOCK_N": 128, "BLOCK_K": 32, "num_warps": 8, "num_stages": 2, "time_ms": 129.5733184814453, "status": "ok"}
{"N": 1048576, "K": 4096, "D": 128, "B": 32, "dtype": "fp16", "BLOCK_N": 128, "BLOCK_K": 32, "num_warps": 8, "num_stages": 4, "time_ms": 134.9278106689453, "status": "ok"}
{"N": 1048576, "K": 4096, "D": 128, "B": 32, "dtype": "fp16", "BLOCK_N": 128, "BLOCK_K": 64, "num_warps": 4, "num_stages": 1, "time_ms": 100.07023620605469, "status": "ok"}
{"N": 1048576, "K": 4096, "D": 128, "B": 32, "dtype": "fp16", "BLOCK_N": 128, "BLOCK_K": 64, "num_warps": 4, "num_stages": 2, "time_ms": 102.30086517333984, "status": "ok"}
{"N": 1048576, "K": 4096, "D": 128, "B": 32, "dtype": "fp16", "BLOCK_N": 128, "BLOCK_K": 64, "num_warps": 4, "num_stages": 4, "time_ms": 101.40140533447266, "status": "ok"}
{"N": 1048576, "K": 4096, "D": 128, "B": 32, "dtype": "fp16", "BLOCK_N": 128, "BLOCK_K": 64, "num_warps": 8, "num_stages": 1, "time_ms": 108.00927734375, "status": "ok"}
{"N": 1048576, "K": 4096, "D": 128, "B": 32, "dtype": "fp16", "BLOCK_N": 128, "BLOCK_K": 64, "num_warps": 8, "num_stages": 2, "time_ms": 103.49398040771484, "status": "ok"}
{"N": 1048576, "K": 4096, "D": 128, "B": 32, "dtype": "fp16", "BLOCK_N": 128, "BLOCK_K": 64, "num_warps": 8, "num_stages": 4, "time_ms": 101.13782501220703, "status": "ok"}
{"N": 1048576, "K": 4096, "D": 128, "B": 32, "dtype": "fp16", "BLOCK_N": 128, "BLOCK_K": 128, "num_warps": 4, "num_stages": 1, "time_ms": 101.32294464111328, "status": "ok"}
{"N": 1048576, "K": 4096, "D": 128, "B": 32, "dtype": "fp16", "BLOCK_N": 128, "BLOCK_K": 128, "num_warps": 4, "num_stages": 2, "time_ms": 95.29638671875, "status": "ok"}
{"N": 1048576, "K": 4096, "D": 128, "B": 32, "dtype": "fp16", "BLOCK_N": 128, "BLOCK_K": 128, "num_warps": 4, "num_stages": 4, "time_ms": 120.36598205566406, "status": "ok"}
{"N": 1048576, "K": 4096, "D": 128, "B": 32, "dtype": "fp16", "BLOCK_N": 128, "BLOCK_K": 128, "num_warps": 8, "num_stages": 1, "time_ms": 138.9055938720703, "status": "ok"}
{"N": 1048576, "K": 4096, "D": 128, "B": 32, "dtype": "fp16", "BLOCK_N": 128, "BLOCK_K": 128, "num_warps": 8, "num_stages": 2, "time_ms": 93.30796813964844, "status": "ok"}
{"N": 1048576, "K": 4096, "D": 128, "B": 32, "dtype": "fp16", "BLOCK_N": 128, "BLOCK_K": 128, "num_warps": 8, "num_stages": 4, "time_ms": 114.4161605834961, "status": "ok"}
{"summary": true, "N": 1048576, "K": 4096, "D": 128, "B": 32, "dtype": "fp16", "best": {"N": 1048576, "K": 4096, "D": 128, "B": 32, "dtype": "fp16", "BLOCK_N": 128, "BLOCK_K": 128, "num_warps": 8, "num_stages": 2, "time_ms": 93.30796813964844, "status": "ok"}, "best_time_ms": 93.30796813964844, "tuning_seconds": 92.52243709564209, "skipped": 0}
