grid_results_h100/N1048576_K16384_D128_B32_fp16.jsonl
{"N": 1048576, "K": 16384, "D": 128, "B": 32, "dtype": "fp16", "BLOCK_N": 32, "BLOCK_K": 32, "num_warps": 4, "num_stages": 1, "time_ms": 1273.6641845703125, "status": "ok"}
{"N": 1048576, "K": 16384, "D": 128, "B": 32, "dtype": "fp16", "BLOCK_N": 32, "BLOCK_K": 32, "num_warps": 4, "num_stages": 2, "time_ms": 1052.9259033203125, "status": "ok"}
{"N": 1048576, "K": 16384, "D": 128, "B": 32, "dtype": "fp16", "BLOCK_N": 32, "BLOCK_K": 32, "num_warps": 4, "num_stages": 4, "time_ms": 1057.2386474609375, "status": "ok"}
{"N": 1048576, "K": 16384, "D": 128, "B": 32, "dtype": "fp16", "BLOCK_N": 32, "BLOCK_K": 32, "num_warps": 8, "num_stages": 1, "time_ms": 1886.9471435546875, "status": "ok"}
{"N": 1048576, "K": 16384, "D": 128, "B": 32, "dtype": "fp16", "BLOCK_N": 32, "BLOCK_K": 32, "num_warps": 8, "num_stages": 2, "time_ms": 1713.3277587890625, "status": "ok"}
{"N": 1048576, "K": 16384, "D": 128, "B": 32, "dtype": "fp16", "BLOCK_N": 32, "BLOCK_K": 32, "num_warps": 8, "num_stages": 4, "time_ms": 1687.931396484375, "status": "ok"}
{"N": 1048576, "K": 16384, "D": 128, "B": 32, "dtype": "fp16", "BLOCK_N": 32, "BLOCK_K": 64, "num_warps": 4, "num_stages": 1, "time_ms": 1097.2725830078125, "status": "ok"}
{"N": 1048576, "K": 16384, "D": 128, "B": 32, "dtype": "fp16", "BLOCK_N": 32, "BLOCK_K": 64, "num_warps": 4, "num_stages": 2, "time_ms": 892.0377197265625, "status": "ok"}
{"N": 1048576, "K": 16384, "D": 128, "B": 32, "dtype": "fp16", "BLOCK_N": 32, "BLOCK_K": 64, "num_warps": 4, "num_stages": 4, "time_ms": 930.4249877929688, "status": "ok"}
{"N": 1048576, "K": 16384, "D": 128, "B": 32, "dtype": "fp16", "BLOCK_N": 32, "BLOCK_K": 64, "num_warps": 8, "num_stages": 1, "time_ms": 1329.9345703125, "status": "ok"}
{"N": 1048576, "K": 16384, "D": 128, "B": 32, "dtype": "fp16", "BLOCK_N": 32, "BLOCK_K": 64, "num_warps": 8, "num_stages": 2, "time_ms": 1121.46923828125, "status": "ok"}
{"N": 1048576, "K": 16384, "D": 128, "B": 32, "dtype": "fp16", "BLOCK_N": 32, "BLOCK_K": 64, "num_warps": 8, "num_stages": 4, "time_ms": 1118.0369873046875, "status": "ok"}
{"N": 1048576, "K": 16384, "D": 128, "B": 32, "dtype": "fp16", "BLOCK_N": 32, "BLOCK_K": 128, "num_warps": 4, "num_stages": 1, "time_ms": 898.8653564453125, "status": "ok"}
{"N": 1048576, "K": 16384, "D": 128, "B": 32, "dtype": "fp16", "BLOCK_N": 32, "BLOCK_K": 128, "num_warps": 4, "num_stages": 2, "time_ms": 718.51611328125, "status": "ok"}
{"N": 1048576, "K": 16384, "D": 128, "B": 32, "dtype": "fp16", "BLOCK_N": 32, "BLOCK_K": 128, "num_warps": 4, "num_stages": 4, "time_ms": 963.5741577148438, "status": "ok"}
{"N": 1048576, "K": 16384, "D": 128, "B": 32, "dtype": "fp16", "BLOCK_N": 32, "BLOCK_K": 128, "num_warps": 8, "num_stages": 1, "time_ms": 1197.1114501953125, "status": "ok"}
{"N": 1048576, "K": 16384, "D": 128, "B": 32, "dtype": "fp16", "BLOCK_N": 32, "BLOCK_K": 128, "num_warps": 8, "num_stages": 2, "time_ms": 1021.0816040039062, "status": "ok"}
{"N": 1048576, "K": 16384, "D": 128, "B": 32, "dtype": "fp16", "BLOCK_N": 32, "BLOCK_K": 128, "num_warps": 8, "num_stages": 4, "time_ms": 1025.3572998046875, "status": "ok"}
{"N": 1048576, "K": 16384, "D": 128, "B": 32, "dtype": "fp16", "BLOCK_N": 64, "BLOCK_K": 32, "num_warps": 4, "num_stages": 1, "time_ms": 556.352294921875, "status": "ok"}
{"N": 1048576, "K": 16384, "D": 128, "B": 32, "dtype": "fp16", "BLOCK_N": 64, "BLOCK_K": 32, "num_warps": 4, "num_stages": 2, "time_ms": 462.3353576660156, "status": "ok"}
{"N": 1048576, "K": 16384, "D": 128, "B": 32, "dtype": "fp16", "BLOCK_N": 64, "BLOCK_K": 32, "num_warps": 4, "num_stages": 4, "time_ms": 488.2761535644531, "status": "ok"}
{"N": 1048576, "K": 16384, "D": 128, "B": 32, "dtype": "fp16", "BLOCK_N": 64, "BLOCK_K": 32, "num_warps": 8, "num_stages": 1, "time_ms": 925.8854370117188, "status": "ok"}
{"N": 1048576, "K": 16384, "D": 128, "B": 32, "dtype": "fp16", "BLOCK_N": 64, "BLOCK_K": 32, "num_warps": 8, "num_stages": 2, "time_ms": 809.5321044921875, "status": "ok"}
{"N": 1048576, "K": 16384, "D": 128, "B": 32, "dtype": "fp16", "BLOCK_N": 64, "BLOCK_K": 32, "num_warps": 8, "num_stages": 4, "time_ms": 814.2716064453125, "status": "ok"}
{"N": 1048576, "K": 16384, "D": 128, "B": 32, "dtype": "fp16", "BLOCK_N": 64, "BLOCK_K": 64, "num_warps": 4, "num_stages": 1, "time_ms": 453.2583312988281, "status": "ok"}
{"N": 1048576, "K": 16384, "D": 128, "B": 32, "dtype": "fp16", "BLOCK_N": 64, "BLOCK_K": 64, "num_warps": 4, "num_stages": 2, "time_ms": 421.625244140625, "status": "ok"}
{"N": 1048576, "K": 16384, "D": 128, "B": 32, "dtype": "fp16", "BLOCK_N": 64, "BLOCK_K": 64, "num_warps": 4, "num_stages": 4, "time_ms": 429.9393005371094, "status": "ok"}
{"N": 1048576, "K": 16384, "D": 128, "B": 32, "dtype": "fp16", "BLOCK_N": 64, "BLOCK_K": 64, "num_warps": 8, "num_stages": 1, "time_ms": 670.2554321289062, "status": "ok"}
{"N": 1048576, "K": 16384, "D": 128, "B": 32, "dtype": "fp16", "BLOCK_N": 64, "BLOCK_K": 64, "num_warps": 8, "num_stages": 2, "time_ms": 583.3983154296875, "status": "ok"}
{"N": 1048576, "K": 16384, "D": 128, "B": 32, "dtype": "fp16", "BLOCK_N": 64, "BLOCK_K": 64, "num_warps": 8, "num_stages": 4, "time_ms": 655.1519775390625, "status": "ok"}
{"N": 1048576, "K": 16384, "D": 128, "B": 32, "dtype": "fp16", "BLOCK_N": 64, "BLOCK_K": 128, "num_warps": 4, "num_stages": 1, "time_ms": 427.2029724121094, "status": "ok"}
{"N": 1048576, "K": 16384, "D": 128, "B": 32, "dtype": "fp16", "BLOCK_N": 64, "BLOCK_K": 128, "num_warps": 4, "num_stages": 2, "time_ms": 425.8337097167969, "status": "ok"}
{"N": 1048576, "K": 16384, "D": 128, "B": 32, "dtype": "fp16", "BLOCK_N": 64, "BLOCK_K": 128, "num_warps": 4, "num_stages": 4, "time_ms": 524.86767578125, "status": "ok"}
{"N": 1048576, "K": 16384, "D": 128, "B": 32, "dtype": "fp16", "BLOCK_N": 64, "BLOCK_K": 128, "num_warps": 8, "num_stages": 1, "time_ms": 627.8692016601562, "status": "ok"}
{"N": 1048576, "K": 16384, "D": 128, "B": 32, "dtype": "fp16", "BLOCK_N": 64, "BLOCK_K": 128, "num_warps": 8, "num_stages": 2, "time_ms": 551.6963500976562, "status": "ok"}
{"N": 1048576, "K": 16384, "D": 128, "B": 32, "dtype": "fp16", "BLOCK_N": 64, "BLOCK_K": 128, "num_warps": 8, "num_stages": 4, "time_ms": 602.8463745117188, "status": "ok"}
{"N": 1048576, "K": 16384, "D": 128, "B": 32, "dtype": "fp16", "BLOCK_N": 128, "BLOCK_K": 32, "num_warps": 4, "num_stages": 1, "time_ms": 449.0515441894531, "status": "ok"}
{"N": 1048576, "K": 16384, "D": 128, "B": 32, "dtype": "fp16", "BLOCK_N": 128, "BLOCK_K": 32, "num_warps": 4, "num_stages": 2, "time_ms": 445.0157470703125, "status": "ok"}
{"N": 1048576, "K": 16384, "D": 128, "B": 32, "dtype": "fp16", "BLOCK_N": 128, "BLOCK_K": 32, "num_warps": 4, "num_stages": 4, "time_ms": 467.4498291015625, "status": "ok"}
{"N": 1048576, "K": 16384, "D": 128, "B": 32, "dtype": "fp16", "BLOCK_N": 128, "BLOCK_K": 32, "num_warps": 8, "num_stages": 1, "time_ms": 467.66448974609375, "status": "ok"}
{"N": 1048576, "K": 16384, "D": 128, "B": 32, "dtype": "fp16", "BLOCK_N": 128, "BLOCK_K": 32, "num_warps": 8, "num_stages": 2, "time_ms": 454.11590576171875, "status": "ok"}
{"N": 1048576, "K": 16384, "D": 128, "B": 32, "dtype": "fp16", "BLOCK_N": 128, "BLOCK_K": 32, "num_warps": 8, "num_stages": 4, "time_ms": 468.00579833984375, "status": "ok"}
{"N": 1048576, "K": 16384, "D": 128, "B": 32, "dtype": "fp16", "BLOCK_N": 128, "BLOCK_K": 64, "num_warps": 4, "num_stages": 1, "time_ms": 419.2688293457031, "status": "ok"}
{"N": 1048576, "K": 16384, "D": 128, "B": 32, "dtype": "fp16", "BLOCK_N": 128, "BLOCK_K": 64, "num_warps": 4, "num_stages": 2, "time_ms": 419.8150939941406, "status": "ok"}
{"N": 1048576, "K": 16384, "D": 128, "B": 32, "dtype": "fp16", "BLOCK_N": 128, "BLOCK_K": 64, "num_warps": 4, "num_stages": 4, "time_ms": 418.2205810546875, "status": "ok"}
{"N": 1048576, "K": 16384, "D": 128, "B": 32, "dtype": "fp16", "BLOCK_N": 128, "BLOCK_K": 64, "num_warps": 8, "num_stages": 1, "time_ms": 421.0057678222656, "status": "ok"}
{"N": 1048576, "K": 16384, "D": 128, "B": 32, "dtype": "fp16", "BLOCK_N": 128, "BLOCK_K": 64, "num_warps": 8, "num_stages": 2, "time_ms": 420.59527587890625, "status": "ok"}
{"N": 1048576, "K": 16384, "D": 128, "B": 32, "dtype": "fp16", "BLOCK_N": 128, "BLOCK_K": 64, "num_warps": 8, "num_stages": 4, "time_ms": 418.5605163574219, "status": "ok"}
{"N": 1048576, "K": 16384, "D": 128, "B": 32, "dtype": "fp16", "BLOCK_N": 128, "BLOCK_K": 128, "num_warps": 4, "num_stages": 1, "time_ms": 415.11090087890625, "status": "ok"}
{"N": 1048576, "K": 16384, "D": 128, "B": 32, "dtype": "fp16", "BLOCK_N": 128, "BLOCK_K": 128, "num_warps": 4, "num_stages": 2, "time_ms": 399.1089782714844, "status": "ok"}
{"N": 1048576, "K": 16384, "D": 128, "B": 32, "dtype": "fp16", "BLOCK_N": 128, "BLOCK_K": 128, "num_warps": 4, "num_stages": 4, "time_ms": 437.6696472167969, "status": "ok"}
{"N": 1048576, "K": 16384, "D": 128, "B": 32, "dtype": "fp16", "BLOCK_N": 128, "BLOCK_K": 128, "num_warps": 8, "num_stages": 1, "time_ms": 548.6607055664062, "status": "ok"}
{"N": 1048576, "K": 16384, "D": 128, "B": 32, "dtype": "fp16", "BLOCK_N": 128, "BLOCK_K": 128, "num_warps": 8, "num_stages": 2, "time_ms": 392.31231689453125, "status": "ok"}
{"N": 1048576, "K": 16384, "D": 128, "B": 32, "dtype": "fp16", "BLOCK_N": 128, "BLOCK_K": 128, "num_warps": 8, "num_stages": 4, "time_ms": 427.1440124511719, "status": "ok"}
{"summary": true, "N": 1048576, "K": 16384, "D": 128, "B": 32, "dtype": "fp16", "best": {"N": 1048576, "K": 16384, "D": 128, "B": 32, "dtype": "fp16", "BLOCK_N": 128, "BLOCK_K": 128, "num_warps": 8, "num_stages": 2, "time_ms": 392.31231689453125, "status": "ok"}, "best_time_ms": 392.31231689453125, "tuning_seconds": 328.45754408836365, "skipped": 0}
