grid_results_h100/N1048576_K200000_D128_B32_fp16.jsonl
{"N": 1048576, "K": 200000, "D": 128, "B": 32, "dtype": "fp16", "BLOCK_N": 32, "BLOCK_K": 32, "num_warps": 4, "num_stages": 1, "time_ms": 15781.1357421875, "status": "ok"}
{"N": 1048576, "K": 200000, "D": 128, "B": 32, "dtype": "fp16", "BLOCK_N": 32, "BLOCK_K": 32, "num_warps": 4, "num_stages": 2, "time_ms": 12850.955078125, "status": "ok"}
{"N": 1048576, "K": 200000, "D": 128, "B": 32, "dtype": "fp16", "BLOCK_N": 32, "BLOCK_K": 32, "num_warps": 4, "num_stages": 4, "time_ms": 12832.16796875, "status": "ok"}
{"N": 1048576, "K": 200000, "D": 128, "B": 32, "dtype": "fp16", "BLOCK_N": 32, "BLOCK_K": 32, "num_warps": 8, "num_stages": 1, "time_ms": 23669.71484375, "status": "ok"}
{"N": 1048576, "K": 200000, "D": 128, "B": 32, "dtype": "fp16", "BLOCK_N": 32, "BLOCK_K": 32, "num_warps": 8, "num_stages": 2, "time_ms": 21163.712890625, "status": "ok"}
{"N": 1048576, "K": 200000, "D": 128, "B": 32, "dtype": "fp16", "BLOCK_N": 32, "BLOCK_K": 32, "num_warps": 8, "num_stages": 4, "time_ms": 20600.537109375, "status": "ok"}
{"N": 1048576, "K": 200000, "D": 128, "B": 32, "dtype": "fp16", "BLOCK_N": 32, "BLOCK_K": 64, "num_warps": 4, "num_stages": 1, "time_ms": 13386.916015625, "status": "ok"}
{"N": 1048576, "K": 200000, "D": 128, "B": 32, "dtype": "fp16", "BLOCK_N": 32, "BLOCK_K": 64, "num_warps": 4, "num_stages": 2, "time_ms": 11124.9296875, "status": "ok"}
{"N": 1048576, "K": 200000, "D": 128, "B": 32, "dtype": "fp16", "BLOCK_N": 32, "BLOCK_K": 64, "num_warps": 4, "num_stages": 4, "time_ms": 11409.794921875, "status": "ok"}
{"N": 1048576, "K": 200000, "D": 128, "B": 32, "dtype": "fp16", "BLOCK_N": 32, "BLOCK_K": 64, "num_warps": 8, "num_stages": 1, "time_ms": 16652.623046875, "status": "ok"}
{"N": 1048576, "K": 200000, "D": 128, "B": 32, "dtype": "fp16", "BLOCK_N": 32, "BLOCK_K": 64, "num_warps": 8, "num_stages": 2, "time_ms": 13750.5703125, "status": "ok"}
{"N": 1048576, "K": 200000, "D": 128, "B": 32, "dtype": "fp16", "BLOCK_N": 32, "BLOCK_K": 64, "num_warps": 8, "num_stages": 4, "time_ms": 13604.71875, "status": "ok"}
{"N": 1048576, "K": 200000, "D": 128, "B": 32, "dtype": "fp16", "BLOCK_N": 32, "BLOCK_K": 128, "num_warps": 4, "num_stages": 1, "time_ms": 11104.9921875, "status": "ok"}
{"N": 1048576, "K": 200000, "D": 128, "B": 32, "dtype": "fp16", "BLOCK_N": 32, "BLOCK_K": 128, "num_warps": 4, "num_stages": 2, "time_ms": 9808.4921875, "status": "ok"}
{"N": 1048576, "K": 200000, "D": 128, "B": 32, "dtype": "fp16", "BLOCK_N": 32, "BLOCK_K": 128, "num_warps": 4, "num_stages": 4, "time_ms": 9929.521484375, "status": "ok"}
{"N": 1048576, "K": 200000, "D": 128, "B": 32, "dtype": "fp16", "BLOCK_N": 32, "BLOCK_K": 128, "num_warps": 8, "num_stages": 1, "time_ms": 14825.37890625, "status": "ok"}
{"N": 1048576, "K": 200000, "D": 128, "B": 32, "dtype": "fp16", "BLOCK_N": 32, "BLOCK_K": 128, "num_warps": 8, "num_stages": 2, "time_ms": 12508.3232421875, "status": "ok"}
{"N": 1048576, "K": 200000, "D": 128, "B": 32, "dtype": "fp16", "BLOCK_N": 32, "BLOCK_K": 128, "num_warps": 8, "num_stages": 4, "time_ms": 12759.494140625, "status": "ok"}
{"N": 1048576, "K": 200000, "D": 128, "B": 32, "dtype": "fp16", "BLOCK_N": 64, "BLOCK_K": 32, "num_warps": 4, "num_stages": 1, "time_ms": 6860.24267578125, "status": "ok"}
{"N": 1048576, "K": 200000, "D": 128, "B": 32, "dtype": "fp16", "BLOCK_N": 64, "BLOCK_K": 32, "num_warps": 4, "num_stages": 2, "time_ms": 5754.31640625, "status": "ok"}
{"N": 1048576, "K": 200000, "D": 128, "B": 32, "dtype": "fp16", "BLOCK_N": 64, "BLOCK_K": 32, "num_warps": 4, "num_stages": 4, "time_ms": 5836.00927734375, "status": "ok"}
{"N": 1048576, "K": 200000, "D": 128, "B": 32, "dtype": "fp16", "BLOCK_N": 64, "BLOCK_K": 32, "num_warps": 8, "num_stages": 1, "time_ms": 11308.05859375, "status": "ok"}
{"N": 1048576, "K": 200000, "D": 128, "B": 32, "dtype": "fp16", "BLOCK_N": 64, "BLOCK_K": 32, "num_warps": 8, "num_stages": 2, "time_ms": 9869.2802734375, "status": "ok"}
{"N": 1048576, "K": 200000, "D": 128, "B": 32, "dtype": "fp16", "BLOCK_N": 64, "BLOCK_K": 32, "num_warps": 8, "num_stages": 4, "time_ms": 9955.16796875, "status": "ok"}
{"N": 1048576, "K": 200000, "D": 128, "B": 32, "dtype": "fp16", "BLOCK_N": 64, "BLOCK_K": 64, "num_warps": 4, "num_stages": 1, "time_ms": 5699.4453125, "status": "ok"}
{"N": 1048576, "K": 200000, "D": 128, "B": 32, "dtype": "fp16", "BLOCK_N": 64, "BLOCK_K": 64, "num_warps": 4, "num_stages": 2, "time_ms": 5200.9326171875, "status": "ok"}
{"N": 1048576, "K": 200000, "D": 128, "B": 32, "dtype": "fp16", "BLOCK_N": 64, "BLOCK_K": 64, "num_warps": 4, "num_stages": 4, "time_ms": 6266.59228515625, "status": "ok"}
{"N": 1048576, "K": 200000, "D": 128, "B": 32, "dtype": "fp16", "BLOCK_N": 64, "BLOCK_K": 64, "num_warps": 8, "num_stages": 1, "time_ms": 8224.2099609375, "status": "ok"}
{"N": 1048576, "K": 200000, "D": 128, "B": 32, "dtype": "fp16", "BLOCK_N": 64, "BLOCK_K": 64, "num_warps": 8, "num_stages": 2, "time_ms": 7160.8671875, "status": "ok"}
{"N": 1048576, "K": 200000, "D": 128, "B": 32, "dtype": "fp16", "BLOCK_N": 64, "BLOCK_K": 64, "num_warps": 8, "num_stages": 4, "time_ms": 7839.80712890625, "status": "ok"}
{"N": 1048576, "K": 200000, "D": 128, "B": 32, "dtype": "fp16", "BLOCK_N": 64, "BLOCK_K": 128, "num_warps": 4, "num_stages": 1, "time_ms": 5804.75634765625, "status": "ok"}
{"N": 1048576, "K": 200000, "D": 128, "B": 32, "dtype": "fp16", "BLOCK_N": 64, "BLOCK_K": 128, "num_warps": 4, "num_stages": 2, "time_ms": 5693.92431640625, "status": "ok"}
{"N": 1048576, "K": 200000, "D": 128, "B": 32, "dtype": "fp16", "BLOCK_N": 64, "BLOCK_K": 128, "num_warps": 4, "num_stages": 4, "time_ms": 7626.04736328125, "status": "ok"}
{"N": 1048576, "K": 200000, "D": 128, "B": 32, "dtype": "fp16", "BLOCK_N": 64, "BLOCK_K": 128, "num_warps": 8, "num_stages": 1, "time_ms": 8119.634765625, "status": "ok"}
{"N": 1048576, "K": 200000, "D": 128, "B": 32, "dtype": "fp16", "BLOCK_N": 64, "BLOCK_K": 128, "num_warps": 8, "num_stages": 2, "time_ms": 7333.59619140625, "status": "ok"}
{"N": 1048576, "K": 200000, "D": 128, "B": 32, "dtype": "fp16", "BLOCK_N": 64, "BLOCK_K": 128, "num_warps": 8, "num_stages": 4, "time_ms": 9026.7412109375, "status": "ok"}
{"N": 1048576, "K": 200000, "D": 128, "B": 32, "dtype": "fp16", "BLOCK_N": 128, "BLOCK_K": 32, "num_warps": 4, "num_stages": 1, "time_ms": 5610.3876953125, "status": "ok"}
{"N": 1048576, "K": 200000, "D": 128, "B": 32, "dtype": "fp16", "BLOCK_N": 128, "BLOCK_K": 32, "num_warps": 4, "num_stages": 2, "time_ms": 5671.9970703125, "status": "ok"}
{"N": 1048576, "K": 200000, "D": 128, "B": 32, "dtype": "fp16", "BLOCK_N": 128, "BLOCK_K": 32, "num_warps": 4, "num_stages": 4, "time_ms": 5860.9921875, "status": "ok"}
{"N": 1048576, "K": 200000, "D": 128, "B": 32, "dtype": "fp16", "BLOCK_N": 128, "BLOCK_K": 32, "num_warps": 8, "num_stages": 1, "time_ms": 5783.0302734375, "status": "ok"}
{"N": 1048576, "K": 200000, "D": 128, "B": 32, "dtype": "fp16", "BLOCK_N": 128, "BLOCK_K": 32, "num_warps": 8, "num_stages": 2, "time_ms": 5676.79052734375, "status": "ok"}
{"N": 1048576, "K": 200000, "D": 128, "B": 32, "dtype": "fp16", "BLOCK_N": 128, "BLOCK_K": 32, "num_warps": 8, "num_stages": 4, "time_ms": 5870.69921875, "status": "ok"}
{"N": 1048576, "K": 200000, "D": 128, "B": 32, "dtype": "fp16", "BLOCK_N": 128, "BLOCK_K": 64, "num_warps": 4, "num_stages": 1, "time_ms": 5087.0615234375, "status": "ok"}
{"N": 1048576, "K": 200000, "D": 128, "B": 32, "dtype": "fp16", "BLOCK_N": 128, "BLOCK_K": 64, "num_warps": 4, "num_stages": 2, "time_ms": 4904.02783203125, "status": "ok"}
{"N": 1048576, "K": 200000, "D": 128, "B": 32, "dtype": "fp16", "BLOCK_N": 128, "BLOCK_K": 64, "num_warps": 4, "num_stages": 4, "time_ms": 4936.43701171875, "status": "ok"}
{"N": 1048576, "K": 200000, "D": 128, "B": 32, "dtype": "fp16", "BLOCK_N": 128, "BLOCK_K": 64, "num_warps": 8, "num_stages": 1, "time_ms": 5129.708984375, "status": "ok"}
{"N": 1048576, "K": 200000, "D": 128, "B": 32, "dtype": "fp16", "BLOCK_N": 128, "BLOCK_K": 64, "num_warps": 8, "num_stages": 2, "time_ms": 5058.17041015625, "status": "ok"}
{"N": 1048576, "K": 200000, "D": 128, "B": 32, "dtype": "fp16", "BLOCK_N": 128, "BLOCK_K": 64, "num_warps": 8, "num_stages": 4, "time_ms": 5103.8125, "status": "ok"}
{"N": 1048576, "K": 200000, "D": 128, "B": 32, "dtype": "fp16", "BLOCK_N": 128, "BLOCK_K": 128, "num_warps": 4, "num_stages": 1, "time_ms": 5753.17333984375, "status": "ok"}
{"N": 1048576, "K": 200000, "D": 128, "B": 32, "dtype": "fp16", "BLOCK_N": 128, "BLOCK_K": 128, "num_warps": 4, "num_stages": 2, "time_ms": 5131.06494140625, "status": "ok"}
{"N": 1048576, "K": 200000, "D": 128, "B": 32, "dtype": "fp16", "BLOCK_N": 128, "BLOCK_K": 128, "num_warps": 4, "num_stages": 4, "time_ms": 5662.67626953125, "status": "ok"}
{"N": 1048576, "K": 200000, "D": 128, "B": 32, "dtype": "fp16", "BLOCK_N": 128, "BLOCK_K": 128, "num_warps": 8, "num_stages": 1, "time_ms": 8677.078125, "status": "ok"}
{"N": 1048576, "K": 200000, "D": 128, "B": 32, "dtype": "fp16", "BLOCK_N": 128, "BLOCK_K": 128, "num_warps": 8, "num_stages": 2, "time_ms": 7310.8037109375, "status": "ok"}
{"N": 1048576, "K": 200000, "D": 128, "B": 32, "dtype": "fp16", "BLOCK_N": 128, "BLOCK_K": 128, "num_warps": 8, "num_stages": 4, "time_ms": 5949.94677734375, "status": "ok"}
{"summary": true, "N": 1048576, "K": 200000, "D": 128, "B": 32, "dtype": "fp16", "best": {"N": 1048576, "K": 200000, "D": 128, "B": 32, "dtype": "fp16", "BLOCK_N": 128, "BLOCK_K": 64, "num_warps": 4, "num_stages": 2, "time_ms": 4904.02783203125, "status": "ok"}, "best_time_ms": 4904.02783203125, "tuning_seconds": 3971.5322399139404, "skipped": 0}
