grid_results_h100/N1048576_K65536_D256_B1_fp16.jsonl
{"N": 1048576, "K": 65536, "D": 256, "B": 1, "dtype": "fp16", "BLOCK_N": 32, "BLOCK_K": 32, "num_warps": 4, "num_stages": 1, "time_ms": 280.7132873535156, "status": "ok"}
{"N": 1048576, "K": 65536, "D": 256, "B": 1, "dtype": "fp16", "BLOCK_N": 32, "BLOCK_K": 32, "num_warps": 4, "num_stages": 2, "time_ms": 222.18838500976562, "status": "ok"}
{"N": 1048576, "K": 65536, "D": 256, "B": 1, "dtype": "fp16", "BLOCK_N": 32, "BLOCK_K": 32, "num_warps": 4, "num_stages": 4, "time_ms": 258.4466247558594, "status": "ok"}
{"N": 1048576, "K": 65536, "D": 256, "B": 1, "dtype": "fp16", "BLOCK_N": 32, "BLOCK_K": 32, "num_warps": 8, "num_stages": 1, "time_ms": 384.1690979003906, "status": "ok"}
{"N": 1048576, "K": 65536, "D": 256, "B": 1, "dtype": "fp16", "BLOCK_N": 32, "BLOCK_K": 32, "num_warps": 8, "num_stages": 2, "time_ms": 326.04510498046875, "status": "ok"}
{"N": 1048576, "K": 65536, "D": 256, "B": 1, "dtype": "fp16", "BLOCK_N": 32, "BLOCK_K": 32, "num_warps": 8, "num_stages": 4, "time_ms": 328.73822021484375, "status": "ok"}
{"N": 1048576, "K": 65536, "D": 256, "B": 1, "dtype": "fp16", "BLOCK_N": 32, "BLOCK_K": 64, "num_warps": 4, "num_stages": 1, "time_ms": 239.7222442626953, "status": "ok"}
{"N": 1048576, "K": 65536, "D": 256, "B": 1, "dtype": "fp16", "BLOCK_N": 32, "BLOCK_K": 64, "num_warps": 4, "num_stages": 2, "time_ms": 200.1616668701172, "status": "ok"}
{"N": 1048576, "K": 65536, "D": 256, "B": 1, "dtype": "fp16", "BLOCK_N": 32, "BLOCK_K": 64, "num_warps": 4, "num_stages": 4, "time_ms": 238.10182189941406, "status": "ok"}
{"N": 1048576, "K": 65536, "D": 256, "B": 1, "dtype": "fp16", "BLOCK_N": 32, "BLOCK_K": 64, "num_warps": 8, "num_stages": 1, "time_ms": 285.72601318359375, "status": "ok"}
{"N": 1048576, "K": 65536, "D": 256, "B": 1, "dtype": "fp16", "BLOCK_N": 32, "BLOCK_K": 64, "num_warps": 8, "num_stages": 2, "time_ms": 218.68710327148438, "status": "ok"}
{"N": 1048576, "K": 65536, "D": 256, "B": 1, "dtype": "fp16", "BLOCK_N": 32, "BLOCK_K": 64, "num_warps": 8, "num_stages": 4, "time_ms": 233.64256286621094, "status": "ok"}
{"N": 1048576, "K": 65536, "D": 256, "B": 1, "dtype": "fp16", "BLOCK_N": 32, "BLOCK_K": 128, "num_warps": 4, "num_stages": 1, "time_ms": 227.35743713378906, "status": "ok"}
{"N": 1048576, "K": 65536, "D": 256, "B": 1, "dtype": "fp16", "BLOCK_N": 32, "BLOCK_K": 128, "num_warps": 4, "num_stages": 2, "time_ms": 193.03794860839844, "status": "ok"}
{"N": 1048576, "K": 65536, "D": 256, "B": 1, "dtype": "fp16", "BLOCK_N": 32, "BLOCK_K": 128, "num_warps": 4, "num_stages": 4, "time_ms": 255.37088012695312, "status": "ok"}
{"N": 1048576, "K": 65536, "D": 256, "B": 1, "dtype": "fp16", "BLOCK_N": 32, "BLOCK_K": 128, "num_warps": 8, "num_stages": 1, "time_ms": 272.7978515625, "status": "ok"}
{"N": 1048576, "K": 65536, "D": 256, "B": 1, "dtype": "fp16", "BLOCK_N": 32, "BLOCK_K": 128, "num_warps": 8, "num_stages": 2, "time_ms": 219.653564453125, "status": "ok"}
{"N": 1048576, "K": 65536, "D": 256, "B": 1, "dtype": "fp16", "BLOCK_N": 32, "BLOCK_K": 128, "num_warps": 8, "num_stages": 4, "time_ms": 281.4505615234375, "status": "ok"}
{"N": 1048576, "K": 65536, "D": 256, "B": 1, "dtype": "fp16", "BLOCK_N": 64, "BLOCK_K": 32, "num_warps": 4, "num_stages": 1, "time_ms": 135.62002563476562, "status": "ok"}
{"N": 1048576, "K": 65536, "D": 256, "B": 1, "dtype": "fp16", "BLOCK_N": 64, "BLOCK_K": 32, "num_warps": 4, "num_stages": 2, "time_ms": 118.02777862548828, "status": "ok"}
{"N": 1048576, "K": 65536, "D": 256, "B": 1, "dtype": "fp16", "BLOCK_N": 64, "BLOCK_K": 32, "num_warps": 4, "num_stages": 4, "time_ms": 112.24765014648438, "status": "ok"}
{"N": 1048576, "K": 65536, "D": 256, "B": 1, "dtype": "fp16", "BLOCK_N": 64, "BLOCK_K": 32, "num_warps": 8, "num_stages": 1, "time_ms": 188.55625915527344, "status": "ok"}
{"N": 1048576, "K": 65536, "D": 256, "B": 1, "dtype": "fp16", "BLOCK_N": 64, "BLOCK_K": 32, "num_warps": 8, "num_stages": 2, "time_ms": 162.79458618164062, "status": "ok"}
{"N": 1048576, "K": 65536, "D": 256, "B": 1, "dtype": "fp16", "BLOCK_N": 64, "BLOCK_K": 32, "num_warps": 8, "num_stages": 4, "time_ms": 166.908935546875, "status": "ok"}
{"N": 1048576, "K": 65536, "D": 256, "B": 1, "dtype": "fp16", "BLOCK_N": 64, "BLOCK_K": 64, "num_warps": 4, "num_stages": 1, "time_ms": 110.9095687866211, "status": "ok"}
{"N": 1048576, "K": 65536, "D": 256, "B": 1, "dtype": "fp16", "BLOCK_N": 64, "BLOCK_K": 64, "num_warps": 4, "num_stages": 2, "time_ms": 124.62364959716797, "status": "ok"}
{"N": 1048576, "K": 65536, "D": 256, "B": 1, "dtype": "fp16", "BLOCK_N": 64, "BLOCK_K": 64, "num_warps": 4, "num_stages": 4, "time_ms": 160.4614715576172, "status": "ok"}
{"N": 1048576, "K": 65536, "D": 256, "B": 1, "dtype": "fp16", "BLOCK_N": 64, "BLOCK_K": 64, "num_warps": 8, "num_stages": 1, "time_ms": 147.4304656982422, "status": "ok"}
{"N": 1048576, "K": 65536, "D": 256, "B": 1, "dtype": "fp16", "BLOCK_N": 64, "BLOCK_K": 64, "num_warps": 8, "num_stages": 2, "time_ms": 139.845947265625, "status": "ok"}
{"N": 1048576, "K": 65536, "D": 256, "B": 1, "dtype": "fp16", "BLOCK_N": 64, "BLOCK_K": 64, "num_warps": 8, "num_stages": 4, "time_ms": 145.92515563964844, "status": "ok"}
{"N": 1048576, "K": 65536, "D": 256, "B": 1, "dtype": "fp16", "BLOCK_N": 64, "BLOCK_K": 128, "num_warps": 4, "num_stages": 1, "time_ms": 94.72447967529297, "status": "ok"}
{"N": 1048576, "K": 65536, "D": 256, "B": 1, "dtype": "fp16", "BLOCK_N": 64, "BLOCK_K": 128, "num_warps": 4, "num_stages": 2, "time_ms": 136.30770874023438, "status": "ok"}
{"N": 1048576, "K": 65536, "D": 256, "B": 1, "dtype": "fp16", "BLOCK_N": 64, "BLOCK_K": 128, "num_warps": 4, "num_stages": 4, "status": "oor"}
{"N": 1048576, "K": 65536, "D": 256, "B": 1, "dtype": "fp16", "BLOCK_N": 64, "BLOCK_K": 128, "num_warps": 8, "num_stages": 1, "time_ms": 142.02406311035156, "status": "ok"}
{"N": 1048576, "K": 65536, "D": 256, "B": 1, "dtype": "fp16", "BLOCK_N": 64, "BLOCK_K": 128, "num_warps": 8, "num_stages": 2, "time_ms": 145.71615600585938, "status": "ok"}
{"N": 1048576, "K": 65536, "D": 256, "B": 1, "dtype": "fp16", "BLOCK_N": 64, "BLOCK_K": 128, "num_warps": 8, "num_stages": 4, "status": "oor"}
{"N": 1048576, "K": 65536, "D": 256, "B": 1, "dtype": "fp16", "BLOCK_N": 128, "BLOCK_K": 32, "num_warps": 4, "num_stages": 1, "time_ms": 115.90054321289062, "status": "ok"}
{"N": 1048576, "K": 65536, "D": 256, "B": 1, "dtype": "fp16", "BLOCK_N": 128, "BLOCK_K": 32, "num_warps": 4, "num_stages": 2, "time_ms": 122.6395492553711, "status": "ok"}
{"N": 1048576, "K": 65536, "D": 256, "B": 1, "dtype": "fp16", "BLOCK_N": 128, "BLOCK_K": 32, "num_warps": 4, "num_stages": 4, "time_ms": 145.15391540527344, "status": "ok"}
{"N": 1048576, "K": 65536, "D": 256, "B": 1, "dtype": "fp16", "BLOCK_N": 128, "BLOCK_K": 32, "num_warps": 8, "num_stages": 1, "time_ms": 108.20559692382812, "status": "ok"}
{"N": 1048576, "K": 65536, "D": 256, "B": 1, "dtype": "fp16", "BLOCK_N": 128, "BLOCK_K": 32, "num_warps": 8, "num_stages": 2, "time_ms": 106.6487045288086, "status": "ok"}
{"N": 1048576, "K": 65536, "D": 256, "B": 1, "dtype": "fp16", "BLOCK_N": 128, "BLOCK_K": 32, "num_warps": 8, "num_stages": 4, "time_ms": 104.10047912597656, "status": "ok"}
{"N": 1048576, "K": 65536, "D": 256, "B": 1, "dtype": "fp16", "BLOCK_N": 128, "BLOCK_K": 64, "num_warps": 4, "num_stages": 1, "time_ms": 96.99600219726562, "status": "ok"}
{"N": 1048576, "K": 65536, "D": 256, "B": 1, "dtype": "fp16", "BLOCK_N": 128, "BLOCK_K": 64, "num_warps": 4, "num_stages": 2, "time_ms": 132.97389221191406, "status": "ok"}
{"N": 1048576, "K": 65536, "D": 256, "B": 1, "dtype": "fp16", "BLOCK_N": 128, "BLOCK_K": 64, "num_warps": 4, "num_stages": 4, "time_ms": 104.02912139892578, "status": "ok"}
{"N": 1048576, "K": 65536, "D": 256, "B": 1, "dtype": "fp16", "BLOCK_N": 128, "BLOCK_K": 64, "num_warps": 8, "num_stages": 1, "time_ms": 92.98358154296875, "status": "ok"}
{"N": 1048576, "K": 65536, "D": 256, "B": 1, "dtype": "fp16", "BLOCK_N": 128, "BLOCK_K": 64, "num_warps": 8, "num_stages": 2, "time_ms": 130.18675231933594, "status": "ok"}
{"N": 1048576, "K": 65536, "D": 256, "B": 1, "dtype": "fp16", "BLOCK_N": 128, "BLOCK_K": 64, "num_warps": 8, "num_stages": 4, "time_ms": 98.23535919189453, "status": "ok"}
{"N": 1048576, "K": 65536, "D": 256, "B": 1, "dtype": "fp16", "BLOCK_N": 128, "BLOCK_K": 128, "num_warps": 4, "num_stages": 1, "time_ms": 123.60797119140625, "status": "ok"}
{"N": 1048576, "K": 65536, "D": 256, "B": 1, "dtype": "fp16", "BLOCK_N": 128, "BLOCK_K": 128, "num_warps": 4, "num_stages": 2, "time_ms": 103.29261016845703, "status": "ok"}
{"N": 1048576, "K": 65536, "D": 256, "B": 1, "dtype": "fp16", "BLOCK_N": 128, "BLOCK_K": 128, "num_warps": 4, "num_stages": 4, "status": "oor"}
{"N": 1048576, "K": 65536, "D": 256, "B": 1, "dtype": "fp16", "BLOCK_N": 128, "BLOCK_K": 128, "num_warps": 8, "num_stages": 1, "time_ms": 121.78905487060547, "status": "ok"}
{"N": 1048576, "K": 65536, "D": 256, "B": 1, "dtype": "fp16", "BLOCK_N": 128, "BLOCK_K": 128, "num_warps": 8, "num_stages": 2, "time_ms": 99.92963409423828, "status": "ok"}
{"N": 1048576, "K": 65536, "D": 256, "B": 1, "dtype": "fp16", "BLOCK_N": 128, "BLOCK_K": 128, "num_warps": 8, "num_stages": 4, "status": "oor"}
{"summary": true, "N": 1048576, "K": 65536, "D": 256, "B": 1, "dtype": "fp16", "best": {"N": 1048576, "K": 65536, "D": 256, "B": 1, "dtype": "fp16", "BLOCK_N": 128, "BLOCK_K": 64, "num_warps": 8, "num_stages": 1, "time_ms": 92.98358154296875, "status": "ok"}, "best_time_ms": 92.98358154296875, "tuning_seconds": 87.26196193695068, "skipped": 4}
