grid_results_h100/N262144_K1024_D64_B32_fp16.jsonl
{"N": 262144, "K": 1024, "D": 64, "B": 32, "dtype": "fp16", "BLOCK_N": 32, "BLOCK_K": 32, "num_warps": 4, "num_stages": 1, "time_ms": 13.153440475463867, "status": "ok"}
{"N": 262144, "K": 1024, "D": 64, "B": 32, "dtype": "fp16", "BLOCK_N": 32, "BLOCK_K": 32, "num_warps": 4, "num_stages": 2, "time_ms": 11.817312240600586, "status": "ok"}
{"N": 262144, "K": 1024, "D": 64, "B": 32, "dtype": "fp16", "BLOCK_N": 32, "BLOCK_K": 32, "num_warps": 4, "num_stages": 4, "time_ms": 11.787424087524414, "status": "ok"}
{"N": 262144, "K": 1024, "D": 64, "B": 32, "dtype": "fp16", "BLOCK_N": 32, "BLOCK_K": 32, "num_warps": 8, "num_stages": 1, "time_ms": 20.599199295043945, "status": "ok"}
{"N": 262144, "K": 1024, "D": 64, "B": 32, "dtype": "fp16", "BLOCK_N": 32, "BLOCK_K": 32, "num_warps": 8, "num_stages": 2, "time_ms": 19.742048263549805, "status": "ok"}
{"N": 262144, "K": 1024, "D": 64, "B": 32, "dtype": "fp16", "BLOCK_N": 32, "BLOCK_K": 32, "num_warps": 8, "num_stages": 4, "time_ms": 19.743104934692383, "status": "ok"}
{"N": 262144, "K": 1024, "D": 64, "B": 32, "dtype": "fp16", "BLOCK_N": 32, "BLOCK_K": 64, "num_warps": 4, "num_stages": 1, "time_ms": 11.175840377807617, "status": "ok"}
{"N": 262144, "K": 1024, "D": 64, "B": 32, "dtype": "fp16", "BLOCK_N": 32, "BLOCK_K": 64, "num_warps": 4, "num_stages": 2, "time_ms": 10.114272117614746, "status": "ok"}
{"N": 262144, "K": 1024, "D": 64, "B": 32, "dtype": "fp16", "BLOCK_N": 32, "BLOCK_K": 64, "num_warps": 4, "num_stages": 4, "time_ms": 9.774687767028809, "status": "ok"}
{"N": 262144, "K": 1024, "D": 64, "B": 32, "dtype": "fp16", "BLOCK_N": 32, "BLOCK_K": 64, "num_warps": 8, "num_stages": 1, "time_ms": 13.619327545166016, "status": "ok"}
{"N": 262144, "K": 1024, "D": 64, "B": 32, "dtype": "fp16", "BLOCK_N": 32, "BLOCK_K": 64, "num_warps": 8, "num_stages": 2, "time_ms": 12.884256362915039, "status": "ok"}
{"N": 262144, "K": 1024, "D": 64, "B": 32, "dtype": "fp16", "BLOCK_N": 32, "BLOCK_K": 64, "num_warps": 8, "num_stages": 4, "time_ms": 12.877568244934082, "status": "ok"}
{"N": 262144, "K": 1024, "D": 64, "B": 32, "dtype": "fp16", "BLOCK_N": 32, "BLOCK_K": 128, "num_warps": 4, "num_stages": 1, "time_ms": 8.880928039550781, "status": "ok"}
{"N": 262144, "K": 1024, "D": 64, "B": 32, "dtype": "fp16", "BLOCK_N": 32, "BLOCK_K": 128, "num_warps": 4, "num_stages": 2, "time_ms": 8.291199684143066, "status": "ok"}
{"N": 262144, "K": 1024, "D": 64, "B": 32, "dtype": "fp16", "BLOCK_N": 32, "BLOCK_K": 128, "num_warps": 4, "num_stages": 4, "time_ms": 8.362719535827637, "status": "ok"}
{"N": 262144, "K": 1024, "D": 64, "B": 32, "dtype": "fp16", "BLOCK_N": 32, "BLOCK_K": 128, "num_warps": 8, "num_stages": 1, "time_ms": 14.11513614654541, "status": "ok"}
{"N": 262144, "K": 1024, "D": 64, "B": 32, "dtype": "fp16", "BLOCK_N": 32, "BLOCK_K": 128, "num_warps": 8, "num_stages": 2, "time_ms": 12.3854398727417, "status": "ok"}
{"N": 262144, "K": 1024, "D": 64, "B": 32, "dtype": "fp16", "BLOCK_N": 32, "BLOCK_K": 128, "num_warps": 8, "num_stages": 4, "time_ms": 12.069215774536133, "status": "ok"}
{"N": 262144, "K": 1024, "D": 64, "B": 32, "dtype": "fp16", "BLOCK_N": 64, "BLOCK_K": 32, "num_warps": 4, "num_stages": 1, "time_ms": 5.28988790512085, "status": "ok"}
{"N": 262144, "K": 1024, "D": 64, "B": 32, "dtype": "fp16", "BLOCK_N": 64, "BLOCK_K": 32, "num_warps": 4, "num_stages": 2, "time_ms": 5.252511978149414, "status": "ok"}
{"N": 262144, "K": 1024, "D": 64, "B": 32, "dtype": "fp16", "BLOCK_N": 64, "BLOCK_K": 32, "num_warps": 4, "num_stages": 4, "time_ms": 5.357600212097168, "status": "ok"}
{"N": 262144, "K": 1024, "D": 64, "B": 32, "dtype": "fp16", "BLOCK_N": 64, "BLOCK_K": 32, "num_warps": 8, "num_stages": 1, "time_ms": 10.493791580200195, "status": "ok"}
{"N": 262144, "K": 1024, "D": 64, "B": 32, "dtype": "fp16", "BLOCK_N": 64, "BLOCK_K": 32, "num_warps": 8, "num_stages": 2, "time_ms": 9.899231910705566, "status": "ok"}
{"N": 262144, "K": 1024, "D": 64, "B": 32, "dtype": "fp16", "BLOCK_N": 64, "BLOCK_K": 32, "num_warps": 8, "num_stages": 4, "time_ms": 9.804736137390137, "status": "ok"}
{"N": 262144, "K": 1024, "D": 64, "B": 32, "dtype": "fp16", "BLOCK_N": 64, "BLOCK_K": 64, "num_warps": 4, "num_stages": 1, "time_ms": 5.09548807144165, "status": "ok"}
{"N": 262144, "K": 1024, "D": 64, "B": 32, "dtype": "fp16", "BLOCK_N": 64, "BLOCK_K": 64, "num_warps": 4, "num_stages": 2, "time_ms": 4.787903785705566, "status": "ok"}
{"N": 262144, "K": 1024, "D": 64, "B": 32, "dtype": "fp16", "BLOCK_N": 64, "BLOCK_K": 64, "num_warps": 4, "num_stages": 4, "time_ms": 4.855423927307129, "status": "ok"}
{"N": 262144, "K": 1024, "D": 64, "B": 32, "dtype": "fp16", "BLOCK_N": 64, "BLOCK_K": 64, "num_warps": 8, "num_stages": 1, "time_ms": 7.595615863800049, "status": "ok"}
{"N": 262144, "K": 1024, "D": 64, "B": 32, "dtype": "fp16", "BLOCK_N": 64, "BLOCK_K": 64, "num_warps": 8, "num_stages": 2, "time_ms": 7.361504077911377, "status": "ok"}
{"N": 262144, "K": 1024, "D": 64, "B": 32, "dtype": "fp16", "BLOCK_N": 64, "BLOCK_K": 64, "num_warps": 8, "num_stages": 4, "time_ms": 7.315392017364502, "status": "ok"}
{"N": 262144, "K": 1024, "D": 64, "B": 32, "dtype": "fp16", "BLOCK_N": 64, "BLOCK_K": 128, "num_warps": 4, "num_stages": 1, "time_ms": 4.744703769683838, "status": "ok"}
{"N": 262144, "K": 1024, "D": 64, "B": 32, "dtype": "fp16", "BLOCK_N": 64, "BLOCK_K": 128, "num_warps": 4, "num_stages": 2, "time_ms": 4.735775947570801, "status": "ok"}
{"N": 262144, "K": 1024, "D": 64, "B": 32, "dtype": "fp16", "BLOCK_N": 64, "BLOCK_K": 128, "num_warps": 4, "num_stages": 4, "time_ms": 4.863423824310303, "status": "ok"}
{"N": 262144, "K": 1024, "D": 64, "B": 32, "dtype": "fp16", "BLOCK_N": 64, "BLOCK_K": 128, "num_warps": 8, "num_stages": 1, "time_ms": 7.366432189941406, "status": "ok"}
{"N": 262144, "K": 1024, "D": 64, "B": 32, "dtype": "fp16", "BLOCK_N": 64, "BLOCK_K": 128, "num_warps": 8, "num_stages": 2, "time_ms": 7.000160217285156, "status": "ok"}
{"N": 262144, "K": 1024, "D": 64, "B": 32, "dtype": "fp16", "BLOCK_N": 64, "BLOCK_K": 128, "num_warps": 8, "num_stages": 4, "time_ms": 6.871744155883789, "status": "ok"}
{"N": 262144, "K": 1024, "D": 64, "B": 32, "dtype": "fp16", "BLOCK_N": 128, "BLOCK_K": 32, "num_warps": 4, "num_stages": 1, "time_ms": 5.20582389831543, "status": "ok"}
{"N": 262144, "K": 1024, "D": 64, "B": 32, "dtype": "fp16", "BLOCK_N": 128, "BLOCK_K": 32, "num_warps": 4, "num_stages": 2, "time_ms": 5.132319927215576, "status": "ok"}
{"N": 262144, "K": 1024, "D": 64, "B": 32, "dtype": "fp16", "BLOCK_N": 128, "BLOCK_K": 32, "num_warps": 4, "num_stages": 4, "time_ms": 5.141312122344971, "status": "ok"}
{"N": 262144, "K": 1024, "D": 64, "B": 32, "dtype": "fp16", "BLOCK_N": 128, "BLOCK_K": 32, "num_warps": 8, "num_stages": 1, "time_ms": 5.448160171508789, "status": "ok"}
{"N": 262144, "K": 1024, "D": 64, "B": 32, "dtype": "fp16", "BLOCK_N": 128, "BLOCK_K": 32, "num_warps": 8, "num_stages": 2, "time_ms": 5.714591979980469, "status": "ok"}
{"N": 262144, "K": 1024, "D": 64, "B": 32, "dtype": "fp16", "BLOCK_N": 128, "BLOCK_K": 32, "num_warps": 8, "num_stages": 4, "time_ms": 5.590784072875977, "status": "ok"}
{"N": 262144, "K": 1024, "D": 64, "B": 32, "dtype": "fp16", "BLOCK_N": 128, "BLOCK_K": 64, "num_warps": 4, "num_stages": 1, "time_ms": 4.990880012512207, "status": "ok"}
{"N": 262144, "K": 1024, "D": 64, "B": 32, "dtype": "fp16", "BLOCK_N": 128, "BLOCK_K": 64, "num_warps": 4, "num_stages": 2, "time_ms": 4.585440158843994, "status": "ok"}
{"N": 262144, "K": 1024, "D": 64, "B": 32, "dtype": "fp16", "BLOCK_N": 128, "BLOCK_K": 64, "num_warps": 4, "num_stages": 4, "time_ms": 4.723999977111816, "status": "ok"}
{"N": 262144, "K": 1024, "D": 64, "B": 32, "dtype": "fp16", "BLOCK_N": 128, "BLOCK_K": 64, "num_warps": 8, "num_stages": 1, "time_ms": 5.178207874298096, "status": "ok"}
{"N": 262144, "K": 1024, "D": 64, "B": 32, "dtype": "fp16", "BLOCK_N": 128, "BLOCK_K": 64, "num_warps": 8, "num_stages": 2, "time_ms": 5.045119762420654, "status": "ok"}
{"N": 262144, "K": 1024, "D": 64, "B": 32, "dtype": "fp16", "BLOCK_N": 128, "BLOCK_K": 64, "num_warps": 8, "num_stages": 4, "time_ms": 5.073567867279053, "status": "ok"}
{"N": 262144, "K": 1024, "D": 64, "B": 32, "dtype": "fp16", "BLOCK_N": 128, "BLOCK_K": 128, "num_warps": 4, "num_stages": 1, "time_ms": 5.368063926696777, "status": "ok"}
{"N": 262144, "K": 1024, "D": 64, "B": 32, "dtype": "fp16", "BLOCK_N": 128, "BLOCK_K": 128, "num_warps": 4, "num_stages": 2, "time_ms": 5.056064128875732, "status": "ok"}
{"N": 262144, "K": 1024, "D": 64, "B": 32, "dtype": "fp16", "BLOCK_N": 128, "BLOCK_K": 128, "num_warps": 4, "num_stages": 4, "time_ms": 4.68720006942749, "status": "ok"}
{"N": 262144, "K": 1024, "D": 64, "B": 32, "dtype": "fp16", "BLOCK_N": 128, "BLOCK_K": 128, "num_warps": 8, "num_stages": 1, "time_ms": 7.166272163391113, "status": "ok"}
{"N": 262144, "K": 1024, "D": 64, "B": 32, "dtype": "fp16", "BLOCK_N": 128, "BLOCK_K": 128, "num_warps": 8, "num_stages": 2, "time_ms": 4.93120002746582, "status": "ok"}
{"N": 262144, "K": 1024, "D": 64, "B": 32, "dtype": "fp16", "BLOCK_N": 128, "BLOCK_K": 128, "num_warps": 8, "num_stages": 4, "time_ms": 4.8158721923828125, "status": "ok"}
{"summary": true, "N": 262144, "K": 1024, "D": 64, "B": 32, "dtype": "fp16", "best": {"N": 262144, "K": 1024, "D": 64, "B": 32, "dtype": "fp16", "BLOCK_N": 128, "BLOCK_K": 64, "num_warps": 4, "num_stages": 2, "time_ms": 4.585440158843994, "status": "ok"}, "best_time_ms": 4.585440158843994, "tuning_seconds": 15.43842601776123, "skipped": 0}
