grid_results_h100/N262144_K1024_D128_B32_fp16.jsonl
{"N": 262144, "K": 1024, "D": 128, "B": 32, "dtype": "fp16", "BLOCK_N": 32, "BLOCK_K": 32, "num_warps": 4, "num_stages": 1, "time_ms": 20.18764877319336, "status": "ok"}
{"N": 262144, "K": 1024, "D": 128, "B": 32, "dtype": "fp16", "BLOCK_N": 32, "BLOCK_K": 32, "num_warps": 4, "num_stages": 2, "time_ms": 16.656320571899414, "status": "ok"}
{"N": 262144, "K": 1024, "D": 128, "B": 32, "dtype": "fp16", "BLOCK_N": 32, "BLOCK_K": 32, "num_warps": 4, "num_stages": 4, "time_ms": 16.551488876342773, "status": "ok"}
{"N": 262144, "K": 1024, "D": 128, "B": 32, "dtype": "fp16", "BLOCK_N": 32, "BLOCK_K": 32, "num_warps": 8, "num_stages": 1, "time_ms": 29.428543090820312, "status": "ok"}
{"N": 262144, "K": 1024, "D": 128, "B": 32, "dtype": "fp16", "BLOCK_N": 32, "BLOCK_K": 32, "num_warps": 8, "num_stages": 2, "time_ms": 26.914335250854492, "status": "ok"}
{"N": 262144, "K": 1024, "D": 128, "B": 32, "dtype": "fp16", "BLOCK_N": 32, "BLOCK_K": 32, "num_warps": 8, "num_stages": 4, "time_ms": 26.733888626098633, "status": "ok"}
{"N": 262144, "K": 1024, "D": 128, "B": 32, "dtype": "fp16", "BLOCK_N": 32, "BLOCK_K": 64, "num_warps": 4, "num_stages": 1, "time_ms": 17.134624481201172, "status": "ok"}
{"N": 262144, "K": 1024, "D": 128, "B": 32, "dtype": "fp16", "BLOCK_N": 32, "BLOCK_K": 64, "num_warps": 4, "num_stages": 2, "time_ms": 13.71951961517334, "status": "ok"}
{"N": 262144, "K": 1024, "D": 128, "B": 32, "dtype": "fp16", "BLOCK_N": 32, "BLOCK_K": 64, "num_warps": 4, "num_stages": 4, "time_ms": 15.14345645904541, "status": "ok"}
{"N": 262144, "K": 1024, "D": 128, "B": 32, "dtype": "fp16", "BLOCK_N": 32, "BLOCK_K": 64, "num_warps": 8, "num_stages": 1, "time_ms": 20.817312240600586, "status": "ok"}
{"N": 262144, "K": 1024, "D": 128, "B": 32, "dtype": "fp16", "BLOCK_N": 32, "BLOCK_K": 64, "num_warps": 8, "num_stages": 2, "time_ms": 17.709535598754883, "status": "ok"}
{"N": 262144, "K": 1024, "D": 128, "B": 32, "dtype": "fp16", "BLOCK_N": 32, "BLOCK_K": 64, "num_warps": 8, "num_stages": 4, "time_ms": 18.29756736755371, "status": "ok"}
{"N": 262144, "K": 1024, "D": 128, "B": 32, "dtype": "fp16", "BLOCK_N": 32, "BLOCK_K": 128, "num_warps": 4, "num_stages": 1, "time_ms": 13.861760139465332, "status": "ok"}
{"N": 262144, "K": 1024, "D": 128, "B": 32, "dtype": "fp16", "BLOCK_N": 32, "BLOCK_K": 128, "num_warps": 4, "num_stages": 2, "time_ms": 10.955391883850098, "status": "ok"}
{"N": 262144, "K": 1024, "D": 128, "B": 32, "dtype": "fp16", "BLOCK_N": 32, "BLOCK_K": 128, "num_warps": 4, "num_stages": 4, "time_ms": 14.41209602355957, "status": "ok"}
{"N": 262144, "K": 1024, "D": 128, "B": 32, "dtype": "fp16", "BLOCK_N": 32, "BLOCK_K": 128, "num_warps": 8, "num_stages": 1, "time_ms": 18.749408721923828, "status": "ok"}
{"N": 262144, "K": 1024, "D": 128, "B": 32, "dtype": "fp16", "BLOCK_N": 32, "BLOCK_K": 128, "num_warps": 8, "num_stages": 2, "time_ms": 16.63929557800293, "status": "ok"}
{"N": 262144, "K": 1024, "D": 128, "B": 32, "dtype": "fp16", "BLOCK_N": 32, "BLOCK_K": 128, "num_warps": 8, "num_stages": 4, "time_ms": 17.456640243530273, "status": "ok"}
{"N": 262144, "K": 1024, "D": 128, "B": 32, "dtype": "fp16", "BLOCK_N": 64, "BLOCK_K": 32, "num_warps": 4, "num_stages": 1, "time_ms": 8.325440406799316, "status": "ok"}
{"N": 262144, "K": 1024, "D": 128, "B": 32, "dtype": "fp16", "BLOCK_N": 64, "BLOCK_K": 32, "num_warps": 4, "num_stages": 2, "time_ms": 6.882336139678955, "status": "ok"}
{"N": 262144, "K": 1024, "D": 128, "B": 32, "dtype": "fp16", "BLOCK_N": 64, "BLOCK_K": 32, "num_warps": 4, "num_stages": 4, "time_ms": 7.296512126922607, "status": "ok"}
{"N": 262144, "K": 1024, "D": 128, "B": 32, "dtype": "fp16", "BLOCK_N": 64, "BLOCK_K": 32, "num_warps": 8, "num_stages": 1, "time_ms": 14.835424423217773, "status": "ok"}
{"N": 262144, "K": 1024, "D": 128, "B": 32, "dtype": "fp16", "BLOCK_N": 64, "BLOCK_K": 32, "num_warps": 8, "num_stages": 2, "time_ms": 12.940223693847656, "status": "ok"}
{"N": 262144, "K": 1024, "D": 128, "B": 32, "dtype": "fp16", "BLOCK_N": 64, "BLOCK_K": 32, "num_warps": 8, "num_stages": 4, "time_ms": 13.177248001098633, "status": "ok"}
{"N": 262144, "K": 1024, "D": 128, "B": 32, "dtype": "fp16", "BLOCK_N": 64, "BLOCK_K": 64, "num_warps": 4, "num_stages": 1, "time_ms": 6.740384101867676, "status": "ok"}
{"N": 262144, "K": 1024, "D": 128, "B": 32, "dtype": "fp16", "BLOCK_N": 64, "BLOCK_K": 64, "num_warps": 4, "num_stages": 2, "time_ms": 5.996799945831299, "status": "ok"}
{"N": 262144, "K": 1024, "D": 128, "B": 32, "dtype": "fp16", "BLOCK_N": 64, "BLOCK_K": 64, "num_warps": 4, "num_stages": 4, "time_ms": 6.771647930145264, "status": "ok"}
{"N": 262144, "K": 1024, "D": 128, "B": 32, "dtype": "fp16", "BLOCK_N": 64, "BLOCK_K": 64, "num_warps": 8, "num_stages": 1, "time_ms": 10.494208335876465, "status": "ok"}
{"N": 262144, "K": 1024, "D": 128, "B": 32, "dtype": "fp16", "BLOCK_N": 64, "BLOCK_K": 64, "num_warps": 8, "num_stages": 2, "time_ms": 9.145695686340332, "status": "ok"}
{"N": 262144, "K": 1024, "D": 128, "B": 32, "dtype": "fp16", "BLOCK_N": 64, "BLOCK_K": 64, "num_warps": 8, "num_stages": 4, "time_ms": 10.566720008850098, "status": "ok"}
{"N": 262144, "K": 1024, "D": 128, "B": 32, "dtype": "fp16", "BLOCK_N": 64, "BLOCK_K": 128, "num_warps": 4, "num_stages": 1, "time_ms": 6.219871997833252, "status": "ok"}
{"N": 262144, "K": 1024, "D": 128, "B": 32, "dtype": "fp16", "BLOCK_N": 64, "BLOCK_K": 128, "num_warps": 4, "num_stages": 2, "time_ms": 6.900415897369385, "status": "ok"}
{"N": 262144, "K": 1024, "D": 128, "B": 32, "dtype": "fp16", "BLOCK_N": 64, "BLOCK_K": 128, "num_warps": 4, "num_stages": 4, "time_ms": 9.117216110229492, "status": "ok"}
{"N": 262144, "K": 1024, "D": 128, "B": 32, "dtype": "fp16", "BLOCK_N": 64, "BLOCK_K": 128, "num_warps": 8, "num_stages": 1, "time_ms": 9.815135955810547, "status": "ok"}
{"N": 262144, "K": 1024, "D": 128, "B": 32, "dtype": "fp16", "BLOCK_N": 64, "BLOCK_K": 128, "num_warps": 8, "num_stages": 2, "time_ms": 8.708064079284668, "status": "ok"}
{"N": 262144, "K": 1024, "D": 128, "B": 32, "dtype": "fp16", "BLOCK_N": 64, "BLOCK_K": 128, "num_warps": 8, "num_stages": 4, "time_ms": 10.787039756774902, "status": "ok"}
{"N": 262144, "K": 1024, "D": 128, "B": 32, "dtype": "fp16", "BLOCK_N": 128, "BLOCK_K": 32, "num_warps": 4, "num_stages": 1, "time_ms": 7.084671974182129, "status": "ok"}
{"N": 262144, "K": 1024, "D": 128, "B": 32, "dtype": "fp16", "BLOCK_N": 128, "BLOCK_K": 32, "num_warps": 4, "num_stages": 2, "time_ms": 7.183135986328125, "status": "ok"}
{"N": 262144, "K": 1024, "D": 128, "B": 32, "dtype": "fp16", "BLOCK_N": 128, "BLOCK_K": 32, "num_warps": 4, "num_stages": 4, "time_ms": 7.383456230163574, "status": "ok"}
{"N": 262144, "K": 1024, "D": 128, "B": 32, "dtype": "fp16", "BLOCK_N": 128, "BLOCK_K": 32, "num_warps": 8, "num_stages": 1, "time_ms": 7.247615814208984, "status": "ok"}
{"N": 262144, "K": 1024, "D": 128, "B": 32, "dtype": "fp16", "BLOCK_N": 128, "BLOCK_K": 32, "num_warps": 8, "num_stages": 2, "time_ms": 7.035200119018555, "status": "ok"}
{"N": 262144, "K": 1024, "D": 128, "B": 32, "dtype": "fp16", "BLOCK_N": 128, "BLOCK_K": 32, "num_warps": 8, "num_stages": 4, "time_ms": 7.254271984100342, "status": "ok"}
{"N": 262144, "K": 1024, "D": 128, "B": 32, "dtype": "fp16", "BLOCK_N": 128, "BLOCK_K": 64, "num_warps": 4, "num_stages": 1, "time_ms": 6.053855895996094, "status": "ok"}
{"N": 262144, "K": 1024, "D": 128, "B": 32, "dtype": "fp16", "BLOCK_N": 128, "BLOCK_K": 64, "num_warps": 4, "num_stages": 2, "time_ms": 6.20963191986084, "status": "ok"}
{"N": 262144, "K": 1024, "D": 128, "B": 32, "dtype": "fp16", "BLOCK_N": 128, "BLOCK_K": 64, "num_warps": 4, "num_stages": 4, "time_ms": 6.252223968505859, "status": "ok"}
{"N": 262144, "K": 1024, "D": 128, "B": 32, "dtype": "fp16", "BLOCK_N": 128, "BLOCK_K": 64, "num_warps": 8, "num_stages": 1, "time_ms": 6.4231038093566895, "status": "ok"}
{"N": 262144, "K": 1024, "D": 128, "B": 32, "dtype": "fp16", "BLOCK_N": 128, "BLOCK_K": 64, "num_warps": 8, "num_stages": 2, "time_ms": 6.333216190338135, "status": "ok"}
{"N": 262144, "K": 1024, "D": 128, "B": 32, "dtype": "fp16", "BLOCK_N": 128, "BLOCK_K": 64, "num_warps": 8, "num_stages": 4, "time_ms": 6.430751800537109, "status": "ok"}
{"N": 262144, "K": 1024, "D": 128, "B": 32, "dtype": "fp16", "BLOCK_N": 128, "BLOCK_K": 128, "num_warps": 4, "num_stages": 1, "time_ms": 6.367775917053223, "status": "ok"}
{"N": 262144, "K": 1024, "D": 128, "B": 32, "dtype": "fp16", "BLOCK_N": 128, "BLOCK_K": 128, "num_warps": 4, "num_stages": 2, "time_ms": 6.14569616317749, "status": "ok"}
{"N": 262144, "K": 1024, "D": 128, "B": 32, "dtype": "fp16", "BLOCK_N": 128, "BLOCK_K": 128, "num_warps": 4, "num_stages": 4, "time_ms": 7.801695823669434, "status": "ok"}
{"N": 262144, "K": 1024, "D": 128, "B": 32, "dtype": "fp16", "BLOCK_N": 128, "BLOCK_K": 128, "num_warps": 8, "num_stages": 1, "time_ms": 9.320128440856934, "status": "ok"}
{"N": 262144, "K": 1024, "D": 128, "B": 32, "dtype": "fp16", "BLOCK_N": 128, "BLOCK_K": 128, "num_warps": 8, "num_stages": 2, "time_ms": 6.1671037673950195, "status": "ok"}
{"N": 262144, "K": 1024, "D": 128, "B": 32, "dtype": "fp16", "BLOCK_N": 128, "BLOCK_K": 128, "num_warps": 8, "num_stages": 4, "time_ms": 7.35536003112793, "status": "ok"}
{"summary": true, "N": 262144, "K": 1024, "D": 128, "B": 32, "dtype": "fp16", "best": {"N": 262144, "K": 1024, "D": 128, "B": 32, "dtype": "fp16", "BLOCK_N": 64, "BLOCK_K": 64, "num_warps": 4, "num_stages": 2, "time_ms": 5.996799945831299, "status": "ok"}, "best_time_ms": 5.996799945831299, "tuning_seconds": 18.883716344833374, "skipped": 0}
