grid_results_h100/N262144_K200000_D64_B32_fp16.jsonl
{"N": 262144, "K": 200000, "D": 64, "B": 32, "dtype": "fp16", "BLOCK_N": 32, "BLOCK_K": 32, "num_warps": 4, "num_stages": 1, "time_ms": 2545.724609375, "status": "ok"}
{"N": 262144, "K": 200000, "D": 64, "B": 32, "dtype": "fp16", "BLOCK_N": 32, "BLOCK_K": 32, "num_warps": 4, "num_stages": 2, "time_ms": 2254.119140625, "status": "ok"}
{"N": 262144, "K": 200000, "D": 64, "B": 32, "dtype": "fp16", "BLOCK_N": 32, "BLOCK_K": 32, "num_warps": 4, "num_stages": 4, "time_ms": 2244.580810546875, "status": "ok"}
{"N": 262144, "K": 200000, "D": 64, "B": 32, "dtype": "fp16", "BLOCK_N": 32, "BLOCK_K": 32, "num_warps": 8, "num_stages": 1, "time_ms": 4116.95947265625, "status": "ok"}
{"N": 262144, "K": 200000, "D": 64, "B": 32, "dtype": "fp16", "BLOCK_N": 32, "BLOCK_K": 32, "num_warps": 8, "num_stages": 2, "time_ms": 3884.896240234375, "status": "ok"}
{"N": 262144, "K": 200000, "D": 64, "B": 32, "dtype": "fp16", "BLOCK_N": 32, "BLOCK_K": 32, "num_warps": 8, "num_stages": 4, "time_ms": 3793.836181640625, "status": "ok"}
{"N": 262144, "K": 200000, "D": 64, "B": 32, "dtype": "fp16", "BLOCK_N": 32, "BLOCK_K": 64, "num_warps": 4, "num_stages": 1, "time_ms": 2184.519287109375, "status": "ok"}
{"N": 262144, "K": 200000, "D": 64, "B": 32, "dtype": "fp16", "BLOCK_N": 32, "BLOCK_K": 64, "num_warps": 4, "num_stages": 2, "time_ms": 1925.102294921875, "status": "ok"}
{"N": 262144, "K": 200000, "D": 64, "B": 32, "dtype": "fp16", "BLOCK_N": 32, "BLOCK_K": 64, "num_warps": 4, "num_stages": 4, "time_ms": 1841.470703125, "status": "ok"}
{"N": 262144, "K": 200000, "D": 64, "B": 32, "dtype": "fp16", "BLOCK_N": 32, "BLOCK_K": 64, "num_warps": 8, "num_stages": 1, "time_ms": 2649.2255859375, "status": "ok"}
{"N": 262144, "K": 200000, "D": 64, "B": 32, "dtype": "fp16", "BLOCK_N": 32, "BLOCK_K": 64, "num_warps": 8, "num_stages": 2, "time_ms": 2478.193115234375, "status": "ok"}
{"N": 262144, "K": 200000, "D": 64, "B": 32, "dtype": "fp16", "BLOCK_N": 32, "BLOCK_K": 64, "num_warps": 8, "num_stages": 4, "time_ms": 2402.233642578125, "status": "ok"}
{"N": 262144, "K": 200000, "D": 64, "B": 32, "dtype": "fp16", "BLOCK_N": 32, "BLOCK_K": 128, "num_warps": 4, "num_stages": 1, "time_ms": 1767.9481201171875, "status": "ok"}
{"N": 262144, "K": 200000, "D": 64, "B": 32, "dtype": "fp16", "BLOCK_N": 32, "BLOCK_K": 128, "num_warps": 4, "num_stages": 2, "time_ms": 1593.7413330078125, "status": "ok"}
{"N": 262144, "K": 200000, "D": 64, "B": 32, "dtype": "fp16", "BLOCK_N": 32, "BLOCK_K": 128, "num_warps": 4, "num_stages": 4, "time_ms": 1588.3077392578125, "status": "ok"}
{"N": 262144, "K": 200000, "D": 64, "B": 32, "dtype": "fp16", "BLOCK_N": 32, "BLOCK_K": 128, "num_warps": 8, "num_stages": 1, "time_ms": 2878.63720703125, "status": "ok"}
{"N": 262144, "K": 200000, "D": 64, "B": 32, "dtype": "fp16", "BLOCK_N": 32, "BLOCK_K": 128, "num_warps": 8, "num_stages": 2, "time_ms": 2304.85546875, "status": "ok"}
{"N": 262144, "K": 200000, "D": 64, "B": 32, "dtype": "fp16", "BLOCK_N": 32, "BLOCK_K": 128, "num_warps": 8, "num_stages": 4, "time_ms": 2239.0634765625, "status": "ok"}
{"N": 262144, "K": 200000, "D": 64, "B": 32, "dtype": "fp16", "BLOCK_N": 64, "BLOCK_K": 32, "num_warps": 4, "num_stages": 1, "time_ms": 1061.3692626953125, "status": "ok"}
{"N": 262144, "K": 200000, "D": 64, "B": 32, "dtype": "fp16", "BLOCK_N": 64, "BLOCK_K": 32, "num_warps": 4, "num_stages": 2, "time_ms": 1038.8443603515625, "status": "ok"}
{"N": 262144, "K": 200000, "D": 64, "B": 32, "dtype": "fp16", "BLOCK_N": 64, "BLOCK_K": 32, "num_warps": 4, "num_stages": 4, "time_ms": 1038.777587890625, "status": "ok"}
{"N": 262144, "K": 200000, "D": 64, "B": 32, "dtype": "fp16", "BLOCK_N": 64, "BLOCK_K": 32, "num_warps": 8, "num_stages": 1, "time_ms": 2052.0830078125, "status": "ok"}
{"N": 262144, "K": 200000, "D": 64, "B": 32, "dtype": "fp16", "BLOCK_N": 64, "BLOCK_K": 32, "num_warps": 8, "num_stages": 2, "time_ms": 1937.7628173828125, "status": "ok"}
{"N": 262144, "K": 200000, "D": 64, "B": 32, "dtype": "fp16", "BLOCK_N": 64, "BLOCK_K": 32, "num_warps": 8, "num_stages": 4, "time_ms": 1889.2030029296875, "status": "ok"}
{"N": 262144, "K": 200000, "D": 64, "B": 32, "dtype": "fp16", "BLOCK_N": 64, "BLOCK_K": 64, "num_warps": 4, "num_stages": 1, "time_ms": 1001.6133422851562, "status": "ok"}
{"N": 262144, "K": 200000, "D": 64, "B": 32, "dtype": "fp16", "BLOCK_N": 64, "BLOCK_K": 64, "num_warps": 4, "num_stages": 2, "time_ms": 942.4700927734375, "status": "ok"}
{"N": 262144, "K": 200000, "D": 64, "B": 32, "dtype": "fp16", "BLOCK_N": 64, "BLOCK_K": 64, "num_warps": 4, "num_stages": 4, "time_ms": 944.8298950195312, "status": "ok"}
{"N": 262144, "K": 200000, "D": 64, "B": 32, "dtype": "fp16", "BLOCK_N": 64, "BLOCK_K": 64, "num_warps": 8, "num_stages": 1, "time_ms": 1467.6505126953125, "status": "ok"}
{"N": 262144, "K": 200000, "D": 64, "B": 32, "dtype": "fp16", "BLOCK_N": 64, "BLOCK_K": 64, "num_warps": 8, "num_stages": 2, "time_ms": 1400.0091552734375, "status": "ok"}
{"N": 262144, "K": 200000, "D": 64, "B": 32, "dtype": "fp16", "BLOCK_N": 64, "BLOCK_K": 64, "num_warps": 8, "num_stages": 4, "time_ms": 1377.3104248046875, "status": "ok"}
{"N": 262144, "K": 200000, "D": 64, "B": 32, "dtype": "fp16", "BLOCK_N": 64, "BLOCK_K": 128, "num_warps": 4, "num_stages": 1, "time_ms": 1057.441162109375, "status": "ok"}
{"N": 262144, "K": 200000, "D": 64, "B": 32, "dtype": "fp16", "BLOCK_N": 64, "BLOCK_K": 128, "num_warps": 4, "num_stages": 2, "time_ms": 980.5166015625, "status": "ok"}
{"N": 262144, "K": 200000, "D": 64, "B": 32, "dtype": "fp16", "BLOCK_N": 64, "BLOCK_K": 128, "num_warps": 4, "num_stages": 4, "time_ms": 970.17626953125, "status": "ok"}
{"N": 262144, "K": 200000, "D": 64, "B": 32, "dtype": "fp16", "BLOCK_N": 64, "BLOCK_K": 128, "num_warps": 8, "num_stages": 1, "time_ms": 1619.730712890625, "status": "ok"}
{"N": 262144, "K": 200000, "D": 64, "B": 32, "dtype": "fp16", "BLOCK_N": 64, "BLOCK_K": 128, "num_warps": 8, "num_stages": 2, "time_ms": 1458.5048828125, "status": "ok"}
{"N": 262144, "K": 200000, "D": 64, "B": 32, "dtype": "fp16", "BLOCK_N": 64, "BLOCK_K": 128, "num_warps": 8, "num_stages": 4, "time_ms": 1410.812744140625, "status": "ok"}
{"N": 262144, "K": 200000, "D": 64, "B": 32, "dtype": "fp16", "BLOCK_N": 128, "BLOCK_K": 32, "num_warps": 4, "num_stages": 1, "time_ms": 1006.3057861328125, "status": "ok"}
{"N": 262144, "K": 200000, "D": 64, "B": 32, "dtype": "fp16", "BLOCK_N": 128, "BLOCK_K": 32, "num_warps": 4, "num_stages": 2, "time_ms": 986.7073364257812, "status": "ok"}
{"N": 262144, "K": 200000, "D": 64, "B": 32, "dtype": "fp16", "BLOCK_N": 128, "BLOCK_K": 32, "num_warps": 4, "num_stages": 4, "time_ms": 990.0859985351562, "status": "ok"}
{"N": 262144, "K": 200000, "D": 64, "B": 32, "dtype": "fp16", "BLOCK_N": 128, "BLOCK_K": 32, "num_warps": 8, "num_stages": 1, "time_ms": 1057.635498046875, "status": "ok"}
{"N": 262144, "K": 200000, "D": 64, "B": 32, "dtype": "fp16", "BLOCK_N": 128, "BLOCK_K": 32, "num_warps": 8, "num_stages": 2, "time_ms": 1111.486083984375, "status": "ok"}
{"N": 262144, "K": 200000, "D": 64, "B": 32, "dtype": "fp16", "BLOCK_N": 128, "BLOCK_K": 32, "num_warps": 8, "num_stages": 4, "time_ms": 1083.39892578125, "status": "ok"}
{"N": 262144, "K": 200000, "D": 64, "B": 32, "dtype": "fp16", "BLOCK_N": 128, "BLOCK_K": 64, "num_warps": 4, "num_stages": 1, "time_ms": 955.6090698242188, "status": "ok"}
{"N": 262144, "K": 200000, "D": 64, "B": 32, "dtype": "fp16", "BLOCK_N": 128, "BLOCK_K": 64, "num_warps": 4, "num_stages": 2, "time_ms": 896.4488525390625, "status": "ok"}
{"N": 262144, "K": 200000, "D": 64, "B": 32, "dtype": "fp16", "BLOCK_N": 128, "BLOCK_K": 64, "num_warps": 4, "num_stages": 4, "time_ms": 888.9171752929688, "status": "ok"}
{"N": 262144, "K": 200000, "D": 64, "B": 32, "dtype": "fp16", "BLOCK_N": 128, "BLOCK_K": 64, "num_warps": 8, "num_stages": 1, "time_ms": 1010.7117919921875, "status": "ok"}
{"N": 262144, "K": 200000, "D": 64, "B": 32, "dtype": "fp16", "BLOCK_N": 128, "BLOCK_K": 64, "num_warps": 8, "num_stages": 2, "time_ms": 985.8457641601562, "status": "ok"}
{"N": 262144, "K": 200000, "D": 64, "B": 32, "dtype": "fp16", "BLOCK_N": 128, "BLOCK_K": 64, "num_warps": 8, "num_stages": 4, "time_ms": 935.8165893554688, "status": "ok"}
{"N": 262144, "K": 200000, "D": 64, "B": 32, "dtype": "fp16", "BLOCK_N": 128, "BLOCK_K": 128, "num_warps": 4, "num_stages": 1, "time_ms": 1038.072998046875, "status": "ok"}
{"N": 262144, "K": 200000, "D": 64, "B": 32, "dtype": "fp16", "BLOCK_N": 128, "BLOCK_K": 128, "num_warps": 4, "num_stages": 2, "time_ms": 1015.45751953125, "status": "ok"}
{"N": 262144, "K": 200000, "D": 64, "B": 32, "dtype": "fp16", "BLOCK_N": 128, "BLOCK_K": 128, "num_warps": 4, "num_stages": 4, "time_ms": 945.849609375, "status": "ok"}
{"N": 262144, "K": 200000, "D": 64, "B": 32, "dtype": "fp16", "BLOCK_N": 128, "BLOCK_K": 128, "num_warps": 8, "num_stages": 1, "time_ms": 1622.40283203125, "status": "ok"}
{"N": 262144, "K": 200000, "D": 64, "B": 32, "dtype": "fp16", "BLOCK_N": 128, "BLOCK_K": 128, "num_warps": 8, "num_stages": 2, "time_ms": 1602.38720703125, "status": "ok"}
{"N": 262144, "K": 200000, "D": 64, "B": 32, "dtype": "fp16", "BLOCK_N": 128, "BLOCK_K": 128, "num_warps": 8, "num_stages": 4, "time_ms": 1293.8076171875, "status": "ok"}
{"summary": true, "N": 262144, "K": 200000, "D": 64, "B": 32, "dtype": "fp16", "best": {"N": 262144, "K": 200000, "D": 64, "B": 32, "dtype": "fp16", "BLOCK_N": 128, "BLOCK_K": 64, "num_warps": 4, "num_stages": 4, "time_ms": 888.9171752929688, "status": "ok"}, "best_time_ms": 888.9171752929688, "tuning_seconds": 714.7522337436676, "skipped": 0}
