grid_results_h100/N262144_K4096_D128_B1_fp16.jsonl
{"N": 262144, "K": 4096, "D": 128, "B": 1, "dtype": "fp16", "BLOCK_N": 32, "BLOCK_K": 32, "num_warps": 4, "num_stages": 1, "time_ms": 2.6107840538024902, "status": "ok"}
{"N": 262144, "K": 4096, "D": 128, "B": 1, "dtype": "fp16", "BLOCK_N": 32, "BLOCK_K": 32, "num_warps": 4, "num_stages": 2, "time_ms": 2.1372640132904053, "status": "ok"}
{"N": 262144, "K": 4096, "D": 128, "B": 1, "dtype": "fp16", "BLOCK_N": 32, "BLOCK_K": 32, "num_warps": 4, "num_stages": 4, "time_ms": 2.1484960317611694, "status": "ok"}
{"N": 262144, "K": 4096, "D": 128, "B": 1, "dtype": "fp16", "BLOCK_N": 32, "BLOCK_K": 32, "num_warps": 8, "num_stages": 1, "time_ms": 3.884704113006592, "status": "ok"}
{"N": 262144, "K": 4096, "D": 128, "B": 1, "dtype": "fp16", "BLOCK_N": 32, "BLOCK_K": 32, "num_warps": 8, "num_stages": 2, "time_ms": 3.507456064224243, "status": "ok"}
{"N": 262144, "K": 4096, "D": 128, "B": 1, "dtype": "fp16", "BLOCK_N": 32, "BLOCK_K": 32, "num_warps": 8, "num_stages": 4, "time_ms": 3.450752019882202, "status": "ok"}
{"N": 262144, "K": 4096, "D": 128, "B": 1, "dtype": "fp16", "BLOCK_N": 32, "BLOCK_K": 64, "num_warps": 4, "num_stages": 1, "time_ms": 2.2175999879837036, "status": "ok"}
{"N": 262144, "K": 4096, "D": 128, "B": 1, "dtype": "fp16", "BLOCK_N": 32, "BLOCK_K": 64, "num_warps": 4, "num_stages": 2, "time_ms": 1.7530239820480347, "status": "ok"}
{"N": 262144, "K": 4096, "D": 128, "B": 1, "dtype": "fp16", "BLOCK_N": 32, "BLOCK_K": 64, "num_warps": 4, "num_stages": 4, "time_ms": 1.8697919845581055, "status": "ok"}
{"N": 262144, "K": 4096, "D": 128, "B": 1, "dtype": "fp16", "BLOCK_N": 32, "BLOCK_K": 64, "num_warps": 8, "num_stages": 1, "time_ms": 2.7397758960723877, "status": "ok"}
{"N": 262144, "K": 4096, "D": 128, "B": 1, "dtype": "fp16", "BLOCK_N": 32, "BLOCK_K": 64, "num_warps": 8, "num_stages": 2, "time_ms": 2.2731200456619263, "status": "ok"}
{"N": 262144, "K": 4096, "D": 128, "B": 1, "dtype": "fp16", "BLOCK_N": 32, "BLOCK_K": 64, "num_warps": 8, "num_stages": 4, "time_ms": 2.264591932296753, "status": "ok"}
{"N": 262144, "K": 4096, "D": 128, "B": 1, "dtype": "fp16", "BLOCK_N": 32, "BLOCK_K": 128, "num_warps": 4, "num_stages": 1, "time_ms": 1.7686399817466736, "status": "ok"}
{"N": 262144, "K": 4096, "D": 128, "B": 1, "dtype": "fp16", "BLOCK_N": 32, "BLOCK_K": 128, "num_warps": 4, "num_stages": 2, "time_ms": 1.3542933464050293, "status": "ok"}
{"N": 262144, "K": 4096, "D": 128, "B": 1, "dtype": "fp16", "BLOCK_N": 32, "BLOCK_K": 128, "num_warps": 4, "num_stages": 4, "time_ms": 1.7747840285301208, "status": "ok"}
{"N": 262144, "K": 4096, "D": 128, "B": 1, "dtype": "fp16", "BLOCK_N": 32, "BLOCK_K": 128, "num_warps": 8, "num_stages": 1, "time_ms": 2.423424005508423, "status": "ok"}
{"N": 262144, "K": 4096, "D": 128, "B": 1, "dtype": "fp16", "BLOCK_N": 32, "BLOCK_K": 128, "num_warps": 8, "num_stages": 2, "time_ms": 2.088479995727539, "status": "ok"}
{"N": 262144, "K": 4096, "D": 128, "B": 1, "dtype": "fp16", "BLOCK_N": 32, "BLOCK_K": 128, "num_warps": 8, "num_stages": 4, "time_ms": 2.114351987838745, "status": "ok"}
{"N": 262144, "K": 4096, "D": 128, "B": 1, "dtype": "fp16", "BLOCK_N": 64, "BLOCK_K": 32, "num_warps": 4, "num_stages": 1, "time_ms": 1.0664159953594208, "status": "ok"}
{"N": 262144, "K": 4096, "D": 128, "B": 1, "dtype": "fp16", "BLOCK_N": 64, "BLOCK_K": 32, "num_warps": 4, "num_stages": 2, "time_ms": 0.9094912052154541, "status": "ok"}
{"N": 262144, "K": 4096, "D": 128, "B": 1, "dtype": "fp16", "BLOCK_N": 64, "BLOCK_K": 32, "num_warps": 4, "num_stages": 4, "time_ms": 0.9235519915819168, "status": "ok"}
{"N": 262144, "K": 4096, "D": 128, "B": 1, "dtype": "fp16", "BLOCK_N": 64, "BLOCK_K": 32, "num_warps": 8, "num_stages": 1, "time_ms": 1.9284160137176514, "status": "ok"}
{"N": 262144, "K": 4096, "D": 128, "B": 1, "dtype": "fp16", "BLOCK_N": 64, "BLOCK_K": 32, "num_warps": 8, "num_stages": 2, "time_ms": 1.6864799857139587, "status": "ok"}
{"N": 262144, "K": 4096, "D": 128, "B": 1, "dtype": "fp16", "BLOCK_N": 64, "BLOCK_K": 32, "num_warps": 8, "num_stages": 4, "time_ms": 1.6945439577102661, "status": "ok"}
{"N": 262144, "K": 4096, "D": 128, "B": 1, "dtype": "fp16", "BLOCK_N": 64, "BLOCK_K": 64, "num_warps": 4, "num_stages": 1, "time_ms": 0.8782335996627808, "status": "ok"}
{"N": 262144, "K": 4096, "D": 128, "B": 1, "dtype": "fp16", "BLOCK_N": 64, "BLOCK_K": 64, "num_warps": 4, "num_stages": 2, "time_ms": 0.7830527901649476, "status": "ok"}
{"N": 262144, "K": 4096, "D": 128, "B": 1, "dtype": "fp16", "BLOCK_N": 64, "BLOCK_K": 64, "num_warps": 4, "num_stages": 4, "time_ms": 0.8202047944068909, "status": "ok"}
{"N": 262144, "K": 4096, "D": 128, "B": 1, "dtype": "fp16", "BLOCK_N": 64, "BLOCK_K": 64, "num_warps": 8, "num_stages": 1, "time_ms": 1.3457600275675456, "status": "ok"}
{"N": 262144, "K": 4096, "D": 128, "B": 1, "dtype": "fp16", "BLOCK_N": 64, "BLOCK_K": 64, "num_warps": 8, "num_stages": 2, "time_ms": 1.1839786370595295, "status": "ok"}
{"N": 262144, "K": 4096, "D": 128, "B": 1, "dtype": "fp16", "BLOCK_N": 64, "BLOCK_K": 64, "num_warps": 8, "num_stages": 4, "time_ms": 1.3330346743265789, "status": "ok"}
{"N": 262144, "K": 4096, "D": 128, "B": 1, "dtype": "fp16", "BLOCK_N": 64, "BLOCK_K": 128, "num_warps": 4, "num_stages": 1, "time_ms": 0.786630392074585, "status": "ok"}
{"N": 262144, "K": 4096, "D": 128, "B": 1, "dtype": "fp16", "BLOCK_N": 64, "BLOCK_K": 128, "num_warps": 4, "num_stages": 2, "time_ms": 0.7940736055374146, "status": "ok"}
{"N": 262144, "K": 4096, "D": 128, "B": 1, "dtype": "fp16", "BLOCK_N": 64, "BLOCK_K": 128, "num_warps": 4, "num_stages": 4, "time_ms": 1.0650720000267029, "status": "ok"}
{"N": 262144, "K": 4096, "D": 128, "B": 1, "dtype": "fp16", "BLOCK_N": 64, "BLOCK_K": 128, "num_warps": 8, "num_stages": 1, "time_ms": 1.268170674641927, "status": "ok"}
{"N": 262144, "K": 4096, "D": 128, "B": 1, "dtype": "fp16", "BLOCK_N": 64, "BLOCK_K": 128, "num_warps": 8, "num_stages": 2, "time_ms": 1.0905199944972992, "status": "ok"}
{"N": 262144, "K": 4096, "D": 128, "B": 1, "dtype": "fp16", "BLOCK_N": 64, "BLOCK_K": 128, "num_warps": 8, "num_stages": 4, "time_ms": 1.276810646057129, "status": "ok"}
{"N": 262144, "K": 4096, "D": 128, "B": 1, "dtype": "fp16", "BLOCK_N": 128, "BLOCK_K": 32, "num_warps": 4, "num_stages": 1, "time_ms": 0.927144005894661, "status": "ok"}
{"N": 262144, "K": 4096, "D": 128, "B": 1, "dtype": "fp16", "BLOCK_N": 128, "BLOCK_K": 32, "num_warps": 4, "num_stages": 2, "time_ms": 0.9454719871282578, "status": "ok"}
{"N": 262144, "K": 4096, "D": 128, "B": 1, "dtype": "fp16", "BLOCK_N": 128, "BLOCK_K": 32, "num_warps": 4, "num_stages": 4, "time_ms": 0.9651679992675781, "status": "ok"}
{"N": 262144, "K": 4096, "D": 128, "B": 1, "dtype": "fp16", "BLOCK_N": 128, "BLOCK_K": 32, "num_warps": 8, "num_stages": 1, "time_ms": 0.9530320018529892, "status": "ok"}
{"N": 262144, "K": 4096, "D": 128, "B": 1, "dtype": "fp16", "BLOCK_N": 128, "BLOCK_K": 32, "num_warps": 8, "num_stages": 2, "time_ms": 0.9364079833030701, "status": "ok"}
{"N": 262144, "K": 4096, "D": 128, "B": 1, "dtype": "fp16", "BLOCK_N": 128, "BLOCK_K": 32, "num_warps": 8, "num_stages": 4, "time_ms": 0.9515919983386993, "status": "ok"}
{"N": 262144, "K": 4096, "D": 128, "B": 1, "dtype": "fp16", "BLOCK_N": 128, "BLOCK_K": 64, "num_warps": 4, "num_stages": 1, "time_ms": 0.801971185207367, "status": "ok"}
{"N": 262144, "K": 4096, "D": 128, "B": 1, "dtype": "fp16", "BLOCK_N": 128, "BLOCK_K": 64, "num_warps": 4, "num_stages": 2, "time_ms": 0.7985023975372314, "status": "ok"}
{"N": 262144, "K": 4096, "D": 128, "B": 1, "dtype": "fp16", "BLOCK_N": 128, "BLOCK_K": 64, "num_warps": 4, "num_stages": 4, "time_ms": 0.794822382926941, "status": "ok"}
{"N": 262144, "K": 4096, "D": 128, "B": 1, "dtype": "fp16", "BLOCK_N": 128, "BLOCK_K": 64, "num_warps": 8, "num_stages": 1, "time_ms": 0.8362496137619019, "status": "ok"}
{"N": 262144, "K": 4096, "D": 128, "B": 1, "dtype": "fp16", "BLOCK_N": 128, "BLOCK_K": 64, "num_warps": 8, "num_stages": 2, "time_ms": 0.814195191860199, "status": "ok"}
{"N": 262144, "K": 4096, "D": 128, "B": 1, "dtype": "fp16", "BLOCK_N": 128, "BLOCK_K": 64, "num_warps": 8, "num_stages": 4, "time_ms": 0.8038848042488098, "status": "ok"}
{"N": 262144, "K": 4096, "D": 128, "B": 1, "dtype": "fp16", "BLOCK_N": 128, "BLOCK_K": 128, "num_warps": 4, "num_stages": 1, "time_ms": 0.8028543949127197, "status": "ok"}
{"N": 262144, "K": 4096, "D": 128, "B": 1, "dtype": "fp16", "BLOCK_N": 128, "BLOCK_K": 128, "num_warps": 4, "num_stages": 2, "time_ms": 0.7657407999038697, "status": "ok"}
{"N": 262144, "K": 4096, "D": 128, "B": 1, "dtype": "fp16", "BLOCK_N": 128, "BLOCK_K": 128, "num_warps": 4, "num_stages": 4, "time_ms": 0.9328639954328537, "status": "ok"}
{"N": 262144, "K": 4096, "D": 128, "B": 1, "dtype": "fp16", "BLOCK_N": 128, "BLOCK_K": 128, "num_warps": 8, "num_stages": 1, "time_ms": 1.1840960184733074, "status": "ok"}
{"N": 262144, "K": 4096, "D": 128, "B": 1, "dtype": "fp16", "BLOCK_N": 128, "BLOCK_K": 128, "num_warps": 8, "num_stages": 2, "time_ms": 0.746943998336792, "status": "ok"}
{"N": 262144, "K": 4096, "D": 128, "B": 1, "dtype": "fp16", "BLOCK_N": 128, "BLOCK_K": 128, "num_warps": 8, "num_stages": 4, "time_ms": 0.8844288110733032, "status": "ok"}
{"summary": true, "N": 262144, "K": 4096, "D": 128, "B": 1, "dtype": "fp16", "best": {"N": 262144, "K": 4096, "D": 128, "B": 1, "dtype": "fp16", "BLOCK_N": 128, "BLOCK_K": 128, "num_warps": 8, "num_stages": 2, "time_ms": 0.746943998336792, "status": "ok"}, "best_time_ms": 0.746943998336792, "tuning_seconds": 14.56951093673706, "skipped": 0}
