grid_results_h100/N262144_K65536_D128_B32_fp16.jsonl
{"N": 262144, "K": 65536, "D": 128, "B": 32, "dtype": "fp16", "BLOCK_N": 32, "BLOCK_K": 32, "num_warps": 4, "num_stages": 1, "time_ms": 1273.6026611328125, "status": "ok"}
{"N": 262144, "K": 65536, "D": 128, "B": 32, "dtype": "fp16", "BLOCK_N": 32, "BLOCK_K": 32, "num_warps": 4, "num_stages": 2, "time_ms": 1052.897705078125, "status": "ok"}
{"N": 262144, "K": 65536, "D": 128, "B": 32, "dtype": "fp16", "BLOCK_N": 32, "BLOCK_K": 32, "num_warps": 4, "num_stages": 4, "time_ms": 1055.3089599609375, "status": "ok"}
{"N": 262144, "K": 65536, "D": 128, "B": 32, "dtype": "fp16", "BLOCK_N": 32, "BLOCK_K": 32, "num_warps": 8, "num_stages": 1, "time_ms": 1887.6932373046875, "status": "ok"}
{"N": 262144, "K": 65536, "D": 128, "B": 32, "dtype": "fp16", "BLOCK_N": 32, "BLOCK_K": 32, "num_warps": 8, "num_stages": 2, "time_ms": 1719.8587646484375, "status": "ok"}
{"N": 262144, "K": 65536, "D": 128, "B": 32, "dtype": "fp16", "BLOCK_N": 32, "BLOCK_K": 32, "num_warps": 8, "num_stages": 4, "time_ms": 1687.7894287109375, "status": "ok"}
{"N": 262144, "K": 65536, "D": 128, "B": 32, "dtype": "fp16", "BLOCK_N": 32, "BLOCK_K": 64, "num_warps": 4, "num_stages": 1, "time_ms": 1097.4595947265625, "status": "ok"}
{"N": 262144, "K": 65536, "D": 128, "B": 32, "dtype": "fp16", "BLOCK_N": 32, "BLOCK_K": 64, "num_warps": 4, "num_stages": 2, "time_ms": 891.8487548828125, "status": "ok"}
{"N": 262144, "K": 65536, "D": 128, "B": 32, "dtype": "fp16", "BLOCK_N": 32, "BLOCK_K": 64, "num_warps": 4, "num_stages": 4, "time_ms": 933.2426147460938, "status": "ok"}
{"N": 262144, "K": 65536, "D": 128, "B": 32, "dtype": "fp16", "BLOCK_N": 32, "BLOCK_K": 64, "num_warps": 8, "num_stages": 1, "time_ms": 1329.6434326171875, "status": "ok"}
{"N": 262144, "K": 65536, "D": 128, "B": 32, "dtype": "fp16", "BLOCK_N": 32, "BLOCK_K": 64, "num_warps": 8, "num_stages": 2, "time_ms": 1126.7047119140625, "status": "ok"}
{"N": 262144, "K": 65536, "D": 128, "B": 32, "dtype": "fp16", "BLOCK_N": 32, "BLOCK_K": 64, "num_warps": 8, "num_stages": 4, "time_ms": 1115.656005859375, "status": "ok"}
{"N": 262144, "K": 65536, "D": 128, "B": 32, "dtype": "fp16", "BLOCK_N": 32, "BLOCK_K": 128, "num_warps": 4, "num_stages": 1, "time_ms": 893.1893310546875, "status": "ok"}
{"N": 262144, "K": 65536, "D": 128, "B": 32, "dtype": "fp16", "BLOCK_N": 32, "BLOCK_K": 128, "num_warps": 4, "num_stages": 2, "time_ms": 726.8641357421875, "status": "ok"}
{"N": 262144, "K": 65536, "D": 128, "B": 32, "dtype": "fp16", "BLOCK_N": 32, "BLOCK_K": 128, "num_warps": 4, "num_stages": 4, "time_ms": 972.0580444335938, "status": "ok"}
{"N": 262144, "K": 65536, "D": 128, "B": 32, "dtype": "fp16", "BLOCK_N": 32, "BLOCK_K": 128, "num_warps": 8, "num_stages": 1, "time_ms": 1189.5968017578125, "status": "ok"}
{"N": 262144, "K": 65536, "D": 128, "B": 32, "dtype": "fp16", "BLOCK_N": 32, "BLOCK_K": 128, "num_warps": 8, "num_stages": 2, "time_ms": 1027.104248046875, "status": "ok"}
{"N": 262144, "K": 65536, "D": 128, "B": 32, "dtype": "fp16", "BLOCK_N": 32, "BLOCK_K": 128, "num_warps": 8, "num_stages": 4, "time_ms": 1022.0531616210938, "status": "ok"}
{"N": 262144, "K": 65536, "D": 128, "B": 32, "dtype": "fp16", "BLOCK_N": 64, "BLOCK_K": 32, "num_warps": 4, "num_stages": 1, "time_ms": 555.60693359375, "status": "ok"}
{"N": 262144, "K": 65536, "D": 128, "B": 32, "dtype": "fp16", "BLOCK_N": 64, "BLOCK_K": 32, "num_warps": 4, "num_stages": 2, "time_ms": 458.6738586425781, "status": "ok"}
{"N": 262144, "K": 65536, "D": 128, "B": 32, "dtype": "fp16", "BLOCK_N": 64, "BLOCK_K": 32, "num_warps": 4, "num_stages": 4, "time_ms": 479.0013732910156, "status": "ok"}
{"N": 262144, "K": 65536, "D": 128, "B": 32, "dtype": "fp16", "BLOCK_N": 64, "BLOCK_K": 32, "num_warps": 8, "num_stages": 1, "time_ms": 931.5963745117188, "status": "ok"}
{"N": 262144, "K": 65536, "D": 128, "B": 32, "dtype": "fp16", "BLOCK_N": 64, "BLOCK_K": 32, "num_warps": 8, "num_stages": 2, "time_ms": 809.3782958984375, "status": "ok"}
{"N": 262144, "K": 65536, "D": 128, "B": 32, "dtype": "fp16", "BLOCK_N": 64, "BLOCK_K": 32, "num_warps": 8, "num_stages": 4, "time_ms": 816.1248168945312, "status": "ok"}
{"N": 262144, "K": 65536, "D": 128, "B": 32, "dtype": "fp16", "BLOCK_N": 64, "BLOCK_K": 64, "num_warps": 4, "num_stages": 1, "time_ms": 455.4704284667969, "status": "ok"}
{"N": 262144, "K": 65536, "D": 128, "B": 32, "dtype": "fp16", "BLOCK_N": 64, "BLOCK_K": 64, "num_warps": 4, "num_stages": 2, "time_ms": 420.912109375, "status": "ok"}
{"N": 262144, "K": 65536, "D": 128, "B": 32, "dtype": "fp16", "BLOCK_N": 64, "BLOCK_K": 64, "num_warps": 4, "num_stages": 4, "time_ms": 426.9761047363281, "status": "ok"}
{"N": 262144, "K": 65536, "D": 128, "B": 32, "dtype": "fp16", "BLOCK_N": 64, "BLOCK_K": 64, "num_warps": 8, "num_stages": 1, "time_ms": 675.1964111328125, "status": "ok"}
{"N": 262144, "K": 65536, "D": 128, "B": 32, "dtype": "fp16", "BLOCK_N": 64, "BLOCK_K": 64, "num_warps": 8, "num_stages": 2, "time_ms": 584.289306640625, "status": "ok"}
{"N": 262144, "K": 65536, "D": 128, "B": 32, "dtype": "fp16", "BLOCK_N": 64, "BLOCK_K": 64, "num_warps": 8, "num_stages": 4, "time_ms": 656.0379028320312, "status": "ok"}
{"N": 262144, "K": 65536, "D": 128, "B": 32, "dtype": "fp16", "BLOCK_N": 64, "BLOCK_K": 128, "num_warps": 4, "num_stages": 1, "time_ms": 427.2643737792969, "status": "ok"}
{"N": 262144, "K": 65536, "D": 128, "B": 32, "dtype": "fp16", "BLOCK_N": 64, "BLOCK_K": 128, "num_warps": 4, "num_stages": 2, "time_ms": 424.40478515625, "status": "ok"}
{"N": 262144, "K": 65536, "D": 128, "B": 32, "dtype": "fp16", "BLOCK_N": 64, "BLOCK_K": 128, "num_warps": 4, "num_stages": 4, "time_ms": 513.3049926757812, "status": "ok"}
{"N": 262144, "K": 65536, "D": 128, "B": 32, "dtype": "fp16", "BLOCK_N": 64, "BLOCK_K": 128, "num_warps": 8, "num_stages": 1, "time_ms": 629.0816040039062, "status": "ok"}
{"N": 262144, "K": 65536, "D": 128, "B": 32, "dtype": "fp16", "BLOCK_N": 64, "BLOCK_K": 128, "num_warps": 8, "num_stages": 2, "time_ms": 551.4402465820312, "status": "ok"}
{"N": 262144, "K": 65536, "D": 128, "B": 32, "dtype": "fp16", "BLOCK_N": 64, "BLOCK_K": 128, "num_warps": 8, "num_stages": 4, "time_ms": 602.0885009765625, "status": "ok"}
{"N": 262144, "K": 65536, "D": 128, "B": 32, "dtype": "fp16", "BLOCK_N": 128, "BLOCK_K": 32, "num_warps": 4, "num_stages": 1, "time_ms": 450.84490966796875, "status": "ok"}
{"N": 262144, "K": 65536, "D": 128, "B": 32, "dtype": "fp16", "BLOCK_N": 128, "BLOCK_K": 32, "num_warps": 4, "num_stages": 2, "time_ms": 450.9895324707031, "status": "ok"}
{"N": 262144, "K": 65536, "D": 128, "B": 32, "dtype": "fp16", "BLOCK_N": 128, "BLOCK_K": 32, "num_warps": 4, "num_stages": 4, "time_ms": 472.6141052246094, "status": "ok"}
{"N": 262144, "K": 65536, "D": 128, "B": 32, "dtype": "fp16", "BLOCK_N": 128, "BLOCK_K": 32, "num_warps": 8, "num_stages": 1, "time_ms": 472.7073974609375, "status": "ok"}
{"N": 262144, "K": 65536, "D": 128, "B": 32, "dtype": "fp16", "BLOCK_N": 128, "BLOCK_K": 32, "num_warps": 8, "num_stages": 2, "time_ms": 452.6202392578125, "status": "ok"}
{"N": 262144, "K": 65536, "D": 128, "B": 32, "dtype": "fp16", "BLOCK_N": 128, "BLOCK_K": 32, "num_warps": 8, "num_stages": 4, "time_ms": 463.85906982421875, "status": "ok"}
{"N": 262144, "K": 65536, "D": 128, "B": 32, "dtype": "fp16", "BLOCK_N": 128, "BLOCK_K": 64, "num_warps": 4, "num_stages": 1, "time_ms": 417.2917175292969, "status": "ok"}
{"N": 262144, "K": 65536, "D": 128, "B": 32, "dtype": "fp16", "BLOCK_N": 128, "BLOCK_K": 64, "num_warps": 4, "num_stages": 2, "time_ms": 418.2184753417969, "status": "ok"}
{"N": 262144, "K": 65536, "D": 128, "B": 32, "dtype": "fp16", "BLOCK_N": 128, "BLOCK_K": 64, "num_warps": 4, "num_stages": 4, "time_ms": 417.9339294433594, "status": "ok"}
{"N": 262144, "K": 65536, "D": 128, "B": 32, "dtype": "fp16", "BLOCK_N": 128, "BLOCK_K": 64, "num_warps": 8, "num_stages": 1, "time_ms": 421.7002868652344, "status": "ok"}
{"N": 262144, "K": 65536, "D": 128, "B": 32, "dtype": "fp16", "BLOCK_N": 128, "BLOCK_K": 64, "num_warps": 8, "num_stages": 2, "time_ms": 419.9761047363281, "status": "ok"}
{"N": 262144, "K": 65536, "D": 128, "B": 32, "dtype": "fp16", "BLOCK_N": 128, "BLOCK_K": 64, "num_warps": 8, "num_stages": 4, "time_ms": 419.9720458984375, "status": "ok"}
{"N": 262144, "K": 65536, "D": 128, "B": 32, "dtype": "fp16", "BLOCK_N": 128, "BLOCK_K": 128, "num_warps": 4, "num_stages": 1, "time_ms": 414.43206787109375, "status": "ok"}
{"N": 262144, "K": 65536, "D": 128, "B": 32, "dtype": "fp16", "BLOCK_N": 128, "BLOCK_K": 128, "num_warps": 4, "num_stages": 2, "time_ms": 404.4026184082031, "status": "ok"}
{"N": 262144, "K": 65536, "D": 128, "B": 32, "dtype": "fp16", "BLOCK_N": 128, "BLOCK_K": 128, "num_warps": 4, "num_stages": 4, "time_ms": 435.6958923339844, "status": "ok"}
{"N": 262144, "K": 65536, "D": 128, "B": 32, "dtype": "fp16", "BLOCK_N": 128, "BLOCK_K": 128, "num_warps": 8, "num_stages": 1, "time_ms": 553.49755859375, "status": "ok"}
{"N": 262144, "K": 65536, "D": 128, "B": 32, "dtype": "fp16", "BLOCK_N": 128, "BLOCK_K": 128, "num_warps": 8, "num_stages": 2, "time_ms": 391.2505798339844, "status": "ok"}
{"N": 262144, "K": 65536, "D": 128, "B": 32, "dtype": "fp16", "BLOCK_N": 128, "BLOCK_K": 128, "num_warps": 8, "num_stages": 4, "time_ms": 428.48931884765625, "status": "ok"}
{"summary": true, "N": 262144, "K": 65536, "D": 128, "B": 32, "dtype": "fp16", "best": {"N": 262144, "K": 65536, "D": 128, "B": 32, "dtype": "fp16", "BLOCK_N": 128, "BLOCK_K": 128, "num_warps": 8, "num_stages": 2, "time_ms": 391.2505798339844, "status": "ok"}, "best_time_ms": 391.2505798339844, "tuning_seconds": 328.72781467437744, "skipped": 0}
