grid_results_h100/N262144_K65536_D64_B32_fp16.jsonl
{"N": 262144, "K": 65536, "D": 64, "B": 32, "dtype": "fp16", "BLOCK_N": 32, "BLOCK_K": 32, "num_warps": 4, "num_stages": 1, "time_ms": 834.1622924804688, "status": "ok"}
{"N": 262144, "K": 65536, "D": 64, "B": 32, "dtype": "fp16", "BLOCK_N": 32, "BLOCK_K": 32, "num_warps": 4, "num_stages": 2, "time_ms": 737.5601196289062, "status": "ok"}
{"N": 262144, "K": 65536, "D": 64, "B": 32, "dtype": "fp16", "BLOCK_N": 32, "BLOCK_K": 32, "num_warps": 4, "num_stages": 4, "time_ms": 733.8121948242188, "status": "ok"}
{"N": 262144, "K": 65536, "D": 64, "B": 32, "dtype": "fp16", "BLOCK_N": 32, "BLOCK_K": 32, "num_warps": 8, "num_stages": 1, "time_ms": 1343.2353515625, "status": "ok"}
{"N": 262144, "K": 65536, "D": 64, "B": 32, "dtype": "fp16", "BLOCK_N": 32, "BLOCK_K": 32, "num_warps": 8, "num_stages": 2, "time_ms": 1269.6695556640625, "status": "ok"}
{"N": 262144, "K": 65536, "D": 64, "B": 32, "dtype": "fp16", "BLOCK_N": 32, "BLOCK_K": 32, "num_warps": 8, "num_stages": 4, "time_ms": 1242.56396484375, "status": "ok"}
{"N": 262144, "K": 65536, "D": 64, "B": 32, "dtype": "fp16", "BLOCK_N": 32, "BLOCK_K": 64, "num_warps": 4, "num_stages": 1, "time_ms": 714.4589233398438, "status": "ok"}
{"N": 262144, "K": 65536, "D": 64, "B": 32, "dtype": "fp16", "BLOCK_N": 32, "BLOCK_K": 64, "num_warps": 4, "num_stages": 2, "time_ms": 632.9537963867188, "status": "ok"}
{"N": 262144, "K": 65536, "D": 64, "B": 32, "dtype": "fp16", "BLOCK_N": 32, "BLOCK_K": 64, "num_warps": 4, "num_stages": 4, "time_ms": 606.80078125, "status": "ok"}
{"N": 262144, "K": 65536, "D": 64, "B": 32, "dtype": "fp16", "BLOCK_N": 32, "BLOCK_K": 64, "num_warps": 8, "num_stages": 1, "time_ms": 867.98974609375, "status": "ok"}
{"N": 262144, "K": 65536, "D": 64, "B": 32, "dtype": "fp16", "BLOCK_N": 32, "BLOCK_K": 64, "num_warps": 8, "num_stages": 2, "time_ms": 803.6094970703125, "status": "ok"}
{"N": 262144, "K": 65536, "D": 64, "B": 32, "dtype": "fp16", "BLOCK_N": 32, "BLOCK_K": 64, "num_warps": 8, "num_stages": 4, "time_ms": 781.2130737304688, "status": "ok"}
{"N": 262144, "K": 65536, "D": 64, "B": 32, "dtype": "fp16", "BLOCK_N": 32, "BLOCK_K": 128, "num_warps": 4, "num_stages": 1, "time_ms": 564.198486328125, "status": "ok"}
{"N": 262144, "K": 65536, "D": 64, "B": 32, "dtype": "fp16", "BLOCK_N": 32, "BLOCK_K": 128, "num_warps": 4, "num_stages": 2, "time_ms": 517.0072021484375, "status": "ok"}
{"N": 262144, "K": 65536, "D": 64, "B": 32, "dtype": "fp16", "BLOCK_N": 32, "BLOCK_K": 128, "num_warps": 4, "num_stages": 4, "time_ms": 503.1226501464844, "status": "ok"}
{"N": 262144, "K": 65536, "D": 64, "B": 32, "dtype": "fp16", "BLOCK_N": 32, "BLOCK_K": 128, "num_warps": 8, "num_stages": 1, "time_ms": 905.3012084960938, "status": "ok"}
{"N": 262144, "K": 65536, "D": 64, "B": 32, "dtype": "fp16", "BLOCK_N": 32, "BLOCK_K": 128, "num_warps": 8, "num_stages": 2, "time_ms": 742.7970581054688, "status": "ok"}
{"N": 262144, "K": 65536, "D": 64, "B": 32, "dtype": "fp16", "BLOCK_N": 32, "BLOCK_K": 128, "num_warps": 8, "num_stages": 4, "time_ms": 717.09228515625, "status": "ok"}
{"N": 262144, "K": 65536, "D": 64, "B": 32, "dtype": "fp16", "BLOCK_N": 64, "BLOCK_K": 32, "num_warps": 4, "num_stages": 1, "time_ms": 346.56640625, "status": "ok"}
{"N": 262144, "K": 65536, "D": 64, "B": 32, "dtype": "fp16", "BLOCK_N": 64, "BLOCK_K": 32, "num_warps": 4, "num_stages": 2, "time_ms": 334.4947204589844, "status": "ok"}
{"N": 262144, "K": 65536, "D": 64, "B": 32, "dtype": "fp16", "BLOCK_N": 64, "BLOCK_K": 32, "num_warps": 4, "num_stages": 4, "time_ms": 336.7826843261719, "status": "ok"}
{"N": 262144, "K": 65536, "D": 64, "B": 32, "dtype": "fp16", "BLOCK_N": 64, "BLOCK_K": 32, "num_warps": 8, "num_stages": 1, "time_ms": 673.5394897460938, "status": "ok"}
{"N": 262144, "K": 65536, "D": 64, "B": 32, "dtype": "fp16", "BLOCK_N": 64, "BLOCK_K": 32, "num_warps": 8, "num_stages": 2, "time_ms": 629.8134765625, "status": "ok"}
{"N": 262144, "K": 65536, "D": 64, "B": 32, "dtype": "fp16", "BLOCK_N": 64, "BLOCK_K": 32, "num_warps": 8, "num_stages": 4, "time_ms": 616.1078491210938, "status": "ok"}
{"N": 262144, "K": 65536, "D": 64, "B": 32, "dtype": "fp16", "BLOCK_N": 64, "BLOCK_K": 64, "num_warps": 4, "num_stages": 1, "time_ms": 317.4341125488281, "status": "ok"}
{"N": 262144, "K": 65536, "D": 64, "B": 32, "dtype": "fp16", "BLOCK_N": 64, "BLOCK_K": 64, "num_warps": 4, "num_stages": 2, "time_ms": 300.7525634765625, "status": "ok"}
{"N": 262144, "K": 65536, "D": 64, "B": 32, "dtype": "fp16", "BLOCK_N": 64, "BLOCK_K": 64, "num_warps": 4, "num_stages": 4, "time_ms": 302.0977783203125, "status": "ok"}
{"N": 262144, "K": 65536, "D": 64, "B": 32, "dtype": "fp16", "BLOCK_N": 64, "BLOCK_K": 64, "num_warps": 8, "num_stages": 1, "time_ms": 479.6797790527344, "status": "ok"}
{"N": 262144, "K": 65536, "D": 64, "B": 32, "dtype": "fp16", "BLOCK_N": 64, "BLOCK_K": 64, "num_warps": 8, "num_stages": 2, "time_ms": 457.2842102050781, "status": "ok"}
{"N": 262144, "K": 65536, "D": 64, "B": 32, "dtype": "fp16", "BLOCK_N": 64, "BLOCK_K": 64, "num_warps": 8, "num_stages": 4, "time_ms": 443.1672668457031, "status": "ok"}
{"N": 262144, "K": 65536, "D": 64, "B": 32, "dtype": "fp16", "BLOCK_N": 64, "BLOCK_K": 128, "num_warps": 4, "num_stages": 1, "time_ms": 301.2118835449219, "status": "ok"}
{"N": 262144, "K": 65536, "D": 64, "B": 32, "dtype": "fp16", "BLOCK_N": 64, "BLOCK_K": 128, "num_warps": 4, "num_stages": 2, "time_ms": 294.2759094238281, "status": "ok"}
{"N": 262144, "K": 65536, "D": 64, "B": 32, "dtype": "fp16", "BLOCK_N": 64, "BLOCK_K": 128, "num_warps": 4, "num_stages": 4, "time_ms": 296.47296142578125, "status": "ok"}
{"N": 262144, "K": 65536, "D": 64, "B": 32, "dtype": "fp16", "BLOCK_N": 64, "BLOCK_K": 128, "num_warps": 8, "num_stages": 1, "time_ms": 494.6440734863281, "status": "ok"}
{"N": 262144, "K": 65536, "D": 64, "B": 32, "dtype": "fp16", "BLOCK_N": 64, "BLOCK_K": 128, "num_warps": 8, "num_stages": 2, "time_ms": 428.8314514160156, "status": "ok"}
{"N": 262144, "K": 65536, "D": 64, "B": 32, "dtype": "fp16", "BLOCK_N": 64, "BLOCK_K": 128, "num_warps": 8, "num_stages": 4, "time_ms": 403.50787353515625, "status": "ok"}
{"N": 262144, "K": 65536, "D": 64, "B": 32, "dtype": "fp16", "BLOCK_N": 128, "BLOCK_K": 32, "num_warps": 4, "num_stages": 1, "time_ms": 325.878662109375, "status": "ok"}
{"N": 262144, "K": 65536, "D": 64, "B": 32, "dtype": "fp16", "BLOCK_N": 128, "BLOCK_K": 32, "num_warps": 4, "num_stages": 2, "time_ms": 319.19805908203125, "status": "ok"}
{"N": 262144, "K": 65536, "D": 64, "B": 32, "dtype": "fp16", "BLOCK_N": 128, "BLOCK_K": 32, "num_warps": 4, "num_stages": 4, "time_ms": 324.1435241699219, "status": "ok"}
{"N": 262144, "K": 65536, "D": 64, "B": 32, "dtype": "fp16", "BLOCK_N": 128, "BLOCK_K": 32, "num_warps": 8, "num_stages": 1, "time_ms": 344.2551574707031, "status": "ok"}
{"N": 262144, "K": 65536, "D": 64, "B": 32, "dtype": "fp16", "BLOCK_N": 128, "BLOCK_K": 32, "num_warps": 8, "num_stages": 2, "time_ms": 357.97637939453125, "status": "ok"}
{"N": 262144, "K": 65536, "D": 64, "B": 32, "dtype": "fp16", "BLOCK_N": 128, "BLOCK_K": 32, "num_warps": 8, "num_stages": 4, "time_ms": 348.7161865234375, "status": "ok"}
{"N": 262144, "K": 65536, "D": 64, "B": 32, "dtype": "fp16", "BLOCK_N": 128, "BLOCK_K": 64, "num_warps": 4, "num_stages": 1, "time_ms": 314.53369140625, "status": "ok"}
{"N": 262144, "K": 65536, "D": 64, "B": 32, "dtype": "fp16", "BLOCK_N": 128, "BLOCK_K": 64, "num_warps": 4, "num_stages": 2, "time_ms": 289.36279296875, "status": "ok"}
{"N": 262144, "K": 65536, "D": 64, "B": 32, "dtype": "fp16", "BLOCK_N": 128, "BLOCK_K": 64, "num_warps": 4, "num_stages": 4, "time_ms": 290.8403625488281, "status": "ok"}
{"N": 262144, "K": 65536, "D": 64, "B": 32, "dtype": "fp16", "BLOCK_N": 128, "BLOCK_K": 64, "num_warps": 8, "num_stages": 1, "time_ms": 322.6552734375, "status": "ok"}
{"N": 262144, "K": 65536, "D": 64, "B": 32, "dtype": "fp16", "BLOCK_N": 128, "BLOCK_K": 64, "num_warps": 8, "num_stages": 2, "time_ms": 313.19451904296875, "status": "ok"}
{"N": 262144, "K": 65536, "D": 64, "B": 32, "dtype": "fp16", "BLOCK_N": 128, "BLOCK_K": 64, "num_warps": 8, "num_stages": 4, "time_ms": 305.2959289550781, "status": "ok"}
{"N": 262144, "K": 65536, "D": 64, "B": 32, "dtype": "fp16", "BLOCK_N": 128, "BLOCK_K": 128, "num_warps": 4, "num_stages": 1, "time_ms": 312.194580078125, "status": "ok"}
{"N": 262144, "K": 65536, "D": 64, "B": 32, "dtype": "fp16", "BLOCK_N": 128, "BLOCK_K": 128, "num_warps": 4, "num_stages": 2, "time_ms": 310.0274353027344, "status": "ok"}
{"N": 262144, "K": 65536, "D": 64, "B": 32, "dtype": "fp16", "BLOCK_N": 128, "BLOCK_K": 128, "num_warps": 4, "num_stages": 4, "time_ms": 287.0557861328125, "status": "ok"}
{"N": 262144, "K": 65536, "D": 64, "B": 32, "dtype": "fp16", "BLOCK_N": 128, "BLOCK_K": 128, "num_warps": 8, "num_stages": 1, "time_ms": 442.1690979003906, "status": "ok"}
{"N": 262144, "K": 65536, "D": 64, "B": 32, "dtype": "fp16", "BLOCK_N": 128, "BLOCK_K": 128, "num_warps": 8, "num_stages": 2, "time_ms": 297.4891662597656, "status": "ok"}
{"N": 262144, "K": 65536, "D": 64, "B": 32, "dtype": "fp16", "BLOCK_N": 128, "BLOCK_K": 128, "num_warps": 8, "num_stages": 4, "time_ms": 290.2318115234375, "status": "ok"}
{"summary": true, "N": 262144, "K": 65536, "D": 64, "B": 32, "dtype": "fp16", "best": {"N": 262144, "K": 65536, "D": 64, "B": 32, "dtype": "fp16", "BLOCK_N": 128, "BLOCK_K": 128, "num_warps": 4, "num_stages": 4, "time_ms": 287.0557861328125, "status": "ok"}, "best_time_ms": 287.0557861328125, "tuning_seconds": 235.1973888874054, "skipped": 0}
