grid_results_h100/N262144_K200000_D64_B1_fp16.jsonl
{"N": 262144, "K": 200000, "D": 64, "B": 1, "dtype": "fp16", "BLOCK_N": 32, "BLOCK_K": 32, "num_warps": 4, "num_stages": 1, "time_ms": 80.9257583618164, "status": "ok"}
{"N": 262144, "K": 200000, "D": 64, "B": 1, "dtype": "fp16", "BLOCK_N": 32, "BLOCK_K": 32, "num_warps": 4, "num_stages": 2, "time_ms": 72.85865783691406, "status": "ok"}
{"N": 262144, "K": 200000, "D": 64, "B": 1, "dtype": "fp16", "BLOCK_N": 32, "BLOCK_K": 32, "num_warps": 4, "num_stages": 4, "time_ms": 70.85356903076172, "status": "ok"}
{"N": 262144, "K": 200000, "D": 64, "B": 1, "dtype": "fp16", "BLOCK_N": 32, "BLOCK_K": 32, "num_warps": 8, "num_stages": 1, "time_ms": 133.20883178710938, "status": "ok"}
{"N": 262144, "K": 200000, "D": 64, "B": 1, "dtype": "fp16", "BLOCK_N": 32, "BLOCK_K": 32, "num_warps": 8, "num_stages": 2, "time_ms": 125.34540557861328, "status": "ok"}
{"N": 262144, "K": 200000, "D": 64, "B": 1, "dtype": "fp16", "BLOCK_N": 32, "BLOCK_K": 32, "num_warps": 8, "num_stages": 4, "time_ms": 120.88761901855469, "status": "ok"}
{"N": 262144, "K": 200000, "D": 64, "B": 1, "dtype": "fp16", "BLOCK_N": 32, "BLOCK_K": 64, "num_warps": 4, "num_stages": 1, "time_ms": 68.857666015625, "status": "ok"}
{"N": 262144, "K": 200000, "D": 64, "B": 1, "dtype": "fp16", "BLOCK_N": 32, "BLOCK_K": 64, "num_warps": 4, "num_stages": 2, "time_ms": 61.024478912353516, "status": "ok"}
{"N": 262144, "K": 200000, "D": 64, "B": 1, "dtype": "fp16", "BLOCK_N": 32, "BLOCK_K": 64, "num_warps": 4, "num_stages": 4, "time_ms": 57.82886505126953, "status": "ok"}
{"N": 262144, "K": 200000, "D": 64, "B": 1, "dtype": "fp16", "BLOCK_N": 32, "BLOCK_K": 64, "num_warps": 8, "num_stages": 1, "time_ms": 84.48550415039062, "status": "ok"}
{"N": 262144, "K": 200000, "D": 64, "B": 1, "dtype": "fp16", "BLOCK_N": 32, "BLOCK_K": 64, "num_warps": 8, "num_stages": 2, "time_ms": 79.35555267333984, "status": "ok"}
{"N": 262144, "K": 200000, "D": 64, "B": 1, "dtype": "fp16", "BLOCK_N": 32, "BLOCK_K": 64, "num_warps": 8, "num_stages": 4, "time_ms": 75.97164916992188, "status": "ok"}
{"N": 262144, "K": 200000, "D": 64, "B": 1, "dtype": "fp16", "BLOCK_N": 32, "BLOCK_K": 128, "num_warps": 4, "num_stages": 1, "time_ms": 55.62883377075195, "status": "ok"}
{"N": 262144, "K": 200000, "D": 64, "B": 1, "dtype": "fp16", "BLOCK_N": 32, "BLOCK_K": 128, "num_warps": 4, "num_stages": 2, "time_ms": 50.69094467163086, "status": "ok"}
{"N": 262144, "K": 200000, "D": 64, "B": 1, "dtype": "fp16", "BLOCK_N": 32, "BLOCK_K": 128, "num_warps": 4, "num_stages": 4, "time_ms": 49.32255935668945, "status": "ok"}
{"N": 262144, "K": 200000, "D": 64, "B": 1, "dtype": "fp16", "BLOCK_N": 32, "BLOCK_K": 128, "num_warps": 8, "num_stages": 1, "time_ms": 91.77254486083984, "status": "ok"}
{"N": 262144, "K": 200000, "D": 64, "B": 1, "dtype": "fp16", "BLOCK_N": 32, "BLOCK_K": 128, "num_warps": 8, "num_stages": 2, "time_ms": 73.3213119506836, "status": "ok"}
{"N": 262144, "K": 200000, "D": 64, "B": 1, "dtype": "fp16", "BLOCK_N": 32, "BLOCK_K": 128, "num_warps": 8, "num_stages": 4, "time_ms": 71.31053161621094, "status": "ok"}
{"N": 262144, "K": 200000, "D": 64, "B": 1, "dtype": "fp16", "BLOCK_N": 64, "BLOCK_K": 32, "num_warps": 4, "num_stages": 1, "time_ms": 33.627742767333984, "status": "ok"}
{"N": 262144, "K": 200000, "D": 64, "B": 1, "dtype": "fp16", "BLOCK_N": 64, "BLOCK_K": 32, "num_warps": 4, "num_stages": 2, "time_ms": 33.77299118041992, "status": "ok"}
{"N": 262144, "K": 200000, "D": 64, "B": 1, "dtype": "fp16", "BLOCK_N": 64, "BLOCK_K": 32, "num_warps": 4, "num_stages": 4, "time_ms": 32.64457702636719, "status": "ok"}
{"N": 262144, "K": 200000, "D": 64, "B": 1, "dtype": "fp16", "BLOCK_N": 64, "BLOCK_K": 32, "num_warps": 8, "num_stages": 1, "time_ms": 66.78972625732422, "status": "ok"}
{"N": 262144, "K": 200000, "D": 64, "B": 1, "dtype": "fp16", "BLOCK_N": 64, "BLOCK_K": 32, "num_warps": 8, "num_stages": 2, "time_ms": 63.59542465209961, "status": "ok"}
{"N": 262144, "K": 200000, "D": 64, "B": 1, "dtype": "fp16", "BLOCK_N": 64, "BLOCK_K": 32, "num_warps": 8, "num_stages": 4, "time_ms": 61.27756881713867, "status": "ok"}
{"N": 262144, "K": 200000, "D": 64, "B": 1, "dtype": "fp16", "BLOCK_N": 64, "BLOCK_K": 64, "num_warps": 4, "num_stages": 1, "time_ms": 31.56220817565918, "status": "ok"}
{"N": 262144, "K": 200000, "D": 64, "B": 1, "dtype": "fp16", "BLOCK_N": 64, "BLOCK_K": 64, "num_warps": 4, "num_stages": 2, "time_ms": 29.931072235107422, "status": "ok"}
{"N": 262144, "K": 200000, "D": 64, "B": 1, "dtype": "fp16", "BLOCK_N": 64, "BLOCK_K": 64, "num_warps": 4, "num_stages": 4, "time_ms": 29.486175537109375, "status": "ok"}
{"N": 262144, "K": 200000, "D": 64, "B": 1, "dtype": "fp16", "BLOCK_N": 64, "BLOCK_K": 64, "num_warps": 8, "num_stages": 1, "time_ms": 47.448768615722656, "status": "ok"}
{"N": 262144, "K": 200000, "D": 64, "B": 1, "dtype": "fp16", "BLOCK_N": 64, "BLOCK_K": 64, "num_warps": 8, "num_stages": 2, "time_ms": 45.48080062866211, "status": "ok"}
{"N": 262144, "K": 200000, "D": 64, "B": 1, "dtype": "fp16", "BLOCK_N": 64, "BLOCK_K": 64, "num_warps": 8, "num_stages": 4, "time_ms": 44.38617706298828, "status": "ok"}
{"N": 262144, "K": 200000, "D": 64, "B": 1, "dtype": "fp16", "BLOCK_N": 64, "BLOCK_K": 128, "num_warps": 4, "num_stages": 1, "time_ms": 34.369728088378906, "status": "ok"}
{"N": 262144, "K": 200000, "D": 64, "B": 1, "dtype": "fp16", "BLOCK_N": 64, "BLOCK_K": 128, "num_warps": 4, "num_stages": 2, "time_ms": 31.979936599731445, "status": "ok"}
{"N": 262144, "K": 200000, "D": 64, "B": 1, "dtype": "fp16", "BLOCK_N": 64, "BLOCK_K": 128, "num_warps": 4, "num_stages": 4, "time_ms": 31.19196891784668, "status": "ok"}
{"N": 262144, "K": 200000, "D": 64, "B": 1, "dtype": "fp16", "BLOCK_N": 64, "BLOCK_K": 128, "num_warps": 8, "num_stages": 1, "time_ms": 52.64080047607422, "status": "ok"}
{"N": 262144, "K": 200000, "D": 64, "B": 1, "dtype": "fp16", "BLOCK_N": 64, "BLOCK_K": 128, "num_warps": 8, "num_stages": 2, "time_ms": 47.57302474975586, "status": "ok"}
{"N": 262144, "K": 200000, "D": 64, "B": 1, "dtype": "fp16", "BLOCK_N": 64, "BLOCK_K": 128, "num_warps": 8, "num_stages": 4, "time_ms": 46.332096099853516, "status": "ok"}
{"N": 262144, "K": 200000, "D": 64, "B": 1, "dtype": "fp16", "BLOCK_N": 128, "BLOCK_K": 32, "num_warps": 4, "num_stages": 1, "time_ms": 33.3256950378418, "status": "ok"}
{"N": 262144, "K": 200000, "D": 64, "B": 1, "dtype": "fp16", "BLOCK_N": 128, "BLOCK_K": 32, "num_warps": 4, "num_stages": 2, "time_ms": 32.66854476928711, "status": "ok"}
{"N": 262144, "K": 200000, "D": 64, "B": 1, "dtype": "fp16", "BLOCK_N": 128, "BLOCK_K": 32, "num_warps": 4, "num_stages": 4, "time_ms": 32.21702575683594, "status": "ok"}
{"N": 262144, "K": 200000, "D": 64, "B": 1, "dtype": "fp16", "BLOCK_N": 128, "BLOCK_K": 32, "num_warps": 8, "num_stages": 1, "time_ms": 34.51494216918945, "status": "ok"}
{"N": 262144, "K": 200000, "D": 64, "B": 1, "dtype": "fp16", "BLOCK_N": 128, "BLOCK_K": 32, "num_warps": 8, "num_stages": 2, "time_ms": 36.646942138671875, "status": "ok"}
{"N": 262144, "K": 200000, "D": 64, "B": 1, "dtype": "fp16", "BLOCK_N": 128, "BLOCK_K": 32, "num_warps": 8, "num_stages": 4, "time_ms": 35.14876937866211, "status": "ok"}
{"N": 262144, "K": 200000, "D": 64, "B": 1, "dtype": "fp16", "BLOCK_N": 128, "BLOCK_K": 64, "num_warps": 4, "num_stages": 1, "time_ms": 31.15884780883789, "status": "ok"}
{"N": 262144, "K": 200000, "D": 64, "B": 1, "dtype": "fp16", "BLOCK_N": 128, "BLOCK_K": 64, "num_warps": 4, "num_stages": 2, "time_ms": 29.64080047607422, "status": "ok"}
{"N": 262144, "K": 200000, "D": 64, "B": 1, "dtype": "fp16", "BLOCK_N": 128, "BLOCK_K": 64, "num_warps": 4, "num_stages": 4, "time_ms": 28.762399673461914, "status": "ok"}
{"N": 262144, "K": 200000, "D": 64, "B": 1, "dtype": "fp16", "BLOCK_N": 128, "BLOCK_K": 64, "num_warps": 8, "num_stages": 1, "time_ms": 33.046241760253906, "status": "ok"}
{"N": 262144, "K": 200000, "D": 64, "B": 1, "dtype": "fp16", "BLOCK_N": 128, "BLOCK_K": 64, "num_warps": 8, "num_stages": 2, "time_ms": 32.27046585083008, "status": "ok"}
{"N": 262144, "K": 200000, "D": 64, "B": 1, "dtype": "fp16", "BLOCK_N": 128, "BLOCK_K": 64, "num_warps": 8, "num_stages": 4, "time_ms": 30.130592346191406, "status": "ok"}
{"N": 262144, "K": 200000, "D": 64, "B": 1, "dtype": "fp16", "BLOCK_N": 128, "BLOCK_K": 128, "num_warps": 4, "num_stages": 1, "time_ms": 33.50204849243164, "status": "ok"}
{"N": 262144, "K": 200000, "D": 64, "B": 1, "dtype": "fp16", "BLOCK_N": 128, "BLOCK_K": 128, "num_warps": 4, "num_stages": 2, "time_ms": 32.64665603637695, "status": "ok"}
{"N": 262144, "K": 200000, "D": 64, "B": 1, "dtype": "fp16", "BLOCK_N": 128, "BLOCK_K": 128, "num_warps": 4, "num_stages": 4, "time_ms": 30.417375564575195, "status": "ok"}
{"N": 262144, "K": 200000, "D": 64, "B": 1, "dtype": "fp16", "BLOCK_N": 128, "BLOCK_K": 128, "num_warps": 8, "num_stages": 1, "time_ms": 51.92265701293945, "status": "ok"}
{"N": 262144, "K": 200000, "D": 64, "B": 1, "dtype": "fp16", "BLOCK_N": 128, "BLOCK_K": 128, "num_warps": 8, "num_stages": 2, "time_ms": 51.242881774902344, "status": "ok"}
{"N": 262144, "K": 200000, "D": 64, "B": 1, "dtype": "fp16", "BLOCK_N": 128, "BLOCK_K": 128, "num_warps": 8, "num_stages": 4, "time_ms": 41.82236862182617, "status": "ok"}
{"summary": true, "N": 262144, "K": 200000, "D": 64, "B": 1, "dtype": "fp16", "best": {"N": 262144, "K": 200000, "D": 64, "B": 1, "dtype": "fp16", "BLOCK_N": 128, "BLOCK_K": 64, "num_warps": 4, "num_stages": 4, "time_ms": 28.762399673461914, "status": "ok"}, "best_time_ms": 28.762399673461914, "tuning_seconds": 34.65960717201233, "skipped": 0}
