grid_results_h100/N262144_K4096_D64_B32_fp16.jsonl
{"N": 262144, "K": 4096, "D": 64, "B": 32, "dtype": "fp16", "BLOCK_N": 32, "BLOCK_K": 32, "num_warps": 4, "num_stages": 1, "time_ms": 51.55775833129883, "status": "ok"}
{"N": 262144, "K": 4096, "D": 64, "B": 32, "dtype": "fp16", "BLOCK_N": 32, "BLOCK_K": 32, "num_warps": 4, "num_stages": 2, "time_ms": 45.65919876098633, "status": "ok"}
{"N": 262144, "K": 4096, "D": 64, "B": 32, "dtype": "fp16", "BLOCK_N": 32, "BLOCK_K": 32, "num_warps": 4, "num_stages": 4, "time_ms": 45.21507263183594, "status": "ok"}
{"N": 262144, "K": 4096, "D": 64, "B": 32, "dtype": "fp16", "BLOCK_N": 32, "BLOCK_K": 32, "num_warps": 8, "num_stages": 1, "time_ms": 82.83494567871094, "status": "ok"}
{"N": 262144, "K": 4096, "D": 64, "B": 32, "dtype": "fp16", "BLOCK_N": 32, "BLOCK_K": 32, "num_warps": 8, "num_stages": 2, "time_ms": 78.15910339355469, "status": "ok"}
{"N": 262144, "K": 4096, "D": 64, "B": 32, "dtype": "fp16", "BLOCK_N": 32, "BLOCK_K": 32, "num_warps": 8, "num_stages": 4, "time_ms": 77.27629089355469, "status": "ok"}
{"N": 262144, "K": 4096, "D": 64, "B": 32, "dtype": "fp16", "BLOCK_N": 32, "BLOCK_K": 64, "num_warps": 4, "num_stages": 1, "time_ms": 43.80815887451172, "status": "ok"}
{"N": 262144, "K": 4096, "D": 64, "B": 32, "dtype": "fp16", "BLOCK_N": 32, "BLOCK_K": 64, "num_warps": 4, "num_stages": 2, "time_ms": 39.089088439941406, "status": "ok"}
{"N": 262144, "K": 4096, "D": 64, "B": 32, "dtype": "fp16", "BLOCK_N": 32, "BLOCK_K": 64, "num_warps": 4, "num_stages": 4, "time_ms": 37.326751708984375, "status": "ok"}
{"N": 262144, "K": 4096, "D": 64, "B": 32, "dtype": "fp16", "BLOCK_N": 32, "BLOCK_K": 64, "num_warps": 8, "num_stages": 1, "time_ms": 53.2097282409668, "status": "ok"}
{"N": 262144, "K": 4096, "D": 64, "B": 32, "dtype": "fp16", "BLOCK_N": 32, "BLOCK_K": 64, "num_warps": 8, "num_stages": 2, "time_ms": 49.37443161010742, "status": "ok"}
{"N": 262144, "K": 4096, "D": 64, "B": 32, "dtype": "fp16", "BLOCK_N": 32, "BLOCK_K": 64, "num_warps": 8, "num_stages": 4, "time_ms": 48.760318756103516, "status": "ok"}
{"N": 262144, "K": 4096, "D": 64, "B": 32, "dtype": "fp16", "BLOCK_N": 32, "BLOCK_K": 128, "num_warps": 4, "num_stages": 1, "time_ms": 34.69599914550781, "status": "ok"}
{"N": 262144, "K": 4096, "D": 64, "B": 32, "dtype": "fp16", "BLOCK_N": 32, "BLOCK_K": 128, "num_warps": 4, "num_stages": 2, "time_ms": 31.083871841430664, "status": "ok"}
{"N": 262144, "K": 4096, "D": 64, "B": 32, "dtype": "fp16", "BLOCK_N": 32, "BLOCK_K": 128, "num_warps": 4, "num_stages": 4, "time_ms": 30.70230484008789, "status": "ok"}
{"N": 262144, "K": 4096, "D": 64, "B": 32, "dtype": "fp16", "BLOCK_N": 32, "BLOCK_K": 128, "num_warps": 8, "num_stages": 1, "time_ms": 56.24678421020508, "status": "ok"}
{"N": 262144, "K": 4096, "D": 64, "B": 32, "dtype": "fp16", "BLOCK_N": 32, "BLOCK_K": 128, "num_warps": 8, "num_stages": 2, "time_ms": 46.708160400390625, "status": "ok"}
{"N": 262144, "K": 4096, "D": 64, "B": 32, "dtype": "fp16", "BLOCK_N": 32, "BLOCK_K": 128, "num_warps": 8, "num_stages": 4, "time_ms": 45.2564811706543, "status": "ok"}
{"N": 262144, "K": 4096, "D": 64, "B": 32, "dtype": "fp16", "BLOCK_N": 64, "BLOCK_K": 32, "num_warps": 4, "num_stages": 1, "time_ms": 20.81545639038086, "status": "ok"}
{"N": 262144, "K": 4096, "D": 64, "B": 32, "dtype": "fp16", "BLOCK_N": 64, "BLOCK_K": 32, "num_warps": 4, "num_stages": 2, "time_ms": 20.535104751586914, "status": "ok"}
{"N": 262144, "K": 4096, "D": 64, "B": 32, "dtype": "fp16", "BLOCK_N": 64, "BLOCK_K": 32, "num_warps": 4, "num_stages": 4, "time_ms": 20.763071060180664, "status": "ok"}
{"N": 262144, "K": 4096, "D": 64, "B": 32, "dtype": "fp16", "BLOCK_N": 64, "BLOCK_K": 32, "num_warps": 8, "num_stages": 1, "time_ms": 41.433406829833984, "status": "ok"}
{"N": 262144, "K": 4096, "D": 64, "B": 32, "dtype": "fp16", "BLOCK_N": 64, "BLOCK_K": 32, "num_warps": 8, "num_stages": 2, "time_ms": 38.471038818359375, "status": "ok"}
{"N": 262144, "K": 4096, "D": 64, "B": 32, "dtype": "fp16", "BLOCK_N": 64, "BLOCK_K": 32, "num_warps": 8, "num_stages": 4, "time_ms": 37.82863998413086, "status": "ok"}
{"N": 262144, "K": 4096, "D": 64, "B": 32, "dtype": "fp16", "BLOCK_N": 64, "BLOCK_K": 64, "num_warps": 4, "num_stages": 1, "time_ms": 19.622079849243164, "status": "ok"}
{"N": 262144, "K": 4096, "D": 64, "B": 32, "dtype": "fp16", "BLOCK_N": 64, "BLOCK_K": 64, "num_warps": 4, "num_stages": 2, "time_ms": 18.581087112426758, "status": "ok"}
{"N": 262144, "K": 4096, "D": 64, "B": 32, "dtype": "fp16", "BLOCK_N": 64, "BLOCK_K": 64, "num_warps": 4, "num_stages": 4, "time_ms": 18.70867156982422, "status": "ok"}
{"N": 262144, "K": 4096, "D": 64, "B": 32, "dtype": "fp16", "BLOCK_N": 64, "BLOCK_K": 64, "num_warps": 8, "num_stages": 1, "time_ms": 29.677471160888672, "status": "ok"}
{"N": 262144, "K": 4096, "D": 64, "B": 32, "dtype": "fp16", "BLOCK_N": 64, "BLOCK_K": 64, "num_warps": 8, "num_stages": 2, "time_ms": 28.19593620300293, "status": "ok"}
{"N": 262144, "K": 4096, "D": 64, "B": 32, "dtype": "fp16", "BLOCK_N": 64, "BLOCK_K": 64, "num_warps": 8, "num_stages": 4, "time_ms": 27.83830451965332, "status": "ok"}
{"N": 262144, "K": 4096, "D": 64, "B": 32, "dtype": "fp16", "BLOCK_N": 64, "BLOCK_K": 128, "num_warps": 4, "num_stages": 1, "time_ms": 18.70172882080078, "status": "ok"}
{"N": 262144, "K": 4096, "D": 64, "B": 32, "dtype": "fp16", "BLOCK_N": 64, "BLOCK_K": 128, "num_warps": 4, "num_stages": 2, "time_ms": 18.028640747070312, "status": "ok"}
{"N": 262144, "K": 4096, "D": 64, "B": 32, "dtype": "fp16", "BLOCK_N": 64, "BLOCK_K": 128, "num_warps": 4, "num_stages": 4, "time_ms": 18.139968872070312, "status": "ok"}
{"N": 262144, "K": 4096, "D": 64, "B": 32, "dtype": "fp16", "BLOCK_N": 64, "BLOCK_K": 128, "num_warps": 8, "num_stages": 1, "time_ms": 30.358495712280273, "status": "ok"}
{"N": 262144, "K": 4096, "D": 64, "B": 32, "dtype": "fp16", "BLOCK_N": 64, "BLOCK_K": 128, "num_warps": 8, "num_stages": 2, "time_ms": 26.253536224365234, "status": "ok"}
{"N": 262144, "K": 4096, "D": 64, "B": 32, "dtype": "fp16", "BLOCK_N": 64, "BLOCK_K": 128, "num_warps": 8, "num_stages": 4, "time_ms": 25.035680770874023, "status": "ok"}
{"N": 262144, "K": 4096, "D": 64, "B": 32, "dtype": "fp16", "BLOCK_N": 128, "BLOCK_K": 32, "num_warps": 4, "num_stages": 1, "time_ms": 20.497695922851562, "status": "ok"}
{"N": 262144, "K": 4096, "D": 64, "B": 32, "dtype": "fp16", "BLOCK_N": 128, "BLOCK_K": 32, "num_warps": 4, "num_stages": 2, "time_ms": 19.915424346923828, "status": "ok"}
{"N": 262144, "K": 4096, "D": 64, "B": 32, "dtype": "fp16", "BLOCK_N": 128, "BLOCK_K": 32, "num_warps": 4, "num_stages": 4, "time_ms": 20.235328674316406, "status": "ok"}
{"N": 262144, "K": 4096, "D": 64, "B": 32, "dtype": "fp16", "BLOCK_N": 128, "BLOCK_K": 32, "num_warps": 8, "num_stages": 1, "time_ms": 21.082176208496094, "status": "ok"}
{"N": 262144, "K": 4096, "D": 64, "B": 32, "dtype": "fp16", "BLOCK_N": 128, "BLOCK_K": 32, "num_warps": 8, "num_stages": 2, "time_ms": 22.0729923248291, "status": "ok"}
{"N": 262144, "K": 4096, "D": 64, "B": 32, "dtype": "fp16", "BLOCK_N": 128, "BLOCK_K": 32, "num_warps": 8, "num_stages": 4, "time_ms": 21.70025634765625, "status": "ok"}
{"N": 262144, "K": 4096, "D": 64, "B": 32, "dtype": "fp16", "BLOCK_N": 128, "BLOCK_K": 64, "num_warps": 4, "num_stages": 1, "time_ms": 19.293407440185547, "status": "ok"}
{"N": 262144, "K": 4096, "D": 64, "B": 32, "dtype": "fp16", "BLOCK_N": 128, "BLOCK_K": 64, "num_warps": 4, "num_stages": 2, "time_ms": 17.859935760498047, "status": "ok"}
{"N": 262144, "K": 4096, "D": 64, "B": 32, "dtype": "fp16", "BLOCK_N": 128, "BLOCK_K": 64, "num_warps": 4, "num_stages": 4, "time_ms": 18.084735870361328, "status": "ok"}
{"N": 262144, "K": 4096, "D": 64, "B": 32, "dtype": "fp16", "BLOCK_N": 128, "BLOCK_K": 64, "num_warps": 8, "num_stages": 1, "time_ms": 19.902912139892578, "status": "ok"}
{"N": 262144, "K": 4096, "D": 64, "B": 32, "dtype": "fp16", "BLOCK_N": 128, "BLOCK_K": 64, "num_warps": 8, "num_stages": 2, "time_ms": 19.192447662353516, "status": "ok"}
{"N": 262144, "K": 4096, "D": 64, "B": 32, "dtype": "fp16", "BLOCK_N": 128, "BLOCK_K": 64, "num_warps": 8, "num_stages": 4, "time_ms": 19.208480834960938, "status": "ok"}
{"N": 262144, "K": 4096, "D": 64, "B": 32, "dtype": "fp16", "BLOCK_N": 128, "BLOCK_K": 128, "num_warps": 4, "num_stages": 1, "time_ms": 20.766399383544922, "status": "ok"}
{"N": 262144, "K": 4096, "D": 64, "B": 32, "dtype": "fp16", "BLOCK_N": 128, "BLOCK_K": 128, "num_warps": 4, "num_stages": 2, "time_ms": 19.40991973876953, "status": "ok"}
{"N": 262144, "K": 4096, "D": 64, "B": 32, "dtype": "fp16", "BLOCK_N": 128, "BLOCK_K": 128, "num_warps": 4, "num_stages": 4, "time_ms": 18.06710433959961, "status": "ok"}
{"N": 262144, "K": 4096, "D": 64, "B": 32, "dtype": "fp16", "BLOCK_N": 128, "BLOCK_K": 128, "num_warps": 8, "num_stages": 1, "time_ms": 26.96735954284668, "status": "ok"}
{"N": 262144, "K": 4096, "D": 64, "B": 32, "dtype": "fp16", "BLOCK_N": 128, "BLOCK_K": 128, "num_warps": 8, "num_stages": 2, "time_ms": 18.439775466918945, "status": "ok"}
{"N": 262144, "K": 4096, "D": 64, "B": 32, "dtype": "fp16", "BLOCK_N": 128, "BLOCK_K": 128, "num_warps": 8, "num_stages": 4, "time_ms": 18.148128509521484, "status": "ok"}
{"summary": true, "N": 262144, "K": 4096, "D": 64, "B": 32, "dtype": "fp16", "best": {"N": 262144, "K": 4096, "D": 64, "B": 32, "dtype": "fp16", "BLOCK_N": 128, "BLOCK_K": 64, "num_warps": 4, "num_stages": 2, "time_ms": 17.859935760498047, "status": "ok"}, "best_time_ms": 17.859935760498047, "tuning_seconds": 25.682108402252197, "skipped": 0}
