grid_results_h100/N262144_K16384_D128_B32_fp16.jsonl
{"N": 262144, "K": 16384, "D": 128, "B": 32, "dtype": "fp16", "BLOCK_N": 32, "BLOCK_K": 32, "num_warps": 4, "num_stages": 1, "time_ms": 318.5689392089844, "status": "ok"}
{"N": 262144, "K": 16384, "D": 128, "B": 32, "dtype": "fp16", "BLOCK_N": 32, "BLOCK_K": 32, "num_warps": 4, "num_stages": 2, "time_ms": 269.9483642578125, "status": "ok"}
{"N": 262144, "K": 16384, "D": 128, "B": 32, "dtype": "fp16", "BLOCK_N": 32, "BLOCK_K": 32, "num_warps": 4, "num_stages": 4, "time_ms": 271.98602294921875, "status": "ok"}
{"N": 262144, "K": 16384, "D": 128, "B": 32, "dtype": "fp16", "BLOCK_N": 32, "BLOCK_K": 32, "num_warps": 8, "num_stages": 1, "time_ms": 471.77447509765625, "status": "ok"}
{"N": 262144, "K": 16384, "D": 128, "B": 32, "dtype": "fp16", "BLOCK_N": 32, "BLOCK_K": 32, "num_warps": 8, "num_stages": 2, "time_ms": 428.2894592285156, "status": "ok"}
{"N": 262144, "K": 16384, "D": 128, "B": 32, "dtype": "fp16", "BLOCK_N": 32, "BLOCK_K": 32, "num_warps": 8, "num_stages": 4, "time_ms": 421.9452819824219, "status": "ok"}
{"N": 262144, "K": 16384, "D": 128, "B": 32, "dtype": "fp16", "BLOCK_N": 32, "BLOCK_K": 64, "num_warps": 4, "num_stages": 1, "time_ms": 277.0812072753906, "status": "ok"}
{"N": 262144, "K": 16384, "D": 128, "B": 32, "dtype": "fp16", "BLOCK_N": 32, "BLOCK_K": 64, "num_warps": 4, "num_stages": 2, "time_ms": 216.86965942382812, "status": "ok"}
{"N": 262144, "K": 16384, "D": 128, "B": 32, "dtype": "fp16", "BLOCK_N": 32, "BLOCK_K": 64, "num_warps": 4, "num_stages": 4, "time_ms": 237.3974151611328, "status": "ok"}
{"N": 262144, "K": 16384, "D": 128, "B": 32, "dtype": "fp16", "BLOCK_N": 32, "BLOCK_K": 64, "num_warps": 8, "num_stages": 1, "time_ms": 332.20526123046875, "status": "ok"}
{"N": 262144, "K": 16384, "D": 128, "B": 32, "dtype": "fp16", "BLOCK_N": 32, "BLOCK_K": 64, "num_warps": 8, "num_stages": 2, "time_ms": 280.97052001953125, "status": "ok"}
{"N": 262144, "K": 16384, "D": 128, "B": 32, "dtype": "fp16", "BLOCK_N": 32, "BLOCK_K": 64, "num_warps": 8, "num_stages": 4, "time_ms": 281.653076171875, "status": "ok"}
{"N": 262144, "K": 16384, "D": 128, "B": 32, "dtype": "fp16", "BLOCK_N": 32, "BLOCK_K": 128, "num_warps": 4, "num_stages": 1, "time_ms": 221.68850708007812, "status": "ok"}
{"N": 262144, "K": 16384, "D": 128, "B": 32, "dtype": "fp16", "BLOCK_N": 32, "BLOCK_K": 128, "num_warps": 4, "num_stages": 2, "time_ms": 174.82952880859375, "status": "ok"}
{"N": 262144, "K": 16384, "D": 128, "B": 32, "dtype": "fp16", "BLOCK_N": 32, "BLOCK_K": 128, "num_warps": 4, "num_stages": 4, "time_ms": 235.09698486328125, "status": "ok"}
{"N": 262144, "K": 16384, "D": 128, "B": 32, "dtype": "fp16", "BLOCK_N": 32, "BLOCK_K": 128, "num_warps": 8, "num_stages": 1, "time_ms": 298.5552062988281, "status": "ok"}
{"N": 262144, "K": 16384, "D": 128, "B": 32, "dtype": "fp16", "BLOCK_N": 32, "BLOCK_K": 128, "num_warps": 8, "num_stages": 2, "time_ms": 263.8258361816406, "status": "ok"}
{"N": 262144, "K": 16384, "D": 128, "B": 32, "dtype": "fp16", "BLOCK_N": 32, "BLOCK_K": 128, "num_warps": 8, "num_stages": 4, "time_ms": 266.2991027832031, "status": "ok"}
{"N": 262144, "K": 16384, "D": 128, "B": 32, "dtype": "fp16", "BLOCK_N": 64, "BLOCK_K": 32, "num_warps": 4, "num_stages": 1, "time_ms": 146.69517517089844, "status": "ok"}
{"N": 262144, "K": 16384, "D": 128, "B": 32, "dtype": "fp16", "BLOCK_N": 64, "BLOCK_K": 32, "num_warps": 4, "num_stages": 2, "time_ms": 128.00767517089844, "status": "ok"}
{"N": 262144, "K": 16384, "D": 128, "B": 32, "dtype": "fp16", "BLOCK_N": 64, "BLOCK_K": 32, "num_warps": 4, "num_stages": 4, "time_ms": 137.6781463623047, "status": "ok"}
{"N": 262144, "K": 16384, "D": 128, "B": 32, "dtype": "fp16", "BLOCK_N": 64, "BLOCK_K": 32, "num_warps": 8, "num_stages": 1, "time_ms": 232.99241638183594, "status": "ok"}
{"N": 262144, "K": 16384, "D": 128, "B": 32, "dtype": "fp16", "BLOCK_N": 64, "BLOCK_K": 32, "num_warps": 8, "num_stages": 2, "time_ms": 202.6747589111328, "status": "ok"}
{"N": 262144, "K": 16384, "D": 128, "B": 32, "dtype": "fp16", "BLOCK_N": 64, "BLOCK_K": 32, "num_warps": 8, "num_stages": 4, "time_ms": 203.03231811523438, "status": "ok"}
{"N": 262144, "K": 16384, "D": 128, "B": 32, "dtype": "fp16", "BLOCK_N": 64, "BLOCK_K": 64, "num_warps": 4, "num_stages": 1, "time_ms": 128.6856689453125, "status": "ok"}
{"N": 262144, "K": 16384, "D": 128, "B": 32, "dtype": "fp16", "BLOCK_N": 64, "BLOCK_K": 64, "num_warps": 4, "num_stages": 2, "time_ms": 102.6899185180664, "status": "ok"}
{"N": 262144, "K": 16384, "D": 128, "B": 32, "dtype": "fp16", "BLOCK_N": 64, "BLOCK_K": 64, "num_warps": 4, "num_stages": 4, "time_ms": 115.16304016113281, "status": "ok"}
{"N": 262144, "K": 16384, "D": 128, "B": 32, "dtype": "fp16", "BLOCK_N": 64, "BLOCK_K": 64, "num_warps": 8, "num_stages": 1, "time_ms": 163.89254760742188, "status": "ok"}
{"N": 262144, "K": 16384, "D": 128, "B": 32, "dtype": "fp16", "BLOCK_N": 64, "BLOCK_K": 64, "num_warps": 8, "num_stages": 2, "time_ms": 149.5564727783203, "status": "ok"}
{"N": 262144, "K": 16384, "D": 128, "B": 32, "dtype": "fp16", "BLOCK_N": 64, "BLOCK_K": 64, "num_warps": 8, "num_stages": 4, "time_ms": 162.4113006591797, "status": "ok"}
{"N": 262144, "K": 16384, "D": 128, "B": 32, "dtype": "fp16", "BLOCK_N": 64, "BLOCK_K": 128, "num_warps": 4, "num_stages": 1, "time_ms": 111.50707244873047, "status": "ok"}
{"N": 262144, "K": 16384, "D": 128, "B": 32, "dtype": "fp16", "BLOCK_N": 64, "BLOCK_K": 128, "num_warps": 4, "num_stages": 2, "time_ms": 106.74832153320312, "status": "ok"}
{"N": 262144, "K": 16384, "D": 128, "B": 32, "dtype": "fp16", "BLOCK_N": 64, "BLOCK_K": 128, "num_warps": 4, "num_stages": 4, "time_ms": 142.4351348876953, "status": "ok"}
{"N": 262144, "K": 16384, "D": 128, "B": 32, "dtype": "fp16", "BLOCK_N": 64, "BLOCK_K": 128, "num_warps": 8, "num_stages": 1, "time_ms": 154.9761962890625, "status": "ok"}
{"N": 262144, "K": 16384, "D": 128, "B": 32, "dtype": "fp16", "BLOCK_N": 64, "BLOCK_K": 128, "num_warps": 8, "num_stages": 2, "time_ms": 151.04576110839844, "status": "ok"}
{"N": 262144, "K": 16384, "D": 128, "B": 32, "dtype": "fp16", "BLOCK_N": 64, "BLOCK_K": 128, "num_warps": 8, "num_stages": 4, "time_ms": 152.10243225097656, "status": "ok"}
{"N": 262144, "K": 16384, "D": 128, "B": 32, "dtype": "fp16", "BLOCK_N": 128, "BLOCK_K": 32, "num_warps": 4, "num_stages": 1, "time_ms": 126.18828582763672, "status": "ok"}
{"N": 262144, "K": 16384, "D": 128, "B": 32, "dtype": "fp16", "BLOCK_N": 128, "BLOCK_K": 32, "num_warps": 4, "num_stages": 2, "time_ms": 124.87010955810547, "status": "ok"}
{"N": 262144, "K": 16384, "D": 128, "B": 32, "dtype": "fp16", "BLOCK_N": 128, "BLOCK_K": 32, "num_warps": 4, "num_stages": 4, "time_ms": 134.5392608642578, "status": "ok"}
{"N": 262144, "K": 16384, "D": 128, "B": 32, "dtype": "fp16", "BLOCK_N": 128, "BLOCK_K": 32, "num_warps": 8, "num_stages": 1, "time_ms": 132.6260223388672, "status": "ok"}
{"N": 262144, "K": 16384, "D": 128, "B": 32, "dtype": "fp16", "BLOCK_N": 128, "BLOCK_K": 32, "num_warps": 8, "num_stages": 2, "time_ms": 128.2918701171875, "status": "ok"}
{"N": 262144, "K": 16384, "D": 128, "B": 32, "dtype": "fp16", "BLOCK_N": 128, "BLOCK_K": 32, "num_warps": 8, "num_stages": 4, "time_ms": 130.7574005126953, "status": "ok"}
{"N": 262144, "K": 16384, "D": 128, "B": 32, "dtype": "fp16", "BLOCK_N": 128, "BLOCK_K": 64, "num_warps": 4, "num_stages": 1, "time_ms": 99.56684875488281, "status": "ok"}
{"N": 262144, "K": 16384, "D": 128, "B": 32, "dtype": "fp16", "BLOCK_N": 128, "BLOCK_K": 64, "num_warps": 4, "num_stages": 2, "time_ms": 99.34585571289062, "status": "ok"}
{"N": 262144, "K": 16384, "D": 128, "B": 32, "dtype": "fp16", "BLOCK_N": 128, "BLOCK_K": 64, "num_warps": 4, "num_stages": 4, "time_ms": 98.67036437988281, "status": "ok"}
{"N": 262144, "K": 16384, "D": 128, "B": 32, "dtype": "fp16", "BLOCK_N": 128, "BLOCK_K": 64, "num_warps": 8, "num_stages": 1, "time_ms": 106.74111938476562, "status": "ok"}
{"N": 262144, "K": 16384, "D": 128, "B": 32, "dtype": "fp16", "BLOCK_N": 128, "BLOCK_K": 64, "num_warps": 8, "num_stages": 2, "time_ms": 102.152099609375, "status": "ok"}
{"N": 262144, "K": 16384, "D": 128, "B": 32, "dtype": "fp16", "BLOCK_N": 128, "BLOCK_K": 64, "num_warps": 8, "num_stages": 4, "time_ms": 101.26038360595703, "status": "ok"}
{"N": 262144, "K": 16384, "D": 128, "B": 32, "dtype": "fp16", "BLOCK_N": 128, "BLOCK_K": 128, "num_warps": 4, "num_stages": 1, "time_ms": 97.48185729980469, "status": "ok"}
{"N": 262144, "K": 16384, "D": 128, "B": 32, "dtype": "fp16", "BLOCK_N": 128, "BLOCK_K": 128, "num_warps": 4, "num_stages": 2, "time_ms": 93.08303833007812, "status": "ok"}
{"N": 262144, "K": 16384, "D": 128, "B": 32, "dtype": "fp16", "BLOCK_N": 128, "BLOCK_K": 128, "num_warps": 4, "num_stages": 4, "time_ms": 114.88921356201172, "status": "ok"}
{"N": 262144, "K": 16384, "D": 128, "B": 32, "dtype": "fp16", "BLOCK_N": 128, "BLOCK_K": 128, "num_warps": 8, "num_stages": 1, "time_ms": 137.4817352294922, "status": "ok"}
{"N": 262144, "K": 16384, "D": 128, "B": 32, "dtype": "fp16", "BLOCK_N": 128, "BLOCK_K": 128, "num_warps": 8, "num_stages": 2, "time_ms": 91.30889892578125, "status": "ok"}
{"N": 262144, "K": 16384, "D": 128, "B": 32, "dtype": "fp16", "BLOCK_N": 128, "BLOCK_K": 128, "num_warps": 8, "num_stages": 4, "time_ms": 108.15805053710938, "status": "ok"}
{"summary": true, "N": 262144, "K": 16384, "D": 128, "B": 32, "dtype": "fp16", "best": {"N": 262144, "K": 16384, "D": 128, "B": 32, "dtype": "fp16", "BLOCK_N": 128, "BLOCK_K": 128, "num_warps": 8, "num_stages": 2, "time_ms": 91.30889892578125, "status": "ok"}, "best_time_ms": 91.30889892578125, "tuning_seconds": 92.10518550872803, "skipped": 0}
