grid_results_h100/N262144_K256_D128_B32_fp16.jsonl
{"N": 262144, "K": 256, "D": 128, "B": 32, "dtype": "fp16", "BLOCK_N": 32, "BLOCK_K": 32, "num_warps": 4, "num_stages": 1, "time_ms": 5.191999912261963, "status": "ok"}
{"N": 262144, "K": 256, "D": 128, "B": 32, "dtype": "fp16", "BLOCK_N": 32, "BLOCK_K": 32, "num_warps": 4, "num_stages": 2, "time_ms": 4.422080039978027, "status": "ok"}
{"N": 262144, "K": 256, "D": 128, "B": 32, "dtype": "fp16", "BLOCK_N": 32, "BLOCK_K": 32, "num_warps": 4, "num_stages": 4, "time_ms": 4.6249918937683105, "status": "ok"}
{"N": 262144, "K": 256, "D": 128, "B": 32, "dtype": "fp16", "BLOCK_N": 32, "BLOCK_K": 32, "num_warps": 8, "num_stages": 1, "time_ms": 7.626239776611328, "status": "ok"}
{"N": 262144, "K": 256, "D": 128, "B": 32, "dtype": "fp16", "BLOCK_N": 32, "BLOCK_K": 32, "num_warps": 8, "num_stages": 2, "time_ms": 7.160543918609619, "status": "ok"}
{"N": 262144, "K": 256, "D": 128, "B": 32, "dtype": "fp16", "BLOCK_N": 32, "BLOCK_K": 32, "num_warps": 8, "num_stages": 4, "time_ms": 7.305471897125244, "status": "ok"}
{"N": 262144, "K": 256, "D": 128, "B": 32, "dtype": "fp16", "BLOCK_N": 32, "BLOCK_K": 64, "num_warps": 4, "num_stages": 1, "time_ms": 4.449855804443359, "status": "ok"}
{"N": 262144, "K": 256, "D": 128, "B": 32, "dtype": "fp16", "BLOCK_N": 32, "BLOCK_K": 64, "num_warps": 4, "num_stages": 2, "time_ms": 3.732640027999878, "status": "ok"}
{"N": 262144, "K": 256, "D": 128, "B": 32, "dtype": "fp16", "BLOCK_N": 32, "BLOCK_K": 64, "num_warps": 4, "num_stages": 4, "time_ms": 4.581503868103027, "status": "ok"}
{"N": 262144, "K": 256, "D": 128, "B": 32, "dtype": "fp16", "BLOCK_N": 32, "BLOCK_K": 64, "num_warps": 8, "num_stages": 1, "time_ms": 5.431295871734619, "status": "ok"}
{"N": 262144, "K": 256, "D": 128, "B": 32, "dtype": "fp16", "BLOCK_N": 32, "BLOCK_K": 64, "num_warps": 8, "num_stages": 2, "time_ms": 5.1763200759887695, "status": "ok"}
{"N": 262144, "K": 256, "D": 128, "B": 32, "dtype": "fp16", "BLOCK_N": 32, "BLOCK_K": 64, "num_warps": 8, "num_stages": 4, "time_ms": 5.270495891571045, "status": "ok"}
{"N": 262144, "K": 256, "D": 128, "B": 32, "dtype": "fp16", "BLOCK_N": 32, "BLOCK_K": 128, "num_warps": 4, "num_stages": 1, "time_ms": 3.6538240909576416, "status": "ok"}
{"N": 262144, "K": 256, "D": 128, "B": 32, "dtype": "fp16", "BLOCK_N": 32, "BLOCK_K": 128, "num_warps": 4, "num_stages": 2, "time_ms": 3.273279905319214, "status": "ok"}
{"N": 262144, "K": 256, "D": 128, "B": 32, "dtype": "fp16", "BLOCK_N": 32, "BLOCK_K": 128, "num_warps": 4, "num_stages": 4, "time_ms": 5.024991989135742, "status": "ok"}
{"N": 262144, "K": 256, "D": 128, "B": 32, "dtype": "fp16", "BLOCK_N": 32, "BLOCK_K": 128, "num_warps": 8, "num_stages": 1, "time_ms": 4.963295936584473, "status": "ok"}
{"N": 262144, "K": 256, "D": 128, "B": 32, "dtype": "fp16", "BLOCK_N": 32, "BLOCK_K": 128, "num_warps": 8, "num_stages": 2, "time_ms": 4.671807765960693, "status": "ok"}
{"N": 262144, "K": 256, "D": 128, "B": 32, "dtype": "fp16", "BLOCK_N": 32, "BLOCK_K": 128, "num_warps": 8, "num_stages": 4, "time_ms": 5.584959983825684, "status": "ok"}
{"N": 262144, "K": 256, "D": 128, "B": 32, "dtype": "fp16", "BLOCK_N": 64, "BLOCK_K": 32, "num_warps": 4, "num_stages": 1, "time_ms": 2.223695993423462, "status": "ok"}
{"N": 262144, "K": 256, "D": 128, "B": 32, "dtype": "fp16", "BLOCK_N": 64, "BLOCK_K": 32, "num_warps": 4, "num_stages": 2, "time_ms": 1.9276639819145203, "status": "ok"}
{"N": 262144, "K": 256, "D": 128, "B": 32, "dtype": "fp16", "BLOCK_N": 64, "BLOCK_K": 32, "num_warps": 4, "num_stages": 4, "time_ms": 2.090767979621887, "status": "ok"}
{"N": 262144, "K": 256, "D": 128, "B": 32, "dtype": "fp16", "BLOCK_N": 64, "BLOCK_K": 32, "num_warps": 8, "num_stages": 1, "time_ms": 3.7935359477996826, "status": "ok"}
{"N": 262144, "K": 256, "D": 128, "B": 32, "dtype": "fp16", "BLOCK_N": 64, "BLOCK_K": 32, "num_warps": 8, "num_stages": 2, "time_ms": 3.441279888153076, "status": "ok"}
{"N": 262144, "K": 256, "D": 128, "B": 32, "dtype": "fp16", "BLOCK_N": 64, "BLOCK_K": 32, "num_warps": 8, "num_stages": 4, "time_ms": 3.6119680404663086, "status": "ok"}
{"N": 262144, "K": 256, "D": 128, "B": 32, "dtype": "fp16", "BLOCK_N": 64, "BLOCK_K": 64, "num_warps": 4, "num_stages": 1, "time_ms": 1.9067679643630981, "status": "ok"}
{"N": 262144, "K": 256, "D": 128, "B": 32, "dtype": "fp16", "BLOCK_N": 64, "BLOCK_K": 64, "num_warps": 4, "num_stages": 2, "time_ms": 1.7431840300559998, "status": "ok"}
{"N": 262144, "K": 256, "D": 128, "B": 32, "dtype": "fp16", "BLOCK_N": 64, "BLOCK_K": 64, "num_warps": 4, "num_stages": 4, "time_ms": 2.2611199617385864, "status": "ok"}
{"N": 262144, "K": 256, "D": 128, "B": 32, "dtype": "fp16", "BLOCK_N": 64, "BLOCK_K": 64, "num_warps": 8, "num_stages": 1, "time_ms": 2.6881279945373535, "status": "ok"}
{"N": 262144, "K": 256, "D": 128, "B": 32, "dtype": "fp16", "BLOCK_N": 64, "BLOCK_K": 64, "num_warps": 8, "num_stages": 2, "time_ms": 2.581696033477783, "status": "ok"}
{"N": 262144, "K": 256, "D": 128, "B": 32, "dtype": "fp16", "BLOCK_N": 64, "BLOCK_K": 64, "num_warps": 8, "num_stages": 4, "time_ms": 3.17574405670166, "status": "ok"}
{"N": 262144, "K": 256, "D": 128, "B": 32, "dtype": "fp16", "BLOCK_N": 64, "BLOCK_K": 128, "num_warps": 4, "num_stages": 1, "time_ms": 1.8962559700012207, "status": "ok"}
{"N": 262144, "K": 256, "D": 128, "B": 32, "dtype": "fp16", "BLOCK_N": 64, "BLOCK_K": 128, "num_warps": 4, "num_stages": 2, "time_ms": 2.2683039903640747, "status": "ok"}
{"N": 262144, "K": 256, "D": 128, "B": 32, "dtype": "fp16", "BLOCK_N": 64, "BLOCK_K": 128, "num_warps": 4, "num_stages": 4, "time_ms": 3.4504640102386475, "status": "ok"}
{"N": 262144, "K": 256, "D": 128, "B": 32, "dtype": "fp16", "BLOCK_N": 64, "BLOCK_K": 128, "num_warps": 8, "num_stages": 1, "time_ms": 2.6182079315185547, "status": "ok"}
{"N": 262144, "K": 256, "D": 128, "B": 32, "dtype": "fp16", "BLOCK_N": 64, "BLOCK_K": 128, "num_warps": 8, "num_stages": 2, "time_ms": 2.5785279273986816, "status": "ok"}
{"N": 262144, "K": 256, "D": 128, "B": 32, "dtype": "fp16", "BLOCK_N": 64, "BLOCK_K": 128, "num_warps": 8, "num_stages": 4, "time_ms": 3.900063991546631, "status": "ok"}
{"N": 262144, "K": 256, "D": 128, "B": 32, "dtype": "fp16", "BLOCK_N": 128, "BLOCK_K": 32, "num_warps": 4, "num_stages": 1, "time_ms": 1.9267839789390564, "status": "ok"}
{"N": 262144, "K": 256, "D": 128, "B": 32, "dtype": "fp16", "BLOCK_N": 128, "BLOCK_K": 32, "num_warps": 4, "num_stages": 2, "time_ms": 1.9250400066375732, "status": "ok"}
{"N": 262144, "K": 256, "D": 128, "B": 32, "dtype": "fp16", "BLOCK_N": 128, "BLOCK_K": 32, "num_warps": 4, "num_stages": 4, "time_ms": 2.019327998161316, "status": "ok"}
{"N": 262144, "K": 256, "D": 128, "B": 32, "dtype": "fp16", "BLOCK_N": 128, "BLOCK_K": 32, "num_warps": 8, "num_stages": 1, "time_ms": 1.9535199999809265, "status": "ok"}
{"N": 262144, "K": 256, "D": 128, "B": 32, "dtype": "fp16", "BLOCK_N": 128, "BLOCK_K": 32, "num_warps": 8, "num_stages": 2, "time_ms": 1.9351359605789185, "status": "ok"}
{"N": 262144, "K": 256, "D": 128, "B": 32, "dtype": "fp16", "BLOCK_N": 128, "BLOCK_K": 32, "num_warps": 8, "num_stages": 4, "time_ms": 1.9942400455474854, "status": "ok"}
{"N": 262144, "K": 256, "D": 128, "B": 32, "dtype": "fp16", "BLOCK_N": 128, "BLOCK_K": 64, "num_warps": 4, "num_stages": 1, "time_ms": 1.6824960112571716, "status": "ok"}
{"N": 262144, "K": 256, "D": 128, "B": 32, "dtype": "fp16", "BLOCK_N": 128, "BLOCK_K": 64, "num_warps": 4, "num_stages": 2, "time_ms": 1.7371839880943298, "status": "ok"}
{"N": 262144, "K": 256, "D": 128, "B": 32, "dtype": "fp16", "BLOCK_N": 128, "BLOCK_K": 64, "num_warps": 4, "num_stages": 4, "time_ms": 1.9407680034637451, "status": "ok"}
{"N": 262144, "K": 256, "D": 128, "B": 32, "dtype": "fp16", "BLOCK_N": 128, "BLOCK_K": 64, "num_warps": 8, "num_stages": 1, "time_ms": 1.7695040106773376, "status": "ok"}
{"N": 262144, "K": 256, "D": 128, "B": 32, "dtype": "fp16", "BLOCK_N": 128, "BLOCK_K": 64, "num_warps": 8, "num_stages": 2, "time_ms": 1.755407989025116, "status": "ok"}
{"N": 262144, "K": 256, "D": 128, "B": 32, "dtype": "fp16", "BLOCK_N": 128, "BLOCK_K": 64, "num_warps": 8, "num_stages": 4, "time_ms": 1.8612639904022217, "status": "ok"}
{"N": 262144, "K": 256, "D": 128, "B": 32, "dtype": "fp16", "BLOCK_N": 128, "BLOCK_K": 128, "num_warps": 4, "num_stages": 1, "time_ms": 2.0089598894119263, "status": "ok"}
{"N": 262144, "K": 256, "D": 128, "B": 32, "dtype": "fp16", "BLOCK_N": 128, "BLOCK_K": 128, "num_warps": 4, "num_stages": 2, "time_ms": 1.768880009651184, "status": "ok"}
{"N": 262144, "K": 256, "D": 128, "B": 32, "dtype": "fp16", "BLOCK_N": 128, "BLOCK_K": 128, "num_warps": 4, "num_stages": 4, "time_ms": 2.7088959217071533, "status": "ok"}
{"N": 262144, "K": 256, "D": 128, "B": 32, "dtype": "fp16", "BLOCK_N": 128, "BLOCK_K": 128, "num_warps": 8, "num_stages": 1, "time_ms": 2.866879940032959, "status": "ok"}
{"N": 262144, "K": 256, "D": 128, "B": 32, "dtype": "fp16", "BLOCK_N": 128, "BLOCK_K": 128, "num_warps": 8, "num_stages": 2, "time_ms": 2.5952000617980957, "status": "ok"}
{"N": 262144, "K": 256, "D": 128, "B": 32, "dtype": "fp16", "BLOCK_N": 128, "BLOCK_K": 128, "num_warps": 8, "num_stages": 4, "time_ms": 2.576512098312378, "status": "ok"}
{"summary": true, "N": 262144, "K": 256, "D": 128, "B": 32, "dtype": "fp16", "best": {"N": 262144, "K": 256, "D": 128, "B": 32, "dtype": "fp16", "BLOCK_N": 128, "BLOCK_K": 64, "num_warps": 4, "num_stages": 1, "time_ms": 1.6824960112571716, "status": "ok"}, "best_time_ms": 1.6824960112571716, "tuning_seconds": 15.245615482330322, "skipped": 0}
