grid_results_h100/N262144_K200000_D128_B32_fp16.jsonl
{"N": 262144, "K": 200000, "D": 128, "B": 32, "dtype": "fp16", "BLOCK_N": 32, "BLOCK_K": 32, "num_warps": 4, "num_stages": 1, "time_ms": 3945.2470703125, "status": "ok"}
{"N": 262144, "K": 200000, "D": 128, "B": 32, "dtype": "fp16", "BLOCK_N": 32, "BLOCK_K": 32, "num_warps": 4, "num_stages": 2, "time_ms": 3211.27587890625, "status": "ok"}
{"N": 262144, "K": 200000, "D": 128, "B": 32, "dtype": "fp16", "BLOCK_N": 32, "BLOCK_K": 32, "num_warps": 4, "num_stages": 4, "time_ms": 3215.5966796875, "status": "ok"}
{"N": 262144, "K": 200000, "D": 128, "B": 32, "dtype": "fp16", "BLOCK_N": 32, "BLOCK_K": 32, "num_warps": 8, "num_stages": 1, "time_ms": 5909.189453125, "status": "ok"}
{"N": 262144, "K": 200000, "D": 128, "B": 32, "dtype": "fp16", "BLOCK_N": 32, "BLOCK_K": 32, "num_warps": 8, "num_stages": 2, "time_ms": 5258.2197265625, "status": "ok"}
{"N": 262144, "K": 200000, "D": 128, "B": 32, "dtype": "fp16", "BLOCK_N": 32, "BLOCK_K": 32, "num_warps": 8, "num_stages": 4, "time_ms": 5184.6572265625, "status": "ok"}
{"N": 262144, "K": 200000, "D": 128, "B": 32, "dtype": "fp16", "BLOCK_N": 32, "BLOCK_K": 64, "num_warps": 4, "num_stages": 1, "time_ms": 3348.205322265625, "status": "ok"}
{"N": 262144, "K": 200000, "D": 128, "B": 32, "dtype": "fp16", "BLOCK_N": 32, "BLOCK_K": 64, "num_warps": 4, "num_stages": 2, "time_ms": 2779.073974609375, "status": "ok"}
{"N": 262144, "K": 200000, "D": 128, "B": 32, "dtype": "fp16", "BLOCK_N": 32, "BLOCK_K": 64, "num_warps": 4, "num_stages": 4, "time_ms": 2877.095947265625, "status": "ok"}
{"N": 262144, "K": 200000, "D": 128, "B": 32, "dtype": "fp16", "BLOCK_N": 32, "BLOCK_K": 64, "num_warps": 8, "num_stages": 1, "time_ms": 4131.26611328125, "status": "ok"}
{"N": 262144, "K": 200000, "D": 128, "B": 32, "dtype": "fp16", "BLOCK_N": 32, "BLOCK_K": 64, "num_warps": 8, "num_stages": 2, "time_ms": 3437.605224609375, "status": "ok"}
{"N": 262144, "K": 200000, "D": 128, "B": 32, "dtype": "fp16", "BLOCK_N": 32, "BLOCK_K": 64, "num_warps": 8, "num_stages": 4, "time_ms": 3401.15087890625, "status": "ok"}
{"N": 262144, "K": 200000, "D": 128, "B": 32, "dtype": "fp16", "BLOCK_N": 32, "BLOCK_K": 128, "num_warps": 4, "num_stages": 1, "time_ms": 2783.59326171875, "status": "ok"}
{"N": 262144, "K": 200000, "D": 128, "B": 32, "dtype": "fp16", "BLOCK_N": 32, "BLOCK_K": 128, "num_warps": 4, "num_stages": 2, "time_ms": 2434.377197265625, "status": "ok"}
{"N": 262144, "K": 200000, "D": 128, "B": 32, "dtype": "fp16", "BLOCK_N": 32, "BLOCK_K": 128, "num_warps": 4, "num_stages": 4, "time_ms": 2485.3857421875, "status": "ok"}
{"N": 262144, "K": 200000, "D": 128, "B": 32, "dtype": "fp16", "BLOCK_N": 32, "BLOCK_K": 128, "num_warps": 8, "num_stages": 1, "time_ms": 3698.21337890625, "status": "ok"}
{"N": 262144, "K": 200000, "D": 128, "B": 32, "dtype": "fp16", "BLOCK_N": 32, "BLOCK_K": 128, "num_warps": 8, "num_stages": 2, "time_ms": 3132.365234375, "status": "ok"}
{"N": 262144, "K": 200000, "D": 128, "B": 32, "dtype": "fp16", "BLOCK_N": 32, "BLOCK_K": 128, "num_warps": 8, "num_stages": 4, "time_ms": 3191.695556640625, "status": "ok"}
{"N": 262144, "K": 200000, "D": 128, "B": 32, "dtype": "fp16", "BLOCK_N": 64, "BLOCK_K": 32, "num_warps": 4, "num_stages": 1, "time_ms": 1698.6077880859375, "status": "ok"}
{"N": 262144, "K": 200000, "D": 128, "B": 32, "dtype": "fp16", "BLOCK_N": 64, "BLOCK_K": 32, "num_warps": 4, "num_stages": 2, "time_ms": 1444.343994140625, "status": "ok"}
{"N": 262144, "K": 200000, "D": 128, "B": 32, "dtype": "fp16", "BLOCK_N": 64, "BLOCK_K": 32, "num_warps": 4, "num_stages": 4, "time_ms": 1465.568603515625, "status": "ok"}
{"N": 262144, "K": 200000, "D": 128, "B": 32, "dtype": "fp16", "BLOCK_N": 64, "BLOCK_K": 32, "num_warps": 8, "num_stages": 1, "time_ms": 2838.282470703125, "status": "ok"}
{"N": 262144, "K": 200000, "D": 128, "B": 32, "dtype": "fp16", "BLOCK_N": 64, "BLOCK_K": 32, "num_warps": 8, "num_stages": 2, "time_ms": 2469.670166015625, "status": "ok"}
{"N": 262144, "K": 200000, "D": 128, "B": 32, "dtype": "fp16", "BLOCK_N": 64, "BLOCK_K": 32, "num_warps": 8, "num_stages": 4, "time_ms": 2478.0087890625, "status": "ok"}
{"N": 262144, "K": 200000, "D": 128, "B": 32, "dtype": "fp16", "BLOCK_N": 64, "BLOCK_K": 64, "num_warps": 4, "num_stages": 1, "time_ms": 1417.077880859375, "status": "ok"}
{"N": 262144, "K": 200000, "D": 128, "B": 32, "dtype": "fp16", "BLOCK_N": 64, "BLOCK_K": 64, "num_warps": 4, "num_stages": 2, "time_ms": 1298.620849609375, "status": "ok"}
{"N": 262144, "K": 200000, "D": 128, "B": 32, "dtype": "fp16", "BLOCK_N": 64, "BLOCK_K": 64, "num_warps": 4, "num_stages": 4, "time_ms": 1568.88134765625, "status": "ok"}
{"N": 262144, "K": 200000, "D": 128, "B": 32, "dtype": "fp16", "BLOCK_N": 64, "BLOCK_K": 64, "num_warps": 8, "num_stages": 1, "time_ms": 2037.51318359375, "status": "ok"}
{"N": 262144, "K": 200000, "D": 128, "B": 32, "dtype": "fp16", "BLOCK_N": 64, "BLOCK_K": 64, "num_warps": 8, "num_stages": 2, "time_ms": 1785.58544921875, "status": "ok"}
{"N": 262144, "K": 200000, "D": 128, "B": 32, "dtype": "fp16", "BLOCK_N": 64, "BLOCK_K": 64, "num_warps": 8, "num_stages": 4, "time_ms": 1966.3201904296875, "status": "ok"}
{"N": 262144, "K": 200000, "D": 128, "B": 32, "dtype": "fp16", "BLOCK_N": 64, "BLOCK_K": 128, "num_warps": 4, "num_stages": 1, "time_ms": 1440.02978515625, "status": "ok"}
{"N": 262144, "K": 200000, "D": 128, "B": 32, "dtype": "fp16", "BLOCK_N": 64, "BLOCK_K": 128, "num_warps": 4, "num_stages": 2, "time_ms": 1409.115966796875, "status": "ok"}
{"N": 262144, "K": 200000, "D": 128, "B": 32, "dtype": "fp16", "BLOCK_N": 64, "BLOCK_K": 128, "num_warps": 4, "num_stages": 4, "time_ms": 1901.441650390625, "status": "ok"}
{"N": 262144, "K": 200000, "D": 128, "B": 32, "dtype": "fp16", "BLOCK_N": 64, "BLOCK_K": 128, "num_warps": 8, "num_stages": 1, "time_ms": 2023.7708740234375, "status": "ok"}
{"N": 262144, "K": 200000, "D": 128, "B": 32, "dtype": "fp16", "BLOCK_N": 64, "BLOCK_K": 128, "num_warps": 8, "num_stages": 2, "time_ms": 1837.10107421875, "status": "ok"}
{"N": 262144, "K": 200000, "D": 128, "B": 32, "dtype": "fp16", "BLOCK_N": 64, "BLOCK_K": 128, "num_warps": 8, "num_stages": 4, "time_ms": 2253.543701171875, "status": "ok"}
{"N": 262144, "K": 200000, "D": 128, "B": 32, "dtype": "fp16", "BLOCK_N": 128, "BLOCK_K": 32, "num_warps": 4, "num_stages": 1, "time_ms": 1417.694091796875, "status": "ok"}
{"N": 262144, "K": 200000, "D": 128, "B": 32, "dtype": "fp16", "BLOCK_N": 128, "BLOCK_K": 32, "num_warps": 4, "num_stages": 2, "time_ms": 1420.5372314453125, "status": "ok"}
{"N": 262144, "K": 200000, "D": 128, "B": 32, "dtype": "fp16", "BLOCK_N": 128, "BLOCK_K": 32, "num_warps": 4, "num_stages": 4, "time_ms": 1460.6837158203125, "status": "ok"}
{"N": 262144, "K": 200000, "D": 128, "B": 32, "dtype": "fp16", "BLOCK_N": 128, "BLOCK_K": 32, "num_warps": 8, "num_stages": 1, "time_ms": 1446.4632568359375, "status": "ok"}
{"N": 262144, "K": 200000, "D": 128, "B": 32, "dtype": "fp16", "BLOCK_N": 128, "BLOCK_K": 32, "num_warps": 8, "num_stages": 2, "time_ms": 1413.5836181640625, "status": "ok"}
{"N": 262144, "K": 200000, "D": 128, "B": 32, "dtype": "fp16", "BLOCK_N": 128, "BLOCK_K": 32, "num_warps": 8, "num_stages": 4, "time_ms": 1464.427734375, "status": "ok"}
{"N": 262144, "K": 200000, "D": 128, "B": 32, "dtype": "fp16", "BLOCK_N": 128, "BLOCK_K": 64, "num_warps": 4, "num_stages": 1, "time_ms": 1262.5157470703125, "status": "ok"}
{"N": 262144, "K": 200000, "D": 128, "B": 32, "dtype": "fp16", "BLOCK_N": 128, "BLOCK_K": 64, "num_warps": 4, "num_stages": 2, "time_ms": 1237.896240234375, "status": "ok"}
{"N": 262144, "K": 200000, "D": 128, "B": 32, "dtype": "fp16", "BLOCK_N": 128, "BLOCK_K": 64, "num_warps": 4, "num_stages": 4, "time_ms": 1233.7791748046875, "status": "ok"}
{"N": 262144, "K": 200000, "D": 128, "B": 32, "dtype": "fp16", "BLOCK_N": 128, "BLOCK_K": 64, "num_warps": 8, "num_stages": 1, "time_ms": 1286.7064208984375, "status": "ok"}
{"N": 262144, "K": 200000, "D": 128, "B": 32, "dtype": "fp16", "BLOCK_N": 128, "BLOCK_K": 64, "num_warps": 8, "num_stages": 2, "time_ms": 1257.4154052734375, "status": "ok"}
{"N": 262144, "K": 200000, "D": 128, "B": 32, "dtype": "fp16", "BLOCK_N": 128, "BLOCK_K": 64, "num_warps": 8, "num_stages": 4, "time_ms": 1263.901123046875, "status": "ok"}
{"N": 262144, "K": 200000, "D": 128, "B": 32, "dtype": "fp16", "BLOCK_N": 128, "BLOCK_K": 128, "num_warps": 4, "num_stages": 1, "time_ms": 1443.6446533203125, "status": "ok"}
{"N": 262144, "K": 200000, "D": 128, "B": 32, "dtype": "fp16", "BLOCK_N": 128, "BLOCK_K": 128, "num_warps": 4, "num_stages": 2, "time_ms": 1285.1827392578125, "status": "ok"}
{"N": 262144, "K": 200000, "D": 128, "B": 32, "dtype": "fp16", "BLOCK_N": 128, "BLOCK_K": 128, "num_warps": 4, "num_stages": 4, "time_ms": 1412.7628173828125, "status": "ok"}
{"N": 262144, "K": 200000, "D": 128, "B": 32, "dtype": "fp16", "BLOCK_N": 128, "BLOCK_K": 128, "num_warps": 8, "num_stages": 1, "time_ms": 2170.285400390625, "status": "ok"}
{"N": 262144, "K": 200000, "D": 128, "B": 32, "dtype": "fp16", "BLOCK_N": 128, "BLOCK_K": 128, "num_warps": 8, "num_stages": 2, "time_ms": 1828.81591796875, "status": "ok"}
{"N": 262144, "K": 200000, "D": 128, "B": 32, "dtype": "fp16", "BLOCK_N": 128, "BLOCK_K": 128, "num_warps": 8, "num_stages": 4, "time_ms": 1495.2259521484375, "status": "ok"}
{"summary": true, "N": 262144, "K": 200000, "D": 128, "B": 32, "dtype": "fp16", "best": {"N": 262144, "K": 200000, "D": 128, "B": 32, "dtype": "fp16", "BLOCK_N": 128, "BLOCK_K": 64, "num_warps": 4, "num_stages": 4, "time_ms": 1233.7791748046875, "status": "ok"}, "best_time_ms": 1233.7791748046875, "tuning_seconds": 1003.370866060257, "skipped": 0}
