grid_results_h100/N65536_K65536_D128_B1_fp16.jsonl
{"N": 65536, "K": 65536, "D": 128, "B": 1, "dtype": "fp16", "BLOCK_N": 32, "BLOCK_K": 32, "num_warps": 4, "num_stages": 1, "time_ms": 10.674112319946289, "status": "ok"}
{"N": 65536, "K": 65536, "D": 128, "B": 1, "dtype": "fp16", "BLOCK_N": 32, "BLOCK_K": 32, "num_warps": 4, "num_stages": 2, "time_ms": 8.828512191772461, "status": "ok"}
{"N": 65536, "K": 65536, "D": 128, "B": 1, "dtype": "fp16", "BLOCK_N": 32, "BLOCK_K": 32, "num_warps": 4, "num_stages": 4, "time_ms": 8.679007530212402, "status": "ok"}
{"N": 65536, "K": 65536, "D": 128, "B": 1, "dtype": "fp16", "BLOCK_N": 32, "BLOCK_K": 32, "num_warps": 8, "num_stages": 1, "time_ms": 16.081119537353516, "status": "ok"}
{"N": 65536, "K": 65536, "D": 128, "B": 1, "dtype": "fp16", "BLOCK_N": 32, "BLOCK_K": 32, "num_warps": 8, "num_stages": 2, "time_ms": 14.5316801071167, "status": "ok"}
{"N": 65536, "K": 65536, "D": 128, "B": 1, "dtype": "fp16", "BLOCK_N": 32, "BLOCK_K": 32, "num_warps": 8, "num_stages": 4, "time_ms": 14.05081558227539, "status": "ok"}
{"N": 65536, "K": 65536, "D": 128, "B": 1, "dtype": "fp16", "BLOCK_N": 32, "BLOCK_K": 64, "num_warps": 4, "num_stages": 1, "time_ms": 9.019935607910156, "status": "ok"}
{"N": 65536, "K": 65536, "D": 128, "B": 1, "dtype": "fp16", "BLOCK_N": 32, "BLOCK_K": 64, "num_warps": 4, "num_stages": 2, "time_ms": 7.116896152496338, "status": "ok"}
{"N": 65536, "K": 65536, "D": 128, "B": 1, "dtype": "fp16", "BLOCK_N": 32, "BLOCK_K": 64, "num_warps": 4, "num_stages": 4, "time_ms": 8.266336441040039, "status": "ok"}
{"N": 65536, "K": 65536, "D": 128, "B": 1, "dtype": "fp16", "BLOCK_N": 32, "BLOCK_K": 64, "num_warps": 8, "num_stages": 1, "time_ms": 11.11894416809082, "status": "ok"}
{"N": 65536, "K": 65536, "D": 128, "B": 1, "dtype": "fp16", "BLOCK_N": 32, "BLOCK_K": 64, "num_warps": 8, "num_stages": 2, "time_ms": 9.322208404541016, "status": "ok"}
{"N": 65536, "K": 65536, "D": 128, "B": 1, "dtype": "fp16", "BLOCK_N": 32, "BLOCK_K": 64, "num_warps": 8, "num_stages": 4, "time_ms": 9.292160034179688, "status": "ok"}
{"N": 65536, "K": 65536, "D": 128, "B": 1, "dtype": "fp16", "BLOCK_N": 32, "BLOCK_K": 128, "num_warps": 4, "num_stages": 1, "time_ms": 7.309120178222656, "status": "ok"}
{"N": 65536, "K": 65536, "D": 128, "B": 1, "dtype": "fp16", "BLOCK_N": 32, "BLOCK_K": 128, "num_warps": 4, "num_stages": 2, "time_ms": 5.681888103485107, "status": "ok"}
{"N": 65536, "K": 65536, "D": 128, "B": 1, "dtype": "fp16", "BLOCK_N": 32, "BLOCK_K": 128, "num_warps": 4, "num_stages": 4, "time_ms": 7.006720066070557, "status": "ok"}
{"N": 65536, "K": 65536, "D": 128, "B": 1, "dtype": "fp16", "BLOCK_N": 32, "BLOCK_K": 128, "num_warps": 8, "num_stages": 1, "time_ms": 9.81811237335205, "status": "ok"}
{"N": 65536, "K": 65536, "D": 128, "B": 1, "dtype": "fp16", "BLOCK_N": 32, "BLOCK_K": 128, "num_warps": 8, "num_stages": 2, "time_ms": 8.451359748840332, "status": "ok"}
{"N": 65536, "K": 65536, "D": 128, "B": 1, "dtype": "fp16", "BLOCK_N": 32, "BLOCK_K": 128, "num_warps": 8, "num_stages": 4, "time_ms": 8.325471878051758, "status": "ok"}
{"N": 65536, "K": 65536, "D": 128, "B": 1, "dtype": "fp16", "BLOCK_N": 64, "BLOCK_K": 32, "num_warps": 4, "num_stages": 1, "time_ms": 4.302688121795654, "status": "ok"}
{"N": 65536, "K": 65536, "D": 128, "B": 1, "dtype": "fp16", "BLOCK_N": 64, "BLOCK_K": 32, "num_warps": 4, "num_stages": 2, "time_ms": 4.426815986633301, "status": "ok"}
{"N": 65536, "K": 65536, "D": 128, "B": 1, "dtype": "fp16", "BLOCK_N": 64, "BLOCK_K": 32, "num_warps": 4, "num_stages": 4, "time_ms": 3.7536959648132324, "status": "ok"}
{"N": 65536, "K": 65536, "D": 128, "B": 1, "dtype": "fp16", "BLOCK_N": 64, "BLOCK_K": 32, "num_warps": 8, "num_stages": 1, "time_ms": 7.837120056152344, "status": "ok"}
{"N": 65536, "K": 65536, "D": 128, "B": 1, "dtype": "fp16", "BLOCK_N": 64, "BLOCK_K": 32, "num_warps": 8, "num_stages": 2, "time_ms": 6.898335933685303, "status": "ok"}
{"N": 65536, "K": 65536, "D": 128, "B": 1, "dtype": "fp16", "BLOCK_N": 64, "BLOCK_K": 32, "num_warps": 8, "num_stages": 4, "time_ms": 6.859551906585693, "status": "ok"}
{"N": 65536, "K": 65536, "D": 128, "B": 1, "dtype": "fp16", "BLOCK_N": 64, "BLOCK_K": 64, "num_warps": 4, "num_stages": 1, "time_ms": 3.5957438945770264, "status": "ok"}
{"N": 65536, "K": 65536, "D": 128, "B": 1, "dtype": "fp16", "BLOCK_N": 64, "BLOCK_K": 64, "num_warps": 4, "num_stages": 2, "time_ms": 3.365823984146118, "status": "ok"}
{"N": 65536, "K": 65536, "D": 128, "B": 1, "dtype": "fp16", "BLOCK_N": 64, "BLOCK_K": 64, "num_warps": 4, "num_stages": 4, "time_ms": 3.4118080139160156, "status": "ok"}
{"N": 65536, "K": 65536, "D": 128, "B": 1, "dtype": "fp16", "BLOCK_N": 64, "BLOCK_K": 64, "num_warps": 8, "num_stages": 1, "time_ms": 5.5070719718933105, "status": "ok"}
{"N": 65536, "K": 65536, "D": 128, "B": 1, "dtype": "fp16", "BLOCK_N": 64, "BLOCK_K": 64, "num_warps": 8, "num_stages": 2, "time_ms": 4.871103763580322, "status": "ok"}
{"N": 65536, "K": 65536, "D": 128, "B": 1, "dtype": "fp16", "BLOCK_N": 64, "BLOCK_K": 64, "num_warps": 8, "num_stages": 4, "time_ms": 5.365920066833496, "status": "ok"}
{"N": 65536, "K": 65536, "D": 128, "B": 1, "dtype": "fp16", "BLOCK_N": 64, "BLOCK_K": 128, "num_warps": 4, "num_stages": 1, "time_ms": 3.175584077835083, "status": "ok"}
{"N": 65536, "K": 65536, "D": 128, "B": 1, "dtype": "fp16", "BLOCK_N": 64, "BLOCK_K": 128, "num_warps": 4, "num_stages": 2, "time_ms": 3.269792079925537, "status": "ok"}
{"N": 65536, "K": 65536, "D": 128, "B": 1, "dtype": "fp16", "BLOCK_N": 64, "BLOCK_K": 128, "num_warps": 4, "num_stages": 4, "time_ms": 4.162784099578857, "status": "ok"}
{"N": 65536, "K": 65536, "D": 128, "B": 1, "dtype": "fp16", "BLOCK_N": 64, "BLOCK_K": 128, "num_warps": 8, "num_stages": 1, "time_ms": 5.1905598640441895, "status": "ok"}
{"N": 65536, "K": 65536, "D": 128, "B": 1, "dtype": "fp16", "BLOCK_N": 64, "BLOCK_K": 128, "num_warps": 8, "num_stages": 2, "time_ms": 4.368639945983887, "status": "ok"}
{"N": 65536, "K": 65536, "D": 128, "B": 1, "dtype": "fp16", "BLOCK_N": 64, "BLOCK_K": 128, "num_warps": 8, "num_stages": 4, "time_ms": 5.008096218109131, "status": "ok"}
{"N": 65536, "K": 65536, "D": 128, "B": 1, "dtype": "fp16", "BLOCK_N": 128, "BLOCK_K": 32, "num_warps": 4, "num_stages": 1, "time_ms": 3.879551887512207, "status": "ok"}
{"N": 65536, "K": 65536, "D": 128, "B": 1, "dtype": "fp16", "BLOCK_N": 128, "BLOCK_K": 32, "num_warps": 4, "num_stages": 2, "time_ms": 4.035327911376953, "status": "ok"}
{"N": 65536, "K": 65536, "D": 128, "B": 1, "dtype": "fp16", "BLOCK_N": 128, "BLOCK_K": 32, "num_warps": 4, "num_stages": 4, "time_ms": 3.995743989944458, "status": "ok"}
{"N": 65536, "K": 65536, "D": 128, "B": 1, "dtype": "fp16", "BLOCK_N": 128, "BLOCK_K": 32, "num_warps": 8, "num_stages": 1, "time_ms": 3.8474559783935547, "status": "ok"}
{"N": 65536, "K": 65536, "D": 128, "B": 1, "dtype": "fp16", "BLOCK_N": 128, "BLOCK_K": 32, "num_warps": 8, "num_stages": 2, "time_ms": 3.9120640754699707, "status": "ok"}
{"N": 65536, "K": 65536, "D": 128, "B": 1, "dtype": "fp16", "BLOCK_N": 128, "BLOCK_K": 32, "num_warps": 8, "num_stages": 4, "time_ms": 3.8464319705963135, "status": "ok"}
{"N": 65536, "K": 65536, "D": 128, "B": 1, "dtype": "fp16", "BLOCK_N": 128, "BLOCK_K": 64, "num_warps": 4, "num_stages": 1, "time_ms": 3.3415679931640625, "status": "ok"}
{"N": 65536, "K": 65536, "D": 128, "B": 1, "dtype": "fp16", "BLOCK_N": 128, "BLOCK_K": 64, "num_warps": 4, "num_stages": 2, "time_ms": 3.381824016571045, "status": "ok"}
{"N": 65536, "K": 65536, "D": 128, "B": 1, "dtype": "fp16", "BLOCK_N": 128, "BLOCK_K": 64, "num_warps": 4, "num_stages": 4, "time_ms": 3.160543918609619, "status": "ok"}
{"N": 65536, "K": 65536, "D": 128, "B": 1, "dtype": "fp16", "BLOCK_N": 128, "BLOCK_K": 64, "num_warps": 8, "num_stages": 1, "time_ms": 3.6468799114227295, "status": "ok"}
{"N": 65536, "K": 65536, "D": 128, "B": 1, "dtype": "fp16", "BLOCK_N": 128, "BLOCK_K": 64, "num_warps": 8, "num_stages": 2, "time_ms": 3.4238719940185547, "status": "ok"}
{"N": 65536, "K": 65536, "D": 128, "B": 1, "dtype": "fp16", "BLOCK_N": 128, "BLOCK_K": 64, "num_warps": 8, "num_stages": 4, "time_ms": 3.221951961517334, "status": "ok"}
{"N": 65536, "K": 65536, "D": 128, "B": 1, "dtype": "fp16", "BLOCK_N": 128, "BLOCK_K": 128, "num_warps": 4, "num_stages": 1, "time_ms": 3.2845120429992676, "status": "ok"}
{"N": 65536, "K": 65536, "D": 128, "B": 1, "dtype": "fp16", "BLOCK_N": 128, "BLOCK_K": 128, "num_warps": 4, "num_stages": 2, "time_ms": 3.128159999847412, "status": "ok"}
{"N": 65536, "K": 65536, "D": 128, "B": 1, "dtype": "fp16", "BLOCK_N": 128, "BLOCK_K": 128, "num_warps": 4, "num_stages": 4, "time_ms": 3.580512046813965, "status": "ok"}
{"N": 65536, "K": 65536, "D": 128, "B": 1, "dtype": "fp16", "BLOCK_N": 128, "BLOCK_K": 128, "num_warps": 8, "num_stages": 1, "time_ms": 4.8937602043151855, "status": "ok"}
{"N": 65536, "K": 65536, "D": 128, "B": 1, "dtype": "fp16", "BLOCK_N": 128, "BLOCK_K": 128, "num_warps": 8, "num_stages": 2, "time_ms": 3.140255928039551, "status": "ok"}
{"N": 65536, "K": 65536, "D": 128, "B": 1, "dtype": "fp16", "BLOCK_N": 128, "BLOCK_K": 128, "num_warps": 8, "num_stages": 4, "time_ms": 3.527872085571289, "status": "ok"}
{"summary": true, "N": 65536, "K": 65536, "D": 128, "B": 1, "dtype": "fp16", "best": {"N": 65536, "K": 65536, "D": 128, "B": 1, "dtype": "fp16", "BLOCK_N": 128, "BLOCK_K": 128, "num_warps": 4, "num_stages": 2, "time_ms": 3.128159999847412, "status": "ok"}, "best_time_ms": 3.128159999847412, "tuning_seconds": 16.575425386428833, "skipped": 0}
