grid_results_h100/N65536_K200000_D64_B32_fp16.jsonl
{"N": 65536, "K": 200000, "D": 64, "B": 32, "dtype": "fp16", "BLOCK_N": 32, "BLOCK_K": 32, "num_warps": 4, "num_stages": 1, "time_ms": 637.6599731445312, "status": "ok"}
{"N": 65536, "K": 200000, "D": 64, "B": 32, "dtype": "fp16", "BLOCK_N": 32, "BLOCK_K": 32, "num_warps": 4, "num_stages": 2, "time_ms": 564.9300537109375, "status": "ok"}
{"N": 65536, "K": 200000, "D": 64, "B": 32, "dtype": "fp16", "BLOCK_N": 32, "BLOCK_K": 32, "num_warps": 4, "num_stages": 4, "time_ms": 555.622314453125, "status": "ok"}
{"N": 65536, "K": 200000, "D": 64, "B": 32, "dtype": "fp16", "BLOCK_N": 32, "BLOCK_K": 32, "num_warps": 8, "num_stages": 1, "time_ms": 1033.270751953125, "status": "ok"}
{"N": 65536, "K": 200000, "D": 64, "B": 32, "dtype": "fp16", "BLOCK_N": 32, "BLOCK_K": 32, "num_warps": 8, "num_stages": 2, "time_ms": 976.6405639648438, "status": "ok"}
{"N": 65536, "K": 200000, "D": 64, "B": 32, "dtype": "fp16", "BLOCK_N": 32, "BLOCK_K": 32, "num_warps": 8, "num_stages": 4, "time_ms": 949.6356811523438, "status": "ok"}
{"N": 65536, "K": 200000, "D": 64, "B": 32, "dtype": "fp16", "BLOCK_N": 32, "BLOCK_K": 64, "num_warps": 4, "num_stages": 1, "time_ms": 546.67578125, "status": "ok"}
{"N": 65536, "K": 200000, "D": 64, "B": 32, "dtype": "fp16", "BLOCK_N": 32, "BLOCK_K": 64, "num_warps": 4, "num_stages": 2, "time_ms": 481.1497802734375, "status": "ok"}
{"N": 65536, "K": 200000, "D": 64, "B": 32, "dtype": "fp16", "BLOCK_N": 32, "BLOCK_K": 64, "num_warps": 4, "num_stages": 4, "time_ms": 457.66845703125, "status": "ok"}
{"N": 65536, "K": 200000, "D": 64, "B": 32, "dtype": "fp16", "BLOCK_N": 32, "BLOCK_K": 64, "num_warps": 8, "num_stages": 1, "time_ms": 663.2007446289062, "status": "ok"}
{"N": 65536, "K": 200000, "D": 64, "B": 32, "dtype": "fp16", "BLOCK_N": 32, "BLOCK_K": 64, "num_warps": 8, "num_stages": 2, "time_ms": 619.9996948242188, "status": "ok"}
{"N": 65536, "K": 200000, "D": 64, "B": 32, "dtype": "fp16", "BLOCK_N": 32, "BLOCK_K": 64, "num_warps": 8, "num_stages": 4, "time_ms": 597.2421264648438, "status": "ok"}
{"N": 65536, "K": 200000, "D": 64, "B": 32, "dtype": "fp16", "BLOCK_N": 32, "BLOCK_K": 128, "num_warps": 4, "num_stages": 1, "time_ms": 442.135986328125, "status": "ok"}
{"N": 65536, "K": 200000, "D": 64, "B": 32, "dtype": "fp16", "BLOCK_N": 32, "BLOCK_K": 128, "num_warps": 4, "num_stages": 2, "time_ms": 407.94232177734375, "status": "ok"}
{"N": 65536, "K": 200000, "D": 64, "B": 32, "dtype": "fp16", "BLOCK_N": 32, "BLOCK_K": 128, "num_warps": 4, "num_stages": 4, "time_ms": 412.80963134765625, "status": "ok"}
{"N": 65536, "K": 200000, "D": 64, "B": 32, "dtype": "fp16", "BLOCK_N": 32, "BLOCK_K": 128, "num_warps": 8, "num_stages": 1, "time_ms": 721.0139770507812, "status": "ok"}
{"N": 65536, "K": 200000, "D": 64, "B": 32, "dtype": "fp16", "BLOCK_N": 32, "BLOCK_K": 128, "num_warps": 8, "num_stages": 2, "time_ms": 575.4193725585938, "status": "ok"}
{"N": 65536, "K": 200000, "D": 64, "B": 32, "dtype": "fp16", "BLOCK_N": 32, "BLOCK_K": 128, "num_warps": 8, "num_stages": 4, "time_ms": 560.4949340820312, "status": "ok"}
{"N": 65536, "K": 200000, "D": 64, "B": 32, "dtype": "fp16", "BLOCK_N": 64, "BLOCK_K": 32, "num_warps": 4, "num_stages": 1, "time_ms": 283.2181701660156, "status": "ok"}
{"N": 65536, "K": 200000, "D": 64, "B": 32, "dtype": "fp16", "BLOCK_N": 64, "BLOCK_K": 32, "num_warps": 4, "num_stages": 2, "time_ms": 277.81707763671875, "status": "ok"}
{"N": 65536, "K": 200000, "D": 64, "B": 32, "dtype": "fp16", "BLOCK_N": 64, "BLOCK_K": 32, "num_warps": 4, "num_stages": 4, "time_ms": 277.14093017578125, "status": "ok"}
{"N": 65536, "K": 200000, "D": 64, "B": 32, "dtype": "fp16", "BLOCK_N": 64, "BLOCK_K": 32, "num_warps": 8, "num_stages": 1, "time_ms": 514.6676025390625, "status": "ok"}
{"N": 65536, "K": 200000, "D": 64, "B": 32, "dtype": "fp16", "BLOCK_N": 64, "BLOCK_K": 32, "num_warps": 8, "num_stages": 2, "time_ms": 487.5801696777344, "status": "ok"}
{"N": 65536, "K": 200000, "D": 64, "B": 32, "dtype": "fp16", "BLOCK_N": 64, "BLOCK_K": 32, "num_warps": 8, "num_stages": 4, "time_ms": 474.8497619628906, "status": "ok"}
{"N": 65536, "K": 200000, "D": 64, "B": 32, "dtype": "fp16", "BLOCK_N": 64, "BLOCK_K": 64, "num_warps": 4, "num_stages": 1, "time_ms": 268.6693420410156, "status": "ok"}
{"N": 65536, "K": 200000, "D": 64, "B": 32, "dtype": "fp16", "BLOCK_N": 64, "BLOCK_K": 64, "num_warps": 4, "num_stages": 2, "time_ms": 243.7526397705078, "status": "ok"}
{"N": 65536, "K": 200000, "D": 64, "B": 32, "dtype": "fp16", "BLOCK_N": 64, "BLOCK_K": 64, "num_warps": 4, "num_stages": 4, "time_ms": 242.78338623046875, "status": "ok"}
{"N": 65536, "K": 200000, "D": 64, "B": 32, "dtype": "fp16", "BLOCK_N": 64, "BLOCK_K": 64, "num_warps": 8, "num_stages": 1, "time_ms": 367.68682861328125, "status": "ok"}
{"N": 65536, "K": 200000, "D": 64, "B": 32, "dtype": "fp16", "BLOCK_N": 64, "BLOCK_K": 64, "num_warps": 8, "num_stages": 2, "time_ms": 351.6178894042969, "status": "ok"}
{"N": 65536, "K": 200000, "D": 64, "B": 32, "dtype": "fp16", "BLOCK_N": 64, "BLOCK_K": 64, "num_warps": 8, "num_stages": 4, "time_ms": 343.3384094238281, "status": "ok"}
{"N": 65536, "K": 200000, "D": 64, "B": 32, "dtype": "fp16", "BLOCK_N": 64, "BLOCK_K": 128, "num_warps": 4, "num_stages": 1, "time_ms": 271.84490966796875, "status": "ok"}
{"N": 65536, "K": 200000, "D": 64, "B": 32, "dtype": "fp16", "BLOCK_N": 64, "BLOCK_K": 128, "num_warps": 4, "num_stages": 2, "time_ms": 256.6379089355469, "status": "ok"}
{"N": 65536, "K": 200000, "D": 64, "B": 32, "dtype": "fp16", "BLOCK_N": 64, "BLOCK_K": 128, "num_warps": 4, "num_stages": 4, "time_ms": 251.43788146972656, "status": "ok"}
{"N": 65536, "K": 200000, "D": 64, "B": 32, "dtype": "fp16", "BLOCK_N": 64, "BLOCK_K": 128, "num_warps": 8, "num_stages": 1, "time_ms": 410.27191162109375, "status": "ok"}
{"N": 65536, "K": 200000, "D": 64, "B": 32, "dtype": "fp16", "BLOCK_N": 64, "BLOCK_K": 128, "num_warps": 8, "num_stages": 2, "time_ms": 370.2261657714844, "status": "ok"}
{"N": 65536, "K": 200000, "D": 64, "B": 32, "dtype": "fp16", "BLOCK_N": 64, "BLOCK_K": 128, "num_warps": 8, "num_stages": 4, "time_ms": 355.478759765625, "status": "ok"}
{"N": 65536, "K": 200000, "D": 64, "B": 32, "dtype": "fp16", "BLOCK_N": 128, "BLOCK_K": 32, "num_warps": 4, "num_stages": 1, "time_ms": 266.1552734375, "status": "ok"}
{"N": 65536, "K": 200000, "D": 64, "B": 32, "dtype": "fp16", "BLOCK_N": 128, "BLOCK_K": 32, "num_warps": 4, "num_stages": 2, "time_ms": 260.7851257324219, "status": "ok"}
{"N": 65536, "K": 200000, "D": 64, "B": 32, "dtype": "fp16", "BLOCK_N": 128, "BLOCK_K": 32, "num_warps": 4, "num_stages": 4, "time_ms": 260.50909423828125, "status": "ok"}
{"N": 65536, "K": 200000, "D": 64, "B": 32, "dtype": "fp16", "BLOCK_N": 128, "BLOCK_K": 32, "num_warps": 8, "num_stages": 1, "time_ms": 273.8377380371094, "status": "ok"}
{"N": 65536, "K": 200000, "D": 64, "B": 32, "dtype": "fp16", "BLOCK_N": 128, "BLOCK_K": 32, "num_warps": 8, "num_stages": 2, "time_ms": 283.3294677734375, "status": "ok"}
{"N": 65536, "K": 200000, "D": 64, "B": 32, "dtype": "fp16", "BLOCK_N": 128, "BLOCK_K": 32, "num_warps": 8, "num_stages": 4, "time_ms": 274.1257019042969, "status": "ok"}
{"N": 65536, "K": 200000, "D": 64, "B": 32, "dtype": "fp16", "BLOCK_N": 128, "BLOCK_K": 64, "num_warps": 4, "num_stages": 1, "time_ms": 247.86700439453125, "status": "ok"}
{"N": 65536, "K": 200000, "D": 64, "B": 32, "dtype": "fp16", "BLOCK_N": 128, "BLOCK_K": 64, "num_warps": 4, "num_stages": 2, "time_ms": 225.1695098876953, "status": "ok"}
{"N": 65536, "K": 200000, "D": 64, "B": 32, "dtype": "fp16", "BLOCK_N": 128, "BLOCK_K": 64, "num_warps": 4, "num_stages": 4, "time_ms": 220.3903350830078, "status": "ok"}
{"N": 65536, "K": 200000, "D": 64, "B": 32, "dtype": "fp16", "BLOCK_N": 128, "BLOCK_K": 64, "num_warps": 8, "num_stages": 1, "time_ms": 254.76821899414062, "status": "ok"}
{"N": 65536, "K": 200000, "D": 64, "B": 32, "dtype": "fp16", "BLOCK_N": 128, "BLOCK_K": 64, "num_warps": 8, "num_stages": 2, "time_ms": 250.89596557617188, "status": "ok"}
{"N": 65536, "K": 200000, "D": 64, "B": 32, "dtype": "fp16", "BLOCK_N": 128, "BLOCK_K": 64, "num_warps": 8, "num_stages": 4, "time_ms": 235.9970245361328, "status": "ok"}
{"N": 65536, "K": 200000, "D": 64, "B": 32, "dtype": "fp16", "BLOCK_N": 128, "BLOCK_K": 128, "num_warps": 4, "num_stages": 1, "time_ms": 265.0113220214844, "status": "ok"}
{"N": 65536, "K": 200000, "D": 64, "B": 32, "dtype": "fp16", "BLOCK_N": 128, "BLOCK_K": 128, "num_warps": 4, "num_stages": 2, "time_ms": 258.4073791503906, "status": "ok"}
{"N": 65536, "K": 200000, "D": 64, "B": 32, "dtype": "fp16", "BLOCK_N": 128, "BLOCK_K": 128, "num_warps": 4, "num_stages": 4, "time_ms": 236.2974090576172, "status": "ok"}
{"N": 65536, "K": 200000, "D": 64, "B": 32, "dtype": "fp16", "BLOCK_N": 128, "BLOCK_K": 128, "num_warps": 8, "num_stages": 1, "time_ms": 411.340087890625, "status": "ok"}
{"N": 65536, "K": 200000, "D": 64, "B": 32, "dtype": "fp16", "BLOCK_N": 128, "BLOCK_K": 128, "num_warps": 8, "num_stages": 2, "time_ms": 409.6103820800781, "status": "ok"}
{"N": 65536, "K": 200000, "D": 64, "B": 32, "dtype": "fp16", "BLOCK_N": 128, "BLOCK_K": 128, "num_warps": 8, "num_stages": 4, "time_ms": 324.6221618652344, "status": "ok"}
{"summary": true, "N": 65536, "K": 200000, "D": 64, "B": 32, "dtype": "fp16", "best": {"N": 65536, "K": 200000, "D": 64, "B": 32, "dtype": "fp16", "BLOCK_N": 128, "BLOCK_K": 64, "num_warps": 4, "num_stages": 4, "time_ms": 220.3903350830078, "status": "ok"}, "best_time_ms": 220.3903350830078, "tuning_seconds": 189.0866322517395, "skipped": 0}
