grid_results_h100/N65536_K200000_D128_B1_fp16.jsonl
{"N": 65536, "K": 200000, "D": 128, "B": 1, "dtype": "fp16", "BLOCK_N": 32, "BLOCK_K": 32, "num_warps": 4, "num_stages": 1, "time_ms": 31.918655395507812, "status": "ok"}
{"N": 65536, "K": 200000, "D": 128, "B": 1, "dtype": "fp16", "BLOCK_N": 32, "BLOCK_K": 32, "num_warps": 4, "num_stages": 2, "time_ms": 26.657888412475586, "status": "ok"}
{"N": 65536, "K": 200000, "D": 128, "B": 1, "dtype": "fp16", "BLOCK_N": 32, "BLOCK_K": 32, "num_warps": 4, "num_stages": 4, "time_ms": 26.13155174255371, "status": "ok"}
{"N": 65536, "K": 200000, "D": 128, "B": 1, "dtype": "fp16", "BLOCK_N": 32, "BLOCK_K": 32, "num_warps": 8, "num_stages": 1, "time_ms": 51.11366271972656, "status": "ok"}
{"N": 65536, "K": 200000, "D": 128, "B": 1, "dtype": "fp16", "BLOCK_N": 32, "BLOCK_K": 32, "num_warps": 8, "num_stages": 2, "time_ms": 46.136417388916016, "status": "ok"}
{"N": 65536, "K": 200000, "D": 128, "B": 1, "dtype": "fp16", "BLOCK_N": 32, "BLOCK_K": 32, "num_warps": 8, "num_stages": 4, "time_ms": 42.40227127075195, "status": "ok"}
{"N": 65536, "K": 200000, "D": 128, "B": 1, "dtype": "fp16", "BLOCK_N": 32, "BLOCK_K": 64, "num_warps": 4, "num_stages": 1, "time_ms": 27.224960327148438, "status": "ok"}
{"N": 65536, "K": 200000, "D": 128, "B": 1, "dtype": "fp16", "BLOCK_N": 32, "BLOCK_K": 64, "num_warps": 4, "num_stages": 2, "time_ms": 21.59004783630371, "status": "ok"}
{"N": 65536, "K": 200000, "D": 128, "B": 1, "dtype": "fp16", "BLOCK_N": 32, "BLOCK_K": 64, "num_warps": 4, "num_stages": 4, "time_ms": 24.643327713012695, "status": "ok"}
{"N": 65536, "K": 200000, "D": 128, "B": 1, "dtype": "fp16", "BLOCK_N": 32, "BLOCK_K": 64, "num_warps": 8, "num_stages": 1, "time_ms": 33.73955154418945, "status": "ok"}
{"N": 65536, "K": 200000, "D": 128, "B": 1, "dtype": "fp16", "BLOCK_N": 32, "BLOCK_K": 64, "num_warps": 8, "num_stages": 2, "time_ms": 28.50668716430664, "status": "ok"}
{"N": 65536, "K": 200000, "D": 128, "B": 1, "dtype": "fp16", "BLOCK_N": 32, "BLOCK_K": 64, "num_warps": 8, "num_stages": 4, "time_ms": 27.78214454650879, "status": "ok"}
{"N": 65536, "K": 200000, "D": 128, "B": 1, "dtype": "fp16", "BLOCK_N": 32, "BLOCK_K": 128, "num_warps": 4, "num_stages": 1, "time_ms": 22.411008834838867, "status": "ok"}
{"N": 65536, "K": 200000, "D": 128, "B": 1, "dtype": "fp16", "BLOCK_N": 32, "BLOCK_K": 128, "num_warps": 4, "num_stages": 2, "time_ms": 17.824575424194336, "status": "ok"}
{"N": 65536, "K": 200000, "D": 128, "B": 1, "dtype": "fp16", "BLOCK_N": 32, "BLOCK_K": 128, "num_warps": 4, "num_stages": 4, "time_ms": 19.86720085144043, "status": "ok"}
{"N": 65536, "K": 200000, "D": 128, "B": 1, "dtype": "fp16", "BLOCK_N": 32, "BLOCK_K": 128, "num_warps": 8, "num_stages": 1, "time_ms": 29.89401626586914, "status": "ok"}
{"N": 65536, "K": 200000, "D": 128, "B": 1, "dtype": "fp16", "BLOCK_N": 32, "BLOCK_K": 128, "num_warps": 8, "num_stages": 2, "time_ms": 25.659936904907227, "status": "ok"}
{"N": 65536, "K": 200000, "D": 128, "B": 1, "dtype": "fp16", "BLOCK_N": 32, "BLOCK_K": 128, "num_warps": 8, "num_stages": 4, "time_ms": 25.99190330505371, "status": "ok"}
{"N": 65536, "K": 200000, "D": 128, "B": 1, "dtype": "fp16", "BLOCK_N": 64, "BLOCK_K": 32, "num_warps": 4, "num_stages": 1, "time_ms": 13.111231803894043, "status": "ok"}
{"N": 65536, "K": 200000, "D": 128, "B": 1, "dtype": "fp16", "BLOCK_N": 64, "BLOCK_K": 32, "num_warps": 4, "num_stages": 2, "time_ms": 15.107392311096191, "status": "ok"}
{"N": 65536, "K": 200000, "D": 128, "B": 1, "dtype": "fp16", "BLOCK_N": 64, "BLOCK_K": 32, "num_warps": 4, "num_stages": 4, "time_ms": 12.298784255981445, "status": "ok"}
{"N": 65536, "K": 200000, "D": 128, "B": 1, "dtype": "fp16", "BLOCK_N": 64, "BLOCK_K": 32, "num_warps": 8, "num_stages": 1, "time_ms": 23.544448852539062, "status": "ok"}
{"N": 65536, "K": 200000, "D": 128, "B": 1, "dtype": "fp16", "BLOCK_N": 64, "BLOCK_K": 32, "num_warps": 8, "num_stages": 2, "time_ms": 20.956031799316406, "status": "ok"}
{"N": 65536, "K": 200000, "D": 128, "B": 1, "dtype": "fp16", "BLOCK_N": 64, "BLOCK_K": 32, "num_warps": 8, "num_stages": 4, "time_ms": 20.78495979309082, "status": "ok"}
{"N": 65536, "K": 200000, "D": 128, "B": 1, "dtype": "fp16", "BLOCK_N": 64, "BLOCK_K": 64, "num_warps": 4, "num_stages": 1, "time_ms": 11.72275161743164, "status": "ok"}
{"N": 65536, "K": 200000, "D": 128, "B": 1, "dtype": "fp16", "BLOCK_N": 64, "BLOCK_K": 64, "num_warps": 4, "num_stages": 2, "time_ms": 10.553343772888184, "status": "ok"}
{"N": 65536, "K": 200000, "D": 128, "B": 1, "dtype": "fp16", "BLOCK_N": 64, "BLOCK_K": 64, "num_warps": 4, "num_stages": 4, "time_ms": 12.589407920837402, "status": "ok"}
{"N": 65536, "K": 200000, "D": 128, "B": 1, "dtype": "fp16", "BLOCK_N": 64, "BLOCK_K": 64, "num_warps": 8, "num_stages": 1, "time_ms": 16.705535888671875, "status": "ok"}
{"N": 65536, "K": 200000, "D": 128, "B": 1, "dtype": "fp16", "BLOCK_N": 64, "BLOCK_K": 64, "num_warps": 8, "num_stages": 2, "time_ms": 14.891551971435547, "status": "ok"}
{"N": 65536, "K": 200000, "D": 128, "B": 1, "dtype": "fp16", "BLOCK_N": 64, "BLOCK_K": 64, "num_warps": 8, "num_stages": 4, "time_ms": 16.43824005126953, "status": "ok"}
{"N": 65536, "K": 200000, "D": 128, "B": 1, "dtype": "fp16", "BLOCK_N": 64, "BLOCK_K": 128, "num_warps": 4, "num_stages": 1, "time_ms": 11.262399673461914, "status": "ok"}
{"N": 65536, "K": 200000, "D": 128, "B": 1, "dtype": "fp16", "BLOCK_N": 64, "BLOCK_K": 128, "num_warps": 4, "num_stages": 2, "time_ms": 11.052703857421875, "status": "ok"}
{"N": 65536, "K": 200000, "D": 128, "B": 1, "dtype": "fp16", "BLOCK_N": 64, "BLOCK_K": 128, "num_warps": 4, "num_stages": 4, "time_ms": 15.323328018188477, "status": "ok"}
{"N": 65536, "K": 200000, "D": 128, "B": 1, "dtype": "fp16", "BLOCK_N": 64, "BLOCK_K": 128, "num_warps": 8, "num_stages": 1, "time_ms": 17.088735580444336, "status": "ok"}
{"N": 65536, "K": 200000, "D": 128, "B": 1, "dtype": "fp16", "BLOCK_N": 64, "BLOCK_K": 128, "num_warps": 8, "num_stages": 2, "time_ms": 15.326047897338867, "status": "ok"}
{"N": 65536, "K": 200000, "D": 128, "B": 1, "dtype": "fp16", "BLOCK_N": 64, "BLOCK_K": 128, "num_warps": 8, "num_stages": 4, "time_ms": 18.060640335083008, "status": "ok"}
{"N": 65536, "K": 200000, "D": 128, "B": 1, "dtype": "fp16", "BLOCK_N": 128, "BLOCK_K": 32, "num_warps": 4, "num_stages": 1, "time_ms": 11.851263999938965, "status": "ok"}
{"N": 65536, "K": 200000, "D": 128, "B": 1, "dtype": "fp16", "BLOCK_N": 128, "BLOCK_K": 32, "num_warps": 4, "num_stages": 2, "time_ms": 12.140512466430664, "status": "ok"}
{"N": 65536, "K": 200000, "D": 128, "B": 1, "dtype": "fp16", "BLOCK_N": 128, "BLOCK_K": 32, "num_warps": 4, "num_stages": 4, "time_ms": 12.70787239074707, "status": "ok"}
{"N": 65536, "K": 200000, "D": 128, "B": 1, "dtype": "fp16", "BLOCK_N": 128, "BLOCK_K": 32, "num_warps": 8, "num_stages": 1, "time_ms": 11.703583717346191, "status": "ok"}
{"N": 65536, "K": 200000, "D": 128, "B": 1, "dtype": "fp16", "BLOCK_N": 128, "BLOCK_K": 32, "num_warps": 8, "num_stages": 2, "time_ms": 11.75500774383545, "status": "ok"}
{"N": 65536, "K": 200000, "D": 128, "B": 1, "dtype": "fp16", "BLOCK_N": 128, "BLOCK_K": 32, "num_warps": 8, "num_stages": 4, "time_ms": 12.349087715148926, "status": "ok"}
{"N": 65536, "K": 200000, "D": 128, "B": 1, "dtype": "fp16", "BLOCK_N": 128, "BLOCK_K": 64, "num_warps": 4, "num_stages": 1, "time_ms": 10.184191703796387, "status": "ok"}
{"N": 65536, "K": 200000, "D": 128, "B": 1, "dtype": "fp16", "BLOCK_N": 128, "BLOCK_K": 64, "num_warps": 4, "num_stages": 2, "time_ms": 11.236703872680664, "status": "ok"}
{"N": 65536, "K": 200000, "D": 128, "B": 1, "dtype": "fp16", "BLOCK_N": 128, "BLOCK_K": 64, "num_warps": 4, "num_stages": 4, "time_ms": 10.102592468261719, "status": "ok"}
{"N": 65536, "K": 200000, "D": 128, "B": 1, "dtype": "fp16", "BLOCK_N": 128, "BLOCK_K": 64, "num_warps": 8, "num_stages": 1, "time_ms": 11.350591659545898, "status": "ok"}
{"N": 65536, "K": 200000, "D": 128, "B": 1, "dtype": "fp16", "BLOCK_N": 128, "BLOCK_K": 64, "num_warps": 8, "num_stages": 2, "time_ms": 11.379551887512207, "status": "ok"}
{"N": 65536, "K": 200000, "D": 128, "B": 1, "dtype": "fp16", "BLOCK_N": 128, "BLOCK_K": 64, "num_warps": 8, "num_stages": 4, "time_ms": 10.105631828308105, "status": "ok"}
{"N": 65536, "K": 200000, "D": 128, "B": 1, "dtype": "fp16", "BLOCK_N": 128, "BLOCK_K": 128, "num_warps": 4, "num_stages": 1, "time_ms": 12.275712013244629, "status": "ok"}
{"N": 65536, "K": 200000, "D": 128, "B": 1, "dtype": "fp16", "BLOCK_N": 128, "BLOCK_K": 128, "num_warps": 4, "num_stages": 2, "time_ms": 10.626303672790527, "status": "ok"}
{"N": 65536, "K": 200000, "D": 128, "B": 1, "dtype": "fp16", "BLOCK_N": 128, "BLOCK_K": 128, "num_warps": 4, "num_stages": 4, "time_ms": 11.607808113098145, "status": "ok"}
{"N": 65536, "K": 200000, "D": 128, "B": 1, "dtype": "fp16", "BLOCK_N": 128, "BLOCK_K": 128, "num_warps": 8, "num_stages": 1, "time_ms": 17.483423233032227, "status": "ok"}
{"N": 65536, "K": 200000, "D": 128, "B": 1, "dtype": "fp16", "BLOCK_N": 128, "BLOCK_K": 128, "num_warps": 8, "num_stages": 2, "time_ms": 14.819904327392578, "status": "ok"}
{"N": 65536, "K": 200000, "D": 128, "B": 1, "dtype": "fp16", "BLOCK_N": 128, "BLOCK_K": 128, "num_warps": 8, "num_stages": 4, "time_ms": 12.403583526611328, "status": "ok"}
{"summary": true, "N": 65536, "K": 200000, "D": 128, "B": 1, "dtype": "fp16", "best": {"N": 65536, "K": 200000, "D": 128, "B": 1, "dtype": "fp16", "BLOCK_N": 128, "BLOCK_K": 64, "num_warps": 4, "num_stages": 4, "time_ms": 10.102592468261719, "status": "ok"}, "best_time_ms": 10.102592468261719, "tuning_seconds": 22.34885048866272, "skipped": 0}
