grid_results_h100/N65536_K200000_D128_B32_fp16.jsonl
{"N": 65536, "K": 200000, "D": 128, "B": 32, "dtype": "fp16", "BLOCK_N": 32, "BLOCK_K": 32, "num_warps": 4, "num_stages": 1, "time_ms": 972.3275146484375, "status": "ok"}
{"N": 65536, "K": 200000, "D": 128, "B": 32, "dtype": "fp16", "BLOCK_N": 32, "BLOCK_K": 32, "num_warps": 4, "num_stages": 2, "time_ms": 803.1139526367188, "status": "ok"}
{"N": 65536, "K": 200000, "D": 128, "B": 32, "dtype": "fp16", "BLOCK_N": 32, "BLOCK_K": 32, "num_warps": 4, "num_stages": 4, "time_ms": 803.0730590820312, "status": "ok"}
{"N": 65536, "K": 200000, "D": 128, "B": 32, "dtype": "fp16", "BLOCK_N": 32, "BLOCK_K": 32, "num_warps": 8, "num_stages": 1, "time_ms": 1478.8587646484375, "status": "ok"}
{"N": 65536, "K": 200000, "D": 128, "B": 32, "dtype": "fp16", "BLOCK_N": 32, "BLOCK_K": 32, "num_warps": 8, "num_stages": 2, "time_ms": 1315.4866943359375, "status": "ok"}
{"N": 65536, "K": 200000, "D": 128, "B": 32, "dtype": "fp16", "BLOCK_N": 32, "BLOCK_K": 32, "num_warps": 8, "num_stages": 4, "time_ms": 1289.2269287109375, "status": "ok"}
{"N": 65536, "K": 200000, "D": 128, "B": 32, "dtype": "fp16", "BLOCK_N": 32, "BLOCK_K": 64, "num_warps": 4, "num_stages": 1, "time_ms": 837.9714965820312, "status": "ok"}
{"N": 65536, "K": 200000, "D": 128, "B": 32, "dtype": "fp16", "BLOCK_N": 32, "BLOCK_K": 64, "num_warps": 4, "num_stages": 2, "time_ms": 693.3171997070312, "status": "ok"}
{"N": 65536, "K": 200000, "D": 128, "B": 32, "dtype": "fp16", "BLOCK_N": 32, "BLOCK_K": 64, "num_warps": 4, "num_stages": 4, "time_ms": 719.6782836914062, "status": "ok"}
{"N": 65536, "K": 200000, "D": 128, "B": 32, "dtype": "fp16", "BLOCK_N": 32, "BLOCK_K": 64, "num_warps": 8, "num_stages": 1, "time_ms": 1029.8826904296875, "status": "ok"}
{"N": 65536, "K": 200000, "D": 128, "B": 32, "dtype": "fp16", "BLOCK_N": 32, "BLOCK_K": 64, "num_warps": 8, "num_stages": 2, "time_ms": 860.2883911132812, "status": "ok"}
{"N": 65536, "K": 200000, "D": 128, "B": 32, "dtype": "fp16", "BLOCK_N": 32, "BLOCK_K": 64, "num_warps": 8, "num_stages": 4, "time_ms": 851.2726440429688, "status": "ok"}
{"N": 65536, "K": 200000, "D": 128, "B": 32, "dtype": "fp16", "BLOCK_N": 32, "BLOCK_K": 128, "num_warps": 4, "num_stages": 1, "time_ms": 695.6895141601562, "status": "ok"}
{"N": 65536, "K": 200000, "D": 128, "B": 32, "dtype": "fp16", "BLOCK_N": 32, "BLOCK_K": 128, "num_warps": 4, "num_stages": 2, "time_ms": 582.9295654296875, "status": "ok"}
{"N": 65536, "K": 200000, "D": 128, "B": 32, "dtype": "fp16", "BLOCK_N": 32, "BLOCK_K": 128, "num_warps": 4, "num_stages": 4, "time_ms": 617.6439208984375, "status": "ok"}
{"N": 65536, "K": 200000, "D": 128, "B": 32, "dtype": "fp16", "BLOCK_N": 32, "BLOCK_K": 128, "num_warps": 8, "num_stages": 1, "time_ms": 924.4824829101562, "status": "ok"}
{"N": 65536, "K": 200000, "D": 128, "B": 32, "dtype": "fp16", "BLOCK_N": 32, "BLOCK_K": 128, "num_warps": 8, "num_stages": 2, "time_ms": 784.0908813476562, "status": "ok"}
{"N": 65536, "K": 200000, "D": 128, "B": 32, "dtype": "fp16", "BLOCK_N": 32, "BLOCK_K": 128, "num_warps": 8, "num_stages": 4, "time_ms": 799.02392578125, "status": "ok"}
{"N": 65536, "K": 200000, "D": 128, "B": 32, "dtype": "fp16", "BLOCK_N": 64, "BLOCK_K": 32, "num_warps": 4, "num_stages": 1, "time_ms": 422.3088073730469, "status": "ok"}
{"N": 65536, "K": 200000, "D": 128, "B": 32, "dtype": "fp16", "BLOCK_N": 64, "BLOCK_K": 32, "num_warps": 4, "num_stages": 2, "time_ms": 366.2209777832031, "status": "ok"}
{"N": 65536, "K": 200000, "D": 128, "B": 32, "dtype": "fp16", "BLOCK_N": 64, "BLOCK_K": 32, "num_warps": 4, "num_stages": 4, "time_ms": 371.1162414550781, "status": "ok"}
{"N": 65536, "K": 200000, "D": 128, "B": 32, "dtype": "fp16", "BLOCK_N": 64, "BLOCK_K": 32, "num_warps": 8, "num_stages": 1, "time_ms": 706.8204956054688, "status": "ok"}
{"N": 65536, "K": 200000, "D": 128, "B": 32, "dtype": "fp16", "BLOCK_N": 64, "BLOCK_K": 32, "num_warps": 8, "num_stages": 2, "time_ms": 618.8970947265625, "status": "ok"}
{"N": 65536, "K": 200000, "D": 128, "B": 32, "dtype": "fp16", "BLOCK_N": 64, "BLOCK_K": 32, "num_warps": 8, "num_stages": 4, "time_ms": 624.05419921875, "status": "ok"}
{"N": 65536, "K": 200000, "D": 128, "B": 32, "dtype": "fp16", "BLOCK_N": 64, "BLOCK_K": 64, "num_warps": 4, "num_stages": 1, "time_ms": 354.041748046875, "status": "ok"}
{"N": 65536, "K": 200000, "D": 128, "B": 32, "dtype": "fp16", "BLOCK_N": 64, "BLOCK_K": 64, "num_warps": 4, "num_stages": 2, "time_ms": 320.1375427246094, "status": "ok"}
{"N": 65536, "K": 200000, "D": 128, "B": 32, "dtype": "fp16", "BLOCK_N": 64, "BLOCK_K": 64, "num_warps": 4, "num_stages": 4, "time_ms": 395.5927734375, "status": "ok"}
{"N": 65536, "K": 200000, "D": 128, "B": 32, "dtype": "fp16", "BLOCK_N": 64, "BLOCK_K": 64, "num_warps": 8, "num_stages": 1, "time_ms": 524.0957641601562, "status": "ok"}
{"N": 65536, "K": 200000, "D": 128, "B": 32, "dtype": "fp16", "BLOCK_N": 64, "BLOCK_K": 64, "num_warps": 8, "num_stages": 2, "time_ms": 438.9720458984375, "status": "ok"}
{"N": 65536, "K": 200000, "D": 128, "B": 32, "dtype": "fp16", "BLOCK_N": 64, "BLOCK_K": 64, "num_warps": 8, "num_stages": 4, "time_ms": 494.8106384277344, "status": "ok"}
{"N": 65536, "K": 200000, "D": 128, "B": 32, "dtype": "fp16", "BLOCK_N": 64, "BLOCK_K": 128, "num_warps": 4, "num_stages": 1, "time_ms": 357.94097900390625, "status": "ok"}
{"N": 65536, "K": 200000, "D": 128, "B": 32, "dtype": "fp16", "BLOCK_N": 64, "BLOCK_K": 128, "num_warps": 4, "num_stages": 2, "time_ms": 355.51806640625, "status": "ok"}
{"N": 65536, "K": 200000, "D": 128, "B": 32, "dtype": "fp16", "BLOCK_N": 64, "BLOCK_K": 128, "num_warps": 4, "num_stages": 4, "time_ms": 476.39141845703125, "status": "ok"}
{"N": 65536, "K": 200000, "D": 128, "B": 32, "dtype": "fp16", "BLOCK_N": 64, "BLOCK_K": 128, "num_warps": 8, "num_stages": 1, "time_ms": 510.7882995605469, "status": "ok"}
{"N": 65536, "K": 200000, "D": 128, "B": 32, "dtype": "fp16", "BLOCK_N": 64, "BLOCK_K": 128, "num_warps": 8, "num_stages": 2, "time_ms": 458.0190124511719, "status": "ok"}
{"N": 65536, "K": 200000, "D": 128, "B": 32, "dtype": "fp16", "BLOCK_N": 64, "BLOCK_K": 128, "num_warps": 8, "num_stages": 4, "time_ms": 564.1892700195312, "status": "ok"}
{"N": 65536, "K": 200000, "D": 128, "B": 32, "dtype": "fp16", "BLOCK_N": 128, "BLOCK_K": 32, "num_warps": 4, "num_stages": 1, "time_ms": 354.4608459472656, "status": "ok"}
{"N": 65536, "K": 200000, "D": 128, "B": 32, "dtype": "fp16", "BLOCK_N": 128, "BLOCK_K": 32, "num_warps": 4, "num_stages": 2, "time_ms": 352.9730224609375, "status": "ok"}
{"N": 65536, "K": 200000, "D": 128, "B": 32, "dtype": "fp16", "BLOCK_N": 128, "BLOCK_K": 32, "num_warps": 4, "num_stages": 4, "time_ms": 373.4484558105469, "status": "ok"}
{"N": 65536, "K": 200000, "D": 128, "B": 32, "dtype": "fp16", "BLOCK_N": 128, "BLOCK_K": 32, "num_warps": 8, "num_stages": 1, "time_ms": 373.57177734375, "status": "ok"}
{"N": 65536, "K": 200000, "D": 128, "B": 32, "dtype": "fp16", "BLOCK_N": 128, "BLOCK_K": 32, "num_warps": 8, "num_stages": 2, "time_ms": 359.8215637207031, "status": "ok"}
{"N": 65536, "K": 200000, "D": 128, "B": 32, "dtype": "fp16", "BLOCK_N": 128, "BLOCK_K": 32, "num_warps": 8, "num_stages": 4, "time_ms": 371.6862487792969, "status": "ok"}
{"N": 65536, "K": 200000, "D": 128, "B": 32, "dtype": "fp16", "BLOCK_N": 128, "BLOCK_K": 64, "num_warps": 4, "num_stages": 1, "time_ms": 304.9513854980469, "status": "ok"}
{"N": 65536, "K": 200000, "D": 128, "B": 32, "dtype": "fp16", "BLOCK_N": 128, "BLOCK_K": 64, "num_warps": 4, "num_stages": 2, "time_ms": 305.2103271484375, "status": "ok"}
{"N": 65536, "K": 200000, "D": 128, "B": 32, "dtype": "fp16", "BLOCK_N": 128, "BLOCK_K": 64, "num_warps": 4, "num_stages": 4, "time_ms": 300.9103698730469, "status": "ok"}
{"N": 65536, "K": 200000, "D": 128, "B": 32, "dtype": "fp16", "BLOCK_N": 128, "BLOCK_K": 64, "num_warps": 8, "num_stages": 1, "time_ms": 316.599853515625, "status": "ok"}
{"N": 65536, "K": 200000, "D": 128, "B": 32, "dtype": "fp16", "BLOCK_N": 128, "BLOCK_K": 64, "num_warps": 8, "num_stages": 2, "time_ms": 306.54876708984375, "status": "ok"}
{"N": 65536, "K": 200000, "D": 128, "B": 32, "dtype": "fp16", "BLOCK_N": 128, "BLOCK_K": 64, "num_warps": 8, "num_stages": 4, "time_ms": 304.6151428222656, "status": "ok"}
{"N": 65536, "K": 200000, "D": 128, "B": 32, "dtype": "fp16", "BLOCK_N": 128, "BLOCK_K": 128, "num_warps": 4, "num_stages": 1, "time_ms": 364.1021728515625, "status": "ok"}
{"N": 65536, "K": 200000, "D": 128, "B": 32, "dtype": "fp16", "BLOCK_N": 128, "BLOCK_K": 128, "num_warps": 4, "num_stages": 2, "time_ms": 313.7923583984375, "status": "ok"}
{"N": 65536, "K": 200000, "D": 128, "B": 32, "dtype": "fp16", "BLOCK_N": 128, "BLOCK_K": 128, "num_warps": 4, "num_stages": 4, "time_ms": 356.4230041503906, "status": "ok"}
{"N": 65536, "K": 200000, "D": 128, "B": 32, "dtype": "fp16", "BLOCK_N": 128, "BLOCK_K": 128, "num_warps": 8, "num_stages": 1, "time_ms": 545.7803344726562, "status": "ok"}
{"N": 65536, "K": 200000, "D": 128, "B": 32, "dtype": "fp16", "BLOCK_N": 128, "BLOCK_K": 128, "num_warps": 8, "num_stages": 2, "time_ms": 459.61773681640625, "status": "ok"}
{"N": 65536, "K": 200000, "D": 128, "B": 32, "dtype": "fp16", "BLOCK_N": 128, "BLOCK_K": 128, "num_warps": 8, "num_stages": 4, "time_ms": 376.0389099121094, "status": "ok"}
{"summary": true, "N": 65536, "K": 200000, "D": 128, "B": 32, "dtype": "fp16", "best": {"N": 65536, "K": 200000, "D": 128, "B": 32, "dtype": "fp16", "BLOCK_N": 128, "BLOCK_K": 64, "num_warps": 4, "num_stages": 4, "time_ms": 300.9103698730469, "status": "ok"}, "best_time_ms": 300.9103698730469, "tuning_seconds": 261.4996898174286, "skipped": 0}
