grid_results_h100/N65536_K16384_D64_B32_fp16.jsonl
{"N": 65536, "K": 16384, "D": 64, "B": 32, "dtype": "fp16", "BLOCK_N": 32, "BLOCK_K": 32, "num_warps": 4, "num_stages": 1, "time_ms": 52.23820877075195, "status": "ok"}
{"N": 65536, "K": 16384, "D": 64, "B": 32, "dtype": "fp16", "BLOCK_N": 32, "BLOCK_K": 32, "num_warps": 4, "num_stages": 2, "time_ms": 45.99897766113281, "status": "ok"}
{"N": 65536, "K": 16384, "D": 64, "B": 32, "dtype": "fp16", "BLOCK_N": 32, "BLOCK_K": 32, "num_warps": 4, "num_stages": 4, "time_ms": 45.40377426147461, "status": "ok"}
{"N": 65536, "K": 16384, "D": 64, "B": 32, "dtype": "fp16", "BLOCK_N": 32, "BLOCK_K": 32, "num_warps": 8, "num_stages": 1, "time_ms": 83.77359771728516, "status": "ok"}
{"N": 65536, "K": 16384, "D": 64, "B": 32, "dtype": "fp16", "BLOCK_N": 32, "BLOCK_K": 32, "num_warps": 8, "num_stages": 2, "time_ms": 78.72051239013672, "status": "ok"}
{"N": 65536, "K": 16384, "D": 64, "B": 32, "dtype": "fp16", "BLOCK_N": 32, "BLOCK_K": 32, "num_warps": 8, "num_stages": 4, "time_ms": 77.62918090820312, "status": "ok"}
{"N": 65536, "K": 16384, "D": 64, "B": 32, "dtype": "fp16", "BLOCK_N": 32, "BLOCK_K": 64, "num_warps": 4, "num_stages": 1, "time_ms": 44.13539123535156, "status": "ok"}
{"N": 65536, "K": 16384, "D": 64, "B": 32, "dtype": "fp16", "BLOCK_N": 32, "BLOCK_K": 64, "num_warps": 4, "num_stages": 2, "time_ms": 39.031455993652344, "status": "ok"}
{"N": 65536, "K": 16384, "D": 64, "B": 32, "dtype": "fp16", "BLOCK_N": 32, "BLOCK_K": 64, "num_warps": 4, "num_stages": 4, "time_ms": 37.29087829589844, "status": "ok"}
{"N": 65536, "K": 16384, "D": 64, "B": 32, "dtype": "fp16", "BLOCK_N": 32, "BLOCK_K": 64, "num_warps": 8, "num_stages": 1, "time_ms": 54.23712158203125, "status": "ok"}
{"N": 65536, "K": 16384, "D": 64, "B": 32, "dtype": "fp16", "BLOCK_N": 32, "BLOCK_K": 64, "num_warps": 8, "num_stages": 2, "time_ms": 49.61369705200195, "status": "ok"}
{"N": 65536, "K": 16384, "D": 64, "B": 32, "dtype": "fp16", "BLOCK_N": 32, "BLOCK_K": 64, "num_warps": 8, "num_stages": 4, "time_ms": 48.75455856323242, "status": "ok"}
{"N": 65536, "K": 16384, "D": 64, "B": 32, "dtype": "fp16", "BLOCK_N": 32, "BLOCK_K": 128, "num_warps": 4, "num_stages": 1, "time_ms": 34.896671295166016, "status": "ok"}
{"N": 65536, "K": 16384, "D": 64, "B": 32, "dtype": "fp16", "BLOCK_N": 32, "BLOCK_K": 128, "num_warps": 4, "num_stages": 2, "time_ms": 31.178943634033203, "status": "ok"}
{"N": 65536, "K": 16384, "D": 64, "B": 32, "dtype": "fp16", "BLOCK_N": 32, "BLOCK_K": 128, "num_warps": 4, "num_stages": 4, "time_ms": 30.414304733276367, "status": "ok"}
{"N": 65536, "K": 16384, "D": 64, "B": 32, "dtype": "fp16", "BLOCK_N": 32, "BLOCK_K": 128, "num_warps": 8, "num_stages": 1, "time_ms": 56.314430236816406, "status": "ok"}
{"N": 65536, "K": 16384, "D": 64, "B": 32, "dtype": "fp16", "BLOCK_N": 32, "BLOCK_K": 128, "num_warps": 8, "num_stages": 2, "time_ms": 46.65913772583008, "status": "ok"}
{"N": 65536, "K": 16384, "D": 64, "B": 32, "dtype": "fp16", "BLOCK_N": 32, "BLOCK_K": 128, "num_warps": 8, "num_stages": 4, "time_ms": 44.620033264160156, "status": "ok"}
{"N": 65536, "K": 16384, "D": 64, "B": 32, "dtype": "fp16", "BLOCK_N": 64, "BLOCK_K": 32, "num_warps": 4, "num_stages": 1, "time_ms": 20.83020782470703, "status": "ok"}
{"N": 65536, "K": 16384, "D": 64, "B": 32, "dtype": "fp16", "BLOCK_N": 64, "BLOCK_K": 32, "num_warps": 4, "num_stages": 2, "time_ms": 20.6213436126709, "status": "ok"}
{"N": 65536, "K": 16384, "D": 64, "B": 32, "dtype": "fp16", "BLOCK_N": 64, "BLOCK_K": 32, "num_warps": 4, "num_stages": 4, "time_ms": 20.82441520690918, "status": "ok"}
{"N": 65536, "K": 16384, "D": 64, "B": 32, "dtype": "fp16", "BLOCK_N": 64, "BLOCK_K": 32, "num_warps": 8, "num_stages": 1, "time_ms": 42.12694549560547, "status": "ok"}
{"N": 65536, "K": 16384, "D": 64, "B": 32, "dtype": "fp16", "BLOCK_N": 64, "BLOCK_K": 32, "num_warps": 8, "num_stages": 2, "time_ms": 38.664703369140625, "status": "ok"}
{"N": 65536, "K": 16384, "D": 64, "B": 32, "dtype": "fp16", "BLOCK_N": 64, "BLOCK_K": 32, "num_warps": 8, "num_stages": 4, "time_ms": 37.881439208984375, "status": "ok"}
{"N": 65536, "K": 16384, "D": 64, "B": 32, "dtype": "fp16", "BLOCK_N": 64, "BLOCK_K": 64, "num_warps": 4, "num_stages": 1, "time_ms": 19.59596824645996, "status": "ok"}
{"N": 65536, "K": 16384, "D": 64, "B": 32, "dtype": "fp16", "BLOCK_N": 64, "BLOCK_K": 64, "num_warps": 4, "num_stages": 2, "time_ms": 18.58515167236328, "status": "ok"}
{"N": 65536, "K": 16384, "D": 64, "B": 32, "dtype": "fp16", "BLOCK_N": 64, "BLOCK_K": 64, "num_warps": 4, "num_stages": 4, "time_ms": 18.712928771972656, "status": "ok"}
{"N": 65536, "K": 16384, "D": 64, "B": 32, "dtype": "fp16", "BLOCK_N": 64, "BLOCK_K": 64, "num_warps": 8, "num_stages": 1, "time_ms": 29.75712013244629, "status": "ok"}
{"N": 65536, "K": 16384, "D": 64, "B": 32, "dtype": "fp16", "BLOCK_N": 64, "BLOCK_K": 64, "num_warps": 8, "num_stages": 2, "time_ms": 28.1876163482666, "status": "ok"}
{"N": 65536, "K": 16384, "D": 64, "B": 32, "dtype": "fp16", "BLOCK_N": 64, "BLOCK_K": 64, "num_warps": 8, "num_stages": 4, "time_ms": 27.542144775390625, "status": "ok"}
{"N": 65536, "K": 16384, "D": 64, "B": 32, "dtype": "fp16", "BLOCK_N": 64, "BLOCK_K": 128, "num_warps": 4, "num_stages": 1, "time_ms": 18.70560073852539, "status": "ok"}
{"N": 65536, "K": 16384, "D": 64, "B": 32, "dtype": "fp16", "BLOCK_N": 64, "BLOCK_K": 128, "num_warps": 4, "num_stages": 2, "time_ms": 17.945823669433594, "status": "ok"}
{"N": 65536, "K": 16384, "D": 64, "B": 32, "dtype": "fp16", "BLOCK_N": 64, "BLOCK_K": 128, "num_warps": 4, "num_stages": 4, "time_ms": 18.080415725708008, "status": "ok"}
{"N": 65536, "K": 16384, "D": 64, "B": 32, "dtype": "fp16", "BLOCK_N": 64, "BLOCK_K": 128, "num_warps": 8, "num_stages": 1, "time_ms": 30.381376266479492, "status": "ok"}
{"N": 65536, "K": 16384, "D": 64, "B": 32, "dtype": "fp16", "BLOCK_N": 64, "BLOCK_K": 128, "num_warps": 8, "num_stages": 2, "time_ms": 26.1395206451416, "status": "ok"}
{"N": 65536, "K": 16384, "D": 64, "B": 32, "dtype": "fp16", "BLOCK_N": 64, "BLOCK_K": 128, "num_warps": 8, "num_stages": 4, "time_ms": 24.66828727722168, "status": "ok"}
{"N": 65536, "K": 16384, "D": 64, "B": 32, "dtype": "fp16", "BLOCK_N": 128, "BLOCK_K": 32, "num_warps": 4, "num_stages": 1, "time_ms": 20.578847885131836, "status": "ok"}
{"N": 65536, "K": 16384, "D": 64, "B": 32, "dtype": "fp16", "BLOCK_N": 128, "BLOCK_K": 32, "num_warps": 4, "num_stages": 2, "time_ms": 19.937023162841797, "status": "ok"}
{"N": 65536, "K": 16384, "D": 64, "B": 32, "dtype": "fp16", "BLOCK_N": 128, "BLOCK_K": 32, "num_warps": 4, "num_stages": 4, "time_ms": 20.432544708251953, "status": "ok"}
{"N": 65536, "K": 16384, "D": 64, "B": 32, "dtype": "fp16", "BLOCK_N": 128, "BLOCK_K": 32, "num_warps": 8, "num_stages": 1, "time_ms": 21.323871612548828, "status": "ok"}
{"N": 65536, "K": 16384, "D": 64, "B": 32, "dtype": "fp16", "BLOCK_N": 128, "BLOCK_K": 32, "num_warps": 8, "num_stages": 2, "time_ms": 22.210336685180664, "status": "ok"}
{"N": 65536, "K": 16384, "D": 64, "B": 32, "dtype": "fp16", "BLOCK_N": 128, "BLOCK_K": 32, "num_warps": 8, "num_stages": 4, "time_ms": 21.76691246032715, "status": "ok"}
{"N": 65536, "K": 16384, "D": 64, "B": 32, "dtype": "fp16", "BLOCK_N": 128, "BLOCK_K": 64, "num_warps": 4, "num_stages": 1, "time_ms": 19.44121551513672, "status": "ok"}
{"N": 65536, "K": 16384, "D": 64, "B": 32, "dtype": "fp16", "BLOCK_N": 128, "BLOCK_K": 64, "num_warps": 4, "num_stages": 2, "time_ms": 17.799455642700195, "status": "ok"}
{"N": 65536, "K": 16384, "D": 64, "B": 32, "dtype": "fp16", "BLOCK_N": 128, "BLOCK_K": 64, "num_warps": 4, "num_stages": 4, "time_ms": 18.095264434814453, "status": "ok"}
{"N": 65536, "K": 16384, "D": 64, "B": 32, "dtype": "fp16", "BLOCK_N": 128, "BLOCK_K": 64, "num_warps": 8, "num_stages": 1, "time_ms": 20.238784790039062, "status": "ok"}
{"N": 65536, "K": 16384, "D": 64, "B": 32, "dtype": "fp16", "BLOCK_N": 128, "BLOCK_K": 64, "num_warps": 8, "num_stages": 2, "time_ms": 19.212127685546875, "status": "ok"}
{"N": 65536, "K": 16384, "D": 64, "B": 32, "dtype": "fp16", "BLOCK_N": 128, "BLOCK_K": 64, "num_warps": 8, "num_stages": 4, "time_ms": 19.023679733276367, "status": "ok"}
{"N": 65536, "K": 16384, "D": 64, "B": 32, "dtype": "fp16", "BLOCK_N": 128, "BLOCK_K": 128, "num_warps": 4, "num_stages": 1, "time_ms": 19.71571159362793, "status": "ok"}
{"N": 65536, "K": 16384, "D": 64, "B": 32, "dtype": "fp16", "BLOCK_N": 128, "BLOCK_K": 128, "num_warps": 4, "num_stages": 2, "time_ms": 19.56585693359375, "status": "ok"}
{"N": 65536, "K": 16384, "D": 64, "B": 32, "dtype": "fp16", "BLOCK_N": 128, "BLOCK_K": 128, "num_warps": 4, "num_stages": 4, "time_ms": 17.986175537109375, "status": "ok"}
{"N": 65536, "K": 16384, "D": 64, "B": 32, "dtype": "fp16", "BLOCK_N": 128, "BLOCK_K": 128, "num_warps": 8, "num_stages": 1, "time_ms": 27.142656326293945, "status": "ok"}
{"N": 65536, "K": 16384, "D": 64, "B": 32, "dtype": "fp16", "BLOCK_N": 128, "BLOCK_K": 128, "num_warps": 8, "num_stages": 2, "time_ms": 18.434911727905273, "status": "ok"}
{"N": 65536, "K": 16384, "D": 64, "B": 32, "dtype": "fp16", "BLOCK_N": 128, "BLOCK_K": 128, "num_warps": 8, "num_stages": 4, "time_ms": 18.03708839416504, "status": "ok"}
{"summary": true, "N": 65536, "K": 16384, "D": 64, "B": 32, "dtype": "fp16", "best": {"N": 65536, "K": 16384, "D": 64, "B": 32, "dtype": "fp16", "BLOCK_N": 128, "BLOCK_K": 64, "num_warps": 4, "num_stages": 2, "time_ms": 17.799455642700195, "status": "ok"}, "best_time_ms": 17.799455642700195, "tuning_seconds": 25.818056106567383, "skipped": 0}
