grid_results_h100/N65536_K16384_D128_B32_fp16.jsonl
{"N": 65536, "K": 16384, "D": 128, "B": 32, "dtype": "fp16", "BLOCK_N": 32, "BLOCK_K": 32, "num_warps": 4, "num_stages": 1, "time_ms": 79.65081787109375, "status": "ok"}
{"N": 65536, "K": 16384, "D": 128, "B": 32, "dtype": "fp16", "BLOCK_N": 32, "BLOCK_K": 32, "num_warps": 4, "num_stages": 2, "time_ms": 64.94287872314453, "status": "ok"}
{"N": 65536, "K": 16384, "D": 128, "B": 32, "dtype": "fp16", "BLOCK_N": 32, "BLOCK_K": 32, "num_warps": 4, "num_stages": 4, "time_ms": 65.00800323486328, "status": "ok"}
{"N": 65536, "K": 16384, "D": 128, "B": 32, "dtype": "fp16", "BLOCK_N": 32, "BLOCK_K": 32, "num_warps": 8, "num_stages": 1, "time_ms": 118.05209350585938, "status": "ok"}
{"N": 65536, "K": 16384, "D": 128, "B": 32, "dtype": "fp16", "BLOCK_N": 32, "BLOCK_K": 32, "num_warps": 8, "num_stages": 2, "time_ms": 107.11878204345703, "status": "ok"}
{"N": 65536, "K": 16384, "D": 128, "B": 32, "dtype": "fp16", "BLOCK_N": 32, "BLOCK_K": 32, "num_warps": 8, "num_stages": 4, "time_ms": 105.46800231933594, "status": "ok"}
{"N": 65536, "K": 16384, "D": 128, "B": 32, "dtype": "fp16", "BLOCK_N": 32, "BLOCK_K": 64, "num_warps": 4, "num_stages": 1, "time_ms": 67.71577453613281, "status": "ok"}
{"N": 65536, "K": 16384, "D": 128, "B": 32, "dtype": "fp16", "BLOCK_N": 32, "BLOCK_K": 64, "num_warps": 4, "num_stages": 2, "time_ms": 53.42473602294922, "status": "ok"}
{"N": 65536, "K": 16384, "D": 128, "B": 32, "dtype": "fp16", "BLOCK_N": 32, "BLOCK_K": 64, "num_warps": 4, "num_stages": 4, "time_ms": 56.87152099609375, "status": "ok"}
{"N": 65536, "K": 16384, "D": 128, "B": 32, "dtype": "fp16", "BLOCK_N": 32, "BLOCK_K": 64, "num_warps": 8, "num_stages": 1, "time_ms": 83.12406158447266, "status": "ok"}
{"N": 65536, "K": 16384, "D": 128, "B": 32, "dtype": "fp16", "BLOCK_N": 32, "BLOCK_K": 64, "num_warps": 8, "num_stages": 2, "time_ms": 69.25459289550781, "status": "ok"}
{"N": 65536, "K": 16384, "D": 128, "B": 32, "dtype": "fp16", "BLOCK_N": 32, "BLOCK_K": 64, "num_warps": 8, "num_stages": 4, "time_ms": 68.9978256225586, "status": "ok"}
{"N": 65536, "K": 16384, "D": 128, "B": 32, "dtype": "fp16", "BLOCK_N": 32, "BLOCK_K": 128, "num_warps": 4, "num_stages": 1, "time_ms": 54.43116760253906, "status": "ok"}
{"N": 65536, "K": 16384, "D": 128, "B": 32, "dtype": "fp16", "BLOCK_N": 32, "BLOCK_K": 128, "num_warps": 4, "num_stages": 2, "time_ms": 43.36182403564453, "status": "ok"}
{"N": 65536, "K": 16384, "D": 128, "B": 32, "dtype": "fp16", "BLOCK_N": 32, "BLOCK_K": 128, "num_warps": 4, "num_stages": 4, "time_ms": 57.03913497924805, "status": "ok"}
{"N": 65536, "K": 16384, "D": 128, "B": 32, "dtype": "fp16", "BLOCK_N": 32, "BLOCK_K": 128, "num_warps": 8, "num_stages": 1, "time_ms": 74.2795181274414, "status": "ok"}
{"N": 65536, "K": 16384, "D": 128, "B": 32, "dtype": "fp16", "BLOCK_N": 32, "BLOCK_K": 128, "num_warps": 8, "num_stages": 2, "time_ms": 63.03139114379883, "status": "ok"}
{"N": 65536, "K": 16384, "D": 128, "B": 32, "dtype": "fp16", "BLOCK_N": 32, "BLOCK_K": 128, "num_warps": 8, "num_stages": 4, "time_ms": 63.2988166809082, "status": "ok"}
{"N": 65536, "K": 16384, "D": 128, "B": 32, "dtype": "fp16", "BLOCK_N": 64, "BLOCK_K": 32, "num_warps": 4, "num_stages": 1, "time_ms": 32.76108932495117, "status": "ok"}
{"N": 65536, "K": 16384, "D": 128, "B": 32, "dtype": "fp16", "BLOCK_N": 64, "BLOCK_K": 32, "num_warps": 4, "num_stages": 2, "time_ms": 28.234848022460938, "status": "ok"}
{"N": 65536, "K": 16384, "D": 128, "B": 32, "dtype": "fp16", "BLOCK_N": 64, "BLOCK_K": 32, "num_warps": 4, "num_stages": 4, "time_ms": 28.988672256469727, "status": "ok"}
{"N": 65536, "K": 16384, "D": 128, "B": 32, "dtype": "fp16", "BLOCK_N": 64, "BLOCK_K": 32, "num_warps": 8, "num_stages": 1, "time_ms": 57.996543884277344, "status": "ok"}
{"N": 65536, "K": 16384, "D": 128, "B": 32, "dtype": "fp16", "BLOCK_N": 64, "BLOCK_K": 32, "num_warps": 8, "num_stages": 2, "time_ms": 50.11824035644531, "status": "ok"}
{"N": 65536, "K": 16384, "D": 128, "B": 32, "dtype": "fp16", "BLOCK_N": 64, "BLOCK_K": 32, "num_warps": 8, "num_stages": 4, "time_ms": 50.50697708129883, "status": "ok"}
{"N": 65536, "K": 16384, "D": 128, "B": 32, "dtype": "fp16", "BLOCK_N": 64, "BLOCK_K": 64, "num_warps": 4, "num_stages": 1, "time_ms": 28.83456039428711, "status": "ok"}
{"N": 65536, "K": 16384, "D": 128, "B": 32, "dtype": "fp16", "BLOCK_N": 64, "BLOCK_K": 64, "num_warps": 4, "num_stages": 2, "time_ms": 25.261823654174805, "status": "ok"}
{"N": 65536, "K": 16384, "D": 128, "B": 32, "dtype": "fp16", "BLOCK_N": 64, "BLOCK_K": 64, "num_warps": 4, "num_stages": 4, "time_ms": 26.163904190063477, "status": "ok"}
{"N": 65536, "K": 16384, "D": 128, "B": 32, "dtype": "fp16", "BLOCK_N": 64, "BLOCK_K": 64, "num_warps": 8, "num_stages": 1, "time_ms": 41.11616134643555, "status": "ok"}
{"N": 65536, "K": 16384, "D": 128, "B": 32, "dtype": "fp16", "BLOCK_N": 64, "BLOCK_K": 64, "num_warps": 8, "num_stages": 2, "time_ms": 35.5775032043457, "status": "ok"}
{"N": 65536, "K": 16384, "D": 128, "B": 32, "dtype": "fp16", "BLOCK_N": 64, "BLOCK_K": 64, "num_warps": 8, "num_stages": 4, "time_ms": 40.400638580322266, "status": "ok"}
{"N": 65536, "K": 16384, "D": 128, "B": 32, "dtype": "fp16", "BLOCK_N": 64, "BLOCK_K": 128, "num_warps": 4, "num_stages": 1, "time_ms": 26.00057601928711, "status": "ok"}
{"N": 65536, "K": 16384, "D": 128, "B": 32, "dtype": "fp16", "BLOCK_N": 64, "BLOCK_K": 128, "num_warps": 4, "num_stages": 2, "time_ms": 25.743839263916016, "status": "ok"}
{"N": 65536, "K": 16384, "D": 128, "B": 32, "dtype": "fp16", "BLOCK_N": 64, "BLOCK_K": 128, "num_warps": 4, "num_stages": 4, "time_ms": 31.445280075073242, "status": "ok"}
{"N": 65536, "K": 16384, "D": 128, "B": 32, "dtype": "fp16", "BLOCK_N": 64, "BLOCK_K": 128, "num_warps": 8, "num_stages": 1, "time_ms": 38.47862243652344, "status": "ok"}
{"N": 65536, "K": 16384, "D": 128, "B": 32, "dtype": "fp16", "BLOCK_N": 64, "BLOCK_K": 128, "num_warps": 8, "num_stages": 2, "time_ms": 32.77503967285156, "status": "ok"}
{"N": 65536, "K": 16384, "D": 128, "B": 32, "dtype": "fp16", "BLOCK_N": 64, "BLOCK_K": 128, "num_warps": 8, "num_stages": 4, "time_ms": 37.43360137939453, "status": "ok"}
{"N": 65536, "K": 16384, "D": 128, "B": 32, "dtype": "fp16", "BLOCK_N": 128, "BLOCK_K": 32, "num_warps": 4, "num_stages": 1, "time_ms": 27.956607818603516, "status": "ok"}
{"N": 65536, "K": 16384, "D": 128, "B": 32, "dtype": "fp16", "BLOCK_N": 128, "BLOCK_K": 32, "num_warps": 4, "num_stages": 2, "time_ms": 27.75663948059082, "status": "ok"}
{"N": 65536, "K": 16384, "D": 128, "B": 32, "dtype": "fp16", "BLOCK_N": 128, "BLOCK_K": 32, "num_warps": 4, "num_stages": 4, "time_ms": 28.85158348083496, "status": "ok"}
{"N": 65536, "K": 16384, "D": 128, "B": 32, "dtype": "fp16", "BLOCK_N": 128, "BLOCK_K": 32, "num_warps": 8, "num_stages": 1, "time_ms": 28.750207901000977, "status": "ok"}
{"N": 65536, "K": 16384, "D": 128, "B": 32, "dtype": "fp16", "BLOCK_N": 128, "BLOCK_K": 32, "num_warps": 8, "num_stages": 2, "time_ms": 27.754751205444336, "status": "ok"}
{"N": 65536, "K": 16384, "D": 128, "B": 32, "dtype": "fp16", "BLOCK_N": 128, "BLOCK_K": 32, "num_warps": 8, "num_stages": 4, "time_ms": 28.44646453857422, "status": "ok"}
{"N": 65536, "K": 16384, "D": 128, "B": 32, "dtype": "fp16", "BLOCK_N": 128, "BLOCK_K": 64, "num_warps": 4, "num_stages": 1, "time_ms": 25.159616470336914, "status": "ok"}
{"N": 65536, "K": 16384, "D": 128, "B": 32, "dtype": "fp16", "BLOCK_N": 128, "BLOCK_K": 64, "num_warps": 4, "num_stages": 2, "time_ms": 24.138784408569336, "status": "ok"}
{"N": 65536, "K": 16384, "D": 128, "B": 32, "dtype": "fp16", "BLOCK_N": 128, "BLOCK_K": 64, "num_warps": 4, "num_stages": 4, "time_ms": 24.497407913208008, "status": "ok"}
{"N": 65536, "K": 16384, "D": 128, "B": 32, "dtype": "fp16", "BLOCK_N": 128, "BLOCK_K": 64, "num_warps": 8, "num_stages": 1, "time_ms": 25.435327529907227, "status": "ok"}
{"N": 65536, "K": 16384, "D": 128, "B": 32, "dtype": "fp16", "BLOCK_N": 128, "BLOCK_K": 64, "num_warps": 8, "num_stages": 2, "time_ms": 24.989919662475586, "status": "ok"}
{"N": 65536, "K": 16384, "D": 128, "B": 32, "dtype": "fp16", "BLOCK_N": 128, "BLOCK_K": 64, "num_warps": 8, "num_stages": 4, "time_ms": 24.609024047851562, "status": "ok"}
{"N": 65536, "K": 16384, "D": 128, "B": 32, "dtype": "fp16", "BLOCK_N": 128, "BLOCK_K": 128, "num_warps": 4, "num_stages": 1, "time_ms": 24.010208129882812, "status": "ok"}
{"N": 65536, "K": 16384, "D": 128, "B": 32, "dtype": "fp16", "BLOCK_N": 128, "BLOCK_K": 128, "num_warps": 4, "num_stages": 2, "time_ms": 23.305984497070312, "status": "ok"}
{"N": 65536, "K": 16384, "D": 128, "B": 32, "dtype": "fp16", "BLOCK_N": 128, "BLOCK_K": 128, "num_warps": 4, "num_stages": 4, "time_ms": 26.99616050720215, "status": "ok"}
{"N": 65536, "K": 16384, "D": 128, "B": 32, "dtype": "fp16", "BLOCK_N": 128, "BLOCK_K": 128, "num_warps": 8, "num_stages": 1, "time_ms": 34.577823638916016, "status": "ok"}
{"N": 65536, "K": 16384, "D": 128, "B": 32, "dtype": "fp16", "BLOCK_N": 128, "BLOCK_K": 128, "num_warps": 8, "num_stages": 2, "time_ms": 22.75935935974121, "status": "ok"}
{"N": 65536, "K": 16384, "D": 128, "B": 32, "dtype": "fp16", "BLOCK_N": 128, "BLOCK_K": 128, "num_warps": 8, "num_stages": 4, "time_ms": 25.96847915649414, "status": "ok"}
{"summary": true, "N": 65536, "K": 16384, "D": 128, "B": 32, "dtype": "fp16", "best": {"N": 65536, "K": 16384, "D": 128, "B": 32, "dtype": "fp16", "BLOCK_N": 128, "BLOCK_K": 128, "num_warps": 8, "num_stages": 2, "time_ms": 22.75935935974121, "status": "ok"}, "best_time_ms": 22.75935935974121, "tuning_seconds": 33.21828007698059, "skipped": 0}
