grid_results_h100/N65536_K4096_D128_B32_fp16.jsonl
{"N": 65536, "K": 4096, "D": 128, "B": 32, "dtype": "fp16", "BLOCK_N": 32, "BLOCK_K": 32, "num_warps": 4, "num_stages": 1, "time_ms": 20.098848342895508, "status": "ok"}
{"N": 65536, "K": 4096, "D": 128, "B": 32, "dtype": "fp16", "BLOCK_N": 32, "BLOCK_K": 32, "num_warps": 4, "num_stages": 2, "time_ms": 16.388959884643555, "status": "ok"}
{"N": 65536, "K": 4096, "D": 128, "B": 32, "dtype": "fp16", "BLOCK_N": 32, "BLOCK_K": 32, "num_warps": 4, "num_stages": 4, "time_ms": 16.568096160888672, "status": "ok"}
{"N": 65536, "K": 4096, "D": 128, "B": 32, "dtype": "fp16", "BLOCK_N": 32, "BLOCK_K": 32, "num_warps": 8, "num_stages": 1, "time_ms": 29.332767486572266, "status": "ok"}
{"N": 65536, "K": 4096, "D": 128, "B": 32, "dtype": "fp16", "BLOCK_N": 32, "BLOCK_K": 32, "num_warps": 8, "num_stages": 2, "time_ms": 26.684255599975586, "status": "ok"}
{"N": 65536, "K": 4096, "D": 128, "B": 32, "dtype": "fp16", "BLOCK_N": 32, "BLOCK_K": 32, "num_warps": 8, "num_stages": 4, "time_ms": 26.30451202392578, "status": "ok"}
{"N": 65536, "K": 4096, "D": 128, "B": 32, "dtype": "fp16", "BLOCK_N": 32, "BLOCK_K": 64, "num_warps": 4, "num_stages": 1, "time_ms": 17.086048126220703, "status": "ok"}
{"N": 65536, "K": 4096, "D": 128, "B": 32, "dtype": "fp16", "BLOCK_N": 32, "BLOCK_K": 64, "num_warps": 4, "num_stages": 2, "time_ms": 13.448351860046387, "status": "ok"}
{"N": 65536, "K": 4096, "D": 128, "B": 32, "dtype": "fp16", "BLOCK_N": 32, "BLOCK_K": 64, "num_warps": 4, "num_stages": 4, "time_ms": 14.512703895568848, "status": "ok"}
{"N": 65536, "K": 4096, "D": 128, "B": 32, "dtype": "fp16", "BLOCK_N": 32, "BLOCK_K": 64, "num_warps": 8, "num_stages": 1, "time_ms": 20.693567276000977, "status": "ok"}
{"N": 65536, "K": 4096, "D": 128, "B": 32, "dtype": "fp16", "BLOCK_N": 32, "BLOCK_K": 64, "num_warps": 8, "num_stages": 2, "time_ms": 17.65839958190918, "status": "ok"}
{"N": 65536, "K": 4096, "D": 128, "B": 32, "dtype": "fp16", "BLOCK_N": 32, "BLOCK_K": 64, "num_warps": 8, "num_stages": 4, "time_ms": 17.64182472229004, "status": "ok"}
{"N": 65536, "K": 4096, "D": 128, "B": 32, "dtype": "fp16", "BLOCK_N": 32, "BLOCK_K": 128, "num_warps": 4, "num_stages": 1, "time_ms": 13.749855995178223, "status": "ok"}
{"N": 65536, "K": 4096, "D": 128, "B": 32, "dtype": "fp16", "BLOCK_N": 32, "BLOCK_K": 128, "num_warps": 4, "num_stages": 2, "time_ms": 10.852928161621094, "status": "ok"}
{"N": 65536, "K": 4096, "D": 128, "B": 32, "dtype": "fp16", "BLOCK_N": 32, "BLOCK_K": 128, "num_warps": 4, "num_stages": 4, "time_ms": 14.02070426940918, "status": "ok"}
{"N": 65536, "K": 4096, "D": 128, "B": 32, "dtype": "fp16", "BLOCK_N": 32, "BLOCK_K": 128, "num_warps": 8, "num_stages": 1, "time_ms": 18.467679977416992, "status": "ok"}
{"N": 65536, "K": 4096, "D": 128, "B": 32, "dtype": "fp16", "BLOCK_N": 32, "BLOCK_K": 128, "num_warps": 8, "num_stages": 2, "time_ms": 15.999199867248535, "status": "ok"}
{"N": 65536, "K": 4096, "D": 128, "B": 32, "dtype": "fp16", "BLOCK_N": 32, "BLOCK_K": 128, "num_warps": 8, "num_stages": 4, "time_ms": 16.263296127319336, "status": "ok"}
{"N": 65536, "K": 4096, "D": 128, "B": 32, "dtype": "fp16", "BLOCK_N": 64, "BLOCK_K": 32, "num_warps": 4, "num_stages": 1, "time_ms": 8.326432228088379, "status": "ok"}
{"N": 65536, "K": 4096, "D": 128, "B": 32, "dtype": "fp16", "BLOCK_N": 64, "BLOCK_K": 32, "num_warps": 4, "num_stages": 2, "time_ms": 6.696479797363281, "status": "ok"}
{"N": 65536, "K": 4096, "D": 128, "B": 32, "dtype": "fp16", "BLOCK_N": 64, "BLOCK_K": 32, "num_warps": 4, "num_stages": 4, "time_ms": 7.327199935913086, "status": "ok"}
{"N": 65536, "K": 4096, "D": 128, "B": 32, "dtype": "fp16", "BLOCK_N": 64, "BLOCK_K": 32, "num_warps": 8, "num_stages": 1, "time_ms": 14.708352088928223, "status": "ok"}
{"N": 65536, "K": 4096, "D": 128, "B": 32, "dtype": "fp16", "BLOCK_N": 64, "BLOCK_K": 32, "num_warps": 8, "num_stages": 2, "time_ms": 12.682720184326172, "status": "ok"}
{"N": 65536, "K": 4096, "D": 128, "B": 32, "dtype": "fp16", "BLOCK_N": 64, "BLOCK_K": 32, "num_warps": 8, "num_stages": 4, "time_ms": 12.707967758178711, "status": "ok"}
{"N": 65536, "K": 4096, "D": 128, "B": 32, "dtype": "fp16", "BLOCK_N": 64, "BLOCK_K": 64, "num_warps": 4, "num_stages": 1, "time_ms": 6.853055953979492, "status": "ok"}
{"N": 65536, "K": 4096, "D": 128, "B": 32, "dtype": "fp16", "BLOCK_N": 64, "BLOCK_K": 64, "num_warps": 4, "num_stages": 2, "time_ms": 5.884160041809082, "status": "ok"}
{"N": 65536, "K": 4096, "D": 128, "B": 32, "dtype": "fp16", "BLOCK_N": 64, "BLOCK_K": 64, "num_warps": 4, "num_stages": 4, "time_ms": 6.32473611831665, "status": "ok"}
{"N": 65536, "K": 4096, "D": 128, "B": 32, "dtype": "fp16", "BLOCK_N": 64, "BLOCK_K": 64, "num_warps": 8, "num_stages": 1, "time_ms": 10.241951942443848, "status": "ok"}
{"N": 65536, "K": 4096, "D": 128, "B": 32, "dtype": "fp16", "BLOCK_N": 64, "BLOCK_K": 64, "num_warps": 8, "num_stages": 2, "time_ms": 8.946944236755371, "status": "ok"}
{"N": 65536, "K": 4096, "D": 128, "B": 32, "dtype": "fp16", "BLOCK_N": 64, "BLOCK_K": 64, "num_warps": 8, "num_stages": 4, "time_ms": 10.232959747314453, "status": "ok"}
{"N": 65536, "K": 4096, "D": 128, "B": 32, "dtype": "fp16", "BLOCK_N": 64, "BLOCK_K": 128, "num_warps": 4, "num_stages": 1, "time_ms": 6.4112958908081055, "status": "ok"}
{"N": 65536, "K": 4096, "D": 128, "B": 32, "dtype": "fp16", "BLOCK_N": 64, "BLOCK_K": 128, "num_warps": 4, "num_stages": 2, "time_ms": 6.099679946899414, "status": "ok"}
{"N": 65536, "K": 4096, "D": 128, "B": 32, "dtype": "fp16", "BLOCK_N": 64, "BLOCK_K": 128, "num_warps": 4, "num_stages": 4, "time_ms": 8.215231895446777, "status": "ok"}
{"N": 65536, "K": 4096, "D": 128, "B": 32, "dtype": "fp16", "BLOCK_N": 64, "BLOCK_K": 128, "num_warps": 8, "num_stages": 1, "time_ms": 9.713312149047852, "status": "ok"}
{"N": 65536, "K": 4096, "D": 128, "B": 32, "dtype": "fp16", "BLOCK_N": 64, "BLOCK_K": 128, "num_warps": 8, "num_stages": 2, "time_ms": 8.3820161819458, "status": "ok"}
{"N": 65536, "K": 4096, "D": 128, "B": 32, "dtype": "fp16", "BLOCK_N": 64, "BLOCK_K": 128, "num_warps": 8, "num_stages": 4, "time_ms": 9.764800071716309, "status": "ok"}
{"N": 65536, "K": 4096, "D": 128, "B": 32, "dtype": "fp16", "BLOCK_N": 128, "BLOCK_K": 32, "num_warps": 4, "num_stages": 1, "time_ms": 6.926752090454102, "status": "ok"}
{"N": 65536, "K": 4096, "D": 128, "B": 32, "dtype": "fp16", "BLOCK_N": 128, "BLOCK_K": 32, "num_warps": 4, "num_stages": 2, "time_ms": 6.961343765258789, "status": "ok"}
{"N": 65536, "K": 4096, "D": 128, "B": 32, "dtype": "fp16", "BLOCK_N": 128, "BLOCK_K": 32, "num_warps": 4, "num_stages": 4, "time_ms": 7.262527942657471, "status": "ok"}
{"N": 65536, "K": 4096, "D": 128, "B": 32, "dtype": "fp16", "BLOCK_N": 128, "BLOCK_K": 32, "num_warps": 8, "num_stages": 1, "time_ms": 7.172063827514648, "status": "ok"}
{"N": 65536, "K": 4096, "D": 128, "B": 32, "dtype": "fp16", "BLOCK_N": 128, "BLOCK_K": 32, "num_warps": 8, "num_stages": 2, "time_ms": 7.022975921630859, "status": "ok"}
{"N": 65536, "K": 4096, "D": 128, "B": 32, "dtype": "fp16", "BLOCK_N": 128, "BLOCK_K": 32, "num_warps": 8, "num_stages": 4, "time_ms": 7.249279975891113, "status": "ok"}
{"N": 65536, "K": 4096, "D": 128, "B": 32, "dtype": "fp16", "BLOCK_N": 128, "BLOCK_K": 64, "num_warps": 4, "num_stages": 1, "time_ms": 5.90883207321167, "status": "ok"}
{"N": 65536, "K": 4096, "D": 128, "B": 32, "dtype": "fp16", "BLOCK_N": 128, "BLOCK_K": 64, "num_warps": 4, "num_stages": 2, "time_ms": 5.967967987060547, "status": "ok"}
{"N": 65536, "K": 4096, "D": 128, "B": 32, "dtype": "fp16", "BLOCK_N": 128, "BLOCK_K": 64, "num_warps": 4, "num_stages": 4, "time_ms": 6.058080196380615, "status": "ok"}
{"N": 65536, "K": 4096, "D": 128, "B": 32, "dtype": "fp16", "BLOCK_N": 128, "BLOCK_K": 64, "num_warps": 8, "num_stages": 1, "time_ms": 6.259232044219971, "status": "ok"}
{"N": 65536, "K": 4096, "D": 128, "B": 32, "dtype": "fp16", "BLOCK_N": 128, "BLOCK_K": 64, "num_warps": 8, "num_stages": 2, "time_ms": 6.162367820739746, "status": "ok"}
{"N": 65536, "K": 4096, "D": 128, "B": 32, "dtype": "fp16", "BLOCK_N": 128, "BLOCK_K": 64, "num_warps": 8, "num_stages": 4, "time_ms": 6.191711902618408, "status": "ok"}
{"N": 65536, "K": 4096, "D": 128, "B": 32, "dtype": "fp16", "BLOCK_N": 128, "BLOCK_K": 128, "num_warps": 4, "num_stages": 1, "time_ms": 6.040895938873291, "status": "ok"}
{"N": 65536, "K": 4096, "D": 128, "B": 32, "dtype": "fp16", "BLOCK_N": 128, "BLOCK_K": 128, "num_warps": 4, "num_stages": 2, "time_ms": 5.7288641929626465, "status": "ok"}
{"N": 65536, "K": 4096, "D": 128, "B": 32, "dtype": "fp16", "BLOCK_N": 128, "BLOCK_K": 128, "num_warps": 4, "num_stages": 4, "time_ms": 7.050591945648193, "status": "ok"}
{"N": 65536, "K": 4096, "D": 128, "B": 32, "dtype": "fp16", "BLOCK_N": 128, "BLOCK_K": 128, "num_warps": 8, "num_stages": 1, "time_ms": 8.937312126159668, "status": "ok"}
{"N": 65536, "K": 4096, "D": 128, "B": 32, "dtype": "fp16", "BLOCK_N": 128, "BLOCK_K": 128, "num_warps": 8, "num_stages": 2, "time_ms": 5.616511821746826, "status": "ok"}
{"N": 65536, "K": 4096, "D": 128, "B": 32, "dtype": "fp16", "BLOCK_N": 128, "BLOCK_K": 128, "num_warps": 8, "num_stages": 4, "time_ms": 6.675680160522461, "status": "ok"}
{"summary": true, "N": 65536, "K": 4096, "D": 128, "B": 32, "dtype": "fp16", "best": {"N": 65536, "K": 4096, "D": 128, "B": 32, "dtype": "fp16", "BLOCK_N": 128, "BLOCK_K": 128, "num_warps": 8, "num_stages": 2, "time_ms": 5.616511821746826, "status": "ok"}, "best_time_ms": 5.616511821746826, "tuning_seconds": 18.699971437454224, "skipped": 0}
