grid_results_h100/N65536_K1024_D128_B32_fp16.jsonl
{"N": 65536, "K": 1024, "D": 128, "B": 32, "dtype": "fp16", "BLOCK_N": 32, "BLOCK_K": 32, "num_warps": 4, "num_stages": 1, "time_ms": 5.180287837982178, "status": "ok"}
{"N": 65536, "K": 1024, "D": 128, "B": 32, "dtype": "fp16", "BLOCK_N": 32, "BLOCK_K": 32, "num_warps": 4, "num_stages": 2, "time_ms": 4.195136070251465, "status": "ok"}
{"N": 65536, "K": 1024, "D": 128, "B": 32, "dtype": "fp16", "BLOCK_N": 32, "BLOCK_K": 32, "num_warps": 4, "num_stages": 4, "time_ms": 4.314271926879883, "status": "ok"}
{"N": 65536, "K": 1024, "D": 128, "B": 32, "dtype": "fp16", "BLOCK_N": 32, "BLOCK_K": 32, "num_warps": 8, "num_stages": 1, "time_ms": 7.5472002029418945, "status": "ok"}
{"N": 65536, "K": 1024, "D": 128, "B": 32, "dtype": "fp16", "BLOCK_N": 32, "BLOCK_K": 32, "num_warps": 8, "num_stages": 2, "time_ms": 6.89299201965332, "status": "ok"}
{"N": 65536, "K": 1024, "D": 128, "B": 32, "dtype": "fp16", "BLOCK_N": 32, "BLOCK_K": 32, "num_warps": 8, "num_stages": 4, "time_ms": 6.841504096984863, "status": "ok"}
{"N": 65536, "K": 1024, "D": 128, "B": 32, "dtype": "fp16", "BLOCK_N": 32, "BLOCK_K": 64, "num_warps": 4, "num_stages": 1, "time_ms": 4.387936115264893, "status": "ok"}
{"N": 65536, "K": 1024, "D": 128, "B": 32, "dtype": "fp16", "BLOCK_N": 32, "BLOCK_K": 64, "num_warps": 4, "num_stages": 2, "time_ms": 3.4435839653015137, "status": "ok"}
{"N": 65536, "K": 1024, "D": 128, "B": 32, "dtype": "fp16", "BLOCK_N": 32, "BLOCK_K": 64, "num_warps": 4, "num_stages": 4, "time_ms": 3.8104639053344727, "status": "ok"}
{"N": 65536, "K": 1024, "D": 128, "B": 32, "dtype": "fp16", "BLOCK_N": 32, "BLOCK_K": 64, "num_warps": 8, "num_stages": 1, "time_ms": 5.346879959106445, "status": "ok"}
{"N": 65536, "K": 1024, "D": 128, "B": 32, "dtype": "fp16", "BLOCK_N": 32, "BLOCK_K": 64, "num_warps": 8, "num_stages": 2, "time_ms": 4.511231899261475, "status": "ok"}
{"N": 65536, "K": 1024, "D": 128, "B": 32, "dtype": "fp16", "BLOCK_N": 32, "BLOCK_K": 64, "num_warps": 8, "num_stages": 4, "time_ms": 4.625088214874268, "status": "ok"}
{"N": 65536, "K": 1024, "D": 128, "B": 32, "dtype": "fp16", "BLOCK_N": 32, "BLOCK_K": 128, "num_warps": 4, "num_stages": 1, "time_ms": 3.50598406791687, "status": "ok"}
{"N": 65536, "K": 1024, "D": 128, "B": 32, "dtype": "fp16", "BLOCK_N": 32, "BLOCK_K": 128, "num_warps": 4, "num_stages": 2, "time_ms": 2.795423984527588, "status": "ok"}
{"N": 65536, "K": 1024, "D": 128, "B": 32, "dtype": "fp16", "BLOCK_N": 32, "BLOCK_K": 128, "num_warps": 4, "num_stages": 4, "time_ms": 3.69702410697937, "status": "ok"}
{"N": 65536, "K": 1024, "D": 128, "B": 32, "dtype": "fp16", "BLOCK_N": 32, "BLOCK_K": 128, "num_warps": 8, "num_stages": 1, "time_ms": 4.774720191955566, "status": "ok"}
{"N": 65536, "K": 1024, "D": 128, "B": 32, "dtype": "fp16", "BLOCK_N": 32, "BLOCK_K": 128, "num_warps": 8, "num_stages": 2, "time_ms": 4.178336143493652, "status": "ok"}
{"N": 65536, "K": 1024, "D": 128, "B": 32, "dtype": "fp16", "BLOCK_N": 32, "BLOCK_K": 128, "num_warps": 8, "num_stages": 4, "time_ms": 4.419487953186035, "status": "ok"}
{"N": 65536, "K": 1024, "D": 128, "B": 32, "dtype": "fp16", "BLOCK_N": 64, "BLOCK_K": 32, "num_warps": 4, "num_stages": 1, "time_ms": 2.04912006855011, "status": "ok"}
{"N": 65536, "K": 1024, "D": 128, "B": 32, "dtype": "fp16", "BLOCK_N": 64, "BLOCK_K": 32, "num_warps": 4, "num_stages": 2, "time_ms": 1.7625920176506042, "status": "ok"}
{"N": 65536, "K": 1024, "D": 128, "B": 32, "dtype": "fp16", "BLOCK_N": 64, "BLOCK_K": 32, "num_warps": 4, "num_stages": 4, "time_ms": 1.8434560298919678, "status": "ok"}
{"N": 65536, "K": 1024, "D": 128, "B": 32, "dtype": "fp16", "BLOCK_N": 64, "BLOCK_K": 32, "num_warps": 8, "num_stages": 1, "time_ms": 3.7334721088409424, "status": "ok"}
{"N": 65536, "K": 1024, "D": 128, "B": 32, "dtype": "fp16", "BLOCK_N": 64, "BLOCK_K": 32, "num_warps": 8, "num_stages": 2, "time_ms": 3.283168077468872, "status": "ok"}
{"N": 65536, "K": 1024, "D": 128, "B": 32, "dtype": "fp16", "BLOCK_N": 64, "BLOCK_K": 32, "num_warps": 8, "num_stages": 4, "time_ms": 3.3390400409698486, "status": "ok"}
{"N": 65536, "K": 1024, "D": 128, "B": 32, "dtype": "fp16", "BLOCK_N": 64, "BLOCK_K": 64, "num_warps": 4, "num_stages": 1, "time_ms": 1.721119999885559, "status": "ok"}
{"N": 65536, "K": 1024, "D": 128, "B": 32, "dtype": "fp16", "BLOCK_N": 64, "BLOCK_K": 64, "num_warps": 4, "num_stages": 2, "time_ms": 1.5358826716740925, "status": "ok"}
{"N": 65536, "K": 1024, "D": 128, "B": 32, "dtype": "fp16", "BLOCK_N": 64, "BLOCK_K": 64, "num_warps": 4, "num_stages": 4, "time_ms": 1.7074880003929138, "status": "ok"}
{"N": 65536, "K": 1024, "D": 128, "B": 32, "dtype": "fp16", "BLOCK_N": 64, "BLOCK_K": 64, "num_warps": 8, "num_stages": 1, "time_ms": 2.6236159801483154, "status": "ok"}
{"N": 65536, "K": 1024, "D": 128, "B": 32, "dtype": "fp16", "BLOCK_N": 64, "BLOCK_K": 64, "num_warps": 8, "num_stages": 2, "time_ms": 2.321776032447815, "status": "ok"}
{"N": 65536, "K": 1024, "D": 128, "B": 32, "dtype": "fp16", "BLOCK_N": 64, "BLOCK_K": 64, "num_warps": 8, "num_stages": 4, "time_ms": 2.6793599128723145, "status": "ok"}
{"N": 65536, "K": 1024, "D": 128, "B": 32, "dtype": "fp16", "BLOCK_N": 64, "BLOCK_K": 128, "num_warps": 4, "num_stages": 1, "time_ms": 1.5895040035247803, "status": "ok"}
{"N": 65536, "K": 1024, "D": 128, "B": 32, "dtype": "fp16", "BLOCK_N": 64, "BLOCK_K": 128, "num_warps": 4, "num_stages": 2, "time_ms": 1.6633439660072327, "status": "ok"}
{"N": 65536, "K": 1024, "D": 128, "B": 32, "dtype": "fp16", "BLOCK_N": 64, "BLOCK_K": 128, "num_warps": 4, "num_stages": 4, "time_ms": 2.316815972328186, "status": "ok"}
{"N": 65536, "K": 1024, "D": 128, "B": 32, "dtype": "fp16", "BLOCK_N": 64, "BLOCK_K": 128, "num_warps": 8, "num_stages": 1, "time_ms": 2.4943039417266846, "status": "ok"}
{"N": 65536, "K": 1024, "D": 128, "B": 32, "dtype": "fp16", "BLOCK_N": 64, "BLOCK_K": 128, "num_warps": 8, "num_stages": 2, "time_ms": 2.2255359888076782, "status": "ok"}
{"N": 65536, "K": 1024, "D": 128, "B": 32, "dtype": "fp16", "BLOCK_N": 64, "BLOCK_K": 128, "num_warps": 8, "num_stages": 4, "time_ms": 2.753119945526123, "status": "ok"}
{"N": 65536, "K": 1024, "D": 128, "B": 32, "dtype": "fp16", "BLOCK_N": 128, "BLOCK_K": 32, "num_warps": 4, "num_stages": 1, "time_ms": 1.784928023815155, "status": "ok"}
{"N": 65536, "K": 1024, "D": 128, "B": 32, "dtype": "fp16", "BLOCK_N": 128, "BLOCK_K": 32, "num_warps": 4, "num_stages": 2, "time_ms": 1.8088640570640564, "status": "ok"}
{"N": 65536, "K": 1024, "D": 128, "B": 32, "dtype": "fp16", "BLOCK_N": 128, "BLOCK_K": 32, "num_warps": 4, "num_stages": 4, "time_ms": 1.8968960046768188, "status": "ok"}
{"N": 65536, "K": 1024, "D": 128, "B": 32, "dtype": "fp16", "BLOCK_N": 128, "BLOCK_K": 32, "num_warps": 8, "num_stages": 1, "time_ms": 1.8414239883422852, "status": "ok"}
{"N": 65536, "K": 1024, "D": 128, "B": 32, "dtype": "fp16", "BLOCK_N": 128, "BLOCK_K": 32, "num_warps": 8, "num_stages": 2, "time_ms": 1.808415949344635, "status": "ok"}
{"N": 65536, "K": 1024, "D": 128, "B": 32, "dtype": "fp16", "BLOCK_N": 128, "BLOCK_K": 32, "num_warps": 8, "num_stages": 4, "time_ms": 1.8657919764518738, "status": "ok"}
{"N": 65536, "K": 1024, "D": 128, "B": 32, "dtype": "fp16", "BLOCK_N": 128, "BLOCK_K": 64, "num_warps": 4, "num_stages": 1, "time_ms": 1.5343146721522014, "status": "ok"}
{"N": 65536, "K": 1024, "D": 128, "B": 32, "dtype": "fp16", "BLOCK_N": 128, "BLOCK_K": 64, "num_warps": 4, "num_stages": 2, "time_ms": 1.5688639879226685, "status": "ok"}
{"N": 65536, "K": 1024, "D": 128, "B": 32, "dtype": "fp16", "BLOCK_N": 128, "BLOCK_K": 64, "num_warps": 4, "num_stages": 4, "time_ms": 1.5999360084533691, "status": "ok"}
{"N": 65536, "K": 1024, "D": 128, "B": 32, "dtype": "fp16", "BLOCK_N": 128, "BLOCK_K": 64, "num_warps": 8, "num_stages": 1, "time_ms": 1.6478559970855713, "status": "ok"}
{"N": 65536, "K": 1024, "D": 128, "B": 32, "dtype": "fp16", "BLOCK_N": 128, "BLOCK_K": 64, "num_warps": 8, "num_stages": 2, "time_ms": 1.610047996044159, "status": "ok"}
{"N": 65536, "K": 1024, "D": 128, "B": 32, "dtype": "fp16", "BLOCK_N": 128, "BLOCK_K": 64, "num_warps": 8, "num_stages": 4, "time_ms": 1.6134560108184814, "status": "ok"}
{"N": 65536, "K": 1024, "D": 128, "B": 32, "dtype": "fp16", "BLOCK_N": 128, "BLOCK_K": 128, "num_warps": 4, "num_stages": 1, "time_ms": 1.6248800158500671, "status": "ok"}
{"N": 65536, "K": 1024, "D": 128, "B": 32, "dtype": "fp16", "BLOCK_N": 128, "BLOCK_K": 128, "num_warps": 4, "num_stages": 2, "time_ms": 1.5285333395004272, "status": "ok"}
{"N": 65536, "K": 1024, "D": 128, "B": 32, "dtype": "fp16", "BLOCK_N": 128, "BLOCK_K": 128, "num_warps": 4, "num_stages": 4, "time_ms": 1.9693920016288757, "status": "ok"}
{"N": 65536, "K": 1024, "D": 128, "B": 32, "dtype": "fp16", "BLOCK_N": 128, "BLOCK_K": 128, "num_warps": 8, "num_stages": 1, "time_ms": 2.3935359716415405, "status": "ok"}
{"N": 65536, "K": 1024, "D": 128, "B": 32, "dtype": "fp16", "BLOCK_N": 128, "BLOCK_K": 128, "num_warps": 8, "num_stages": 2, "time_ms": 1.5104960203170776, "status": "ok"}
{"N": 65536, "K": 1024, "D": 128, "B": 32, "dtype": "fp16", "BLOCK_N": 128, "BLOCK_K": 128, "num_warps": 8, "num_stages": 4, "time_ms": 1.861840009689331, "status": "ok"}
{"summary": true, "N": 65536, "K": 1024, "D": 128, "B": 32, "dtype": "fp16", "best": {"N": 65536, "K": 1024, "D": 128, "B": 32, "dtype": "fp16", "BLOCK_N": 128, "BLOCK_K": 128, "num_warps": 8, "num_stages": 2, "time_ms": 1.5104960203170776, "status": "ok"}, "best_time_ms": 1.5104960203170776, "tuning_seconds": 15.389177560806274, "skipped": 0}
