grid_results_h100/N65536_K4096_D512_B1_fp16.jsonl
{"N": 65536, "K": 4096, "D": 512, "B": 1, "dtype": "fp16", "BLOCK_N": 32, "BLOCK_K": 32, "num_warps": 4, "num_stages": 1, "time_ms": 2.278208017349243, "status": "ok"}
{"N": 65536, "K": 4096, "D": 512, "B": 1, "dtype": "fp16", "BLOCK_N": 32, "BLOCK_K": 32, "num_warps": 4, "num_stages": 2, "time_ms": 2.018720030784607, "status": "ok"}
{"N": 65536, "K": 4096, "D": 512, "B": 1, "dtype": "fp16", "BLOCK_N": 32, "BLOCK_K": 32, "num_warps": 4, "num_stages": 4, "time_ms": 2.850399971008301, "status": "ok"}
{"N": 65536, "K": 4096, "D": 512, "B": 1, "dtype": "fp16", "BLOCK_N": 32, "BLOCK_K": 32, "num_warps": 8, "num_stages": 1, "time_ms": 2.9339840412139893, "status": "ok"}
{"N": 65536, "K": 4096, "D": 512, "B": 1, "dtype": "fp16", "BLOCK_N": 32, "BLOCK_K": 32, "num_warps": 8, "num_stages": 2, "time_ms": 2.4570560455322266, "status": "ok"}
{"N": 65536, "K": 4096, "D": 512, "B": 1, "dtype": "fp16", "BLOCK_N": 32, "BLOCK_K": 32, "num_warps": 8, "num_stages": 4, "time_ms": 2.8717119693756104, "status": "ok"}
{"N": 65536, "K": 4096, "D": 512, "B": 1, "dtype": "fp16", "BLOCK_N": 32, "BLOCK_K": 64, "num_warps": 4, "num_stages": 1, "time_ms": 1.9727840423583984, "status": "ok"}
{"N": 65536, "K": 4096, "D": 512, "B": 1, "dtype": "fp16", "BLOCK_N": 32, "BLOCK_K": 64, "num_warps": 4, "num_stages": 2, "time_ms": 1.525429328282674, "status": "ok"}
{"N": 65536, "K": 4096, "D": 512, "B": 1, "dtype": "fp16", "BLOCK_N": 32, "BLOCK_K": 64, "num_warps": 4, "num_stages": 4, "time_ms": 2.0359840393066406, "status": "ok"}
{"N": 65536, "K": 4096, "D": 512, "B": 1, "dtype": "fp16", "BLOCK_N": 32, "BLOCK_K": 64, "num_warps": 8, "num_stages": 1, "time_ms": 2.2441920042037964, "status": "ok"}
{"N": 65536, "K": 4096, "D": 512, "B": 1, "dtype": "fp16", "BLOCK_N": 32, "BLOCK_K": 64, "num_warps": 8, "num_stages": 2, "time_ms": 1.7554559707641602, "status": "ok"}
{"N": 65536, "K": 4096, "D": 512, "B": 1, "dtype": "fp16", "BLOCK_N": 32, "BLOCK_K": 64, "num_warps": 8, "num_stages": 4, "time_ms": 2.1167999505996704, "status": "ok"}
{"N": 65536, "K": 4096, "D": 512, "B": 1, "dtype": "fp16", "BLOCK_N": 32, "BLOCK_K": 128, "num_warps": 4, "num_stages": 1, "time_ms": 2.2604000568389893, "status": "ok"}
{"N": 65536, "K": 4096, "D": 512, "B": 1, "dtype": "fp16", "BLOCK_N": 32, "BLOCK_K": 128, "num_warps": 4, "num_stages": 2, "time_ms": 1.650767982006073, "status": "ok"}
{"N": 65536, "K": 4096, "D": 512, "B": 1, "dtype": "fp16", "BLOCK_N": 32, "BLOCK_K": 128, "num_warps": 4, "num_stages": 4, "status": "oor"}
{"N": 65536, "K": 4096, "D": 512, "B": 1, "dtype": "fp16", "BLOCK_N": 32, "BLOCK_K": 128, "num_warps": 8, "num_stages": 1, "time_ms": 2.099152088165283, "status": "ok"}
{"N": 65536, "K": 4096, "D": 512, "B": 1, "dtype": "fp16", "BLOCK_N": 32, "BLOCK_K": 128, "num_warps": 8, "num_stages": 2, "time_ms": 1.919983983039856, "status": "ok"}
{"N": 65536, "K": 4096, "D": 512, "B": 1, "dtype": "fp16", "BLOCK_N": 32, "BLOCK_K": 128, "num_warps": 8, "num_stages": 4, "status": "oor"}
{"N": 65536, "K": 4096, "D": 512, "B": 1, "dtype": "fp16", "BLOCK_N": 64, "BLOCK_K": 32, "num_warps": 4, "num_stages": 1, "time_ms": 0.980463981628418, "status": "ok"}
{"N": 65536, "K": 4096, "D": 512, "B": 1, "dtype": "fp16", "BLOCK_N": 64, "BLOCK_K": 32, "num_warps": 4, "num_stages": 2, "time_ms": 1.1512000262737274, "status": "ok"}
{"N": 65536, "K": 4096, "D": 512, "B": 1, "dtype": "fp16", "BLOCK_N": 64, "BLOCK_K": 32, "num_warps": 4, "num_stages": 4, "time_ms": 0.8727488040924072, "status": "ok"}
{"N": 65536, "K": 4096, "D": 512, "B": 1, "dtype": "fp16", "BLOCK_N": 64, "BLOCK_K": 32, "num_warps": 8, "num_stages": 1, "time_ms": 1.4378666480382283, "status": "ok"}
{"N": 65536, "K": 4096, "D": 512, "B": 1, "dtype": "fp16", "BLOCK_N": 64, "BLOCK_K": 32, "num_warps": 8, "num_stages": 2, "time_ms": 1.5951040387153625, "status": "ok"}
{"N": 65536, "K": 4096, "D": 512, "B": 1, "dtype": "fp16", "BLOCK_N": 64, "BLOCK_K": 32, "num_warps": 8, "num_stages": 4, "time_ms": 1.3382506767908733, "status": "ok"}
{"N": 65536, "K": 4096, "D": 512, "B": 1, "dtype": "fp16", "BLOCK_N": 64, "BLOCK_K": 64, "num_warps": 4, "num_stages": 1, "time_ms": 1.096367985010147, "status": "ok"}
{"N": 65536, "K": 4096, "D": 512, "B": 1, "dtype": "fp16", "BLOCK_N": 64, "BLOCK_K": 64, "num_warps": 4, "num_stages": 2, "time_ms": 0.861190390586853, "status": "ok"}
{"N": 65536, "K": 4096, "D": 512, "B": 1, "dtype": "fp16", "BLOCK_N": 64, "BLOCK_K": 64, "num_warps": 4, "num_stages": 4, "status": "oor"}
{"N": 65536, "K": 4096, "D": 512, "B": 1, "dtype": "fp16", "BLOCK_N": 64, "BLOCK_K": 64, "num_warps": 8, "num_stages": 1, "time_ms": 1.1959679921468098, "status": "ok"}
{"N": 65536, "K": 4096, "D": 512, "B": 1, "dtype": "fp16", "BLOCK_N": 64, "BLOCK_K": 64, "num_warps": 8, "num_stages": 2, "time_ms": 1.0477440357208252, "status": "ok"}
{"N": 65536, "K": 4096, "D": 512, "B": 1, "dtype": "fp16", "BLOCK_N": 64, "BLOCK_K": 64, "num_warps": 8, "num_stages": 4, "status": "oor"}
{"N": 65536, "K": 4096, "D": 512, "B": 1, "dtype": "fp16", "BLOCK_N": 64, "BLOCK_K": 128, "num_warps": 4, "num_stages": 1, "time_ms": 1.1540879905223846, "status": "ok"}
{"N": 65536, "K": 4096, "D": 512, "B": 1, "dtype": "fp16", "BLOCK_N": 64, "BLOCK_K": 128, "num_warps": 4, "num_stages": 2, "status": "oor"}
{"N": 65536, "K": 4096, "D": 512, "B": 1, "dtype": "fp16", "BLOCK_N": 64, "BLOCK_K": 128, "num_warps": 4, "num_stages": 4, "status": "oor"}
{"N": 65536, "K": 4096, "D": 512, "B": 1, "dtype": "fp16", "BLOCK_N": 64, "BLOCK_K": 128, "num_warps": 8, "num_stages": 1, "time_ms": 0.9705599844455719, "status": "ok"}
{"N": 65536, "K": 4096, "D": 512, "B": 1, "dtype": "fp16", "BLOCK_N": 64, "BLOCK_K": 128, "num_warps": 8, "num_stages": 2, "status": "oor"}
{"N": 65536, "K": 4096, "D": 512, "B": 1, "dtype": "fp16", "BLOCK_N": 64, "BLOCK_K": 128, "num_warps": 8, "num_stages": 4, "status": "oor"}
{"N": 65536, "K": 4096, "D": 512, "B": 1, "dtype": "fp16", "BLOCK_N": 128, "BLOCK_K": 32, "num_warps": 4, "num_stages": 1, "time_ms": 1.0173439979553223, "status": "ok"}
{"N": 65536, "K": 4096, "D": 512, "B": 1, "dtype": "fp16", "BLOCK_N": 128, "BLOCK_K": 32, "num_warps": 4, "num_stages": 2, "time_ms": 0.9041471958160401, "status": "ok"}
{"N": 65536, "K": 4096, "D": 512, "B": 1, "dtype": "fp16", "BLOCK_N": 128, "BLOCK_K": 32, "num_warps": 4, "num_stages": 4, "status": "oor"}
{"N": 65536, "K": 4096, "D": 512, "B": 1, "dtype": "fp16", "BLOCK_N": 128, "BLOCK_K": 32, "num_warps": 8, "num_stages": 1, "time_ms": 0.9579759985208511, "status": "ok"}
{"N": 65536, "K": 4096, "D": 512, "B": 1, "dtype": "fp16", "BLOCK_N": 128, "BLOCK_K": 32, "num_warps": 8, "num_stages": 2, "time_ms": 0.8805311918258667, "status": "ok"}
{"N": 65536, "K": 4096, "D": 512, "B": 1, "dtype": "fp16", "BLOCK_N": 128, "BLOCK_K": 32, "num_warps": 8, "num_stages": 4, "status": "oor"}
{"N": 65536, "K": 4096, "D": 512, "B": 1, "dtype": "fp16", "BLOCK_N": 128, "BLOCK_K": 64, "num_warps": 4, "num_stages": 1, "time_ms": 0.7944448113441467, "status": "ok"}
{"N": 65536, "K": 4096, "D": 512, "B": 1, "dtype": "fp16", "BLOCK_N": 128, "BLOCK_K": 64, "num_warps": 4, "num_stages": 2, "status": "oor"}
{"N": 65536, "K": 4096, "D": 512, "B": 1, "dtype": "fp16", "BLOCK_N": 128, "BLOCK_K": 64, "num_warps": 4, "num_stages": 4, "status": "oor"}
{"N": 65536, "K": 4096, "D": 512, "B": 1, "dtype": "fp16", "BLOCK_N": 128, "BLOCK_K": 64, "num_warps": 8, "num_stages": 1, "time_ms": 0.7445887923240662, "status": "ok"}
{"N": 65536, "K": 4096, "D": 512, "B": 1, "dtype": "fp16", "BLOCK_N": 128, "BLOCK_K": 64, "num_warps": 8, "num_stages": 2, "status": "oor"}
{"N": 65536, "K": 4096, "D": 512, "B": 1, "dtype": "fp16", "BLOCK_N": 128, "BLOCK_K": 64, "num_warps": 8, "num_stages": 4, "status": "oor"}
{"N": 65536, "K": 4096, "D": 512, "B": 1, "dtype": "fp16", "BLOCK_N": 128, "BLOCK_K": 128, "num_warps": 4, "num_stages": 1, "status": "oor"}
{"N": 65536, "K": 4096, "D": 512, "B": 1, "dtype": "fp16", "BLOCK_N": 128, "BLOCK_K": 128, "num_warps": 4, "num_stages": 2, "status": "oor"}
{"N": 65536, "K": 4096, "D": 512, "B": 1, "dtype": "fp16", "BLOCK_N": 128, "BLOCK_K": 128, "num_warps": 4, "num_stages": 4, "status": "oor"}
{"N": 65536, "K": 4096, "D": 512, "B": 1, "dtype": "fp16", "BLOCK_N": 128, "BLOCK_K": 128, "num_warps": 8, "num_stages": 1, "status": "oor"}
{"N": 65536, "K": 4096, "D": 512, "B": 1, "dtype": "fp16", "BLOCK_N": 128, "BLOCK_K": 128, "num_warps": 8, "num_stages": 2, "status": "oor"}
{"N": 65536, "K": 4096, "D": 512, "B": 1, "dtype": "fp16", "BLOCK_N": 128, "BLOCK_K": 128, "num_warps": 8, "num_stages": 4, "status": "oor"}
{"summary": true, "N": 65536, "K": 4096, "D": 512, "B": 1, "dtype": "fp16", "best": {"N": 65536, "K": 4096, "D": 512, "B": 1, "dtype": "fp16", "BLOCK_N": 128, "BLOCK_K": 64, "num_warps": 8, "num_stages": 1, "time_ms": 0.7445887923240662, "status": "ok"}, "best_time_ms": 0.7445887923240662, "tuning_seconds": 27.577739238739014, "skipped": 20}
