grid_results_h100/N65536_K16384_D128_B1_fp16.jsonl
{"N": 65536, "K": 16384, "D": 128, "B": 1, "dtype": "fp16", "BLOCK_N": 32, "BLOCK_K": 32, "num_warps": 4, "num_stages": 1, "time_ms": 2.7180800437927246, "status": "ok"}
{"N": 65536, "K": 16384, "D": 128, "B": 1, "dtype": "fp16", "BLOCK_N": 32, "BLOCK_K": 32, "num_warps": 4, "num_stages": 2, "time_ms": 2.224511981010437, "status": "ok"}
{"N": 65536, "K": 16384, "D": 128, "B": 1, "dtype": "fp16", "BLOCK_N": 32, "BLOCK_K": 32, "num_warps": 4, "num_stages": 4, "time_ms": 2.186560034751892, "status": "ok"}
{"N": 65536, "K": 16384, "D": 128, "B": 1, "dtype": "fp16", "BLOCK_N": 32, "BLOCK_K": 32, "num_warps": 8, "num_stages": 1, "time_ms": 4.058879852294922, "status": "ok"}
{"N": 65536, "K": 16384, "D": 128, "B": 1, "dtype": "fp16", "BLOCK_N": 32, "BLOCK_K": 32, "num_warps": 8, "num_stages": 2, "time_ms": 3.604032039642334, "status": "ok"}
{"N": 65536, "K": 16384, "D": 128, "B": 1, "dtype": "fp16", "BLOCK_N": 32, "BLOCK_K": 32, "num_warps": 8, "num_stages": 4, "time_ms": 3.5462400913238525, "status": "ok"}
{"N": 65536, "K": 16384, "D": 128, "B": 1, "dtype": "fp16", "BLOCK_N": 32, "BLOCK_K": 64, "num_warps": 4, "num_stages": 1, "time_ms": 2.285775899887085, "status": "ok"}
{"N": 65536, "K": 16384, "D": 128, "B": 1, "dtype": "fp16", "BLOCK_N": 32, "BLOCK_K": 64, "num_warps": 4, "num_stages": 2, "time_ms": 1.8116000294685364, "status": "ok"}
{"N": 65536, "K": 16384, "D": 128, "B": 1, "dtype": "fp16", "BLOCK_N": 32, "BLOCK_K": 64, "num_warps": 4, "num_stages": 4, "time_ms": 2.110864043235779, "status": "ok"}
{"N": 65536, "K": 16384, "D": 128, "B": 1, "dtype": "fp16", "BLOCK_N": 32, "BLOCK_K": 64, "num_warps": 8, "num_stages": 1, "time_ms": 2.788127899169922, "status": "ok"}
{"N": 65536, "K": 16384, "D": 128, "B": 1, "dtype": "fp16", "BLOCK_N": 32, "BLOCK_K": 64, "num_warps": 8, "num_stages": 2, "time_ms": 2.3324960470199585, "status": "ok"}
{"N": 65536, "K": 16384, "D": 128, "B": 1, "dtype": "fp16", "BLOCK_N": 32, "BLOCK_K": 64, "num_warps": 8, "num_stages": 4, "time_ms": 2.335376024246216, "status": "ok"}
{"N": 65536, "K": 16384, "D": 128, "B": 1, "dtype": "fp16", "BLOCK_N": 32, "BLOCK_K": 128, "num_warps": 4, "num_stages": 1, "time_ms": 1.8266080021858215, "status": "ok"}
{"N": 65536, "K": 16384, "D": 128, "B": 1, "dtype": "fp16", "BLOCK_N": 32, "BLOCK_K": 128, "num_warps": 4, "num_stages": 2, "time_ms": 1.408021330833435, "status": "ok"}
{"N": 65536, "K": 16384, "D": 128, "B": 1, "dtype": "fp16", "BLOCK_N": 32, "BLOCK_K": 128, "num_warps": 4, "num_stages": 4, "time_ms": 1.767408013343811, "status": "ok"}
{"N": 65536, "K": 16384, "D": 128, "B": 1, "dtype": "fp16", "BLOCK_N": 32, "BLOCK_K": 128, "num_warps": 8, "num_stages": 1, "time_ms": 2.5050880908966064, "status": "ok"}
{"N": 65536, "K": 16384, "D": 128, "B": 1, "dtype": "fp16", "BLOCK_N": 32, "BLOCK_K": 128, "num_warps": 8, "num_stages": 2, "time_ms": 2.1348479986190796, "status": "ok"}
{"N": 65536, "K": 16384, "D": 128, "B": 1, "dtype": "fp16", "BLOCK_N": 32, "BLOCK_K": 128, "num_warps": 8, "num_stages": 4, "time_ms": 2.120512008666992, "status": "ok"}
{"N": 65536, "K": 16384, "D": 128, "B": 1, "dtype": "fp16", "BLOCK_N": 64, "BLOCK_K": 32, "num_warps": 4, "num_stages": 1, "time_ms": 1.1065919995307922, "status": "ok"}
{"N": 65536, "K": 16384, "D": 128, "B": 1, "dtype": "fp16", "BLOCK_N": 64, "BLOCK_K": 32, "num_warps": 4, "num_stages": 2, "time_ms": 1.2187199989954631, "status": "ok"}
{"N": 65536, "K": 16384, "D": 128, "B": 1, "dtype": "fp16", "BLOCK_N": 64, "BLOCK_K": 32, "num_warps": 4, "num_stages": 4, "time_ms": 0.9594320058822632, "status": "ok"}
{"N": 65536, "K": 16384, "D": 128, "B": 1, "dtype": "fp16", "BLOCK_N": 64, "BLOCK_K": 32, "num_warps": 8, "num_stages": 1, "time_ms": 1.9812319874763489, "status": "ok"}
{"N": 65536, "K": 16384, "D": 128, "B": 1, "dtype": "fp16", "BLOCK_N": 64, "BLOCK_K": 32, "num_warps": 8, "num_stages": 2, "time_ms": 1.755679965019226, "status": "ok"}
{"N": 65536, "K": 16384, "D": 128, "B": 1, "dtype": "fp16", "BLOCK_N": 64, "BLOCK_K": 32, "num_warps": 8, "num_stages": 4, "time_ms": 1.7251999974250793, "status": "ok"}
{"N": 65536, "K": 16384, "D": 128, "B": 1, "dtype": "fp16", "BLOCK_N": 64, "BLOCK_K": 64, "num_warps": 4, "num_stages": 1, "time_ms": 0.9297440052032471, "status": "ok"}
{"N": 65536, "K": 16384, "D": 128, "B": 1, "dtype": "fp16", "BLOCK_N": 64, "BLOCK_K": 64, "num_warps": 4, "num_stages": 2, "time_ms": 0.8496703982353211, "status": "ok"}
{"N": 65536, "K": 16384, "D": 128, "B": 1, "dtype": "fp16", "BLOCK_N": 64, "BLOCK_K": 64, "num_warps": 4, "num_stages": 4, "time_ms": 0.8565952062606812, "status": "ok"}
{"N": 65536, "K": 16384, "D": 128, "B": 1, "dtype": "fp16", "BLOCK_N": 64, "BLOCK_K": 64, "num_warps": 8, "num_stages": 1, "time_ms": 1.3911679983139038, "status": "ok"}
{"N": 65536, "K": 16384, "D": 128, "B": 1, "dtype": "fp16", "BLOCK_N": 64, "BLOCK_K": 64, "num_warps": 8, "num_stages": 2, "time_ms": 1.2291946411132812, "status": "ok"}
{"N": 65536, "K": 16384, "D": 128, "B": 1, "dtype": "fp16", "BLOCK_N": 64, "BLOCK_K": 64, "num_warps": 8, "num_stages": 4, "time_ms": 1.3509440024693806, "status": "ok"}
{"N": 65536, "K": 16384, "D": 128, "B": 1, "dtype": "fp16", "BLOCK_N": 64, "BLOCK_K": 128, "num_warps": 4, "num_stages": 1, "time_ms": 0.8068672060966492, "status": "ok"}
{"N": 65536, "K": 16384, "D": 128, "B": 1, "dtype": "fp16", "BLOCK_N": 64, "BLOCK_K": 128, "num_warps": 4, "num_stages": 2, "time_ms": 0.826528000831604, "status": "ok"}
{"N": 65536, "K": 16384, "D": 128, "B": 1, "dtype": "fp16", "BLOCK_N": 64, "BLOCK_K": 128, "num_warps": 4, "num_stages": 4, "time_ms": 1.0643439888954163, "status": "ok"}
{"N": 65536, "K": 16384, "D": 128, "B": 1, "dtype": "fp16", "BLOCK_N": 64, "BLOCK_K": 128, "num_warps": 8, "num_stages": 1, "time_ms": 1.2935786644617717, "status": "ok"}
{"N": 65536, "K": 16384, "D": 128, "B": 1, "dtype": "fp16", "BLOCK_N": 64, "BLOCK_K": 128, "num_warps": 8, "num_stages": 2, "time_ms": 1.1120319962501526, "status": "ok"}
{"N": 65536, "K": 16384, "D": 128, "B": 1, "dtype": "fp16", "BLOCK_N": 64, "BLOCK_K": 128, "num_warps": 8, "num_stages": 4, "time_ms": 1.2805759906768799, "status": "ok"}
{"N": 65536, "K": 16384, "D": 128, "B": 1, "dtype": "fp16", "BLOCK_N": 128, "BLOCK_K": 32, "num_warps": 4, "num_stages": 1, "time_ms": 0.9929360002279282, "status": "ok"}
{"N": 65536, "K": 16384, "D": 128, "B": 1, "dtype": "fp16", "BLOCK_N": 128, "BLOCK_K": 32, "num_warps": 4, "num_stages": 2, "time_ms": 1.0077039897441864, "status": "ok"}
{"N": 65536, "K": 16384, "D": 128, "B": 1, "dtype": "fp16", "BLOCK_N": 128, "BLOCK_K": 32, "num_warps": 4, "num_stages": 4, "time_ms": 1.009807974100113, "status": "ok"}
{"N": 65536, "K": 16384, "D": 128, "B": 1, "dtype": "fp16", "BLOCK_N": 128, "BLOCK_K": 32, "num_warps": 8, "num_stages": 1, "time_ms": 0.978408008813858, "status": "ok"}
{"N": 65536, "K": 16384, "D": 128, "B": 1, "dtype": "fp16", "BLOCK_N": 128, "BLOCK_K": 32, "num_warps": 8, "num_stages": 2, "time_ms": 1.00176802277565, "status": "ok"}
{"N": 65536, "K": 16384, "D": 128, "B": 1, "dtype": "fp16", "BLOCK_N": 128, "BLOCK_K": 32, "num_warps": 8, "num_stages": 4, "time_ms": 0.987296000123024, "status": "ok"}
{"N": 65536, "K": 16384, "D": 128, "B": 1, "dtype": "fp16", "BLOCK_N": 128, "BLOCK_K": 64, "num_warps": 4, "num_stages": 1, "time_ms": 0.8492096066474915, "status": "ok"}
{"N": 65536, "K": 16384, "D": 128, "B": 1, "dtype": "fp16", "BLOCK_N": 128, "BLOCK_K": 64, "num_warps": 4, "num_stages": 2, "time_ms": 0.8590016007423401, "status": "ok"}
{"N": 65536, "K": 16384, "D": 128, "B": 1, "dtype": "fp16", "BLOCK_N": 128, "BLOCK_K": 64, "num_warps": 4, "num_stages": 4, "time_ms": 0.8107263922691346, "status": "ok"}
{"N": 65536, "K": 16384, "D": 128, "B": 1, "dtype": "fp16", "BLOCK_N": 128, "BLOCK_K": 64, "num_warps": 8, "num_stages": 1, "time_ms": 0.91703200340271, "status": "ok"}
{"N": 65536, "K": 16384, "D": 128, "B": 1, "dtype": "fp16", "BLOCK_N": 128, "BLOCK_K": 64, "num_warps": 8, "num_stages": 2, "time_ms": 0.8668735980987549, "status": "ok"}
{"N": 65536, "K": 16384, "D": 128, "B": 1, "dtype": "fp16", "BLOCK_N": 128, "BLOCK_K": 64, "num_warps": 8, "num_stages": 4, "time_ms": 0.8100543975830078, "status": "ok"}
{"N": 65536, "K": 16384, "D": 128, "B": 1, "dtype": "fp16", "BLOCK_N": 128, "BLOCK_K": 128, "num_warps": 4, "num_stages": 1, "time_ms": 0.8245759844779968, "status": "ok"}
{"N": 65536, "K": 16384, "D": 128, "B": 1, "dtype": "fp16", "BLOCK_N": 128, "BLOCK_K": 128, "num_warps": 4, "num_stages": 2, "time_ms": 0.7872575879096985, "status": "ok"}
{"N": 65536, "K": 16384, "D": 128, "B": 1, "dtype": "fp16", "BLOCK_N": 128, "BLOCK_K": 128, "num_warps": 4, "num_stages": 4, "time_ms": 0.9172160029411316, "status": "ok"}
{"N": 65536, "K": 16384, "D": 128, "B": 1, "dtype": "fp16", "BLOCK_N": 128, "BLOCK_K": 128, "num_warps": 8, "num_stages": 1, "time_ms": 1.2477973302205403, "status": "ok"}
{"N": 65536, "K": 16384, "D": 128, "B": 1, "dtype": "fp16", "BLOCK_N": 128, "BLOCK_K": 128, "num_warps": 8, "num_stages": 2, "time_ms": 0.7951616048812866, "status": "ok"}
{"N": 65536, "K": 16384, "D": 128, "B": 1, "dtype": "fp16", "BLOCK_N": 128, "BLOCK_K": 128, "num_warps": 8, "num_stages": 4, "time_ms": 0.8918016076087951, "status": "ok"}
{"summary": true, "N": 65536, "K": 16384, "D": 128, "B": 1, "dtype": "fp16", "best": {"N": 65536, "K": 16384, "D": 128, "B": 1, "dtype": "fp16", "BLOCK_N": 128, "BLOCK_K": 128, "num_warps": 4, "num_stages": 2, "time_ms": 0.7872575879096985, "status": "ok"}, "best_time_ms": 0.7872575879096985, "tuning_seconds": 14.603588819503784, "skipped": 0}
