grid_results_h100/N65536_K4096_D64_B1_fp16.jsonl
{"N": 65536, "K": 4096, "D": 64, "B": 1, "dtype": "fp16", "BLOCK_N": 32, "BLOCK_K": 32, "num_warps": 4, "num_stages": 1, "time_ms": 0.45317332943280536, "status": "ok"}
{"N": 65536, "K": 4096, "D": 64, "B": 1, "dtype": "fp16", "BLOCK_N": 32, "BLOCK_K": 32, "num_warps": 4, "num_stages": 2, "time_ms": 0.40861759781837464, "status": "ok"}
{"N": 65536, "K": 4096, "D": 64, "B": 1, "dtype": "fp16", "BLOCK_N": 32, "BLOCK_K": 32, "num_warps": 4, "num_stages": 4, "time_ms": 0.3969119995832443, "status": "ok"}
{"N": 65536, "K": 4096, "D": 64, "B": 1, "dtype": "fp16", "BLOCK_N": 32, "BLOCK_K": 32, "num_warps": 8, "num_stages": 1, "time_ms": 0.7505280017852783, "status": "ok"}
{"N": 65536, "K": 4096, "D": 64, "B": 1, "dtype": "fp16", "BLOCK_N": 32, "BLOCK_K": 32, "num_warps": 8, "num_stages": 2, "time_ms": 0.6856480240821838, "status": "ok"}
{"N": 65536, "K": 4096, "D": 64, "B": 1, "dtype": "fp16", "BLOCK_N": 32, "BLOCK_K": 32, "num_warps": 8, "num_stages": 4, "time_ms": 0.6581173241138458, "status": "ok"}
{"N": 65536, "K": 4096, "D": 64, "B": 1, "dtype": "fp16", "BLOCK_N": 32, "BLOCK_K": 64, "num_warps": 4, "num_stages": 1, "time_ms": 0.38337279558181764, "status": "ok"}
{"N": 65536, "K": 4096, "D": 64, "B": 1, "dtype": "fp16", "BLOCK_N": 32, "BLOCK_K": 64, "num_warps": 4, "num_stages": 2, "time_ms": 0.34563781456513837, "status": "ok"}
{"N": 65536, "K": 4096, "D": 64, "B": 1, "dtype": "fp16", "BLOCK_N": 32, "BLOCK_K": 64, "num_warps": 4, "num_stages": 4, "time_ms": 0.3277992768721147, "status": "ok"}
{"N": 65536, "K": 4096, "D": 64, "B": 1, "dtype": "fp16", "BLOCK_N": 32, "BLOCK_K": 64, "num_warps": 8, "num_stages": 1, "time_ms": 0.4620373282167647, "status": "ok"}
{"N": 65536, "K": 4096, "D": 64, "B": 1, "dtype": "fp16", "BLOCK_N": 32, "BLOCK_K": 64, "num_warps": 8, "num_stages": 2, "time_ms": 0.4336746633052826, "status": "ok"}
{"N": 65536, "K": 4096, "D": 64, "B": 1, "dtype": "fp16", "BLOCK_N": 32, "BLOCK_K": 64, "num_warps": 8, "num_stages": 4, "time_ms": 0.4197191099325816, "status": "ok"}
{"N": 65536, "K": 4096, "D": 64, "B": 1, "dtype": "fp16", "BLOCK_N": 32, "BLOCK_K": 128, "num_warps": 4, "num_stages": 1, "time_ms": 0.3068266659975052, "status": "ok"}
{"N": 65536, "K": 4096, "D": 64, "B": 1, "dtype": "fp16", "BLOCK_N": 32, "BLOCK_K": 128, "num_warps": 4, "num_stages": 2, "time_ms": 0.2785107699724344, "status": "ok"}
{"N": 65536, "K": 4096, "D": 64, "B": 1, "dtype": "fp16", "BLOCK_N": 32, "BLOCK_K": 128, "num_warps": 4, "num_stages": 4, "time_ms": 0.2681348557983126, "status": "ok"}
{"N": 65536, "K": 4096, "D": 64, "B": 1, "dtype": "fp16", "BLOCK_N": 32, "BLOCK_K": 128, "num_warps": 8, "num_stages": 1, "time_ms": 0.4839559942483902, "status": "ok"}
{"N": 65536, "K": 4096, "D": 64, "B": 1, "dtype": "fp16", "BLOCK_N": 32, "BLOCK_K": 128, "num_warps": 8, "num_stages": 2, "time_ms": 0.4046968850824568, "status": "ok"}
{"N": 65536, "K": 4096, "D": 64, "B": 1, "dtype": "fp16", "BLOCK_N": 32, "BLOCK_K": 128, "num_warps": 8, "num_stages": 4, "time_ms": 0.38641920387744905, "status": "ok"}
{"N": 65536, "K": 4096, "D": 64, "B": 1, "dtype": "fp16", "BLOCK_N": 64, "BLOCK_K": 32, "num_warps": 4, "num_stages": 1, "time_ms": 0.2020498820964028, "status": "ok"}
{"N": 65536, "K": 4096, "D": 64, "B": 1, "dtype": "fp16", "BLOCK_N": 64, "BLOCK_K": 32, "num_warps": 4, "num_stages": 2, "time_ms": 0.20473788065068863, "status": "ok"}
{"N": 65536, "K": 4096, "D": 64, "B": 1, "dtype": "fp16", "BLOCK_N": 64, "BLOCK_K": 32, "num_warps": 4, "num_stages": 4, "time_ms": 0.19399905818350174, "status": "ok"}
{"N": 65536, "K": 4096, "D": 64, "B": 1, "dtype": "fp16", "BLOCK_N": 64, "BLOCK_K": 32, "num_warps": 8, "num_stages": 1, "time_ms": 0.3700800001621246, "status": "ok"}
{"N": 65536, "K": 4096, "D": 64, "B": 1, "dtype": "fp16", "BLOCK_N": 64, "BLOCK_K": 32, "num_warps": 8, "num_stages": 2, "time_ms": 0.35536873069676483, "status": "ok"}
{"N": 65536, "K": 4096, "D": 64, "B": 1, "dtype": "fp16", "BLOCK_N": 64, "BLOCK_K": 32, "num_warps": 8, "num_stages": 4, "time_ms": 0.3389643566174941, "status": "ok"}
{"N": 65536, "K": 4096, "D": 64, "B": 1, "dtype": "fp16", "BLOCK_N": 64, "BLOCK_K": 64, "num_warps": 4, "num_stages": 1, "time_ms": 0.18328888879881966, "status": "ok"}
{"N": 65536, "K": 4096, "D": 64, "B": 1, "dtype": "fp16", "BLOCK_N": 64, "BLOCK_K": 64, "num_warps": 4, "num_stages": 2, "time_ms": 0.18181333359744814, "status": "ok"}
{"N": 65536, "K": 4096, "D": 64, "B": 1, "dtype": "fp16", "BLOCK_N": 64, "BLOCK_K": 64, "num_warps": 4, "num_stages": 4, "time_ms": 0.16917557935965688, "status": "ok"}
{"N": 65536, "K": 4096, "D": 64, "B": 1, "dtype": "fp16", "BLOCK_N": 64, "BLOCK_K": 64, "num_warps": 8, "num_stages": 1, "time_ms": 0.26819657002176556, "status": "ok"}
{"N": 65536, "K": 4096, "D": 64, "B": 1, "dtype": "fp16", "BLOCK_N": 64, "BLOCK_K": 64, "num_warps": 8, "num_stages": 2, "time_ms": 0.2590834306819098, "status": "ok"}
{"N": 65536, "K": 4096, "D": 64, "B": 1, "dtype": "fp16", "BLOCK_N": 64, "BLOCK_K": 64, "num_warps": 8, "num_stages": 4, "time_ms": 0.24878399819135666, "status": "ok"}
{"N": 65536, "K": 4096, "D": 64, "B": 1, "dtype": "fp16", "BLOCK_N": 64, "BLOCK_K": 128, "num_warps": 4, "num_stages": 1, "time_ms": 0.17045052506421743, "status": "ok"}
{"N": 65536, "K": 4096, "D": 64, "B": 1, "dtype": "fp16", "BLOCK_N": 64, "BLOCK_K": 128, "num_warps": 4, "num_stages": 2, "time_ms": 0.16901726314896032, "status": "ok"}
{"N": 65536, "K": 4096, "D": 64, "B": 1, "dtype": "fp16", "BLOCK_N": 64, "BLOCK_K": 128, "num_warps": 4, "num_stages": 4, "time_ms": 0.16153263104589363, "status": "ok"}
{"N": 65536, "K": 4096, "D": 64, "B": 1, "dtype": "fp16", "BLOCK_N": 64, "BLOCK_K": 128, "num_warps": 8, "num_stages": 1, "time_ms": 0.26344369466488177, "status": "ok"}
{"N": 65536, "K": 4096, "D": 64, "B": 1, "dtype": "fp16", "BLOCK_N": 64, "BLOCK_K": 128, "num_warps": 8, "num_stages": 2, "time_ms": 0.24158506790796916, "status": "ok"}
{"N": 65536, "K": 4096, "D": 64, "B": 1, "dtype": "fp16", "BLOCK_N": 64, "BLOCK_K": 128, "num_warps": 8, "num_stages": 4, "time_ms": 0.2204799996688962, "status": "ok"}
{"N": 65536, "K": 4096, "D": 64, "B": 1, "dtype": "fp16", "BLOCK_N": 128, "BLOCK_K": 32, "num_warps": 4, "num_stages": 1, "time_ms": 0.2090339995920658, "status": "ok"}
{"N": 65536, "K": 4096, "D": 64, "B": 1, "dtype": "fp16", "BLOCK_N": 128, "BLOCK_K": 32, "num_warps": 4, "num_stages": 2, "time_ms": 0.2083780001848936, "status": "ok"}
{"N": 65536, "K": 4096, "D": 64, "B": 1, "dtype": "fp16", "BLOCK_N": 128, "BLOCK_K": 32, "num_warps": 4, "num_stages": 4, "time_ms": 0.1933854117113001, "status": "ok"}
{"N": 65536, "K": 4096, "D": 64, "B": 1, "dtype": "fp16", "BLOCK_N": 128, "BLOCK_K": 32, "num_warps": 8, "num_stages": 1, "time_ms": 0.2044555308187709, "status": "ok"}
{"N": 65536, "K": 4096, "D": 64, "B": 1, "dtype": "fp16", "BLOCK_N": 128, "BLOCK_K": 32, "num_warps": 8, "num_stages": 2, "time_ms": 0.21969399880617857, "status": "ok"}
{"N": 65536, "K": 4096, "D": 64, "B": 1, "dtype": "fp16", "BLOCK_N": 128, "BLOCK_K": 32, "num_warps": 8, "num_stages": 4, "time_ms": 0.2028630594996845, "status": "ok"}
{"N": 65536, "K": 4096, "D": 64, "B": 1, "dtype": "fp16", "BLOCK_N": 128, "BLOCK_K": 64, "num_warps": 4, "num_stages": 1, "time_ms": 0.1874115549855762, "status": "ok"}
{"N": 65536, "K": 4096, "D": 64, "B": 1, "dtype": "fp16", "BLOCK_N": 128, "BLOCK_K": 64, "num_warps": 4, "num_stages": 2, "time_ms": 0.17672533210780886, "status": "ok"}
{"N": 65536, "K": 4096, "D": 64, "B": 1, "dtype": "fp16", "BLOCK_N": 128, "BLOCK_K": 64, "num_warps": 4, "num_stages": 4, "time_ms": 0.16729263333897842, "status": "ok"}
{"N": 65536, "K": 4096, "D": 64, "B": 1, "dtype": "fp16", "BLOCK_N": 128, "BLOCK_K": 64, "num_warps": 8, "num_stages": 1, "time_ms": 0.19114541218561285, "status": "ok"}
{"N": 65536, "K": 4096, "D": 64, "B": 1, "dtype": "fp16", "BLOCK_N": 128, "BLOCK_K": 64, "num_warps": 8, "num_stages": 2, "time_ms": 0.19182870493215673, "status": "ok"}
{"N": 65536, "K": 4096, "D": 64, "B": 1, "dtype": "fp16", "BLOCK_N": 128, "BLOCK_K": 64, "num_warps": 8, "num_stages": 4, "time_ms": 0.1742787353302303, "status": "ok"}
{"N": 65536, "K": 4096, "D": 64, "B": 1, "dtype": "fp16", "BLOCK_N": 128, "BLOCK_K": 128, "num_warps": 4, "num_stages": 1, "time_ms": 0.18590400202406776, "status": "ok"}
{"N": 65536, "K": 4096, "D": 64, "B": 1, "dtype": "fp16", "BLOCK_N": 128, "BLOCK_K": 128, "num_warps": 4, "num_stages": 2, "time_ms": 0.18115377757284376, "status": "ok"}
{"N": 65536, "K": 4096, "D": 64, "B": 1, "dtype": "fp16", "BLOCK_N": 128, "BLOCK_K": 128, "num_warps": 4, "num_stages": 4, "time_ms": 0.16874947438114568, "status": "ok"}
{"N": 65536, "K": 4096, "D": 64, "B": 1, "dtype": "fp16", "BLOCK_N": 128, "BLOCK_K": 128, "num_warps": 8, "num_stages": 1, "time_ms": 0.2569782797779356, "status": "ok"}
{"N": 65536, "K": 4096, "D": 64, "B": 1, "dtype": "fp16", "BLOCK_N": 128, "BLOCK_K": 128, "num_warps": 8, "num_stages": 2, "time_ms": 0.1776977777481079, "status": "ok"}
{"N": 65536, "K": 4096, "D": 64, "B": 1, "dtype": "fp16", "BLOCK_N": 128, "BLOCK_K": 128, "num_warps": 8, "num_stages": 4, "time_ms": 0.16749642161946549, "status": "ok"}
{"summary": true, "N": 65536, "K": 4096, "D": 64, "B": 1, "dtype": "fp16", "best": {"N": 65536, "K": 4096, "D": 64, "B": 1, "dtype": "fp16", "BLOCK_N": 64, "BLOCK_K": 128, "num_warps": 4, "num_stages": 4, "time_ms": 0.16153263104589363, "status": "ok"}, "best_time_ms": 0.16153263104589363, "tuning_seconds": 12.43858003616333, "skipped": 0}
