grid_results_h100/N65536_K65536_D128_B32_fp16.jsonl
{"N": 65536, "K": 65536, "D": 128, "B": 32, "dtype": "fp16", "BLOCK_N": 32, "BLOCK_K": 32, "num_warps": 4, "num_stages": 1, "time_ms": 318.7929382324219, "status": "ok"}
{"N": 65536, "K": 65536, "D": 128, "B": 32, "dtype": "fp16", "BLOCK_N": 32, "BLOCK_K": 32, "num_warps": 4, "num_stages": 2, "time_ms": 269.5798645019531, "status": "ok"}
{"N": 65536, "K": 65536, "D": 128, "B": 32, "dtype": "fp16", "BLOCK_N": 32, "BLOCK_K": 32, "num_warps": 4, "num_stages": 4, "time_ms": 272.36602783203125, "status": "ok"}
{"N": 65536, "K": 65536, "D": 128, "B": 32, "dtype": "fp16", "BLOCK_N": 32, "BLOCK_K": 32, "num_warps": 8, "num_stages": 1, "time_ms": 472.689697265625, "status": "ok"}
{"N": 65536, "K": 65536, "D": 128, "B": 32, "dtype": "fp16", "BLOCK_N": 32, "BLOCK_K": 32, "num_warps": 8, "num_stages": 2, "time_ms": 430.3407287597656, "status": "ok"}
{"N": 65536, "K": 65536, "D": 128, "B": 32, "dtype": "fp16", "BLOCK_N": 32, "BLOCK_K": 32, "num_warps": 8, "num_stages": 4, "time_ms": 422.2169494628906, "status": "ok"}
{"N": 65536, "K": 65536, "D": 128, "B": 32, "dtype": "fp16", "BLOCK_N": 32, "BLOCK_K": 64, "num_warps": 4, "num_stages": 1, "time_ms": 276.3519287109375, "status": "ok"}
{"N": 65536, "K": 65536, "D": 128, "B": 32, "dtype": "fp16", "BLOCK_N": 32, "BLOCK_K": 64, "num_warps": 4, "num_stages": 2, "time_ms": 217.89564514160156, "status": "ok"}
{"N": 65536, "K": 65536, "D": 128, "B": 32, "dtype": "fp16", "BLOCK_N": 32, "BLOCK_K": 64, "num_warps": 4, "num_stages": 4, "time_ms": 234.98915100097656, "status": "ok"}
{"N": 65536, "K": 65536, "D": 128, "B": 32, "dtype": "fp16", "BLOCK_N": 32, "BLOCK_K": 64, "num_warps": 8, "num_stages": 1, "time_ms": 333.4414367675781, "status": "ok"}
{"N": 65536, "K": 65536, "D": 128, "B": 32, "dtype": "fp16", "BLOCK_N": 32, "BLOCK_K": 64, "num_warps": 8, "num_stages": 2, "time_ms": 282.2619323730469, "status": "ok"}
{"N": 65536, "K": 65536, "D": 128, "B": 32, "dtype": "fp16", "BLOCK_N": 32, "BLOCK_K": 64, "num_warps": 8, "num_stages": 4, "time_ms": 280.5933532714844, "status": "ok"}
{"N": 65536, "K": 65536, "D": 128, "B": 32, "dtype": "fp16", "BLOCK_N": 32, "BLOCK_K": 128, "num_warps": 4, "num_stages": 1, "time_ms": 221.1353302001953, "status": "ok"}
{"N": 65536, "K": 65536, "D": 128, "B": 32, "dtype": "fp16", "BLOCK_N": 32, "BLOCK_K": 128, "num_warps": 4, "num_stages": 2, "time_ms": 178.6971893310547, "status": "ok"}
{"N": 65536, "K": 65536, "D": 128, "B": 32, "dtype": "fp16", "BLOCK_N": 32, "BLOCK_K": 128, "num_warps": 4, "num_stages": 4, "time_ms": 232.82252502441406, "status": "ok"}
{"N": 65536, "K": 65536, "D": 128, "B": 32, "dtype": "fp16", "BLOCK_N": 32, "BLOCK_K": 128, "num_warps": 8, "num_stages": 1, "time_ms": 298.71331787109375, "status": "ok"}
{"N": 65536, "K": 65536, "D": 128, "B": 32, "dtype": "fp16", "BLOCK_N": 32, "BLOCK_K": 128, "num_warps": 8, "num_stages": 2, "time_ms": 264.5677490234375, "status": "ok"}
{"N": 65536, "K": 65536, "D": 128, "B": 32, "dtype": "fp16", "BLOCK_N": 32, "BLOCK_K": 128, "num_warps": 8, "num_stages": 4, "time_ms": 264.05865478515625, "status": "ok"}
{"N": 65536, "K": 65536, "D": 128, "B": 32, "dtype": "fp16", "BLOCK_N": 64, "BLOCK_K": 32, "num_warps": 4, "num_stages": 1, "time_ms": 147.2584686279297, "status": "ok"}
{"N": 65536, "K": 65536, "D": 128, "B": 32, "dtype": "fp16", "BLOCK_N": 64, "BLOCK_K": 32, "num_warps": 4, "num_stages": 2, "time_ms": 131.5629425048828, "status": "ok"}
{"N": 65536, "K": 65536, "D": 128, "B": 32, "dtype": "fp16", "BLOCK_N": 64, "BLOCK_K": 32, "num_warps": 4, "num_stages": 4, "time_ms": 136.8810577392578, "status": "ok"}
{"N": 65536, "K": 65536, "D": 128, "B": 32, "dtype": "fp16", "BLOCK_N": 64, "BLOCK_K": 32, "num_warps": 8, "num_stages": 1, "time_ms": 231.90444946289062, "status": "ok"}
{"N": 65536, "K": 65536, "D": 128, "B": 32, "dtype": "fp16", "BLOCK_N": 64, "BLOCK_K": 32, "num_warps": 8, "num_stages": 2, "time_ms": 201.3612518310547, "status": "ok"}
{"N": 65536, "K": 65536, "D": 128, "B": 32, "dtype": "fp16", "BLOCK_N": 64, "BLOCK_K": 32, "num_warps": 8, "num_stages": 4, "time_ms": 202.06710815429688, "status": "ok"}
{"N": 65536, "K": 65536, "D": 128, "B": 32, "dtype": "fp16", "BLOCK_N": 64, "BLOCK_K": 64, "num_warps": 4, "num_stages": 1, "time_ms": 129.6339569091797, "status": "ok"}
{"N": 65536, "K": 65536, "D": 128, "B": 32, "dtype": "fp16", "BLOCK_N": 64, "BLOCK_K": 64, "num_warps": 4, "num_stages": 2, "time_ms": 105.8279037475586, "status": "ok"}
{"N": 65536, "K": 65536, "D": 128, "B": 32, "dtype": "fp16", "BLOCK_N": 64, "BLOCK_K": 64, "num_warps": 4, "num_stages": 4, "time_ms": 111.6578598022461, "status": "ok"}
{"N": 65536, "K": 65536, "D": 128, "B": 32, "dtype": "fp16", "BLOCK_N": 64, "BLOCK_K": 64, "num_warps": 8, "num_stages": 1, "time_ms": 164.57359313964844, "status": "ok"}
{"N": 65536, "K": 65536, "D": 128, "B": 32, "dtype": "fp16", "BLOCK_N": 64, "BLOCK_K": 64, "num_warps": 8, "num_stages": 2, "time_ms": 149.46397399902344, "status": "ok"}
{"N": 65536, "K": 65536, "D": 128, "B": 32, "dtype": "fp16", "BLOCK_N": 64, "BLOCK_K": 64, "num_warps": 8, "num_stages": 4, "time_ms": 162.4824676513672, "status": "ok"}
{"N": 65536, "K": 65536, "D": 128, "B": 32, "dtype": "fp16", "BLOCK_N": 64, "BLOCK_K": 128, "num_warps": 4, "num_stages": 1, "time_ms": 106.57698822021484, "status": "ok"}
{"N": 65536, "K": 65536, "D": 128, "B": 32, "dtype": "fp16", "BLOCK_N": 64, "BLOCK_K": 128, "num_warps": 4, "num_stages": 2, "time_ms": 104.46540832519531, "status": "ok"}
{"N": 65536, "K": 65536, "D": 128, "B": 32, "dtype": "fp16", "BLOCK_N": 64, "BLOCK_K": 128, "num_warps": 4, "num_stages": 4, "time_ms": 138.32473754882812, "status": "ok"}
{"N": 65536, "K": 65536, "D": 128, "B": 32, "dtype": "fp16", "BLOCK_N": 64, "BLOCK_K": 128, "num_warps": 8, "num_stages": 1, "time_ms": 156.09727478027344, "status": "ok"}
{"N": 65536, "K": 65536, "D": 128, "B": 32, "dtype": "fp16", "BLOCK_N": 64, "BLOCK_K": 128, "num_warps": 8, "num_stages": 2, "time_ms": 148.71673583984375, "status": "ok"}
{"N": 65536, "K": 65536, "D": 128, "B": 32, "dtype": "fp16", "BLOCK_N": 64, "BLOCK_K": 128, "num_warps": 8, "num_stages": 4, "time_ms": 153.2054443359375, "status": "ok"}
{"N": 65536, "K": 65536, "D": 128, "B": 32, "dtype": "fp16", "BLOCK_N": 128, "BLOCK_K": 32, "num_warps": 4, "num_stages": 1, "time_ms": 128.16773986816406, "status": "ok"}
{"N": 65536, "K": 65536, "D": 128, "B": 32, "dtype": "fp16", "BLOCK_N": 128, "BLOCK_K": 32, "num_warps": 4, "num_stages": 2, "time_ms": 125.7291488647461, "status": "ok"}
{"N": 65536, "K": 65536, "D": 128, "B": 32, "dtype": "fp16", "BLOCK_N": 128, "BLOCK_K": 32, "num_warps": 4, "num_stages": 4, "time_ms": 133.78713989257812, "status": "ok"}
{"N": 65536, "K": 65536, "D": 128, "B": 32, "dtype": "fp16", "BLOCK_N": 128, "BLOCK_K": 32, "num_warps": 8, "num_stages": 1, "time_ms": 133.5845489501953, "status": "ok"}
{"N": 65536, "K": 65536, "D": 128, "B": 32, "dtype": "fp16", "BLOCK_N": 128, "BLOCK_K": 32, "num_warps": 8, "num_stages": 2, "time_ms": 127.38655853271484, "status": "ok"}
{"N": 65536, "K": 65536, "D": 128, "B": 32, "dtype": "fp16", "BLOCK_N": 128, "BLOCK_K": 32, "num_warps": 8, "num_stages": 4, "time_ms": 129.7953643798828, "status": "ok"}
{"N": 65536, "K": 65536, "D": 128, "B": 32, "dtype": "fp16", "BLOCK_N": 128, "BLOCK_K": 64, "num_warps": 4, "num_stages": 1, "time_ms": 100.81465911865234, "status": "ok"}
{"N": 65536, "K": 65536, "D": 128, "B": 32, "dtype": "fp16", "BLOCK_N": 128, "BLOCK_K": 64, "num_warps": 4, "num_stages": 2, "time_ms": 98.31187438964844, "status": "ok"}
{"N": 65536, "K": 65536, "D": 128, "B": 32, "dtype": "fp16", "BLOCK_N": 128, "BLOCK_K": 64, "num_warps": 4, "num_stages": 4, "time_ms": 100.3851547241211, "status": "ok"}
{"N": 65536, "K": 65536, "D": 128, "B": 32, "dtype": "fp16", "BLOCK_N": 128, "BLOCK_K": 64, "num_warps": 8, "num_stages": 1, "time_ms": 104.69229125976562, "status": "ok"}
{"N": 65536, "K": 65536, "D": 128, "B": 32, "dtype": "fp16", "BLOCK_N": 128, "BLOCK_K": 64, "num_warps": 8, "num_stages": 2, "time_ms": 100.29948425292969, "status": "ok"}
{"N": 65536, "K": 65536, "D": 128, "B": 32, "dtype": "fp16", "BLOCK_N": 128, "BLOCK_K": 64, "num_warps": 8, "num_stages": 4, "time_ms": 101.4705581665039, "status": "ok"}
{"N": 65536, "K": 65536, "D": 128, "B": 32, "dtype": "fp16", "BLOCK_N": 128, "BLOCK_K": 128, "num_warps": 4, "num_stages": 1, "time_ms": 97.46144104003906, "status": "ok"}
{"N": 65536, "K": 65536, "D": 128, "B": 32, "dtype": "fp16", "BLOCK_N": 128, "BLOCK_K": 128, "num_warps": 4, "num_stages": 2, "time_ms": 93.54537963867188, "status": "ok"}
{"N": 65536, "K": 65536, "D": 128, "B": 32, "dtype": "fp16", "BLOCK_N": 128, "BLOCK_K": 128, "num_warps": 4, "num_stages": 4, "time_ms": 115.65142059326172, "status": "ok"}
{"N": 65536, "K": 65536, "D": 128, "B": 32, "dtype": "fp16", "BLOCK_N": 128, "BLOCK_K": 128, "num_warps": 8, "num_stages": 1, "time_ms": 147.78521728515625, "status": "ok"}
{"N": 65536, "K": 65536, "D": 128, "B": 32, "dtype": "fp16", "BLOCK_N": 128, "BLOCK_K": 128, "num_warps": 8, "num_stages": 2, "time_ms": 93.75801849365234, "status": "ok"}
{"N": 65536, "K": 65536, "D": 128, "B": 32, "dtype": "fp16", "BLOCK_N": 128, "BLOCK_K": 128, "num_warps": 8, "num_stages": 4, "time_ms": 113.61321258544922, "status": "ok"}
{"summary": true, "N": 65536, "K": 65536, "D": 128, "B": 32, "dtype": "fp16", "best": {"N": 65536, "K": 65536, "D": 128, "B": 32, "dtype": "fp16", "BLOCK_N": 128, "BLOCK_K": 128, "num_warps": 4, "num_stages": 2, "time_ms": 93.54537963867188, "status": "ok"}, "best_time_ms": 93.54537963867188, "tuning_seconds": 92.3408842086792, "skipped": 0}
