grid_results_h100/N65536_K65536_D64_B32_fp16.jsonl
{"N": 65536, "K": 65536, "D": 64, "B": 32, "dtype": "fp16", "BLOCK_N": 32, "BLOCK_K": 32, "num_warps": 4, "num_stages": 1, "time_ms": 208.92291259765625, "status": "ok"}
{"N": 65536, "K": 65536, "D": 64, "B": 32, "dtype": "fp16", "BLOCK_N": 32, "BLOCK_K": 32, "num_warps": 4, "num_stages": 2, "time_ms": 184.71807861328125, "status": "ok"}
{"N": 65536, "K": 65536, "D": 64, "B": 32, "dtype": "fp16", "BLOCK_N": 32, "BLOCK_K": 32, "num_warps": 4, "num_stages": 4, "time_ms": 182.02499389648438, "status": "ok"}
{"N": 65536, "K": 65536, "D": 64, "B": 32, "dtype": "fp16", "BLOCK_N": 32, "BLOCK_K": 32, "num_warps": 8, "num_stages": 1, "time_ms": 336.78857421875, "status": "ok"}
{"N": 65536, "K": 65536, "D": 64, "B": 32, "dtype": "fp16", "BLOCK_N": 32, "BLOCK_K": 32, "num_warps": 8, "num_stages": 2, "time_ms": 318.1538391113281, "status": "ok"}
{"N": 65536, "K": 65536, "D": 64, "B": 32, "dtype": "fp16", "BLOCK_N": 32, "BLOCK_K": 32, "num_warps": 8, "num_stages": 4, "time_ms": 310.9949035644531, "status": "ok"}
{"N": 65536, "K": 65536, "D": 64, "B": 32, "dtype": "fp16", "BLOCK_N": 32, "BLOCK_K": 64, "num_warps": 4, "num_stages": 1, "time_ms": 177.8568572998047, "status": "ok"}
{"N": 65536, "K": 65536, "D": 64, "B": 32, "dtype": "fp16", "BLOCK_N": 32, "BLOCK_K": 64, "num_warps": 4, "num_stages": 2, "time_ms": 157.58489990234375, "status": "ok"}
{"N": 65536, "K": 65536, "D": 64, "B": 32, "dtype": "fp16", "BLOCK_N": 32, "BLOCK_K": 64, "num_warps": 4, "num_stages": 4, "time_ms": 151.18966674804688, "status": "ok"}
{"N": 65536, "K": 65536, "D": 64, "B": 32, "dtype": "fp16", "BLOCK_N": 32, "BLOCK_K": 64, "num_warps": 8, "num_stages": 1, "time_ms": 217.2097625732422, "status": "ok"}
{"N": 65536, "K": 65536, "D": 64, "B": 32, "dtype": "fp16", "BLOCK_N": 32, "BLOCK_K": 64, "num_warps": 8, "num_stages": 2, "time_ms": 201.1011199951172, "status": "ok"}
{"N": 65536, "K": 65536, "D": 64, "B": 32, "dtype": "fp16", "BLOCK_N": 32, "BLOCK_K": 64, "num_warps": 8, "num_stages": 4, "time_ms": 195.5417938232422, "status": "ok"}
{"N": 65536, "K": 65536, "D": 64, "B": 32, "dtype": "fp16", "BLOCK_N": 32, "BLOCK_K": 128, "num_warps": 4, "num_stages": 1, "time_ms": 146.3783416748047, "status": "ok"}
{"N": 65536, "K": 65536, "D": 64, "B": 32, "dtype": "fp16", "BLOCK_N": 32, "BLOCK_K": 128, "num_warps": 4, "num_stages": 2, "time_ms": 142.52662658691406, "status": "ok"}
{"N": 65536, "K": 65536, "D": 64, "B": 32, "dtype": "fp16", "BLOCK_N": 32, "BLOCK_K": 128, "num_warps": 4, "num_stages": 4, "time_ms": 140.7252197265625, "status": "ok"}
{"N": 65536, "K": 65536, "D": 64, "B": 32, "dtype": "fp16", "BLOCK_N": 32, "BLOCK_K": 128, "num_warps": 8, "num_stages": 1, "time_ms": 226.70022583007812, "status": "ok"}
{"N": 65536, "K": 65536, "D": 64, "B": 32, "dtype": "fp16", "BLOCK_N": 32, "BLOCK_K": 128, "num_warps": 8, "num_stages": 2, "time_ms": 185.9108123779297, "status": "ok"}
{"N": 65536, "K": 65536, "D": 64, "B": 32, "dtype": "fp16", "BLOCK_N": 32, "BLOCK_K": 128, "num_warps": 8, "num_stages": 4, "time_ms": 179.24217224121094, "status": "ok"}
{"N": 65536, "K": 65536, "D": 64, "B": 32, "dtype": "fp16", "BLOCK_N": 64, "BLOCK_K": 32, "num_warps": 4, "num_stages": 1, "time_ms": 84.45945739746094, "status": "ok"}
{"N": 65536, "K": 65536, "D": 64, "B": 32, "dtype": "fp16", "BLOCK_N": 64, "BLOCK_K": 32, "num_warps": 4, "num_stages": 2, "time_ms": 82.64028930664062, "status": "ok"}
{"N": 65536, "K": 65536, "D": 64, "B": 32, "dtype": "fp16", "BLOCK_N": 64, "BLOCK_K": 32, "num_warps": 4, "num_stages": 4, "time_ms": 83.2600326538086, "status": "ok"}
{"N": 65536, "K": 65536, "D": 64, "B": 32, "dtype": "fp16", "BLOCK_N": 64, "BLOCK_K": 32, "num_warps": 8, "num_stages": 1, "time_ms": 168.74691772460938, "status": "ok"}
{"N": 65536, "K": 65536, "D": 64, "B": 32, "dtype": "fp16", "BLOCK_N": 64, "BLOCK_K": 32, "num_warps": 8, "num_stages": 2, "time_ms": 158.20632934570312, "status": "ok"}
{"N": 65536, "K": 65536, "D": 64, "B": 32, "dtype": "fp16", "BLOCK_N": 64, "BLOCK_K": 32, "num_warps": 8, "num_stages": 4, "time_ms": 155.52896118164062, "status": "ok"}
{"N": 65536, "K": 65536, "D": 64, "B": 32, "dtype": "fp16", "BLOCK_N": 64, "BLOCK_K": 64, "num_warps": 4, "num_stages": 1, "time_ms": 79.06963348388672, "status": "ok"}
{"N": 65536, "K": 65536, "D": 64, "B": 32, "dtype": "fp16", "BLOCK_N": 64, "BLOCK_K": 64, "num_warps": 4, "num_stages": 2, "time_ms": 75.43990325927734, "status": "ok"}
{"N": 65536, "K": 65536, "D": 64, "B": 32, "dtype": "fp16", "BLOCK_N": 64, "BLOCK_K": 64, "num_warps": 4, "num_stages": 4, "time_ms": 75.27629089355469, "status": "ok"}
{"N": 65536, "K": 65536, "D": 64, "B": 32, "dtype": "fp16", "BLOCK_N": 64, "BLOCK_K": 64, "num_warps": 8, "num_stages": 1, "time_ms": 121.23270416259766, "status": "ok"}
{"N": 65536, "K": 65536, "D": 64, "B": 32, "dtype": "fp16", "BLOCK_N": 64, "BLOCK_K": 64, "num_warps": 8, "num_stages": 2, "time_ms": 115.47062683105469, "status": "ok"}
{"N": 65536, "K": 65536, "D": 64, "B": 32, "dtype": "fp16", "BLOCK_N": 64, "BLOCK_K": 64, "num_warps": 8, "num_stages": 4, "time_ms": 114.27954864501953, "status": "ok"}
{"N": 65536, "K": 65536, "D": 64, "B": 32, "dtype": "fp16", "BLOCK_N": 64, "BLOCK_K": 128, "num_warps": 4, "num_stages": 1, "time_ms": 74.76191711425781, "status": "ok"}
{"N": 65536, "K": 65536, "D": 64, "B": 32, "dtype": "fp16", "BLOCK_N": 64, "BLOCK_K": 128, "num_warps": 4, "num_stages": 2, "time_ms": 72.23677062988281, "status": "ok"}
{"N": 65536, "K": 65536, "D": 64, "B": 32, "dtype": "fp16", "BLOCK_N": 64, "BLOCK_K": 128, "num_warps": 4, "num_stages": 4, "time_ms": 71.95024108886719, "status": "ok"}
{"N": 65536, "K": 65536, "D": 64, "B": 32, "dtype": "fp16", "BLOCK_N": 64, "BLOCK_K": 128, "num_warps": 8, "num_stages": 1, "time_ms": 123.8941421508789, "status": "ok"}
{"N": 65536, "K": 65536, "D": 64, "B": 32, "dtype": "fp16", "BLOCK_N": 64, "BLOCK_K": 128, "num_warps": 8, "num_stages": 2, "time_ms": 106.93949127197266, "status": "ok"}
{"N": 65536, "K": 65536, "D": 64, "B": 32, "dtype": "fp16", "BLOCK_N": 64, "BLOCK_K": 128, "num_warps": 8, "num_stages": 4, "time_ms": 98.93421173095703, "status": "ok"}
{"N": 65536, "K": 65536, "D": 64, "B": 32, "dtype": "fp16", "BLOCK_N": 128, "BLOCK_K": 32, "num_warps": 4, "num_stages": 1, "time_ms": 82.06495666503906, "status": "ok"}
{"N": 65536, "K": 65536, "D": 64, "B": 32, "dtype": "fp16", "BLOCK_N": 128, "BLOCK_K": 32, "num_warps": 4, "num_stages": 2, "time_ms": 80.60137939453125, "status": "ok"}
{"N": 65536, "K": 65536, "D": 64, "B": 32, "dtype": "fp16", "BLOCK_N": 128, "BLOCK_K": 32, "num_warps": 4, "num_stages": 4, "time_ms": 81.54131317138672, "status": "ok"}
{"N": 65536, "K": 65536, "D": 64, "B": 32, "dtype": "fp16", "BLOCK_N": 128, "BLOCK_K": 32, "num_warps": 8, "num_stages": 1, "time_ms": 86.30528259277344, "status": "ok"}
{"N": 65536, "K": 65536, "D": 64, "B": 32, "dtype": "fp16", "BLOCK_N": 128, "BLOCK_K": 32, "num_warps": 8, "num_stages": 2, "time_ms": 89.61145782470703, "status": "ok"}
{"N": 65536, "K": 65536, "D": 64, "B": 32, "dtype": "fp16", "BLOCK_N": 128, "BLOCK_K": 32, "num_warps": 8, "num_stages": 4, "time_ms": 87.6858901977539, "status": "ok"}
{"N": 65536, "K": 65536, "D": 64, "B": 32, "dtype": "fp16", "BLOCK_N": 128, "BLOCK_K": 64, "num_warps": 4, "num_stages": 1, "time_ms": 79.02310180664062, "status": "ok"}
{"N": 65536, "K": 65536, "D": 64, "B": 32, "dtype": "fp16", "BLOCK_N": 128, "BLOCK_K": 64, "num_warps": 4, "num_stages": 2, "time_ms": 72.32736206054688, "status": "ok"}
{"N": 65536, "K": 65536, "D": 64, "B": 32, "dtype": "fp16", "BLOCK_N": 128, "BLOCK_K": 64, "num_warps": 4, "num_stages": 4, "time_ms": 72.07283020019531, "status": "ok"}
{"N": 65536, "K": 65536, "D": 64, "B": 32, "dtype": "fp16", "BLOCK_N": 128, "BLOCK_K": 64, "num_warps": 8, "num_stages": 1, "time_ms": 80.99504089355469, "status": "ok"}
{"N": 65536, "K": 65536, "D": 64, "B": 32, "dtype": "fp16", "BLOCK_N": 128, "BLOCK_K": 64, "num_warps": 8, "num_stages": 2, "time_ms": 78.2520980834961, "status": "ok"}
{"N": 65536, "K": 65536, "D": 64, "B": 32, "dtype": "fp16", "BLOCK_N": 128, "BLOCK_K": 64, "num_warps": 8, "num_stages": 4, "time_ms": 77.34893035888672, "status": "ok"}
{"N": 65536, "K": 65536, "D": 64, "B": 32, "dtype": "fp16", "BLOCK_N": 128, "BLOCK_K": 128, "num_warps": 4, "num_stages": 1, "time_ms": 78.29993438720703, "status": "ok"}
{"N": 65536, "K": 65536, "D": 64, "B": 32, "dtype": "fp16", "BLOCK_N": 128, "BLOCK_K": 128, "num_warps": 4, "num_stages": 2, "time_ms": 77.52278137207031, "status": "ok"}
{"N": 65536, "K": 65536, "D": 64, "B": 32, "dtype": "fp16", "BLOCK_N": 128, "BLOCK_K": 128, "num_warps": 4, "num_stages": 4, "time_ms": 71.602783203125, "status": "ok"}
{"N": 65536, "K": 65536, "D": 64, "B": 32, "dtype": "fp16", "BLOCK_N": 128, "BLOCK_K": 128, "num_warps": 8, "num_stages": 1, "time_ms": 111.22809600830078, "status": "ok"}
{"N": 65536, "K": 65536, "D": 64, "B": 32, "dtype": "fp16", "BLOCK_N": 128, "BLOCK_K": 128, "num_warps": 8, "num_stages": 2, "time_ms": 74.53382110595703, "status": "ok"}
{"N": 65536, "K": 65536, "D": 64, "B": 32, "dtype": "fp16", "BLOCK_N": 128, "BLOCK_K": 128, "num_warps": 8, "num_stages": 4, "time_ms": 72.10079956054688, "status": "ok"}
{"summary": true, "N": 65536, "K": 65536, "D": 64, "B": 32, "dtype": "fp16", "best": {"N": 65536, "K": 65536, "D": 64, "B": 32, "dtype": "fp16", "BLOCK_N": 128, "BLOCK_K": 128, "num_warps": 4, "num_stages": 4, "time_ms": 71.602783203125, "status": "ok"}, "best_time_ms": 71.602783203125, "tuning_seconds": 67.61807513237, "skipped": 0}
