grid_results_a100/N1048576_K4096_D64_B1_fp16.jsonl
{"N": 1048576, "K": 4096, "D": 64, "B": 1, "dtype": "fp16", "BLOCK_N": 32, "BLOCK_K": 32, "num_warps": 4, "num_stages": 1, "time_ms": 13.369343757629395, "status": "ok"}
{"N": 1048576, "K": 4096, "D": 64, "B": 1, "dtype": "fp16", "BLOCK_N": 32, "BLOCK_K": 32, "num_warps": 4, "num_stages": 2, "time_ms": 9.368576049804688, "status": "ok"}
{"N": 1048576, "K": 4096, "D": 64, "B": 1, "dtype": "fp16", "BLOCK_N": 32, "BLOCK_K": 32, "num_warps": 4, "num_stages": 4, "time_ms": 9.306112289428711, "status": "ok"}
{"N": 1048576, "K": 4096, "D": 64, "B": 1, "dtype": "fp16", "BLOCK_N": 32, "BLOCK_K": 32, "num_warps": 8, "num_stages": 1, "time_ms": 17.074176788330078, "status": "ok"}
{"N": 1048576, "K": 4096, "D": 64, "B": 1, "dtype": "fp16", "BLOCK_N": 32, "BLOCK_K": 32, "num_warps": 8, "num_stages": 2, "time_ms": 16.115711212158203, "status": "ok"}
{"N": 1048576, "K": 4096, "D": 64, "B": 1, "dtype": "fp16", "BLOCK_N": 32, "BLOCK_K": 32, "num_warps": 8, "num_stages": 4, "time_ms": 15.865856170654297, "status": "ok"}
{"N": 1048576, "K": 4096, "D": 64, "B": 1, "dtype": "fp16", "BLOCK_N": 32, "BLOCK_K": 64, "num_warps": 4, "num_stages": 1, "time_ms": 8.988672256469727, "status": "ok"}
{"N": 1048576, "K": 4096, "D": 64, "B": 1, "dtype": "fp16", "BLOCK_N": 32, "BLOCK_K": 64, "num_warps": 4, "num_stages": 2, "time_ms": 7.733248233795166, "status": "ok"}
{"N": 1048576, "K": 4096, "D": 64, "B": 1, "dtype": "fp16", "BLOCK_N": 32, "BLOCK_K": 64, "num_warps": 4, "num_stages": 4, "time_ms": 7.89299201965332, "status": "ok"}
{"N": 1048576, "K": 4096, "D": 64, "B": 1, "dtype": "fp16", "BLOCK_N": 32, "BLOCK_K": 64, "num_warps": 8, "num_stages": 1, "time_ms": 11.511808395385742, "status": "ok"}
{"N": 1048576, "K": 4096, "D": 64, "B": 1, "dtype": "fp16", "BLOCK_N": 32, "BLOCK_K": 64, "num_warps": 8, "num_stages": 2, "time_ms": 10.286080360412598, "status": "ok"}
{"N": 1048576, "K": 4096, "D": 64, "B": 1, "dtype": "fp16", "BLOCK_N": 32, "BLOCK_K": 64, "num_warps": 8, "num_stages": 4, "time_ms": 10.007552146911621, "status": "ok"}
{"N": 1048576, "K": 4096, "D": 64, "B": 1, "dtype": "fp16", "BLOCK_N": 32, "BLOCK_K": 128, "num_warps": 4, "num_stages": 1, "time_ms": 7.4547200202941895, "status": "ok"}
{"N": 1048576, "K": 4096, "D": 64, "B": 1, "dtype": "fp16", "BLOCK_N": 32, "BLOCK_K": 128, "num_warps": 4, "num_stages": 2, "time_ms": 6.503424167633057, "status": "ok"}
{"N": 1048576, "K": 4096, "D": 64, "B": 1, "dtype": "fp16", "BLOCK_N": 32, "BLOCK_K": 128, "num_warps": 4, "num_stages": 4, "time_ms": 6.819839954376221, "status": "ok"}
{"N": 1048576, "K": 4096, "D": 64, "B": 1, "dtype": "fp16", "BLOCK_N": 32, "BLOCK_K": 128, "num_warps": 8, "num_stages": 1, "time_ms": 10.622976303100586, "status": "ok"}
{"N": 1048576, "K": 4096, "D": 64, "B": 1, "dtype": "fp16", "BLOCK_N": 32, "BLOCK_K": 128, "num_warps": 8, "num_stages": 2, "time_ms": 9.676799774169922, "status": "ok"}
{"N": 1048576, "K": 4096, "D": 64, "B": 1, "dtype": "fp16", "BLOCK_N": 32, "BLOCK_K": 128, "num_warps": 8, "num_stages": 4, "time_ms": 10.070015907287598, "status": "ok"}
{"N": 1048576, "K": 4096, "D": 64, "B": 1, "dtype": "fp16", "BLOCK_N": 64, "BLOCK_K": 32, "num_warps": 4, "num_stages": 1, "time_ms": 7.8100481033325195, "status": "ok"}
{"N": 1048576, "K": 4096, "D": 64, "B": 1, "dtype": "fp16", "BLOCK_N": 64, "BLOCK_K": 32, "num_warps": 4, "num_stages": 2, "time_ms": 7.180287837982178, "status": "ok"}
{"N": 1048576, "K": 4096, "D": 64, "B": 1, "dtype": "fp16", "BLOCK_N": 64, "BLOCK_K": 32, "num_warps": 4, "num_stages": 4, "time_ms": 7.305215835571289, "status": "ok"}
{"N": 1048576, "K": 4096, "D": 64, "B": 1, "dtype": "fp16", "BLOCK_N": 64, "BLOCK_K": 32, "num_warps": 8, "num_stages": 1, "time_ms": 9.653247833251953, "status": "ok"}
{"N": 1048576, "K": 4096, "D": 64, "B": 1, "dtype": "fp16", "BLOCK_N": 64, "BLOCK_K": 32, "num_warps": 8, "num_stages": 2, "time_ms": 9.298944473266602, "status": "ok"}
{"N": 1048576, "K": 4096, "D": 64, "B": 1, "dtype": "fp16", "BLOCK_N": 64, "BLOCK_K": 32, "num_warps": 8, "num_stages": 4, "time_ms": 9.351167678833008, "status": "ok"}
{"N": 1048576, "K": 4096, "D": 64, "B": 1, "dtype": "fp16", "BLOCK_N": 64, "BLOCK_K": 64, "num_warps": 4, "num_stages": 1, "time_ms": 6.110208034515381, "status": "ok"}
{"N": 1048576, "K": 4096, "D": 64, "B": 1, "dtype": "fp16", "BLOCK_N": 64, "BLOCK_K": 64, "num_warps": 4, "num_stages": 2, "time_ms": 7.111680030822754, "status": "ok"}
{"N": 1048576, "K": 4096, "D": 64, "B": 1, "dtype": "fp16", "BLOCK_N": 64, "BLOCK_K": 64, "num_warps": 4, "num_stages": 4, "time_ms": 7.080959796905518, "status": "ok"}
{"N": 1048576, "K": 4096, "D": 64, "B": 1, "dtype": "fp16", "BLOCK_N": 64, "BLOCK_K": 64, "num_warps": 8, "num_stages": 1, "time_ms": 10.885120391845703, "status": "ok"}
{"N": 1048576, "K": 4096, "D": 64, "B": 1, "dtype": "fp16", "BLOCK_N": 64, "BLOCK_K": 64, "num_warps": 8, "num_stages": 2, "time_ms": 9.539584159851074, "status": "ok"}
{"N": 1048576, "K": 4096, "D": 64, "B": 1, "dtype": "fp16", "BLOCK_N": 64, "BLOCK_K": 64, "num_warps": 8, "num_stages": 4, "time_ms": 9.505791664123535, "status": "ok"}
{"N": 1048576, "K": 4096, "D": 64, "B": 1, "dtype": "fp16", "BLOCK_N": 64, "BLOCK_K": 128, "num_warps": 4, "num_stages": 1, "time_ms": 7.667712211608887, "status": "ok"}
{"N": 1048576, "K": 4096, "D": 64, "B": 1, "dtype": "fp16", "BLOCK_N": 64, "BLOCK_K": 128, "num_warps": 4, "num_stages": 2, "time_ms": 7.151616096496582, "status": "ok"}
{"N": 1048576, "K": 4096, "D": 64, "B": 1, "dtype": "fp16", "BLOCK_N": 64, "BLOCK_K": 128, "num_warps": 4, "num_stages": 4, "time_ms": 8.829952239990234, "status": "ok"}
{"N": 1048576, "K": 4096, "D": 64, "B": 1, "dtype": "fp16", "BLOCK_N": 64, "BLOCK_K": 128, "num_warps": 8, "num_stages": 1, "time_ms": 9.32147216796875, "status": "ok"}
{"N": 1048576, "K": 4096, "D": 64, "B": 1, "dtype": "fp16", "BLOCK_N": 64, "BLOCK_K": 128, "num_warps": 8, "num_stages": 2, "time_ms": 8.70297622680664, "status": "ok"}
{"N": 1048576, "K": 4096, "D": 64, "B": 1, "dtype": "fp16", "BLOCK_N": 64, "BLOCK_K": 128, "num_warps": 8, "num_stages": 4, "time_ms": 8.22374439239502, "status": "ok"}
{"N": 1048576, "K": 4096, "D": 64, "B": 1, "dtype": "fp16", "BLOCK_N": 128, "BLOCK_K": 32, "num_warps": 4, "num_stages": 1, "time_ms": 6.060031890869141, "status": "ok"}
{"N": 1048576, "K": 4096, "D": 64, "B": 1, "dtype": "fp16", "BLOCK_N": 128, "BLOCK_K": 32, "num_warps": 4, "num_stages": 2, "time_ms": 5.705728054046631, "status": "ok"}
{"N": 1048576, "K": 4096, "D": 64, "B": 1, "dtype": "fp16", "BLOCK_N": 128, "BLOCK_K": 32, "num_warps": 4, "num_stages": 4, "time_ms": 5.8224639892578125, "status": "ok"}
{"N": 1048576, "K": 4096, "D": 64, "B": 1, "dtype": "fp16", "BLOCK_N": 128, "BLOCK_K": 32, "num_warps": 8, "num_stages": 1, "time_ms": 9.977855682373047, "status": "ok"}
{"N": 1048576, "K": 4096, "D": 64, "B": 1, "dtype": "fp16", "BLOCK_N": 128, "BLOCK_K": 32, "num_warps": 8, "num_stages": 2, "time_ms": 9.682944297790527, "status": "ok"}
{"N": 1048576, "K": 4096, "D": 64, "B": 1, "dtype": "fp16", "BLOCK_N": 128, "BLOCK_K": 32, "num_warps": 8, "num_stages": 4, "time_ms": 9.795583724975586, "status": "ok"}
{"N": 1048576, "K": 4096, "D": 64, "B": 1, "dtype": "fp16", "BLOCK_N": 128, "BLOCK_K": 64, "num_warps": 4, "num_stages": 1, "time_ms": 7.920639991760254, "status": "ok"}
{"N": 1048576, "K": 4096, "D": 64, "B": 1, "dtype": "fp16", "BLOCK_N": 128, "BLOCK_K": 64, "num_warps": 4, "num_stages": 2, "time_ms": 6.7696638107299805, "status": "ok"}
{"N": 1048576, "K": 4096, "D": 64, "B": 1, "dtype": "fp16", "BLOCK_N": 128, "BLOCK_K": 64, "num_warps": 4, "num_stages": 4, "time_ms": 6.644735813140869, "status": "ok"}
{"N": 1048576, "K": 4096, "D": 64, "B": 1, "dtype": "fp16", "BLOCK_N": 128, "BLOCK_K": 64, "num_warps": 8, "num_stages": 1, "time_ms": 8.208383560180664, "status": "ok"}
{"N": 1048576, "K": 4096, "D": 64, "B": 1, "dtype": "fp16", "BLOCK_N": 128, "BLOCK_K": 64, "num_warps": 8, "num_stages": 2, "time_ms": 8.049663543701172, "status": "ok"}
{"N": 1048576, "K": 4096, "D": 64, "B": 1, "dtype": "fp16", "BLOCK_N": 128, "BLOCK_K": 64, "num_warps": 8, "num_stages": 4, "time_ms": 8.038399696350098, "status": "ok"}
{"N": 1048576, "K": 4096, "D": 64, "B": 1, "dtype": "fp16", "BLOCK_N": 128, "BLOCK_K": 128, "num_warps": 4, "num_stages": 1, "time_ms": 6.806528091430664, "status": "ok"}
{"N": 1048576, "K": 4096, "D": 64, "B": 1, "dtype": "fp16", "BLOCK_N": 128, "BLOCK_K": 128, "num_warps": 4, "num_stages": 2, "time_ms": 6.781951904296875, "status": "ok"}
{"N": 1048576, "K": 4096, "D": 64, "B": 1, "dtype": "fp16", "BLOCK_N": 128, "BLOCK_K": 128, "num_warps": 4, "num_stages": 4, "time_ms": 6.768640041351318, "status": "ok"}
{"N": 1048576, "K": 4096, "D": 64, "B": 1, "dtype": "fp16", "BLOCK_N": 128, "BLOCK_K": 128, "num_warps": 8, "num_stages": 1, "time_ms": 10.391551971435547, "status": "ok"}
{"N": 1048576, "K": 4096, "D": 64, "B": 1, "dtype": "fp16", "BLOCK_N": 128, "BLOCK_K": 128, "num_warps": 8, "num_stages": 2, "time_ms": 9.398271560668945, "status": "ok"}
{"N": 1048576, "K": 4096, "D": 64, "B": 1, "dtype": "fp16", "BLOCK_N": 128, "BLOCK_K": 128, "num_warps": 8, "num_stages": 4, "time_ms": 8.592384338378906, "status": "ok"}
{"summary": true, "N": 1048576, "K": 4096, "D": 64, "B": 1, "dtype": "fp16", "best": {"N": 1048576, "K": 4096, "D": 64, "B": 1, "dtype": "fp16", "BLOCK_N": 128, "BLOCK_K": 32, "num_warps": 4, "num_stages": 2, "time_ms": 5.705728054046631, "status": "ok"}, "best_time_ms": 5.705728054046631, "tuning_seconds": 18.92218017578125, "skipped": 0}
