grid_results_a100/N1048576_K16384_D64_B1_fp16.jsonl
{"N": 1048576, "K": 16384, "D": 64, "B": 1, "dtype": "fp16", "BLOCK_N": 32, "BLOCK_K": 32, "num_warps": 4, "num_stages": 1, "time_ms": 42.37209701538086, "status": "ok"}
{"N": 1048576, "K": 16384, "D": 64, "B": 1, "dtype": "fp16", "BLOCK_N": 32, "BLOCK_K": 32, "num_warps": 4, "num_stages": 2, "time_ms": 37.28691101074219, "status": "ok"}
{"N": 1048576, "K": 16384, "D": 64, "B": 1, "dtype": "fp16", "BLOCK_N": 32, "BLOCK_K": 32, "num_warps": 4, "num_stages": 4, "time_ms": 36.93772888183594, "status": "ok"}
{"N": 1048576, "K": 16384, "D": 64, "B": 1, "dtype": "fp16", "BLOCK_N": 32, "BLOCK_K": 32, "num_warps": 8, "num_stages": 1, "time_ms": 68.5823974609375, "status": "ok"}
{"N": 1048576, "K": 16384, "D": 64, "B": 1, "dtype": "fp16", "BLOCK_N": 32, "BLOCK_K": 32, "num_warps": 8, "num_stages": 2, "time_ms": 64.18841552734375, "status": "ok"}
{"N": 1048576, "K": 16384, "D": 64, "B": 1, "dtype": "fp16", "BLOCK_N": 32, "BLOCK_K": 32, "num_warps": 8, "num_stages": 4, "time_ms": 63.1357421875, "status": "ok"}
{"N": 1048576, "K": 16384, "D": 64, "B": 1, "dtype": "fp16", "BLOCK_N": 32, "BLOCK_K": 64, "num_warps": 4, "num_stages": 1, "time_ms": 35.9444465637207, "status": "ok"}
{"N": 1048576, "K": 16384, "D": 64, "B": 1, "dtype": "fp16", "BLOCK_N": 32, "BLOCK_K": 64, "num_warps": 4, "num_stages": 2, "time_ms": 30.962688446044922, "status": "ok"}
{"N": 1048576, "K": 16384, "D": 64, "B": 1, "dtype": "fp16", "BLOCK_N": 32, "BLOCK_K": 64, "num_warps": 4, "num_stages": 4, "time_ms": 31.547391891479492, "status": "ok"}
{"N": 1048576, "K": 16384, "D": 64, "B": 1, "dtype": "fp16", "BLOCK_N": 32, "BLOCK_K": 64, "num_warps": 8, "num_stages": 1, "time_ms": 46.6063346862793, "status": "ok"}
{"N": 1048576, "K": 16384, "D": 64, "B": 1, "dtype": "fp16", "BLOCK_N": 32, "BLOCK_K": 64, "num_warps": 8, "num_stages": 2, "time_ms": 40.84940719604492, "status": "ok"}
{"N": 1048576, "K": 16384, "D": 64, "B": 1, "dtype": "fp16", "BLOCK_N": 32, "BLOCK_K": 64, "num_warps": 8, "num_stages": 4, "time_ms": 39.55507278442383, "status": "ok"}
{"N": 1048576, "K": 16384, "D": 64, "B": 1, "dtype": "fp16", "BLOCK_N": 32, "BLOCK_K": 128, "num_warps": 4, "num_stages": 1, "time_ms": 29.470720291137695, "status": "ok"}
{"N": 1048576, "K": 16384, "D": 64, "B": 1, "dtype": "fp16", "BLOCK_N": 32, "BLOCK_K": 128, "num_warps": 4, "num_stages": 2, "time_ms": 25.923583984375, "status": "ok"}
{"N": 1048576, "K": 16384, "D": 64, "B": 1, "dtype": "fp16", "BLOCK_N": 32, "BLOCK_K": 128, "num_warps": 4, "num_stages": 4, "time_ms": 26.90559959411621, "status": "ok"}
{"N": 1048576, "K": 16384, "D": 64, "B": 1, "dtype": "fp16", "BLOCK_N": 32, "BLOCK_K": 128, "num_warps": 8, "num_stages": 1, "time_ms": 42.50214385986328, "status": "ok"}
{"N": 1048576, "K": 16384, "D": 64, "B": 1, "dtype": "fp16", "BLOCK_N": 32, "BLOCK_K": 128, "num_warps": 8, "num_stages": 2, "time_ms": 38.53209686279297, "status": "ok"}
{"N": 1048576, "K": 16384, "D": 64, "B": 1, "dtype": "fp16", "BLOCK_N": 32, "BLOCK_K": 128, "num_warps": 8, "num_stages": 4, "time_ms": 39.43423843383789, "status": "ok"}
{"N": 1048576, "K": 16384, "D": 64, "B": 1, "dtype": "fp16", "BLOCK_N": 64, "BLOCK_K": 32, "num_warps": 4, "num_stages": 1, "time_ms": 31.40812873840332, "status": "ok"}
{"N": 1048576, "K": 16384, "D": 64, "B": 1, "dtype": "fp16", "BLOCK_N": 64, "BLOCK_K": 32, "num_warps": 4, "num_stages": 2, "time_ms": 28.53376007080078, "status": "ok"}
{"N": 1048576, "K": 16384, "D": 64, "B": 1, "dtype": "fp16", "BLOCK_N": 64, "BLOCK_K": 32, "num_warps": 4, "num_stages": 4, "time_ms": 28.855295181274414, "status": "ok"}
{"N": 1048576, "K": 16384, "D": 64, "B": 1, "dtype": "fp16", "BLOCK_N": 64, "BLOCK_K": 32, "num_warps": 8, "num_stages": 1, "time_ms": 39.07379150390625, "status": "ok"}
{"N": 1048576, "K": 16384, "D": 64, "B": 1, "dtype": "fp16", "BLOCK_N": 64, "BLOCK_K": 32, "num_warps": 8, "num_stages": 2, "time_ms": 37.00940704345703, "status": "ok"}
{"N": 1048576, "K": 16384, "D": 64, "B": 1, "dtype": "fp16", "BLOCK_N": 64, "BLOCK_K": 32, "num_warps": 8, "num_stages": 4, "time_ms": 37.186561584472656, "status": "ok"}
{"N": 1048576, "K": 16384, "D": 64, "B": 1, "dtype": "fp16", "BLOCK_N": 64, "BLOCK_K": 64, "num_warps": 4, "num_stages": 1, "time_ms": 24.383487701416016, "status": "ok"}
{"N": 1048576, "K": 16384, "D": 64, "B": 1, "dtype": "fp16", "BLOCK_N": 64, "BLOCK_K": 64, "num_warps": 4, "num_stages": 2, "time_ms": 22.52390480041504, "status": "ok"}
{"N": 1048576, "K": 16384, "D": 64, "B": 1, "dtype": "fp16", "BLOCK_N": 64, "BLOCK_K": 64, "num_warps": 4, "num_stages": 4, "time_ms": 22.171648025512695, "status": "ok"}
{"N": 1048576, "K": 16384, "D": 64, "B": 1, "dtype": "fp16", "BLOCK_N": 64, "BLOCK_K": 64, "num_warps": 8, "num_stages": 1, "time_ms": 33.97529602050781, "status": "ok"}
{"N": 1048576, "K": 16384, "D": 64, "B": 1, "dtype": "fp16", "BLOCK_N": 64, "BLOCK_K": 64, "num_warps": 8, "num_stages": 2, "time_ms": 32.47923278808594, "status": "ok"}
{"N": 1048576, "K": 16384, "D": 64, "B": 1, "dtype": "fp16", "BLOCK_N": 64, "BLOCK_K": 64, "num_warps": 8, "num_stages": 4, "time_ms": 31.99385643005371, "status": "ok"}
{"N": 1048576, "K": 16384, "D": 64, "B": 1, "dtype": "fp16", "BLOCK_N": 64, "BLOCK_K": 128, "num_warps": 4, "num_stages": 1, "time_ms": 25.9051513671875, "status": "ok"}
{"N": 1048576, "K": 16384, "D": 64, "B": 1, "dtype": "fp16", "BLOCK_N": 64, "BLOCK_K": 128, "num_warps": 4, "num_stages": 2, "time_ms": 24.09267234802246, "status": "ok"}
{"N": 1048576, "K": 16384, "D": 64, "B": 1, "dtype": "fp16", "BLOCK_N": 64, "BLOCK_K": 128, "num_warps": 4, "num_stages": 4, "time_ms": 27.043840408325195, "status": "ok"}
{"N": 1048576, "K": 16384, "D": 64, "B": 1, "dtype": "fp16", "BLOCK_N": 64, "BLOCK_K": 128, "num_warps": 8, "num_stages": 1, "time_ms": 28.95155143737793, "status": "ok"}
{"N": 1048576, "K": 16384, "D": 64, "B": 1, "dtype": "fp16", "BLOCK_N": 64, "BLOCK_K": 128, "num_warps": 8, "num_stages": 2, "time_ms": 26.96396827697754, "status": "ok"}
{"N": 1048576, "K": 16384, "D": 64, "B": 1, "dtype": "fp16", "BLOCK_N": 64, "BLOCK_K": 128, "num_warps": 8, "num_stages": 4, "time_ms": 25.032703399658203, "status": "ok"}
{"N": 1048576, "K": 16384, "D": 64, "B": 1, "dtype": "fp16", "BLOCK_N": 128, "BLOCK_K": 32, "num_warps": 4, "num_stages": 1, "time_ms": 19.25836753845215, "status": "ok"}
{"N": 1048576, "K": 16384, "D": 64, "B": 1, "dtype": "fp16", "BLOCK_N": 128, "BLOCK_K": 32, "num_warps": 4, "num_stages": 2, "time_ms": 18.152448654174805, "status": "ok"}
{"N": 1048576, "K": 16384, "D": 64, "B": 1, "dtype": "fp16", "BLOCK_N": 128, "BLOCK_K": 32, "num_warps": 4, "num_stages": 4, "time_ms": 18.737152099609375, "status": "ok"}
{"N": 1048576, "K": 16384, "D": 64, "B": 1, "dtype": "fp16", "BLOCK_N": 128, "BLOCK_K": 32, "num_warps": 8, "num_stages": 1, "time_ms": 31.303680419921875, "status": "ok"}
{"N": 1048576, "K": 16384, "D": 64, "B": 1, "dtype": "fp16", "BLOCK_N": 128, "BLOCK_K": 32, "num_warps": 8, "num_stages": 2, "time_ms": 30.3636474609375, "status": "ok"}
{"N": 1048576, "K": 16384, "D": 64, "B": 1, "dtype": "fp16", "BLOCK_N": 128, "BLOCK_K": 32, "num_warps": 8, "num_stages": 4, "time_ms": 30.625791549682617, "status": "ok"}
{"N": 1048576, "K": 16384, "D": 64, "B": 1, "dtype": "fp16", "BLOCK_N": 128, "BLOCK_K": 64, "num_warps": 4, "num_stages": 1, "time_ms": 24.995840072631836, "status": "ok"}
{"N": 1048576, "K": 16384, "D": 64, "B": 1, "dtype": "fp16", "BLOCK_N": 128, "BLOCK_K": 64, "num_warps": 4, "num_stages": 2, "time_ms": 21.347328186035156, "status": "ok"}
{"N": 1048576, "K": 16384, "D": 64, "B": 1, "dtype": "fp16", "BLOCK_N": 128, "BLOCK_K": 64, "num_warps": 4, "num_stages": 4, "time_ms": 20.902912139892578, "status": "ok"}
{"N": 1048576, "K": 16384, "D": 64, "B": 1, "dtype": "fp16", "BLOCK_N": 128, "BLOCK_K": 64, "num_warps": 8, "num_stages": 1, "time_ms": 26.12735939025879, "status": "ok"}
{"N": 1048576, "K": 16384, "D": 64, "B": 1, "dtype": "fp16", "BLOCK_N": 128, "BLOCK_K": 64, "num_warps": 8, "num_stages": 2, "time_ms": 24.88422393798828, "status": "ok"}
{"N": 1048576, "K": 16384, "D": 64, "B": 1, "dtype": "fp16", "BLOCK_N": 128, "BLOCK_K": 64, "num_warps": 8, "num_stages": 4, "time_ms": 24.825855255126953, "status": "ok"}
{"N": 1048576, "K": 16384, "D": 64, "B": 1, "dtype": "fp16", "BLOCK_N": 128, "BLOCK_K": 128, "num_warps": 4, "num_stages": 1, "time_ms": 20.928512573242188, "status": "ok"}
{"N": 1048576, "K": 16384, "D": 64, "B": 1, "dtype": "fp16", "BLOCK_N": 128, "BLOCK_K": 128, "num_warps": 4, "num_stages": 2, "time_ms": 20.88755226135254, "status": "ok"}
{"N": 1048576, "K": 16384, "D": 64, "B": 1, "dtype": "fp16", "BLOCK_N": 128, "BLOCK_K": 128, "num_warps": 4, "num_stages": 4, "time_ms": 20.89574432373047, "status": "ok"}
{"N": 1048576, "K": 16384, "D": 64, "B": 1, "dtype": "fp16", "BLOCK_N": 128, "BLOCK_K": 128, "num_warps": 8, "num_stages": 1, "time_ms": 32.68812942504883, "status": "ok"}
{"N": 1048576, "K": 16384, "D": 64, "B": 1, "dtype": "fp16", "BLOCK_N": 128, "BLOCK_K": 128, "num_warps": 8, "num_stages": 2, "time_ms": 30.525440216064453, "status": "ok"}
{"N": 1048576, "K": 16384, "D": 64, "B": 1, "dtype": "fp16", "BLOCK_N": 128, "BLOCK_K": 128, "num_warps": 8, "num_stages": 4, "time_ms": 27.882495880126953, "status": "ok"}
{"summary": true, "N": 1048576, "K": 16384, "D": 64, "B": 1, "dtype": "fp16", "best": {"N": 1048576, "K": 16384, "D": 64, "B": 1, "dtype": "fp16", "BLOCK_N": 128, "BLOCK_K": 32, "num_warps": 4, "num_stages": 2, "time_ms": 18.152448654174805, "status": "ok"}, "best_time_ms": 18.152448654174805, "tuning_seconds": 28.82296085357666, "skipped": 0}
