grid_results_a100/N1048576_K256_D64_B32_fp16.jsonl
{"N": 1048576, "K": 256, "D": 64, "B": 32, "dtype": "fp16", "BLOCK_N": 32, "BLOCK_K": 32, "num_warps": 4, "num_stages": 1, "time_ms": 21.510143280029297, "status": "ok"}
{"N": 1048576, "K": 256, "D": 64, "B": 32, "dtype": "fp16", "BLOCK_N": 32, "BLOCK_K": 32, "num_warps": 4, "num_stages": 2, "time_ms": 19.908607482910156, "status": "ok"}
{"N": 1048576, "K": 256, "D": 64, "B": 32, "dtype": "fp16", "BLOCK_N": 32, "BLOCK_K": 32, "num_warps": 4, "num_stages": 4, "time_ms": 20.316160202026367, "status": "ok"}
{"N": 1048576, "K": 256, "D": 64, "B": 32, "dtype": "fp16", "BLOCK_N": 32, "BLOCK_K": 32, "num_warps": 8, "num_stages": 1, "time_ms": 34.750465393066406, "status": "ok"}
{"N": 1048576, "K": 256, "D": 64, "B": 32, "dtype": "fp16", "BLOCK_N": 32, "BLOCK_K": 32, "num_warps": 8, "num_stages": 2, "time_ms": 34.06438446044922, "status": "ok"}
{"N": 1048576, "K": 256, "D": 64, "B": 32, "dtype": "fp16", "BLOCK_N": 32, "BLOCK_K": 32, "num_warps": 8, "num_stages": 4, "time_ms": 34.19647979736328, "status": "ok"}
{"N": 1048576, "K": 256, "D": 64, "B": 32, "dtype": "fp16", "BLOCK_N": 32, "BLOCK_K": 64, "num_warps": 4, "num_stages": 1, "time_ms": 18.63065528869629, "status": "ok"}
{"N": 1048576, "K": 256, "D": 64, "B": 32, "dtype": "fp16", "BLOCK_N": 32, "BLOCK_K": 64, "num_warps": 4, "num_stages": 2, "time_ms": 17.244159698486328, "status": "ok"}
{"N": 1048576, "K": 256, "D": 64, "B": 32, "dtype": "fp16", "BLOCK_N": 32, "BLOCK_K": 64, "num_warps": 4, "num_stages": 4, "time_ms": 18.819072723388672, "status": "ok"}
{"N": 1048576, "K": 256, "D": 64, "B": 32, "dtype": "fp16", "BLOCK_N": 32, "BLOCK_K": 64, "num_warps": 8, "num_stages": 1, "time_ms": 24.342527389526367, "status": "ok"}
{"N": 1048576, "K": 256, "D": 64, "B": 32, "dtype": "fp16", "BLOCK_N": 32, "BLOCK_K": 64, "num_warps": 8, "num_stages": 2, "time_ms": 22.752256393432617, "status": "ok"}
{"N": 1048576, "K": 256, "D": 64, "B": 32, "dtype": "fp16", "BLOCK_N": 32, "BLOCK_K": 64, "num_warps": 8, "num_stages": 4, "time_ms": 23.427072525024414, "status": "ok"}
{"N": 1048576, "K": 256, "D": 64, "B": 32, "dtype": "fp16", "BLOCK_N": 32, "BLOCK_K": 128, "num_warps": 4, "num_stages": 1, "time_ms": 16.245759963989258, "status": "ok"}
{"N": 1048576, "K": 256, "D": 64, "B": 32, "dtype": "fp16", "BLOCK_N": 32, "BLOCK_K": 128, "num_warps": 4, "num_stages": 2, "time_ms": 16.086015701293945, "status": "ok"}
{"N": 1048576, "K": 256, "D": 64, "B": 32, "dtype": "fp16", "BLOCK_N": 32, "BLOCK_K": 128, "num_warps": 4, "num_stages": 4, "time_ms": 19.45907211303711, "status": "ok"}
{"N": 1048576, "K": 256, "D": 64, "B": 32, "dtype": "fp16", "BLOCK_N": 32, "BLOCK_K": 128, "num_warps": 8, "num_stages": 1, "time_ms": 22.535167694091797, "status": "ok"}
{"N": 1048576, "K": 256, "D": 64, "B": 32, "dtype": "fp16", "BLOCK_N": 32, "BLOCK_K": 128, "num_warps": 8, "num_stages": 2, "time_ms": 22.24947166442871, "status": "ok"}
{"N": 1048576, "K": 256, "D": 64, "B": 32, "dtype": "fp16", "BLOCK_N": 32, "BLOCK_K": 128, "num_warps": 8, "num_stages": 4, "time_ms": 26.151935577392578, "status": "ok"}
{"N": 1048576, "K": 256, "D": 64, "B": 32, "dtype": "fp16", "BLOCK_N": 64, "BLOCK_K": 32, "num_warps": 4, "num_stages": 1, "time_ms": 16.108543395996094, "status": "ok"}
{"N": 1048576, "K": 256, "D": 64, "B": 32, "dtype": "fp16", "BLOCK_N": 64, "BLOCK_K": 32, "num_warps": 4, "num_stages": 2, "time_ms": 15.57913589477539, "status": "ok"}
{"N": 1048576, "K": 256, "D": 64, "B": 32, "dtype": "fp16", "BLOCK_N": 64, "BLOCK_K": 32, "num_warps": 4, "num_stages": 4, "time_ms": 15.878144264221191, "status": "ok"}
{"N": 1048576, "K": 256, "D": 64, "B": 32, "dtype": "fp16", "BLOCK_N": 64, "BLOCK_K": 32, "num_warps": 8, "num_stages": 1, "time_ms": 19.737600326538086, "status": "ok"}
{"N": 1048576, "K": 256, "D": 64, "B": 32, "dtype": "fp16", "BLOCK_N": 64, "BLOCK_K": 32, "num_warps": 8, "num_stages": 2, "time_ms": 19.85740852355957, "status": "ok"}
{"N": 1048576, "K": 256, "D": 64, "B": 32, "dtype": "fp16", "BLOCK_N": 64, "BLOCK_K": 32, "num_warps": 8, "num_stages": 4, "time_ms": 20.24448013305664, "status": "ok"}
{"N": 1048576, "K": 256, "D": 64, "B": 32, "dtype": "fp16", "BLOCK_N": 64, "BLOCK_K": 64, "num_warps": 4, "num_stages": 1, "time_ms": 12.964863777160645, "status": "ok"}
{"N": 1048576, "K": 256, "D": 64, "B": 32, "dtype": "fp16", "BLOCK_N": 64, "BLOCK_K": 64, "num_warps": 4, "num_stages": 2, "time_ms": 12.886015892028809, "status": "ok"}
{"N": 1048576, "K": 256, "D": 64, "B": 32, "dtype": "fp16", "BLOCK_N": 64, "BLOCK_K": 64, "num_warps": 4, "num_stages": 4, "time_ms": 12.948479652404785, "status": "ok"}
{"N": 1048576, "K": 256, "D": 64, "B": 32, "dtype": "fp16", "BLOCK_N": 64, "BLOCK_K": 64, "num_warps": 8, "num_stages": 1, "time_ms": 17.733631134033203, "status": "ok"}
{"N": 1048576, "K": 256, "D": 64, "B": 32, "dtype": "fp16", "BLOCK_N": 64, "BLOCK_K": 64, "num_warps": 8, "num_stages": 2, "time_ms": 17.926143646240234, "status": "ok"}
{"N": 1048576, "K": 256, "D": 64, "B": 32, "dtype": "fp16", "BLOCK_N": 64, "BLOCK_K": 64, "num_warps": 8, "num_stages": 4, "time_ms": 18.03775978088379, "status": "ok"}
{"N": 1048576, "K": 256, "D": 64, "B": 32, "dtype": "fp16", "BLOCK_N": 64, "BLOCK_K": 128, "num_warps": 4, "num_stages": 1, "time_ms": 14.4650239944458, "status": "ok"}
{"N": 1048576, "K": 256, "D": 64, "B": 32, "dtype": "fp16", "BLOCK_N": 64, "BLOCK_K": 128, "num_warps": 4, "num_stages": 2, "time_ms": 14.190591812133789, "status": "ok"}
{"N": 1048576, "K": 256, "D": 64, "B": 32, "dtype": "fp16", "BLOCK_N": 64, "BLOCK_K": 128, "num_warps": 4, "num_stages": 4, "time_ms": 17.679359436035156, "status": "ok"}
{"N": 1048576, "K": 256, "D": 64, "B": 32, "dtype": "fp16", "BLOCK_N": 64, "BLOCK_K": 128, "num_warps": 8, "num_stages": 1, "time_ms": 15.0763521194458, "status": "ok"}
{"N": 1048576, "K": 256, "D": 64, "B": 32, "dtype": "fp16", "BLOCK_N": 64, "BLOCK_K": 128, "num_warps": 8, "num_stages": 2, "time_ms": 16.358400344848633, "status": "ok"}
{"N": 1048576, "K": 256, "D": 64, "B": 32, "dtype": "fp16", "BLOCK_N": 64, "BLOCK_K": 128, "num_warps": 8, "num_stages": 4, "time_ms": 16.502784729003906, "status": "ok"}
{"N": 1048576, "K": 256, "D": 64, "B": 32, "dtype": "fp16", "BLOCK_N": 128, "BLOCK_K": 32, "num_warps": 4, "num_stages": 1, "time_ms": 10.431488037109375, "status": "ok"}
{"N": 1048576, "K": 256, "D": 64, "B": 32, "dtype": "fp16", "BLOCK_N": 128, "BLOCK_K": 32, "num_warps": 4, "num_stages": 2, "time_ms": 9.597951889038086, "status": "ok"}
{"N": 1048576, "K": 256, "D": 64, "B": 32, "dtype": "fp16", "BLOCK_N": 128, "BLOCK_K": 32, "num_warps": 4, "num_stages": 4, "time_ms": 10.377216339111328, "status": "ok"}
{"N": 1048576, "K": 256, "D": 64, "B": 32, "dtype": "fp16", "BLOCK_N": 128, "BLOCK_K": 32, "num_warps": 8, "num_stages": 1, "time_ms": 16.128000259399414, "status": "ok"}
{"N": 1048576, "K": 256, "D": 64, "B": 32, "dtype": "fp16", "BLOCK_N": 128, "BLOCK_K": 32, "num_warps": 8, "num_stages": 2, "time_ms": 16.671743392944336, "status": "ok"}
{"N": 1048576, "K": 256, "D": 64, "B": 32, "dtype": "fp16", "BLOCK_N": 128, "BLOCK_K": 32, "num_warps": 8, "num_stages": 4, "time_ms": 16.43622398376465, "status": "ok"}
{"N": 1048576, "K": 256, "D": 64, "B": 32, "dtype": "fp16", "BLOCK_N": 128, "BLOCK_K": 64, "num_warps": 4, "num_stages": 1, "time_ms": 13.306879997253418, "status": "ok"}
{"N": 1048576, "K": 256, "D": 64, "B": 32, "dtype": "fp16", "BLOCK_N": 128, "BLOCK_K": 64, "num_warps": 4, "num_stages": 2, "time_ms": 11.984895706176758, "status": "ok"}
{"N": 1048576, "K": 256, "D": 64, "B": 32, "dtype": "fp16", "BLOCK_N": 128, "BLOCK_K": 64, "num_warps": 4, "num_stages": 4, "time_ms": 11.806719779968262, "status": "ok"}
{"N": 1048576, "K": 256, "D": 64, "B": 32, "dtype": "fp16", "BLOCK_N": 128, "BLOCK_K": 64, "num_warps": 8, "num_stages": 1, "time_ms": 13.832192420959473, "status": "ok"}
{"N": 1048576, "K": 256, "D": 64, "B": 32, "dtype": "fp16", "BLOCK_N": 128, "BLOCK_K": 64, "num_warps": 8, "num_stages": 2, "time_ms": 14.15782356262207, "status": "ok"}
{"N": 1048576, "K": 256, "D": 64, "B": 32, "dtype": "fp16", "BLOCK_N": 128, "BLOCK_K": 64, "num_warps": 8, "num_stages": 4, "time_ms": 13.77280044555664, "status": "ok"}
{"N": 1048576, "K": 256, "D": 64, "B": 32, "dtype": "fp16", "BLOCK_N": 128, "BLOCK_K": 128, "num_warps": 4, "num_stages": 1, "time_ms": 13.838335990905762, "status": "ok"}
{"N": 1048576, "K": 256, "D": 64, "B": 32, "dtype": "fp16", "BLOCK_N": 128, "BLOCK_K": 128, "num_warps": 4, "num_stages": 2, "time_ms": 13.148159980773926, "status": "ok"}
{"N": 1048576, "K": 256, "D": 64, "B": 32, "dtype": "fp16", "BLOCK_N": 128, "BLOCK_K": 128, "num_warps": 4, "num_stages": 4, "time_ms": 12.370944023132324, "status": "ok"}
{"N": 1048576, "K": 256, "D": 64, "B": 32, "dtype": "fp16", "BLOCK_N": 128, "BLOCK_K": 128, "num_warps": 8, "num_stages": 1, "time_ms": 17.250303268432617, "status": "ok"}
{"N": 1048576, "K": 256, "D": 64, "B": 32, "dtype": "fp16", "BLOCK_N": 128, "BLOCK_K": 128, "num_warps": 8, "num_stages": 2, "time_ms": 18.546688079833984, "status": "ok"}
{"N": 1048576, "K": 256, "D": 64, "B": 32, "dtype": "fp16", "BLOCK_N": 128, "BLOCK_K": 128, "num_warps": 8, "num_stages": 4, "time_ms": 18.589696884155273, "status": "ok"}
{"summary": true, "N": 1048576, "K": 256, "D": 64, "B": 32, "dtype": "fp16", "best": {"N": 1048576, "K": 256, "D": 64, "B": 32, "dtype": "fp16", "BLOCK_N": 128, "BLOCK_K": 32, "num_warps": 4, "num_stages": 2, "time_ms": 9.597951889038086, "status": "ok"}, "best_time_ms": 9.597951889038086, "tuning_seconds": 22.720933437347412, "skipped": 0}
