grid_results_a100/N1048576_K200000_D128_B1_fp16.jsonl
{"N": 1048576, "K": 200000, "D": 128, "B": 1, "dtype": "fp16", "BLOCK_N": 32, "BLOCK_K": 32, "num_warps": 4, "num_stages": 1, "time_ms": 816.6328125, "status": "ok"}
{"N": 1048576, "K": 200000, "D": 128, "B": 1, "dtype": "fp16", "BLOCK_N": 32, "BLOCK_K": 32, "num_warps": 4, "num_stages": 2, "time_ms": 671.1972045898438, "status": "ok"}
{"N": 1048576, "K": 200000, "D": 128, "B": 1, "dtype": "fp16", "BLOCK_N": 32, "BLOCK_K": 32, "num_warps": 4, "num_stages": 4, "time_ms": 694.7000122070312, "status": "ok"}
{"N": 1048576, "K": 200000, "D": 128, "B": 1, "dtype": "fp16", "BLOCK_N": 32, "BLOCK_K": 32, "num_warps": 8, "num_stages": 1, "time_ms": 1186.58251953125, "status": "ok"}
{"N": 1048576, "K": 200000, "D": 128, "B": 1, "dtype": "fp16", "BLOCK_N": 32, "BLOCK_K": 32, "num_warps": 8, "num_stages": 2, "time_ms": 1087.2237548828125, "status": "ok"}
{"N": 1048576, "K": 200000, "D": 128, "B": 1, "dtype": "fp16", "BLOCK_N": 32, "BLOCK_K": 32, "num_warps": 8, "num_stages": 4, "time_ms": 1069.6365966796875, "status": "ok"}
{"N": 1048576, "K": 200000, "D": 128, "B": 1, "dtype": "fp16", "BLOCK_N": 32, "BLOCK_K": 64, "num_warps": 4, "num_stages": 1, "time_ms": 716.464111328125, "status": "ok"}
{"N": 1048576, "K": 200000, "D": 128, "B": 1, "dtype": "fp16", "BLOCK_N": 32, "BLOCK_K": 64, "num_warps": 4, "num_stages": 2, "time_ms": 559.4111938476562, "status": "ok"}
{"N": 1048576, "K": 200000, "D": 128, "B": 1, "dtype": "fp16", "BLOCK_N": 32, "BLOCK_K": 64, "num_warps": 4, "num_stages": 4, "time_ms": 667.7596435546875, "status": "ok"}
{"N": 1048576, "K": 200000, "D": 128, "B": 1, "dtype": "fp16", "BLOCK_N": 32, "BLOCK_K": 64, "num_warps": 8, "num_stages": 1, "time_ms": 853.3330078125, "status": "ok"}
{"N": 1048576, "K": 200000, "D": 128, "B": 1, "dtype": "fp16", "BLOCK_N": 32, "BLOCK_K": 64, "num_warps": 8, "num_stages": 2, "time_ms": 715.0551147460938, "status": "ok"}
{"N": 1048576, "K": 200000, "D": 128, "B": 1, "dtype": "fp16", "BLOCK_N": 32, "BLOCK_K": 64, "num_warps": 8, "num_stages": 4, "time_ms": 789.8665161132812, "status": "ok"}
{"N": 1048576, "K": 200000, "D": 128, "B": 1, "dtype": "fp16", "BLOCK_N": 32, "BLOCK_K": 128, "num_warps": 4, "num_stages": 1, "time_ms": 622.772216796875, "status": "ok"}
{"N": 1048576, "K": 200000, "D": 128, "B": 1, "dtype": "fp16", "BLOCK_N": 32, "BLOCK_K": 128, "num_warps": 4, "num_stages": 2, "time_ms": 540.0463256835938, "status": "ok"}
{"N": 1048576, "K": 200000, "D": 128, "B": 1, "dtype": "fp16", "BLOCK_N": 32, "BLOCK_K": 128, "num_warps": 4, "num_stages": 4, "time_ms": 815.3917236328125, "status": "ok"}
{"N": 1048576, "K": 200000, "D": 128, "B": 1, "dtype": "fp16", "BLOCK_N": 32, "BLOCK_K": 128, "num_warps": 8, "num_stages": 1, "time_ms": 833.5155029296875, "status": "ok"}
{"N": 1048576, "K": 200000, "D": 128, "B": 1, "dtype": "fp16", "BLOCK_N": 32, "BLOCK_K": 128, "num_warps": 8, "num_stages": 2, "time_ms": 658.2476806640625, "status": "ok"}
{"N": 1048576, "K": 200000, "D": 128, "B": 1, "dtype": "fp16", "BLOCK_N": 32, "BLOCK_K": 128, "num_warps": 8, "num_stages": 4, "time_ms": 984.5933837890625, "status": "ok"}
{"N": 1048576, "K": 200000, "D": 128, "B": 1, "dtype": "fp16", "BLOCK_N": 64, "BLOCK_K": 32, "num_warps": 4, "num_stages": 1, "time_ms": 584.4121704101562, "status": "ok"}
{"N": 1048576, "K": 200000, "D": 128, "B": 1, "dtype": "fp16", "BLOCK_N": 64, "BLOCK_K": 32, "num_warps": 4, "num_stages": 2, "time_ms": 513.7479858398438, "status": "ok"}
{"N": 1048576, "K": 200000, "D": 128, "B": 1, "dtype": "fp16", "BLOCK_N": 64, "BLOCK_K": 32, "num_warps": 4, "num_stages": 4, "time_ms": 548.569091796875, "status": "ok"}
{"N": 1048576, "K": 200000, "D": 128, "B": 1, "dtype": "fp16", "BLOCK_N": 64, "BLOCK_K": 32, "num_warps": 8, "num_stages": 1, "time_ms": 736.3839721679688, "status": "ok"}
{"N": 1048576, "K": 200000, "D": 128, "B": 1, "dtype": "fp16", "BLOCK_N": 64, "BLOCK_K": 32, "num_warps": 8, "num_stages": 2, "time_ms": 651.1943969726562, "status": "ok"}
{"N": 1048576, "K": 200000, "D": 128, "B": 1, "dtype": "fp16", "BLOCK_N": 64, "BLOCK_K": 32, "num_warps": 8, "num_stages": 4, "time_ms": 661.11181640625, "status": "ok"}
{"N": 1048576, "K": 200000, "D": 128, "B": 1, "dtype": "fp16", "BLOCK_N": 64, "BLOCK_K": 64, "num_warps": 4, "num_stages": 1, "time_ms": 452.2823791503906, "status": "ok"}
{"N": 1048576, "K": 200000, "D": 128, "B": 1, "dtype": "fp16", "BLOCK_N": 64, "BLOCK_K": 64, "num_warps": 4, "num_stages": 2, "time_ms": 399.6631164550781, "status": "ok"}
{"N": 1048576, "K": 200000, "D": 128, "B": 1, "dtype": "fp16", "BLOCK_N": 64, "BLOCK_K": 64, "num_warps": 4, "num_stages": 4, "time_ms": 444.8798828125, "status": "ok"}
{"N": 1048576, "K": 200000, "D": 128, "B": 1, "dtype": "fp16", "BLOCK_N": 64, "BLOCK_K": 64, "num_warps": 8, "num_stages": 1, "time_ms": 600.0097045898438, "status": "ok"}
{"N": 1048576, "K": 200000, "D": 128, "B": 1, "dtype": "fp16", "BLOCK_N": 64, "BLOCK_K": 64, "num_warps": 8, "num_stages": 2, "time_ms": 549.4743041992188, "status": "ok"}
{"N": 1048576, "K": 200000, "D": 128, "B": 1, "dtype": "fp16", "BLOCK_N": 64, "BLOCK_K": 64, "num_warps": 8, "num_stages": 4, "time_ms": 568.9241333007812, "status": "ok"}
{"N": 1048576, "K": 200000, "D": 128, "B": 1, "dtype": "fp16", "BLOCK_N": 64, "BLOCK_K": 128, "num_warps": 4, "num_stages": 1, "time_ms": 479.8453674316406, "status": "ok"}
{"N": 1048576, "K": 200000, "D": 128, "B": 1, "dtype": "fp16", "BLOCK_N": 64, "BLOCK_K": 128, "num_warps": 4, "num_stages": 2, "time_ms": 409.5395812988281, "status": "ok"}
{"N": 1048576, "K": 200000, "D": 128, "B": 1, "dtype": "fp16", "BLOCK_N": 64, "BLOCK_K": 128, "num_warps": 4, "num_stages": 4, "time_ms": 688.5682983398438, "status": "ok"}
{"N": 1048576, "K": 200000, "D": 128, "B": 1, "dtype": "fp16", "BLOCK_N": 64, "BLOCK_K": 128, "num_warps": 8, "num_stages": 1, "time_ms": 511.5361328125, "status": "ok"}
{"N": 1048576, "K": 200000, "D": 128, "B": 1, "dtype": "fp16", "BLOCK_N": 64, "BLOCK_K": 128, "num_warps": 8, "num_stages": 2, "time_ms": 454.66522216796875, "status": "ok"}
{"N": 1048576, "K": 200000, "D": 128, "B": 1, "dtype": "fp16", "BLOCK_N": 64, "BLOCK_K": 128, "num_warps": 8, "num_stages": 4, "time_ms": 539.4053344726562, "status": "ok"}
{"N": 1048576, "K": 200000, "D": 128, "B": 1, "dtype": "fp16", "BLOCK_N": 128, "BLOCK_K": 32, "num_warps": 4, "num_stages": 1, "time_ms": 377.1279296875, "status": "ok"}
{"N": 1048576, "K": 200000, "D": 128, "B": 1, "dtype": "fp16", "BLOCK_N": 128, "BLOCK_K": 32, "num_warps": 4, "num_stages": 2, "time_ms": 333.84857177734375, "status": "ok"}
{"N": 1048576, "K": 200000, "D": 128, "B": 1, "dtype": "fp16", "BLOCK_N": 128, "BLOCK_K": 32, "num_warps": 4, "num_stages": 4, "time_ms": 393.8846740722656, "status": "ok"}
{"N": 1048576, "K": 200000, "D": 128, "B": 1, "dtype": "fp16", "BLOCK_N": 128, "BLOCK_K": 32, "num_warps": 8, "num_stages": 1, "time_ms": 545.1970825195312, "status": "ok"}
{"N": 1048576, "K": 200000, "D": 128, "B": 1, "dtype": "fp16", "BLOCK_N": 128, "BLOCK_K": 32, "num_warps": 8, "num_stages": 2, "time_ms": 517.1046142578125, "status": "ok"}
{"N": 1048576, "K": 200000, "D": 128, "B": 1, "dtype": "fp16", "BLOCK_N": 128, "BLOCK_K": 32, "num_warps": 8, "num_stages": 4, "time_ms": 540.3525390625, "status": "ok"}
{"N": 1048576, "K": 200000, "D": 128, "B": 1, "dtype": "fp16", "BLOCK_N": 128, "BLOCK_K": 64, "num_warps": 4, "num_stages": 1, "time_ms": 432.1873779296875, "status": "ok"}
{"N": 1048576, "K": 200000, "D": 128, "B": 1, "dtype": "fp16", "BLOCK_N": 128, "BLOCK_K": 64, "num_warps": 4, "num_stages": 2, "time_ms": 358.6744384765625, "status": "ok"}
{"N": 1048576, "K": 200000, "D": 128, "B": 1, "dtype": "fp16", "BLOCK_N": 128, "BLOCK_K": 64, "num_warps": 4, "num_stages": 4, "time_ms": 520.3394775390625, "status": "ok"}
{"N": 1048576, "K": 200000, "D": 128, "B": 1, "dtype": "fp16", "BLOCK_N": 128, "BLOCK_K": 64, "num_warps": 8, "num_stages": 1, "time_ms": 448.6860656738281, "status": "ok"}
{"N": 1048576, "K": 200000, "D": 128, "B": 1, "dtype": "fp16", "BLOCK_N": 128, "BLOCK_K": 64, "num_warps": 8, "num_stages": 2, "time_ms": 428.5665283203125, "status": "ok"}
{"N": 1048576, "K": 200000, "D": 128, "B": 1, "dtype": "fp16", "BLOCK_N": 128, "BLOCK_K": 64, "num_warps": 8, "num_stages": 4, "time_ms": 481.0588073730469, "status": "ok"}
{"N": 1048576, "K": 200000, "D": 128, "B": 1, "dtype": "fp16", "BLOCK_N": 128, "BLOCK_K": 128, "num_warps": 4, "num_stages": 1, "time_ms": 490.8820495605469, "status": "ok"}
{"N": 1048576, "K": 200000, "D": 128, "B": 1, "dtype": "fp16", "BLOCK_N": 128, "BLOCK_K": 128, "num_warps": 4, "num_stages": 2, "time_ms": 364.6750793457031, "status": "ok"}
{"N": 1048576, "K": 200000, "D": 128, "B": 1, "dtype": "fp16", "BLOCK_N": 128, "BLOCK_K": 128, "num_warps": 4, "num_stages": 4, "time_ms": 517.5132446289062, "status": "ok"}
{"N": 1048576, "K": 200000, "D": 128, "B": 1, "dtype": "fp16", "BLOCK_N": 128, "BLOCK_K": 128, "num_warps": 8, "num_stages": 1, "time_ms": 594.050048828125, "status": "ok"}
{"N": 1048576, "K": 200000, "D": 128, "B": 1, "dtype": "fp16", "BLOCK_N": 128, "BLOCK_K": 128, "num_warps": 8, "num_stages": 2, "time_ms": 528.2396240234375, "status": "ok"}
{"N": 1048576, "K": 200000, "D": 128, "B": 1, "dtype": "fp16", "BLOCK_N": 128, "BLOCK_K": 128, "num_warps": 8, "num_stages": 4, "time_ms": 466.2231140136719, "status": "ok"}
{"summary": true, "N": 1048576, "K": 200000, "D": 128, "B": 1, "dtype": "fp16", "best": {"N": 1048576, "K": 200000, "D": 128, "B": 1, "dtype": "fp16", "BLOCK_N": 128, "BLOCK_K": 32, "num_warps": 4, "num_stages": 2, "time_ms": 333.84857177734375, "status": "ok"}, "best_time_ms": 333.84857177734375, "tuning_seconds": 277.4179530143738, "skipped": 0}
