grid_results_a100/N1048576_K65536_D128_B1_fp16.jsonl
{"N": 1048576, "K": 65536, "D": 128, "B": 1, "dtype": "fp16", "BLOCK_N": 32, "BLOCK_K": 32, "num_warps": 4, "num_stages": 1, "time_ms": 261.3381042480469, "status": "ok"}
{"N": 1048576, "K": 65536, "D": 128, "B": 1, "dtype": "fp16", "BLOCK_N": 32, "BLOCK_K": 32, "num_warps": 4, "num_stages": 2, "time_ms": 215.7496337890625, "status": "ok"}
{"N": 1048576, "K": 65536, "D": 128, "B": 1, "dtype": "fp16", "BLOCK_N": 32, "BLOCK_K": 32, "num_warps": 4, "num_stages": 4, "time_ms": 224.76083374023438, "status": "ok"}
{"N": 1048576, "K": 65536, "D": 128, "B": 1, "dtype": "fp16", "BLOCK_N": 32, "BLOCK_K": 32, "num_warps": 8, "num_stages": 1, "time_ms": 385.1284484863281, "status": "ok"}
{"N": 1048576, "K": 65536, "D": 128, "B": 1, "dtype": "fp16", "BLOCK_N": 32, "BLOCK_K": 32, "num_warps": 8, "num_stages": 2, "time_ms": 351.7020263671875, "status": "ok"}
{"N": 1048576, "K": 65536, "D": 128, "B": 1, "dtype": "fp16", "BLOCK_N": 32, "BLOCK_K": 32, "num_warps": 8, "num_stages": 4, "time_ms": 349.4143981933594, "status": "ok"}
{"N": 1048576, "K": 65536, "D": 128, "B": 1, "dtype": "fp16", "BLOCK_N": 32, "BLOCK_K": 64, "num_warps": 4, "num_stages": 1, "time_ms": 229.45484924316406, "status": "ok"}
{"N": 1048576, "K": 65536, "D": 128, "B": 1, "dtype": "fp16", "BLOCK_N": 32, "BLOCK_K": 64, "num_warps": 4, "num_stages": 2, "time_ms": 179.6116485595703, "status": "ok"}
{"N": 1048576, "K": 65536, "D": 128, "B": 1, "dtype": "fp16", "BLOCK_N": 32, "BLOCK_K": 64, "num_warps": 4, "num_stages": 4, "time_ms": 210.18418884277344, "status": "ok"}
{"N": 1048576, "K": 65536, "D": 128, "B": 1, "dtype": "fp16", "BLOCK_N": 32, "BLOCK_K": 64, "num_warps": 8, "num_stages": 1, "time_ms": 276.0888366699219, "status": "ok"}
{"N": 1048576, "K": 65536, "D": 128, "B": 1, "dtype": "fp16", "BLOCK_N": 32, "BLOCK_K": 64, "num_warps": 8, "num_stages": 2, "time_ms": 229.66680908203125, "status": "ok"}
{"N": 1048576, "K": 65536, "D": 128, "B": 1, "dtype": "fp16", "BLOCK_N": 32, "BLOCK_K": 64, "num_warps": 8, "num_stages": 4, "time_ms": 245.9535369873047, "status": "ok"}
{"N": 1048576, "K": 65536, "D": 128, "B": 1, "dtype": "fp16", "BLOCK_N": 32, "BLOCK_K": 128, "num_warps": 4, "num_stages": 1, "time_ms": 197.04115295410156, "status": "ok"}
{"N": 1048576, "K": 65536, "D": 128, "B": 1, "dtype": "fp16", "BLOCK_N": 32, "BLOCK_K": 128, "num_warps": 4, "num_stages": 2, "time_ms": 166.82701110839844, "status": "ok"}
{"N": 1048576, "K": 65536, "D": 128, "B": 1, "dtype": "fp16", "BLOCK_N": 32, "BLOCK_K": 128, "num_warps": 4, "num_stages": 4, "time_ms": 252.76824951171875, "status": "ok"}
{"N": 1048576, "K": 65536, "D": 128, "B": 1, "dtype": "fp16", "BLOCK_N": 32, "BLOCK_K": 128, "num_warps": 8, "num_stages": 1, "time_ms": 251.83743286132812, "status": "ok"}
{"N": 1048576, "K": 65536, "D": 128, "B": 1, "dtype": "fp16", "BLOCK_N": 32, "BLOCK_K": 128, "num_warps": 8, "num_stages": 2, "time_ms": 211.2593994140625, "status": "ok"}
{"N": 1048576, "K": 65536, "D": 128, "B": 1, "dtype": "fp16", "BLOCK_N": 32, "BLOCK_K": 128, "num_warps": 8, "num_stages": 4, "time_ms": 276.5199279785156, "status": "ok"}
{"N": 1048576, "K": 65536, "D": 128, "B": 1, "dtype": "fp16", "BLOCK_N": 64, "BLOCK_K": 32, "num_warps": 4, "num_stages": 1, "time_ms": 189.7154541015625, "status": "ok"}
{"N": 1048576, "K": 65536, "D": 128, "B": 1, "dtype": "fp16", "BLOCK_N": 64, "BLOCK_K": 32, "num_warps": 4, "num_stages": 2, "time_ms": 165.6135711669922, "status": "ok"}
{"N": 1048576, "K": 65536, "D": 128, "B": 1, "dtype": "fp16", "BLOCK_N": 64, "BLOCK_K": 32, "num_warps": 4, "num_stages": 4, "time_ms": 178.1063690185547, "status": "ok"}
{"N": 1048576, "K": 65536, "D": 128, "B": 1, "dtype": "fp16", "BLOCK_N": 64, "BLOCK_K": 32, "num_warps": 8, "num_stages": 1, "time_ms": 233.2815399169922, "status": "ok"}
{"N": 1048576, "K": 65536, "D": 128, "B": 1, "dtype": "fp16", "BLOCK_N": 64, "BLOCK_K": 32, "num_warps": 8, "num_stages": 2, "time_ms": 209.98348999023438, "status": "ok"}
{"N": 1048576, "K": 65536, "D": 128, "B": 1, "dtype": "fp16", "BLOCK_N": 64, "BLOCK_K": 32, "num_warps": 8, "num_stages": 4, "time_ms": 215.7301788330078, "status": "ok"}
{"N": 1048576, "K": 65536, "D": 128, "B": 1, "dtype": "fp16", "BLOCK_N": 64, "BLOCK_K": 64, "num_warps": 4, "num_stages": 1, "time_ms": 146.67674255371094, "status": "ok"}
{"N": 1048576, "K": 65536, "D": 128, "B": 1, "dtype": "fp16", "BLOCK_N": 64, "BLOCK_K": 64, "num_warps": 4, "num_stages": 2, "time_ms": 133.02476501464844, "status": "ok"}
{"N": 1048576, "K": 65536, "D": 128, "B": 1, "dtype": "fp16", "BLOCK_N": 64, "BLOCK_K": 64, "num_warps": 4, "num_stages": 4, "time_ms": 143.57913208007812, "status": "ok"}
{"N": 1048576, "K": 65536, "D": 128, "B": 1, "dtype": "fp16", "BLOCK_N": 64, "BLOCK_K": 64, "num_warps": 8, "num_stages": 1, "time_ms": 194.8282928466797, "status": "ok"}
{"N": 1048576, "K": 65536, "D": 128, "B": 1, "dtype": "fp16", "BLOCK_N": 64, "BLOCK_K": 64, "num_warps": 8, "num_stages": 2, "time_ms": 176.8151092529297, "status": "ok"}
{"N": 1048576, "K": 65536, "D": 128, "B": 1, "dtype": "fp16", "BLOCK_N": 64, "BLOCK_K": 64, "num_warps": 8, "num_stages": 4, "time_ms": 184.92416381835938, "status": "ok"}
{"N": 1048576, "K": 65536, "D": 128, "B": 1, "dtype": "fp16", "BLOCK_N": 64, "BLOCK_K": 128, "num_warps": 4, "num_stages": 1, "time_ms": 151.15980529785156, "status": "ok"}
{"N": 1048576, "K": 65536, "D": 128, "B": 1, "dtype": "fp16", "BLOCK_N": 64, "BLOCK_K": 128, "num_warps": 4, "num_stages": 2, "time_ms": 134.73178100585938, "status": "ok"}
{"N": 1048576, "K": 65536, "D": 128, "B": 1, "dtype": "fp16", "BLOCK_N": 64, "BLOCK_K": 128, "num_warps": 4, "num_stages": 4, "time_ms": 208.9707489013672, "status": "ok"}
{"N": 1048576, "K": 65536, "D": 128, "B": 1, "dtype": "fp16", "BLOCK_N": 64, "BLOCK_K": 128, "num_warps": 8, "num_stages": 1, "time_ms": 161.34042358398438, "status": "ok"}
{"N": 1048576, "K": 65536, "D": 128, "B": 1, "dtype": "fp16", "BLOCK_N": 64, "BLOCK_K": 128, "num_warps": 8, "num_stages": 2, "time_ms": 145.18988037109375, "status": "ok"}
{"N": 1048576, "K": 65536, "D": 128, "B": 1, "dtype": "fp16", "BLOCK_N": 64, "BLOCK_K": 128, "num_warps": 8, "num_stages": 4, "time_ms": 165.8408966064453, "status": "ok"}
{"N": 1048576, "K": 65536, "D": 128, "B": 1, "dtype": "fp16", "BLOCK_N": 128, "BLOCK_K": 32, "num_warps": 4, "num_stages": 1, "time_ms": 121.09619140625, "status": "ok"}
{"N": 1048576, "K": 65536, "D": 128, "B": 1, "dtype": "fp16", "BLOCK_N": 128, "BLOCK_K": 32, "num_warps": 4, "num_stages": 2, "time_ms": 106.429443359375, "status": "ok"}
{"N": 1048576, "K": 65536, "D": 128, "B": 1, "dtype": "fp16", "BLOCK_N": 128, "BLOCK_K": 32, "num_warps": 4, "num_stages": 4, "time_ms": 127.5146255493164, "status": "ok"}
{"N": 1048576, "K": 65536, "D": 128, "B": 1, "dtype": "fp16", "BLOCK_N": 128, "BLOCK_K": 32, "num_warps": 8, "num_stages": 1, "time_ms": 177.08749389648438, "status": "ok"}
{"N": 1048576, "K": 65536, "D": 128, "B": 1, "dtype": "fp16", "BLOCK_N": 128, "BLOCK_K": 32, "num_warps": 8, "num_stages": 2, "time_ms": 166.2801971435547, "status": "ok"}
{"N": 1048576, "K": 65536, "D": 128, "B": 1, "dtype": "fp16", "BLOCK_N": 128, "BLOCK_K": 32, "num_warps": 8, "num_stages": 4, "time_ms": 176.53146362304688, "status": "ok"}
{"N": 1048576, "K": 65536, "D": 128, "B": 1, "dtype": "fp16", "BLOCK_N": 128, "BLOCK_K": 64, "num_warps": 4, "num_stages": 1, "time_ms": 141.23622131347656, "status": "ok"}
{"N": 1048576, "K": 65536, "D": 128, "B": 1, "dtype": "fp16", "BLOCK_N": 128, "BLOCK_K": 64, "num_warps": 4, "num_stages": 2, "time_ms": 117.77740478515625, "status": "ok"}
{"N": 1048576, "K": 65536, "D": 128, "B": 1, "dtype": "fp16", "BLOCK_N": 128, "BLOCK_K": 64, "num_warps": 4, "num_stages": 4, "time_ms": 159.05690002441406, "status": "ok"}
{"N": 1048576, "K": 65536, "D": 128, "B": 1, "dtype": "fp16", "BLOCK_N": 128, "BLOCK_K": 64, "num_warps": 8, "num_stages": 1, "time_ms": 145.42437744140625, "status": "ok"}
{"N": 1048576, "K": 65536, "D": 128, "B": 1, "dtype": "fp16", "BLOCK_N": 128, "BLOCK_K": 64, "num_warps": 8, "num_stages": 2, "time_ms": 139.42784118652344, "status": "ok"}
{"N": 1048576, "K": 65536, "D": 128, "B": 1, "dtype": "fp16", "BLOCK_N": 128, "BLOCK_K": 64, "num_warps": 8, "num_stages": 4, "time_ms": 157.02732849121094, "status": "ok"}
{"N": 1048576, "K": 65536, "D": 128, "B": 1, "dtype": "fp16", "BLOCK_N": 128, "BLOCK_K": 128, "num_warps": 4, "num_stages": 1, "time_ms": 156.55218505859375, "status": "ok"}
{"N": 1048576, "K": 65536, "D": 128, "B": 1, "dtype": "fp16", "BLOCK_N": 128, "BLOCK_K": 128, "num_warps": 4, "num_stages": 2, "time_ms": 124.3873291015625, "status": "ok"}
{"N": 1048576, "K": 65536, "D": 128, "B": 1, "dtype": "fp16", "BLOCK_N": 128, "BLOCK_K": 128, "num_warps": 4, "num_stages": 4, "time_ms": 163.84512329101562, "status": "ok"}
{"N": 1048576, "K": 65536, "D": 128, "B": 1, "dtype": "fp16", "BLOCK_N": 128, "BLOCK_K": 128, "num_warps": 8, "num_stages": 1, "time_ms": 174.84288024902344, "status": "ok"}
{"N": 1048576, "K": 65536, "D": 128, "B": 1, "dtype": "fp16", "BLOCK_N": 128, "BLOCK_K": 128, "num_warps": 8, "num_stages": 2, "time_ms": 163.36282348632812, "status": "ok"}
{"N": 1048576, "K": 65536, "D": 128, "B": 1, "dtype": "fp16", "BLOCK_N": 128, "BLOCK_K": 128, "num_warps": 8, "num_stages": 4, "time_ms": 143.52896118164062, "status": "ok"}
{"summary": true, "N": 1048576, "K": 65536, "D": 128, "B": 1, "dtype": "fp16", "best": {"N": 1048576, "K": 65536, "D": 128, "B": 1, "dtype": "fp16", "BLOCK_N": 128, "BLOCK_K": 32, "num_warps": 4, "num_stages": 2, "time_ms": 106.429443359375, "status": "ok"}, "best_time_ms": 106.429443359375, "tuning_seconds": 100.38479399681091, "skipped": 0}
