grid_results_a100/N1048576_K1024_D64_B1_fp16.jsonl
{"N": 1048576, "K": 1024, "D": 64, "B": 1, "dtype": "fp16", "BLOCK_N": 32, "BLOCK_K": 32, "num_warps": 4, "num_stages": 1, "time_ms": 3.437567949295044, "status": "ok"}
{"N": 1048576, "K": 1024, "D": 64, "B": 1, "dtype": "fp16", "BLOCK_N": 32, "BLOCK_K": 32, "num_warps": 4, "num_stages": 2, "time_ms": 3.0597119331359863, "status": "ok"}
{"N": 1048576, "K": 1024, "D": 64, "B": 1, "dtype": "fp16", "BLOCK_N": 32, "BLOCK_K": 32, "num_warps": 4, "num_stages": 4, "time_ms": 3.058687925338745, "status": "ok"}
{"N": 1048576, "K": 1024, "D": 64, "B": 1, "dtype": "fp16", "BLOCK_N": 32, "BLOCK_K": 32, "num_warps": 8, "num_stages": 1, "time_ms": 5.543935775756836, "status": "ok"}
{"N": 1048576, "K": 1024, "D": 64, "B": 1, "dtype": "fp16", "BLOCK_N": 32, "BLOCK_K": 32, "num_warps": 8, "num_stages": 2, "time_ms": 5.242879867553711, "status": "ok"}
{"N": 1048576, "K": 1024, "D": 64, "B": 1, "dtype": "fp16", "BLOCK_N": 32, "BLOCK_K": 32, "num_warps": 8, "num_stages": 4, "time_ms": 5.184512138366699, "status": "ok"}
{"N": 1048576, "K": 1024, "D": 64, "B": 1, "dtype": "fp16", "BLOCK_N": 32, "BLOCK_K": 64, "num_warps": 4, "num_stages": 1, "time_ms": 2.935807943344116, "status": "ok"}
{"N": 1048576, "K": 1024, "D": 64, "B": 1, "dtype": "fp16", "BLOCK_N": 32, "BLOCK_K": 64, "num_warps": 4, "num_stages": 2, "time_ms": 2.544640064239502, "status": "ok"}
{"N": 1048576, "K": 1024, "D": 64, "B": 1, "dtype": "fp16", "BLOCK_N": 32, "BLOCK_K": 64, "num_warps": 4, "num_stages": 4, "time_ms": 2.6316800117492676, "status": "ok"}
{"N": 1048576, "K": 1024, "D": 64, "B": 1, "dtype": "fp16", "BLOCK_N": 32, "BLOCK_K": 64, "num_warps": 8, "num_stages": 1, "time_ms": 3.7795839309692383, "status": "ok"}
{"N": 1048576, "K": 1024, "D": 64, "B": 1, "dtype": "fp16", "BLOCK_N": 32, "BLOCK_K": 64, "num_warps": 8, "num_stages": 2, "time_ms": 3.3894400596618652, "status": "ok"}
{"N": 1048576, "K": 1024, "D": 64, "B": 1, "dtype": "fp16", "BLOCK_N": 32, "BLOCK_K": 64, "num_warps": 8, "num_stages": 4, "time_ms": 3.3310720920562744, "status": "ok"}
{"N": 1048576, "K": 1024, "D": 64, "B": 1, "dtype": "fp16", "BLOCK_N": 32, "BLOCK_K": 128, "num_warps": 4, "num_stages": 1, "time_ms": 2.442239999771118, "status": "ok"}
{"N": 1048576, "K": 1024, "D": 64, "B": 1, "dtype": "fp16", "BLOCK_N": 32, "BLOCK_K": 128, "num_warps": 4, "num_stages": 2, "time_ms": 2.2041600942611694, "status": "ok"}
{"N": 1048576, "K": 1024, "D": 64, "B": 1, "dtype": "fp16", "BLOCK_N": 32, "BLOCK_K": 128, "num_warps": 4, "num_stages": 4, "time_ms": 2.3695359230041504, "status": "ok"}
{"N": 1048576, "K": 1024, "D": 64, "B": 1, "dtype": "fp16", "BLOCK_N": 32, "BLOCK_K": 128, "num_warps": 8, "num_stages": 1, "time_ms": 3.4887681007385254, "status": "ok"}
{"N": 1048576, "K": 1024, "D": 64, "B": 1, "dtype": "fp16", "BLOCK_N": 32, "BLOCK_K": 128, "num_warps": 8, "num_stages": 2, "time_ms": 3.251199960708618, "status": "ok"}
{"N": 1048576, "K": 1024, "D": 64, "B": 1, "dtype": "fp16", "BLOCK_N": 32, "BLOCK_K": 128, "num_warps": 8, "num_stages": 4, "time_ms": 3.457024097442627, "status": "ok"}
{"N": 1048576, "K": 1024, "D": 64, "B": 1, "dtype": "fp16", "BLOCK_N": 64, "BLOCK_K": 32, "num_warps": 4, "num_stages": 1, "time_ms": 2.549760103225708, "status": "ok"}
{"N": 1048576, "K": 1024, "D": 64, "B": 1, "dtype": "fp16", "BLOCK_N": 64, "BLOCK_K": 32, "num_warps": 4, "num_stages": 2, "time_ms": 2.3552000522613525, "status": "ok"}
{"N": 1048576, "K": 1024, "D": 64, "B": 1, "dtype": "fp16", "BLOCK_N": 64, "BLOCK_K": 32, "num_warps": 4, "num_stages": 4, "time_ms": 2.3961598873138428, "status": "ok"}
{"N": 1048576, "K": 1024, "D": 64, "B": 1, "dtype": "fp16", "BLOCK_N": 64, "BLOCK_K": 32, "num_warps": 8, "num_stages": 1, "time_ms": 3.13753604888916, "status": "ok"}
{"N": 1048576, "K": 1024, "D": 64, "B": 1, "dtype": "fp16", "BLOCK_N": 64, "BLOCK_K": 32, "num_warps": 8, "num_stages": 2, "time_ms": 3.039232015609741, "status": "ok"}
{"N": 1048576, "K": 1024, "D": 64, "B": 1, "dtype": "fp16", "BLOCK_N": 64, "BLOCK_K": 32, "num_warps": 8, "num_stages": 4, "time_ms": 3.06278395652771, "status": "ok"}
{"N": 1048576, "K": 1024, "D": 64, "B": 1, "dtype": "fp16", "BLOCK_N": 64, "BLOCK_K": 64, "num_warps": 4, "num_stages": 1, "time_ms": 2.009600043296814, "status": "ok"}
{"N": 1048576, "K": 1024, "D": 64, "B": 1, "dtype": "fp16", "BLOCK_N": 64, "BLOCK_K": 64, "num_warps": 4, "num_stages": 2, "time_ms": 1.8595839738845825, "status": "ok"}
{"N": 1048576, "K": 1024, "D": 64, "B": 1, "dtype": "fp16", "BLOCK_N": 64, "BLOCK_K": 64, "num_warps": 4, "num_stages": 4, "time_ms": 1.8391040563583374, "status": "ok"}
{"N": 1048576, "K": 1024, "D": 64, "B": 1, "dtype": "fp16", "BLOCK_N": 64, "BLOCK_K": 64, "num_warps": 8, "num_stages": 1, "time_ms": 2.7740159034729004, "status": "ok"}
{"N": 1048576, "K": 1024, "D": 64, "B": 1, "dtype": "fp16", "BLOCK_N": 64, "BLOCK_K": 64, "num_warps": 8, "num_stages": 2, "time_ms": 2.677759885787964, "status": "ok"}
{"N": 1048576, "K": 1024, "D": 64, "B": 1, "dtype": "fp16", "BLOCK_N": 64, "BLOCK_K": 64, "num_warps": 8, "num_stages": 4, "time_ms": 2.683903932571411, "status": "ok"}
{"N": 1048576, "K": 1024, "D": 64, "B": 1, "dtype": "fp16", "BLOCK_N": 64, "BLOCK_K": 128, "num_warps": 4, "num_stages": 1, "time_ms": 2.148863911628723, "status": "ok"}
{"N": 1048576, "K": 1024, "D": 64, "B": 1, "dtype": "fp16", "BLOCK_N": 64, "BLOCK_K": 128, "num_warps": 4, "num_stages": 2, "time_ms": 2.041856050491333, "status": "ok"}
{"N": 1048576, "K": 1024, "D": 64, "B": 1, "dtype": "fp16", "BLOCK_N": 64, "BLOCK_K": 128, "num_warps": 4, "num_stages": 4, "time_ms": 2.343935966491699, "status": "ok"}
{"N": 1048576, "K": 1024, "D": 64, "B": 1, "dtype": "fp16", "BLOCK_N": 64, "BLOCK_K": 128, "num_warps": 8, "num_stages": 1, "time_ms": 2.4043519496917725, "status": "ok"}
{"N": 1048576, "K": 1024, "D": 64, "B": 1, "dtype": "fp16", "BLOCK_N": 64, "BLOCK_K": 128, "num_warps": 8, "num_stages": 2, "time_ms": 2.257920026779175, "status": "ok"}
{"N": 1048576, "K": 1024, "D": 64, "B": 1, "dtype": "fp16", "BLOCK_N": 64, "BLOCK_K": 128, "num_warps": 8, "num_stages": 4, "time_ms": 2.1882879734039307, "status": "ok"}
{"N": 1048576, "K": 1024, "D": 64, "B": 1, "dtype": "fp16", "BLOCK_N": 128, "BLOCK_K": 32, "num_warps": 4, "num_stages": 1, "time_ms": 1.5651839971542358, "status": "ok"}
{"N": 1048576, "K": 1024, "D": 64, "B": 1, "dtype": "fp16", "BLOCK_N": 128, "BLOCK_K": 32, "num_warps": 4, "num_stages": 2, "time_ms": 1.468074639638265, "status": "ok"}
{"N": 1048576, "K": 1024, "D": 64, "B": 1, "dtype": "fp16", "BLOCK_N": 128, "BLOCK_K": 32, "num_warps": 4, "num_stages": 4, "time_ms": 1.4935040473937988, "status": "ok"}
{"N": 1048576, "K": 1024, "D": 64, "B": 1, "dtype": "fp16", "BLOCK_N": 128, "BLOCK_K": 32, "num_warps": 8, "num_stages": 1, "time_ms": 2.535423994064331, "status": "ok"}
{"N": 1048576, "K": 1024, "D": 64, "B": 1, "dtype": "fp16", "BLOCK_N": 128, "BLOCK_K": 32, "num_warps": 8, "num_stages": 2, "time_ms": 2.5036799907684326, "status": "ok"}
{"N": 1048576, "K": 1024, "D": 64, "B": 1, "dtype": "fp16", "BLOCK_N": 128, "BLOCK_K": 32, "num_warps": 8, "num_stages": 4, "time_ms": 2.5272319316864014, "status": "ok"}
{"N": 1048576, "K": 1024, "D": 64, "B": 1, "dtype": "fp16", "BLOCK_N": 128, "BLOCK_K": 64, "num_warps": 4, "num_stages": 1, "time_ms": 2.0526078939437866, "status": "ok"}
{"N": 1048576, "K": 1024, "D": 64, "B": 1, "dtype": "fp16", "BLOCK_N": 128, "BLOCK_K": 64, "num_warps": 4, "num_stages": 2, "time_ms": 1.75872004032135, "status": "ok"}
{"N": 1048576, "K": 1024, "D": 64, "B": 1, "dtype": "fp16", "BLOCK_N": 128, "BLOCK_K": 64, "num_warps": 4, "num_stages": 4, "time_ms": 1.716223955154419, "status": "ok"}
{"N": 1048576, "K": 1024, "D": 64, "B": 1, "dtype": "fp16", "BLOCK_N": 128, "BLOCK_K": 64, "num_warps": 8, "num_stages": 1, "time_ms": 2.1212159395217896, "status": "ok"}
{"N": 1048576, "K": 1024, "D": 64, "B": 1, "dtype": "fp16", "BLOCK_N": 128, "BLOCK_K": 64, "num_warps": 8, "num_stages": 2, "time_ms": 2.075648069381714, "status": "ok"}
{"N": 1048576, "K": 1024, "D": 64, "B": 1, "dtype": "fp16", "BLOCK_N": 128, "BLOCK_K": 64, "num_warps": 8, "num_stages": 4, "time_ms": 2.067456007003784, "status": "ok"}
{"N": 1048576, "K": 1024, "D": 64, "B": 1, "dtype": "fp16", "BLOCK_N": 128, "BLOCK_K": 128, "num_warps": 4, "num_stages": 1, "time_ms": 1.795583963394165, "status": "ok"}
{"N": 1048576, "K": 1024, "D": 64, "B": 1, "dtype": "fp16", "BLOCK_N": 128, "BLOCK_K": 128, "num_warps": 4, "num_stages": 2, "time_ms": 1.7576960325241089, "status": "ok"}
{"N": 1048576, "K": 1024, "D": 64, "B": 1, "dtype": "fp16", "BLOCK_N": 128, "BLOCK_K": 128, "num_warps": 4, "num_stages": 4, "time_ms": 1.7791999578475952, "status": "ok"}
{"N": 1048576, "K": 1024, "D": 64, "B": 1, "dtype": "fp16", "BLOCK_N": 128, "BLOCK_K": 128, "num_warps": 8, "num_stages": 1, "time_ms": 2.637824058532715, "status": "ok"}
{"N": 1048576, "K": 1024, "D": 64, "B": 1, "dtype": "fp16", "BLOCK_N": 128, "BLOCK_K": 128, "num_warps": 8, "num_stages": 2, "time_ms": 2.5968639850616455, "status": "ok"}
{"N": 1048576, "K": 1024, "D": 64, "B": 1, "dtype": "fp16", "BLOCK_N": 128, "BLOCK_K": 128, "num_warps": 8, "num_stages": 4, "time_ms": 2.392064094543457, "status": "ok"}
{"summary": true, "N": 1048576, "K": 1024, "D": 64, "B": 1, "dtype": "fp16", "best": {"N": 1048576, "K": 1024, "D": 64, "B": 1, "dtype": "fp16", "BLOCK_N": 128, "BLOCK_K": 32, "num_warps": 4, "num_stages": 2, "time_ms": 1.468074639638265, "status": "ok"}, "best_time_ms": 1.468074639638265, "tuning_seconds": 16.27007246017456, "skipped": 0}
