grid_results_a100/N1048576_K16384_D128_B1_fp16.jsonl
{"N": 1048576, "K": 16384, "D": 128, "B": 1, "dtype": "fp16", "BLOCK_N": 32, "BLOCK_K": 32, "num_warps": 4, "num_stages": 1, "time_ms": 65.48582458496094, "status": "ok"}
{"N": 1048576, "K": 16384, "D": 128, "B": 1, "dtype": "fp16", "BLOCK_N": 32, "BLOCK_K": 32, "num_warps": 4, "num_stages": 2, "time_ms": 52.81177520751953, "status": "ok"}
{"N": 1048576, "K": 16384, "D": 128, "B": 1, "dtype": "fp16", "BLOCK_N": 32, "BLOCK_K": 32, "num_warps": 4, "num_stages": 4, "time_ms": 55.058433532714844, "status": "ok"}
{"N": 1048576, "K": 16384, "D": 128, "B": 1, "dtype": "fp16", "BLOCK_N": 32, "BLOCK_K": 32, "num_warps": 8, "num_stages": 1, "time_ms": 96.46080017089844, "status": "ok"}
{"N": 1048576, "K": 16384, "D": 128, "B": 1, "dtype": "fp16", "BLOCK_N": 32, "BLOCK_K": 32, "num_warps": 8, "num_stages": 2, "time_ms": 88.00665283203125, "status": "ok"}
{"N": 1048576, "K": 16384, "D": 128, "B": 1, "dtype": "fp16", "BLOCK_N": 32, "BLOCK_K": 32, "num_warps": 8, "num_stages": 4, "time_ms": 87.52025604248047, "status": "ok"}
{"N": 1048576, "K": 16384, "D": 128, "B": 1, "dtype": "fp16", "BLOCK_N": 32, "BLOCK_K": 64, "num_warps": 4, "num_stages": 1, "time_ms": 56.31692886352539, "status": "ok"}
{"N": 1048576, "K": 16384, "D": 128, "B": 1, "dtype": "fp16", "BLOCK_N": 32, "BLOCK_K": 64, "num_warps": 4, "num_stages": 2, "time_ms": 44.09651184082031, "status": "ok"}
{"N": 1048576, "K": 16384, "D": 128, "B": 1, "dtype": "fp16", "BLOCK_N": 32, "BLOCK_K": 64, "num_warps": 4, "num_stages": 4, "time_ms": 51.697662353515625, "status": "ok"}
{"N": 1048576, "K": 16384, "D": 128, "B": 1, "dtype": "fp16", "BLOCK_N": 32, "BLOCK_K": 64, "num_warps": 8, "num_stages": 1, "time_ms": 68.6346206665039, "status": "ok"}
{"N": 1048576, "K": 16384, "D": 128, "B": 1, "dtype": "fp16", "BLOCK_N": 32, "BLOCK_K": 64, "num_warps": 8, "num_stages": 2, "time_ms": 56.55961608886719, "status": "ok"}
{"N": 1048576, "K": 16384, "D": 128, "B": 1, "dtype": "fp16", "BLOCK_N": 32, "BLOCK_K": 64, "num_warps": 8, "num_stages": 4, "time_ms": 61.081600189208984, "status": "ok"}
{"N": 1048576, "K": 16384, "D": 128, "B": 1, "dtype": "fp16", "BLOCK_N": 32, "BLOCK_K": 128, "num_warps": 4, "num_stages": 1, "time_ms": 48.44134521484375, "status": "ok"}
{"N": 1048576, "K": 16384, "D": 128, "B": 1, "dtype": "fp16", "BLOCK_N": 32, "BLOCK_K": 128, "num_warps": 4, "num_stages": 2, "time_ms": 41.14329528808594, "status": "ok"}
{"N": 1048576, "K": 16384, "D": 128, "B": 1, "dtype": "fp16", "BLOCK_N": 32, "BLOCK_K": 128, "num_warps": 4, "num_stages": 4, "time_ms": 62.75993728637695, "status": "ok"}
{"N": 1048576, "K": 16384, "D": 128, "B": 1, "dtype": "fp16", "BLOCK_N": 32, "BLOCK_K": 128, "num_warps": 8, "num_stages": 1, "time_ms": 62.18649673461914, "status": "ok"}
{"N": 1048576, "K": 16384, "D": 128, "B": 1, "dtype": "fp16", "BLOCK_N": 32, "BLOCK_K": 128, "num_warps": 8, "num_stages": 2, "time_ms": 51.57273483276367, "status": "ok"}
{"N": 1048576, "K": 16384, "D": 128, "B": 1, "dtype": "fp16", "BLOCK_N": 32, "BLOCK_K": 128, "num_warps": 8, "num_stages": 4, "time_ms": 69.50707244873047, "status": "ok"}
{"N": 1048576, "K": 16384, "D": 128, "B": 1, "dtype": "fp16", "BLOCK_N": 64, "BLOCK_K": 32, "num_warps": 4, "num_stages": 1, "time_ms": 46.37388610839844, "status": "ok"}
{"N": 1048576, "K": 16384, "D": 128, "B": 1, "dtype": "fp16", "BLOCK_N": 64, "BLOCK_K": 32, "num_warps": 4, "num_stages": 2, "time_ms": 40.53504180908203, "status": "ok"}
{"N": 1048576, "K": 16384, "D": 128, "B": 1, "dtype": "fp16", "BLOCK_N": 64, "BLOCK_K": 32, "num_warps": 4, "num_stages": 4, "time_ms": 43.575294494628906, "status": "ok"}
{"N": 1048576, "K": 16384, "D": 128, "B": 1, "dtype": "fp16", "BLOCK_N": 64, "BLOCK_K": 32, "num_warps": 8, "num_stages": 1, "time_ms": 58.2737922668457, "status": "ok"}
{"N": 1048576, "K": 16384, "D": 128, "B": 1, "dtype": "fp16", "BLOCK_N": 64, "BLOCK_K": 32, "num_warps": 8, "num_stages": 2, "time_ms": 51.4334716796875, "status": "ok"}
{"N": 1048576, "K": 16384, "D": 128, "B": 1, "dtype": "fp16", "BLOCK_N": 64, "BLOCK_K": 32, "num_warps": 8, "num_stages": 4, "time_ms": 53.26540756225586, "status": "ok"}
{"N": 1048576, "K": 16384, "D": 128, "B": 1, "dtype": "fp16", "BLOCK_N": 64, "BLOCK_K": 64, "num_warps": 4, "num_stages": 1, "time_ms": 35.95673751831055, "status": "ok"}
{"N": 1048576, "K": 16384, "D": 128, "B": 1, "dtype": "fp16", "BLOCK_N": 64, "BLOCK_K": 64, "num_warps": 4, "num_stages": 2, "time_ms": 31.029247283935547, "status": "ok"}
{"N": 1048576, "K": 16384, "D": 128, "B": 1, "dtype": "fp16", "BLOCK_N": 64, "BLOCK_K": 64, "num_warps": 4, "num_stages": 4, "time_ms": 35.418113708496094, "status": "ok"}
{"N": 1048576, "K": 16384, "D": 128, "B": 1, "dtype": "fp16", "BLOCK_N": 64, "BLOCK_K": 64, "num_warps": 8, "num_stages": 1, "time_ms": 47.83513641357422, "status": "ok"}
{"N": 1048576, "K": 16384, "D": 128, "B": 1, "dtype": "fp16", "BLOCK_N": 64, "BLOCK_K": 64, "num_warps": 8, "num_stages": 2, "time_ms": 43.36947250366211, "status": "ok"}
{"N": 1048576, "K": 16384, "D": 128, "B": 1, "dtype": "fp16", "BLOCK_N": 64, "BLOCK_K": 64, "num_warps": 8, "num_stages": 4, "time_ms": 45.272064208984375, "status": "ok"}
{"N": 1048576, "K": 16384, "D": 128, "B": 1, "dtype": "fp16", "BLOCK_N": 64, "BLOCK_K": 128, "num_warps": 4, "num_stages": 1, "time_ms": 36.8803825378418, "status": "ok"}
{"N": 1048576, "K": 16384, "D": 128, "B": 1, "dtype": "fp16", "BLOCK_N": 64, "BLOCK_K": 128, "num_warps": 4, "num_stages": 2, "time_ms": 32.3502082824707, "status": "ok"}
{"N": 1048576, "K": 16384, "D": 128, "B": 1, "dtype": "fp16", "BLOCK_N": 64, "BLOCK_K": 128, "num_warps": 4, "num_stages": 4, "time_ms": 52.50048065185547, "status": "ok"}
{"N": 1048576, "K": 16384, "D": 128, "B": 1, "dtype": "fp16", "BLOCK_N": 64, "BLOCK_K": 128, "num_warps": 8, "num_stages": 1, "time_ms": 39.3994255065918, "status": "ok"}
{"N": 1048576, "K": 16384, "D": 128, "B": 1, "dtype": "fp16", "BLOCK_N": 64, "BLOCK_K": 128, "num_warps": 8, "num_stages": 2, "time_ms": 35.782657623291016, "status": "ok"}
{"N": 1048576, "K": 16384, "D": 128, "B": 1, "dtype": "fp16", "BLOCK_N": 64, "BLOCK_K": 128, "num_warps": 8, "num_stages": 4, "time_ms": 41.016319274902344, "status": "ok"}
{"N": 1048576, "K": 16384, "D": 128, "B": 1, "dtype": "fp16", "BLOCK_N": 128, "BLOCK_K": 32, "num_warps": 4, "num_stages": 1, "time_ms": 29.067264556884766, "status": "ok"}
{"N": 1048576, "K": 16384, "D": 128, "B": 1, "dtype": "fp16", "BLOCK_N": 128, "BLOCK_K": 32, "num_warps": 4, "num_stages": 2, "time_ms": 25.93075180053711, "status": "ok"}
{"N": 1048576, "K": 16384, "D": 128, "B": 1, "dtype": "fp16", "BLOCK_N": 128, "BLOCK_K": 32, "num_warps": 4, "num_stages": 4, "time_ms": 26.92198371887207, "status": "ok"}
{"N": 1048576, "K": 16384, "D": 128, "B": 1, "dtype": "fp16", "BLOCK_N": 128, "BLOCK_K": 32, "num_warps": 8, "num_stages": 1, "time_ms": 43.065345764160156, "status": "ok"}
{"N": 1048576, "K": 16384, "D": 128, "B": 1, "dtype": "fp16", "BLOCK_N": 128, "BLOCK_K": 32, "num_warps": 8, "num_stages": 2, "time_ms": 40.606719970703125, "status": "ok"}
{"N": 1048576, "K": 16384, "D": 128, "B": 1, "dtype": "fp16", "BLOCK_N": 128, "BLOCK_K": 32, "num_warps": 8, "num_stages": 4, "time_ms": 43.231231689453125, "status": "ok"}
{"N": 1048576, "K": 16384, "D": 128, "B": 1, "dtype": "fp16", "BLOCK_N": 128, "BLOCK_K": 64, "num_warps": 4, "num_stages": 1, "time_ms": 33.075199127197266, "status": "ok"}
{"N": 1048576, "K": 16384, "D": 128, "B": 1, "dtype": "fp16", "BLOCK_N": 128, "BLOCK_K": 64, "num_warps": 4, "num_stages": 2, "time_ms": 28.052480697631836, "status": "ok"}
{"N": 1048576, "K": 16384, "D": 128, "B": 1, "dtype": "fp16", "BLOCK_N": 128, "BLOCK_K": 64, "num_warps": 4, "num_stages": 4, "time_ms": 39.01747131347656, "status": "ok"}
{"N": 1048576, "K": 16384, "D": 128, "B": 1, "dtype": "fp16", "BLOCK_N": 128, "BLOCK_K": 64, "num_warps": 8, "num_stages": 1, "time_ms": 35.54304122924805, "status": "ok"}
{"N": 1048576, "K": 16384, "D": 128, "B": 1, "dtype": "fp16", "BLOCK_N": 128, "BLOCK_K": 64, "num_warps": 8, "num_stages": 2, "time_ms": 33.921024322509766, "status": "ok"}
{"N": 1048576, "K": 16384, "D": 128, "B": 1, "dtype": "fp16", "BLOCK_N": 128, "BLOCK_K": 64, "num_warps": 8, "num_stages": 4, "time_ms": 39.0830078125, "status": "ok"}
{"N": 1048576, "K": 16384, "D": 128, "B": 1, "dtype": "fp16", "BLOCK_N": 128, "BLOCK_K": 128, "num_warps": 4, "num_stages": 1, "time_ms": 38.45119857788086, "status": "ok"}
{"N": 1048576, "K": 16384, "D": 128, "B": 1, "dtype": "fp16", "BLOCK_N": 128, "BLOCK_K": 128, "num_warps": 4, "num_stages": 2, "time_ms": 29.827072143554688, "status": "ok"}
{"N": 1048576, "K": 16384, "D": 128, "B": 1, "dtype": "fp16", "BLOCK_N": 128, "BLOCK_K": 128, "num_warps": 4, "num_stages": 4, "time_ms": 41.278465270996094, "status": "ok"}
{"N": 1048576, "K": 16384, "D": 128, "B": 1, "dtype": "fp16", "BLOCK_N": 128, "BLOCK_K": 128, "num_warps": 8, "num_stages": 1, "time_ms": 43.683841705322266, "status": "ok"}
{"N": 1048576, "K": 16384, "D": 128, "B": 1, "dtype": "fp16", "BLOCK_N": 128, "BLOCK_K": 128, "num_warps": 8, "num_stages": 2, "time_ms": 40.50022506713867, "status": "ok"}
{"N": 1048576, "K": 16384, "D": 128, "B": 1, "dtype": "fp16", "BLOCK_N": 128, "BLOCK_K": 128, "num_warps": 8, "num_stages": 4, "time_ms": 35.61062240600586, "status": "ok"}
{"summary": true, "N": 1048576, "K": 16384, "D": 128, "B": 1, "dtype": "fp16", "best": {"N": 1048576, "K": 16384, "D": 128, "B": 1, "dtype": "fp16", "BLOCK_N": 128, "BLOCK_K": 32, "num_warps": 4, "num_stages": 2, "time_ms": 25.93075180053711, "status": "ok"}, "best_time_ms": 25.93075180053711, "tuning_seconds": 38.40514087677002, "skipped": 0}
