grid_results_a100/N1048576_K4096_D64_B32_fp16.jsonl
{"N": 1048576, "K": 4096, "D": 64, "B": 32, "dtype": "fp16", "BLOCK_N": 32, "BLOCK_K": 32, "num_warps": 4, "num_stages": 1, "time_ms": 338.651123046875, "status": "ok"}
{"N": 1048576, "K": 4096, "D": 64, "B": 32, "dtype": "fp16", "BLOCK_N": 32, "BLOCK_K": 32, "num_warps": 4, "num_stages": 2, "time_ms": 303.2647705078125, "status": "ok"}
{"N": 1048576, "K": 4096, "D": 64, "B": 32, "dtype": "fp16", "BLOCK_N": 32, "BLOCK_K": 32, "num_warps": 4, "num_stages": 4, "time_ms": 302.1189270019531, "status": "ok"}
{"N": 1048576, "K": 4096, "D": 64, "B": 32, "dtype": "fp16", "BLOCK_N": 32, "BLOCK_K": 32, "num_warps": 8, "num_stages": 1, "time_ms": 543.6528930664062, "status": "ok"}
{"N": 1048576, "K": 4096, "D": 64, "B": 32, "dtype": "fp16", "BLOCK_N": 32, "BLOCK_K": 32, "num_warps": 8, "num_stages": 2, "time_ms": 513.1038818359375, "status": "ok"}
{"N": 1048576, "K": 4096, "D": 64, "B": 32, "dtype": "fp16", "BLOCK_N": 32, "BLOCK_K": 32, "num_warps": 8, "num_stages": 4, "time_ms": 505.5539245605469, "status": "ok"}
{"N": 1048576, "K": 4096, "D": 64, "B": 32, "dtype": "fp16", "BLOCK_N": 32, "BLOCK_K": 64, "num_warps": 4, "num_stages": 1, "time_ms": 291.63519287109375, "status": "ok"}
{"N": 1048576, "K": 4096, "D": 64, "B": 32, "dtype": "fp16", "BLOCK_N": 32, "BLOCK_K": 64, "num_warps": 4, "num_stages": 2, "time_ms": 256.28570556640625, "status": "ok"}
{"N": 1048576, "K": 4096, "D": 64, "B": 32, "dtype": "fp16", "BLOCK_N": 32, "BLOCK_K": 64, "num_warps": 4, "num_stages": 4, "time_ms": 262.7911682128906, "status": "ok"}
{"N": 1048576, "K": 4096, "D": 64, "B": 32, "dtype": "fp16", "BLOCK_N": 32, "BLOCK_K": 64, "num_warps": 8, "num_stages": 1, "time_ms": 366.53363037109375, "status": "ok"}
{"N": 1048576, "K": 4096, "D": 64, "B": 32, "dtype": "fp16", "BLOCK_N": 32, "BLOCK_K": 64, "num_warps": 8, "num_stages": 2, "time_ms": 330.7304992675781, "status": "ok"}
{"N": 1048576, "K": 4096, "D": 64, "B": 32, "dtype": "fp16", "BLOCK_N": 32, "BLOCK_K": 64, "num_warps": 8, "num_stages": 4, "time_ms": 323.4631652832031, "status": "ok"}
{"N": 1048576, "K": 4096, "D": 64, "B": 32, "dtype": "fp16", "BLOCK_N": 32, "BLOCK_K": 128, "num_warps": 4, "num_stages": 1, "time_ms": 247.01747131347656, "status": "ok"}
{"N": 1048576, "K": 4096, "D": 64, "B": 32, "dtype": "fp16", "BLOCK_N": 32, "BLOCK_K": 128, "num_warps": 4, "num_stages": 2, "time_ms": 215.5888671875, "status": "ok"}
{"N": 1048576, "K": 4096, "D": 64, "B": 32, "dtype": "fp16", "BLOCK_N": 32, "BLOCK_K": 128, "num_warps": 4, "num_stages": 4, "time_ms": 223.8638153076172, "status": "ok"}
{"N": 1048576, "K": 4096, "D": 64, "B": 32, "dtype": "fp16", "BLOCK_N": 32, "BLOCK_K": 128, "num_warps": 8, "num_stages": 1, "time_ms": 339.41400146484375, "status": "ok"}
{"N": 1048576, "K": 4096, "D": 64, "B": 32, "dtype": "fp16", "BLOCK_N": 32, "BLOCK_K": 128, "num_warps": 8, "num_stages": 2, "time_ms": 311.2878112792969, "status": "ok"}
{"N": 1048576, "K": 4096, "D": 64, "B": 32, "dtype": "fp16", "BLOCK_N": 32, "BLOCK_K": 128, "num_warps": 8, "num_stages": 4, "time_ms": 321.7766418457031, "status": "ok"}
{"N": 1048576, "K": 4096, "D": 64, "B": 32, "dtype": "fp16", "BLOCK_N": 64, "BLOCK_K": 32, "num_warps": 4, "num_stages": 1, "time_ms": 259.3525695800781, "status": "ok"}
{"N": 1048576, "K": 4096, "D": 64, "B": 32, "dtype": "fp16", "BLOCK_N": 64, "BLOCK_K": 32, "num_warps": 4, "num_stages": 2, "time_ms": 236.34226989746094, "status": "ok"}
{"N": 1048576, "K": 4096, "D": 64, "B": 32, "dtype": "fp16", "BLOCK_N": 64, "BLOCK_K": 32, "num_warps": 4, "num_stages": 4, "time_ms": 239.1367645263672, "status": "ok"}
{"N": 1048576, "K": 4096, "D": 64, "B": 32, "dtype": "fp16", "BLOCK_N": 64, "BLOCK_K": 32, "num_warps": 8, "num_stages": 1, "time_ms": 309.5674743652344, "status": "ok"}
{"N": 1048576, "K": 4096, "D": 64, "B": 32, "dtype": "fp16", "BLOCK_N": 64, "BLOCK_K": 32, "num_warps": 8, "num_stages": 2, "time_ms": 298.1703796386719, "status": "ok"}
{"N": 1048576, "K": 4096, "D": 64, "B": 32, "dtype": "fp16", "BLOCK_N": 64, "BLOCK_K": 32, "num_warps": 8, "num_stages": 4, "time_ms": 300.2429504394531, "status": "ok"}
{"N": 1048576, "K": 4096, "D": 64, "B": 32, "dtype": "fp16", "BLOCK_N": 64, "BLOCK_K": 64, "num_warps": 4, "num_stages": 1, "time_ms": 199.72402954101562, "status": "ok"}
{"N": 1048576, "K": 4096, "D": 64, "B": 32, "dtype": "fp16", "BLOCK_N": 64, "BLOCK_K": 64, "num_warps": 4, "num_stages": 2, "time_ms": 185.491455078125, "status": "ok"}
{"N": 1048576, "K": 4096, "D": 64, "B": 32, "dtype": "fp16", "BLOCK_N": 64, "BLOCK_K": 64, "num_warps": 4, "num_stages": 4, "time_ms": 184.29440307617188, "status": "ok"}
{"N": 1048576, "K": 4096, "D": 64, "B": 32, "dtype": "fp16", "BLOCK_N": 64, "BLOCK_K": 64, "num_warps": 8, "num_stages": 1, "time_ms": 275.1805419921875, "status": "ok"}
{"N": 1048576, "K": 4096, "D": 64, "B": 32, "dtype": "fp16", "BLOCK_N": 64, "BLOCK_K": 64, "num_warps": 8, "num_stages": 2, "time_ms": 263.2908935546875, "status": "ok"}
{"N": 1048576, "K": 4096, "D": 64, "B": 32, "dtype": "fp16", "BLOCK_N": 64, "BLOCK_K": 64, "num_warps": 8, "num_stages": 4, "time_ms": 265.9215393066406, "status": "ok"}
{"N": 1048576, "K": 4096, "D": 64, "B": 32, "dtype": "fp16", "BLOCK_N": 64, "BLOCK_K": 128, "num_warps": 4, "num_stages": 1, "time_ms": 212.3857879638672, "status": "ok"}
{"N": 1048576, "K": 4096, "D": 64, "B": 32, "dtype": "fp16", "BLOCK_N": 64, "BLOCK_K": 128, "num_warps": 4, "num_stages": 2, "time_ms": 198.98060607910156, "status": "ok"}
{"N": 1048576, "K": 4096, "D": 64, "B": 32, "dtype": "fp16", "BLOCK_N": 64, "BLOCK_K": 128, "num_warps": 4, "num_stages": 4, "time_ms": 220.67507934570312, "status": "ok"}
{"N": 1048576, "K": 4096, "D": 64, "B": 32, "dtype": "fp16", "BLOCK_N": 64, "BLOCK_K": 128, "num_warps": 8, "num_stages": 1, "time_ms": 233.3317108154297, "status": "ok"}
{"N": 1048576, "K": 4096, "D": 64, "B": 32, "dtype": "fp16", "BLOCK_N": 64, "BLOCK_K": 128, "num_warps": 8, "num_stages": 2, "time_ms": 217.64813232421875, "status": "ok"}
{"N": 1048576, "K": 4096, "D": 64, "B": 32, "dtype": "fp16", "BLOCK_N": 64, "BLOCK_K": 128, "num_warps": 8, "num_stages": 4, "time_ms": 207.9815673828125, "status": "ok"}
{"N": 1048576, "K": 4096, "D": 64, "B": 32, "dtype": "fp16", "BLOCK_N": 128, "BLOCK_K": 32, "num_warps": 4, "num_stages": 1, "time_ms": 157.51475524902344, "status": "ok"}
{"N": 1048576, "K": 4096, "D": 64, "B": 32, "dtype": "fp16", "BLOCK_N": 128, "BLOCK_K": 32, "num_warps": 4, "num_stages": 2, "time_ms": 150.1808624267578, "status": "ok"}
{"N": 1048576, "K": 4096, "D": 64, "B": 32, "dtype": "fp16", "BLOCK_N": 128, "BLOCK_K": 32, "num_warps": 4, "num_stages": 4, "time_ms": 153.20883178710938, "status": "ok"}
{"N": 1048576, "K": 4096, "D": 64, "B": 32, "dtype": "fp16", "BLOCK_N": 128, "BLOCK_K": 32, "num_warps": 8, "num_stages": 1, "time_ms": 251.0182342529297, "status": "ok"}
{"N": 1048576, "K": 4096, "D": 64, "B": 32, "dtype": "fp16", "BLOCK_N": 128, "BLOCK_K": 32, "num_warps": 8, "num_stages": 2, "time_ms": 245.61766052246094, "status": "ok"}
{"N": 1048576, "K": 4096, "D": 64, "B": 32, "dtype": "fp16", "BLOCK_N": 128, "BLOCK_K": 32, "num_warps": 8, "num_stages": 4, "time_ms": 247.4598388671875, "status": "ok"}
{"N": 1048576, "K": 4096, "D": 64, "B": 32, "dtype": "fp16", "BLOCK_N": 128, "BLOCK_K": 64, "num_warps": 4, "num_stages": 1, "time_ms": 201.10438537597656, "status": "ok"}
{"N": 1048576, "K": 4096, "D": 64, "B": 32, "dtype": "fp16", "BLOCK_N": 128, "BLOCK_K": 64, "num_warps": 4, "num_stages": 2, "time_ms": 175.26988220214844, "status": "ok"}
{"N": 1048576, "K": 4096, "D": 64, "B": 32, "dtype": "fp16", "BLOCK_N": 128, "BLOCK_K": 64, "num_warps": 4, "num_stages": 4, "time_ms": 173.2341766357422, "status": "ok"}
{"N": 1048576, "K": 4096, "D": 64, "B": 32, "dtype": "fp16", "BLOCK_N": 128, "BLOCK_K": 64, "num_warps": 8, "num_stages": 1, "time_ms": 205.306884765625, "status": "ok"}
{"N": 1048576, "K": 4096, "D": 64, "B": 32, "dtype": "fp16", "BLOCK_N": 128, "BLOCK_K": 64, "num_warps": 8, "num_stages": 2, "time_ms": 200.26470947265625, "status": "ok"}
{"N": 1048576, "K": 4096, "D": 64, "B": 32, "dtype": "fp16", "BLOCK_N": 128, "BLOCK_K": 64, "num_warps": 8, "num_stages": 4, "time_ms": 200.7500762939453, "status": "ok"}
{"N": 1048576, "K": 4096, "D": 64, "B": 32, "dtype": "fp16", "BLOCK_N": 128, "BLOCK_K": 128, "num_warps": 4, "num_stages": 1, "time_ms": 172.3934783935547, "status": "ok"}
{"N": 1048576, "K": 4096, "D": 64, "B": 32, "dtype": "fp16", "BLOCK_N": 128, "BLOCK_K": 128, "num_warps": 4, "num_stages": 2, "time_ms": 169.3737030029297, "status": "ok"}
{"N": 1048576, "K": 4096, "D": 64, "B": 32, "dtype": "fp16", "BLOCK_N": 128, "BLOCK_K": 128, "num_warps": 4, "num_stages": 4, "time_ms": 169.7310791015625, "status": "ok"}
{"N": 1048576, "K": 4096, "D": 64, "B": 32, "dtype": "fp16", "BLOCK_N": 128, "BLOCK_K": 128, "num_warps": 8, "num_stages": 1, "time_ms": 256.932861328125, "status": "ok"}
{"N": 1048576, "K": 4096, "D": 64, "B": 32, "dtype": "fp16", "BLOCK_N": 128, "BLOCK_K": 128, "num_warps": 8, "num_stages": 2, "time_ms": 244.63973999023438, "status": "ok"}
{"N": 1048576, "K": 4096, "D": 64, "B": 32, "dtype": "fp16", "BLOCK_N": 128, "BLOCK_K": 128, "num_warps": 8, "num_stages": 4, "time_ms": 224.3041229248047, "status": "ok"}
{"summary": true, "N": 1048576, "K": 4096, "D": 64, "B": 32, "dtype": "fp16", "best": {"N": 1048576, "K": 4096, "D": 64, "B": 32, "dtype": "fp16", "BLOCK_N": 128, "BLOCK_K": 32, "num_warps": 4, "num_stages": 2, "time_ms": 150.1808624267578, "status": "ok"}, "best_time_ms": 150.1808624267578, "tuning_seconds": 126.21314835548401, "skipped": 0}
