grid_results_a100/N262144_K4096_D64_B1_fp16.jsonl
{"N": 262144, "K": 4096, "D": 64, "B": 1, "dtype": "fp16", "BLOCK_N": 32, "BLOCK_K": 32, "num_warps": 4, "num_stages": 1, "time_ms": 3.427328109741211, "status": "ok"}
{"N": 262144, "K": 4096, "D": 64, "B": 1, "dtype": "fp16", "BLOCK_N": 32, "BLOCK_K": 32, "num_warps": 4, "num_stages": 2, "time_ms": 3.052544116973877, "status": "ok"}
{"N": 262144, "K": 4096, "D": 64, "B": 1, "dtype": "fp16", "BLOCK_N": 32, "BLOCK_K": 32, "num_warps": 4, "num_stages": 4, "time_ms": 3.0218238830566406, "status": "ok"}
{"N": 262144, "K": 4096, "D": 64, "B": 1, "dtype": "fp16", "BLOCK_N": 32, "BLOCK_K": 32, "num_warps": 8, "num_stages": 1, "time_ms": 5.528575897216797, "status": "ok"}
{"N": 262144, "K": 4096, "D": 64, "B": 1, "dtype": "fp16", "BLOCK_N": 32, "BLOCK_K": 32, "num_warps": 8, "num_stages": 2, "time_ms": 5.219327926635742, "status": "ok"}
{"N": 262144, "K": 4096, "D": 64, "B": 1, "dtype": "fp16", "BLOCK_N": 32, "BLOCK_K": 32, "num_warps": 8, "num_stages": 4, "time_ms": 5.129216194152832, "status": "ok"}
{"N": 262144, "K": 4096, "D": 64, "B": 1, "dtype": "fp16", "BLOCK_N": 32, "BLOCK_K": 64, "num_warps": 4, "num_stages": 1, "time_ms": 2.9132800102233887, "status": "ok"}
{"N": 262144, "K": 4096, "D": 64, "B": 1, "dtype": "fp16", "BLOCK_N": 32, "BLOCK_K": 64, "num_warps": 4, "num_stages": 2, "time_ms": 2.520064115524292, "status": "ok"}
{"N": 262144, "K": 4096, "D": 64, "B": 1, "dtype": "fp16", "BLOCK_N": 32, "BLOCK_K": 64, "num_warps": 4, "num_stages": 4, "time_ms": 2.5630719661712646, "status": "ok"}
{"N": 262144, "K": 4096, "D": 64, "B": 1, "dtype": "fp16", "BLOCK_N": 32, "BLOCK_K": 64, "num_warps": 8, "num_stages": 1, "time_ms": 3.724287986755371, "status": "ok"}
{"N": 262144, "K": 4096, "D": 64, "B": 1, "dtype": "fp16", "BLOCK_N": 32, "BLOCK_K": 64, "num_warps": 8, "num_stages": 2, "time_ms": 3.333120107650757, "status": "ok"}
{"N": 262144, "K": 4096, "D": 64, "B": 1, "dtype": "fp16", "BLOCK_N": 32, "BLOCK_K": 64, "num_warps": 8, "num_stages": 4, "time_ms": 3.2389121055603027, "status": "ok"}
{"N": 262144, "K": 4096, "D": 64, "B": 1, "dtype": "fp16", "BLOCK_N": 32, "BLOCK_K": 128, "num_warps": 4, "num_stages": 1, "time_ms": 2.4227840900421143, "status": "ok"}
{"N": 262144, "K": 4096, "D": 64, "B": 1, "dtype": "fp16", "BLOCK_N": 32, "BLOCK_K": 128, "num_warps": 4, "num_stages": 2, "time_ms": 2.1196799278259277, "status": "ok"}
{"N": 262144, "K": 4096, "D": 64, "B": 1, "dtype": "fp16", "BLOCK_N": 32, "BLOCK_K": 128, "num_warps": 4, "num_stages": 4, "time_ms": 2.213887929916382, "status": "ok"}
{"N": 262144, "K": 4096, "D": 64, "B": 1, "dtype": "fp16", "BLOCK_N": 32, "BLOCK_K": 128, "num_warps": 8, "num_stages": 1, "time_ms": 3.4303998947143555, "status": "ok"}
{"N": 262144, "K": 4096, "D": 64, "B": 1, "dtype": "fp16", "BLOCK_N": 32, "BLOCK_K": 128, "num_warps": 8, "num_stages": 2, "time_ms": 3.1334400177001953, "status": "ok"}
{"N": 262144, "K": 4096, "D": 64, "B": 1, "dtype": "fp16", "BLOCK_N": 32, "BLOCK_K": 128, "num_warps": 8, "num_stages": 4, "time_ms": 3.2583680152893066, "status": "ok"}
{"N": 262144, "K": 4096, "D": 64, "B": 1, "dtype": "fp16", "BLOCK_N": 64, "BLOCK_K": 32, "num_warps": 4, "num_stages": 1, "time_ms": 2.5538558959960938, "status": "ok"}
{"N": 262144, "K": 4096, "D": 64, "B": 1, "dtype": "fp16", "BLOCK_N": 64, "BLOCK_K": 32, "num_warps": 4, "num_stages": 2, "time_ms": 2.3592960834503174, "status": "ok"}
{"N": 262144, "K": 4096, "D": 64, "B": 1, "dtype": "fp16", "BLOCK_N": 64, "BLOCK_K": 32, "num_warps": 4, "num_stages": 4, "time_ms": 2.3859200477600098, "status": "ok"}
{"N": 262144, "K": 4096, "D": 64, "B": 1, "dtype": "fp16", "BLOCK_N": 64, "BLOCK_K": 32, "num_warps": 8, "num_stages": 1, "time_ms": 3.142656087875366, "status": "ok"}
{"N": 262144, "K": 4096, "D": 64, "B": 1, "dtype": "fp16", "BLOCK_N": 64, "BLOCK_K": 32, "num_warps": 8, "num_stages": 2, "time_ms": 3.034111976623535, "status": "ok"}
{"N": 262144, "K": 4096, "D": 64, "B": 1, "dtype": "fp16", "BLOCK_N": 64, "BLOCK_K": 32, "num_warps": 8, "num_stages": 4, "time_ms": 3.034111976623535, "status": "ok"}
{"N": 262144, "K": 4096, "D": 64, "B": 1, "dtype": "fp16", "BLOCK_N": 64, "BLOCK_K": 64, "num_warps": 4, "num_stages": 1, "time_ms": 2.0014079809188843, "status": "ok"}
{"N": 262144, "K": 4096, "D": 64, "B": 1, "dtype": "fp16", "BLOCK_N": 64, "BLOCK_K": 64, "num_warps": 4, "num_stages": 2, "time_ms": 1.842687964439392, "status": "ok"}
{"N": 262144, "K": 4096, "D": 64, "B": 1, "dtype": "fp16", "BLOCK_N": 64, "BLOCK_K": 64, "num_warps": 4, "num_stages": 4, "time_ms": 1.800704002380371, "status": "ok"}
{"N": 262144, "K": 4096, "D": 64, "B": 1, "dtype": "fp16", "BLOCK_N": 64, "BLOCK_K": 64, "num_warps": 8, "num_stages": 1, "time_ms": 2.752511978149414, "status": "ok"}
{"N": 262144, "K": 4096, "D": 64, "B": 1, "dtype": "fp16", "BLOCK_N": 64, "BLOCK_K": 64, "num_warps": 8, "num_stages": 2, "time_ms": 2.6460158824920654, "status": "ok"}
{"N": 262144, "K": 4096, "D": 64, "B": 1, "dtype": "fp16", "BLOCK_N": 64, "BLOCK_K": 64, "num_warps": 8, "num_stages": 4, "time_ms": 2.6306560039520264, "status": "ok"}
{"N": 262144, "K": 4096, "D": 64, "B": 1, "dtype": "fp16", "BLOCK_N": 64, "BLOCK_K": 128, "num_warps": 4, "num_stages": 1, "time_ms": 2.12992000579834, "status": "ok"}
{"N": 262144, "K": 4096, "D": 64, "B": 1, "dtype": "fp16", "BLOCK_N": 64, "BLOCK_K": 128, "num_warps": 4, "num_stages": 2, "time_ms": 1.9942400455474854, "status": "ok"}
{"N": 262144, "K": 4096, "D": 64, "B": 1, "dtype": "fp16", "BLOCK_N": 64, "BLOCK_K": 128, "num_warps": 4, "num_stages": 4, "time_ms": 2.231808066368103, "status": "ok"}
{"N": 262144, "K": 4096, "D": 64, "B": 1, "dtype": "fp16", "BLOCK_N": 64, "BLOCK_K": 128, "num_warps": 8, "num_stages": 1, "time_ms": 2.35315203666687, "status": "ok"}
{"N": 262144, "K": 4096, "D": 64, "B": 1, "dtype": "fp16", "BLOCK_N": 64, "BLOCK_K": 128, "num_warps": 8, "num_stages": 2, "time_ms": 2.199552059173584, "status": "ok"}
{"N": 262144, "K": 4096, "D": 64, "B": 1, "dtype": "fp16", "BLOCK_N": 64, "BLOCK_K": 128, "num_warps": 8, "num_stages": 4, "time_ms": 2.076672077178955, "status": "ok"}
{"N": 262144, "K": 4096, "D": 64, "B": 1, "dtype": "fp16", "BLOCK_N": 128, "BLOCK_K": 32, "num_warps": 4, "num_stages": 1, "time_ms": 1.5605759620666504, "status": "ok"}
{"N": 262144, "K": 4096, "D": 64, "B": 1, "dtype": "fp16", "BLOCK_N": 128, "BLOCK_K": 32, "num_warps": 4, "num_stages": 2, "time_ms": 1.4827519655227661, "status": "ok"}
{"N": 262144, "K": 4096, "D": 64, "B": 1, "dtype": "fp16", "BLOCK_N": 128, "BLOCK_K": 32, "num_warps": 4, "num_stages": 4, "time_ms": 1.4955520033836365, "status": "ok"}
{"N": 262144, "K": 4096, "D": 64, "B": 1, "dtype": "fp16", "BLOCK_N": 128, "BLOCK_K": 32, "num_warps": 8, "num_stages": 1, "time_ms": 2.5425920486450195, "status": "ok"}
{"N": 262144, "K": 4096, "D": 64, "B": 1, "dtype": "fp16", "BLOCK_N": 128, "BLOCK_K": 32, "num_warps": 8, "num_stages": 2, "time_ms": 2.504703998565674, "status": "ok"}
{"N": 262144, "K": 4096, "D": 64, "B": 1, "dtype": "fp16", "BLOCK_N": 128, "BLOCK_K": 32, "num_warps": 8, "num_stages": 4, "time_ms": 2.519040107727051, "status": "ok"}
{"N": 262144, "K": 4096, "D": 64, "B": 1, "dtype": "fp16", "BLOCK_N": 128, "BLOCK_K": 64, "num_warps": 4, "num_stages": 1, "time_ms": 2.0382720232009888, "status": "ok"}
{"N": 262144, "K": 4096, "D": 64, "B": 1, "dtype": "fp16", "BLOCK_N": 128, "BLOCK_K": 64, "num_warps": 4, "num_stages": 2, "time_ms": 1.7576960325241089, "status": "ok"}
{"N": 262144, "K": 4096, "D": 64, "B": 1, "dtype": "fp16", "BLOCK_N": 128, "BLOCK_K": 64, "num_warps": 4, "num_stages": 4, "time_ms": 1.711616039276123, "status": "ok"}
{"N": 262144, "K": 4096, "D": 64, "B": 1, "dtype": "fp16", "BLOCK_N": 128, "BLOCK_K": 64, "num_warps": 8, "num_stages": 1, "time_ms": 2.0899839401245117, "status": "ok"}
{"N": 262144, "K": 4096, "D": 64, "B": 1, "dtype": "fp16", "BLOCK_N": 128, "BLOCK_K": 64, "num_warps": 8, "num_stages": 2, "time_ms": 2.046976089477539, "status": "ok"}
{"N": 262144, "K": 4096, "D": 64, "B": 1, "dtype": "fp16", "BLOCK_N": 128, "BLOCK_K": 64, "num_warps": 8, "num_stages": 4, "time_ms": 2.0357120037078857, "status": "ok"}
{"N": 262144, "K": 4096, "D": 64, "B": 1, "dtype": "fp16", "BLOCK_N": 128, "BLOCK_K": 128, "num_warps": 4, "num_stages": 1, "time_ms": 1.8042880296707153, "status": "ok"}
{"N": 262144, "K": 4096, "D": 64, "B": 1, "dtype": "fp16", "BLOCK_N": 128, "BLOCK_K": 128, "num_warps": 4, "num_stages": 2, "time_ms": 1.7285120487213135, "status": "ok"}
{"N": 262144, "K": 4096, "D": 64, "B": 1, "dtype": "fp16", "BLOCK_N": 128, "BLOCK_K": 128, "num_warps": 4, "num_stages": 4, "time_ms": 1.723904013633728, "status": "ok"}
{"N": 262144, "K": 4096, "D": 64, "B": 1, "dtype": "fp16", "BLOCK_N": 128, "BLOCK_K": 128, "num_warps": 8, "num_stages": 1, "time_ms": 2.624511957168579, "status": "ok"}
{"N": 262144, "K": 4096, "D": 64, "B": 1, "dtype": "fp16", "BLOCK_N": 128, "BLOCK_K": 128, "num_warps": 8, "num_stages": 2, "time_ms": 2.4985599517822266, "status": "ok"}
{"N": 262144, "K": 4096, "D": 64, "B": 1, "dtype": "fp16", "BLOCK_N": 128, "BLOCK_K": 128, "num_warps": 8, "num_stages": 4, "time_ms": 2.2830079793930054, "status": "ok"}
{"summary": true, "N": 262144, "K": 4096, "D": 64, "B": 1, "dtype": "fp16", "best": {"N": 262144, "K": 4096, "D": 64, "B": 1, "dtype": "fp16", "BLOCK_N": 128, "BLOCK_K": 32, "num_warps": 4, "num_stages": 2, "time_ms": 1.4827519655227661, "status": "ok"}, "best_time_ms": 1.4827519655227661, "tuning_seconds": 16.162734508514404, "skipped": 0}
