grid_results_a100/N262144_K200000_D64_B1_fp16.jsonl
{"N": 262144, "K": 200000, "D": 64, "B": 1, "dtype": "fp16", "BLOCK_N": 32, "BLOCK_K": 32, "num_warps": 4, "num_stages": 1, "time_ms": 131.2348175048828, "status": "ok"}
{"N": 262144, "K": 200000, "D": 64, "B": 1, "dtype": "fp16", "BLOCK_N": 32, "BLOCK_K": 32, "num_warps": 4, "num_stages": 2, "time_ms": 118.21670532226562, "status": "ok"}
{"N": 262144, "K": 200000, "D": 64, "B": 1, "dtype": "fp16", "BLOCK_N": 32, "BLOCK_K": 32, "num_warps": 4, "num_stages": 4, "time_ms": 115.3628158569336, "status": "ok"}
{"N": 262144, "K": 200000, "D": 64, "B": 1, "dtype": "fp16", "BLOCK_N": 32, "BLOCK_K": 32, "num_warps": 8, "num_stages": 1, "time_ms": 215.60525512695312, "status": "ok"}
{"N": 262144, "K": 200000, "D": 64, "B": 1, "dtype": "fp16", "BLOCK_N": 32, "BLOCK_K": 32, "num_warps": 8, "num_stages": 2, "time_ms": 200.22886657714844, "status": "ok"}
{"N": 262144, "K": 200000, "D": 64, "B": 1, "dtype": "fp16", "BLOCK_N": 32, "BLOCK_K": 32, "num_warps": 8, "num_stages": 4, "time_ms": 193.95481872558594, "status": "ok"}
{"N": 262144, "K": 200000, "D": 64, "B": 1, "dtype": "fp16", "BLOCK_N": 32, "BLOCK_K": 64, "num_warps": 4, "num_stages": 1, "time_ms": 111.92524719238281, "status": "ok"}
{"N": 262144, "K": 200000, "D": 64, "B": 1, "dtype": "fp16", "BLOCK_N": 32, "BLOCK_K": 64, "num_warps": 4, "num_stages": 2, "time_ms": 98.37260437011719, "status": "ok"}
{"N": 262144, "K": 200000, "D": 64, "B": 1, "dtype": "fp16", "BLOCK_N": 32, "BLOCK_K": 64, "num_warps": 4, "num_stages": 4, "time_ms": 99.67616271972656, "status": "ok"}
{"N": 262144, "K": 200000, "D": 64, "B": 1, "dtype": "fp16", "BLOCK_N": 32, "BLOCK_K": 64, "num_warps": 8, "num_stages": 1, "time_ms": 147.81849670410156, "status": "ok"}
{"N": 262144, "K": 200000, "D": 64, "B": 1, "dtype": "fp16", "BLOCK_N": 32, "BLOCK_K": 64, "num_warps": 8, "num_stages": 2, "time_ms": 126.92684936523438, "status": "ok"}
{"N": 262144, "K": 200000, "D": 64, "B": 1, "dtype": "fp16", "BLOCK_N": 32, "BLOCK_K": 64, "num_warps": 8, "num_stages": 4, "time_ms": 123.18412780761719, "status": "ok"}
{"N": 262144, "K": 200000, "D": 64, "B": 1, "dtype": "fp16", "BLOCK_N": 32, "BLOCK_K": 128, "num_warps": 4, "num_stages": 1, "time_ms": 96.79974365234375, "status": "ok"}
{"N": 262144, "K": 200000, "D": 64, "B": 1, "dtype": "fp16", "BLOCK_N": 32, "BLOCK_K": 128, "num_warps": 4, "num_stages": 2, "time_ms": 84.21580505371094, "status": "ok"}
{"N": 262144, "K": 200000, "D": 64, "B": 1, "dtype": "fp16", "BLOCK_N": 32, "BLOCK_K": 128, "num_warps": 4, "num_stages": 4, "time_ms": 86.95807647705078, "status": "ok"}
{"N": 262144, "K": 200000, "D": 64, "B": 1, "dtype": "fp16", "BLOCK_N": 32, "BLOCK_K": 128, "num_warps": 8, "num_stages": 1, "time_ms": 133.07904052734375, "status": "ok"}
{"N": 262144, "K": 200000, "D": 64, "B": 1, "dtype": "fp16", "BLOCK_N": 32, "BLOCK_K": 128, "num_warps": 8, "num_stages": 2, "time_ms": 122.89024353027344, "status": "ok"}
{"N": 262144, "K": 200000, "D": 64, "B": 1, "dtype": "fp16", "BLOCK_N": 32, "BLOCK_K": 128, "num_warps": 8, "num_stages": 4, "time_ms": 127.84537506103516, "status": "ok"}
{"N": 262144, "K": 200000, "D": 64, "B": 1, "dtype": "fp16", "BLOCK_N": 64, "BLOCK_K": 32, "num_warps": 4, "num_stages": 1, "time_ms": 98.36339569091797, "status": "ok"}
{"N": 262144, "K": 200000, "D": 64, "B": 1, "dtype": "fp16", "BLOCK_N": 64, "BLOCK_K": 32, "num_warps": 4, "num_stages": 2, "time_ms": 91.74425506591797, "status": "ok"}
{"N": 262144, "K": 200000, "D": 64, "B": 1, "dtype": "fp16", "BLOCK_N": 64, "BLOCK_K": 32, "num_warps": 4, "num_stages": 4, "time_ms": 91.040771484375, "status": "ok"}
{"N": 262144, "K": 200000, "D": 64, "B": 1, "dtype": "fp16", "BLOCK_N": 64, "BLOCK_K": 32, "num_warps": 8, "num_stages": 1, "time_ms": 120.78079986572266, "status": "ok"}
{"N": 262144, "K": 200000, "D": 64, "B": 1, "dtype": "fp16", "BLOCK_N": 64, "BLOCK_K": 32, "num_warps": 8, "num_stages": 2, "time_ms": 117.84909057617188, "status": "ok"}
{"N": 262144, "K": 200000, "D": 64, "B": 1, "dtype": "fp16", "BLOCK_N": 64, "BLOCK_K": 32, "num_warps": 8, "num_stages": 4, "time_ms": 114.12889862060547, "status": "ok"}
{"N": 262144, "K": 200000, "D": 64, "B": 1, "dtype": "fp16", "BLOCK_N": 64, "BLOCK_K": 64, "num_warps": 4, "num_stages": 1, "time_ms": 78.33293151855469, "status": "ok"}
{"N": 262144, "K": 200000, "D": 64, "B": 1, "dtype": "fp16", "BLOCK_N": 64, "BLOCK_K": 64, "num_warps": 4, "num_stages": 2, "time_ms": 74.4816665649414, "status": "ok"}
{"N": 262144, "K": 200000, "D": 64, "B": 1, "dtype": "fp16", "BLOCK_N": 64, "BLOCK_K": 64, "num_warps": 4, "num_stages": 4, "time_ms": 70.40409851074219, "status": "ok"}
{"N": 262144, "K": 200000, "D": 64, "B": 1, "dtype": "fp16", "BLOCK_N": 64, "BLOCK_K": 64, "num_warps": 8, "num_stages": 1, "time_ms": 104.52787017822266, "status": "ok"}
{"N": 262144, "K": 200000, "D": 64, "B": 1, "dtype": "fp16", "BLOCK_N": 64, "BLOCK_K": 64, "num_warps": 8, "num_stages": 2, "time_ms": 101.54086303710938, "status": "ok"}
{"N": 262144, "K": 200000, "D": 64, "B": 1, "dtype": "fp16", "BLOCK_N": 64, "BLOCK_K": 64, "num_warps": 8, "num_stages": 4, "time_ms": 98.72998046875, "status": "ok"}
{"N": 262144, "K": 200000, "D": 64, "B": 1, "dtype": "fp16", "BLOCK_N": 64, "BLOCK_K": 128, "num_warps": 4, "num_stages": 1, "time_ms": 83.6648941040039, "status": "ok"}
{"N": 262144, "K": 200000, "D": 64, "B": 1, "dtype": "fp16", "BLOCK_N": 64, "BLOCK_K": 128, "num_warps": 4, "num_stages": 2, "time_ms": 78.5582046508789, "status": "ok"}
{"N": 262144, "K": 200000, "D": 64, "B": 1, "dtype": "fp16", "BLOCK_N": 64, "BLOCK_K": 128, "num_warps": 4, "num_stages": 4, "time_ms": 89.83757019042969, "status": "ok"}
{"N": 262144, "K": 200000, "D": 64, "B": 1, "dtype": "fp16", "BLOCK_N": 64, "BLOCK_K": 128, "num_warps": 8, "num_stages": 1, "time_ms": 94.8326416015625, "status": "ok"}
{"N": 262144, "K": 200000, "D": 64, "B": 1, "dtype": "fp16", "BLOCK_N": 64, "BLOCK_K": 128, "num_warps": 8, "num_stages": 2, "time_ms": 86.82495880126953, "status": "ok"}
{"N": 262144, "K": 200000, "D": 64, "B": 1, "dtype": "fp16", "BLOCK_N": 64, "BLOCK_K": 128, "num_warps": 8, "num_stages": 4, "time_ms": 82.45452880859375, "status": "ok"}
{"N": 262144, "K": 200000, "D": 64, "B": 1, "dtype": "fp16", "BLOCK_N": 128, "BLOCK_K": 32, "num_warps": 4, "num_stages": 1, "time_ms": 62.32883071899414, "status": "ok"}
{"N": 262144, "K": 200000, "D": 64, "B": 1, "dtype": "fp16", "BLOCK_N": 128, "BLOCK_K": 32, "num_warps": 4, "num_stages": 2, "time_ms": 59.54355239868164, "status": "ok"}
{"N": 262144, "K": 200000, "D": 64, "B": 1, "dtype": "fp16", "BLOCK_N": 128, "BLOCK_K": 32, "num_warps": 4, "num_stages": 4, "time_ms": 60.34739303588867, "status": "ok"}
{"N": 262144, "K": 200000, "D": 64, "B": 1, "dtype": "fp16", "BLOCK_N": 128, "BLOCK_K": 32, "num_warps": 8, "num_stages": 1, "time_ms": 97.46739196777344, "status": "ok"}
{"N": 262144, "K": 200000, "D": 64, "B": 1, "dtype": "fp16", "BLOCK_N": 128, "BLOCK_K": 32, "num_warps": 8, "num_stages": 2, "time_ms": 95.88633728027344, "status": "ok"}
{"N": 262144, "K": 200000, "D": 64, "B": 1, "dtype": "fp16", "BLOCK_N": 128, "BLOCK_K": 32, "num_warps": 8, "num_stages": 4, "time_ms": 96.3921890258789, "status": "ok"}
{"N": 262144, "K": 200000, "D": 64, "B": 1, "dtype": "fp16", "BLOCK_N": 128, "BLOCK_K": 64, "num_warps": 4, "num_stages": 1, "time_ms": 80.41983795166016, "status": "ok"}
{"N": 262144, "K": 200000, "D": 64, "B": 1, "dtype": "fp16", "BLOCK_N": 128, "BLOCK_K": 64, "num_warps": 4, "num_stages": 2, "time_ms": 67.77037048339844, "status": "ok"}
{"N": 262144, "K": 200000, "D": 64, "B": 1, "dtype": "fp16", "BLOCK_N": 128, "BLOCK_K": 64, "num_warps": 4, "num_stages": 4, "time_ms": 65.9968032836914, "status": "ok"}
{"N": 262144, "K": 200000, "D": 64, "B": 1, "dtype": "fp16", "BLOCK_N": 128, "BLOCK_K": 64, "num_warps": 8, "num_stages": 1, "time_ms": 81.8503646850586, "status": "ok"}
{"N": 262144, "K": 200000, "D": 64, "B": 1, "dtype": "fp16", "BLOCK_N": 128, "BLOCK_K": 64, "num_warps": 8, "num_stages": 2, "time_ms": 78.64422607421875, "status": "ok"}
{"N": 262144, "K": 200000, "D": 64, "B": 1, "dtype": "fp16", "BLOCK_N": 128, "BLOCK_K": 64, "num_warps": 8, "num_stages": 4, "time_ms": 76.58905792236328, "status": "ok"}
{"N": 262144, "K": 200000, "D": 64, "B": 1, "dtype": "fp16", "BLOCK_N": 128, "BLOCK_K": 128, "num_warps": 4, "num_stages": 1, "time_ms": 74.7161636352539, "status": "ok"}
{"N": 262144, "K": 200000, "D": 64, "B": 1, "dtype": "fp16", "BLOCK_N": 128, "BLOCK_K": 128, "num_warps": 4, "num_stages": 2, "time_ms": 69.12102508544922, "status": "ok"}
{"N": 262144, "K": 200000, "D": 64, "B": 1, "dtype": "fp16", "BLOCK_N": 128, "BLOCK_K": 128, "num_warps": 4, "num_stages": 4, "time_ms": 64.33792114257812, "status": "ok"}
{"N": 262144, "K": 200000, "D": 64, "B": 1, "dtype": "fp16", "BLOCK_N": 128, "BLOCK_K": 128, "num_warps": 8, "num_stages": 1, "time_ms": 106.38848114013672, "status": "ok"}
{"N": 262144, "K": 200000, "D": 64, "B": 1, "dtype": "fp16", "BLOCK_N": 128, "BLOCK_K": 128, "num_warps": 8, "num_stages": 2, "time_ms": 107.17696380615234, "status": "ok"}
{"N": 262144, "K": 200000, "D": 64, "B": 1, "dtype": "fp16", "BLOCK_N": 128, "BLOCK_K": 128, "num_warps": 8, "num_stages": 4, "time_ms": 97.81145477294922, "status": "ok"}
{"summary": true, "N": 262144, "K": 200000, "D": 64, "B": 1, "dtype": "fp16", "best": {"N": 262144, "K": 200000, "D": 64, "B": 1, "dtype": "fp16", "BLOCK_N": 128, "BLOCK_K": 32, "num_warps": 4, "num_stages": 2, "time_ms": 59.54355239868164, "status": "ok"}, "best_time_ms": 59.54355239868164, "tuning_seconds": 58.882792472839355, "skipped": 0}
