grid_results_a100/N262144_K16384_D512_B1_fp16.jsonl
{"N": 262144, "K": 16384, "D": 512, "B": 1, "dtype": "fp16", "BLOCK_N": 32, "BLOCK_K": 32, "num_warps": 4, "num_stages": 1, "time_ms": 62.94937515258789, "status": "ok"}
{"N": 262144, "K": 16384, "D": 512, "B": 1, "dtype": "fp16", "BLOCK_N": 32, "BLOCK_K": 32, "num_warps": 4, "num_stages": 2, "time_ms": 57.843711853027344, "status": "ok"}
{"N": 262144, "K": 16384, "D": 512, "B": 1, "dtype": "fp16", "BLOCK_N": 32, "BLOCK_K": 32, "num_warps": 4, "num_stages": 4, "time_ms": 69.83270263671875, "status": "ok"}
{"N": 262144, "K": 16384, "D": 512, "B": 1, "dtype": "fp16", "BLOCK_N": 32, "BLOCK_K": 32, "num_warps": 8, "num_stages": 1, "time_ms": 76.51020812988281, "status": "ok"}
{"N": 262144, "K": 16384, "D": 512, "B": 1, "dtype": "fp16", "BLOCK_N": 32, "BLOCK_K": 32, "num_warps": 8, "num_stages": 2, "time_ms": 63.46035385131836, "status": "ok"}
{"N": 262144, "K": 16384, "D": 512, "B": 1, "dtype": "fp16", "BLOCK_N": 32, "BLOCK_K": 32, "num_warps": 8, "num_stages": 4, "time_ms": 77.70521545410156, "status": "ok"}
{"N": 262144, "K": 16384, "D": 512, "B": 1, "dtype": "fp16", "BLOCK_N": 32, "BLOCK_K": 64, "num_warps": 4, "num_stages": 1, "time_ms": 62.738433837890625, "status": "ok"}
{"N": 262144, "K": 16384, "D": 512, "B": 1, "dtype": "fp16", "BLOCK_N": 32, "BLOCK_K": 64, "num_warps": 4, "num_stages": 2, "time_ms": 72.2135009765625, "status": "ok"}
{"N": 262144, "K": 16384, "D": 512, "B": 1, "dtype": "fp16", "BLOCK_N": 32, "BLOCK_K": 64, "num_warps": 4, "num_stages": 4, "status": "oor"}
{"N": 262144, "K": 16384, "D": 512, "B": 1, "dtype": "fp16", "BLOCK_N": 32, "BLOCK_K": 64, "num_warps": 8, "num_stages": 1, "time_ms": 67.31980895996094, "status": "ok"}
{"N": 262144, "K": 16384, "D": 512, "B": 1, "dtype": "fp16", "BLOCK_N": 32, "BLOCK_K": 64, "num_warps": 8, "num_stages": 2, "time_ms": 67.89222717285156, "status": "ok"}
{"N": 262144, "K": 16384, "D": 512, "B": 1, "dtype": "fp16", "BLOCK_N": 32, "BLOCK_K": 64, "num_warps": 8, "num_stages": 4, "status": "oor"}
{"N": 262144, "K": 16384, "D": 512, "B": 1, "dtype": "fp16", "BLOCK_N": 32, "BLOCK_K": 128, "num_warps": 4, "num_stages": 1, "time_ms": 66.57638549804688, "status": "ok"}
{"N": 262144, "K": 16384, "D": 512, "B": 1, "dtype": "fp16", "BLOCK_N": 32, "BLOCK_K": 128, "num_warps": 4, "num_stages": 2, "time_ms": 56.583168029785156, "status": "ok"}
{"N": 262144, "K": 16384, "D": 512, "B": 1, "dtype": "fp16", "BLOCK_N": 32, "BLOCK_K": 128, "num_warps": 4, "num_stages": 4, "status": "oor"}
{"N": 262144, "K": 16384, "D": 512, "B": 1, "dtype": "fp16", "BLOCK_N": 32, "BLOCK_K": 128, "num_warps": 8, "num_stages": 1, "time_ms": 56.03327941894531, "status": "ok"}
{"N": 262144, "K": 16384, "D": 512, "B": 1, "dtype": "fp16", "BLOCK_N": 32, "BLOCK_K": 128, "num_warps": 8, "num_stages": 2, "time_ms": 61.15737533569336, "status": "ok"}
{"N": 262144, "K": 16384, "D": 512, "B": 1, "dtype": "fp16", "BLOCK_N": 32, "BLOCK_K": 128, "num_warps": 8, "num_stages": 4, "status": "oor"}
{"N": 262144, "K": 16384, "D": 512, "B": 1, "dtype": "fp16", "BLOCK_N": 64, "BLOCK_K": 32, "num_warps": 4, "num_stages": 1, "time_ms": 53.65248107910156, "status": "ok"}
{"N": 262144, "K": 16384, "D": 512, "B": 1, "dtype": "fp16", "BLOCK_N": 64, "BLOCK_K": 32, "num_warps": 4, "num_stages": 2, "time_ms": 60.51737594604492, "status": "ok"}
{"N": 262144, "K": 16384, "D": 512, "B": 1, "dtype": "fp16", "BLOCK_N": 64, "BLOCK_K": 32, "num_warps": 4, "num_stages": 4, "time_ms": 56.987648010253906, "status": "ok"}
{"N": 262144, "K": 16384, "D": 512, "B": 1, "dtype": "fp16", "BLOCK_N": 64, "BLOCK_K": 32, "num_warps": 8, "num_stages": 1, "time_ms": 58.484737396240234, "status": "ok"}
{"N": 262144, "K": 16384, "D": 512, "B": 1, "dtype": "fp16", "BLOCK_N": 64, "BLOCK_K": 32, "num_warps": 8, "num_stages": 2, "time_ms": 62.35852813720703, "status": "ok"}
{"N": 262144, "K": 16384, "D": 512, "B": 1, "dtype": "fp16", "BLOCK_N": 64, "BLOCK_K": 32, "num_warps": 8, "num_stages": 4, "time_ms": 48.24371337890625, "status": "ok"}
{"N": 262144, "K": 16384, "D": 512, "B": 1, "dtype": "fp16", "BLOCK_N": 64, "BLOCK_K": 64, "num_warps": 4, "num_stages": 1, "time_ms": 41.031681060791016, "status": "ok"}
{"N": 262144, "K": 16384, "D": 512, "B": 1, "dtype": "fp16", "BLOCK_N": 64, "BLOCK_K": 64, "num_warps": 4, "num_stages": 2, "time_ms": 35.79596710205078, "status": "ok"}
{"N": 262144, "K": 16384, "D": 512, "B": 1, "dtype": "fp16", "BLOCK_N": 64, "BLOCK_K": 64, "num_warps": 4, "num_stages": 4, "status": "oor"}
{"N": 262144, "K": 16384, "D": 512, "B": 1, "dtype": "fp16", "BLOCK_N": 64, "BLOCK_K": 64, "num_warps": 8, "num_stages": 1, "time_ms": 45.81068801879883, "status": "ok"}
{"N": 262144, "K": 16384, "D": 512, "B": 1, "dtype": "fp16", "BLOCK_N": 64, "BLOCK_K": 64, "num_warps": 8, "num_stages": 2, "time_ms": 43.44627380371094, "status": "ok"}
{"N": 262144, "K": 16384, "D": 512, "B": 1, "dtype": "fp16", "BLOCK_N": 64, "BLOCK_K": 64, "num_warps": 8, "num_stages": 4, "status": "oor"}
{"N": 262144, "K": 16384, "D": 512, "B": 1, "dtype": "fp16", "BLOCK_N": 64, "BLOCK_K": 128, "num_warps": 4, "num_stages": 1, "status": "oor"}
{"N": 262144, "K": 16384, "D": 512, "B": 1, "dtype": "fp16", "BLOCK_N": 64, "BLOCK_K": 128, "num_warps": 4, "num_stages": 2, "status": "oor"}
{"N": 262144, "K": 16384, "D": 512, "B": 1, "dtype": "fp16", "BLOCK_N": 64, "BLOCK_K": 128, "num_warps": 4, "num_stages": 4, "status": "oor"}
{"N": 262144, "K": 16384, "D": 512, "B": 1, "dtype": "fp16", "BLOCK_N": 64, "BLOCK_K": 128, "num_warps": 8, "num_stages": 1, "status": "oor"}
{"N": 262144, "K": 16384, "D": 512, "B": 1, "dtype": "fp16", "BLOCK_N": 64, "BLOCK_K": 128, "num_warps": 8, "num_stages": 2, "status": "oor"}
{"N": 262144, "K": 16384, "D": 512, "B": 1, "dtype": "fp16", "BLOCK_N": 64, "BLOCK_K": 128, "num_warps": 8, "num_stages": 4, "status": "oor"}
{"N": 262144, "K": 16384, "D": 512, "B": 1, "dtype": "fp16", "BLOCK_N": 128, "BLOCK_K": 32, "num_warps": 4, "num_stages": 1, "time_ms": 46.70054244995117, "status": "ok"}
{"N": 262144, "K": 16384, "D": 512, "B": 1, "dtype": "fp16", "BLOCK_N": 128, "BLOCK_K": 32, "num_warps": 4, "num_stages": 2, "time_ms": 34.40947341918945, "status": "ok"}
{"N": 262144, "K": 16384, "D": 512, "B": 1, "dtype": "fp16", "BLOCK_N": 128, "BLOCK_K": 32, "num_warps": 4, "num_stages": 4, "status": "oor"}
{"N": 262144, "K": 16384, "D": 512, "B": 1, "dtype": "fp16", "BLOCK_N": 128, "BLOCK_K": 32, "num_warps": 8, "num_stages": 1, "time_ms": 41.19347381591797, "status": "ok"}
{"N": 262144, "K": 16384, "D": 512, "B": 1, "dtype": "fp16", "BLOCK_N": 128, "BLOCK_K": 32, "num_warps": 8, "num_stages": 2, "time_ms": 43.23942565917969, "status": "ok"}
{"N": 262144, "K": 16384, "D": 512, "B": 1, "dtype": "fp16", "BLOCK_N": 128, "BLOCK_K": 32, "num_warps": 8, "num_stages": 4, "status": "oor"}
{"N": 262144, "K": 16384, "D": 512, "B": 1, "dtype": "fp16", "BLOCK_N": 128, "BLOCK_K": 64, "num_warps": 4, "num_stages": 1, "status": "oor"}
{"N": 262144, "K": 16384, "D": 512, "B": 1, "dtype": "fp16", "BLOCK_N": 128, "BLOCK_K": 64, "num_warps": 4, "num_stages": 2, "status": "oor"}
{"N": 262144, "K": 16384, "D": 512, "B": 1, "dtype": "fp16", "BLOCK_N": 128, "BLOCK_K": 64, "num_warps": 4, "num_stages": 4, "status": "oor"}
{"N": 262144, "K": 16384, "D": 512, "B": 1, "dtype": "fp16", "BLOCK_N": 128, "BLOCK_K": 64, "num_warps": 8, "num_stages": 1, "status": "oor"}
{"N": 262144, "K": 16384, "D": 512, "B": 1, "dtype": "fp16", "BLOCK_N": 128, "BLOCK_K": 64, "num_warps": 8, "num_stages": 2, "status": "oor"}
{"N": 262144, "K": 16384, "D": 512, "B": 1, "dtype": "fp16", "BLOCK_N": 128, "BLOCK_K": 64, "num_warps": 8, "num_stages": 4, "status": "oor"}
{"N": 262144, "K": 16384, "D": 512, "B": 1, "dtype": "fp16", "BLOCK_N": 128, "BLOCK_K": 128, "num_warps": 4, "num_stages": 1, "status": "oor"}
{"N": 262144, "K": 16384, "D": 512, "B": 1, "dtype": "fp16", "BLOCK_N": 128, "BLOCK_K": 128, "num_warps": 4, "num_stages": 2, "status": "oor"}
{"N": 262144, "K": 16384, "D": 512, "B": 1, "dtype": "fp16", "BLOCK_N": 128, "BLOCK_K": 128, "num_warps": 4, "num_stages": 4, "status": "oor"}
{"N": 262144, "K": 16384, "D": 512, "B": 1, "dtype": "fp16", "BLOCK_N": 128, "BLOCK_K": 128, "num_warps": 8, "num_stages": 1, "status": "oor"}
{"N": 262144, "K": 16384, "D": 512, "B": 1, "dtype": "fp16", "BLOCK_N": 128, "BLOCK_K": 128, "num_warps": 8, "num_stages": 2, "status": "oor"}
{"N": 262144, "K": 16384, "D": 512, "B": 1, "dtype": "fp16", "BLOCK_N": 128, "BLOCK_K": 128, "num_warps": 8, "num_stages": 4, "status": "oor"}
{"summary": true, "N": 262144, "K": 16384, "D": 512, "B": 1, "dtype": "fp16", "best": {"N": 262144, "K": 16384, "D": 512, "B": 1, "dtype": "fp16", "BLOCK_N": 128, "BLOCK_K": 32, "num_warps": 4, "num_stages": 2, "time_ms": 34.40947341918945, "status": "ok"}, "best_time_ms": 34.40947341918945, "tuning_seconds": 54.15210032463074, "skipped": 26}
