grid_results_a100/N262144_K16384_D64_B32_fp16.jsonl
{"N": 262144, "K": 16384, "D": 64, "B": 32, "dtype": "fp16", "BLOCK_N": 32, "BLOCK_K": 32, "num_warps": 4, "num_stages": 1, "time_ms": 340.64794921875, "status": "ok"}
{"N": 262144, "K": 16384, "D": 64, "B": 32, "dtype": "fp16", "BLOCK_N": 32, "BLOCK_K": 32, "num_warps": 4, "num_stages": 2, "time_ms": 302.91558837890625, "status": "ok"}
{"N": 262144, "K": 16384, "D": 64, "B": 32, "dtype": "fp16", "BLOCK_N": 32, "BLOCK_K": 32, "num_warps": 4, "num_stages": 4, "time_ms": 301.1409912109375, "status": "ok"}
{"N": 262144, "K": 16384, "D": 64, "B": 32, "dtype": "fp16", "BLOCK_N": 32, "BLOCK_K": 32, "num_warps": 8, "num_stages": 1, "time_ms": 546.5579223632812, "status": "ok"}
{"N": 262144, "K": 16384, "D": 64, "B": 32, "dtype": "fp16", "BLOCK_N": 32, "BLOCK_K": 32, "num_warps": 8, "num_stages": 2, "time_ms": 511.3630676269531, "status": "ok"}
{"N": 262144, "K": 16384, "D": 64, "B": 32, "dtype": "fp16", "BLOCK_N": 32, "BLOCK_K": 32, "num_warps": 8, "num_stages": 4, "time_ms": 503.32568359375, "status": "ok"}
{"N": 262144, "K": 16384, "D": 64, "B": 32, "dtype": "fp16", "BLOCK_N": 32, "BLOCK_K": 64, "num_warps": 4, "num_stages": 1, "time_ms": 294.4378967285156, "status": "ok"}
{"N": 262144, "K": 16384, "D": 64, "B": 32, "dtype": "fp16", "BLOCK_N": 32, "BLOCK_K": 64, "num_warps": 4, "num_stages": 2, "time_ms": 254.94630432128906, "status": "ok"}
{"N": 262144, "K": 16384, "D": 64, "B": 32, "dtype": "fp16", "BLOCK_N": 32, "BLOCK_K": 64, "num_warps": 4, "num_stages": 4, "time_ms": 261.7579650878906, "status": "ok"}
{"N": 262144, "K": 16384, "D": 64, "B": 32, "dtype": "fp16", "BLOCK_N": 32, "BLOCK_K": 64, "num_warps": 8, "num_stages": 1, "time_ms": 371.5379333496094, "status": "ok"}
{"N": 262144, "K": 16384, "D": 64, "B": 32, "dtype": "fp16", "BLOCK_N": 32, "BLOCK_K": 64, "num_warps": 8, "num_stages": 2, "time_ms": 328.764404296875, "status": "ok"}
{"N": 262144, "K": 16384, "D": 64, "B": 32, "dtype": "fp16", "BLOCK_N": 32, "BLOCK_K": 64, "num_warps": 8, "num_stages": 4, "time_ms": 319.3681945800781, "status": "ok"}
{"N": 262144, "K": 16384, "D": 64, "B": 32, "dtype": "fp16", "BLOCK_N": 32, "BLOCK_K": 128, "num_warps": 4, "num_stages": 1, "time_ms": 244.3335723876953, "status": "ok"}
{"N": 262144, "K": 16384, "D": 64, "B": 32, "dtype": "fp16", "BLOCK_N": 32, "BLOCK_K": 128, "num_warps": 4, "num_stages": 2, "time_ms": 213.77023315429688, "status": "ok"}
{"N": 262144, "K": 16384, "D": 64, "B": 32, "dtype": "fp16", "BLOCK_N": 32, "BLOCK_K": 128, "num_warps": 4, "num_stages": 4, "time_ms": 219.51385498046875, "status": "ok"}
{"N": 262144, "K": 16384, "D": 64, "B": 32, "dtype": "fp16", "BLOCK_N": 32, "BLOCK_K": 128, "num_warps": 8, "num_stages": 1, "time_ms": 339.9424133300781, "status": "ok"}
{"N": 262144, "K": 16384, "D": 64, "B": 32, "dtype": "fp16", "BLOCK_N": 32, "BLOCK_K": 128, "num_warps": 8, "num_stages": 2, "time_ms": 308.5322265625, "status": "ok"}
{"N": 262144, "K": 16384, "D": 64, "B": 32, "dtype": "fp16", "BLOCK_N": 32, "BLOCK_K": 128, "num_warps": 8, "num_stages": 4, "time_ms": 315.74835205078125, "status": "ok"}
{"N": 262144, "K": 16384, "D": 64, "B": 32, "dtype": "fp16", "BLOCK_N": 64, "BLOCK_K": 32, "num_warps": 4, "num_stages": 1, "time_ms": 257.4172058105469, "status": "ok"}
{"N": 262144, "K": 16384, "D": 64, "B": 32, "dtype": "fp16", "BLOCK_N": 64, "BLOCK_K": 32, "num_warps": 4, "num_stages": 2, "time_ms": 236.09548950195312, "status": "ok"}
{"N": 262144, "K": 16384, "D": 64, "B": 32, "dtype": "fp16", "BLOCK_N": 64, "BLOCK_K": 32, "num_warps": 4, "num_stages": 4, "time_ms": 237.67141723632812, "status": "ok"}
{"N": 262144, "K": 16384, "D": 64, "B": 32, "dtype": "fp16", "BLOCK_N": 64, "BLOCK_K": 32, "num_warps": 8, "num_stages": 1, "time_ms": 312.0445556640625, "status": "ok"}
{"N": 262144, "K": 16384, "D": 64, "B": 32, "dtype": "fp16", "BLOCK_N": 64, "BLOCK_K": 32, "num_warps": 8, "num_stages": 2, "time_ms": 297.3061218261719, "status": "ok"}
{"N": 262144, "K": 16384, "D": 64, "B": 32, "dtype": "fp16", "BLOCK_N": 64, "BLOCK_K": 32, "num_warps": 8, "num_stages": 4, "time_ms": 299.0940246582031, "status": "ok"}
{"N": 262144, "K": 16384, "D": 64, "B": 32, "dtype": "fp16", "BLOCK_N": 64, "BLOCK_K": 64, "num_warps": 4, "num_stages": 1, "time_ms": 202.3802947998047, "status": "ok"}
{"N": 262144, "K": 16384, "D": 64, "B": 32, "dtype": "fp16", "BLOCK_N": 64, "BLOCK_K": 64, "num_warps": 4, "num_stages": 2, "time_ms": 184.3179473876953, "status": "ok"}
{"N": 262144, "K": 16384, "D": 64, "B": 32, "dtype": "fp16", "BLOCK_N": 64, "BLOCK_K": 64, "num_warps": 4, "num_stages": 4, "time_ms": 182.4337921142578, "status": "ok"}
{"N": 262144, "K": 16384, "D": 64, "B": 32, "dtype": "fp16", "BLOCK_N": 64, "BLOCK_K": 64, "num_warps": 8, "num_stages": 1, "time_ms": 273.9312744140625, "status": "ok"}
{"N": 262144, "K": 16384, "D": 64, "B": 32, "dtype": "fp16", "BLOCK_N": 64, "BLOCK_K": 64, "num_warps": 8, "num_stages": 2, "time_ms": 262.3365173339844, "status": "ok"}
{"N": 262144, "K": 16384, "D": 64, "B": 32, "dtype": "fp16", "BLOCK_N": 64, "BLOCK_K": 64, "num_warps": 8, "num_stages": 4, "time_ms": 260.0232849121094, "status": "ok"}
{"N": 262144, "K": 16384, "D": 64, "B": 32, "dtype": "fp16", "BLOCK_N": 64, "BLOCK_K": 128, "num_warps": 4, "num_stages": 1, "time_ms": 210.38079833984375, "status": "ok"}
{"N": 262144, "K": 16384, "D": 64, "B": 32, "dtype": "fp16", "BLOCK_N": 64, "BLOCK_K": 128, "num_warps": 4, "num_stages": 2, "time_ms": 197.69139099121094, "status": "ok"}
{"N": 262144, "K": 16384, "D": 64, "B": 32, "dtype": "fp16", "BLOCK_N": 64, "BLOCK_K": 128, "num_warps": 4, "num_stages": 4, "time_ms": 217.55186462402344, "status": "ok"}
{"N": 262144, "K": 16384, "D": 64, "B": 32, "dtype": "fp16", "BLOCK_N": 64, "BLOCK_K": 128, "num_warps": 8, "num_stages": 1, "time_ms": 233.0839080810547, "status": "ok"}
{"N": 262144, "K": 16384, "D": 64, "B": 32, "dtype": "fp16", "BLOCK_N": 64, "BLOCK_K": 128, "num_warps": 8, "num_stages": 2, "time_ms": 215.97286987304688, "status": "ok"}
{"N": 262144, "K": 16384, "D": 64, "B": 32, "dtype": "fp16", "BLOCK_N": 64, "BLOCK_K": 128, "num_warps": 8, "num_stages": 4, "time_ms": 204.89932250976562, "status": "ok"}
{"N": 262144, "K": 16384, "D": 64, "B": 32, "dtype": "fp16", "BLOCK_N": 128, "BLOCK_K": 32, "num_warps": 4, "num_stages": 1, "time_ms": 158.6544647216797, "status": "ok"}
{"N": 262144, "K": 16384, "D": 64, "B": 32, "dtype": "fp16", "BLOCK_N": 128, "BLOCK_K": 32, "num_warps": 4, "num_stages": 2, "time_ms": 149.2316131591797, "status": "ok"}
{"N": 262144, "K": 16384, "D": 64, "B": 32, "dtype": "fp16", "BLOCK_N": 128, "BLOCK_K": 32, "num_warps": 4, "num_stages": 4, "time_ms": 154.22976684570312, "status": "ok"}
{"N": 262144, "K": 16384, "D": 64, "B": 32, "dtype": "fp16", "BLOCK_N": 128, "BLOCK_K": 32, "num_warps": 8, "num_stages": 1, "time_ms": 253.01504516601562, "status": "ok"}
{"N": 262144, "K": 16384, "D": 64, "B": 32, "dtype": "fp16", "BLOCK_N": 128, "BLOCK_K": 32, "num_warps": 8, "num_stages": 2, "time_ms": 244.5137939453125, "status": "ok"}
{"N": 262144, "K": 16384, "D": 64, "B": 32, "dtype": "fp16", "BLOCK_N": 128, "BLOCK_K": 32, "num_warps": 8, "num_stages": 4, "time_ms": 248.06809997558594, "status": "ok"}
{"N": 262144, "K": 16384, "D": 64, "B": 32, "dtype": "fp16", "BLOCK_N": 128, "BLOCK_K": 64, "num_warps": 4, "num_stages": 1, "time_ms": 202.3936004638672, "status": "ok"}
{"N": 262144, "K": 16384, "D": 64, "B": 32, "dtype": "fp16", "BLOCK_N": 128, "BLOCK_K": 64, "num_warps": 4, "num_stages": 2, "time_ms": 174.65548706054688, "status": "ok"}
{"N": 262144, "K": 16384, "D": 64, "B": 32, "dtype": "fp16", "BLOCK_N": 128, "BLOCK_K": 64, "num_warps": 4, "num_stages": 4, "time_ms": 171.7882843017578, "status": "ok"}
{"N": 262144, "K": 16384, "D": 64, "B": 32, "dtype": "fp16", "BLOCK_N": 128, "BLOCK_K": 64, "num_warps": 8, "num_stages": 1, "time_ms": 208.76390075683594, "status": "ok"}
{"N": 262144, "K": 16384, "D": 64, "B": 32, "dtype": "fp16", "BLOCK_N": 128, "BLOCK_K": 64, "num_warps": 8, "num_stages": 2, "time_ms": 200.09164428710938, "status": "ok"}
{"N": 262144, "K": 16384, "D": 64, "B": 32, "dtype": "fp16", "BLOCK_N": 128, "BLOCK_K": 64, "num_warps": 8, "num_stages": 4, "time_ms": 199.53152465820312, "status": "ok"}
{"N": 262144, "K": 16384, "D": 64, "B": 32, "dtype": "fp16", "BLOCK_N": 128, "BLOCK_K": 128, "num_warps": 4, "num_stages": 1, "time_ms": 171.04588317871094, "status": "ok"}
{"N": 262144, "K": 16384, "D": 64, "B": 32, "dtype": "fp16", "BLOCK_N": 128, "BLOCK_K": 128, "num_warps": 4, "num_stages": 2, "time_ms": 169.09925842285156, "status": "ok"}
{"N": 262144, "K": 16384, "D": 64, "B": 32, "dtype": "fp16", "BLOCK_N": 128, "BLOCK_K": 128, "num_warps": 4, "num_stages": 4, "time_ms": 168.48281860351562, "status": "ok"}
{"N": 262144, "K": 16384, "D": 64, "B": 32, "dtype": "fp16", "BLOCK_N": 128, "BLOCK_K": 128, "num_warps": 8, "num_stages": 1, "time_ms": 260.1922607421875, "status": "ok"}
{"N": 262144, "K": 16384, "D": 64, "B": 32, "dtype": "fp16", "BLOCK_N": 128, "BLOCK_K": 128, "num_warps": 8, "num_stages": 2, "time_ms": 242.64703369140625, "status": "ok"}
{"N": 262144, "K": 16384, "D": 64, "B": 32, "dtype": "fp16", "BLOCK_N": 128, "BLOCK_K": 128, "num_warps": 8, "num_stages": 4, "time_ms": 221.98681640625, "status": "ok"}
{"summary": true, "N": 262144, "K": 16384, "D": 64, "B": 32, "dtype": "fp16", "best": {"N": 262144, "K": 16384, "D": 64, "B": 32, "dtype": "fp16", "BLOCK_N": 128, "BLOCK_K": 32, "num_warps": 4, "num_stages": 2, "time_ms": 149.2316131591797, "status": "ok"}, "best_time_ms": 149.2316131591797, "tuning_seconds": 125.91663241386414, "skipped": 0}
