grid_results_a100/N262144_K256_D128_B1_fp16.jsonl
{"N": 262144, "K": 256, "D": 128, "B": 1, "dtype": "fp16", "BLOCK_N": 32, "BLOCK_K": 32, "num_warps": 4, "num_stages": 1, "time_ms": 0.3665919899940491, "status": "ok"}
{"N": 262144, "K": 256, "D": 128, "B": 1, "dtype": "fp16", "BLOCK_N": 32, "BLOCK_K": 32, "num_warps": 4, "num_stages": 2, "time_ms": 0.3399679991934035, "status": "ok"}
{"N": 262144, "K": 256, "D": 128, "B": 1, "dtype": "fp16", "BLOCK_N": 32, "BLOCK_K": 32, "num_warps": 4, "num_stages": 4, "time_ms": 0.34258489145172966, "status": "ok"}
{"N": 262144, "K": 256, "D": 128, "B": 1, "dtype": "fp16", "BLOCK_N": 32, "BLOCK_K": 32, "num_warps": 8, "num_stages": 1, "time_ms": 0.5131702593394688, "status": "ok"}
{"N": 262144, "K": 256, "D": 128, "B": 1, "dtype": "fp16", "BLOCK_N": 32, "BLOCK_K": 32, "num_warps": 8, "num_stages": 2, "time_ms": 0.4877165598528726, "status": "ok"}
{"N": 262144, "K": 256, "D": 128, "B": 1, "dtype": "fp16", "BLOCK_N": 32, "BLOCK_K": 32, "num_warps": 8, "num_stages": 4, "time_ms": 0.4951771412576948, "status": "ok"}
{"N": 262144, "K": 256, "D": 128, "B": 1, "dtype": "fp16", "BLOCK_N": 32, "BLOCK_K": 64, "num_warps": 4, "num_stages": 1, "time_ms": 0.33541687991884017, "status": "ok"}
{"N": 262144, "K": 256, "D": 128, "B": 1, "dtype": "fp16", "BLOCK_N": 32, "BLOCK_K": 64, "num_warps": 4, "num_stages": 2, "time_ms": 0.3086335986852646, "status": "ok"}
{"N": 262144, "K": 256, "D": 128, "B": 1, "dtype": "fp16", "BLOCK_N": 32, "BLOCK_K": 64, "num_warps": 4, "num_stages": 4, "time_ms": 0.3681848910119798, "status": "ok"}
{"N": 262144, "K": 256, "D": 128, "B": 1, "dtype": "fp16", "BLOCK_N": 32, "BLOCK_K": 64, "num_warps": 8, "num_stages": 1, "time_ms": 0.3735324475500319, "status": "ok"}
{"N": 262144, "K": 256, "D": 128, "B": 1, "dtype": "fp16", "BLOCK_N": 32, "BLOCK_K": 64, "num_warps": 8, "num_stages": 2, "time_ms": 0.33769244617886013, "status": "ok"}
{"N": 262144, "K": 256, "D": 128, "B": 1, "dtype": "fp16", "BLOCK_N": 32, "BLOCK_K": 64, "num_warps": 8, "num_stages": 4, "time_ms": 0.4052479937672615, "status": "ok"}
{"N": 262144, "K": 256, "D": 128, "B": 1, "dtype": "fp16", "BLOCK_N": 32, "BLOCK_K": 128, "num_warps": 4, "num_stages": 1, "time_ms": 0.32051199674606323, "status": "ok"}
{"N": 262144, "K": 256, "D": 128, "B": 1, "dtype": "fp16", "BLOCK_N": 32, "BLOCK_K": 128, "num_warps": 4, "num_stages": 2, "time_ms": 0.3132415980100632, "status": "ok"}
{"N": 262144, "K": 256, "D": 128, "B": 1, "dtype": "fp16", "BLOCK_N": 32, "BLOCK_K": 128, "num_warps": 4, "num_stages": 4, "time_ms": 0.5052708642823356, "status": "ok"}
{"N": 262144, "K": 256, "D": 128, "B": 1, "dtype": "fp16", "BLOCK_N": 32, "BLOCK_K": 128, "num_warps": 8, "num_stages": 1, "time_ms": 0.35805866453382706, "status": "ok"}
{"N": 262144, "K": 256, "D": 128, "B": 1, "dtype": "fp16", "BLOCK_N": 32, "BLOCK_K": 128, "num_warps": 8, "num_stages": 2, "time_ms": 0.33291377623875934, "status": "ok"}
{"N": 262144, "K": 256, "D": 128, "B": 1, "dtype": "fp16", "BLOCK_N": 32, "BLOCK_K": 128, "num_warps": 8, "num_stages": 4, "time_ms": 0.5374536940029689, "status": "ok"}
{"N": 262144, "K": 256, "D": 128, "B": 1, "dtype": "fp16", "BLOCK_N": 64, "BLOCK_K": 32, "num_warps": 4, "num_stages": 1, "time_ms": 0.26959126916798676, "status": "ok"}
{"N": 262144, "K": 256, "D": 128, "B": 1, "dtype": "fp16", "BLOCK_N": 64, "BLOCK_K": 32, "num_warps": 4, "num_stages": 2, "time_ms": 0.243525815281001, "status": "ok"}
{"N": 262144, "K": 256, "D": 128, "B": 1, "dtype": "fp16", "BLOCK_N": 64, "BLOCK_K": 32, "num_warps": 4, "num_stages": 4, "time_ms": 0.2650298096916892, "status": "ok"}
{"N": 262144, "K": 256, "D": 128, "B": 1, "dtype": "fp16", "BLOCK_N": 64, "BLOCK_K": 32, "num_warps": 8, "num_stages": 1, "time_ms": 0.32483555873235065, "status": "ok"}
{"N": 262144, "K": 256, "D": 128, "B": 1, "dtype": "fp16", "BLOCK_N": 64, "BLOCK_K": 32, "num_warps": 8, "num_stages": 2, "time_ms": 0.30044159591197966, "status": "ok"}
{"N": 262144, "K": 256, "D": 128, "B": 1, "dtype": "fp16", "BLOCK_N": 64, "BLOCK_K": 32, "num_warps": 8, "num_stages": 4, "time_ms": 0.31395840644836426, "status": "ok"}
{"N": 262144, "K": 256, "D": 128, "B": 1, "dtype": "fp16", "BLOCK_N": 64, "BLOCK_K": 64, "num_warps": 4, "num_stages": 1, "time_ms": 0.2122240016857783, "status": "ok"}
{"N": 262144, "K": 256, "D": 128, "B": 1, "dtype": "fp16", "BLOCK_N": 64, "BLOCK_K": 64, "num_warps": 4, "num_stages": 2, "time_ms": 0.19794707573377168, "status": "ok"}
{"N": 262144, "K": 256, "D": 128, "B": 1, "dtype": "fp16", "BLOCK_N": 64, "BLOCK_K": 64, "num_warps": 4, "num_stages": 4, "time_ms": 0.24012800306081772, "status": "ok"}
{"N": 262144, "K": 256, "D": 128, "B": 1, "dtype": "fp16", "BLOCK_N": 64, "BLOCK_K": 64, "num_warps": 8, "num_stages": 1, "time_ms": 0.27136000990867615, "status": "ok"}
{"N": 262144, "K": 256, "D": 128, "B": 1, "dtype": "fp16", "BLOCK_N": 64, "BLOCK_K": 64, "num_warps": 8, "num_stages": 2, "time_ms": 0.2627025436271321, "status": "ok"}
{"N": 262144, "K": 256, "D": 128, "B": 1, "dtype": "fp16", "BLOCK_N": 64, "BLOCK_K": 64, "num_warps": 8, "num_stages": 4, "time_ms": 0.28672000467777253, "status": "ok"}
{"N": 262144, "K": 256, "D": 128, "B": 1, "dtype": "fp16", "BLOCK_N": 64, "BLOCK_K": 128, "num_warps": 4, "num_stages": 1, "time_ms": 0.23799466838439307, "status": "ok"}
{"N": 262144, "K": 256, "D": 128, "B": 1, "dtype": "fp16", "BLOCK_N": 64, "BLOCK_K": 128, "num_warps": 4, "num_stages": 2, "time_ms": 0.21222400044401488, "status": "ok"}
{"N": 262144, "K": 256, "D": 128, "B": 1, "dtype": "fp16", "BLOCK_N": 64, "BLOCK_K": 128, "num_warps": 4, "num_stages": 4, "time_ms": 0.39321601390838623, "status": "ok"}
{"N": 262144, "K": 256, "D": 128, "B": 1, "dtype": "fp16", "BLOCK_N": 64, "BLOCK_K": 128, "num_warps": 8, "num_stages": 1, "time_ms": 0.23628800362348557, "status": "ok"}
{"N": 262144, "K": 256, "D": 128, "B": 1, "dtype": "fp16", "BLOCK_N": 64, "BLOCK_K": 128, "num_warps": 8, "num_stages": 2, "time_ms": 0.23295999939242998, "status": "ok"}
{"N": 262144, "K": 256, "D": 128, "B": 1, "dtype": "fp16", "BLOCK_N": 64, "BLOCK_K": 128, "num_warps": 8, "num_stages": 4, "time_ms": 0.3332551154825423, "status": "ok"}
{"N": 262144, "K": 256, "D": 128, "B": 1, "dtype": "fp16", "BLOCK_N": 128, "BLOCK_K": 32, "num_warps": 4, "num_stages": 1, "time_ms": 0.1884160007421787, "status": "ok"}
{"N": 262144, "K": 256, "D": 128, "B": 1, "dtype": "fp16", "BLOCK_N": 128, "BLOCK_K": 32, "num_warps": 4, "num_stages": 2, "time_ms": 0.17444571746247156, "status": "ok"}
{"N": 262144, "K": 256, "D": 128, "B": 1, "dtype": "fp16", "BLOCK_N": 128, "BLOCK_K": 32, "num_warps": 4, "num_stages": 4, "time_ms": 0.21179733549555144, "status": "ok"}
{"N": 262144, "K": 256, "D": 128, "B": 1, "dtype": "fp16", "BLOCK_N": 128, "BLOCK_K": 32, "num_warps": 8, "num_stages": 1, "time_ms": 0.25944436951117084, "status": "ok"}
{"N": 262144, "K": 256, "D": 128, "B": 1, "dtype": "fp16", "BLOCK_N": 128, "BLOCK_K": 32, "num_warps": 8, "num_stages": 2, "time_ms": 0.24827345257455652, "status": "ok"}
{"N": 262144, "K": 256, "D": 128, "B": 1, "dtype": "fp16", "BLOCK_N": 128, "BLOCK_K": 32, "num_warps": 8, "num_stages": 4, "time_ms": 0.26735709472136066, "status": "ok"}
{"N": 262144, "K": 256, "D": 128, "B": 1, "dtype": "fp16", "BLOCK_N": 128, "BLOCK_K": 64, "num_warps": 4, "num_stages": 1, "time_ms": 0.2218666635453701, "status": "ok"}
{"N": 262144, "K": 256, "D": 128, "B": 1, "dtype": "fp16", "BLOCK_N": 128, "BLOCK_K": 64, "num_warps": 4, "num_stages": 2, "time_ms": 0.1833747671200679, "status": "ok"}
{"N": 262144, "K": 256, "D": 128, "B": 1, "dtype": "fp16", "BLOCK_N": 128, "BLOCK_K": 64, "num_warps": 4, "num_stages": 4, "time_ms": 0.27229090983217413, "status": "ok"}
{"N": 262144, "K": 256, "D": 128, "B": 1, "dtype": "fp16", "BLOCK_N": 128, "BLOCK_K": 64, "num_warps": 8, "num_stages": 1, "time_ms": 0.21896533419688544, "status": "ok"}
{"N": 262144, "K": 256, "D": 128, "B": 1, "dtype": "fp16", "BLOCK_N": 128, "BLOCK_K": 64, "num_warps": 8, "num_stages": 2, "time_ms": 0.2199893333017826, "status": "ok"}
{"N": 262144, "K": 256, "D": 128, "B": 1, "dtype": "fp16", "BLOCK_N": 128, "BLOCK_K": 64, "num_warps": 8, "num_stages": 4, "time_ms": 0.2702429104935039, "status": "ok"}
{"N": 262144, "K": 256, "D": 128, "B": 1, "dtype": "fp16", "BLOCK_N": 128, "BLOCK_K": 128, "num_warps": 4, "num_stages": 1, "time_ms": 0.2470632723786614, "status": "ok"}
{"N": 262144, "K": 256, "D": 128, "B": 1, "dtype": "fp16", "BLOCK_N": 128, "BLOCK_K": 128, "num_warps": 4, "num_stages": 2, "time_ms": 0.20590276901538557, "status": "ok"}
{"N": 262144, "K": 256, "D": 128, "B": 1, "dtype": "fp16", "BLOCK_N": 128, "BLOCK_K": 128, "num_warps": 4, "num_stages": 4, "time_ms": 0.31037439703941344, "status": "ok"}
{"N": 262144, "K": 256, "D": 128, "B": 1, "dtype": "fp16", "BLOCK_N": 128, "BLOCK_K": 128, "num_warps": 8, "num_stages": 1, "time_ms": 0.2744320034980774, "status": "ok"}
{"N": 262144, "K": 256, "D": 128, "B": 1, "dtype": "fp16", "BLOCK_N": 128, "BLOCK_K": 128, "num_warps": 8, "num_stages": 2, "time_ms": 0.27266327088529413, "status": "ok"}
{"N": 262144, "K": 256, "D": 128, "B": 1, "dtype": "fp16", "BLOCK_N": 128, "BLOCK_K": 128, "num_warps": 8, "num_stages": 4, "time_ms": 0.2686603529886766, "status": "ok"}
{"summary": true, "N": 262144, "K": 256, "D": 128, "B": 1, "dtype": "fp16", "best": {"N": 262144, "K": 256, "D": 128, "B": 1, "dtype": "fp16", "BLOCK_N": 128, "BLOCK_K": 32, "num_warps": 4, "num_stages": 2, "time_ms": 0.17444571746247156, "status": "ok"}, "best_time_ms": 0.17444571746247156, "tuning_seconds": 18.261517763137817, "skipped": 0}
