grid_results_a100/N262144_K65536_D64_B32_fp16.jsonl
{"N": 262144, "K": 65536, "D": 64, "B": 32, "dtype": "fp16", "BLOCK_N": 32, "BLOCK_K": 32, "num_warps": 4, "num_stages": 1, "time_ms": 1364.536376953125, "status": "ok"}
{"N": 262144, "K": 65536, "D": 64, "B": 32, "dtype": "fp16", "BLOCK_N": 32, "BLOCK_K": 32, "num_warps": 4, "num_stages": 2, "time_ms": 1220.1953125, "status": "ok"}
{"N": 262144, "K": 65536, "D": 64, "B": 32, "dtype": "fp16", "BLOCK_N": 32, "BLOCK_K": 32, "num_warps": 4, "num_stages": 4, "time_ms": 1207.5120849609375, "status": "ok"}
{"N": 262144, "K": 65536, "D": 64, "B": 32, "dtype": "fp16", "BLOCK_N": 32, "BLOCK_K": 32, "num_warps": 8, "num_stages": 1, "time_ms": 2184.91796875, "status": "ok"}
{"N": 262144, "K": 65536, "D": 64, "B": 32, "dtype": "fp16", "BLOCK_N": 32, "BLOCK_K": 32, "num_warps": 8, "num_stages": 2, "time_ms": 2043.39306640625, "status": "ok"}
{"N": 262144, "K": 65536, "D": 64, "B": 32, "dtype": "fp16", "BLOCK_N": 32, "BLOCK_K": 32, "num_warps": 8, "num_stages": 4, "time_ms": 2008.670166015625, "status": "ok"}
{"N": 262144, "K": 65536, "D": 64, "B": 32, "dtype": "fp16", "BLOCK_N": 32, "BLOCK_K": 64, "num_warps": 4, "num_stages": 1, "time_ms": 1180.5194091796875, "status": "ok"}
{"N": 262144, "K": 65536, "D": 64, "B": 32, "dtype": "fp16", "BLOCK_N": 32, "BLOCK_K": 64, "num_warps": 4, "num_stages": 2, "time_ms": 1022.6697998046875, "status": "ok"}
{"N": 262144, "K": 65536, "D": 64, "B": 32, "dtype": "fp16", "BLOCK_N": 32, "BLOCK_K": 64, "num_warps": 4, "num_stages": 4, "time_ms": 1040.110595703125, "status": "ok"}
{"N": 262144, "K": 65536, "D": 64, "B": 32, "dtype": "fp16", "BLOCK_N": 32, "BLOCK_K": 64, "num_warps": 8, "num_stages": 1, "time_ms": 1484.2193603515625, "status": "ok"}
{"N": 262144, "K": 65536, "D": 64, "B": 32, "dtype": "fp16", "BLOCK_N": 32, "BLOCK_K": 64, "num_warps": 8, "num_stages": 2, "time_ms": 1318.3753662109375, "status": "ok"}
{"N": 262144, "K": 65536, "D": 64, "B": 32, "dtype": "fp16", "BLOCK_N": 32, "BLOCK_K": 64, "num_warps": 8, "num_stages": 4, "time_ms": 1283.689453125, "status": "ok"}
{"N": 262144, "K": 65536, "D": 64, "B": 32, "dtype": "fp16", "BLOCK_N": 32, "BLOCK_K": 128, "num_warps": 4, "num_stages": 1, "time_ms": 977.112060546875, "status": "ok"}
{"N": 262144, "K": 65536, "D": 64, "B": 32, "dtype": "fp16", "BLOCK_N": 32, "BLOCK_K": 128, "num_warps": 4, "num_stages": 2, "time_ms": 858.3004150390625, "status": "ok"}
{"N": 262144, "K": 65536, "D": 64, "B": 32, "dtype": "fp16", "BLOCK_N": 32, "BLOCK_K": 128, "num_warps": 4, "num_stages": 4, "time_ms": 877.3508911132812, "status": "ok"}
{"N": 262144, "K": 65536, "D": 64, "B": 32, "dtype": "fp16", "BLOCK_N": 32, "BLOCK_K": 128, "num_warps": 8, "num_stages": 1, "time_ms": 1362.788330078125, "status": "ok"}
{"N": 262144, "K": 65536, "D": 64, "B": 32, "dtype": "fp16", "BLOCK_N": 32, "BLOCK_K": 128, "num_warps": 8, "num_stages": 2, "time_ms": 1240.3763427734375, "status": "ok"}
{"N": 262144, "K": 65536, "D": 64, "B": 32, "dtype": "fp16", "BLOCK_N": 32, "BLOCK_K": 128, "num_warps": 8, "num_stages": 4, "time_ms": 1259.5394287109375, "status": "ok"}
{"N": 262144, "K": 65536, "D": 64, "B": 32, "dtype": "fp16", "BLOCK_N": 64, "BLOCK_K": 32, "num_warps": 4, "num_stages": 1, "time_ms": 1022.2540893554688, "status": "ok"}
{"N": 262144, "K": 65536, "D": 64, "B": 32, "dtype": "fp16", "BLOCK_N": 64, "BLOCK_K": 32, "num_warps": 4, "num_stages": 2, "time_ms": 938.271728515625, "status": "ok"}
{"N": 262144, "K": 65536, "D": 64, "B": 32, "dtype": "fp16", "BLOCK_N": 64, "BLOCK_K": 32, "num_warps": 4, "num_stages": 4, "time_ms": 952.9794311523438, "status": "ok"}
{"N": 262144, "K": 65536, "D": 64, "B": 32, "dtype": "fp16", "BLOCK_N": 64, "BLOCK_K": 32, "num_warps": 8, "num_stages": 1, "time_ms": 1250.2333984375, "status": "ok"}
{"N": 262144, "K": 65536, "D": 64, "B": 32, "dtype": "fp16", "BLOCK_N": 64, "BLOCK_K": 32, "num_warps": 8, "num_stages": 2, "time_ms": 1186.27734375, "status": "ok"}
{"N": 262144, "K": 65536, "D": 64, "B": 32, "dtype": "fp16", "BLOCK_N": 64, "BLOCK_K": 32, "num_warps": 8, "num_stages": 4, "time_ms": 1189.6197509765625, "status": "ok"}
{"N": 262144, "K": 65536, "D": 64, "B": 32, "dtype": "fp16", "BLOCK_N": 64, "BLOCK_K": 64, "num_warps": 4, "num_stages": 1, "time_ms": 805.7937622070312, "status": "ok"}
{"N": 262144, "K": 65536, "D": 64, "B": 32, "dtype": "fp16", "BLOCK_N": 64, "BLOCK_K": 64, "num_warps": 4, "num_stages": 2, "time_ms": 741.5951538085938, "status": "ok"}
{"N": 262144, "K": 65536, "D": 64, "B": 32, "dtype": "fp16", "BLOCK_N": 64, "BLOCK_K": 64, "num_warps": 4, "num_stages": 4, "time_ms": 728.0967407226562, "status": "ok"}
{"N": 262144, "K": 65536, "D": 64, "B": 32, "dtype": "fp16", "BLOCK_N": 64, "BLOCK_K": 64, "num_warps": 8, "num_stages": 1, "time_ms": 1098.4898681640625, "status": "ok"}
{"N": 262144, "K": 65536, "D": 64, "B": 32, "dtype": "fp16", "BLOCK_N": 64, "BLOCK_K": 64, "num_warps": 8, "num_stages": 2, "time_ms": 1047.0072021484375, "status": "ok"}
{"N": 262144, "K": 65536, "D": 64, "B": 32, "dtype": "fp16", "BLOCK_N": 64, "BLOCK_K": 64, "num_warps": 8, "num_stages": 4, "time_ms": 1034.50927734375, "status": "ok"}
{"N": 262144, "K": 65536, "D": 64, "B": 32, "dtype": "fp16", "BLOCK_N": 64, "BLOCK_K": 128, "num_warps": 4, "num_stages": 1, "time_ms": 846.8213500976562, "status": "ok"}
{"N": 262144, "K": 65536, "D": 64, "B": 32, "dtype": "fp16", "BLOCK_N": 64, "BLOCK_K": 128, "num_warps": 4, "num_stages": 2, "time_ms": 800.806884765625, "status": "ok"}
{"N": 262144, "K": 65536, "D": 64, "B": 32, "dtype": "fp16", "BLOCK_N": 64, "BLOCK_K": 128, "num_warps": 4, "num_stages": 4, "time_ms": 859.6797485351562, "status": "ok"}
{"N": 262144, "K": 65536, "D": 64, "B": 32, "dtype": "fp16", "BLOCK_N": 64, "BLOCK_K": 128, "num_warps": 8, "num_stages": 1, "time_ms": 933.0155639648438, "status": "ok"}
{"N": 262144, "K": 65536, "D": 64, "B": 32, "dtype": "fp16", "BLOCK_N": 64, "BLOCK_K": 128, "num_warps": 8, "num_stages": 2, "time_ms": 866.7955322265625, "status": "ok"}
{"N": 262144, "K": 65536, "D": 64, "B": 32, "dtype": "fp16", "BLOCK_N": 64, "BLOCK_K": 128, "num_warps": 8, "num_stages": 4, "time_ms": 820.8312377929688, "status": "ok"}
{"N": 262144, "K": 65536, "D": 64, "B": 32, "dtype": "fp16", "BLOCK_N": 128, "BLOCK_K": 32, "num_warps": 4, "num_stages": 1, "time_ms": 635.5271606445312, "status": "ok"}
{"N": 262144, "K": 65536, "D": 64, "B": 32, "dtype": "fp16", "BLOCK_N": 128, "BLOCK_K": 32, "num_warps": 4, "num_stages": 2, "time_ms": 593.7223510742188, "status": "ok"}
{"N": 262144, "K": 65536, "D": 64, "B": 32, "dtype": "fp16", "BLOCK_N": 128, "BLOCK_K": 32, "num_warps": 4, "num_stages": 4, "time_ms": 617.89697265625, "status": "ok"}
{"N": 262144, "K": 65536, "D": 64, "B": 32, "dtype": "fp16", "BLOCK_N": 128, "BLOCK_K": 32, "num_warps": 8, "num_stages": 1, "time_ms": 1005.5424194335938, "status": "ok"}
{"N": 262144, "K": 65536, "D": 64, "B": 32, "dtype": "fp16", "BLOCK_N": 128, "BLOCK_K": 32, "num_warps": 8, "num_stages": 2, "time_ms": 970.8390502929688, "status": "ok"}
{"N": 262144, "K": 65536, "D": 64, "B": 32, "dtype": "fp16", "BLOCK_N": 128, "BLOCK_K": 32, "num_warps": 8, "num_stages": 4, "time_ms": 993.8646850585938, "status": "ok"}
{"N": 262144, "K": 65536, "D": 64, "B": 32, "dtype": "fp16", "BLOCK_N": 128, "BLOCK_K": 64, "num_warps": 4, "num_stages": 1, "time_ms": 803.2962646484375, "status": "ok"}
{"N": 262144, "K": 65536, "D": 64, "B": 32, "dtype": "fp16", "BLOCK_N": 128, "BLOCK_K": 64, "num_warps": 4, "num_stages": 2, "time_ms": 699.4390869140625, "status": "ok"}
{"N": 262144, "K": 65536, "D": 64, "B": 32, "dtype": "fp16", "BLOCK_N": 128, "BLOCK_K": 64, "num_warps": 4, "num_stages": 4, "time_ms": 689.69677734375, "status": "ok"}
{"N": 262144, "K": 65536, "D": 64, "B": 32, "dtype": "fp16", "BLOCK_N": 128, "BLOCK_K": 64, "num_warps": 8, "num_stages": 1, "time_ms": 834.9132690429688, "status": "ok"}
{"N": 262144, "K": 65536, "D": 64, "B": 32, "dtype": "fp16", "BLOCK_N": 128, "BLOCK_K": 64, "num_warps": 8, "num_stages": 2, "time_ms": 807.836669921875, "status": "ok"}
{"N": 262144, "K": 65536, "D": 64, "B": 32, "dtype": "fp16", "BLOCK_N": 128, "BLOCK_K": 64, "num_warps": 8, "num_stages": 4, "time_ms": 796.6146850585938, "status": "ok"}
{"N": 262144, "K": 65536, "D": 64, "B": 32, "dtype": "fp16", "BLOCK_N": 128, "BLOCK_K": 128, "num_warps": 4, "num_stages": 1, "time_ms": 680.48486328125, "status": "ok"}
{"N": 262144, "K": 65536, "D": 64, "B": 32, "dtype": "fp16", "BLOCK_N": 128, "BLOCK_K": 128, "num_warps": 4, "num_stages": 2, "time_ms": 709.9310302734375, "status": "ok"}
{"N": 262144, "K": 65536, "D": 64, "B": 32, "dtype": "fp16", "BLOCK_N": 128, "BLOCK_K": 128, "num_warps": 4, "num_stages": 4, "time_ms": 699.6572265625, "status": "ok"}
{"N": 262144, "K": 65536, "D": 64, "B": 32, "dtype": "fp16", "BLOCK_N": 128, "BLOCK_K": 128, "num_warps": 8, "num_stages": 1, "time_ms": 1038.983154296875, "status": "ok"}
{"N": 262144, "K": 65536, "D": 64, "B": 32, "dtype": "fp16", "BLOCK_N": 128, "BLOCK_K": 128, "num_warps": 8, "num_stages": 2, "time_ms": 971.662353515625, "status": "ok"}
{"N": 262144, "K": 65536, "D": 64, "B": 32, "dtype": "fp16", "BLOCK_N": 128, "BLOCK_K": 128, "num_warps": 8, "num_stages": 4, "time_ms": 884.6510009765625, "status": "ok"}
{"summary": true, "N": 262144, "K": 65536, "D": 64, "B": 32, "dtype": "fp16", "best": {"N": 262144, "K": 65536, "D": 64, "B": 32, "dtype": "fp16", "BLOCK_N": 128, "BLOCK_K": 32, "num_warps": 4, "num_stages": 2, "time_ms": 593.7223510742188, "status": "ok"}, "best_time_ms": 593.7223510742188, "tuning_seconds": 458.8875021934509, "skipped": 0}
