grid_results_a100/N262144_K4096_D128_B1_fp16.jsonl
{"N": 262144, "K": 4096, "D": 128, "B": 1, "dtype": "fp16", "BLOCK_N": 32, "BLOCK_K": 32, "num_warps": 4, "num_stages": 1, "time_ms": 5.2500481605529785, "status": "ok"}
{"N": 262144, "K": 4096, "D": 128, "B": 1, "dtype": "fp16", "BLOCK_N": 32, "BLOCK_K": 32, "num_warps": 4, "num_stages": 2, "time_ms": 4.220928192138672, "status": "ok"}
{"N": 262144, "K": 4096, "D": 128, "B": 1, "dtype": "fp16", "BLOCK_N": 32, "BLOCK_K": 32, "num_warps": 4, "num_stages": 4, "time_ms": 4.451327800750732, "status": "ok"}
{"N": 262144, "K": 4096, "D": 128, "B": 1, "dtype": "fp16", "BLOCK_N": 32, "BLOCK_K": 32, "num_warps": 8, "num_stages": 1, "time_ms": 7.6912641525268555, "status": "ok"}
{"N": 262144, "K": 4096, "D": 128, "B": 1, "dtype": "fp16", "BLOCK_N": 32, "BLOCK_K": 32, "num_warps": 8, "num_stages": 2, "time_ms": 7.044095993041992, "status": "ok"}
{"N": 262144, "K": 4096, "D": 128, "B": 1, "dtype": "fp16", "BLOCK_N": 32, "BLOCK_K": 32, "num_warps": 8, "num_stages": 4, "time_ms": 7.176191806793213, "status": "ok"}
{"N": 262144, "K": 4096, "D": 128, "B": 1, "dtype": "fp16", "BLOCK_N": 32, "BLOCK_K": 64, "num_warps": 4, "num_stages": 1, "time_ms": 4.56601619720459, "status": "ok"}
{"N": 262144, "K": 4096, "D": 128, "B": 1, "dtype": "fp16", "BLOCK_N": 32, "BLOCK_K": 64, "num_warps": 4, "num_stages": 2, "time_ms": 3.487744092941284, "status": "ok"}
{"N": 262144, "K": 4096, "D": 128, "B": 1, "dtype": "fp16", "BLOCK_N": 32, "BLOCK_K": 64, "num_warps": 4, "num_stages": 4, "time_ms": 4.274176120758057, "status": "ok"}
{"N": 262144, "K": 4096, "D": 128, "B": 1, "dtype": "fp16", "BLOCK_N": 32, "BLOCK_K": 64, "num_warps": 8, "num_stages": 1, "time_ms": 5.541888236999512, "status": "ok"}
{"N": 262144, "K": 4096, "D": 128, "B": 1, "dtype": "fp16", "BLOCK_N": 32, "BLOCK_K": 64, "num_warps": 8, "num_stages": 2, "time_ms": 4.582399845123291, "status": "ok"}
{"N": 262144, "K": 4096, "D": 128, "B": 1, "dtype": "fp16", "BLOCK_N": 32, "BLOCK_K": 64, "num_warps": 8, "num_stages": 4, "time_ms": 5.067776203155518, "status": "ok"}
{"N": 262144, "K": 4096, "D": 128, "B": 1, "dtype": "fp16", "BLOCK_N": 32, "BLOCK_K": 128, "num_warps": 4, "num_stages": 1, "time_ms": 3.9096319675445557, "status": "ok"}
{"N": 262144, "K": 4096, "D": 128, "B": 1, "dtype": "fp16", "BLOCK_N": 32, "BLOCK_K": 128, "num_warps": 4, "num_stages": 2, "time_ms": 3.3413119316101074, "status": "ok"}
{"N": 262144, "K": 4096, "D": 128, "B": 1, "dtype": "fp16", "BLOCK_N": 32, "BLOCK_K": 128, "num_warps": 4, "num_stages": 4, "time_ms": 4.897791862487793, "status": "ok"}
{"N": 262144, "K": 4096, "D": 128, "B": 1, "dtype": "fp16", "BLOCK_N": 32, "BLOCK_K": 128, "num_warps": 8, "num_stages": 1, "time_ms": 5.037055969238281, "status": "ok"}
{"N": 262144, "K": 4096, "D": 128, "B": 1, "dtype": "fp16", "BLOCK_N": 32, "BLOCK_K": 128, "num_warps": 8, "num_stages": 2, "time_ms": 4.170752048492432, "status": "ok"}
{"N": 262144, "K": 4096, "D": 128, "B": 1, "dtype": "fp16", "BLOCK_N": 32, "BLOCK_K": 128, "num_warps": 8, "num_stages": 4, "time_ms": 5.599232196807861, "status": "ok"}
{"N": 262144, "K": 4096, "D": 128, "B": 1, "dtype": "fp16", "BLOCK_N": 64, "BLOCK_K": 32, "num_warps": 4, "num_stages": 1, "time_ms": 3.758080005645752, "status": "ok"}
{"N": 262144, "K": 4096, "D": 128, "B": 1, "dtype": "fp16", "BLOCK_N": 64, "BLOCK_K": 32, "num_warps": 4, "num_stages": 2, "time_ms": 3.2378880977630615, "status": "ok"}
{"N": 262144, "K": 4096, "D": 128, "B": 1, "dtype": "fp16", "BLOCK_N": 64, "BLOCK_K": 32, "num_warps": 4, "num_stages": 4, "time_ms": 3.5327999591827393, "status": "ok"}
{"N": 262144, "K": 4096, "D": 128, "B": 1, "dtype": "fp16", "BLOCK_N": 64, "BLOCK_K": 32, "num_warps": 8, "num_stages": 1, "time_ms": 4.724736213684082, "status": "ok"}
{"N": 262144, "K": 4096, "D": 128, "B": 1, "dtype": "fp16", "BLOCK_N": 64, "BLOCK_K": 32, "num_warps": 8, "num_stages": 2, "time_ms": 4.191232204437256, "status": "ok"}
{"N": 262144, "K": 4096, "D": 128, "B": 1, "dtype": "fp16", "BLOCK_N": 64, "BLOCK_K": 32, "num_warps": 8, "num_stages": 4, "time_ms": 4.339712142944336, "status": "ok"}
{"N": 262144, "K": 4096, "D": 128, "B": 1, "dtype": "fp16", "BLOCK_N": 64, "BLOCK_K": 64, "num_warps": 4, "num_stages": 1, "time_ms": 2.841599941253662, "status": "ok"}
{"N": 262144, "K": 4096, "D": 128, "B": 1, "dtype": "fp16", "BLOCK_N": 64, "BLOCK_K": 64, "num_warps": 4, "num_stages": 2, "time_ms": 2.4248321056365967, "status": "ok"}
{"N": 262144, "K": 4096, "D": 128, "B": 1, "dtype": "fp16", "BLOCK_N": 64, "BLOCK_K": 64, "num_warps": 4, "num_stages": 4, "time_ms": 2.836479902267456, "status": "ok"}
{"N": 262144, "K": 4096, "D": 128, "B": 1, "dtype": "fp16", "BLOCK_N": 64, "BLOCK_K": 64, "num_warps": 8, "num_stages": 1, "time_ms": 3.837951898574829, "status": "ok"}
{"N": 262144, "K": 4096, "D": 128, "B": 1, "dtype": "fp16", "BLOCK_N": 64, "BLOCK_K": 64, "num_warps": 8, "num_stages": 2, "time_ms": 3.5000319480895996, "status": "ok"}
{"N": 262144, "K": 4096, "D": 128, "B": 1, "dtype": "fp16", "BLOCK_N": 64, "BLOCK_K": 64, "num_warps": 8, "num_stages": 4, "time_ms": 3.654655933380127, "status": "ok"}
{"N": 262144, "K": 4096, "D": 128, "B": 1, "dtype": "fp16", "BLOCK_N": 64, "BLOCK_K": 128, "num_warps": 4, "num_stages": 1, "time_ms": 2.982912063598633, "status": "ok"}
{"N": 262144, "K": 4096, "D": 128, "B": 1, "dtype": "fp16", "BLOCK_N": 64, "BLOCK_K": 128, "num_warps": 4, "num_stages": 2, "time_ms": 2.5774080753326416, "status": "ok"}
{"N": 262144, "K": 4096, "D": 128, "B": 1, "dtype": "fp16", "BLOCK_N": 64, "BLOCK_K": 128, "num_warps": 4, "num_stages": 4, "time_ms": 4.31001615524292, "status": "ok"}
{"N": 262144, "K": 4096, "D": 128, "B": 1, "dtype": "fp16", "BLOCK_N": 64, "BLOCK_K": 128, "num_warps": 8, "num_stages": 1, "time_ms": 3.175424098968506, "status": "ok"}
{"N": 262144, "K": 4096, "D": 128, "B": 1, "dtype": "fp16", "BLOCK_N": 64, "BLOCK_K": 128, "num_warps": 8, "num_stages": 2, "time_ms": 2.8692479133605957, "status": "ok"}
{"N": 262144, "K": 4096, "D": 128, "B": 1, "dtype": "fp16", "BLOCK_N": 64, "BLOCK_K": 128, "num_warps": 8, "num_stages": 4, "time_ms": 3.3966081142425537, "status": "ok"}
{"N": 262144, "K": 4096, "D": 128, "B": 1, "dtype": "fp16", "BLOCK_N": 128, "BLOCK_K": 32, "num_warps": 4, "num_stages": 1, "time_ms": 2.3060479164123535, "status": "ok"}
{"N": 262144, "K": 4096, "D": 128, "B": 1, "dtype": "fp16", "BLOCK_N": 128, "BLOCK_K": 32, "num_warps": 4, "num_stages": 2, "time_ms": 2.0203518867492676, "status": "ok"}
{"N": 262144, "K": 4096, "D": 128, "B": 1, "dtype": "fp16", "BLOCK_N": 128, "BLOCK_K": 32, "num_warps": 4, "num_stages": 4, "time_ms": 2.1288959980010986, "status": "ok"}
{"N": 262144, "K": 4096, "D": 128, "B": 1, "dtype": "fp16", "BLOCK_N": 128, "BLOCK_K": 32, "num_warps": 8, "num_stages": 1, "time_ms": 3.5287039279937744, "status": "ok"}
{"N": 262144, "K": 4096, "D": 128, "B": 1, "dtype": "fp16", "BLOCK_N": 128, "BLOCK_K": 32, "num_warps": 8, "num_stages": 2, "time_ms": 3.313663959503174, "status": "ok"}
{"N": 262144, "K": 4096, "D": 128, "B": 1, "dtype": "fp16", "BLOCK_N": 128, "BLOCK_K": 32, "num_warps": 8, "num_stages": 4, "time_ms": 3.5430400371551514, "status": "ok"}
{"N": 262144, "K": 4096, "D": 128, "B": 1, "dtype": "fp16", "BLOCK_N": 128, "BLOCK_K": 64, "num_warps": 4, "num_stages": 1, "time_ms": 2.7975680828094482, "status": "ok"}
{"N": 262144, "K": 4096, "D": 128, "B": 1, "dtype": "fp16", "BLOCK_N": 128, "BLOCK_K": 64, "num_warps": 4, "num_stages": 2, "time_ms": 2.2072319984436035, "status": "ok"}
{"N": 262144, "K": 4096, "D": 128, "B": 1, "dtype": "fp16", "BLOCK_N": 128, "BLOCK_K": 64, "num_warps": 4, "num_stages": 4, "time_ms": 3.196928024291992, "status": "ok"}
{"N": 262144, "K": 4096, "D": 128, "B": 1, "dtype": "fp16", "BLOCK_N": 128, "BLOCK_K": 64, "num_warps": 8, "num_stages": 1, "time_ms": 2.8774399757385254, "status": "ok"}
{"N": 262144, "K": 4096, "D": 128, "B": 1, "dtype": "fp16", "BLOCK_N": 128, "BLOCK_K": 64, "num_warps": 8, "num_stages": 2, "time_ms": 2.7596800327301025, "status": "ok"}
{"N": 262144, "K": 4096, "D": 128, "B": 1, "dtype": "fp16", "BLOCK_N": 128, "BLOCK_K": 64, "num_warps": 8, "num_stages": 4, "time_ms": 3.2020480632781982, "status": "ok"}
{"N": 262144, "K": 4096, "D": 128, "B": 1, "dtype": "fp16", "BLOCK_N": 128, "BLOCK_K": 128, "num_warps": 4, "num_stages": 1, "time_ms": 3.1549439430236816, "status": "ok"}
{"N": 262144, "K": 4096, "D": 128, "B": 1, "dtype": "fp16", "BLOCK_N": 128, "BLOCK_K": 128, "num_warps": 4, "num_stages": 2, "time_ms": 2.5323519706726074, "status": "ok"}
{"N": 262144, "K": 4096, "D": 128, "B": 1, "dtype": "fp16", "BLOCK_N": 128, "BLOCK_K": 128, "num_warps": 4, "num_stages": 4, "time_ms": 3.379199981689453, "status": "ok"}
{"N": 262144, "K": 4096, "D": 128, "B": 1, "dtype": "fp16", "BLOCK_N": 128, "BLOCK_K": 128, "num_warps": 8, "num_stages": 1, "time_ms": 3.56659197807312, "status": "ok"}
{"N": 262144, "K": 4096, "D": 128, "B": 1, "dtype": "fp16", "BLOCK_N": 128, "BLOCK_K": 128, "num_warps": 8, "num_stages": 2, "time_ms": 3.3310720920562744, "status": "ok"}
{"N": 262144, "K": 4096, "D": 128, "B": 1, "dtype": "fp16", "BLOCK_N": 128, "BLOCK_K": 128, "num_warps": 8, "num_stages": 4, "time_ms": 2.9163520336151123, "status": "ok"}
{"summary": true, "N": 262144, "K": 4096, "D": 128, "B": 1, "dtype": "fp16", "best": {"N": 262144, "K": 4096, "D": 128, "B": 1, "dtype": "fp16", "BLOCK_N": 128, "BLOCK_K": 32, "num_warps": 4, "num_stages": 2, "time_ms": 2.0203518867492676, "status": "ok"}, "best_time_ms": 2.0203518867492676, "tuning_seconds": 19.82789969444275, "skipped": 0}
