grid_results_a100/N65536_K16384_D64_B1_fp16.jsonl
{"N": 65536, "K": 16384, "D": 64, "B": 1, "dtype": "fp16", "BLOCK_N": 32, "BLOCK_K": 32, "num_warps": 4, "num_stages": 1, "time_ms": 3.5327999591827393, "status": "ok"}
{"N": 65536, "K": 16384, "D": 64, "B": 1, "dtype": "fp16", "BLOCK_N": 32, "BLOCK_K": 32, "num_warps": 4, "num_stages": 2, "time_ms": 3.2921600341796875, "status": "ok"}
{"N": 65536, "K": 16384, "D": 64, "B": 1, "dtype": "fp16", "BLOCK_N": 32, "BLOCK_K": 32, "num_warps": 4, "num_stages": 4, "time_ms": 3.0894079208374023, "status": "ok"}
{"N": 65536, "K": 16384, "D": 64, "B": 1, "dtype": "fp16", "BLOCK_N": 32, "BLOCK_K": 32, "num_warps": 8, "num_stages": 1, "time_ms": 5.669888019561768, "status": "ok"}
{"N": 65536, "K": 16384, "D": 64, "B": 1, "dtype": "fp16", "BLOCK_N": 32, "BLOCK_K": 32, "num_warps": 8, "num_stages": 2, "time_ms": 5.332992076873779, "status": "ok"}
{"N": 65536, "K": 16384, "D": 64, "B": 1, "dtype": "fp16", "BLOCK_N": 32, "BLOCK_K": 32, "num_warps": 8, "num_stages": 4, "time_ms": 5.180416107177734, "status": "ok"}
{"N": 65536, "K": 16384, "D": 64, "B": 1, "dtype": "fp16", "BLOCK_N": 32, "BLOCK_K": 64, "num_warps": 4, "num_stages": 1, "time_ms": 2.9808640480041504, "status": "ok"}
{"N": 65536, "K": 16384, "D": 64, "B": 1, "dtype": "fp16", "BLOCK_N": 32, "BLOCK_K": 64, "num_warps": 4, "num_stages": 2, "time_ms": 2.5815041065216064, "status": "ok"}
{"N": 65536, "K": 16384, "D": 64, "B": 1, "dtype": "fp16", "BLOCK_N": 32, "BLOCK_K": 64, "num_warps": 4, "num_stages": 4, "time_ms": 2.60915207862854, "status": "ok"}
{"N": 65536, "K": 16384, "D": 64, "B": 1, "dtype": "fp16", "BLOCK_N": 32, "BLOCK_K": 64, "num_warps": 8, "num_stages": 1, "time_ms": 3.826688051223755, "status": "ok"}
{"N": 65536, "K": 16384, "D": 64, "B": 1, "dtype": "fp16", "BLOCK_N": 32, "BLOCK_K": 64, "num_warps": 8, "num_stages": 2, "time_ms": 3.384320020675659, "status": "ok"}
{"N": 65536, "K": 16384, "D": 64, "B": 1, "dtype": "fp16", "BLOCK_N": 32, "BLOCK_K": 64, "num_warps": 8, "num_stages": 4, "time_ms": 3.259392023086548, "status": "ok"}
{"N": 65536, "K": 16384, "D": 64, "B": 1, "dtype": "fp16", "BLOCK_N": 32, "BLOCK_K": 128, "num_warps": 4, "num_stages": 1, "time_ms": 2.4688639640808105, "status": "ok"}
{"N": 65536, "K": 16384, "D": 64, "B": 1, "dtype": "fp16", "BLOCK_N": 32, "BLOCK_K": 128, "num_warps": 4, "num_stages": 2, "time_ms": 2.1591039896011353, "status": "ok"}
{"N": 65536, "K": 16384, "D": 64, "B": 1, "dtype": "fp16", "BLOCK_N": 32, "BLOCK_K": 128, "num_warps": 4, "num_stages": 4, "time_ms": 2.202112078666687, "status": "ok"}
{"N": 65536, "K": 16384, "D": 64, "B": 1, "dtype": "fp16", "BLOCK_N": 32, "BLOCK_K": 128, "num_warps": 8, "num_stages": 1, "time_ms": 3.4734079837799072, "status": "ok"}
{"N": 65536, "K": 16384, "D": 64, "B": 1, "dtype": "fp16", "BLOCK_N": 32, "BLOCK_K": 128, "num_warps": 8, "num_stages": 2, "time_ms": 3.152895927429199, "status": "ok"}
{"N": 65536, "K": 16384, "D": 64, "B": 1, "dtype": "fp16", "BLOCK_N": 32, "BLOCK_K": 128, "num_warps": 8, "num_stages": 4, "time_ms": 3.2225279808044434, "status": "ok"}
{"N": 65536, "K": 16384, "D": 64, "B": 1, "dtype": "fp16", "BLOCK_N": 64, "BLOCK_K": 32, "num_warps": 4, "num_stages": 1, "time_ms": 2.8098559379577637, "status": "ok"}
{"N": 65536, "K": 16384, "D": 64, "B": 1, "dtype": "fp16", "BLOCK_N": 64, "BLOCK_K": 32, "num_warps": 4, "num_stages": 2, "time_ms": 2.5804800987243652, "status": "ok"}
{"N": 65536, "K": 16384, "D": 64, "B": 1, "dtype": "fp16", "BLOCK_N": 64, "BLOCK_K": 32, "num_warps": 4, "num_stages": 4, "time_ms": 2.5917439460754395, "status": "ok"}
{"N": 65536, "K": 16384, "D": 64, "B": 1, "dtype": "fp16", "BLOCK_N": 64, "BLOCK_K": 32, "num_warps": 8, "num_stages": 1, "time_ms": 3.4365439414978027, "status": "ok"}
{"N": 65536, "K": 16384, "D": 64, "B": 1, "dtype": "fp16", "BLOCK_N": 64, "BLOCK_K": 32, "num_warps": 8, "num_stages": 2, "time_ms": 3.283967971801758, "status": "ok"}
{"N": 65536, "K": 16384, "D": 64, "B": 1, "dtype": "fp16", "BLOCK_N": 64, "BLOCK_K": 32, "num_warps": 8, "num_stages": 4, "time_ms": 3.2491519451141357, "status": "ok"}
{"N": 65536, "K": 16384, "D": 64, "B": 1, "dtype": "fp16", "BLOCK_N": 64, "BLOCK_K": 64, "num_warps": 4, "num_stages": 1, "time_ms": 2.2026240825653076, "status": "ok"}
{"N": 65536, "K": 16384, "D": 64, "B": 1, "dtype": "fp16", "BLOCK_N": 64, "BLOCK_K": 64, "num_warps": 4, "num_stages": 2, "time_ms": 1.9952640533447266, "status": "ok"}
{"N": 65536, "K": 16384, "D": 64, "B": 1, "dtype": "fp16", "BLOCK_N": 64, "BLOCK_K": 64, "num_warps": 4, "num_stages": 4, "time_ms": 1.9353599548339844, "status": "ok"}
{"N": 65536, "K": 16384, "D": 64, "B": 1, "dtype": "fp16", "BLOCK_N": 64, "BLOCK_K": 64, "num_warps": 8, "num_stages": 1, "time_ms": 2.964479923248291, "status": "ok"}
{"N": 65536, "K": 16384, "D": 64, "B": 1, "dtype": "fp16", "BLOCK_N": 64, "BLOCK_K": 64, "num_warps": 8, "num_stages": 2, "time_ms": 2.846719980239868, "status": "ok"}
{"N": 65536, "K": 16384, "D": 64, "B": 1, "dtype": "fp16", "BLOCK_N": 64, "BLOCK_K": 64, "num_warps": 8, "num_stages": 4, "time_ms": 2.7842559814453125, "status": "ok"}
{"N": 65536, "K": 16384, "D": 64, "B": 1, "dtype": "fp16", "BLOCK_N": 64, "BLOCK_K": 128, "num_warps": 4, "num_stages": 1, "time_ms": 2.32857608795166, "status": "ok"}
{"N": 65536, "K": 16384, "D": 64, "B": 1, "dtype": "fp16", "BLOCK_N": 64, "BLOCK_K": 128, "num_warps": 4, "num_stages": 2, "time_ms": 2.1990400552749634, "status": "ok"}
{"N": 65536, "K": 16384, "D": 64, "B": 1, "dtype": "fp16", "BLOCK_N": 64, "BLOCK_K": 128, "num_warps": 4, "num_stages": 4, "time_ms": 2.327552080154419, "status": "ok"}
{"N": 65536, "K": 16384, "D": 64, "B": 1, "dtype": "fp16", "BLOCK_N": 64, "BLOCK_K": 128, "num_warps": 8, "num_stages": 1, "time_ms": 2.4883201122283936, "status": "ok"}
{"N": 65536, "K": 16384, "D": 64, "B": 1, "dtype": "fp16", "BLOCK_N": 64, "BLOCK_K": 128, "num_warps": 8, "num_stages": 2, "time_ms": 2.3296000957489014, "status": "ok"}
{"N": 65536, "K": 16384, "D": 64, "B": 1, "dtype": "fp16", "BLOCK_N": 64, "BLOCK_K": 128, "num_warps": 8, "num_stages": 4, "time_ms": 2.160640001296997, "status": "ok"}
{"N": 65536, "K": 16384, "D": 64, "B": 1, "dtype": "fp16", "BLOCK_N": 128, "BLOCK_K": 32, "num_warps": 4, "num_stages": 1, "time_ms": 1.814527988433838, "status": "ok"}
{"N": 65536, "K": 16384, "D": 64, "B": 1, "dtype": "fp16", "BLOCK_N": 128, "BLOCK_K": 32, "num_warps": 4, "num_stages": 2, "time_ms": 1.6778240203857422, "status": "ok"}
{"N": 65536, "K": 16384, "D": 64, "B": 1, "dtype": "fp16", "BLOCK_N": 128, "BLOCK_K": 32, "num_warps": 4, "num_stages": 4, "time_ms": 1.7167359590530396, "status": "ok"}
{"N": 65536, "K": 16384, "D": 64, "B": 1, "dtype": "fp16", "BLOCK_N": 128, "BLOCK_K": 32, "num_warps": 8, "num_stages": 1, "time_ms": 2.796544075012207, "status": "ok"}
{"N": 65536, "K": 16384, "D": 64, "B": 1, "dtype": "fp16", "BLOCK_N": 128, "BLOCK_K": 32, "num_warps": 8, "num_stages": 2, "time_ms": 2.7402238845825195, "status": "ok"}
{"N": 65536, "K": 16384, "D": 64, "B": 1, "dtype": "fp16", "BLOCK_N": 128, "BLOCK_K": 32, "num_warps": 8, "num_stages": 4, "time_ms": 2.7402238845825195, "status": "ok"}
{"N": 65536, "K": 16384, "D": 64, "B": 1, "dtype": "fp16", "BLOCK_N": 128, "BLOCK_K": 64, "num_warps": 4, "num_stages": 1, "time_ms": 2.2625280618667603, "status": "ok"}
{"N": 65536, "K": 16384, "D": 64, "B": 1, "dtype": "fp16", "BLOCK_N": 128, "BLOCK_K": 64, "num_warps": 4, "num_stages": 2, "time_ms": 1.9338240027427673, "status": "ok"}
{"N": 65536, "K": 16384, "D": 64, "B": 1, "dtype": "fp16", "BLOCK_N": 128, "BLOCK_K": 64, "num_warps": 4, "num_stages": 4, "time_ms": 1.8728959560394287, "status": "ok"}
{"N": 65536, "K": 16384, "D": 64, "B": 1, "dtype": "fp16", "BLOCK_N": 128, "BLOCK_K": 64, "num_warps": 8, "num_stages": 1, "time_ms": 2.306559920310974, "status": "ok"}
{"N": 65536, "K": 16384, "D": 64, "B": 1, "dtype": "fp16", "BLOCK_N": 128, "BLOCK_K": 64, "num_warps": 8, "num_stages": 2, "time_ms": 2.224128007888794, "status": "ok"}
{"N": 65536, "K": 16384, "D": 64, "B": 1, "dtype": "fp16", "BLOCK_N": 128, "BLOCK_K": 64, "num_warps": 8, "num_stages": 4, "time_ms": 2.178559899330139, "status": "ok"}
{"N": 65536, "K": 16384, "D": 64, "B": 1, "dtype": "fp16", "BLOCK_N": 128, "BLOCK_K": 128, "num_warps": 4, "num_stages": 1, "time_ms": 2.155519962310791, "status": "ok"}
{"N": 65536, "K": 16384, "D": 64, "B": 1, "dtype": "fp16", "BLOCK_N": 128, "BLOCK_K": 128, "num_warps": 4, "num_stages": 2, "time_ms": 1.9998719692230225, "status": "ok"}
{"N": 65536, "K": 16384, "D": 64, "B": 1, "dtype": "fp16", "BLOCK_N": 128, "BLOCK_K": 128, "num_warps": 4, "num_stages": 4, "time_ms": 1.9676159620285034, "status": "ok"}
{"N": 65536, "K": 16384, "D": 64, "B": 1, "dtype": "fp16", "BLOCK_N": 128, "BLOCK_K": 128, "num_warps": 8, "num_stages": 1, "time_ms": 2.8180480003356934, "status": "ok"}
{"N": 65536, "K": 16384, "D": 64, "B": 1, "dtype": "fp16", "BLOCK_N": 128, "BLOCK_K": 128, "num_warps": 8, "num_stages": 2, "time_ms": 2.6316800117492676, "status": "ok"}
{"N": 65536, "K": 16384, "D": 64, "B": 1, "dtype": "fp16", "BLOCK_N": 128, "BLOCK_K": 128, "num_warps": 8, "num_stages": 4, "time_ms": 2.3889920711517334, "status": "ok"}
{"summary": true, "N": 65536, "K": 16384, "D": 64, "B": 1, "dtype": "fp16", "best": {"N": 65536, "K": 16384, "D": 64, "B": 1, "dtype": "fp16", "BLOCK_N": 128, "BLOCK_K": 32, "num_warps": 4, "num_stages": 2, "time_ms": 1.6778240203857422, "status": "ok"}, "best_time_ms": 1.6778240203857422, "tuning_seconds": 16.200424909591675, "skipped": 0}
