grid_results_a100/N65536_K4096_D64_B32_fp16.jsonl
{"N": 65536, "K": 4096, "D": 64, "B": 32, "dtype": "fp16", "BLOCK_N": 32, "BLOCK_K": 32, "num_warps": 4, "num_stages": 1, "time_ms": 23.234560012817383, "status": "ok"}
{"N": 65536, "K": 4096, "D": 64, "B": 32, "dtype": "fp16", "BLOCK_N": 32, "BLOCK_K": 32, "num_warps": 4, "num_stages": 2, "time_ms": 18.707456588745117, "status": "ok"}
{"N": 65536, "K": 4096, "D": 64, "B": 32, "dtype": "fp16", "BLOCK_N": 32, "BLOCK_K": 32, "num_warps": 4, "num_stages": 4, "time_ms": 18.534400939941406, "status": "ok"}
{"N": 65536, "K": 4096, "D": 64, "B": 32, "dtype": "fp16", "BLOCK_N": 32, "BLOCK_K": 32, "num_warps": 8, "num_stages": 1, "time_ms": 34.05926513671875, "status": "ok"}
{"N": 65536, "K": 4096, "D": 64, "B": 32, "dtype": "fp16", "BLOCK_N": 32, "BLOCK_K": 32, "num_warps": 8, "num_stages": 2, "time_ms": 32.13209533691406, "status": "ok"}
{"N": 65536, "K": 4096, "D": 64, "B": 32, "dtype": "fp16", "BLOCK_N": 32, "BLOCK_K": 32, "num_warps": 8, "num_stages": 4, "time_ms": 31.82080078125, "status": "ok"}
{"N": 65536, "K": 4096, "D": 64, "B": 32, "dtype": "fp16", "BLOCK_N": 32, "BLOCK_K": 64, "num_warps": 4, "num_stages": 1, "time_ms": 18.07360076904297, "status": "ok"}
{"N": 65536, "K": 4096, "D": 64, "B": 32, "dtype": "fp16", "BLOCK_N": 32, "BLOCK_K": 64, "num_warps": 4, "num_stages": 2, "time_ms": 15.739904403686523, "status": "ok"}
{"N": 65536, "K": 4096, "D": 64, "B": 32, "dtype": "fp16", "BLOCK_N": 32, "BLOCK_K": 64, "num_warps": 4, "num_stages": 4, "time_ms": 15.69587230682373, "status": "ok"}
{"N": 65536, "K": 4096, "D": 64, "B": 32, "dtype": "fp16", "BLOCK_N": 32, "BLOCK_K": 64, "num_warps": 8, "num_stages": 1, "time_ms": 22.942720413208008, "status": "ok"}
{"N": 65536, "K": 4096, "D": 64, "B": 32, "dtype": "fp16", "BLOCK_N": 32, "BLOCK_K": 64, "num_warps": 8, "num_stages": 2, "time_ms": 20.4718074798584, "status": "ok"}
{"N": 65536, "K": 4096, "D": 64, "B": 32, "dtype": "fp16", "BLOCK_N": 32, "BLOCK_K": 64, "num_warps": 8, "num_stages": 4, "time_ms": 19.960832595825195, "status": "ok"}
{"N": 65536, "K": 4096, "D": 64, "B": 32, "dtype": "fp16", "BLOCK_N": 32, "BLOCK_K": 128, "num_warps": 4, "num_stages": 1, "time_ms": 15.016960144042969, "status": "ok"}
{"N": 65536, "K": 4096, "D": 64, "B": 32, "dtype": "fp16", "BLOCK_N": 32, "BLOCK_K": 128, "num_warps": 4, "num_stages": 2, "time_ms": 13.094911575317383, "status": "ok"}
{"N": 65536, "K": 4096, "D": 64, "B": 32, "dtype": "fp16", "BLOCK_N": 32, "BLOCK_K": 128, "num_warps": 4, "num_stages": 4, "time_ms": 13.730815887451172, "status": "ok"}
{"N": 65536, "K": 4096, "D": 64, "B": 32, "dtype": "fp16", "BLOCK_N": 32, "BLOCK_K": 128, "num_warps": 8, "num_stages": 1, "time_ms": 21.193727493286133, "status": "ok"}
{"N": 65536, "K": 4096, "D": 64, "B": 32, "dtype": "fp16", "BLOCK_N": 32, "BLOCK_K": 128, "num_warps": 8, "num_stages": 2, "time_ms": 19.302400588989258, "status": "ok"}
{"N": 65536, "K": 4096, "D": 64, "B": 32, "dtype": "fp16", "BLOCK_N": 32, "BLOCK_K": 128, "num_warps": 8, "num_stages": 4, "time_ms": 20.08883285522461, "status": "ok"}
{"N": 65536, "K": 4096, "D": 64, "B": 32, "dtype": "fp16", "BLOCK_N": 64, "BLOCK_K": 32, "num_warps": 4, "num_stages": 1, "time_ms": 15.571968078613281, "status": "ok"}
{"N": 65536, "K": 4096, "D": 64, "B": 32, "dtype": "fp16", "BLOCK_N": 64, "BLOCK_K": 32, "num_warps": 4, "num_stages": 2, "time_ms": 14.317567825317383, "status": "ok"}
{"N": 65536, "K": 4096, "D": 64, "B": 32, "dtype": "fp16", "BLOCK_N": 64, "BLOCK_K": 32, "num_warps": 4, "num_stages": 4, "time_ms": 14.642175674438477, "status": "ok"}
{"N": 65536, "K": 4096, "D": 64, "B": 32, "dtype": "fp16", "BLOCK_N": 64, "BLOCK_K": 32, "num_warps": 8, "num_stages": 1, "time_ms": 19.281919479370117, "status": "ok"}
{"N": 65536, "K": 4096, "D": 64, "B": 32, "dtype": "fp16", "BLOCK_N": 64, "BLOCK_K": 32, "num_warps": 8, "num_stages": 2, "time_ms": 18.565120697021484, "status": "ok"}
{"N": 65536, "K": 4096, "D": 64, "B": 32, "dtype": "fp16", "BLOCK_N": 64, "BLOCK_K": 32, "num_warps": 8, "num_stages": 4, "time_ms": 18.62860870361328, "status": "ok"}
{"N": 65536, "K": 4096, "D": 64, "B": 32, "dtype": "fp16", "BLOCK_N": 64, "BLOCK_K": 64, "num_warps": 4, "num_stages": 1, "time_ms": 12.179455757141113, "status": "ok"}
{"N": 65536, "K": 4096, "D": 64, "B": 32, "dtype": "fp16", "BLOCK_N": 64, "BLOCK_K": 64, "num_warps": 4, "num_stages": 2, "time_ms": 11.316224098205566, "status": "ok"}
{"N": 65536, "K": 4096, "D": 64, "B": 32, "dtype": "fp16", "BLOCK_N": 64, "BLOCK_K": 64, "num_warps": 4, "num_stages": 4, "time_ms": 11.087871551513672, "status": "ok"}
{"N": 65536, "K": 4096, "D": 64, "B": 32, "dtype": "fp16", "BLOCK_N": 64, "BLOCK_K": 64, "num_warps": 8, "num_stages": 1, "time_ms": 16.921600341796875, "status": "ok"}
{"N": 65536, "K": 4096, "D": 64, "B": 32, "dtype": "fp16", "BLOCK_N": 64, "BLOCK_K": 64, "num_warps": 8, "num_stages": 2, "time_ms": 16.243711471557617, "status": "ok"}
{"N": 65536, "K": 4096, "D": 64, "B": 32, "dtype": "fp16", "BLOCK_N": 64, "BLOCK_K": 64, "num_warps": 8, "num_stages": 4, "time_ms": 16.288768768310547, "status": "ok"}
{"N": 65536, "K": 4096, "D": 64, "B": 32, "dtype": "fp16", "BLOCK_N": 64, "BLOCK_K": 128, "num_warps": 4, "num_stages": 1, "time_ms": 13.027327537536621, "status": "ok"}
{"N": 65536, "K": 4096, "D": 64, "B": 32, "dtype": "fp16", "BLOCK_N": 64, "BLOCK_K": 128, "num_warps": 4, "num_stages": 2, "time_ms": 12.149760246276855, "status": "ok"}
{"N": 65536, "K": 4096, "D": 64, "B": 32, "dtype": "fp16", "BLOCK_N": 64, "BLOCK_K": 128, "num_warps": 4, "num_stages": 4, "time_ms": 13.702143669128418, "status": "ok"}
{"N": 65536, "K": 4096, "D": 64, "B": 32, "dtype": "fp16", "BLOCK_N": 64, "BLOCK_K": 128, "num_warps": 8, "num_stages": 1, "time_ms": 14.467071533203125, "status": "ok"}
{"N": 65536, "K": 4096, "D": 64, "B": 32, "dtype": "fp16", "BLOCK_N": 64, "BLOCK_K": 128, "num_warps": 8, "num_stages": 2, "time_ms": 13.523967742919922, "status": "ok"}
{"N": 65536, "K": 4096, "D": 64, "B": 32, "dtype": "fp16", "BLOCK_N": 64, "BLOCK_K": 128, "num_warps": 8, "num_stages": 4, "time_ms": 12.76416015625, "status": "ok"}
{"N": 65536, "K": 4096, "D": 64, "B": 32, "dtype": "fp16", "BLOCK_N": 128, "BLOCK_K": 32, "num_warps": 4, "num_stages": 1, "time_ms": 9.631744384765625, "status": "ok"}
{"N": 65536, "K": 4096, "D": 64, "B": 32, "dtype": "fp16", "BLOCK_N": 128, "BLOCK_K": 32, "num_warps": 4, "num_stages": 2, "time_ms": 9.080831527709961, "status": "ok"}
{"N": 65536, "K": 4096, "D": 64, "B": 32, "dtype": "fp16", "BLOCK_N": 128, "BLOCK_K": 32, "num_warps": 4, "num_stages": 4, "time_ms": 9.239551544189453, "status": "ok"}
{"N": 65536, "K": 4096, "D": 64, "B": 32, "dtype": "fp16", "BLOCK_N": 128, "BLOCK_K": 32, "num_warps": 8, "num_stages": 1, "time_ms": 15.532032012939453, "status": "ok"}
{"N": 65536, "K": 4096, "D": 64, "B": 32, "dtype": "fp16", "BLOCK_N": 128, "BLOCK_K": 32, "num_warps": 8, "num_stages": 2, "time_ms": 15.250432014465332, "status": "ok"}
{"N": 65536, "K": 4096, "D": 64, "B": 32, "dtype": "fp16", "BLOCK_N": 128, "BLOCK_K": 32, "num_warps": 8, "num_stages": 4, "time_ms": 15.38047981262207, "status": "ok"}
{"N": 65536, "K": 4096, "D": 64, "B": 32, "dtype": "fp16", "BLOCK_N": 128, "BLOCK_K": 64, "num_warps": 4, "num_stages": 1, "time_ms": 12.472319602966309, "status": "ok"}
{"N": 65536, "K": 4096, "D": 64, "B": 32, "dtype": "fp16", "BLOCK_N": 128, "BLOCK_K": 64, "num_warps": 4, "num_stages": 2, "time_ms": 10.620927810668945, "status": "ok"}
{"N": 65536, "K": 4096, "D": 64, "B": 32, "dtype": "fp16", "BLOCK_N": 128, "BLOCK_K": 64, "num_warps": 4, "num_stages": 4, "time_ms": 10.490880012512207, "status": "ok"}
{"N": 65536, "K": 4096, "D": 64, "B": 32, "dtype": "fp16", "BLOCK_N": 128, "BLOCK_K": 64, "num_warps": 8, "num_stages": 1, "time_ms": 12.817407608032227, "status": "ok"}
{"N": 65536, "K": 4096, "D": 64, "B": 32, "dtype": "fp16", "BLOCK_N": 128, "BLOCK_K": 64, "num_warps": 8, "num_stages": 2, "time_ms": 12.496895790100098, "status": "ok"}
{"N": 65536, "K": 4096, "D": 64, "B": 32, "dtype": "fp16", "BLOCK_N": 128, "BLOCK_K": 64, "num_warps": 8, "num_stages": 4, "time_ms": 12.45798397064209, "status": "ok"}
{"N": 65536, "K": 4096, "D": 64, "B": 32, "dtype": "fp16", "BLOCK_N": 128, "BLOCK_K": 128, "num_warps": 4, "num_stages": 1, "time_ms": 11.071488380432129, "status": "ok"}
{"N": 65536, "K": 4096, "D": 64, "B": 32, "dtype": "fp16", "BLOCK_N": 128, "BLOCK_K": 128, "num_warps": 4, "num_stages": 2, "time_ms": 10.519552230834961, "status": "ok"}
{"N": 65536, "K": 4096, "D": 64, "B": 32, "dtype": "fp16", "BLOCK_N": 128, "BLOCK_K": 128, "num_warps": 4, "num_stages": 4, "time_ms": 10.486783981323242, "status": "ok"}
{"N": 65536, "K": 4096, "D": 64, "B": 32, "dtype": "fp16", "BLOCK_N": 128, "BLOCK_K": 128, "num_warps": 8, "num_stages": 1, "time_ms": 16.22118377685547, "status": "ok"}
{"N": 65536, "K": 4096, "D": 64, "B": 32, "dtype": "fp16", "BLOCK_N": 128, "BLOCK_K": 128, "num_warps": 8, "num_stages": 2, "time_ms": 15.412223815917969, "status": "ok"}
{"N": 65536, "K": 4096, "D": 64, "B": 32, "dtype": "fp16", "BLOCK_N": 128, "BLOCK_K": 128, "num_warps": 8, "num_stages": 4, "time_ms": 14.107647895812988, "status": "ok"}
{"summary": true, "N": 65536, "K": 4096, "D": 64, "B": 32, "dtype": "fp16", "best": {"N": 65536, "K": 4096, "D": 64, "B": 32, "dtype": "fp16", "BLOCK_N": 128, "BLOCK_K": 32, "num_warps": 4, "num_stages": 2, "time_ms": 9.080831527709961, "status": "ok"}, "best_time_ms": 9.080831527709961, "tuning_seconds": 21.921180725097656, "skipped": 0}
