grid_results_a100/N65536_K1024_D512_B1_fp16.jsonl
{"N": 65536, "K": 1024, "D": 512, "B": 1, "dtype": "fp16", "BLOCK_N": 32, "BLOCK_K": 32, "num_warps": 4, "num_stages": 1, "time_ms": 1.319424033164978, "status": "ok"}
{"N": 65536, "K": 1024, "D": 512, "B": 1, "dtype": "fp16", "BLOCK_N": 32, "BLOCK_K": 32, "num_warps": 4, "num_stages": 2, "time_ms": 1.1397119760513306, "status": "ok"}
{"N": 65536, "K": 1024, "D": 512, "B": 1, "dtype": "fp16", "BLOCK_N": 32, "BLOCK_K": 32, "num_warps": 4, "num_stages": 4, "time_ms": 1.4479360183080037, "status": "ok"}
{"N": 65536, "K": 1024, "D": 512, "B": 1, "dtype": "fp16", "BLOCK_N": 32, "BLOCK_K": 32, "num_warps": 8, "num_stages": 1, "time_ms": 1.5887359976768494, "status": "ok"}
{"N": 65536, "K": 1024, "D": 512, "B": 1, "dtype": "fp16", "BLOCK_N": 32, "BLOCK_K": 32, "num_warps": 8, "num_stages": 2, "time_ms": 1.3557759920756023, "status": "ok"}
{"N": 65536, "K": 1024, "D": 512, "B": 1, "dtype": "fp16", "BLOCK_N": 32, "BLOCK_K": 32, "num_warps": 8, "num_stages": 4, "time_ms": 1.595903992652893, "status": "ok"}
{"N": 65536, "K": 1024, "D": 512, "B": 1, "dtype": "fp16", "BLOCK_N": 32, "BLOCK_K": 64, "num_warps": 4, "num_stages": 1, "time_ms": 1.3247146209081013, "status": "ok"}
{"N": 65536, "K": 1024, "D": 512, "B": 1, "dtype": "fp16", "BLOCK_N": 32, "BLOCK_K": 64, "num_warps": 4, "num_stages": 2, "time_ms": 1.4783146778742473, "status": "ok"}
{"N": 65536, "K": 1024, "D": 512, "B": 1, "dtype": "fp16", "BLOCK_N": 32, "BLOCK_K": 64, "num_warps": 4, "num_stages": 4, "status": "oor"}
{"N": 65536, "K": 1024, "D": 512, "B": 1, "dtype": "fp16", "BLOCK_N": 32, "BLOCK_K": 64, "num_warps": 8, "num_stages": 1, "time_ms": 1.4042453368504841, "status": "ok"}
{"N": 65536, "K": 1024, "D": 512, "B": 1, "dtype": "fp16", "BLOCK_N": 32, "BLOCK_K": 64, "num_warps": 8, "num_stages": 2, "time_ms": 1.3789866765340169, "status": "ok"}
{"N": 65536, "K": 1024, "D": 512, "B": 1, "dtype": "fp16", "BLOCK_N": 32, "BLOCK_K": 64, "num_warps": 8, "num_stages": 4, "status": "oor"}
{"N": 65536, "K": 1024, "D": 512, "B": 1, "dtype": "fp16", "BLOCK_N": 32, "BLOCK_K": 128, "num_warps": 4, "num_stages": 1, "time_ms": 1.341098666191101, "status": "ok"}
{"N": 65536, "K": 1024, "D": 512, "B": 1, "dtype": "fp16", "BLOCK_N": 32, "BLOCK_K": 128, "num_warps": 4, "num_stages": 2, "time_ms": 1.2335786819458008, "status": "ok"}
{"N": 65536, "K": 1024, "D": 512, "B": 1, "dtype": "fp16", "BLOCK_N": 32, "BLOCK_K": 128, "num_warps": 4, "num_stages": 4, "status": "oor"}
{"N": 65536, "K": 1024, "D": 512, "B": 1, "dtype": "fp16", "BLOCK_N": 32, "BLOCK_K": 128, "num_warps": 8, "num_stages": 1, "time_ms": 1.1827199856440227, "status": "ok"}
{"N": 65536, "K": 1024, "D": 512, "B": 1, "dtype": "fp16", "BLOCK_N": 32, "BLOCK_K": 128, "num_warps": 8, "num_stages": 2, "time_ms": 1.2741973797480266, "status": "ok"}
{"N": 65536, "K": 1024, "D": 512, "B": 1, "dtype": "fp16", "BLOCK_N": 32, "BLOCK_K": 128, "num_warps": 8, "num_stages": 4, "status": "oor"}
{"N": 65536, "K": 1024, "D": 512, "B": 1, "dtype": "fp16", "BLOCK_N": 64, "BLOCK_K": 32, "num_warps": 4, "num_stages": 1, "time_ms": 1.1007999976476033, "status": "ok"}
{"N": 65536, "K": 1024, "D": 512, "B": 1, "dtype": "fp16", "BLOCK_N": 64, "BLOCK_K": 32, "num_warps": 4, "num_stages": 2, "time_ms": 1.2021759748458862, "status": "ok"}
{"N": 65536, "K": 1024, "D": 512, "B": 1, "dtype": "fp16", "BLOCK_N": 64, "BLOCK_K": 32, "num_warps": 4, "num_stages": 4, "time_ms": 1.1574613253275554, "status": "ok"}
{"N": 65536, "K": 1024, "D": 512, "B": 1, "dtype": "fp16", "BLOCK_N": 64, "BLOCK_K": 32, "num_warps": 8, "num_stages": 1, "time_ms": 1.1840852896372478, "status": "ok"}
{"N": 65536, "K": 1024, "D": 512, "B": 1, "dtype": "fp16", "BLOCK_N": 64, "BLOCK_K": 32, "num_warps": 8, "num_stages": 2, "time_ms": 1.224021355311076, "status": "ok"}
{"N": 65536, "K": 1024, "D": 512, "B": 1, "dtype": "fp16", "BLOCK_N": 64, "BLOCK_K": 32, "num_warps": 8, "num_stages": 4, "time_ms": 1.0199040174484253, "status": "ok"}
{"N": 65536, "K": 1024, "D": 512, "B": 1, "dtype": "fp16", "BLOCK_N": 64, "BLOCK_K": 64, "num_warps": 4, "num_stages": 1, "time_ms": 0.850943997502327, "status": "ok"}
{"N": 65536, "K": 1024, "D": 512, "B": 1, "dtype": "fp16", "BLOCK_N": 64, "BLOCK_K": 64, "num_warps": 4, "num_stages": 2, "time_ms": 0.7737343907356262, "status": "ok"}
{"N": 65536, "K": 1024, "D": 512, "B": 1, "dtype": "fp16", "BLOCK_N": 64, "BLOCK_K": 64, "num_warps": 4, "num_stages": 4, "status": "oor"}
{"N": 65536, "K": 1024, "D": 512, "B": 1, "dtype": "fp16", "BLOCK_N": 64, "BLOCK_K": 64, "num_warps": 8, "num_stages": 1, "time_ms": 0.9599999934434891, "status": "ok"}
{"N": 65536, "K": 1024, "D": 512, "B": 1, "dtype": "fp16", "BLOCK_N": 64, "BLOCK_K": 64, "num_warps": 8, "num_stages": 2, "time_ms": 0.9310719966888428, "status": "ok"}
{"N": 65536, "K": 1024, "D": 512, "B": 1, "dtype": "fp16", "BLOCK_N": 64, "BLOCK_K": 64, "num_warps": 8, "num_stages": 4, "status": "oor"}
{"N": 65536, "K": 1024, "D": 512, "B": 1, "dtype": "fp16", "BLOCK_N": 64, "BLOCK_K": 128, "num_warps": 4, "num_stages": 1, "status": "oor"}
{"N": 65536, "K": 1024, "D": 512, "B": 1, "dtype": "fp16", "BLOCK_N": 64, "BLOCK_K": 128, "num_warps": 4, "num_stages": 2, "status": "oor"}
{"N": 65536, "K": 1024, "D": 512, "B": 1, "dtype": "fp16", "BLOCK_N": 64, "BLOCK_K": 128, "num_warps": 4, "num_stages": 4, "status": "oor"}
{"N": 65536, "K": 1024, "D": 512, "B": 1, "dtype": "fp16", "BLOCK_N": 64, "BLOCK_K": 128, "num_warps": 8, "num_stages": 1, "status": "oor"}
{"N": 65536, "K": 1024, "D": 512, "B": 1, "dtype": "fp16", "BLOCK_N": 64, "BLOCK_K": 128, "num_warps": 8, "num_stages": 2, "status": "oor"}
{"N": 65536, "K": 1024, "D": 512, "B": 1, "dtype": "fp16", "BLOCK_N": 64, "BLOCK_K": 128, "num_warps": 8, "num_stages": 4, "status": "oor"}
{"N": 65536, "K": 1024, "D": 512, "B": 1, "dtype": "fp16", "BLOCK_N": 128, "BLOCK_K": 32, "num_warps": 4, "num_stages": 1, "time_ms": 0.9784319996833801, "status": "ok"}
{"N": 65536, "K": 1024, "D": 512, "B": 1, "dtype": "fp16", "BLOCK_N": 128, "BLOCK_K": 32, "num_warps": 4, "num_stages": 2, "time_ms": 0.6871039867401123, "status": "ok"}
{"N": 65536, "K": 1024, "D": 512, "B": 1, "dtype": "fp16", "BLOCK_N": 128, "BLOCK_K": 32, "num_warps": 4, "num_stages": 4, "status": "oor"}
{"N": 65536, "K": 1024, "D": 512, "B": 1, "dtype": "fp16", "BLOCK_N": 128, "BLOCK_K": 32, "num_warps": 8, "num_stages": 1, "time_ms": 0.8491520136594772, "status": "ok"}
{"N": 65536, "K": 1024, "D": 512, "B": 1, "dtype": "fp16", "BLOCK_N": 128, "BLOCK_K": 32, "num_warps": 8, "num_stages": 2, "time_ms": 0.8849920034408569, "status": "ok"}
{"N": 65536, "K": 1024, "D": 512, "B": 1, "dtype": "fp16", "BLOCK_N": 128, "BLOCK_K": 32, "num_warps": 8, "num_stages": 4, "status": "oor"}
{"N": 65536, "K": 1024, "D": 512, "B": 1, "dtype": "fp16", "BLOCK_N": 128, "BLOCK_K": 64, "num_warps": 4, "num_stages": 1, "status": "oor"}
{"N": 65536, "K": 1024, "D": 512, "B": 1, "dtype": "fp16", "BLOCK_N": 128, "BLOCK_K": 64, "num_warps": 4, "num_stages": 2, "status": "oor"}
{"N": 65536, "K": 1024, "D": 512, "B": 1, "dtype": "fp16", "BLOCK_N": 128, "BLOCK_K": 64, "num_warps": 4, "num_stages": 4, "status": "oor"}
{"N": 65536, "K": 1024, "D": 512, "B": 1, "dtype": "fp16", "BLOCK_N": 128, "BLOCK_K": 64, "num_warps": 8, "num_stages": 1, "status": "oor"}
{"N": 65536, "K": 1024, "D": 512, "B": 1, "dtype": "fp16", "BLOCK_N": 128, "BLOCK_K": 64, "num_warps": 8, "num_stages": 2, "status": "oor"}
{"N": 65536, "K": 1024, "D": 512, "B": 1, "dtype": "fp16", "BLOCK_N": 128, "BLOCK_K": 64, "num_warps": 8, "num_stages": 4, "status": "oor"}
{"N": 65536, "K": 1024, "D": 512, "B": 1, "dtype": "fp16", "BLOCK_N": 128, "BLOCK_K": 128, "num_warps": 4, "num_stages": 1, "status": "oor"}
{"N": 65536, "K": 1024, "D": 512, "B": 1, "dtype": "fp16", "BLOCK_N": 128, "BLOCK_K": 128, "num_warps": 4, "num_stages": 2, "status": "oor"}
{"N": 65536, "K": 1024, "D": 512, "B": 1, "dtype": "fp16", "BLOCK_N": 128, "BLOCK_K": 128, "num_warps": 4, "num_stages": 4, "status": "oor"}
{"N": 65536, "K": 1024, "D": 512, "B": 1, "dtype": "fp16", "BLOCK_N": 128, "BLOCK_K": 128, "num_warps": 8, "num_stages": 1, "status": "oor"}
{"N": 65536, "K": 1024, "D": 512, "B": 1, "dtype": "fp16", "BLOCK_N": 128, "BLOCK_K": 128, "num_warps": 8, "num_stages": 2, "status": "oor"}
{"N": 65536, "K": 1024, "D": 512, "B": 1, "dtype": "fp16", "BLOCK_N": 128, "BLOCK_K": 128, "num_warps": 8, "num_stages": 4, "status": "oor"}
{"summary": true, "N": 65536, "K": 1024, "D": 512, "B": 1, "dtype": "fp16", "best": {"N": 65536, "K": 1024, "D": 512, "B": 1, "dtype": "fp16", "BLOCK_N": 128, "BLOCK_K": 32, "num_warps": 4, "num_stages": 2, "time_ms": 0.6871039867401123, "status": "ok"}, "best_time_ms": 0.6871039867401123, "tuning_seconds": 41.75605893135071, "skipped": 26}
