grid_results_a100/N65536_K65536_D64_B1_fp16.jsonl
{"N": 65536, "K": 65536, "D": 64, "B": 1, "dtype": "fp16", "BLOCK_N": 32, "BLOCK_K": 32, "num_warps": 4, "num_stages": 1, "time_ms": 14.124032020568848, "status": "ok"}
{"N": 65536, "K": 65536, "D": 64, "B": 1, "dtype": "fp16", "BLOCK_N": 32, "BLOCK_K": 32, "num_warps": 4, "num_stages": 2, "time_ms": 10.397695541381836, "status": "ok"}
{"N": 65536, "K": 65536, "D": 64, "B": 1, "dtype": "fp16", "BLOCK_N": 32, "BLOCK_K": 32, "num_warps": 4, "num_stages": 4, "time_ms": 9.638912200927734, "status": "ok"}
{"N": 65536, "K": 65536, "D": 64, "B": 1, "dtype": "fp16", "BLOCK_N": 32, "BLOCK_K": 32, "num_warps": 8, "num_stages": 1, "time_ms": 17.683456420898438, "status": "ok"}
{"N": 65536, "K": 65536, "D": 64, "B": 1, "dtype": "fp16", "BLOCK_N": 32, "BLOCK_K": 32, "num_warps": 8, "num_stages": 2, "time_ms": 16.61440086364746, "status": "ok"}
{"N": 65536, "K": 65536, "D": 64, "B": 1, "dtype": "fp16", "BLOCK_N": 32, "BLOCK_K": 32, "num_warps": 8, "num_stages": 4, "time_ms": 16.18227195739746, "status": "ok"}
{"N": 65536, "K": 65536, "D": 64, "B": 1, "dtype": "fp16", "BLOCK_N": 32, "BLOCK_K": 64, "num_warps": 4, "num_stages": 1, "time_ms": 9.272319793701172, "status": "ok"}
{"N": 65536, "K": 65536, "D": 64, "B": 1, "dtype": "fp16", "BLOCK_N": 32, "BLOCK_K": 64, "num_warps": 4, "num_stages": 2, "time_ms": 8.030207633972168, "status": "ok"}
{"N": 65536, "K": 65536, "D": 64, "B": 1, "dtype": "fp16", "BLOCK_N": 32, "BLOCK_K": 64, "num_warps": 4, "num_stages": 4, "time_ms": 8.094719886779785, "status": "ok"}
{"N": 65536, "K": 65536, "D": 64, "B": 1, "dtype": "fp16", "BLOCK_N": 32, "BLOCK_K": 64, "num_warps": 8, "num_stages": 1, "time_ms": 11.445247650146484, "status": "ok"}
{"N": 65536, "K": 65536, "D": 64, "B": 1, "dtype": "fp16", "BLOCK_N": 32, "BLOCK_K": 64, "num_warps": 8, "num_stages": 2, "time_ms": 10.585087776184082, "status": "ok"}
{"N": 65536, "K": 65536, "D": 64, "B": 1, "dtype": "fp16", "BLOCK_N": 32, "BLOCK_K": 64, "num_warps": 8, "num_stages": 4, "time_ms": 10.0065279006958, "status": "ok"}
{"N": 65536, "K": 65536, "D": 64, "B": 1, "dtype": "fp16", "BLOCK_N": 32, "BLOCK_K": 128, "num_warps": 4, "num_stages": 1, "time_ms": 7.649280071258545, "status": "ok"}
{"N": 65536, "K": 65536, "D": 64, "B": 1, "dtype": "fp16", "BLOCK_N": 32, "BLOCK_K": 128, "num_warps": 4, "num_stages": 2, "time_ms": 6.6457600593566895, "status": "ok"}
{"N": 65536, "K": 65536, "D": 64, "B": 1, "dtype": "fp16", "BLOCK_N": 32, "BLOCK_K": 128, "num_warps": 4, "num_stages": 4, "time_ms": 6.805503845214844, "status": "ok"}
{"N": 65536, "K": 65536, "D": 64, "B": 1, "dtype": "fp16", "BLOCK_N": 32, "BLOCK_K": 128, "num_warps": 8, "num_stages": 1, "time_ms": 10.750975608825684, "status": "ok"}
{"N": 65536, "K": 65536, "D": 64, "B": 1, "dtype": "fp16", "BLOCK_N": 32, "BLOCK_K": 128, "num_warps": 8, "num_stages": 2, "time_ms": 9.887743949890137, "status": "ok"}
{"N": 65536, "K": 65536, "D": 64, "B": 1, "dtype": "fp16", "BLOCK_N": 32, "BLOCK_K": 128, "num_warps": 8, "num_stages": 4, "time_ms": 9.954303741455078, "status": "ok"}
{"N": 65536, "K": 65536, "D": 64, "B": 1, "dtype": "fp16", "BLOCK_N": 64, "BLOCK_K": 32, "num_warps": 4, "num_stages": 1, "time_ms": 8.72652816772461, "status": "ok"}
{"N": 65536, "K": 65536, "D": 64, "B": 1, "dtype": "fp16", "BLOCK_N": 64, "BLOCK_K": 32, "num_warps": 4, "num_stages": 2, "time_ms": 7.994368076324463, "status": "ok"}
{"N": 65536, "K": 65536, "D": 64, "B": 1, "dtype": "fp16", "BLOCK_N": 64, "BLOCK_K": 32, "num_warps": 4, "num_stages": 4, "time_ms": 8.028160095214844, "status": "ok"}
{"N": 65536, "K": 65536, "D": 64, "B": 1, "dtype": "fp16", "BLOCK_N": 64, "BLOCK_K": 32, "num_warps": 8, "num_stages": 1, "time_ms": 10.71615982055664, "status": "ok"}
{"N": 65536, "K": 65536, "D": 64, "B": 1, "dtype": "fp16", "BLOCK_N": 64, "BLOCK_K": 32, "num_warps": 8, "num_stages": 2, "time_ms": 10.200063705444336, "status": "ok"}
{"N": 65536, "K": 65536, "D": 64, "B": 1, "dtype": "fp16", "BLOCK_N": 64, "BLOCK_K": 32, "num_warps": 8, "num_stages": 4, "time_ms": 10.099712371826172, "status": "ok"}
{"N": 65536, "K": 65536, "D": 64, "B": 1, "dtype": "fp16", "BLOCK_N": 64, "BLOCK_K": 64, "num_warps": 4, "num_stages": 1, "time_ms": 6.878208160400391, "status": "ok"}
{"N": 65536, "K": 65536, "D": 64, "B": 1, "dtype": "fp16", "BLOCK_N": 64, "BLOCK_K": 64, "num_warps": 4, "num_stages": 2, "time_ms": 6.198272228240967, "status": "ok"}
{"N": 65536, "K": 65536, "D": 64, "B": 1, "dtype": "fp16", "BLOCK_N": 64, "BLOCK_K": 64, "num_warps": 4, "num_stages": 4, "time_ms": 5.988351821899414, "status": "ok"}
{"N": 65536, "K": 65536, "D": 64, "B": 1, "dtype": "fp16", "BLOCK_N": 64, "BLOCK_K": 64, "num_warps": 8, "num_stages": 1, "time_ms": 9.207807540893555, "status": "ok"}
{"N": 65536, "K": 65536, "D": 64, "B": 1, "dtype": "fp16", "BLOCK_N": 64, "BLOCK_K": 64, "num_warps": 8, "num_stages": 2, "time_ms": 8.935423851013184, "status": "ok"}
{"N": 65536, "K": 65536, "D": 64, "B": 1, "dtype": "fp16", "BLOCK_N": 64, "BLOCK_K": 64, "num_warps": 8, "num_stages": 4, "time_ms": 9.61843204498291, "status": "ok"}
{"N": 65536, "K": 65536, "D": 64, "B": 1, "dtype": "fp16", "BLOCK_N": 64, "BLOCK_K": 128, "num_warps": 4, "num_stages": 1, "time_ms": 9.253888130187988, "status": "ok"}
{"N": 65536, "K": 65536, "D": 64, "B": 1, "dtype": "fp16", "BLOCK_N": 64, "BLOCK_K": 128, "num_warps": 4, "num_stages": 2, "time_ms": 8.73574447631836, "status": "ok"}
{"N": 65536, "K": 65536, "D": 64, "B": 1, "dtype": "fp16", "BLOCK_N": 64, "BLOCK_K": 128, "num_warps": 4, "num_stages": 4, "time_ms": 9.243647575378418, "status": "ok"}
{"N": 65536, "K": 65536, "D": 64, "B": 1, "dtype": "fp16", "BLOCK_N": 64, "BLOCK_K": 128, "num_warps": 8, "num_stages": 1, "time_ms": 9.995264053344727, "status": "ok"}
{"N": 65536, "K": 65536, "D": 64, "B": 1, "dtype": "fp16", "BLOCK_N": 64, "BLOCK_K": 128, "num_warps": 8, "num_stages": 2, "time_ms": 9.176063537597656, "status": "ok"}
{"N": 65536, "K": 65536, "D": 64, "B": 1, "dtype": "fp16", "BLOCK_N": 64, "BLOCK_K": 128, "num_warps": 8, "num_stages": 4, "time_ms": 8.454143524169922, "status": "ok"}
{"N": 65536, "K": 65536, "D": 64, "B": 1, "dtype": "fp16", "BLOCK_N": 128, "BLOCK_K": 32, "num_warps": 4, "num_stages": 1, "time_ms": 7.119872093200684, "status": "ok"}
{"N": 65536, "K": 65536, "D": 64, "B": 1, "dtype": "fp16", "BLOCK_N": 128, "BLOCK_K": 32, "num_warps": 4, "num_stages": 2, "time_ms": 6.594560146331787, "status": "ok"}
{"N": 65536, "K": 65536, "D": 64, "B": 1, "dtype": "fp16", "BLOCK_N": 128, "BLOCK_K": 32, "num_warps": 4, "num_stages": 4, "time_ms": 6.907904148101807, "status": "ok"}
{"N": 65536, "K": 65536, "D": 64, "B": 1, "dtype": "fp16", "BLOCK_N": 128, "BLOCK_K": 32, "num_warps": 8, "num_stages": 1, "time_ms": 11.311103820800781, "status": "ok"}
{"N": 65536, "K": 65536, "D": 64, "B": 1, "dtype": "fp16", "BLOCK_N": 128, "BLOCK_K": 32, "num_warps": 8, "num_stages": 2, "time_ms": 10.82367992401123, "status": "ok"}
{"N": 65536, "K": 65536, "D": 64, "B": 1, "dtype": "fp16", "BLOCK_N": 128, "BLOCK_K": 32, "num_warps": 8, "num_stages": 4, "time_ms": 10.099712371826172, "status": "ok"}
{"N": 65536, "K": 65536, "D": 64, "B": 1, "dtype": "fp16", "BLOCK_N": 128, "BLOCK_K": 64, "num_warps": 4, "num_stages": 1, "time_ms": 8.129535675048828, "status": "ok"}
{"N": 65536, "K": 65536, "D": 64, "B": 1, "dtype": "fp16", "BLOCK_N": 128, "BLOCK_K": 64, "num_warps": 4, "num_stages": 2, "time_ms": 6.900735855102539, "status": "ok"}
{"N": 65536, "K": 65536, "D": 64, "B": 1, "dtype": "fp16", "BLOCK_N": 128, "BLOCK_K": 64, "num_warps": 4, "num_stages": 4, "time_ms": 6.6170878410339355, "status": "ok"}
{"N": 65536, "K": 65536, "D": 64, "B": 1, "dtype": "fp16", "BLOCK_N": 128, "BLOCK_K": 64, "num_warps": 8, "num_stages": 1, "time_ms": 8.249343872070312, "status": "ok"}
{"N": 65536, "K": 65536, "D": 64, "B": 1, "dtype": "fp16", "BLOCK_N": 128, "BLOCK_K": 64, "num_warps": 8, "num_stages": 2, "time_ms": 8.920063972473145, "status": "ok"}
{"N": 65536, "K": 65536, "D": 64, "B": 1, "dtype": "fp16", "BLOCK_N": 128, "BLOCK_K": 64, "num_warps": 8, "num_stages": 4, "time_ms": 8.639488220214844, "status": "ok"}
{"N": 65536, "K": 65536, "D": 64, "B": 1, "dtype": "fp16", "BLOCK_N": 128, "BLOCK_K": 128, "num_warps": 4, "num_stages": 1, "time_ms": 8.572928428649902, "status": "ok"}
{"N": 65536, "K": 65536, "D": 64, "B": 1, "dtype": "fp16", "BLOCK_N": 128, "BLOCK_K": 128, "num_warps": 4, "num_stages": 2, "time_ms": 7.956480026245117, "status": "ok"}
{"N": 65536, "K": 65536, "D": 64, "B": 1, "dtype": "fp16", "BLOCK_N": 128, "BLOCK_K": 128, "num_warps": 4, "num_stages": 4, "time_ms": 7.8008317947387695, "status": "ok"}
{"N": 65536, "K": 65536, "D": 64, "B": 1, "dtype": "fp16", "BLOCK_N": 128, "BLOCK_K": 128, "num_warps": 8, "num_stages": 1, "time_ms": 11.204607963562012, "status": "ok"}
{"N": 65536, "K": 65536, "D": 64, "B": 1, "dtype": "fp16", "BLOCK_N": 128, "BLOCK_K": 128, "num_warps": 8, "num_stages": 2, "time_ms": 10.505215644836426, "status": "ok"}
{"N": 65536, "K": 65536, "D": 64, "B": 1, "dtype": "fp16", "BLOCK_N": 128, "BLOCK_K": 128, "num_warps": 8, "num_stages": 4, "time_ms": 9.011199951171875, "status": "ok"}
{"summary": true, "N": 65536, "K": 65536, "D": 64, "B": 1, "dtype": "fp16", "best": {"N": 65536, "K": 65536, "D": 64, "B": 1, "dtype": "fp16", "BLOCK_N": 64, "BLOCK_K": 64, "num_warps": 4, "num_stages": 4, "time_ms": 5.988351821899414, "status": "ok"}, "best_time_ms": 5.988351821899414, "tuning_seconds": 19.224549531936646, "skipped": 0}
