grid_results_a100/N65536_K65536_D128_B1_fp16.jsonl
{"N": 65536, "K": 65536, "D": 128, "B": 1, "dtype": "fp16", "BLOCK_N": 32, "BLOCK_K": 32, "num_warps": 4, "num_stages": 1, "time_ms": 21.644287109375, "status": "ok"}
{"N": 65536, "K": 65536, "D": 128, "B": 1, "dtype": "fp16", "BLOCK_N": 32, "BLOCK_K": 32, "num_warps": 4, "num_stages": 2, "time_ms": 13.926400184631348, "status": "ok"}
{"N": 65536, "K": 65536, "D": 128, "B": 1, "dtype": "fp16", "BLOCK_N": 32, "BLOCK_K": 32, "num_warps": 4, "num_stages": 4, "time_ms": 14.07795238494873, "status": "ok"}
{"N": 65536, "K": 65536, "D": 128, "B": 1, "dtype": "fp16", "BLOCK_N": 32, "BLOCK_K": 32, "num_warps": 8, "num_stages": 1, "time_ms": 24.654848098754883, "status": "ok"}
{"N": 65536, "K": 65536, "D": 128, "B": 1, "dtype": "fp16", "BLOCK_N": 32, "BLOCK_K": 32, "num_warps": 8, "num_stages": 2, "time_ms": 22.589439392089844, "status": "ok"}
{"N": 65536, "K": 65536, "D": 128, "B": 1, "dtype": "fp16", "BLOCK_N": 32, "BLOCK_K": 32, "num_warps": 8, "num_stages": 4, "time_ms": 22.341632843017578, "status": "ok"}
{"N": 65536, "K": 65536, "D": 128, "B": 1, "dtype": "fp16", "BLOCK_N": 32, "BLOCK_K": 64, "num_warps": 4, "num_stages": 1, "time_ms": 14.369791984558105, "status": "ok"}
{"N": 65536, "K": 65536, "D": 128, "B": 1, "dtype": "fp16", "BLOCK_N": 32, "BLOCK_K": 64, "num_warps": 4, "num_stages": 2, "time_ms": 11.394047737121582, "status": "ok"}
{"N": 65536, "K": 65536, "D": 128, "B": 1, "dtype": "fp16", "BLOCK_N": 32, "BLOCK_K": 64, "num_warps": 4, "num_stages": 4, "time_ms": 13.330431938171387, "status": "ok"}
{"N": 65536, "K": 65536, "D": 128, "B": 1, "dtype": "fp16", "BLOCK_N": 32, "BLOCK_K": 64, "num_warps": 8, "num_stages": 1, "time_ms": 17.685504913330078, "status": "ok"}
{"N": 65536, "K": 65536, "D": 128, "B": 1, "dtype": "fp16", "BLOCK_N": 32, "BLOCK_K": 64, "num_warps": 8, "num_stages": 2, "time_ms": 14.429183959960938, "status": "ok"}
{"N": 65536, "K": 65536, "D": 128, "B": 1, "dtype": "fp16", "BLOCK_N": 32, "BLOCK_K": 64, "num_warps": 8, "num_stages": 4, "time_ms": 16.433151245117188, "status": "ok"}
{"N": 65536, "K": 65536, "D": 128, "B": 1, "dtype": "fp16", "BLOCK_N": 32, "BLOCK_K": 128, "num_warps": 4, "num_stages": 1, "time_ms": 12.256256103515625, "status": "ok"}
{"N": 65536, "K": 65536, "D": 128, "B": 1, "dtype": "fp16", "BLOCK_N": 32, "BLOCK_K": 128, "num_warps": 4, "num_stages": 2, "time_ms": 11.142144203186035, "status": "ok"}
{"N": 65536, "K": 65536, "D": 128, "B": 1, "dtype": "fp16", "BLOCK_N": 32, "BLOCK_K": 128, "num_warps": 4, "num_stages": 4, "time_ms": 15.673343658447266, "status": "ok"}
{"N": 65536, "K": 65536, "D": 128, "B": 1, "dtype": "fp16", "BLOCK_N": 32, "BLOCK_K": 128, "num_warps": 8, "num_stages": 1, "time_ms": 15.751168251037598, "status": "ok"}
{"N": 65536, "K": 65536, "D": 128, "B": 1, "dtype": "fp16", "BLOCK_N": 32, "BLOCK_K": 128, "num_warps": 8, "num_stages": 2, "time_ms": 13.063167572021484, "status": "ok"}
{"N": 65536, "K": 65536, "D": 128, "B": 1, "dtype": "fp16", "BLOCK_N": 32, "BLOCK_K": 128, "num_warps": 8, "num_stages": 4, "time_ms": 17.778688430786133, "status": "ok"}
{"N": 65536, "K": 65536, "D": 128, "B": 1, "dtype": "fp16", "BLOCK_N": 64, "BLOCK_K": 32, "num_warps": 4, "num_stages": 1, "time_ms": 12.45798397064209, "status": "ok"}
{"N": 65536, "K": 65536, "D": 128, "B": 1, "dtype": "fp16", "BLOCK_N": 64, "BLOCK_K": 32, "num_warps": 4, "num_stages": 2, "time_ms": 10.895359992980957, "status": "ok"}
{"N": 65536, "K": 65536, "D": 128, "B": 1, "dtype": "fp16", "BLOCK_N": 64, "BLOCK_K": 32, "num_warps": 4, "num_stages": 4, "time_ms": 11.8538236618042, "status": "ok"}
{"N": 65536, "K": 65536, "D": 128, "B": 1, "dtype": "fp16", "BLOCK_N": 64, "BLOCK_K": 32, "num_warps": 8, "num_stages": 1, "time_ms": 16.368640899658203, "status": "ok"}
{"N": 65536, "K": 65536, "D": 128, "B": 1, "dtype": "fp16", "BLOCK_N": 64, "BLOCK_K": 32, "num_warps": 8, "num_stages": 2, "time_ms": 14.078975677490234, "status": "ok"}
{"N": 65536, "K": 65536, "D": 128, "B": 1, "dtype": "fp16", "BLOCK_N": 64, "BLOCK_K": 32, "num_warps": 8, "num_stages": 4, "time_ms": 14.287872314453125, "status": "ok"}
{"N": 65536, "K": 65536, "D": 128, "B": 1, "dtype": "fp16", "BLOCK_N": 64, "BLOCK_K": 64, "num_warps": 4, "num_stages": 1, "time_ms": 9.500672340393066, "status": "ok"}
{"N": 65536, "K": 65536, "D": 128, "B": 1, "dtype": "fp16", "BLOCK_N": 64, "BLOCK_K": 64, "num_warps": 4, "num_stages": 2, "time_ms": 8.293375968933105, "status": "ok"}
{"N": 65536, "K": 65536, "D": 128, "B": 1, "dtype": "fp16", "BLOCK_N": 64, "BLOCK_K": 64, "num_warps": 4, "num_stages": 4, "time_ms": 9.217023849487305, "status": "ok"}
{"N": 65536, "K": 65536, "D": 128, "B": 1, "dtype": "fp16", "BLOCK_N": 64, "BLOCK_K": 64, "num_warps": 8, "num_stages": 1, "time_ms": 12.834815979003906, "status": "ok"}
{"N": 65536, "K": 65536, "D": 128, "B": 1, "dtype": "fp16", "BLOCK_N": 64, "BLOCK_K": 64, "num_warps": 8, "num_stages": 2, "time_ms": 11.702272415161133, "status": "ok"}
{"N": 65536, "K": 65536, "D": 128, "B": 1, "dtype": "fp16", "BLOCK_N": 64, "BLOCK_K": 64, "num_warps": 8, "num_stages": 4, "time_ms": 11.84563159942627, "status": "ok"}
{"N": 65536, "K": 65536, "D": 128, "B": 1, "dtype": "fp16", "BLOCK_N": 64, "BLOCK_K": 128, "num_warps": 4, "num_stages": 1, "time_ms": 9.996288299560547, "status": "ok"}
{"N": 65536, "K": 65536, "D": 128, "B": 1, "dtype": "fp16", "BLOCK_N": 64, "BLOCK_K": 128, "num_warps": 4, "num_stages": 2, "time_ms": 8.768511772155762, "status": "ok"}
{"N": 65536, "K": 65536, "D": 128, "B": 1, "dtype": "fp16", "BLOCK_N": 64, "BLOCK_K": 128, "num_warps": 4, "num_stages": 4, "time_ms": 13.86188793182373, "status": "ok"}
{"N": 65536, "K": 65536, "D": 128, "B": 1, "dtype": "fp16", "BLOCK_N": 64, "BLOCK_K": 128, "num_warps": 8, "num_stages": 1, "time_ms": 10.421248435974121, "status": "ok"}
{"N": 65536, "K": 65536, "D": 128, "B": 1, "dtype": "fp16", "BLOCK_N": 64, "BLOCK_K": 128, "num_warps": 8, "num_stages": 2, "time_ms": 9.371647834777832, "status": "ok"}
{"N": 65536, "K": 65536, "D": 128, "B": 1, "dtype": "fp16", "BLOCK_N": 64, "BLOCK_K": 128, "num_warps": 8, "num_stages": 4, "time_ms": 11.908096313476562, "status": "ok"}
{"N": 65536, "K": 65536, "D": 128, "B": 1, "dtype": "fp16", "BLOCK_N": 128, "BLOCK_K": 32, "num_warps": 4, "num_stages": 1, "time_ms": 8.548352241516113, "status": "ok"}
{"N": 65536, "K": 65536, "D": 128, "B": 1, "dtype": "fp16", "BLOCK_N": 128, "BLOCK_K": 32, "num_warps": 4, "num_stages": 2, "time_ms": 9.217023849487305, "status": "ok"}
{"N": 65536, "K": 65536, "D": 128, "B": 1, "dtype": "fp16", "BLOCK_N": 128, "BLOCK_K": 32, "num_warps": 4, "num_stages": 4, "time_ms": 8.0250883102417, "status": "ok"}
{"N": 65536, "K": 65536, "D": 128, "B": 1, "dtype": "fp16", "BLOCK_N": 128, "BLOCK_K": 32, "num_warps": 8, "num_stages": 1, "time_ms": 13.022208213806152, "status": "ok"}
{"N": 65536, "K": 65536, "D": 128, "B": 1, "dtype": "fp16", "BLOCK_N": 128, "BLOCK_K": 32, "num_warps": 8, "num_stages": 2, "time_ms": 11.143168449401855, "status": "ok"}
{"N": 65536, "K": 65536, "D": 128, "B": 1, "dtype": "fp16", "BLOCK_N": 128, "BLOCK_K": 32, "num_warps": 8, "num_stages": 4, "time_ms": 11.776000022888184, "status": "ok"}
{"N": 65536, "K": 65536, "D": 128, "B": 1, "dtype": "fp16", "BLOCK_N": 128, "BLOCK_K": 64, "num_warps": 4, "num_stages": 1, "time_ms": 9.867263793945312, "status": "ok"}
{"N": 65536, "K": 65536, "D": 128, "B": 1, "dtype": "fp16", "BLOCK_N": 128, "BLOCK_K": 64, "num_warps": 4, "num_stages": 2, "time_ms": 7.457791805267334, "status": "ok"}
{"N": 65536, "K": 65536, "D": 128, "B": 1, "dtype": "fp16", "BLOCK_N": 128, "BLOCK_K": 64, "num_warps": 4, "num_stages": 4, "time_ms": 10.665984153747559, "status": "ok"}
{"N": 65536, "K": 65536, "D": 128, "B": 1, "dtype": "fp16", "BLOCK_N": 128, "BLOCK_K": 64, "num_warps": 8, "num_stages": 1, "time_ms": 10.914815902709961, "status": "ok"}
{"N": 65536, "K": 65536, "D": 128, "B": 1, "dtype": "fp16", "BLOCK_N": 128, "BLOCK_K": 64, "num_warps": 8, "num_stages": 2, "time_ms": 9.240575790405273, "status": "ok"}
{"N": 65536, "K": 65536, "D": 128, "B": 1, "dtype": "fp16", "BLOCK_N": 128, "BLOCK_K": 64, "num_warps": 8, "num_stages": 4, "time_ms": 10.277888298034668, "status": "ok"}
{"N": 65536, "K": 65536, "D": 128, "B": 1, "dtype": "fp16", "BLOCK_N": 128, "BLOCK_K": 128, "num_warps": 4, "num_stages": 1, "time_ms": 10.846207618713379, "status": "ok"}
{"N": 65536, "K": 65536, "D": 128, "B": 1, "dtype": "fp16", "BLOCK_N": 128, "BLOCK_K": 128, "num_warps": 4, "num_stages": 2, "time_ms": 8.481792449951172, "status": "ok"}
{"N": 65536, "K": 65536, "D": 128, "B": 1, "dtype": "fp16", "BLOCK_N": 128, "BLOCK_K": 128, "num_warps": 4, "num_stages": 4, "time_ms": 13.858816146850586, "status": "ok"}
{"N": 65536, "K": 65536, "D": 128, "B": 1, "dtype": "fp16", "BLOCK_N": 128, "BLOCK_K": 128, "num_warps": 8, "num_stages": 1, "time_ms": 15.069184303283691, "status": "ok"}
{"N": 65536, "K": 65536, "D": 128, "B": 1, "dtype": "fp16", "BLOCK_N": 128, "BLOCK_K": 128, "num_warps": 8, "num_stages": 2, "time_ms": 13.880319595336914, "status": "ok"}
{"N": 65536, "K": 65536, "D": 128, "B": 1, "dtype": "fp16", "BLOCK_N": 128, "BLOCK_K": 128, "num_warps": 8, "num_stages": 4, "time_ms": 11.94803237915039, "status": "ok"}
{"summary": true, "N": 65536, "K": 65536, "D": 128, "B": 1, "dtype": "fp16", "best": {"N": 65536, "K": 65536, "D": 128, "B": 1, "dtype": "fp16", "BLOCK_N": 128, "BLOCK_K": 64, "num_warps": 4, "num_stages": 2, "time_ms": 7.457791805267334, "status": "ok"}, "best_time_ms": 7.457791805267334, "tuning_seconds": 23.63605833053589, "skipped": 0}
