grid_results_a100/N65536_K16384_D128_B1_fp16.jsonl
{"N": 65536, "K": 16384, "D": 128, "B": 1, "dtype": "fp16", "BLOCK_N": 32, "BLOCK_K": 32, "num_warps": 4, "num_stages": 1, "time_ms": 5.430272102355957, "status": "ok"}
{"N": 65536, "K": 16384, "D": 128, "B": 1, "dtype": "fp16", "BLOCK_N": 32, "BLOCK_K": 32, "num_warps": 4, "num_stages": 2, "time_ms": 4.582399845123291, "status": "ok"}
{"N": 65536, "K": 16384, "D": 128, "B": 1, "dtype": "fp16", "BLOCK_N": 32, "BLOCK_K": 32, "num_warps": 4, "num_stages": 4, "time_ms": 4.545536041259766, "status": "ok"}
{"N": 65536, "K": 16384, "D": 128, "B": 1, "dtype": "fp16", "BLOCK_N": 32, "BLOCK_K": 32, "num_warps": 8, "num_stages": 1, "time_ms": 7.9134721755981445, "status": "ok"}
{"N": 65536, "K": 16384, "D": 128, "B": 1, "dtype": "fp16", "BLOCK_N": 32, "BLOCK_K": 32, "num_warps": 8, "num_stages": 2, "time_ms": 7.229440212249756, "status": "ok"}
{"N": 65536, "K": 16384, "D": 128, "B": 1, "dtype": "fp16", "BLOCK_N": 32, "BLOCK_K": 32, "num_warps": 8, "num_stages": 4, "time_ms": 7.163904190063477, "status": "ok"}
{"N": 65536, "K": 16384, "D": 128, "B": 1, "dtype": "fp16", "BLOCK_N": 32, "BLOCK_K": 64, "num_warps": 4, "num_stages": 1, "time_ms": 4.631552219390869, "status": "ok"}
{"N": 65536, "K": 16384, "D": 128, "B": 1, "dtype": "fp16", "BLOCK_N": 32, "BLOCK_K": 64, "num_warps": 4, "num_stages": 2, "time_ms": 3.7130239009857178, "status": "ok"}
{"N": 65536, "K": 16384, "D": 128, "B": 1, "dtype": "fp16", "BLOCK_N": 32, "BLOCK_K": 64, "num_warps": 4, "num_stages": 4, "time_ms": 4.276224136352539, "status": "ok"}
{"N": 65536, "K": 16384, "D": 128, "B": 1, "dtype": "fp16", "BLOCK_N": 32, "BLOCK_K": 64, "num_warps": 8, "num_stages": 1, "time_ms": 5.625855922698975, "status": "ok"}
{"N": 65536, "K": 16384, "D": 128, "B": 1, "dtype": "fp16", "BLOCK_N": 32, "BLOCK_K": 64, "num_warps": 8, "num_stages": 2, "time_ms": 4.631552219390869, "status": "ok"}
{"N": 65536, "K": 16384, "D": 128, "B": 1, "dtype": "fp16", "BLOCK_N": 32, "BLOCK_K": 64, "num_warps": 8, "num_stages": 4, "time_ms": 5.194752216339111, "status": "ok"}
{"N": 65536, "K": 16384, "D": 128, "B": 1, "dtype": "fp16", "BLOCK_N": 32, "BLOCK_K": 128, "num_warps": 4, "num_stages": 1, "time_ms": 3.960832118988037, "status": "ok"}
{"N": 65536, "K": 16384, "D": 128, "B": 1, "dtype": "fp16", "BLOCK_N": 32, "BLOCK_K": 128, "num_warps": 4, "num_stages": 2, "time_ms": 3.571712017059326, "status": "ok"}
{"N": 65536, "K": 16384, "D": 128, "B": 1, "dtype": "fp16", "BLOCK_N": 32, "BLOCK_K": 128, "num_warps": 4, "num_stages": 4, "time_ms": 5.040128231048584, "status": "ok"}
{"N": 65536, "K": 16384, "D": 128, "B": 1, "dtype": "fp16", "BLOCK_N": 32, "BLOCK_K": 128, "num_warps": 8, "num_stages": 1, "time_ms": 5.075967788696289, "status": "ok"}
{"N": 65536, "K": 16384, "D": 128, "B": 1, "dtype": "fp16", "BLOCK_N": 32, "BLOCK_K": 128, "num_warps": 8, "num_stages": 2, "time_ms": 4.21068811416626, "status": "ok"}
{"N": 65536, "K": 16384, "D": 128, "B": 1, "dtype": "fp16", "BLOCK_N": 32, "BLOCK_K": 128, "num_warps": 8, "num_stages": 4, "time_ms": 5.723135948181152, "status": "ok"}
{"N": 65536, "K": 16384, "D": 128, "B": 1, "dtype": "fp16", "BLOCK_N": 64, "BLOCK_K": 32, "num_warps": 4, "num_stages": 1, "time_ms": 4.015103816986084, "status": "ok"}
{"N": 65536, "K": 16384, "D": 128, "B": 1, "dtype": "fp16", "BLOCK_N": 64, "BLOCK_K": 32, "num_warps": 4, "num_stages": 2, "time_ms": 3.5041279792785645, "status": "ok"}
{"N": 65536, "K": 16384, "D": 128, "B": 1, "dtype": "fp16", "BLOCK_N": 64, "BLOCK_K": 32, "num_warps": 4, "num_stages": 4, "time_ms": 3.827712059020996, "status": "ok"}
{"N": 65536, "K": 16384, "D": 128, "B": 1, "dtype": "fp16", "BLOCK_N": 64, "BLOCK_K": 32, "num_warps": 8, "num_stages": 1, "time_ms": 5.236735820770264, "status": "ok"}
{"N": 65536, "K": 16384, "D": 128, "B": 1, "dtype": "fp16", "BLOCK_N": 64, "BLOCK_K": 32, "num_warps": 8, "num_stages": 2, "time_ms": 4.497407913208008, "status": "ok"}
{"N": 65536, "K": 16384, "D": 128, "B": 1, "dtype": "fp16", "BLOCK_N": 64, "BLOCK_K": 32, "num_warps": 8, "num_stages": 4, "time_ms": 4.61516809463501, "status": "ok"}
{"N": 65536, "K": 16384, "D": 128, "B": 1, "dtype": "fp16", "BLOCK_N": 64, "BLOCK_K": 64, "num_warps": 4, "num_stages": 1, "time_ms": 3.053567886352539, "status": "ok"}
{"N": 65536, "K": 16384, "D": 128, "B": 1, "dtype": "fp16", "BLOCK_N": 64, "BLOCK_K": 64, "num_warps": 4, "num_stages": 2, "time_ms": 2.624511957168579, "status": "ok"}
{"N": 65536, "K": 16384, "D": 128, "B": 1, "dtype": "fp16", "BLOCK_N": 64, "BLOCK_K": 64, "num_warps": 4, "num_stages": 4, "time_ms": 2.982912063598633, "status": "ok"}
{"N": 65536, "K": 16384, "D": 128, "B": 1, "dtype": "fp16", "BLOCK_N": 64, "BLOCK_K": 64, "num_warps": 8, "num_stages": 1, "time_ms": 4.1308159828186035, "status": "ok"}
{"N": 65536, "K": 16384, "D": 128, "B": 1, "dtype": "fp16", "BLOCK_N": 64, "BLOCK_K": 64, "num_warps": 8, "num_stages": 2, "time_ms": 3.764224052429199, "status": "ok"}
{"N": 65536, "K": 16384, "D": 128, "B": 1, "dtype": "fp16", "BLOCK_N": 64, "BLOCK_K": 64, "num_warps": 8, "num_stages": 4, "time_ms": 3.8297600746154785, "status": "ok"}
{"N": 65536, "K": 16384, "D": 128, "B": 1, "dtype": "fp16", "BLOCK_N": 64, "BLOCK_K": 128, "num_warps": 4, "num_stages": 1, "time_ms": 3.2286720275878906, "status": "ok"}
{"N": 65536, "K": 16384, "D": 128, "B": 1, "dtype": "fp16", "BLOCK_N": 64, "BLOCK_K": 128, "num_warps": 4, "num_stages": 2, "time_ms": 2.8149759769439697, "status": "ok"}
{"N": 65536, "K": 16384, "D": 128, "B": 1, "dtype": "fp16", "BLOCK_N": 64, "BLOCK_K": 128, "num_warps": 4, "num_stages": 4, "time_ms": 4.463615894317627, "status": "ok"}
{"N": 65536, "K": 16384, "D": 128, "B": 1, "dtype": "fp16", "BLOCK_N": 64, "BLOCK_K": 128, "num_warps": 8, "num_stages": 1, "time_ms": 3.339263916015625, "status": "ok"}
{"N": 65536, "K": 16384, "D": 128, "B": 1, "dtype": "fp16", "BLOCK_N": 64, "BLOCK_K": 128, "num_warps": 8, "num_stages": 2, "time_ms": 3.033087968826294, "status": "ok"}
{"N": 65536, "K": 16384, "D": 128, "B": 1, "dtype": "fp16", "BLOCK_N": 64, "BLOCK_K": 128, "num_warps": 8, "num_stages": 4, "time_ms": 3.490816116333008, "status": "ok"}
{"N": 65536, "K": 16384, "D": 128, "B": 1, "dtype": "fp16", "BLOCK_N": 128, "BLOCK_K": 32, "num_warps": 4, "num_stages": 1, "time_ms": 2.4842240810394287, "status": "ok"}
{"N": 65536, "K": 16384, "D": 128, "B": 1, "dtype": "fp16", "BLOCK_N": 128, "BLOCK_K": 32, "num_warps": 4, "num_stages": 2, "time_ms": 2.7156479358673096, "status": "ok"}
{"N": 65536, "K": 16384, "D": 128, "B": 1, "dtype": "fp16", "BLOCK_N": 128, "BLOCK_K": 32, "num_warps": 4, "num_stages": 4, "time_ms": 2.969599962234497, "status": "ok"}
{"N": 65536, "K": 16384, "D": 128, "B": 1, "dtype": "fp16", "BLOCK_N": 128, "BLOCK_K": 32, "num_warps": 8, "num_stages": 1, "time_ms": 3.8062078952789307, "status": "ok"}
{"N": 65536, "K": 16384, "D": 128, "B": 1, "dtype": "fp16", "BLOCK_N": 128, "BLOCK_K": 32, "num_warps": 8, "num_stages": 2, "time_ms": 3.5880959033966064, "status": "ok"}
{"N": 65536, "K": 16384, "D": 128, "B": 1, "dtype": "fp16", "BLOCK_N": 128, "BLOCK_K": 32, "num_warps": 8, "num_stages": 4, "time_ms": 3.8041601181030273, "status": "ok"}
{"N": 65536, "K": 16384, "D": 128, "B": 1, "dtype": "fp16", "BLOCK_N": 128, "BLOCK_K": 64, "num_warps": 4, "num_stages": 1, "time_ms": 3.44268798828125, "status": "ok"}
{"N": 65536, "K": 16384, "D": 128, "B": 1, "dtype": "fp16", "BLOCK_N": 128, "BLOCK_K": 64, "num_warps": 4, "num_stages": 2, "time_ms": 2.456576108932495, "status": "ok"}
{"N": 65536, "K": 16384, "D": 128, "B": 1, "dtype": "fp16", "BLOCK_N": 128, "BLOCK_K": 64, "num_warps": 4, "num_stages": 4, "time_ms": 3.3853440284729004, "status": "ok"}
{"N": 65536, "K": 16384, "D": 128, "B": 1, "dtype": "fp16", "BLOCK_N": 128, "BLOCK_K": 64, "num_warps": 8, "num_stages": 1, "time_ms": 3.1395840644836426, "status": "ok"}
{"N": 65536, "K": 16384, "D": 128, "B": 1, "dtype": "fp16", "BLOCK_N": 128, "BLOCK_K": 64, "num_warps": 8, "num_stages": 2, "time_ms": 2.9818880558013916, "status": "ok"}
{"N": 65536, "K": 16384, "D": 128, "B": 1, "dtype": "fp16", "BLOCK_N": 128, "BLOCK_K": 64, "num_warps": 8, "num_stages": 4, "time_ms": 3.3177599906921387, "status": "ok"}
{"N": 65536, "K": 16384, "D": 128, "B": 1, "dtype": "fp16", "BLOCK_N": 128, "BLOCK_K": 128, "num_warps": 4, "num_stages": 1, "time_ms": 3.487744092941284, "status": "ok"}
{"N": 65536, "K": 16384, "D": 128, "B": 1, "dtype": "fp16", "BLOCK_N": 128, "BLOCK_K": 128, "num_warps": 4, "num_stages": 2, "time_ms": 2.8180480003356934, "status": "ok"}
{"N": 65536, "K": 16384, "D": 128, "B": 1, "dtype": "fp16", "BLOCK_N": 128, "BLOCK_K": 128, "num_warps": 4, "num_stages": 4, "time_ms": 3.4897921085357666, "status": "ok"}
{"N": 65536, "K": 16384, "D": 128, "B": 1, "dtype": "fp16", "BLOCK_N": 128, "BLOCK_K": 128, "num_warps": 8, "num_stages": 1, "time_ms": 3.7744638919830322, "status": "ok"}
{"N": 65536, "K": 16384, "D": 128, "B": 1, "dtype": "fp16", "BLOCK_N": 128, "BLOCK_K": 128, "num_warps": 8, "num_stages": 2, "time_ms": 3.486720085144043, "status": "ok"}
{"N": 65536, "K": 16384, "D": 128, "B": 1, "dtype": "fp16", "BLOCK_N": 128, "BLOCK_K": 128, "num_warps": 8, "num_stages": 4, "time_ms": 3.012608051300049, "status": "ok"}
{"summary": true, "N": 65536, "K": 16384, "D": 128, "B": 1, "dtype": "fp16", "best": {"N": 65536, "K": 16384, "D": 128, "B": 1, "dtype": "fp16", "BLOCK_N": 128, "BLOCK_K": 64, "num_warps": 4, "num_stages": 2, "time_ms": 2.456576108932495, "status": "ok"}, "best_time_ms": 2.456576108932495, "tuning_seconds": 19.955733060836792, "skipped": 0}
