grid_results_a100/N65536_K1024_D64_B1_fp16.jsonl
{"N": 65536, "K": 1024, "D": 64, "B": 1, "dtype": "fp16", "BLOCK_N": 32, "BLOCK_K": 32, "num_warps": 4, "num_stages": 1, "time_ms": 0.23244799673557281, "status": "ok"}
{"N": 65536, "K": 1024, "D": 64, "B": 1, "dtype": "fp16", "BLOCK_N": 32, "BLOCK_K": 32, "num_warps": 4, "num_stages": 2, "time_ms": 0.22510933130979538, "status": "ok"}
{"N": 65536, "K": 1024, "D": 64, "B": 1, "dtype": "fp16", "BLOCK_N": 32, "BLOCK_K": 32, "num_warps": 4, "num_stages": 4, "time_ms": 0.2173440009355545, "status": "ok"}
{"N": 65536, "K": 1024, "D": 64, "B": 1, "dtype": "fp16", "BLOCK_N": 32, "BLOCK_K": 32, "num_warps": 8, "num_stages": 1, "time_ms": 0.3644302255577511, "status": "ok"}
{"N": 65536, "K": 1024, "D": 64, "B": 1, "dtype": "fp16", "BLOCK_N": 32, "BLOCK_K": 32, "num_warps": 8, "num_stages": 2, "time_ms": 0.34975289967324996, "status": "ok"}
{"N": 65536, "K": 1024, "D": 64, "B": 1, "dtype": "fp16", "BLOCK_N": 32, "BLOCK_K": 32, "num_warps": 8, "num_stages": 4, "time_ms": 0.342357337474823, "status": "ok"}
{"N": 65536, "K": 1024, "D": 64, "B": 1, "dtype": "fp16", "BLOCK_N": 32, "BLOCK_K": 64, "num_warps": 4, "num_stages": 1, "time_ms": 0.19999507298836341, "status": "ok"}
{"N": 65536, "K": 1024, "D": 64, "B": 1, "dtype": "fp16", "BLOCK_N": 32, "BLOCK_K": 64, "num_warps": 4, "num_stages": 2, "time_ms": 0.1849501534150197, "status": "ok"}
{"N": 65536, "K": 1024, "D": 64, "B": 1, "dtype": "fp16", "BLOCK_N": 32, "BLOCK_K": 64, "num_warps": 4, "num_stages": 4, "time_ms": 0.1876283081678244, "status": "ok"}
{"N": 65536, "K": 1024, "D": 64, "B": 1, "dtype": "fp16", "BLOCK_N": 32, "BLOCK_K": 64, "num_warps": 8, "num_stages": 1, "time_ms": 0.25804799795150757, "status": "ok"}
{"N": 65536, "K": 1024, "D": 64, "B": 1, "dtype": "fp16", "BLOCK_N": 32, "BLOCK_K": 64, "num_warps": 8, "num_stages": 2, "time_ms": 0.2309119999408722, "status": "ok"}
{"N": 65536, "K": 1024, "D": 64, "B": 1, "dtype": "fp16", "BLOCK_N": 32, "BLOCK_K": 64, "num_warps": 8, "num_stages": 4, "time_ms": 0.22579199820756912, "status": "ok"}
{"N": 65536, "K": 1024, "D": 64, "B": 1, "dtype": "fp16", "BLOCK_N": 32, "BLOCK_K": 128, "num_warps": 4, "num_stages": 1, "time_ms": 0.1679360004408019, "status": "ok"}
{"N": 65536, "K": 1024, "D": 64, "B": 1, "dtype": "fp16", "BLOCK_N": 32, "BLOCK_K": 128, "num_warps": 4, "num_stages": 2, "time_ms": 0.15974399766751698, "status": "ok"}
{"N": 65536, "K": 1024, "D": 64, "B": 1, "dtype": "fp16", "BLOCK_N": 32, "BLOCK_K": 128, "num_warps": 4, "num_stages": 4, "time_ms": 0.17064228866781508, "status": "ok"}
{"N": 65536, "K": 1024, "D": 64, "B": 1, "dtype": "fp16", "BLOCK_N": 32, "BLOCK_K": 128, "num_warps": 8, "num_stages": 1, "time_ms": 0.23074133197466531, "status": "ok"}
{"N": 65536, "K": 1024, "D": 64, "B": 1, "dtype": "fp16", "BLOCK_N": 32, "BLOCK_K": 128, "num_warps": 8, "num_stages": 2, "time_ms": 0.218794667472442, "status": "ok"}
{"N": 65536, "K": 1024, "D": 64, "B": 1, "dtype": "fp16", "BLOCK_N": 32, "BLOCK_K": 128, "num_warps": 8, "num_stages": 4, "time_ms": 0.2321066657702128, "status": "ok"}
{"N": 65536, "K": 1024, "D": 64, "B": 1, "dtype": "fp16", "BLOCK_N": 64, "BLOCK_K": 32, "num_warps": 4, "num_stages": 1, "time_ms": 0.1901489244057582, "status": "ok"}
{"N": 65536, "K": 1024, "D": 64, "B": 1, "dtype": "fp16", "BLOCK_N": 64, "BLOCK_K": 32, "num_warps": 4, "num_stages": 2, "time_ms": 0.17876114057643072, "status": "ok"}
{"N": 65536, "K": 1024, "D": 64, "B": 1, "dtype": "fp16", "BLOCK_N": 64, "BLOCK_K": 32, "num_warps": 4, "num_stages": 4, "time_ms": 0.181247998888676, "status": "ok"}
{"N": 65536, "K": 1024, "D": 64, "B": 1, "dtype": "fp16", "BLOCK_N": 64, "BLOCK_K": 32, "num_warps": 8, "num_stages": 1, "time_ms": 0.226389329880476, "status": "ok"}
{"N": 65536, "K": 1024, "D": 64, "B": 1, "dtype": "fp16", "BLOCK_N": 64, "BLOCK_K": 32, "num_warps": 8, "num_stages": 2, "time_ms": 0.22220799823602042, "status": "ok"}
{"N": 65536, "K": 1024, "D": 64, "B": 1, "dtype": "fp16", "BLOCK_N": 64, "BLOCK_K": 32, "num_warps": 8, "num_stages": 4, "time_ms": 0.21947733064492544, "status": "ok"}
{"N": 65536, "K": 1024, "D": 64, "B": 1, "dtype": "fp16", "BLOCK_N": 64, "BLOCK_K": 64, "num_warps": 4, "num_stages": 1, "time_ms": 0.15011840065320334, "status": "ok"}
{"N": 65536, "K": 1024, "D": 64, "B": 1, "dtype": "fp16", "BLOCK_N": 64, "BLOCK_K": 64, "num_warps": 4, "num_stages": 2, "time_ms": 0.14295039971669515, "status": "ok"}
{"N": 65536, "K": 1024, "D": 64, "B": 1, "dtype": "fp16", "BLOCK_N": 64, "BLOCK_K": 64, "num_warps": 4, "num_stages": 4, "time_ms": 0.1410389333963394, "status": "ok"}
{"N": 65536, "K": 1024, "D": 64, "B": 1, "dtype": "fp16", "BLOCK_N": 64, "BLOCK_K": 64, "num_warps": 8, "num_stages": 1, "time_ms": 0.19763199985027313, "status": "ok"}
{"N": 65536, "K": 1024, "D": 64, "B": 1, "dtype": "fp16", "BLOCK_N": 64, "BLOCK_K": 64, "num_warps": 8, "num_stages": 2, "time_ms": 0.1942449269386438, "status": "ok"}
{"N": 65536, "K": 1024, "D": 64, "B": 1, "dtype": "fp16", "BLOCK_N": 64, "BLOCK_K": 64, "num_warps": 8, "num_stages": 4, "time_ms": 0.19408738613128662, "status": "ok"}
{"N": 65536, "K": 1024, "D": 64, "B": 1, "dtype": "fp16", "BLOCK_N": 64, "BLOCK_K": 128, "num_warps": 4, "num_stages": 1, "time_ms": 0.15930514144045965, "status": "ok"}
{"N": 65536, "K": 1024, "D": 64, "B": 1, "dtype": "fp16", "BLOCK_N": 64, "BLOCK_K": 128, "num_warps": 4, "num_stages": 2, "time_ms": 0.15414613684018452, "status": "ok"}
{"N": 65536, "K": 1024, "D": 64, "B": 1, "dtype": "fp16", "BLOCK_N": 64, "BLOCK_K": 128, "num_warps": 4, "num_stages": 4, "time_ms": 0.1700571466769491, "status": "ok"}
{"N": 65536, "K": 1024, "D": 64, "B": 1, "dtype": "fp16", "BLOCK_N": 64, "BLOCK_K": 128, "num_warps": 8, "num_stages": 1, "time_ms": 0.16786285915545054, "status": "ok"}
{"N": 65536, "K": 1024, "D": 64, "B": 1, "dtype": "fp16", "BLOCK_N": 64, "BLOCK_K": 128, "num_warps": 8, "num_stages": 2, "time_ms": 0.1622308556522642, "status": "ok"}
{"N": 65536, "K": 1024, "D": 64, "B": 1, "dtype": "fp16", "BLOCK_N": 64, "BLOCK_K": 128, "num_warps": 8, "num_stages": 4, "time_ms": 0.15828114109379904, "status": "ok"}
{"N": 65536, "K": 1024, "D": 64, "B": 1, "dtype": "fp16", "BLOCK_N": 128, "BLOCK_K": 32, "num_warps": 4, "num_stages": 1, "time_ms": 0.1422677328189214, "status": "ok"}
{"N": 65536, "K": 1024, "D": 64, "B": 1, "dtype": "fp16", "BLOCK_N": 128, "BLOCK_K": 32, "num_warps": 4, "num_stages": 2, "time_ms": 0.12371199717745185, "status": "ok"}
{"N": 65536, "K": 1024, "D": 64, "B": 1, "dtype": "fp16", "BLOCK_N": 128, "BLOCK_K": 32, "num_warps": 4, "num_stages": 4, "time_ms": 0.1319679981097579, "status": "ok"}
{"N": 65536, "K": 1024, "D": 64, "B": 1, "dtype": "fp16", "BLOCK_N": 128, "BLOCK_K": 32, "num_warps": 8, "num_stages": 1, "time_ms": 0.18928246543957636, "status": "ok"}
{"N": 65536, "K": 1024, "D": 64, "B": 1, "dtype": "fp16", "BLOCK_N": 128, "BLOCK_K": 32, "num_warps": 8, "num_stages": 2, "time_ms": 0.18865230908760658, "status": "ok"}
{"N": 65536, "K": 1024, "D": 64, "B": 1, "dtype": "fp16", "BLOCK_N": 128, "BLOCK_K": 32, "num_warps": 8, "num_stages": 4, "time_ms": 0.18865230679512024, "status": "ok"}
{"N": 65536, "K": 1024, "D": 64, "B": 1, "dtype": "fp16", "BLOCK_N": 128, "BLOCK_K": 64, "num_warps": 4, "num_stages": 1, "time_ms": 0.15667199875627244, "status": "ok"}
{"N": 65536, "K": 1024, "D": 64, "B": 1, "dtype": "fp16", "BLOCK_N": 128, "BLOCK_K": 64, "num_warps": 4, "num_stages": 2, "time_ms": 0.1372842659552892, "status": "ok"}
{"N": 65536, "K": 1024, "D": 64, "B": 1, "dtype": "fp16", "BLOCK_N": 128, "BLOCK_K": 64, "num_warps": 4, "num_stages": 4, "time_ms": 0.1353727986415227, "status": "ok"}
{"N": 65536, "K": 1024, "D": 64, "B": 1, "dtype": "fp16", "BLOCK_N": 128, "BLOCK_K": 64, "num_warps": 8, "num_stages": 1, "time_ms": 0.159231998026371, "status": "ok"}
{"N": 65536, "K": 1024, "D": 64, "B": 1, "dtype": "fp16", "BLOCK_N": 128, "BLOCK_K": 64, "num_warps": 8, "num_stages": 2, "time_ms": 0.15598933001359302, "status": "ok"}
{"N": 65536, "K": 1024, "D": 64, "B": 1, "dtype": "fp16", "BLOCK_N": 128, "BLOCK_K": 64, "num_warps": 8, "num_stages": 4, "time_ms": 0.15435093541940054, "status": "ok"}
{"N": 65536, "K": 1024, "D": 64, "B": 1, "dtype": "fp16", "BLOCK_N": 128, "BLOCK_K": 128, "num_warps": 4, "num_stages": 1, "time_ms": 0.15428266922632852, "status": "ok"}
{"N": 65536, "K": 1024, "D": 64, "B": 1, "dtype": "fp16", "BLOCK_N": 128, "BLOCK_K": 128, "num_warps": 4, "num_stages": 2, "time_ms": 0.13899093170960744, "status": "ok"}
{"N": 65536, "K": 1024, "D": 64, "B": 1, "dtype": "fp16", "BLOCK_N": 128, "BLOCK_K": 128, "num_warps": 4, "num_stages": 4, "time_ms": 0.13974186678727468, "status": "ok"}
{"N": 65536, "K": 1024, "D": 64, "B": 1, "dtype": "fp16", "BLOCK_N": 128, "BLOCK_K": 128, "num_warps": 8, "num_stages": 1, "time_ms": 0.1895975378843454, "status": "ok"}
{"N": 65536, "K": 1024, "D": 64, "B": 1, "dtype": "fp16", "BLOCK_N": 128, "BLOCK_K": 128, "num_warps": 8, "num_stages": 2, "time_ms": 0.18439876689360693, "status": "ok"}
{"N": 65536, "K": 1024, "D": 64, "B": 1, "dtype": "fp16", "BLOCK_N": 128, "BLOCK_K": 128, "num_warps": 8, "num_stages": 4, "time_ms": 0.17027657159737178, "status": "ok"}
{"summary": true, "N": 65536, "K": 1024, "D": 64, "B": 1, "dtype": "fp16", "best": {"N": 65536, "K": 1024, "D": 64, "B": 1, "dtype": "fp16", "BLOCK_N": 128, "BLOCK_K": 32, "num_warps": 4, "num_stages": 2, "time_ms": 0.12371199717745185, "status": "ok"}, "best_time_ms": 0.12371199717745185, "tuning_seconds": 15.377389192581177, "skipped": 0}
