grid_results/N10485760_K16384_D64_B1_fp16.jsonl
{"N": 10485760, "K": 16384, "D": 64, "B": 1, "dtype": "fp16", "BLOCK_N": 32, "BLOCK_K": 32, "num_warps": 4, "num_stages": 1, "time_ms": 268.75665283203125, "status": "ok"}
{"N": 10485760, "K": 16384, "D": 64, "B": 1, "dtype": "fp16", "BLOCK_N": 32, "BLOCK_K": 32, "num_warps": 4, "num_stages": 2, "time_ms": 236.3184051513672, "status": "ok"}
{"N": 10485760, "K": 16384, "D": 64, "B": 1, "dtype": "fp16", "BLOCK_N": 32, "BLOCK_K": 32, "num_warps": 4, "num_stages": 4, "time_ms": 233.6650848388672, "status": "ok"}
{"N": 10485760, "K": 16384, "D": 64, "B": 1, "dtype": "fp16", "BLOCK_N": 32, "BLOCK_K": 32, "num_warps": 8, "num_stages": 1, "time_ms": 429.99798583984375, "status": "ok"}
{"N": 10485760, "K": 16384, "D": 64, "B": 1, "dtype": "fp16", "BLOCK_N": 32, "BLOCK_K": 32, "num_warps": 8, "num_stages": 2, "time_ms": 404.8450012207031, "status": "ok"}
{"N": 10485760, "K": 16384, "D": 64, "B": 1, "dtype": "fp16", "BLOCK_N": 32, "BLOCK_K": 32, "num_warps": 8, "num_stages": 4, "time_ms": 399.8277587890625, "status": "ok"}
{"N": 10485760, "K": 16384, "D": 64, "B": 1, "dtype": "fp16", "BLOCK_N": 32, "BLOCK_K": 64, "num_warps": 4, "num_stages": 1, "time_ms": 227.5025634765625, "status": "ok"}
{"N": 10485760, "K": 16384, "D": 64, "B": 1, "dtype": "fp16", "BLOCK_N": 32, "BLOCK_K": 64, "num_warps": 4, "num_stages": 2, "time_ms": 200.75418090820312, "status": "ok"}
{"N": 10485760, "K": 16384, "D": 64, "B": 1, "dtype": "fp16", "BLOCK_N": 32, "BLOCK_K": 64, "num_warps": 4, "num_stages": 4, "time_ms": 189.0081329345703, "status": "ok"}
{"N": 10485760, "K": 16384, "D": 64, "B": 1, "dtype": "fp16", "BLOCK_N": 32, "BLOCK_K": 64, "num_warps": 8, "num_stages": 1, "time_ms": 279.33160400390625, "status": "ok"}
{"N": 10485760, "K": 16384, "D": 64, "B": 1, "dtype": "fp16", "BLOCK_N": 32, "BLOCK_K": 64, "num_warps": 8, "num_stages": 2, "time_ms": 255.13926696777344, "status": "ok"}
{"N": 10485760, "K": 16384, "D": 64, "B": 1, "dtype": "fp16", "BLOCK_N": 32, "BLOCK_K": 64, "num_warps": 8, "num_stages": 4, "time_ms": 251.08746337890625, "status": "ok"}
{"N": 10485760, "K": 16384, "D": 64, "B": 1, "dtype": "fp16", "BLOCK_N": 32, "BLOCK_K": 128, "num_warps": 4, "num_stages": 1, "time_ms": 177.40086364746094, "status": "ok"}
{"N": 10485760, "K": 16384, "D": 64, "B": 1, "dtype": "fp16", "BLOCK_N": 32, "BLOCK_K": 128, "num_warps": 4, "num_stages": 2, "time_ms": 150.4732208251953, "status": "ok"}
{"N": 10485760, "K": 16384, "D": 64, "B": 1, "dtype": "fp16", "BLOCK_N": 32, "BLOCK_K": 128, "num_warps": 4, "num_stages": 4, "time_ms": 153.3720703125, "status": "ok"}
{"N": 10485760, "K": 16384, "D": 64, "B": 1, "dtype": "fp16", "BLOCK_N": 32, "BLOCK_K": 128, "num_warps": 8, "num_stages": 1, "time_ms": 291.2408752441406, "status": "ok"}
{"N": 10485760, "K": 16384, "D": 64, "B": 1, "dtype": "fp16", "BLOCK_N": 32, "BLOCK_K": 128, "num_warps": 8, "num_stages": 2, "time_ms": 238.536865234375, "status": "ok"}
{"N": 10485760, "K": 16384, "D": 64, "B": 1, "dtype": "fp16", "BLOCK_N": 32, "BLOCK_K": 128, "num_warps": 8, "num_stages": 4, "time_ms": 231.2939453125, "status": "ok"}
{"N": 10485760, "K": 16384, "D": 64, "B": 1, "dtype": "fp16", "BLOCK_N": 64, "BLOCK_K": 32, "num_warps": 4, "num_stages": 1, "time_ms": 104.79670715332031, "status": "ok"}
{"N": 10485760, "K": 16384, "D": 64, "B": 1, "dtype": "fp16", "BLOCK_N": 64, "BLOCK_K": 32, "num_warps": 4, "num_stages": 2, "time_ms": 102.7540512084961, "status": "ok"}
{"N": 10485760, "K": 16384, "D": 64, "B": 1, "dtype": "fp16", "BLOCK_N": 64, "BLOCK_K": 32, "num_warps": 4, "num_stages": 4, "time_ms": 103.82704162597656, "status": "ok"}
{"N": 10485760, "K": 16384, "D": 64, "B": 1, "dtype": "fp16", "BLOCK_N": 64, "BLOCK_K": 32, "num_warps": 8, "num_stages": 1, "time_ms": 215.8414764404297, "status": "ok"}
{"N": 10485760, "K": 16384, "D": 64, "B": 1, "dtype": "fp16", "BLOCK_N": 64, "BLOCK_K": 32, "num_warps": 8, "num_stages": 2, "time_ms": 197.50941467285156, "status": "ok"}
{"N": 10485760, "K": 16384, "D": 64, "B": 1, "dtype": "fp16", "BLOCK_N": 64, "BLOCK_K": 32, "num_warps": 8, "num_stages": 4, "time_ms": 194.24172973632812, "status": "ok"}
{"N": 10485760, "K": 16384, "D": 64, "B": 1, "dtype": "fp16", "BLOCK_N": 64, "BLOCK_K": 64, "num_warps": 4, "num_stages": 1, "time_ms": 99.1363525390625, "status": "ok"}
{"N": 10485760, "K": 16384, "D": 64, "B": 1, "dtype": "fp16", "BLOCK_N": 64, "BLOCK_K": 64, "num_warps": 4, "num_stages": 2, "time_ms": 93.08787536621094, "status": "ok"}
{"N": 10485760, "K": 16384, "D": 64, "B": 1, "dtype": "fp16", "BLOCK_N": 64, "BLOCK_K": 64, "num_warps": 4, "num_stages": 4, "time_ms": 94.09881591796875, "status": "ok"}
{"N": 10485760, "K": 16384, "D": 64, "B": 1, "dtype": "fp16", "BLOCK_N": 64, "BLOCK_K": 64, "num_warps": 8, "num_stages": 1, "time_ms": 151.7696990966797, "status": "ok"}
{"N": 10485760, "K": 16384, "D": 64, "B": 1, "dtype": "fp16", "BLOCK_N": 64, "BLOCK_K": 64, "num_warps": 8, "num_stages": 2, "time_ms": 143.48048400878906, "status": "ok"}
{"N": 10485760, "K": 16384, "D": 64, "B": 1, "dtype": "fp16", "BLOCK_N": 64, "BLOCK_K": 64, "num_warps": 8, "num_stages": 4, "time_ms": 140.44053649902344, "status": "ok"}
{"N": 10485760, "K": 16384, "D": 64, "B": 1, "dtype": "fp16", "BLOCK_N": 64, "BLOCK_K": 128, "num_warps": 4, "num_stages": 1, "time_ms": 93.0379867553711, "status": "ok"}
{"N": 10485760, "K": 16384, "D": 64, "B": 1, "dtype": "fp16", "BLOCK_N": 64, "BLOCK_K": 128, "num_warps": 4, "num_stages": 2, "time_ms": 89.82118225097656, "status": "ok"}
{"N": 10485760, "K": 16384, "D": 64, "B": 1, "dtype": "fp16", "BLOCK_N": 64, "BLOCK_K": 128, "num_warps": 4, "num_stages": 4, "time_ms": 89.95123291015625, "status": "ok"}
{"N": 10485760, "K": 16384, "D": 64, "B": 1, "dtype": "fp16", "BLOCK_N": 64, "BLOCK_K": 128, "num_warps": 8, "num_stages": 1, "time_ms": 156.88621520996094, "status": "ok"}
{"N": 10485760, "K": 16384, "D": 64, "B": 1, "dtype": "fp16", "BLOCK_N": 64, "BLOCK_K": 128, "num_warps": 8, "num_stages": 2, "time_ms": 133.8203582763672, "status": "ok"}
{"N": 10485760, "K": 16384, "D": 64, "B": 1, "dtype": "fp16", "BLOCK_N": 64, "BLOCK_K": 128, "num_warps": 8, "num_stages": 4, "time_ms": 126.13136291503906, "status": "ok"}
{"N": 10485760, "K": 16384, "D": 64, "B": 1, "dtype": "fp16", "BLOCK_N": 128, "BLOCK_K": 32, "num_warps": 4, "num_stages": 1, "time_ms": 103.03292846679688, "status": "ok"}
{"N": 10485760, "K": 16384, "D": 64, "B": 1, "dtype": "fp16", "BLOCK_N": 128, "BLOCK_K": 32, "num_warps": 4, "num_stages": 2, "time_ms": 100.0481948852539, "status": "ok"}
{"N": 10485760, "K": 16384, "D": 64, "B": 1, "dtype": "fp16", "BLOCK_N": 128, "BLOCK_K": 32, "num_warps": 4, "num_stages": 4, "time_ms": 102.62140655517578, "status": "ok"}
{"N": 10485760, "K": 16384, "D": 64, "B": 1, "dtype": "fp16", "BLOCK_N": 128, "BLOCK_K": 32, "num_warps": 8, "num_stages": 1, "time_ms": 108.07536315917969, "status": "ok"}
{"N": 10485760, "K": 16384, "D": 64, "B": 1, "dtype": "fp16", "BLOCK_N": 128, "BLOCK_K": 32, "num_warps": 8, "num_stages": 2, "time_ms": 112.13600158691406, "status": "ok"}
{"N": 10485760, "K": 16384, "D": 64, "B": 1, "dtype": "fp16", "BLOCK_N": 128, "BLOCK_K": 32, "num_warps": 8, "num_stages": 4, "time_ms": 110.26182556152344, "status": "ok"}
{"N": 10485760, "K": 16384, "D": 64, "B": 1, "dtype": "fp16", "BLOCK_N": 128, "BLOCK_K": 64, "num_warps": 4, "num_stages": 1, "time_ms": 98.41490936279297, "status": "ok"}
{"N": 10485760, "K": 16384, "D": 64, "B": 1, "dtype": "fp16", "BLOCK_N": 128, "BLOCK_K": 64, "num_warps": 4, "num_stages": 2, "time_ms": 89.70079803466797, "status": "ok"}
{"N": 10485760, "K": 16384, "D": 64, "B": 1, "dtype": "fp16", "BLOCK_N": 128, "BLOCK_K": 64, "num_warps": 4, "num_stages": 4, "time_ms": 91.26255798339844, "status": "ok"}
{"N": 10485760, "K": 16384, "D": 64, "B": 1, "dtype": "fp16", "BLOCK_N": 128, "BLOCK_K": 64, "num_warps": 8, "num_stages": 1, "time_ms": 101.91776275634766, "status": "ok"}
{"N": 10485760, "K": 16384, "D": 64, "B": 1, "dtype": "fp16", "BLOCK_N": 128, "BLOCK_K": 64, "num_warps": 8, "num_stages": 2, "time_ms": 96.62713623046875, "status": "ok"}
{"N": 10485760, "K": 16384, "D": 64, "B": 1, "dtype": "fp16", "BLOCK_N": 128, "BLOCK_K": 64, "num_warps": 8, "num_stages": 4, "time_ms": 96.8321304321289, "status": "ok"}
{"N": 10485760, "K": 16384, "D": 64, "B": 1, "dtype": "fp16", "BLOCK_N": 128, "BLOCK_K": 128, "num_warps": 4, "num_stages": 1, "time_ms": 105.81830596923828, "status": "ok"}
{"N": 10485760, "K": 16384, "D": 64, "B": 1, "dtype": "fp16", "BLOCK_N": 128, "BLOCK_K": 128, "num_warps": 4, "num_stages": 2, "time_ms": 98.38553619384766, "status": "ok"}
{"N": 10485760, "K": 16384, "D": 64, "B": 1, "dtype": "fp16", "BLOCK_N": 128, "BLOCK_K": 128, "num_warps": 4, "num_stages": 4, "time_ms": 87.64307403564453, "status": "ok"}
{"N": 10485760, "K": 16384, "D": 64, "B": 1, "dtype": "fp16", "BLOCK_N": 128, "BLOCK_K": 128, "num_warps": 8, "num_stages": 1, "time_ms": 136.24131774902344, "status": "ok"}
{"N": 10485760, "K": 16384, "D": 64, "B": 1, "dtype": "fp16", "BLOCK_N": 128, "BLOCK_K": 128, "num_warps": 8, "num_stages": 2, "time_ms": 94.92076873779297, "status": "ok"}
{"N": 10485760, "K": 16384, "D": 64, "B": 1, "dtype": "fp16", "BLOCK_N": 128, "BLOCK_K": 128, "num_warps": 8, "num_stages": 4, "time_ms": 91.87808227539062, "status": "ok"}
{"summary": true, "N": 10485760, "K": 16384, "D": 64, "B": 1, "dtype": "fp16", "best": {"N": 10485760, "K": 16384, "D": 64, "B": 1, "dtype": "fp16", "BLOCK_N": 128, "BLOCK_K": 128, "num_warps": 4, "num_stages": 4, "time_ms": 87.64307403564453, "status": "ok"}, "best_time_ms": 87.64307403564453, "tuning_seconds": 79.98053574562073, "skipped": 0}
