grid_results/N1048576_K256_D128_B32_fp16.jsonl
{"N": 1048576, "K": 256, "D": 128, "B": 32, "dtype": "fp16", "BLOCK_N": 32, "BLOCK_K": 32, "num_warps": 4, "num_stages": 1, "time_ms": 20.898591995239258, "status": "ok"}
{"N": 1048576, "K": 256, "D": 128, "B": 32, "dtype": "fp16", "BLOCK_N": 32, "BLOCK_K": 32, "num_warps": 4, "num_stages": 2, "time_ms": 17.96028709411621, "status": "ok"}
{"N": 1048576, "K": 256, "D": 128, "B": 32, "dtype": "fp16", "BLOCK_N": 32, "BLOCK_K": 32, "num_warps": 4, "num_stages": 4, "time_ms": 18.768672943115234, "status": "ok"}
{"N": 1048576, "K": 256, "D": 128, "B": 32, "dtype": "fp16", "BLOCK_N": 32, "BLOCK_K": 32, "num_warps": 8, "num_stages": 1, "time_ms": 30.98428726196289, "status": "ok"}
{"N": 1048576, "K": 256, "D": 128, "B": 32, "dtype": "fp16", "BLOCK_N": 32, "BLOCK_K": 32, "num_warps": 8, "num_stages": 2, "time_ms": 29.071903228759766, "status": "ok"}
{"N": 1048576, "K": 256, "D": 128, "B": 32, "dtype": "fp16", "BLOCK_N": 32, "BLOCK_K": 32, "num_warps": 8, "num_stages": 4, "time_ms": 29.672576904296875, "status": "ok"}
{"N": 1048576, "K": 256, "D": 128, "B": 32, "dtype": "fp16", "BLOCK_N": 32, "BLOCK_K": 64, "num_warps": 4, "num_stages": 1, "time_ms": 18.072288513183594, "status": "ok"}
{"N": 1048576, "K": 256, "D": 128, "B": 32, "dtype": "fp16", "BLOCK_N": 32, "BLOCK_K": 64, "num_warps": 4, "num_stages": 2, "time_ms": 15.157952308654785, "status": "ok"}
{"N": 1048576, "K": 256, "D": 128, "B": 32, "dtype": "fp16", "BLOCK_N": 32, "BLOCK_K": 64, "num_warps": 4, "num_stages": 4, "time_ms": 18.478912353515625, "status": "ok"}
{"N": 1048576, "K": 256, "D": 128, "B": 32, "dtype": "fp16", "BLOCK_N": 32, "BLOCK_K": 64, "num_warps": 8, "num_stages": 1, "time_ms": 22.048095703125, "status": "ok"}
{"N": 1048576, "K": 256, "D": 128, "B": 32, "dtype": "fp16", "BLOCK_N": 32, "BLOCK_K": 64, "num_warps": 8, "num_stages": 2, "time_ms": 20.93916893005371, "status": "ok"}
{"N": 1048576, "K": 256, "D": 128, "B": 32, "dtype": "fp16", "BLOCK_N": 32, "BLOCK_K": 64, "num_warps": 8, "num_stages": 4, "time_ms": 21.305919647216797, "status": "ok"}
{"N": 1048576, "K": 256, "D": 128, "B": 32, "dtype": "fp16", "BLOCK_N": 32, "BLOCK_K": 128, "num_warps": 4, "num_stages": 1, "time_ms": 14.837568283081055, "status": "ok"}
{"N": 1048576, "K": 256, "D": 128, "B": 32, "dtype": "fp16", "BLOCK_N": 32, "BLOCK_K": 128, "num_warps": 4, "num_stages": 2, "time_ms": 13.2161283493042, "status": "ok"}
{"N": 1048576, "K": 256, "D": 128, "B": 32, "dtype": "fp16", "BLOCK_N": 32, "BLOCK_K": 128, "num_warps": 4, "num_stages": 4, "time_ms": 20.157184600830078, "status": "ok"}
{"N": 1048576, "K": 256, "D": 128, "B": 32, "dtype": "fp16", "BLOCK_N": 32, "BLOCK_K": 128, "num_warps": 8, "num_stages": 1, "time_ms": 20.127967834472656, "status": "ok"}
{"N": 1048576, "K": 256, "D": 128, "B": 32, "dtype": "fp16", "BLOCK_N": 32, "BLOCK_K": 128, "num_warps": 8, "num_stages": 2, "time_ms": 18.8505916595459, "status": "ok"}
{"N": 1048576, "K": 256, "D": 128, "B": 32, "dtype": "fp16", "BLOCK_N": 32, "BLOCK_K": 128, "num_warps": 8, "num_stages": 4, "time_ms": 22.81564712524414, "status": "ok"}
{"N": 1048576, "K": 256, "D": 128, "B": 32, "dtype": "fp16", "BLOCK_N": 64, "BLOCK_K": 32, "num_warps": 4, "num_stages": 1, "time_ms": 8.83407974243164, "status": "ok"}
{"N": 1048576, "K": 256, "D": 128, "B": 32, "dtype": "fp16", "BLOCK_N": 64, "BLOCK_K": 32, "num_warps": 4, "num_stages": 2, "time_ms": 7.731840133666992, "status": "ok"}
{"N": 1048576, "K": 256, "D": 128, "B": 32, "dtype": "fp16", "BLOCK_N": 64, "BLOCK_K": 32, "num_warps": 4, "num_stages": 4, "time_ms": 8.386431694030762, "status": "ok"}
{"N": 1048576, "K": 256, "D": 128, "B": 32, "dtype": "fp16", "BLOCK_N": 64, "BLOCK_K": 32, "num_warps": 8, "num_stages": 1, "time_ms": 15.390303611755371, "status": "ok"}
{"N": 1048576, "K": 256, "D": 128, "B": 32, "dtype": "fp16", "BLOCK_N": 64, "BLOCK_K": 32, "num_warps": 8, "num_stages": 2, "time_ms": 13.957119941711426, "status": "ok"}
{"N": 1048576, "K": 256, "D": 128, "B": 32, "dtype": "fp16", "BLOCK_N": 64, "BLOCK_K": 32, "num_warps": 8, "num_stages": 4, "time_ms": 14.668191909790039, "status": "ok"}
{"N": 1048576, "K": 256, "D": 128, "B": 32, "dtype": "fp16", "BLOCK_N": 64, "BLOCK_K": 64, "num_warps": 4, "num_stages": 1, "time_ms": 7.832320213317871, "status": "ok"}
{"N": 1048576, "K": 256, "D": 128, "B": 32, "dtype": "fp16", "BLOCK_N": 64, "BLOCK_K": 64, "num_warps": 4, "num_stages": 2, "time_ms": 7.05299186706543, "status": "ok"}
{"N": 1048576, "K": 256, "D": 128, "B": 32, "dtype": "fp16", "BLOCK_N": 64, "BLOCK_K": 64, "num_warps": 4, "num_stages": 4, "time_ms": 9.195008277893066, "status": "ok"}
{"N": 1048576, "K": 256, "D": 128, "B": 32, "dtype": "fp16", "BLOCK_N": 64, "BLOCK_K": 64, "num_warps": 8, "num_stages": 1, "time_ms": 10.795904159545898, "status": "ok"}
{"N": 1048576, "K": 256, "D": 128, "B": 32, "dtype": "fp16", "BLOCK_N": 64, "BLOCK_K": 64, "num_warps": 8, "num_stages": 2, "time_ms": 10.436320304870605, "status": "ok"}
{"N": 1048576, "K": 256, "D": 128, "B": 32, "dtype": "fp16", "BLOCK_N": 64, "BLOCK_K": 64, "num_warps": 8, "num_stages": 4, "time_ms": 12.753791809082031, "status": "ok"}
{"N": 1048576, "K": 256, "D": 128, "B": 32, "dtype": "fp16", "BLOCK_N": 64, "BLOCK_K": 128, "num_warps": 4, "num_stages": 1, "time_ms": 7.712031841278076, "status": "ok"}
{"N": 1048576, "K": 256, "D": 128, "B": 32, "dtype": "fp16", "BLOCK_N": 64, "BLOCK_K": 128, "num_warps": 4, "num_stages": 2, "time_ms": 9.251680374145508, "status": "ok"}
{"N": 1048576, "K": 256, "D": 128, "B": 32, "dtype": "fp16", "BLOCK_N": 64, "BLOCK_K": 128, "num_warps": 4, "num_stages": 4, "time_ms": 14.06447982788086, "status": "ok"}
{"N": 1048576, "K": 256, "D": 128, "B": 32, "dtype": "fp16", "BLOCK_N": 64, "BLOCK_K": 128, "num_warps": 8, "num_stages": 1, "time_ms": 10.492575645446777, "status": "ok"}
{"N": 1048576, "K": 256, "D": 128, "B": 32, "dtype": "fp16", "BLOCK_N": 64, "BLOCK_K": 128, "num_warps": 8, "num_stages": 2, "time_ms": 10.31817626953125, "status": "ok"}
{"N": 1048576, "K": 256, "D": 128, "B": 32, "dtype": "fp16", "BLOCK_N": 64, "BLOCK_K": 128, "num_warps": 8, "num_stages": 4, "time_ms": 15.798111915588379, "status": "ok"}
{"N": 1048576, "K": 256, "D": 128, "B": 32, "dtype": "fp16", "BLOCK_N": 128, "BLOCK_K": 32, "num_warps": 4, "num_stages": 1, "time_ms": 7.897791862487793, "status": "ok"}
{"N": 1048576, "K": 256, "D": 128, "B": 32, "dtype": "fp16", "BLOCK_N": 128, "BLOCK_K": 32, "num_warps": 4, "num_stages": 2, "time_ms": 7.861567974090576, "status": "ok"}
{"N": 1048576, "K": 256, "D": 128, "B": 32, "dtype": "fp16", "BLOCK_N": 128, "BLOCK_K": 32, "num_warps": 4, "num_stages": 4, "time_ms": 8.178175926208496, "status": "ok"}
{"N": 1048576, "K": 256, "D": 128, "B": 32, "dtype": "fp16", "BLOCK_N": 128, "BLOCK_K": 32, "num_warps": 8, "num_stages": 1, "time_ms": 7.765024185180664, "status": "ok"}
{"N": 1048576, "K": 256, "D": 128, "B": 32, "dtype": "fp16", "BLOCK_N": 128, "BLOCK_K": 32, "num_warps": 8, "num_stages": 2, "time_ms": 7.663136005401611, "status": "ok"}
{"N": 1048576, "K": 256, "D": 128, "B": 32, "dtype": "fp16", "BLOCK_N": 128, "BLOCK_K": 32, "num_warps": 8, "num_stages": 4, "time_ms": 8.0731840133667, "status": "ok"}
{"N": 1048576, "K": 256, "D": 128, "B": 32, "dtype": "fp16", "BLOCK_N": 128, "BLOCK_K": 64, "num_warps": 4, "num_stages": 1, "time_ms": 6.731103897094727, "status": "ok"}
{"N": 1048576, "K": 256, "D": 128, "B": 32, "dtype": "fp16", "BLOCK_N": 128, "BLOCK_K": 64, "num_warps": 4, "num_stages": 2, "time_ms": 7.0503997802734375, "status": "ok"}
{"N": 1048576, "K": 256, "D": 128, "B": 32, "dtype": "fp16", "BLOCK_N": 128, "BLOCK_K": 64, "num_warps": 4, "num_stages": 4, "time_ms": 7.870207786560059, "status": "ok"}
{"N": 1048576, "K": 256, "D": 128, "B": 32, "dtype": "fp16", "BLOCK_N": 128, "BLOCK_K": 64, "num_warps": 8, "num_stages": 1, "time_ms": 7.0972161293029785, "status": "ok"}
{"N": 1048576, "K": 256, "D": 128, "B": 32, "dtype": "fp16", "BLOCK_N": 128, "BLOCK_K": 64, "num_warps": 8, "num_stages": 2, "time_ms": 7.315008163452148, "status": "ok"}
{"N": 1048576, "K": 256, "D": 128, "B": 32, "dtype": "fp16", "BLOCK_N": 128, "BLOCK_K": 64, "num_warps": 8, "num_stages": 4, "time_ms": 7.441472053527832, "status": "ok"}
{"N": 1048576, "K": 256, "D": 128, "B": 32, "dtype": "fp16", "BLOCK_N": 128, "BLOCK_K": 128, "num_warps": 4, "num_stages": 1, "time_ms": 8.070752143859863, "status": "ok"}
{"N": 1048576, "K": 256, "D": 128, "B": 32, "dtype": "fp16", "BLOCK_N": 128, "BLOCK_K": 128, "num_warps": 4, "num_stages": 2, "time_ms": 7.126495838165283, "status": "ok"}
{"N": 1048576, "K": 256, "D": 128, "B": 32, "dtype": "fp16", "BLOCK_N": 128, "BLOCK_K": 128, "num_warps": 4, "num_stages": 4, "time_ms": 10.762751579284668, "status": "ok"}
{"N": 1048576, "K": 256, "D": 128, "B": 32, "dtype": "fp16", "BLOCK_N": 128, "BLOCK_K": 128, "num_warps": 8, "num_stages": 1, "time_ms": 11.252415657043457, "status": "ok"}
{"N": 1048576, "K": 256, "D": 128, "B": 32, "dtype": "fp16", "BLOCK_N": 128, "BLOCK_K": 128, "num_warps": 8, "num_stages": 2, "time_ms": 10.157055854797363, "status": "ok"}
{"N": 1048576, "K": 256, "D": 128, "B": 32, "dtype": "fp16", "BLOCK_N": 128, "BLOCK_K": 128, "num_warps": 8, "num_stages": 4, "time_ms": 10.319999694824219, "status": "ok"}
{"summary": true, "N": 1048576, "K": 256, "D": 128, "B": 32, "dtype": "fp16", "best": {"N": 1048576, "K": 256, "D": 128, "B": 32, "dtype": "fp16", "BLOCK_N": 128, "BLOCK_K": 64, "num_warps": 4, "num_stages": 1, "time_ms": 6.731103897094727, "status": "ok"}, "best_time_ms": 6.731103897094727, "tuning_seconds": 16.337777853012085, "skipped": 0}
