grid_results/N262144_K4096_D128_B32_fp16.jsonl
{"N": 262144, "K": 4096, "D": 128, "B": 32, "dtype": "fp16", "BLOCK_N": 32, "BLOCK_K": 32, "num_warps": 4, "num_stages": 1, "time_ms": 82.28575897216797, "status": "ok"}
{"N": 262144, "K": 4096, "D": 128, "B": 32, "dtype": "fp16", "BLOCK_N": 32, "BLOCK_K": 32, "num_warps": 4, "num_stages": 2, "time_ms": 66.50819396972656, "status": "ok"}
{"N": 262144, "K": 4096, "D": 128, "B": 32, "dtype": "fp16", "BLOCK_N": 32, "BLOCK_K": 32, "num_warps": 4, "num_stages": 4, "time_ms": 66.81126403808594, "status": "ok"}
{"N": 262144, "K": 4096, "D": 128, "B": 32, "dtype": "fp16", "BLOCK_N": 32, "BLOCK_K": 32, "num_warps": 8, "num_stages": 1, "time_ms": 121.61331176757812, "status": "ok"}
{"N": 262144, "K": 4096, "D": 128, "B": 32, "dtype": "fp16", "BLOCK_N": 32, "BLOCK_K": 32, "num_warps": 8, "num_stages": 2, "time_ms": 110.74403381347656, "status": "ok"}
{"N": 262144, "K": 4096, "D": 128, "B": 32, "dtype": "fp16", "BLOCK_N": 32, "BLOCK_K": 32, "num_warps": 8, "num_stages": 4, "time_ms": 109.19721221923828, "status": "ok"}
{"N": 262144, "K": 4096, "D": 128, "B": 32, "dtype": "fp16", "BLOCK_N": 32, "BLOCK_K": 64, "num_warps": 4, "num_stages": 1, "time_ms": 69.97897338867188, "status": "ok"}
{"N": 262144, "K": 4096, "D": 128, "B": 32, "dtype": "fp16", "BLOCK_N": 32, "BLOCK_K": 64, "num_warps": 4, "num_stages": 2, "time_ms": 54.23215866088867, "status": "ok"}
{"N": 262144, "K": 4096, "D": 128, "B": 32, "dtype": "fp16", "BLOCK_N": 32, "BLOCK_K": 64, "num_warps": 4, "num_stages": 4, "time_ms": 58.355777740478516, "status": "ok"}
{"N": 262144, "K": 4096, "D": 128, "B": 32, "dtype": "fp16", "BLOCK_N": 32, "BLOCK_K": 64, "num_warps": 8, "num_stages": 1, "time_ms": 82.87715148925781, "status": "ok"}
{"N": 262144, "K": 4096, "D": 128, "B": 32, "dtype": "fp16", "BLOCK_N": 32, "BLOCK_K": 64, "num_warps": 8, "num_stages": 2, "time_ms": 71.47293090820312, "status": "ok"}
{"N": 262144, "K": 4096, "D": 128, "B": 32, "dtype": "fp16", "BLOCK_N": 32, "BLOCK_K": 64, "num_warps": 8, "num_stages": 4, "time_ms": 71.6494369506836, "status": "ok"}
{"N": 262144, "K": 4096, "D": 128, "B": 32, "dtype": "fp16", "BLOCK_N": 32, "BLOCK_K": 128, "num_warps": 4, "num_stages": 1, "time_ms": 55.38848114013672, "status": "ok"}
{"N": 262144, "K": 4096, "D": 128, "B": 32, "dtype": "fp16", "BLOCK_N": 32, "BLOCK_K": 128, "num_warps": 4, "num_stages": 2, "time_ms": 43.371551513671875, "status": "ok"}
{"N": 262144, "K": 4096, "D": 128, "B": 32, "dtype": "fp16", "BLOCK_N": 32, "BLOCK_K": 128, "num_warps": 4, "num_stages": 4, "time_ms": 54.75727844238281, "status": "ok"}
{"N": 262144, "K": 4096, "D": 128, "B": 32, "dtype": "fp16", "BLOCK_N": 32, "BLOCK_K": 128, "num_warps": 8, "num_stages": 1, "time_ms": 75.90115356445312, "status": "ok"}
{"N": 262144, "K": 4096, "D": 128, "B": 32, "dtype": "fp16", "BLOCK_N": 32, "BLOCK_K": 128, "num_warps": 8, "num_stages": 2, "time_ms": 64.98809814453125, "status": "ok"}
{"N": 262144, "K": 4096, "D": 128, "B": 32, "dtype": "fp16", "BLOCK_N": 32, "BLOCK_K": 128, "num_warps": 8, "num_stages": 4, "time_ms": 67.63056182861328, "status": "ok"}
{"N": 262144, "K": 4096, "D": 128, "B": 32, "dtype": "fp16", "BLOCK_N": 64, "BLOCK_K": 32, "num_warps": 4, "num_stages": 1, "time_ms": 33.204830169677734, "status": "ok"}
{"N": 262144, "K": 4096, "D": 128, "B": 32, "dtype": "fp16", "BLOCK_N": 64, "BLOCK_K": 32, "num_warps": 4, "num_stages": 2, "time_ms": 28.613727569580078, "status": "ok"}
{"N": 262144, "K": 4096, "D": 128, "B": 32, "dtype": "fp16", "BLOCK_N": 64, "BLOCK_K": 32, "num_warps": 4, "num_stages": 4, "time_ms": 29.7392635345459, "status": "ok"}
{"N": 262144, "K": 4096, "D": 128, "B": 32, "dtype": "fp16", "BLOCK_N": 64, "BLOCK_K": 32, "num_warps": 8, "num_stages": 1, "time_ms": 59.328895568847656, "status": "ok"}
{"N": 262144, "K": 4096, "D": 128, "B": 32, "dtype": "fp16", "BLOCK_N": 64, "BLOCK_K": 32, "num_warps": 8, "num_stages": 2, "time_ms": 51.40185546875, "status": "ok"}
{"N": 262144, "K": 4096, "D": 128, "B": 32, "dtype": "fp16", "BLOCK_N": 64, "BLOCK_K": 32, "num_warps": 8, "num_stages": 4, "time_ms": 51.891265869140625, "status": "ok"}
{"N": 262144, "K": 4096, "D": 128, "B": 32, "dtype": "fp16", "BLOCK_N": 64, "BLOCK_K": 64, "num_warps": 4, "num_stages": 1, "time_ms": 28.18992042541504, "status": "ok"}
{"N": 262144, "K": 4096, "D": 128, "B": 32, "dtype": "fp16", "BLOCK_N": 64, "BLOCK_K": 64, "num_warps": 4, "num_stages": 2, "time_ms": 25.552223205566406, "status": "ok"}
{"N": 262144, "K": 4096, "D": 128, "B": 32, "dtype": "fp16", "BLOCK_N": 64, "BLOCK_K": 64, "num_warps": 4, "num_stages": 4, "time_ms": 26.782304763793945, "status": "ok"}
{"N": 262144, "K": 4096, "D": 128, "B": 32, "dtype": "fp16", "BLOCK_N": 64, "BLOCK_K": 64, "num_warps": 8, "num_stages": 1, "time_ms": 41.160606384277344, "status": "ok"}
{"N": 262144, "K": 4096, "D": 128, "B": 32, "dtype": "fp16", "BLOCK_N": 64, "BLOCK_K": 64, "num_warps": 8, "num_stages": 2, "time_ms": 36.00057601928711, "status": "ok"}
{"N": 262144, "K": 4096, "D": 128, "B": 32, "dtype": "fp16", "BLOCK_N": 64, "BLOCK_K": 64, "num_warps": 8, "num_stages": 4, "time_ms": 41.19807815551758, "status": "ok"}
{"N": 262144, "K": 4096, "D": 128, "B": 32, "dtype": "fp16", "BLOCK_N": 64, "BLOCK_K": 128, "num_warps": 4, "num_stages": 1, "time_ms": 26.369407653808594, "status": "ok"}
{"N": 262144, "K": 4096, "D": 128, "B": 32, "dtype": "fp16", "BLOCK_N": 64, "BLOCK_K": 128, "num_warps": 4, "num_stages": 2, "time_ms": 25.608800888061523, "status": "ok"}
{"N": 262144, "K": 4096, "D": 128, "B": 32, "dtype": "fp16", "BLOCK_N": 64, "BLOCK_K": 128, "num_warps": 4, "num_stages": 4, "time_ms": 32.7946891784668, "status": "ok"}
{"N": 262144, "K": 4096, "D": 128, "B": 32, "dtype": "fp16", "BLOCK_N": 64, "BLOCK_K": 128, "num_warps": 8, "num_stages": 1, "time_ms": 39.158878326416016, "status": "ok"}
{"N": 262144, "K": 4096, "D": 128, "B": 32, "dtype": "fp16", "BLOCK_N": 64, "BLOCK_K": 128, "num_warps": 8, "num_stages": 2, "time_ms": 33.45878219604492, "status": "ok"}
{"N": 262144, "K": 4096, "D": 128, "B": 32, "dtype": "fp16", "BLOCK_N": 64, "BLOCK_K": 128, "num_warps": 8, "num_stages": 4, "time_ms": 39.29091262817383, "status": "ok"}
{"N": 262144, "K": 4096, "D": 128, "B": 32, "dtype": "fp16", "BLOCK_N": 128, "BLOCK_K": 32, "num_warps": 4, "num_stages": 1, "time_ms": 28.160768508911133, "status": "ok"}
{"N": 262144, "K": 4096, "D": 128, "B": 32, "dtype": "fp16", "BLOCK_N": 128, "BLOCK_K": 32, "num_warps": 4, "num_stages": 2, "time_ms": 27.928447723388672, "status": "ok"}
{"N": 262144, "K": 4096, "D": 128, "B": 32, "dtype": "fp16", "BLOCK_N": 128, "BLOCK_K": 32, "num_warps": 4, "num_stages": 4, "time_ms": 29.66979217529297, "status": "ok"}
{"N": 262144, "K": 4096, "D": 128, "B": 32, "dtype": "fp16", "BLOCK_N": 128, "BLOCK_K": 32, "num_warps": 8, "num_stages": 1, "time_ms": 28.916799545288086, "status": "ok"}
{"N": 262144, "K": 4096, "D": 128, "B": 32, "dtype": "fp16", "BLOCK_N": 128, "BLOCK_K": 32, "num_warps": 8, "num_stages": 2, "time_ms": 28.105215072631836, "status": "ok"}
{"N": 262144, "K": 4096, "D": 128, "B": 32, "dtype": "fp16", "BLOCK_N": 128, "BLOCK_K": 32, "num_warps": 8, "num_stages": 4, "time_ms": 28.728832244873047, "status": "ok"}
{"N": 262144, "K": 4096, "D": 128, "B": 32, "dtype": "fp16", "BLOCK_N": 128, "BLOCK_K": 64, "num_warps": 4, "num_stages": 1, "time_ms": 25.107328414916992, "status": "ok"}
{"N": 262144, "K": 4096, "D": 128, "B": 32, "dtype": "fp16", "BLOCK_N": 128, "BLOCK_K": 64, "num_warps": 4, "num_stages": 2, "time_ms": 25.029888153076172, "status": "ok"}
{"N": 262144, "K": 4096, "D": 128, "B": 32, "dtype": "fp16", "BLOCK_N": 128, "BLOCK_K": 64, "num_warps": 4, "num_stages": 4, "time_ms": 25.13408088684082, "status": "ok"}
{"N": 262144, "K": 4096, "D": 128, "B": 32, "dtype": "fp16", "BLOCK_N": 128, "BLOCK_K": 64, "num_warps": 8, "num_stages": 1, "time_ms": 25.91904067993164, "status": "ok"}
{"N": 262144, "K": 4096, "D": 128, "B": 32, "dtype": "fp16", "BLOCK_N": 128, "BLOCK_K": 64, "num_warps": 8, "num_stages": 2, "time_ms": 25.32815933227539, "status": "ok"}
{"N": 262144, "K": 4096, "D": 128, "B": 32, "dtype": "fp16", "BLOCK_N": 128, "BLOCK_K": 64, "num_warps": 8, "num_stages": 4, "time_ms": 25.165536880493164, "status": "ok"}
{"N": 262144, "K": 4096, "D": 128, "B": 32, "dtype": "fp16", "BLOCK_N": 128, "BLOCK_K": 128, "num_warps": 4, "num_stages": 1, "time_ms": 24.968639373779297, "status": "ok"}
{"N": 262144, "K": 4096, "D": 128, "B": 32, "dtype": "fp16", "BLOCK_N": 128, "BLOCK_K": 128, "num_warps": 4, "num_stages": 2, "time_ms": 23.83977508544922, "status": "ok"}
{"N": 262144, "K": 4096, "D": 128, "B": 32, "dtype": "fp16", "BLOCK_N": 128, "BLOCK_K": 128, "num_warps": 4, "num_stages": 4, "time_ms": 28.29088020324707, "status": "ok"}
{"N": 262144, "K": 4096, "D": 128, "B": 32, "dtype": "fp16", "BLOCK_N": 128, "BLOCK_K": 128, "num_warps": 8, "num_stages": 1, "time_ms": 35.58505630493164, "status": "ok"}
{"N": 262144, "K": 4096, "D": 128, "B": 32, "dtype": "fp16", "BLOCK_N": 128, "BLOCK_K": 128, "num_warps": 8, "num_stages": 2, "time_ms": 23.676895141601562, "status": "ok"}
{"N": 262144, "K": 4096, "D": 128, "B": 32, "dtype": "fp16", "BLOCK_N": 128, "BLOCK_K": 128, "num_warps": 8, "num_stages": 4, "time_ms": 26.78803253173828, "status": "ok"}
{"summary": true, "N": 262144, "K": 4096, "D": 128, "B": 32, "dtype": "fp16", "best": {"N": 262144, "K": 4096, "D": 128, "B": 32, "dtype": "fp16", "BLOCK_N": 128, "BLOCK_K": 128, "num_warps": 8, "num_stages": 2, "time_ms": 23.676895141601562, "status": "ok"}, "best_time_ms": 23.676895141601562, "tuning_seconds": 30.304747104644775, "skipped": 0}
