grid_results/N65536_K200000_D64_B32_fp16.jsonl
{"N": 65536, "K": 200000, "D": 64, "B": 32, "dtype": "fp16", "BLOCK_N": 32, "BLOCK_K": 32, "num_warps": 4, "num_stages": 1, "time_ms": 660.431884765625, "status": "ok"}
{"N": 65536, "K": 200000, "D": 64, "B": 32, "dtype": "fp16", "BLOCK_N": 32, "BLOCK_K": 32, "num_warps": 4, "num_stages": 2, "time_ms": 581.4671020507812, "status": "ok"}
{"N": 65536, "K": 200000, "D": 64, "B": 32, "dtype": "fp16", "BLOCK_N": 32, "BLOCK_K": 32, "num_warps": 4, "num_stages": 4, "time_ms": 567.1474609375, "status": "ok"}
{"N": 65536, "K": 200000, "D": 64, "B": 32, "dtype": "fp16", "BLOCK_N": 32, "BLOCK_K": 32, "num_warps": 8, "num_stages": 1, "time_ms": 1050.7359619140625, "status": "ok"}
{"N": 65536, "K": 200000, "D": 64, "B": 32, "dtype": "fp16", "BLOCK_N": 32, "BLOCK_K": 32, "num_warps": 8, "num_stages": 2, "time_ms": 985.9046630859375, "status": "ok"}
{"N": 65536, "K": 200000, "D": 64, "B": 32, "dtype": "fp16", "BLOCK_N": 32, "BLOCK_K": 32, "num_warps": 8, "num_stages": 4, "time_ms": 978.6408081054688, "status": "ok"}
{"N": 65536, "K": 200000, "D": 64, "B": 32, "dtype": "fp16", "BLOCK_N": 32, "BLOCK_K": 64, "num_warps": 4, "num_stages": 1, "time_ms": 553.18896484375, "status": "ok"}
{"N": 65536, "K": 200000, "D": 64, "B": 32, "dtype": "fp16", "BLOCK_N": 32, "BLOCK_K": 64, "num_warps": 4, "num_stages": 2, "time_ms": 484.86083984375, "status": "ok"}
{"N": 65536, "K": 200000, "D": 64, "B": 32, "dtype": "fp16", "BLOCK_N": 32, "BLOCK_K": 64, "num_warps": 4, "num_stages": 4, "time_ms": 470.14544677734375, "status": "ok"}
{"N": 65536, "K": 200000, "D": 64, "B": 32, "dtype": "fp16", "BLOCK_N": 32, "BLOCK_K": 64, "num_warps": 8, "num_stages": 1, "time_ms": 722.0955810546875, "status": "ok"}
{"N": 65536, "K": 200000, "D": 64, "B": 32, "dtype": "fp16", "BLOCK_N": 32, "BLOCK_K": 64, "num_warps": 8, "num_stages": 2, "time_ms": 616.6533813476562, "status": "ok"}
{"N": 65536, "K": 200000, "D": 64, "B": 32, "dtype": "fp16", "BLOCK_N": 32, "BLOCK_K": 64, "num_warps": 8, "num_stages": 4, "time_ms": 598.4833984375, "status": "ok"}
{"N": 65536, "K": 200000, "D": 64, "B": 32, "dtype": "fp16", "BLOCK_N": 32, "BLOCK_K": 128, "num_warps": 4, "num_stages": 1, "time_ms": 470.98388671875, "status": "ok"}
{"N": 65536, "K": 200000, "D": 64, "B": 32, "dtype": "fp16", "BLOCK_N": 32, "BLOCK_K": 128, "num_warps": 4, "num_stages": 2, "time_ms": 402.71356201171875, "status": "ok"}
{"N": 65536, "K": 200000, "D": 64, "B": 32, "dtype": "fp16", "BLOCK_N": 32, "BLOCK_K": 128, "num_warps": 4, "num_stages": 4, "time_ms": 391.35479736328125, "status": "ok"}
{"N": 65536, "K": 200000, "D": 64, "B": 32, "dtype": "fp16", "BLOCK_N": 32, "BLOCK_K": 128, "num_warps": 8, "num_stages": 1, "time_ms": 664.2350463867188, "status": "ok"}
{"N": 65536, "K": 200000, "D": 64, "B": 32, "dtype": "fp16", "BLOCK_N": 32, "BLOCK_K": 128, "num_warps": 8, "num_stages": 2, "time_ms": 609.0323486328125, "status": "ok"}
{"N": 65536, "K": 200000, "D": 64, "B": 32, "dtype": "fp16", "BLOCK_N": 32, "BLOCK_K": 128, "num_warps": 8, "num_stages": 4, "time_ms": 567.8010864257812, "status": "ok"}
{"N": 65536, "K": 200000, "D": 64, "B": 32, "dtype": "fp16", "BLOCK_N": 64, "BLOCK_K": 32, "num_warps": 4, "num_stages": 1, "time_ms": 268.2558898925781, "status": "ok"}
{"N": 65536, "K": 200000, "D": 64, "B": 32, "dtype": "fp16", "BLOCK_N": 64, "BLOCK_K": 32, "num_warps": 4, "num_stages": 2, "time_ms": 254.53939819335938, "status": "ok"}
{"N": 65536, "K": 200000, "D": 64, "B": 32, "dtype": "fp16", "BLOCK_N": 64, "BLOCK_K": 32, "num_warps": 4, "num_stages": 4, "time_ms": 257.02032470703125, "status": "ok"}
{"N": 65536, "K": 200000, "D": 64, "B": 32, "dtype": "fp16", "BLOCK_N": 64, "BLOCK_K": 32, "num_warps": 8, "num_stages": 1, "time_ms": 526.5841064453125, "status": "ok"}
{"N": 65536, "K": 200000, "D": 64, "B": 32, "dtype": "fp16", "BLOCK_N": 64, "BLOCK_K": 32, "num_warps": 8, "num_stages": 2, "time_ms": 497.5401916503906, "status": "ok"}
{"N": 65536, "K": 200000, "D": 64, "B": 32, "dtype": "fp16", "BLOCK_N": 64, "BLOCK_K": 32, "num_warps": 8, "num_stages": 4, "time_ms": 484.0837707519531, "status": "ok"}
{"N": 65536, "K": 200000, "D": 64, "B": 32, "dtype": "fp16", "BLOCK_N": 64, "BLOCK_K": 64, "num_warps": 4, "num_stages": 1, "time_ms": 245.9871368408203, "status": "ok"}
{"N": 65536, "K": 200000, "D": 64, "B": 32, "dtype": "fp16", "BLOCK_N": 64, "BLOCK_K": 64, "num_warps": 4, "num_stages": 2, "time_ms": 228.87423706054688, "status": "ok"}
{"N": 65536, "K": 200000, "D": 64, "B": 32, "dtype": "fp16", "BLOCK_N": 64, "BLOCK_K": 64, "num_warps": 4, "num_stages": 4, "time_ms": 231.29200744628906, "status": "ok"}
{"N": 65536, "K": 200000, "D": 64, "B": 32, "dtype": "fp16", "BLOCK_N": 64, "BLOCK_K": 64, "num_warps": 8, "num_stages": 1, "time_ms": 371.6318359375, "status": "ok"}
{"N": 65536, "K": 200000, "D": 64, "B": 32, "dtype": "fp16", "BLOCK_N": 64, "BLOCK_K": 64, "num_warps": 8, "num_stages": 2, "time_ms": 361.4463806152344, "status": "ok"}
{"N": 65536, "K": 200000, "D": 64, "B": 32, "dtype": "fp16", "BLOCK_N": 64, "BLOCK_K": 64, "num_warps": 8, "num_stages": 4, "time_ms": 350.7806701660156, "status": "ok"}
{"N": 65536, "K": 200000, "D": 64, "B": 32, "dtype": "fp16", "BLOCK_N": 64, "BLOCK_K": 128, "num_warps": 4, "num_stages": 1, "time_ms": 261.8648986816406, "status": "ok"}
{"N": 65536, "K": 200000, "D": 64, "B": 32, "dtype": "fp16", "BLOCK_N": 64, "BLOCK_K": 128, "num_warps": 4, "num_stages": 2, "time_ms": 242.58901977539062, "status": "ok"}
{"N": 65536, "K": 200000, "D": 64, "B": 32, "dtype": "fp16", "BLOCK_N": 64, "BLOCK_K": 128, "num_warps": 4, "num_stages": 4, "time_ms": 241.76438903808594, "status": "ok"}
{"N": 65536, "K": 200000, "D": 64, "B": 32, "dtype": "fp16", "BLOCK_N": 64, "BLOCK_K": 128, "num_warps": 8, "num_stages": 1, "time_ms": 410.5255126953125, "status": "ok"}
{"N": 65536, "K": 200000, "D": 64, "B": 32, "dtype": "fp16", "BLOCK_N": 64, "BLOCK_K": 128, "num_warps": 8, "num_stages": 2, "time_ms": 378.9803771972656, "status": "ok"}
{"N": 65536, "K": 200000, "D": 64, "B": 32, "dtype": "fp16", "BLOCK_N": 64, "BLOCK_K": 128, "num_warps": 8, "num_stages": 4, "time_ms": 364.25933837890625, "status": "ok"}
{"N": 65536, "K": 200000, "D": 64, "B": 32, "dtype": "fp16", "BLOCK_N": 128, "BLOCK_K": 32, "num_warps": 4, "num_stages": 1, "time_ms": 254.60464477539062, "status": "ok"}
{"N": 65536, "K": 200000, "D": 64, "B": 32, "dtype": "fp16", "BLOCK_N": 128, "BLOCK_K": 32, "num_warps": 4, "num_stages": 2, "time_ms": 249.91036987304688, "status": "ok"}
{"N": 65536, "K": 200000, "D": 64, "B": 32, "dtype": "fp16", "BLOCK_N": 128, "BLOCK_K": 32, "num_warps": 4, "num_stages": 4, "time_ms": 251.179931640625, "status": "ok"}
{"N": 65536, "K": 200000, "D": 64, "B": 32, "dtype": "fp16", "BLOCK_N": 128, "BLOCK_K": 32, "num_warps": 8, "num_stages": 1, "time_ms": 268.63116455078125, "status": "ok"}
{"N": 65536, "K": 200000, "D": 64, "B": 32, "dtype": "fp16", "BLOCK_N": 128, "BLOCK_K": 32, "num_warps": 8, "num_stages": 2, "time_ms": 285.2370910644531, "status": "ok"}
{"N": 65536, "K": 200000, "D": 64, "B": 32, "dtype": "fp16", "BLOCK_N": 128, "BLOCK_K": 32, "num_warps": 8, "num_stages": 4, "time_ms": 275.82916259765625, "status": "ok"}
{"N": 65536, "K": 200000, "D": 64, "B": 32, "dtype": "fp16", "BLOCK_N": 128, "BLOCK_K": 64, "num_warps": 4, "num_stages": 1, "time_ms": 242.19068908691406, "status": "ok"}
{"N": 65536, "K": 200000, "D": 64, "B": 32, "dtype": "fp16", "BLOCK_N": 128, "BLOCK_K": 64, "num_warps": 4, "num_stages": 2, "time_ms": 226.11138916015625, "status": "ok"}
{"N": 65536, "K": 200000, "D": 64, "B": 32, "dtype": "fp16", "BLOCK_N": 128, "BLOCK_K": 64, "num_warps": 4, "num_stages": 4, "time_ms": 223.098876953125, "status": "ok"}
{"N": 65536, "K": 200000, "D": 64, "B": 32, "dtype": "fp16", "BLOCK_N": 128, "BLOCK_K": 64, "num_warps": 8, "num_stages": 1, "time_ms": 258.9038391113281, "status": "ok"}
{"N": 65536, "K": 200000, "D": 64, "B": 32, "dtype": "fp16", "BLOCK_N": 128, "BLOCK_K": 64, "num_warps": 8, "num_stages": 2, "time_ms": 245.6776580810547, "status": "ok"}
{"N": 65536, "K": 200000, "D": 64, "B": 32, "dtype": "fp16", "BLOCK_N": 128, "BLOCK_K": 64, "num_warps": 8, "num_stages": 4, "time_ms": 237.4119415283203, "status": "ok"}
{"N": 65536, "K": 200000, "D": 64, "B": 32, "dtype": "fp16", "BLOCK_N": 128, "BLOCK_K": 128, "num_warps": 4, "num_stages": 1, "time_ms": 263.38995361328125, "status": "ok"}
{"N": 65536, "K": 200000, "D": 64, "B": 32, "dtype": "fp16", "BLOCK_N": 128, "BLOCK_K": 128, "num_warps": 4, "num_stages": 2, "time_ms": 261.2985534667969, "status": "ok"}
{"N": 65536, "K": 200000, "D": 64, "B": 32, "dtype": "fp16", "BLOCK_N": 128, "BLOCK_K": 128, "num_warps": 4, "num_stages": 4, "time_ms": 241.374267578125, "status": "ok"}
{"N": 65536, "K": 200000, "D": 64, "B": 32, "dtype": "fp16", "BLOCK_N": 128, "BLOCK_K": 128, "num_warps": 8, "num_stages": 1, "time_ms": 406.81707763671875, "status": "ok"}
{"N": 65536, "K": 200000, "D": 64, "B": 32, "dtype": "fp16", "BLOCK_N": 128, "BLOCK_K": 128, "num_warps": 8, "num_stages": 2, "time_ms": 386.3715515136719, "status": "ok"}
{"N": 65536, "K": 200000, "D": 64, "B": 32, "dtype": "fp16", "BLOCK_N": 128, "BLOCK_K": 128, "num_warps": 8, "num_stages": 4, "time_ms": 329.5460510253906, "status": "ok"}
{"summary": true, "N": 65536, "K": 200000, "D": 64, "B": 32, "dtype": "fp16", "best": {"N": 65536, "K": 200000, "D": 64, "B": 32, "dtype": "fp16", "BLOCK_N": 128, "BLOCK_K": 64, "num_warps": 4, "num_stages": 4, "time_ms": 223.098876953125, "status": "ok"}, "best_time_ms": 223.098876953125, "tuning_seconds": 184.81705617904663, "skipped": 0}
