grid_results/N65536_K4096_D128_B1_fp16.jsonl
{"N": 65536, "K": 4096, "D": 128, "B": 1, "dtype": "fp16", "BLOCK_N": 32, "BLOCK_K": 32, "num_warps": 4, "num_stages": 1, "time_ms": 0.6865599950154623, "status": "ok"}
{"N": 65536, "K": 4096, "D": 128, "B": 1, "dtype": "fp16", "BLOCK_N": 32, "BLOCK_K": 32, "num_warps": 4, "num_stages": 2, "time_ms": 0.5695588333266122, "status": "ok"}
{"N": 65536, "K": 4096, "D": 128, "B": 1, "dtype": "fp16", "BLOCK_N": 32, "BLOCK_K": 32, "num_warps": 4, "num_stages": 4, "time_ms": 0.559748001396656, "status": "ok"}
{"N": 65536, "K": 4096, "D": 128, "B": 1, "dtype": "fp16", "BLOCK_N": 32, "BLOCK_K": 32, "num_warps": 8, "num_stages": 1, "time_ms": 1.036687970161438, "status": "ok"}
{"N": 65536, "K": 4096, "D": 128, "B": 1, "dtype": "fp16", "BLOCK_N": 32, "BLOCK_K": 32, "num_warps": 8, "num_stages": 2, "time_ms": 0.92499840259552, "status": "ok"}
{"N": 65536, "K": 4096, "D": 128, "B": 1, "dtype": "fp16", "BLOCK_N": 32, "BLOCK_K": 32, "num_warps": 8, "num_stages": 4, "time_ms": 0.8989376187324524, "status": "ok"}
{"N": 65536, "K": 4096, "D": 128, "B": 1, "dtype": "fp16", "BLOCK_N": 32, "BLOCK_K": 64, "num_warps": 4, "num_stages": 1, "time_ms": 0.5825737203870501, "status": "ok"}
{"N": 65536, "K": 4096, "D": 128, "B": 1, "dtype": "fp16", "BLOCK_N": 32, "BLOCK_K": 64, "num_warps": 4, "num_stages": 2, "time_ms": 0.46258488959736294, "status": "ok"}
{"N": 65536, "K": 4096, "D": 128, "B": 1, "dtype": "fp16", "BLOCK_N": 32, "BLOCK_K": 64, "num_warps": 4, "num_stages": 4, "time_ms": 0.5215280055999756, "status": "ok"}
{"N": 65536, "K": 4096, "D": 128, "B": 1, "dtype": "fp16", "BLOCK_N": 32, "BLOCK_K": 64, "num_warps": 8, "num_stages": 1, "time_ms": 0.6938666601975759, "status": "ok"}
{"N": 65536, "K": 4096, "D": 128, "B": 1, "dtype": "fp16", "BLOCK_N": 32, "BLOCK_K": 64, "num_warps": 8, "num_stages": 2, "time_ms": 0.5952320098876953, "status": "ok"}
{"N": 65536, "K": 4096, "D": 128, "B": 1, "dtype": "fp16", "BLOCK_N": 32, "BLOCK_K": 64, "num_warps": 8, "num_stages": 4, "time_ms": 0.5919954265866961, "status": "ok"}
{"N": 65536, "K": 4096, "D": 128, "B": 1, "dtype": "fp16", "BLOCK_N": 32, "BLOCK_K": 128, "num_warps": 4, "num_stages": 1, "time_ms": 0.4664142198032803, "status": "ok"}
{"N": 65536, "K": 4096, "D": 128, "B": 1, "dtype": "fp16", "BLOCK_N": 32, "BLOCK_K": 128, "num_warps": 4, "num_stages": 2, "time_ms": 0.3629090894352306, "status": "ok"}
{"N": 65536, "K": 4096, "D": 128, "B": 1, "dtype": "fp16", "BLOCK_N": 32, "BLOCK_K": 128, "num_warps": 4, "num_stages": 4, "time_ms": 0.45833244257503086, "status": "ok"}
{"N": 65536, "K": 4096, "D": 128, "B": 1, "dtype": "fp16", "BLOCK_N": 32, "BLOCK_K": 128, "num_warps": 8, "num_stages": 1, "time_ms": 0.6303771563938686, "status": "ok"}
{"N": 65536, "K": 4096, "D": 128, "B": 1, "dtype": "fp16", "BLOCK_N": 32, "BLOCK_K": 128, "num_warps": 8, "num_stages": 2, "time_ms": 0.5450799986720085, "status": "ok"}
{"N": 65536, "K": 4096, "D": 128, "B": 1, "dtype": "fp16", "BLOCK_N": 32, "BLOCK_K": 128, "num_warps": 8, "num_stages": 4, "time_ms": 0.5606171403612409, "status": "ok"}
{"N": 65536, "K": 4096, "D": 128, "B": 1, "dtype": "fp16", "BLOCK_N": 64, "BLOCK_K": 32, "num_warps": 4, "num_stages": 1, "time_ms": 0.28534400037356783, "status": "ok"}
{"N": 65536, "K": 4096, "D": 128, "B": 1, "dtype": "fp16", "BLOCK_N": 64, "BLOCK_K": 32, "num_warps": 4, "num_stages": 2, "time_ms": 0.2982276907333961, "status": "ok"}
{"N": 65536, "K": 4096, "D": 128, "B": 1, "dtype": "fp16", "BLOCK_N": 64, "BLOCK_K": 32, "num_warps": 4, "num_stages": 4, "time_ms": 0.2511146664619446, "status": "ok"}
{"N": 65536, "K": 4096, "D": 128, "B": 1, "dtype": "fp16", "BLOCK_N": 64, "BLOCK_K": 32, "num_warps": 8, "num_stages": 1, "time_ms": 0.505731999874115, "status": "ok"}
{"N": 65536, "K": 4096, "D": 128, "B": 1, "dtype": "fp16", "BLOCK_N": 64, "BLOCK_K": 32, "num_warps": 8, "num_stages": 2, "time_ms": 0.4516159991423289, "status": "ok"}
{"N": 65536, "K": 4096, "D": 128, "B": 1, "dtype": "fp16", "BLOCK_N": 64, "BLOCK_K": 32, "num_warps": 8, "num_stages": 4, "time_ms": 0.4450880057281918, "status": "ok"}
{"N": 65536, "K": 4096, "D": 128, "B": 1, "dtype": "fp16", "BLOCK_N": 64, "BLOCK_K": 64, "num_warps": 4, "num_stages": 1, "time_ms": 0.24568746685981752, "status": "ok"}
{"N": 65536, "K": 4096, "D": 128, "B": 1, "dtype": "fp16", "BLOCK_N": 64, "BLOCK_K": 64, "num_warps": 4, "num_stages": 2, "time_ms": 0.2257411769207786, "status": "ok"}
{"N": 65536, "K": 4096, "D": 128, "B": 1, "dtype": "fp16", "BLOCK_N": 64, "BLOCK_K": 64, "num_warps": 4, "num_stages": 4, "time_ms": 0.22558305719319513, "status": "ok"}
{"N": 65536, "K": 4096, "D": 128, "B": 1, "dtype": "fp16", "BLOCK_N": 64, "BLOCK_K": 64, "num_warps": 8, "num_stages": 1, "time_ms": 0.35880727388642053, "status": "ok"}
{"N": 65536, "K": 4096, "D": 128, "B": 1, "dtype": "fp16", "BLOCK_N": 64, "BLOCK_K": 64, "num_warps": 8, "num_stages": 2, "time_ms": 0.31871261963477504, "status": "ok"}
{"N": 65536, "K": 4096, "D": 128, "B": 1, "dtype": "fp16", "BLOCK_N": 64, "BLOCK_K": 64, "num_warps": 8, "num_stages": 4, "time_ms": 0.34959732989470166, "status": "ok"}
{"N": 65536, "K": 4096, "D": 128, "B": 1, "dtype": "fp16", "BLOCK_N": 64, "BLOCK_K": 128, "num_warps": 4, "num_stages": 1, "time_ms": 0.2145991101861, "status": "ok"}
{"N": 65536, "K": 4096, "D": 128, "B": 1, "dtype": "fp16", "BLOCK_N": 64, "BLOCK_K": 128, "num_warps": 4, "num_stages": 2, "time_ms": 0.21582682255436392, "status": "ok"}
{"N": 65536, "K": 4096, "D": 128, "B": 1, "dtype": "fp16", "BLOCK_N": 64, "BLOCK_K": 128, "num_warps": 4, "num_stages": 4, "time_ms": 0.28258971657071796, "status": "ok"}
{"N": 65536, "K": 4096, "D": 128, "B": 1, "dtype": "fp16", "BLOCK_N": 64, "BLOCK_K": 128, "num_warps": 8, "num_stages": 1, "time_ms": 0.3333839997649193, "status": "ok"}
{"N": 65536, "K": 4096, "D": 128, "B": 1, "dtype": "fp16", "BLOCK_N": 64, "BLOCK_K": 128, "num_warps": 8, "num_stages": 2, "time_ms": 0.2911634317466191, "status": "ok"}
{"N": 65536, "K": 4096, "D": 128, "B": 1, "dtype": "fp16", "BLOCK_N": 64, "BLOCK_K": 128, "num_warps": 8, "num_stages": 4, "time_ms": 0.33727466811736423, "status": "ok"}
{"N": 65536, "K": 4096, "D": 128, "B": 1, "dtype": "fp16", "BLOCK_N": 128, "BLOCK_K": 32, "num_warps": 4, "num_stages": 1, "time_ms": 0.25737386345863345, "status": "ok"}
{"N": 65536, "K": 4096, "D": 128, "B": 1, "dtype": "fp16", "BLOCK_N": 128, "BLOCK_K": 32, "num_warps": 4, "num_stages": 2, "time_ms": 0.26179413199424745, "status": "ok"}
{"N": 65536, "K": 4096, "D": 128, "B": 1, "dtype": "fp16", "BLOCK_N": 128, "BLOCK_K": 32, "num_warps": 4, "num_stages": 4, "time_ms": 0.26407679716746013, "status": "ok"}
{"N": 65536, "K": 4096, "D": 128, "B": 1, "dtype": "fp16", "BLOCK_N": 128, "BLOCK_K": 32, "num_warps": 8, "num_stages": 1, "time_ms": 0.2556928018728892, "status": "ok"}
{"N": 65536, "K": 4096, "D": 128, "B": 1, "dtype": "fp16", "BLOCK_N": 128, "BLOCK_K": 32, "num_warps": 8, "num_stages": 2, "time_ms": 0.25997013250986734, "status": "ok"}
{"N": 65536, "K": 4096, "D": 128, "B": 1, "dtype": "fp16", "BLOCK_N": 128, "BLOCK_K": 32, "num_warps": 8, "num_stages": 4, "time_ms": 0.26039040088653564, "status": "ok"}
{"N": 65536, "K": 4096, "D": 128, "B": 1, "dtype": "fp16", "BLOCK_N": 128, "BLOCK_K": 64, "num_warps": 4, "num_stages": 1, "time_ms": 0.22339576658080607, "status": "ok"}
{"N": 65536, "K": 4096, "D": 128, "B": 1, "dtype": "fp16", "BLOCK_N": 128, "BLOCK_K": 64, "num_warps": 4, "num_stages": 2, "time_ms": 0.22824282330625198, "status": "ok"}
{"N": 65536, "K": 4096, "D": 128, "B": 1, "dtype": "fp16", "BLOCK_N": 128, "BLOCK_K": 64, "num_warps": 4, "num_stages": 4, "time_ms": 0.21322164553053238, "status": "ok"}
{"N": 65536, "K": 4096, "D": 128, "B": 1, "dtype": "fp16", "BLOCK_N": 128, "BLOCK_K": 64, "num_warps": 8, "num_stages": 1, "time_ms": 0.2391140004619956, "status": "ok"}
{"N": 65536, "K": 4096, "D": 128, "B": 1, "dtype": "fp16", "BLOCK_N": 128, "BLOCK_K": 64, "num_warps": 8, "num_stages": 2, "time_ms": 0.2258199993520975, "status": "ok"}
{"N": 65536, "K": 4096, "D": 128, "B": 1, "dtype": "fp16", "BLOCK_N": 128, "BLOCK_K": 64, "num_warps": 8, "num_stages": 4, "time_ms": 0.21360376477241516, "status": "ok"}
{"N": 65536, "K": 4096, "D": 128, "B": 1, "dtype": "fp16", "BLOCK_N": 128, "BLOCK_K": 128, "num_warps": 4, "num_stages": 1, "time_ms": 0.2192075287594515, "status": "ok"}
{"N": 65536, "K": 4096, "D": 128, "B": 1, "dtype": "fp16", "BLOCK_N": 128, "BLOCK_K": 128, "num_warps": 4, "num_stages": 2, "time_ms": 0.21026844365729225, "status": "ok"}
{"N": 65536, "K": 4096, "D": 128, "B": 1, "dtype": "fp16", "BLOCK_N": 128, "BLOCK_K": 128, "num_warps": 4, "num_stages": 4, "time_ms": 0.2499925325314204, "status": "ok"}
{"N": 65536, "K": 4096, "D": 128, "B": 1, "dtype": "fp16", "BLOCK_N": 128, "BLOCK_K": 128, "num_warps": 8, "num_stages": 1, "time_ms": 0.32922933250665665, "status": "ok"}
{"N": 65536, "K": 4096, "D": 128, "B": 1, "dtype": "fp16", "BLOCK_N": 128, "BLOCK_K": 128, "num_warps": 8, "num_stages": 2, "time_ms": 0.2117244435681237, "status": "ok"}
{"N": 65536, "K": 4096, "D": 128, "B": 1, "dtype": "fp16", "BLOCK_N": 128, "BLOCK_K": 128, "num_warps": 8, "num_stages": 4, "time_ms": 0.24012800026685, "status": "ok"}
{"summary": true, "N": 65536, "K": 4096, "D": 128, "B": 1, "dtype": "fp16", "best": {"N": 65536, "K": 4096, "D": 128, "B": 1, "dtype": "fp16", "BLOCK_N": 128, "BLOCK_K": 128, "num_warps": 4, "num_stages": 2, "time_ms": 0.21026844365729225, "status": "ok"}, "best_time_ms": 0.21026844365729225, "tuning_seconds": 11.272372007369995, "skipped": 0}
