grid_results/N65536_K256_D128_B1_fp16.jsonl
{"N": 65536, "K": 256, "D": 128, "B": 1, "dtype": "fp16", "BLOCK_N": 32, "BLOCK_K": 32, "num_warps": 4, "num_stages": 1, "time_ms": 0.0507840005060037, "status": "ok"}
{"N": 65536, "K": 256, "D": 128, "B": 1, "dtype": "fp16", "BLOCK_N": 32, "BLOCK_K": 32, "num_warps": 4, "num_stages": 2, "time_ms": 0.04616417379482933, "status": "ok"}
{"N": 65536, "K": 256, "D": 128, "B": 1, "dtype": "fp16", "BLOCK_N": 32, "BLOCK_K": 32, "num_warps": 4, "num_stages": 4, "time_ms": 0.046421565601359245, "status": "ok"}
{"N": 65536, "K": 256, "D": 128, "B": 1, "dtype": "fp16", "BLOCK_N": 32, "BLOCK_K": 32, "num_warps": 8, "num_stages": 1, "time_ms": 0.0728717841006614, "status": "ok"}
{"N": 65536, "K": 256, "D": 128, "B": 1, "dtype": "fp16", "BLOCK_N": 32, "BLOCK_K": 32, "num_warps": 8, "num_stages": 2, "time_ms": 0.06853642079390977, "status": "ok"}
{"N": 65536, "K": 256, "D": 128, "B": 1, "dtype": "fp16", "BLOCK_N": 32, "BLOCK_K": 32, "num_warps": 8, "num_stages": 4, "time_ms": 0.06796378936422498, "status": "ok"}
{"N": 65536, "K": 256, "D": 128, "B": 1, "dtype": "fp16", "BLOCK_N": 32, "BLOCK_K": 64, "num_warps": 4, "num_stages": 1, "time_ms": 0.046154434590236, "status": "ok"}
{"N": 65536, "K": 256, "D": 128, "B": 1, "dtype": "fp16", "BLOCK_N": 32, "BLOCK_K": 64, "num_warps": 4, "num_stages": 2, "time_ms": 0.04009273496209359, "status": "ok"}
{"N": 65536, "K": 256, "D": 128, "B": 1, "dtype": "fp16", "BLOCK_N": 32, "BLOCK_K": 64, "num_warps": 4, "num_stages": 4, "time_ms": 0.04810269731421803, "status": "ok"}
{"N": 65536, "K": 256, "D": 128, "B": 1, "dtype": "fp16", "BLOCK_N": 32, "BLOCK_K": 64, "num_warps": 8, "num_stages": 1, "time_ms": 0.052117073226992675, "status": "ok"}
{"N": 65536, "K": 256, "D": 128, "B": 1, "dtype": "fp16", "BLOCK_N": 32, "BLOCK_K": 64, "num_warps": 8, "num_stages": 2, "time_ms": 0.05190556105680582, "status": "ok"}
{"N": 65536, "K": 256, "D": 128, "B": 1, "dtype": "fp16", "BLOCK_N": 32, "BLOCK_K": 64, "num_warps": 8, "num_stages": 4, "time_ms": 0.05084331715252341, "status": "ok"}
{"N": 65536, "K": 256, "D": 128, "B": 1, "dtype": "fp16", "BLOCK_N": 32, "BLOCK_K": 128, "num_warps": 4, "num_stages": 1, "time_ms": 0.037431148693282554, "status": "ok"}
{"N": 65536, "K": 256, "D": 128, "B": 1, "dtype": "fp16", "BLOCK_N": 32, "BLOCK_K": 128, "num_warps": 4, "num_stages": 2, "time_ms": 0.03508085083771259, "status": "ok"}
{"N": 65536, "K": 256, "D": 128, "B": 1, "dtype": "fp16", "BLOCK_N": 32, "BLOCK_K": 128, "num_warps": 4, "num_stages": 4, "time_ms": 0.050131047588019145, "status": "ok"}
{"N": 65536, "K": 256, "D": 128, "B": 1, "dtype": "fp16", "BLOCK_N": 32, "BLOCK_K": 128, "num_warps": 8, "num_stages": 1, "time_ms": 0.04844948831339215, "status": "ok"}
{"N": 65536, "K": 256, "D": 128, "B": 1, "dtype": "fp16", "BLOCK_N": 32, "BLOCK_K": 128, "num_warps": 8, "num_stages": 2, "time_ms": 0.04663709085434675, "status": "ok"}
{"N": 65536, "K": 256, "D": 128, "B": 1, "dtype": "fp16", "BLOCK_N": 32, "BLOCK_K": 128, "num_warps": 8, "num_stages": 4, "time_ms": 0.05477619498241239, "status": "ok"}
{"N": 65536, "K": 256, "D": 128, "B": 1, "dtype": "fp16", "BLOCK_N": 64, "BLOCK_K": 32, "num_warps": 4, "num_stages": 1, "time_ms": 0.028521599918603896, "status": "ok"}
{"N": 65536, "K": 256, "D": 128, "B": 1, "dtype": "fp16", "BLOCK_N": 64, "BLOCK_K": 32, "num_warps": 4, "num_stages": 2, "time_ms": 0.03029373586880711, "status": "ok"}
{"N": 65536, "K": 256, "D": 128, "B": 1, "dtype": "fp16", "BLOCK_N": 64, "BLOCK_K": 32, "num_warps": 4, "num_stages": 4, "time_ms": 0.026475428570328013, "status": "ok"}
{"N": 65536, "K": 256, "D": 128, "B": 1, "dtype": "fp16", "BLOCK_N": 64, "BLOCK_K": 32, "num_warps": 8, "num_stages": 1, "time_ms": 0.04058933351188898, "status": "ok"}
{"N": 65536, "K": 256, "D": 128, "B": 1, "dtype": "fp16", "BLOCK_N": 64, "BLOCK_K": 32, "num_warps": 8, "num_stages": 2, "time_ms": 0.03881404069917543, "status": "ok"}
{"N": 65536, "K": 256, "D": 128, "B": 1, "dtype": "fp16", "BLOCK_N": 64, "BLOCK_K": 32, "num_warps": 8, "num_stages": 4, "time_ms": 0.03856914300395518, "status": "ok"}
{"N": 65536, "K": 256, "D": 128, "B": 1, "dtype": "fp16", "BLOCK_N": 64, "BLOCK_K": 64, "num_warps": 4, "num_stages": 1, "time_ms": 0.027771169811768352, "status": "ok"}
{"N": 65536, "K": 256, "D": 128, "B": 1, "dtype": "fp16", "BLOCK_N": 64, "BLOCK_K": 64, "num_warps": 4, "num_stages": 2, "time_ms": 0.025445760004222395, "status": "ok"}
{"N": 65536, "K": 256, "D": 128, "B": 1, "dtype": "fp16", "BLOCK_N": 64, "BLOCK_K": 64, "num_warps": 4, "num_stages": 4, "time_ms": 0.02852266668981197, "status": "ok"}
{"N": 65536, "K": 256, "D": 128, "B": 1, "dtype": "fp16", "BLOCK_N": 64, "BLOCK_K": 64, "num_warps": 8, "num_stages": 1, "time_ms": 0.031143529559759534, "status": "ok"}
{"N": 65536, "K": 256, "D": 128, "B": 1, "dtype": "fp16", "BLOCK_N": 64, "BLOCK_K": 64, "num_warps": 8, "num_stages": 2, "time_ms": 0.03094892307686118, "status": "ok"}
{"N": 65536, "K": 256, "D": 128, "B": 1, "dtype": "fp16", "BLOCK_N": 64, "BLOCK_K": 64, "num_warps": 8, "num_stages": 4, "time_ms": 0.033529230823310524, "status": "ok"}
{"N": 65536, "K": 256, "D": 128, "B": 1, "dtype": "fp16", "BLOCK_N": 64, "BLOCK_K": 128, "num_warps": 4, "num_stages": 1, "time_ms": 0.02508628584577569, "status": "ok"}
{"N": 65536, "K": 256, "D": 128, "B": 1, "dtype": "fp16", "BLOCK_N": 64, "BLOCK_K": 128, "num_warps": 4, "num_stages": 2, "time_ms": 0.027051692362874746, "status": "ok"}
{"N": 65536, "K": 256, "D": 128, "B": 1, "dtype": "fp16", "BLOCK_N": 64, "BLOCK_K": 128, "num_warps": 4, "num_stages": 4, "time_ms": 0.03689407996833324, "status": "ok"}
{"N": 65536, "K": 256, "D": 128, "B": 1, "dtype": "fp16", "BLOCK_N": 64, "BLOCK_K": 128, "num_warps": 8, "num_stages": 1, "time_ms": 0.030238188697763208, "status": "ok"}
{"N": 65536, "K": 256, "D": 128, "B": 1, "dtype": "fp16", "BLOCK_N": 64, "BLOCK_K": 128, "num_warps": 8, "num_stages": 2, "time_ms": 0.030401207541800895, "status": "ok"}
{"N": 65536, "K": 256, "D": 128, "B": 1, "dtype": "fp16", "BLOCK_N": 64, "BLOCK_K": 128, "num_warps": 8, "num_stages": 4, "time_ms": 0.04047733327994744, "status": "ok"}
{"N": 65536, "K": 256, "D": 128, "B": 1, "dtype": "fp16", "BLOCK_N": 128, "BLOCK_K": 32, "num_warps": 4, "num_stages": 1, "time_ms": 0.027609962231989176, "status": "ok"}
{"N": 65536, "K": 256, "D": 128, "B": 1, "dtype": "fp16", "BLOCK_N": 128, "BLOCK_K": 32, "num_warps": 4, "num_stages": 2, "time_ms": 0.028269333415664732, "status": "ok"}
{"N": 65536, "K": 256, "D": 128, "B": 1, "dtype": "fp16", "BLOCK_N": 128, "BLOCK_K": 32, "num_warps": 4, "num_stages": 4, "time_ms": 0.027471384570862237, "status": "ok"}
{"N": 65536, "K": 256, "D": 128, "B": 1, "dtype": "fp16", "BLOCK_N": 128, "BLOCK_K": 32, "num_warps": 8, "num_stages": 1, "time_ms": 0.027277629477558313, "status": "ok"}
{"N": 65536, "K": 256, "D": 128, "B": 1, "dtype": "fp16", "BLOCK_N": 128, "BLOCK_K": 32, "num_warps": 8, "num_stages": 2, "time_ms": 0.02760785452344201, "status": "ok"}
{"N": 65536, "K": 256, "D": 128, "B": 1, "dtype": "fp16", "BLOCK_N": 128, "BLOCK_K": 32, "num_warps": 8, "num_stages": 4, "time_ms": 0.02703243629498915, "status": "ok"}
{"N": 65536, "K": 256, "D": 128, "B": 1, "dtype": "fp16", "BLOCK_N": 128, "BLOCK_K": 64, "num_warps": 4, "num_stages": 1, "time_ms": 0.025050666666141263, "status": "ok"}
{"N": 65536, "K": 256, "D": 128, "B": 1, "dtype": "fp16", "BLOCK_N": 128, "BLOCK_K": 64, "num_warps": 4, "num_stages": 2, "time_ms": 0.025283622608151077, "status": "ok"}
{"N": 65536, "K": 256, "D": 128, "B": 1, "dtype": "fp16", "BLOCK_N": 128, "BLOCK_K": 64, "num_warps": 4, "num_stages": 4, "time_ms": 0.02512430761439296, "status": "ok"}
{"N": 65536, "K": 256, "D": 128, "B": 1, "dtype": "fp16", "BLOCK_N": 128, "BLOCK_K": 64, "num_warps": 8, "num_stages": 1, "time_ms": 0.026461672715165398, "status": "ok"}
{"N": 65536, "K": 256, "D": 128, "B": 1, "dtype": "fp16", "BLOCK_N": 128, "BLOCK_K": 64, "num_warps": 8, "num_stages": 2, "time_ms": 0.0248051427770406, "status": "ok"}
{"N": 65536, "K": 256, "D": 128, "B": 1, "dtype": "fp16", "BLOCK_N": 128, "BLOCK_K": 64, "num_warps": 8, "num_stages": 4, "time_ms": 0.02428571430833212, "status": "ok"}
{"N": 65536, "K": 256, "D": 128, "B": 1, "dtype": "fp16", "BLOCK_N": 128, "BLOCK_K": 128, "num_warps": 4, "num_stages": 1, "time_ms": 0.025992452817143134, "status": "ok"}
{"N": 65536, "K": 256, "D": 128, "B": 1, "dtype": "fp16", "BLOCK_N": 128, "BLOCK_K": 128, "num_warps": 4, "num_stages": 2, "time_ms": 0.02449540752503607, "status": "ok"}
{"N": 65536, "K": 256, "D": 128, "B": 1, "dtype": "fp16", "BLOCK_N": 128, "BLOCK_K": 128, "num_warps": 4, "num_stages": 4, "time_ms": 0.031104640141129493, "status": "ok"}
{"N": 65536, "K": 256, "D": 128, "B": 1, "dtype": "fp16", "BLOCK_N": 128, "BLOCK_K": 128, "num_warps": 8, "num_stages": 1, "time_ms": 0.032778448976424276, "status": "ok"}
{"N": 65536, "K": 256, "D": 128, "B": 1, "dtype": "fp16", "BLOCK_N": 128, "BLOCK_K": 128, "num_warps": 8, "num_stages": 2, "time_ms": 0.03050215381125991, "status": "ok"}
{"N": 65536, "K": 256, "D": 128, "B": 1, "dtype": "fp16", "BLOCK_N": 128, "BLOCK_K": 128, "num_warps": 8, "num_stages": 4, "time_ms": 0.03015384626073333, "status": "ok"}
{"summary": true, "N": 65536, "K": 256, "D": 128, "B": 1, "dtype": "fp16", "best": {"N": 65536, "K": 256, "D": 128, "B": 1, "dtype": "fp16", "BLOCK_N": 128, "BLOCK_K": 64, "num_warps": 8, "num_stages": 4, "time_ms": 0.02428571430833212, "status": "ok"}, "best_time_ms": 0.02428571430833212, "tuning_seconds": 11.234763383865356, "skipped": 0}
