grid_results/N65536_K16384_D64_B32_fp16.jsonl
{"N": 65536, "K": 16384, "D": 64, "B": 32, "dtype": "fp16", "BLOCK_N": 32, "BLOCK_K": 32, "num_warps": 4, "num_stages": 1, "time_ms": 53.85148620605469, "status": "ok"}
{"N": 65536, "K": 16384, "D": 64, "B": 32, "dtype": "fp16", "BLOCK_N": 32, "BLOCK_K": 32, "num_warps": 4, "num_stages": 2, "time_ms": 47.436126708984375, "status": "ok"}
{"N": 65536, "K": 16384, "D": 64, "B": 32, "dtype": "fp16", "BLOCK_N": 32, "BLOCK_K": 32, "num_warps": 4, "num_stages": 4, "time_ms": 46.87651062011719, "status": "ok"}
{"N": 65536, "K": 16384, "D": 64, "B": 32, "dtype": "fp16", "BLOCK_N": 32, "BLOCK_K": 32, "num_warps": 8, "num_stages": 1, "time_ms": 86.38396453857422, "status": "ok"}
{"N": 65536, "K": 16384, "D": 64, "B": 32, "dtype": "fp16", "BLOCK_N": 32, "BLOCK_K": 32, "num_warps": 8, "num_stages": 2, "time_ms": 81.2396469116211, "status": "ok"}
{"N": 65536, "K": 16384, "D": 64, "B": 32, "dtype": "fp16", "BLOCK_N": 32, "BLOCK_K": 32, "num_warps": 8, "num_stages": 4, "time_ms": 80.06768035888672, "status": "ok"}
{"N": 65536, "K": 16384, "D": 64, "B": 32, "dtype": "fp16", "BLOCK_N": 32, "BLOCK_K": 64, "num_warps": 4, "num_stages": 1, "time_ms": 45.57990264892578, "status": "ok"}
{"N": 65536, "K": 16384, "D": 64, "B": 32, "dtype": "fp16", "BLOCK_N": 32, "BLOCK_K": 64, "num_warps": 4, "num_stages": 2, "time_ms": 40.30598449707031, "status": "ok"}
{"N": 65536, "K": 16384, "D": 64, "B": 32, "dtype": "fp16", "BLOCK_N": 32, "BLOCK_K": 64, "num_warps": 4, "num_stages": 4, "time_ms": 38.182273864746094, "status": "ok"}
{"N": 65536, "K": 16384, "D": 64, "B": 32, "dtype": "fp16", "BLOCK_N": 32, "BLOCK_K": 64, "num_warps": 8, "num_stages": 1, "time_ms": 56.00620651245117, "status": "ok"}
{"N": 65536, "K": 16384, "D": 64, "B": 32, "dtype": "fp16", "BLOCK_N": 32, "BLOCK_K": 64, "num_warps": 8, "num_stages": 2, "time_ms": 51.18134307861328, "status": "ok"}
{"N": 65536, "K": 16384, "D": 64, "B": 32, "dtype": "fp16", "BLOCK_N": 32, "BLOCK_K": 64, "num_warps": 8, "num_stages": 4, "time_ms": 50.29123306274414, "status": "ok"}
{"N": 65536, "K": 16384, "D": 64, "B": 32, "dtype": "fp16", "BLOCK_N": 32, "BLOCK_K": 128, "num_warps": 4, "num_stages": 1, "time_ms": 35.83718490600586, "status": "ok"}
{"N": 65536, "K": 16384, "D": 64, "B": 32, "dtype": "fp16", "BLOCK_N": 32, "BLOCK_K": 128, "num_warps": 4, "num_stages": 2, "time_ms": 30.425504684448242, "status": "ok"}
{"N": 65536, "K": 16384, "D": 64, "B": 32, "dtype": "fp16", "BLOCK_N": 32, "BLOCK_K": 128, "num_warps": 4, "num_stages": 4, "time_ms": 30.977664947509766, "status": "ok"}
{"N": 65536, "K": 16384, "D": 64, "B": 32, "dtype": "fp16", "BLOCK_N": 32, "BLOCK_K": 128, "num_warps": 8, "num_stages": 1, "time_ms": 58.384830474853516, "status": "ok"}
{"N": 65536, "K": 16384, "D": 64, "B": 32, "dtype": "fp16", "BLOCK_N": 32, "BLOCK_K": 128, "num_warps": 8, "num_stages": 2, "time_ms": 48.17647933959961, "status": "ok"}
{"N": 65536, "K": 16384, "D": 64, "B": 32, "dtype": "fp16", "BLOCK_N": 32, "BLOCK_K": 128, "num_warps": 8, "num_stages": 4, "time_ms": 46.331966400146484, "status": "ok"}
{"N": 65536, "K": 16384, "D": 64, "B": 32, "dtype": "fp16", "BLOCK_N": 64, "BLOCK_K": 32, "num_warps": 4, "num_stages": 1, "time_ms": 21.09676742553711, "status": "ok"}
{"N": 65536, "K": 16384, "D": 64, "B": 32, "dtype": "fp16", "BLOCK_N": 64, "BLOCK_K": 32, "num_warps": 4, "num_stages": 2, "time_ms": 20.7478084564209, "status": "ok"}
{"N": 65536, "K": 16384, "D": 64, "B": 32, "dtype": "fp16", "BLOCK_N": 64, "BLOCK_K": 32, "num_warps": 4, "num_stages": 4, "time_ms": 21.072927474975586, "status": "ok"}
{"N": 65536, "K": 16384, "D": 64, "B": 32, "dtype": "fp16", "BLOCK_N": 64, "BLOCK_K": 32, "num_warps": 8, "num_stages": 1, "time_ms": 43.342689514160156, "status": "ok"}
{"N": 65536, "K": 16384, "D": 64, "B": 32, "dtype": "fp16", "BLOCK_N": 64, "BLOCK_K": 32, "num_warps": 8, "num_stages": 2, "time_ms": 39.897281646728516, "status": "ok"}
{"N": 65536, "K": 16384, "D": 64, "B": 32, "dtype": "fp16", "BLOCK_N": 64, "BLOCK_K": 32, "num_warps": 8, "num_stages": 4, "time_ms": 39.124481201171875, "status": "ok"}
{"N": 65536, "K": 16384, "D": 64, "B": 32, "dtype": "fp16", "BLOCK_N": 64, "BLOCK_K": 64, "num_warps": 4, "num_stages": 1, "time_ms": 20.089248657226562, "status": "ok"}
{"N": 65536, "K": 16384, "D": 64, "B": 32, "dtype": "fp16", "BLOCK_N": 64, "BLOCK_K": 64, "num_warps": 4, "num_stages": 2, "time_ms": 18.783231735229492, "status": "ok"}
{"N": 65536, "K": 16384, "D": 64, "B": 32, "dtype": "fp16", "BLOCK_N": 64, "BLOCK_K": 64, "num_warps": 4, "num_stages": 4, "time_ms": 19.007871627807617, "status": "ok"}
{"N": 65536, "K": 16384, "D": 64, "B": 32, "dtype": "fp16", "BLOCK_N": 64, "BLOCK_K": 64, "num_warps": 8, "num_stages": 1, "time_ms": 30.735776901245117, "status": "ok"}
{"N": 65536, "K": 16384, "D": 64, "B": 32, "dtype": "fp16", "BLOCK_N": 64, "BLOCK_K": 64, "num_warps": 8, "num_stages": 2, "time_ms": 29.09644889831543, "status": "ok"}
{"N": 65536, "K": 16384, "D": 64, "B": 32, "dtype": "fp16", "BLOCK_N": 64, "BLOCK_K": 64, "num_warps": 8, "num_stages": 4, "time_ms": 28.47862434387207, "status": "ok"}
{"N": 65536, "K": 16384, "D": 64, "B": 32, "dtype": "fp16", "BLOCK_N": 64, "BLOCK_K": 128, "num_warps": 4, "num_stages": 1, "time_ms": 18.4932804107666, "status": "ok"}
{"N": 65536, "K": 16384, "D": 64, "B": 32, "dtype": "fp16", "BLOCK_N": 64, "BLOCK_K": 128, "num_warps": 4, "num_stages": 2, "time_ms": 18.1079044342041, "status": "ok"}
{"N": 65536, "K": 16384, "D": 64, "B": 32, "dtype": "fp16", "BLOCK_N": 64, "BLOCK_K": 128, "num_warps": 4, "num_stages": 4, "time_ms": 18.07753562927246, "status": "ok"}
{"N": 65536, "K": 16384, "D": 64, "B": 32, "dtype": "fp16", "BLOCK_N": 64, "BLOCK_K": 128, "num_warps": 8, "num_stages": 1, "time_ms": 31.1628475189209, "status": "ok"}
{"N": 65536, "K": 16384, "D": 64, "B": 32, "dtype": "fp16", "BLOCK_N": 64, "BLOCK_K": 128, "num_warps": 8, "num_stages": 2, "time_ms": 27.097631454467773, "status": "ok"}
{"N": 65536, "K": 16384, "D": 64, "B": 32, "dtype": "fp16", "BLOCK_N": 64, "BLOCK_K": 128, "num_warps": 8, "num_stages": 4, "time_ms": 25.537248611450195, "status": "ok"}
{"N": 65536, "K": 16384, "D": 64, "B": 32, "dtype": "fp16", "BLOCK_N": 128, "BLOCK_K": 32, "num_warps": 4, "num_stages": 1, "time_ms": 20.988447189331055, "status": "ok"}
{"N": 65536, "K": 16384, "D": 64, "B": 32, "dtype": "fp16", "BLOCK_N": 128, "BLOCK_K": 32, "num_warps": 4, "num_stages": 2, "time_ms": 20.41983985900879, "status": "ok"}
{"N": 65536, "K": 16384, "D": 64, "B": 32, "dtype": "fp16", "BLOCK_N": 128, "BLOCK_K": 32, "num_warps": 4, "num_stages": 4, "time_ms": 20.790464401245117, "status": "ok"}
{"N": 65536, "K": 16384, "D": 64, "B": 32, "dtype": "fp16", "BLOCK_N": 128, "BLOCK_K": 32, "num_warps": 8, "num_stages": 1, "time_ms": 22.026559829711914, "status": "ok"}
{"N": 65536, "K": 16384, "D": 64, "B": 32, "dtype": "fp16", "BLOCK_N": 128, "BLOCK_K": 32, "num_warps": 8, "num_stages": 2, "time_ms": 22.8907527923584, "status": "ok"}
{"N": 65536, "K": 16384, "D": 64, "B": 32, "dtype": "fp16", "BLOCK_N": 128, "BLOCK_K": 32, "num_warps": 8, "num_stages": 4, "time_ms": 22.432191848754883, "status": "ok"}
{"N": 65536, "K": 16384, "D": 64, "B": 32, "dtype": "fp16", "BLOCK_N": 128, "BLOCK_K": 64, "num_warps": 4, "num_stages": 1, "time_ms": 19.989887237548828, "status": "ok"}
{"N": 65536, "K": 16384, "D": 64, "B": 32, "dtype": "fp16", "BLOCK_N": 128, "BLOCK_K": 64, "num_warps": 4, "num_stages": 2, "time_ms": 18.353759765625, "status": "ok"}
{"N": 65536, "K": 16384, "D": 64, "B": 32, "dtype": "fp16", "BLOCK_N": 128, "BLOCK_K": 64, "num_warps": 4, "num_stages": 4, "time_ms": 18.417728424072266, "status": "ok"}
{"N": 65536, "K": 16384, "D": 64, "B": 32, "dtype": "fp16", "BLOCK_N": 128, "BLOCK_K": 64, "num_warps": 8, "num_stages": 1, "time_ms": 20.717632293701172, "status": "ok"}
{"N": 65536, "K": 16384, "D": 64, "B": 32, "dtype": "fp16", "BLOCK_N": 128, "BLOCK_K": 64, "num_warps": 8, "num_stages": 2, "time_ms": 19.815391540527344, "status": "ok"}
{"N": 65536, "K": 16384, "D": 64, "B": 32, "dtype": "fp16", "BLOCK_N": 128, "BLOCK_K": 64, "num_warps": 8, "num_stages": 4, "time_ms": 19.64543914794922, "status": "ok"}
{"N": 65536, "K": 16384, "D": 64, "B": 32, "dtype": "fp16", "BLOCK_N": 128, "BLOCK_K": 128, "num_warps": 4, "num_stages": 1, "time_ms": 21.415679931640625, "status": "ok"}
{"N": 65536, "K": 16384, "D": 64, "B": 32, "dtype": "fp16", "BLOCK_N": 128, "BLOCK_K": 128, "num_warps": 4, "num_stages": 2, "time_ms": 19.858911514282227, "status": "ok"}
{"N": 65536, "K": 16384, "D": 64, "B": 32, "dtype": "fp16", "BLOCK_N": 128, "BLOCK_K": 128, "num_warps": 4, "num_stages": 4, "time_ms": 17.911296844482422, "status": "ok"}
{"N": 65536, "K": 16384, "D": 64, "B": 32, "dtype": "fp16", "BLOCK_N": 128, "BLOCK_K": 128, "num_warps": 8, "num_stages": 1, "time_ms": 27.972543716430664, "status": "ok"}
{"N": 65536, "K": 16384, "D": 64, "B": 32, "dtype": "fp16", "BLOCK_N": 128, "BLOCK_K": 128, "num_warps": 8, "num_stages": 2, "time_ms": 19.2192325592041, "status": "ok"}
{"N": 65536, "K": 16384, "D": 64, "B": 32, "dtype": "fp16", "BLOCK_N": 128, "BLOCK_K": 128, "num_warps": 8, "num_stages": 4, "time_ms": 18.62201690673828, "status": "ok"}
{"summary": true, "N": 65536, "K": 16384, "D": 64, "B": 32, "dtype": "fp16", "best": {"N": 65536, "K": 16384, "D": 64, "B": 32, "dtype": "fp16", "BLOCK_N": 128, "BLOCK_K": 128, "num_warps": 4, "num_stages": 4, "time_ms": 17.911296844482422, "status": "ok"}, "best_time_ms": 17.911296844482422, "tuning_seconds": 23.220016717910767, "skipped": 0}
