grid_results/N65536_K4096_D128_B32_fp16.jsonl
{"N": 65536, "K": 4096, "D": 128, "B": 32, "dtype": "fp16", "BLOCK_N": 32, "BLOCK_K": 32, "num_warps": 4, "num_stages": 1, "time_ms": 20.596160888671875, "status": "ok"}
{"N": 65536, "K": 4096, "D": 128, "B": 32, "dtype": "fp16", "BLOCK_N": 32, "BLOCK_K": 32, "num_warps": 4, "num_stages": 2, "time_ms": 16.80860710144043, "status": "ok"}
{"N": 65536, "K": 4096, "D": 128, "B": 32, "dtype": "fp16", "BLOCK_N": 32, "BLOCK_K": 32, "num_warps": 4, "num_stages": 4, "time_ms": 16.844064712524414, "status": "ok"}
{"N": 65536, "K": 4096, "D": 128, "B": 32, "dtype": "fp16", "BLOCK_N": 32, "BLOCK_K": 32, "num_warps": 8, "num_stages": 1, "time_ms": 30.44585609436035, "status": "ok"}
{"N": 65536, "K": 4096, "D": 128, "B": 32, "dtype": "fp16", "BLOCK_N": 32, "BLOCK_K": 32, "num_warps": 8, "num_stages": 2, "time_ms": 27.72777557373047, "status": "ok"}
{"N": 65536, "K": 4096, "D": 128, "B": 32, "dtype": "fp16", "BLOCK_N": 32, "BLOCK_K": 32, "num_warps": 8, "num_stages": 4, "time_ms": 27.369855880737305, "status": "ok"}
{"N": 65536, "K": 4096, "D": 128, "B": 32, "dtype": "fp16", "BLOCK_N": 32, "BLOCK_K": 64, "num_warps": 4, "num_stages": 1, "time_ms": 17.510112762451172, "status": "ok"}
{"N": 65536, "K": 4096, "D": 128, "B": 32, "dtype": "fp16", "BLOCK_N": 32, "BLOCK_K": 64, "num_warps": 4, "num_stages": 2, "time_ms": 13.644767761230469, "status": "ok"}
{"N": 65536, "K": 4096, "D": 128, "B": 32, "dtype": "fp16", "BLOCK_N": 32, "BLOCK_K": 64, "num_warps": 4, "num_stages": 4, "time_ms": 14.751615524291992, "status": "ok"}
{"N": 65536, "K": 4096, "D": 128, "B": 32, "dtype": "fp16", "BLOCK_N": 32, "BLOCK_K": 64, "num_warps": 8, "num_stages": 1, "time_ms": 20.895904541015625, "status": "ok"}
{"N": 65536, "K": 4096, "D": 128, "B": 32, "dtype": "fp16", "BLOCK_N": 32, "BLOCK_K": 64, "num_warps": 8, "num_stages": 2, "time_ms": 17.927263259887695, "status": "ok"}
{"N": 65536, "K": 4096, "D": 128, "B": 32, "dtype": "fp16", "BLOCK_N": 32, "BLOCK_K": 64, "num_warps": 8, "num_stages": 4, "time_ms": 17.95916748046875, "status": "ok"}
{"N": 65536, "K": 4096, "D": 128, "B": 32, "dtype": "fp16", "BLOCK_N": 32, "BLOCK_K": 128, "num_warps": 4, "num_stages": 1, "time_ms": 13.970399856567383, "status": "ok"}
{"N": 65536, "K": 4096, "D": 128, "B": 32, "dtype": "fp16", "BLOCK_N": 32, "BLOCK_K": 128, "num_warps": 4, "num_stages": 2, "time_ms": 10.773056030273438, "status": "ok"}
{"N": 65536, "K": 4096, "D": 128, "B": 32, "dtype": "fp16", "BLOCK_N": 32, "BLOCK_K": 128, "num_warps": 4, "num_stages": 4, "time_ms": 13.921855926513672, "status": "ok"}
{"N": 65536, "K": 4096, "D": 128, "B": 32, "dtype": "fp16", "BLOCK_N": 32, "BLOCK_K": 128, "num_warps": 8, "num_stages": 1, "time_ms": 19.174560546875, "status": "ok"}
{"N": 65536, "K": 4096, "D": 128, "B": 32, "dtype": "fp16", "BLOCK_N": 32, "BLOCK_K": 128, "num_warps": 8, "num_stages": 2, "time_ms": 16.431743621826172, "status": "ok"}
{"N": 65536, "K": 4096, "D": 128, "B": 32, "dtype": "fp16", "BLOCK_N": 32, "BLOCK_K": 128, "num_warps": 8, "num_stages": 4, "time_ms": 17.055007934570312, "status": "ok"}
{"N": 65536, "K": 4096, "D": 128, "B": 32, "dtype": "fp16", "BLOCK_N": 64, "BLOCK_K": 32, "num_warps": 4, "num_stages": 1, "time_ms": 8.103008270263672, "status": "ok"}
{"N": 65536, "K": 4096, "D": 128, "B": 32, "dtype": "fp16", "BLOCK_N": 64, "BLOCK_K": 32, "num_warps": 4, "num_stages": 2, "time_ms": 6.781472206115723, "status": "ok"}
{"N": 65536, "K": 4096, "D": 128, "B": 32, "dtype": "fp16", "BLOCK_N": 64, "BLOCK_K": 32, "num_warps": 4, "num_stages": 4, "time_ms": 7.261472225189209, "status": "ok"}
{"N": 65536, "K": 4096, "D": 128, "B": 32, "dtype": "fp16", "BLOCK_N": 64, "BLOCK_K": 32, "num_warps": 8, "num_stages": 1, "time_ms": 15.110143661499023, "status": "ok"}
{"N": 65536, "K": 4096, "D": 128, "B": 32, "dtype": "fp16", "BLOCK_N": 64, "BLOCK_K": 32, "num_warps": 8, "num_stages": 2, "time_ms": 13.009119987487793, "status": "ok"}
{"N": 65536, "K": 4096, "D": 128, "B": 32, "dtype": "fp16", "BLOCK_N": 64, "BLOCK_K": 32, "num_warps": 8, "num_stages": 4, "time_ms": 13.124704360961914, "status": "ok"}
{"N": 65536, "K": 4096, "D": 128, "B": 32, "dtype": "fp16", "BLOCK_N": 64, "BLOCK_K": 64, "num_warps": 4, "num_stages": 1, "time_ms": 6.626848220825195, "status": "ok"}
{"N": 65536, "K": 4096, "D": 128, "B": 32, "dtype": "fp16", "BLOCK_N": 64, "BLOCK_K": 64, "num_warps": 4, "num_stages": 2, "time_ms": 6.089632034301758, "status": "ok"}
{"N": 65536, "K": 4096, "D": 128, "B": 32, "dtype": "fp16", "BLOCK_N": 64, "BLOCK_K": 64, "num_warps": 4, "num_stages": 4, "time_ms": 6.489344120025635, "status": "ok"}
{"N": 65536, "K": 4096, "D": 128, "B": 32, "dtype": "fp16", "BLOCK_N": 64, "BLOCK_K": 64, "num_warps": 8, "num_stages": 1, "time_ms": 10.512031555175781, "status": "ok"}
{"N": 65536, "K": 4096, "D": 128, "B": 32, "dtype": "fp16", "BLOCK_N": 64, "BLOCK_K": 64, "num_warps": 8, "num_stages": 2, "time_ms": 9.094847679138184, "status": "ok"}
{"N": 65536, "K": 4096, "D": 128, "B": 32, "dtype": "fp16", "BLOCK_N": 64, "BLOCK_K": 64, "num_warps": 8, "num_stages": 4, "time_ms": 10.418784141540527, "status": "ok"}
{"N": 65536, "K": 4096, "D": 128, "B": 32, "dtype": "fp16", "BLOCK_N": 64, "BLOCK_K": 128, "num_warps": 4, "num_stages": 1, "time_ms": 6.4146881103515625, "status": "ok"}
{"N": 65536, "K": 4096, "D": 128, "B": 32, "dtype": "fp16", "BLOCK_N": 64, "BLOCK_K": 128, "num_warps": 4, "num_stages": 2, "time_ms": 6.108960151672363, "status": "ok"}
{"N": 65536, "K": 4096, "D": 128, "B": 32, "dtype": "fp16", "BLOCK_N": 64, "BLOCK_K": 128, "num_warps": 4, "num_stages": 4, "time_ms": 8.285887718200684, "status": "ok"}
{"N": 65536, "K": 4096, "D": 128, "B": 32, "dtype": "fp16", "BLOCK_N": 64, "BLOCK_K": 128, "num_warps": 8, "num_stages": 1, "time_ms": 9.898528099060059, "status": "ok"}
{"N": 65536, "K": 4096, "D": 128, "B": 32, "dtype": "fp16", "BLOCK_N": 64, "BLOCK_K": 128, "num_warps": 8, "num_stages": 2, "time_ms": 8.452320098876953, "status": "ok"}
{"N": 65536, "K": 4096, "D": 128, "B": 32, "dtype": "fp16", "BLOCK_N": 64, "BLOCK_K": 128, "num_warps": 8, "num_stages": 4, "time_ms": 9.938752174377441, "status": "ok"}
{"N": 65536, "K": 4096, "D": 128, "B": 32, "dtype": "fp16", "BLOCK_N": 128, "BLOCK_K": 32, "num_warps": 4, "num_stages": 1, "time_ms": 6.915616035461426, "status": "ok"}
{"N": 65536, "K": 4096, "D": 128, "B": 32, "dtype": "fp16", "BLOCK_N": 128, "BLOCK_K": 32, "num_warps": 4, "num_stages": 2, "time_ms": 7.026944160461426, "status": "ok"}
{"N": 65536, "K": 4096, "D": 128, "B": 32, "dtype": "fp16", "BLOCK_N": 128, "BLOCK_K": 32, "num_warps": 4, "num_stages": 4, "time_ms": 7.509471893310547, "status": "ok"}
{"N": 65536, "K": 4096, "D": 128, "B": 32, "dtype": "fp16", "BLOCK_N": 128, "BLOCK_K": 32, "num_warps": 8, "num_stages": 1, "time_ms": 7.221024036407471, "status": "ok"}
{"N": 65536, "K": 4096, "D": 128, "B": 32, "dtype": "fp16", "BLOCK_N": 128, "BLOCK_K": 32, "num_warps": 8, "num_stages": 2, "time_ms": 7.036831855773926, "status": "ok"}
{"N": 65536, "K": 4096, "D": 128, "B": 32, "dtype": "fp16", "BLOCK_N": 128, "BLOCK_K": 32, "num_warps": 8, "num_stages": 4, "time_ms": 7.28329610824585, "status": "ok"}
{"N": 65536, "K": 4096, "D": 128, "B": 32, "dtype": "fp16", "BLOCK_N": 128, "BLOCK_K": 64, "num_warps": 4, "num_stages": 1, "time_ms": 5.9962239265441895, "status": "ok"}
{"N": 65536, "K": 4096, "D": 128, "B": 32, "dtype": "fp16", "BLOCK_N": 128, "BLOCK_K": 64, "num_warps": 4, "num_stages": 2, "time_ms": 6.147456169128418, "status": "ok"}
{"N": 65536, "K": 4096, "D": 128, "B": 32, "dtype": "fp16", "BLOCK_N": 128, "BLOCK_K": 64, "num_warps": 4, "num_stages": 4, "time_ms": 6.107423782348633, "status": "ok"}
{"N": 65536, "K": 4096, "D": 128, "B": 32, "dtype": "fp16", "BLOCK_N": 128, "BLOCK_K": 64, "num_warps": 8, "num_stages": 1, "time_ms": 6.304768085479736, "status": "ok"}
{"N": 65536, "K": 4096, "D": 128, "B": 32, "dtype": "fp16", "BLOCK_N": 128, "BLOCK_K": 64, "num_warps": 8, "num_stages": 2, "time_ms": 6.261343955993652, "status": "ok"}
{"N": 65536, "K": 4096, "D": 128, "B": 32, "dtype": "fp16", "BLOCK_N": 128, "BLOCK_K": 64, "num_warps": 8, "num_stages": 4, "time_ms": 6.173183917999268, "status": "ok"}
{"N": 65536, "K": 4096, "D": 128, "B": 32, "dtype": "fp16", "BLOCK_N": 128, "BLOCK_K": 128, "num_warps": 4, "num_stages": 1, "time_ms": 6.124032020568848, "status": "ok"}
{"N": 65536, "K": 4096, "D": 128, "B": 32, "dtype": "fp16", "BLOCK_N": 128, "BLOCK_K": 128, "num_warps": 4, "num_stages": 2, "time_ms": 5.854144096374512, "status": "ok"}
{"N": 65536, "K": 4096, "D": 128, "B": 32, "dtype": "fp16", "BLOCK_N": 128, "BLOCK_K": 128, "num_warps": 4, "num_stages": 4, "time_ms": 7.165279865264893, "status": "ok"}
{"N": 65536, "K": 4096, "D": 128, "B": 32, "dtype": "fp16", "BLOCK_N": 128, "BLOCK_K": 128, "num_warps": 8, "num_stages": 1, "time_ms": 9.017279624938965, "status": "ok"}
{"N": 65536, "K": 4096, "D": 128, "B": 32, "dtype": "fp16", "BLOCK_N": 128, "BLOCK_K": 128, "num_warps": 8, "num_stages": 2, "time_ms": 5.669792175292969, "status": "ok"}
{"N": 65536, "K": 4096, "D": 128, "B": 32, "dtype": "fp16", "BLOCK_N": 128, "BLOCK_K": 128, "num_warps": 8, "num_stages": 4, "time_ms": 6.849887847900391, "status": "ok"}
{"summary": true, "N": 65536, "K": 4096, "D": 128, "B": 32, "dtype": "fp16", "best": {"N": 65536, "K": 4096, "D": 128, "B": 32, "dtype": "fp16", "BLOCK_N": 128, "BLOCK_K": 128, "num_warps": 8, "num_stages": 2, "time_ms": 5.669792175292969, "status": "ok"}, "best_time_ms": 5.669792175292969, "tuning_seconds": 15.572216510772705, "skipped": 0}
